author,title,description,url,urlToImage,publishedAt,content,source.id,source.name
By Trita Parsi and Adam N. Weinstein,Why Are American Troops Still in Iraq?,"The U.S. withdrew its forces from Afghanistan last year. This year, it should withdraw its forces from Iraq. ",https://www.nytimes.com/2022/02/10/opinion/biden-iraq-military.html,https://static01.nyt.com/images/2022/02/11/opinion/09Parsi-Weinstein/merlin_180140466_80bd3d3b-f6fb-4abb-828a-d0b9fd5a296d-articleLarge.jpg,2022-02-10T21:21:24+0000,"U.S. troops in Iraq quietly thwarted two separate drone attacks on bases hosting American soldiers in the first week of 2022. The attacks, attributed to Iraqi Shiite militias, are no surprise: America’s presence in Iraq is increasingly unwelcome. More attacks are bound to come as long as the Biden administration decides to keep forces there. With each passing day, the risk of a deadly attack increases.",the-new-york-times,The New York Times
By Juliet Macur,"For Brendan Kerry, skating runs in the family.","His mother, Monica MacDonald, and her partner Rodney Clarke were the first ice dancers to compete for Australia at the Olympics.",https://www.nytimes.com/2022/02/09/sports/olympics/brendan-kerry-figure-skating.html,https://static01.nyt.com/images/2022/02/09/sports/olympics/figure-skating-beijing-olympics-977/figure-skating-beijing-olympics-977-articleLarge.jpg,2022-02-10T02:56:33+0000,"How long has 27-year-old Brendan Kerry been around in the sport of figure skating? Long enough to be an eight-time national champion in Australia, winning his first title a decade ago. (When Nathan Chen was 12.)",the-new-york-times,The New York Times
By Christina Morales,Opening a Restaurant in Miami? Invoking Cuban Communism Might Backfire.,"The restaurant, Café Habana, is scheduled to open in the spring. But it’s already leaving a bitter taste for many Miami-Dade County residents.",https://www.nytimes.com/2022/02/10/dining/cafe-habana-miami-castro-guevara.html,https://static01.nyt.com/images/2022/02/10/dining/10Habana/merlin_201730689_489ba635-d8de-4306-8a5f-abe6547f69e0-articleLarge.jpg,2022-02-10T23:19:33+0000,MIAMI — A Manhattan restaurant planning an expansion to Miami has drawn the ire of some Cuban Americans after its use of Communist lore was pointed out on social media.,the-new-york-times,The New York Times
By Manohla Dargis,‘Playground’ Review: A Creation Story,"In this stunning Belgian drama, a little girl and her brother go to school, read, write, fight and learn some brutal lessons about life.",https://www.nytimes.com/2022/02/10/movies/playground-review.html,https://static01.nyt.com/images/2022/02/11/arts/10playground-1/merlin_201361182_cc4b7f0f-fe5e-4716-920f-241efdda24d8-articleLarge.jpg,2022-02-10T19:13:24+0000,"In a perfect hour and 12 minutes, “Playground” tells the sweeping, intimate story of a child’s coming into consciousness. Set almost entirely within the confines of an elementary school and its grounds, it takes place in an unidentified Belgian neighborhood at an institution that’s as colorless, generic and unwelcoming as any educational sausage factory. There, girls and boys are turned into students, playmates, friends, adversaries, future citizens and dutiful workers. They study and obey but sometimes they also resist.",the-new-york-times,The New York Times
"By Andrew Ross Sorkin, Jason Karaian, Sarah Kessler, Stephen Gandel, Michael J. de la Merced, Lauren Hirsch and Ephrat Livni",Who Benefits From Higher Prices?,"Wages are growing fast, but prices are rising even faster.",https://www.nytimes.com/2022/02/10/business/dealbook/inflation-pay-prices.html,https://static01.nyt.com/images/2022/02/10/multimedia/10db-newsletter-inflationpay/10db-newsletter-inflationpay-articleLarge.jpg,2022-02-10T12:31:30+0000,"This morning, the government will report inflation data for January. Economists expect that prices continued to climb at the fastest pace in 40 years. But how much workers feel the effects of inflation depends on whether wages, which have also been growing fast, can keep pace with rising prices. DealBook turned to Ben Casselman, an economics reporter at The Times, for his thoughts. Here’s what he said:",the-new-york-times,The New York Times
By Juliet Macur,Nathan Chen is winning by not trying so hard to win.,"In position for gold heading into the free skate, he is appreciating the experience, win or lose.",https://www.nytimes.com/2022/02/09/sports/olympics/nathan-chen-is-winning-by-not-trying-so-hard-to-win.html,https://static01.nyt.com/images/2022/02/10/multimedia/10olympics-briefing-chen-setup-topart/10olympics-briefing-chen-setup-topart-articleLarge.jpg,2022-02-10T02:31:34+0000,Follow our live coverage as ​​Nathan Chen goes for gold in men’s figure skating.,the-new-york-times,The New York Times
By Gail Collins,Let’s All Sweat Student Debt,"Flick that pen, Joe.",https://www.nytimes.com/2022/02/09/opinion/biden-student-loan-debt.html,https://static01.nyt.com/images/2022/02/10/opinion/10collins_original/10collins_original-articleLarge-v2.jpg,2022-02-10T00:04:03+0000,Perhaps you’re wondering whatever happened to Joe Biden’s plan to reduce student loan debt.,the-new-york-times,The New York Times
By Kevin Draper,"Sweden’s Speedskating Hero Is Quick in the Turns, and With an Opinion","In the first week of the Beijing Olympics, Nils van der Poel criticized his own sport, set off a controversy over the quality of the ice — and blew away his main competition, the Dutch.",https://www.nytimes.com/2022/02/10/sports/olympics/nils-van-der-poel-speedskating.html,https://static01.nyt.com/images/2022/02/10/sports/10oly-nils-react/merlin_201463419_6d25363e-ce7c-4efa-95a8-a07c0e6493a2-articleLarge.jpg,2022-02-10T19:47:33+0000,"BEIJING — Nils van der Poel spends a lot of time thinking about the Dutch. He has come up with an explanation for why he, a Swede, and not an athlete from the sport’s unquestioned powerhouse, is the most dominant men’s distance speedskater in the world.",the-new-york-times,The New York Times
By Paul Stenquist,The Life (and House) That Street Racing Built,"Kevin Lawrence ruled Chicago’s streets 40 years ago, earning enough for a home down payment. He’s still racing, with his family at his side.",https://www.nytimes.com/2022/02/10/business/street-racing-drag-racing.html,https://static01.nyt.com/images/2022/02/11/business/00wheels-streetrace1/00wheels-streetrace1-articleLarge.jpg,2022-02-10T11:00:08+0000,"Long after sundown one day 44 years ago, 21-year-old Kevin Lawrence stepped out of his ’68 Chevelle onto a sparsely traveled road just beyond Chicago’s suburban sprawl. After hushed negotiations with another young man, he settled into his car and ignited an engine that barked powerfully before settling into a bass-beat idle. He switched on the headlights, illuminating 50 feet of road. I jabbed at the shutter of a beat-up camera, clicking off frames as my flash defied the darkness.",the-new-york-times,The New York Times
By James Barron,"‘Mask or Vax’ Rule Lifted, but That Doesn’t Mean No Masks","Gov. Kathy Hochul said the indoor mask mandate for businesses would expire today. Other states loosened pandemic rules, deepening confusion about what is and is not required.",https://www.nytimes.com/2022/02/10/nyregion/mask-or-vax-rule-covid.html,https://static01.nyt.com/images/2022/02/10/multimedia/10nytoday-nymasks/10nytoday-nymasks-articleLarge.jpg,2022-02-10T05:25:47+0000,"Good morning. It’s Thursday. We’ll take a closer look at Gov. Kathy Hochul’s decision to end New York State’s indoor masking rules. We’ll also look at a restaurant where the preferred way to make a reservation is not by phone or with an app, but on Instagram.",the-new-york-times,The New York Times
By A.O. Scott,‘Catch the Fair One’ Review: The Fight of Her Life,The real-life boxer Kali Reis plays a pugilist in search of revenge.,https://www.nytimes.com/2022/02/10/movies/catch-the-fair-one-review.html,https://static01.nyt.com/images/2022/02/08/arts/00catch-the-fair-one/merlin_201360996_7e8441d7-52a0-4b1e-a0eb-46c58a8035f9-articleLarge.jpg,2022-02-10T12:00:07+0000,"“Catch the Fair One” is a violent, brooding rescue-revenge drama — the kind of genre workout you might expect to find Liam Neeson grimacing his way though around this time of year. With all respect to Neeson, the star of this tough, modest movie brings a different kind of credibility. She’s Kali Reis, a world champion boxer in both the welterweight and middleweight classes. Her nickname is K.O.",the-new-york-times,The New York Times
,T’s Valentine’s Day Gift Guide,"Hand-woven scarves, an incense holder that doubles as jewelry — and more.",https://www.nytimes.com/2022/02/10/t-magazine/valentines-day-gift-guide.html,https://static01.nyt.com/images/2022/02/09/t-magazine/09tmag-newsletter-slide-ACFP/09tmag-newsletter-slide-ACFP-articleLarge.jpg,2022-02-10T14:00:09+0000,"Welcome to the T List, a newsletter from the editors of T Magazine. This week, we’ve turned it into our Valentine’s Day gift guide, with recommendations on what we’re coveting for ourselves and eyeing for our loved ones. Sign up here to find us in your inbox every Wednesday. And you can always reach us at tlist@nytimes.com.",the-new-york-times,The New York Times
By Dana Goldstein,Why Liberal Suburbs Face a New Round of School Mask Battles,"With the end of many statewide mask mandates, it’s up to local districts whether they will keep the requirement. Communities anticipate political and emotional fights ahead.",https://www.nytimes.com/2022/02/10/us/school-mask-mandates.html,https://static01.nyt.com/images/2022/02/09/us/00masks1/00masks1-articleLarge.jpg,2022-02-10T10:00:20+0000,"David Fleishman, the superintendent of schools in Newton, Mass., an affluent Boston suburb, said he recently received a message from a parent who pushed for ending mask mandates in classrooms.",the-new-york-times,The New York Times
By M.H. Miller,"George Clinton on Painting, P-Funk and His Artistic Legacy","The artist’s influence is indisputably far-reaching. When asked about his own inspirations, he cites Lauren Halsey, as well as Fab Five Freddy and ancient Egypt.",https://www.nytimes.com/2022/02/10/t-magazine/george-clinton-art.html,https://static01.nyt.com/images/2022/02/10/t-magazine/art/10tmag-george-clinton-slide-RQX8/10tmag-george-clinton-slide-RQX8-articleLarge.jpg,2022-02-10T12:00:31+0000,"George Clinton has been ahead of his time for most of his life, and he knows it. In the early ’70s, he began refining his artistic vision — one that combined elements of blues, R&B, gospel and immersive science fiction imagery into something altogether different from anything that had come before — with the musical collective Parliament-Funkadelic, which he formed and lead. “I knew then that I was doing something I would have to explain 20 years later,” Clinton told me on a recent phone call, speaking from his home in Tallahassee, Fla.",the-new-york-times,The New York Times
By Lauren McCarthy,Why are all of these Olympic skiers wearing tape on their faces?,"The trend was perhaps first started by the skier Ted Ligety, who wore a strip of tape reading “U.S.A.” at the 2018 Winter Games.",https://www.nytimes.com/2022/02/09/sports/olympics/skiing-face-tape.html,,2022-02-10T19:52:16+0000,"The colorful strips of adhesive are hard to miss. Maja Dahlqvist and Jonna Sundling of Sweden, Denise Herrmann of Germany and Jessie Diggins of the United States have all been spotted with tape across their noses and cheeks in competition.",the-new-york-times,The New York Times
By Terry Parris Jr,What Do You Know About Peatlands? Tell Us.,"Headway’s next project is exploring peatlands around the world, why they are so important and the threats they face. And we want to talk to you.",https://www.nytimes.com/2022/02/10/climate/climate-change-carbon-peatlands.html,https://static01.nyt.com/images/2022/02/22/multimedia/00hw-peatcallout/00hw-peatcallout-articleLarge.jpg,2022-02-10T18:12:24+0000,"If you’re someone drawn to bogs, swamps, fens, mires, marshes or any type of peatland, the Headway team wants to hear from you.",the-new-york-times,The New York Times
By Juliet Macur,"Yuzuru Hanyu, Nathan Chen’s rival, appears to fall short of a comeback.","He also failed to land a quadruple axel, which would have made history.",https://www.nytimes.com/2022/02/09/sports/olympics/yuzuru-hanyu-figure-skating.html,https://static01.nyt.com/images/2022/02/09/sports/olympics/figure-skating-beijing-olympics-1290/figure-skating-beijing-olympics-1290-articleLarge.jpg,2022-02-10T04:29:56+0000,Yuzuru Hanyu of Japan entered the Beijing Olympics as the two-time defending gold medalist and Nathan Chen’s chief rival.,the-new-york-times,The New York Times
By Kevin Draper,"For Donovan Carrillo, the first Mexican skater in the long program, it all started with a girl named Lisa.",And he’s already looking forward to the next step in his journey.,https://www.nytimes.com/2022/02/09/sports/olympics/donovan-carrillo-figure-skating.html,https://static01.nyt.com/images/2022/02/09/sports/olympics/figure-skating-beijing-olympics-935/figure-skating-beijing-olympics-935-articleLarge.jpg,2022-02-10T04:01:11+0000,"Donovan Carrillo began figure skating at 8 years old, following his sister to the local rink, but it was another girl, Lisa, who kept him there. Carrillo had a crush on Lisa.",the-new-york-times,The New York Times
By Isaac Aronow and Doug Mennella,Spelling Bee Forum,Feeling stuck on today’s puzzle? We can help.,https://www.nytimes.com/2022/02/10/crosswords/spelling-bee-forum.html,https://static01.nyt.com/images/2022/02/10/crosswords/10bee-forum-thur/10bee-forum-thur-articleLarge.jpg,2022-02-10T08:00:04+0000,"THURSDAY — Hi busy bees! Welcome to today’s Spelling Bee forum. There are a number of terms that appear in both this article and other online discussions of the Spelling Bee; a glossary of those terms compiled by Monicat, a Times reader, can be found below.",the-new-york-times,The New York Times
By Emma G. Fitzsimmons,"Nearly 3,000 N.Y.C. Workers Have a Day to Get Vaccinated or Be Fired",Mayor Eric Adams has embraced a vaccine mandate for city workers and warned that thousands would get fired this week if they were not vaccinated.,https://www.nytimes.com/2022/02/10/nyregion/vaccine-mandate-nyc-workers.html,https://static01.nyt.com/images/2022/02/10/nyregion/10nyvirus-workers/merlin_201574788_b751eead-5fc3-4545-8f84-ca3b3ccefbc3-articleLarge.jpg,2022-02-10T22:30:32+0000,"Hundreds of municipal workers marched across the Brooklyn Bridge this week, chanting in unison for New York City to end its vaccine mandate, and carrying signs that said “Fire Fauci” and “Unvaccinated Lives Matter.”",the-new-york-times,The New York Times
By Remy Tumin,"The soundtrack of the men’s free skate? Rock, electronic and Latin pop.","The musicians, including Elton John, have headlined arenas and concert halls around the world, and their songs will play during the men’s skating competition.",https://www.nytimes.com/2022/02/09/sports/olympics/playlist-mens-free-skate.html,https://static01.nyt.com/images/2022/02/10/multimedia/10olympics-briefing-mens-skating-soundtrack-topart/10olympics-briefing-mens-skating-soundtrack-topart-articleLarge-v2.jpg,2022-02-10T02:18:49+0000,Elton John. Daft Punk. Phillip Phillips. Ricky Martin.,the-new-york-times,The New York Times
By Emmanuel Morgan,The N.F.L. Wants to Be a Player in a City of Players,"The league’s new West Coast headquarters, in the shadow of SoFi Stadium, gives it a large footprint in the land of big media deals.",https://www.nytimes.com/2022/02/10/sports/football/nfl-los-angeles-headquarters.html,https://static01.nyt.com/images/2022/02/10/sports/10sb-nflla/merlin_201718548_3cc6b2c2-f9d9-4464-ace0-f26cab9dea65-articleLarge.jpg,2022-02-10T08:00:13+0000,"LOS ANGELES — The former West Coast headquarters for the N.F.L., the most popular North American professional sports league,  was tucked away in Culver City, Calif., a residential Los Angeles suburb, and its neighbors included a mosque, an assisted-living facility and an elementary school.",the-new-york-times,The New York Times
By Jan Hoffman,"C.D.C. Proposes New Guidelines for Treating Pain, Including Opioid Use",The agency threw out previous recommended limits on doses but encouraged “nonopioid therapies” wherever possible.,https://www.nytimes.com/2022/02/10/health/cdc-opioid-pain-guidelines.html,https://static01.nyt.com/images/2022/02/10/science/10opioids-promo/merlin_191082249_dff0f25f-00eb-4837-b871-5fb1fe41fe6a-articleLarge.jpg,2022-02-10T13:45:42+0000,The federal government on Thursday proposed new guidelines for prescribing opioid painkillers that remove its previous recommended ceilings on doses for chronic pain patients and instead encourage doctors to use their best judgment.,the-new-york-times,The New York Times
By Kevin Draper,A Teen Phenom’s Secrets to Success: Long Femurs and His Own Counsel,"Jordan Stolz, following his own plan, won a place on the U.S. speedskating team at 17 after a major growth spurt and a breakout performance at the Olympic trials.",https://www.nytimes.com/2022/02/10/sports/olympics/jordan-stolz-united-states-speedskating.html,https://static01.nyt.com/images/2022/02/11/sports/11oly-stolz/merlin_201753171_121dab63-da46-412d-b764-4e8cc619b877-articleLarge.jpg,2022-02-10T17:37:57+0000,"BEIJING — Every time he has been asked recently about his goal for the Olympics, Jordan Stolz, a 17-year-old American speedskater, has given a similar answer.",the-new-york-times,The New York Times
By Jack Ewing,The Biden administration outlines a plan to build a network of electric vehicle chargers.,"Using $5 billion that Congress allocated last year, the Biden administration would require states to install high-voltage chargers along interstate highways.",https://www.nytimes.com/2022/02/10/business/electric-vehicle-chargers-biden.html,https://static01.nyt.com/images/2022/02/10/multimedia/10economy-briefing-ev-charging/10economy-briefing-ev-charging-articleLarge.jpg,2022-02-10T10:00:13+0000,"The Biden administration said on Thursday that it would require states to submit proposals to line highways with electric vehicle chargers, part of a $5 billion plan to fill a gap in the infrastructure needed to support booming sales of battery-powered cars.",the-new-york-times,The New York Times
By Jon Pareles,"Betty Davis, Raw Funk Innovator, Is Dead at 77",“Nasty Gal” and her two other 1970s albums influenced generations of R&B and hip-hop.,https://www.nytimes.com/2022/02/10/arts/music/betty-davis-dead.html,https://static01.nyt.com/images/2022/02/10/obituaries/10Davis1/merlin_201744294_80b2bdf1-1a1c-4c9b-9d7f-62eb2b26623e-articleLarge.jpg,2022-02-10T19:57:05+0000,"Betty Davis, the singer and songwriter whose raunchy persona, fierce funk grooves and Afrofuturistic style in the early 1970s made her a forerunner of R&B and hip-hop to come, died on Wednesday in Homestead, Pa., the town outside Pittsburgh where she had lived. She was 77.",the-new-york-times,The New York Times
By Billy Witz,Joe Burrow’s Last Playoff Loss Was in High School. He Still Thinks About It.,"“It was the first time I had a firsthand experience of something that was bigger than the collective team,” said Tyler Bailey, one of Burrow’s teammates at Athens High School.",https://www.nytimes.com/2022/02/10/sports/football/joe-burrow-ohio.html,https://static01.nyt.com/images/2022/02/08/sports/08sb-burrow-loss-walking/08sb-burrow-loss-walking-articleLarge.jpg,2022-02-10T22:45:13+0000,"THE PLAINS, Ohio — When the final lateral had failed, the last tackle had been secured and the clock had hit zero, Joe Burrow yanked off his gold Athens High School helmet and dropped to the Ohio Stadium turf. All around him, Toledo Central Catholic football players stormed onto the field, celebrating a heart-thumping, roller-coaster ride of a state championship victory. The final score: Central Catholic 56, Athens 52.",the-new-york-times,The New York Times
By Sam Roberts,"Gloria Rojas, Trailblazing Latina Broadcaster, Dies at 82","“I remember thinking,” she once said, “that if they hire another Hispanic, they’ll have to let me go, since who needs two?” She helped change that.",https://www.nytimes.com/2022/02/10/business/media/gloria-rojas-dead.html,https://static01.nyt.com/images/2022/02/09/obituaries/09Rojas1/09Rojas1-articleLarge.jpg,2022-02-10T17:25:56+0000,"Gloria Rojas, who was billed as New York City’s first Latina broadcast journalist when she was hired by WCBS-TV in 1968, and who went on to work as a journalist for every major network affiliate in the city for 23 years, died on Feb. 2 in Cambridge, Md. She was 82.",the-new-york-times,The New York Times
By Steve Lohr,A Gene Sequencing Pioneer Battles Over What It Can Buy,"Is Illumina, a gene-sequencing powerhouse, trying to speed innovation in the field of cancer blood tests or thwart it with an acquisition?",https://www.nytimes.com/2022/02/10/business/illumina-gene-sequencing-ftc.html,https://static01.nyt.com/images/2022/02/07/business/00illumina1/merlin_201147786_229d342c-71c7-4e59-93e8-f214520f3659-articleLarge.jpg,2022-02-10T10:00:15+0000,"Illumina, the leading maker of gene-sequencing machines, is tiny compared with the tech giants of Silicon Valley. But like Google and Facebook, Illumina now finds itself in the cross hairs of antitrust enforcers in the United States and Europe.",the-new-york-times,The New York Times
By Maureen Farrell,SoftBank’s Woes Are Mounting,"Plunging profit, wobbly shares and a key executive’s departure after a bitter pay dispute beget the question: Will SoftBank rein in its freewheeling ways?",https://www.nytimes.com/2022/02/10/business/softbank-masayoshi-son-marcelo-claure.html,https://static01.nyt.com/images/2022/02/01/business/01claure-expenses-1/01claure-expenses-1-articleLarge.jpg,2022-02-10T17:15:10+0000,"For the past decade, SoftBank and its founder, Masayoshi Son, grabbed headlines mainly for the Japanese conglomerate’s eye-popping investments, becoming a fixture in the American technology scene by spending freely on start-ups and fundamentally reshaping how such companies had been funded.",the-new-york-times,The New York Times
By Gina Kolata,F.D.A. Panel Rejects Lilly’s Cancer Drug Tested Only in China,"The panel debated whether overseas trials could be applied to a more diverse U.S. population. The decision may affect other Chinese drug trials, and spotlights the high cost of immunotherapy.",https://www.nytimes.com/2022/02/10/health/fda-cancer-drug-china.html,https://static01.nyt.com/images/2022/02/10/science/10FDA-cancerdrug1/merlin_181058262_c718d43e-a7ef-43b9-a638-6871ac57d17e-articleLarge.jpg,2022-02-10T22:35:14+0000,An advisory committee to the Food and Drug Administration overwhelmingly voted on Thursday against recommending agency approval of a lung cancer drug that was tested only in China and sold there.,the-new-york-times,The New York Times
By Devika Girish,‘Indemnity’ Review: Fires Everywhere,This South African thriller trades plausibility and originality for a worthy substitute: a great deal of fun.,https://www.nytimes.com/2022/02/10/movies/indemnity-review-fires-everywhere.html,https://static01.nyt.com/images/2022/02/10/arts/10INDEMNITY-REVIEW/merlin_201361089_d4881519-e016-487b-8c4a-e49704b4105e-articleLarge.jpg,2022-02-10T12:00:09+0000,"A South African thriller haunted by the ghosts of many Hollywood blockbusters past, “Indemnity” trades plausibility and originality for a worthy substitute: a great deal of fun.",the-new-york-times,The New York Times
By David Leonhardt,Mitch McConnell vs. Republicans,Making sense of the G.O.P. leader’s squabble with his own party.,https://www.nytimes.com/2022/02/10/briefing/mitch-mcconnell-republican-party.html,https://static01.nyt.com/images/2022/02/10/multimedia/10ambriefing-promo/10ambriefing-mcconnell-articleLarge-v2.jpg,2022-02-10T11:55:59+0000,Mitch McConnell has a long history of playing hardball — even changing the rules of American politics — to benefit the Republican Party.,the-new-york-times,The New York Times
By Beatrice Loayza,‘I Want You Back’ Review: Scheming Hearts,Jenny Slate and Charlie Day play strangers who team up to win back their exes in this pleasantly run-of-the-mill rom-com.,https://www.nytimes.com/2022/02/10/movies/i-want-you-back-review.html,https://static01.nyt.com/images/2022/02/10/multimedia/10want-you-back1/10want-you-back1-articleLarge.jpg,2022-02-10T12:00:16+0000,"Directed by Jason Orley, “I Want You Back” is a throwback rom-com about the love lives of straight people, and its jokes hit about as much as they miss. The story is mediocre and formulaic, yes, but pleasantly so. And it shows not only ladies dealing in blubbering heartbreak, but guys going through it as well.",the-new-york-times,The New York Times
By Jessica Testa,Where Fashion and Food Mingle and the Chopsticks Are for Sale,"The designer Humberto Leon talks about love and merch at Chifa, his family’s Los Angeles restaurant.",https://www.nytimes.com/2022/02/10/style/humberto-leon-chifa-merch.html,https://static01.nyt.com/images/2022/02/10/fashion/10HUMBERTO1/merlin_201433995_487a6e0b-0c5f-48ff-b4dd-1d94e557dfcc-articleLarge.jpg,2022-02-10T08:00:10+0000,"A year ago, Humberto Leon opened a restaurant with his family on the northeast side of Los Angeles.",the-new-york-times,The New York Times
