author,title,description,url,urlToImage,publishedAt,content,source.id,source.name
By Julia Jacobs,New York Zoos and Aquarium Plan to Open this Month,"If all goes as planned with the state’s reopening, the public will be allowed back to see the animals starting on July 24.",https://www.nytimes.com/2020/07/09/arts/zoos-new-york-reopening.html,https://static01.nyt.com/images/2020/07/09/arts/09zoos/merlin_171855909_6ffd5791-0e1e-4ec4-b41a-7edb46264c35-articleLarge.jpg,2020-07-09T20:43:13+0000,"The sea lions may get an audience soon enough, but they shouldn’t expect sold-out shows.",the-new-york-times,The New York Times
By Sandra E. Garcia,Ziwe Fumudoh Asks: ‘How Many Black People Do You Know?’,"The comedian performs a kind of racial high wire act on her Instagram Live show, but she really just wants to heal.",https://www.nytimes.com/2020/07/09/us/ziwe-fumudoh-asks-how-many-black-people-do-you-know.html,https://static01.nyt.com/images/2020/07/09/fashion/09ZIWE-prmo/09ZIWE-prmo-articleLarge.jpg,2020-07-09T17:30:03+0000,"How many Black friends do you have? Is it “between four and five?” If so, then you have something in common with several guests on Ziwe Fumudoh’s Instagram Live show.",the-new-york-times,The New York Times
By Jacey Fortin,Indiana Woman Is Accused of Driving Into Demonstrators,"Video footage of the attack, in Bloomington, showed a car zooming forward as a woman clung to its hood and a man clutched the driver’s side, his foot grazing the asphalt.",https://www.nytimes.com/2020/07/09/us/bloomington-vauhxx-booker-car-protesters.html,https://static01.nyt.com/images/2020/07/09/multimedia/09xp-bloomington-pix1/09xp-bloomington-pix1-articleLarge.jpg,2020-07-09T21:44:43+0000,"A woman who was accused of driving her car through a crowd of protesters in Bloomington, Ind., on Monday, injuring at least two people, has been arrested, the authorities said Thursday.",the-new-york-times,The New York Times
By Apoorva Mandavilli,"The Coronavirus Can Be Airborne Indoors, W.H.O. Says","The agency also explained more directly that people without symptoms may spread the virus. The acknowledgments should have come sooner, some experts said.",https://www.nytimes.com/2020/07/09/health/virus-aerosols-who.html,https://static01.nyt.com/images/2020/07/09/science/09virus-aerosols/09virus-aerosols-articleLarge.jpg,2020-07-09T18:54:14+0000,"The coronavirus may linger in the air in crowded indoor spaces, spreading from one person to the next, the World Health Organization acknowledged on Thursday.",the-new-york-times,The New York Times
By Betsy Hodges,"As Mayor of Minneapolis, I Saw How White Liberals Block Change",But this revolutionary moment is inviting us to be a part of the solution.,https://www.nytimes.com/2020/07/09/opinion/minneapolis-hodges-racism.html,https://static01.nyt.com/images/2020/07/07/opinion/00hodges1/merlin_174291870_9b2d5e99-e4e8-4320-be8b-f2db3e8d9d33-articleLarge.jpg,2020-07-09T19:34:25+0000,"Democrats have largely led big and midsize cities for much of the past half-century. Yet the gaps in socioeconomic outcomes between white people and people of color are by several measures at their worst in the richest, bluest cities of the United States.",the-new-york-times,The New York Times
By Farhad Manjoo,"I’ve Seen a Future Without Cars, and It’s Amazing",Why do American cities waste so much space on cars?,https://www.nytimes.com/2020/07/09/opinion/ban-cars-manhattan-cities.html,https://static01.nyt.com/images/2020/07/09/opinion/sunday/09manjoo_promo/09manjoo_promo-articleLarge.jpg,2020-07-09T10:39:05+0000,"As coronavirus lockdowns crept across the globe this winter and spring, an unusual sound fell over the world’s metropolises: the hush of streets that were suddenly, blessedly free of cars. City dwellers reported hearing bird song, wind and the rustling of leaves. (Along with, in New York City, the intermittent screams of sirens).",the-new-york-times,The New York Times
By Spencer Bokat-Lindell,Inside the Supreme Court’s Ruling on Birth Control Coverage,A victory for religious employers is a defeat for their employees — and for the Affordable Care Act.,https://www.nytimes.com/2020/07/09/opinion/inside-the-supreme-courts-ruling-on-birth-control-coverage.html,https://static01.nyt.com/images/2020/07/09/opinion/09debatableillo/09debatableillo-articleLarge.jpg,2020-07-09T22:45:04+0000,This article is part of the Debatable newsletter. You can sign up here to receive it on Tuesdays and Thursdays.,the-new-york-times,The New York Times
By Michael W. McConnell,"On Religion, the Supreme Court Protects the Right to Be Different","Recent decisions are about safeguarding pluralism, not taking sides in the culture wars.",https://www.nytimes.com/2020/07/09/opinion/supreme-court-religion.html,https://static01.nyt.com/images/2020/07/10/opinion/09mcconnell/merlin_174361377_c3f28ac9-1192-4d28-9a53-6ee7a27efd31-articleLarge.jpg,2020-07-09T09:04:43+0000,Some Supreme Court watchers have been quick to interpret recent decisions as skirmishes in American “culture wars” — with some decisions (on abortion and sexual orientation) siding with the cultural left and others (on religion) siding with the cultural right.,the-new-york-times,The New York Times
By Patricia Cohen and Ben Casselman,"Hiring Outlook Remains Dim, With ‘Scarring in the Economy’","As unemployment claims keep pouring in, new job postings are lacking, and an end to some benefits is approaching.",https://www.nytimes.com/2020/07/09/business/economy/unemployment-claims-coronavirus.html,https://static01.nyt.com/images/2020/07/10/business/09JPvirus-jobless1-print/merlin_172328577_4859c36e-1d76-41ba-91ef-c33386de6a25-articleLarge.jpg,2020-07-09T19:59:09+0000,"The number of new state unemployment claims dipped last week, but job losses continue to batter the economy as rising coronavirus cases pushed some regions of the country to reverse course and reimpose shutdown orders on businesses.",the-new-york-times,The New York Times
By Tammy Duckworth,Tammy Duckworth: Tucker Carlson Doesn’t Know What Patriotism Is,Neither does President Trump.,https://www.nytimes.com/2020/07/09/opinion/tammy-duckworth-tucker-carlson.html,https://static01.nyt.com/images/2020/07/09/opinion/09duckworthNew/09duckworthNew-articleLarge.jpg,2020-07-09T21:41:32+0000,"A little over 240 years ago, two of my ancestors put on the uniform of George Washington’s Continental Army and marched into battle, willing to die if it meant bringing their fledgling nation inches closer to independence. Centuries later, in 1992, I followed in their footsteps and joined the Army.",the-new-york-times,The New York Times
,2 Art Gallery Shows to Explore From Home,Galleries and museums are getting creative about presenting work online during the coronavirus crisis. Here are two shows worth viewing virtually.,https://www.nytimes.com/2020/07/09/arts/design/virtual-art-shows.html,https://static01.nyt.com/images/2020/07/09/arts/09virtual-galleries1/merlin_174317832_ea89ab30-d266-4b49-b16b-077deaa7f965-articleLarge.jpg,2020-07-09T14:48:42+0000,"Some of New York’s now-shuttered museum exhibitions — the Museum of Modern Art’s precise Donald Judd retrospective, the Whitney Museum of American Art’s grand survey of Mexican painting — will go back on view later this summer, but one of the best will not re-emerge. “Gerhard Richter: Painting After All,” the final exhibition at the Met Breuer, took years to organize and yet closed after just nine days; since the Metropolitan Museum of Art is now turning over the Breuer building to the Frick Collection, the German artist’s terse photo paintings and doubt-wracked abstractions are being crated up and shipped home.",the-new-york-times,The New York Times
By Tim Gray,High-Yield Bonds Have Been Behaving a Lot Like Stocks,"They have produced strong returns over long periods, but the March meltdown was a reminder that high-yield bonds can add to your troubles.",https://www.nytimes.com/2020/07/09/business/high-yield-bonds-coronavirus.html,https://static01.nyt.com/images/2020/07/12/business/12high/merlin_174291615_52813316-ea1a-48a5-b827-01fb720de273-articleLarge.jpg,2020-07-09T09:00:20+0000,A high-yield bond sounds like a perfect investment combining gushing income with solid reliability.,the-new-york-times,The New York Times
By Moris Moreno,Air Travel in the Age of Coronavirus: A Visual Diary of a Flight,"In late June, I flew with my family from Seattle to Boston. This is a step-by-step visual account of my flight.",https://www.nytimes.com/interactive/2020/07/09/travel/coronavirus-air-travel-visual-diary.html,https://static01.nyt.com/images/2020/07/09/travel/09travel-flight-promo/09travel-flight-promo-articleLarge.jpg,2020-07-09T15:00:06+0000,"In late June, I flew with my family from Seattle to Boston. This is a step-by-step visual account of my flight.",the-new-york-times,The New York Times
By Conrad de Aenlle,Stocks That Could Thrive in a Post-Pandemic World,"Life will return to ‘normal,’ but not entirely. Here are some suggestions for investing in a changed world.",https://www.nytimes.com/2020/07/09/business/stocks-after-coronavirus-investors.html,https://static01.nyt.com/images/2020/07/08/business/08virus-mfqpost-01/08virus-mfqpost-01-articleLarge.jpg,2020-07-09T09:00:19+0000,"When facing a crisis as dire as the coronavirus pandemic, it’s natural to think that everything will change utterly and forever by the time it’s over. But people are resilient creatures of habit, so many aspects of life will return to what used to pass for “normal.”",the-new-york-times,The New York Times
By Christopher Clarey,Six Feet? Try Seven Separate Tracks,Call it extreme social distancing. Track and field athletes will compete in eight disciplines at seven different tracks in Europe and the United States.,https://www.nytimes.com/2020/07/09/sports/six-feet-try-seven-separate-tracks.html,https://static01.nyt.com/images/2020/07/09/sports/09zurich-track1/merlin_110865906_365ebaa1-a3bd-410c-b442-d5a6e00d0cc3-articleLarge.jpg,2020-07-09T07:00:09+0000,"At the last summer Olympics, Allyson Felix and Shaunae Miller-Uibo dueled down the final stretch of the 400 meters. In a photo finish, Miller sprawled across the finish line to win the gold medal by seven-hundredths of a second.",the-new-york-times,The New York Times
By Shira Ovide,Can Facebook Ever Stop the Drama?,"How Facebook’s most recent crisis started, and what it says about the company’s role in our lives.",https://www.nytimes.com/2020/07/09/technology/facebook-crisis.html,https://static01.nyt.com/images/2020/07/09/business/09ontech/09ontech-articleLarge.jpg,2020-07-09T16:22:18+0000,This article is part of the On Tech newsletter. You can sign up here to receive it weekdays.,the-new-york-times,The New York Times
By Michael Kimmelman,New York as a Biking City? It Could Happen. And It Should.,"A new report proposes 425 miles of interconnected bike lanes across the five boroughs. Another sees new car-free bridges into Manhattan from Queens, Brooklyn and New Jersey.",https://www.nytimes.com/2020/07/09/arts/bike-bridges-new-york.html,https://static01.nyt.com/images/2020/07/09/arts/09kimmelman-bridge1/09kimmelman-bridge1-articleLarge.jpg,2020-07-09T09:00:21+0000,"If not change, then glimmers of it. Maybe.",the-new-york-times,The New York Times
By Vanessa Friedman,Digital Dior. Remote Chanel. What’s Couture With No Runway?,"The first streamed couture shows were more like mini-movies, music videos, trailers and perfume commercials. There were some clothes, too.",https://www.nytimes.com/2020/07/09/fashion/digital-couture-fashion-week-dior-chanel.html,https://static01.nyt.com/images/2020/07/09/fashion/09COUTURE-Viktor-Rolf/09COUTURE-Viktor-Rolf-articleLarge-v6.jpg,2020-07-09T12:43:50+0000,Is this a front row anyone really wants to join?,the-new-york-times,The New York Times
By Alyssa Shelasky,Is Sex Dead for Parents?,Finding the time and energy for intimacy was hard enough pre-pandemic; now wanting to be closer to someone feels almost impossible.,https://www.nytimes.com/2020/07/09/parenting/sex-parents-coronavirus.html,,2020-07-09T18:30:14+0000,"While in domestic confinement, the most comforting thing I can say to my female friends, near and far, is not “This too shall pass.” Nor is it “We can do hard things.” It is my own pearl of wisdom, and it goes something like this: “Don’t worry, no one actually wants to have sex with their husband.”",the-new-york-times,The New York Times
By Andrew E. Kramer,"In a Death, Details of More Russian Murder-for-Hire Plots",A Chechen man shot near Vienna last weekend had spoken publicly of giving Austrian and Ukrainian authorities information about contract killings. He also said there was a price on his head.,https://www.nytimes.com/2020/07/09/world/europe/chechnya-russian-murder-vienna.html,https://static01.nyt.com/images/2020/07/09/world/09russia-murder/merlin_129255104_c828c2fd-5d6e-4cdc-9b53-78ee5fa8800f-articleLarge.jpg,2020-07-09T18:36:15+0000,"MOSCOW — Earlier this year, a heavyset man living in Vienna and known as Beck Martin said during a TV interview that he was assisting an investigation of a complicated murder-for-hire plot, in which three people were to be killed in exchange for $2 million.",the-new-york-times,The New York Times
By Elian Peltier,A Melania Trump Statue Is Set on Fire. Its Patron Gets Inspired.,"The American artist who commissioned the work near the first lady’s Slovenian hometown said he wanted to interview the arsonists. “There’s a lot of buzz around the destruction of monuments,” he noted.",https://www.nytimes.com/2020/07/09/world/europe/melania-trump-statue-slovenia.html,,2020-07-09T13:37:51+0000,"LONDON — After a wooden statue of Melania Trump was burned near her birthplace in Slovenia over the weekend, the American artist who commissioned it said that he now wants to interview the arsonist as part of a new project.",the-new-york-times,The New York Times
By Julia Jacobs,New York Zoos and Aquarium Plan to Open this Month,"If all goes as planned with the state’s reopening, the public will be allowed back to see the animals starting on July 24.",https://www.nytimes.com/2020/07/09/arts/zoos-new-york-reopening.html,https://static01.nyt.com/images/2020/07/09/arts/09zoos/merlin_171855909_6ffd5791-0e1e-4ec4-b41a-7edb46264c35-articleLarge.jpg,2020-07-09T20:43:13+0000,"The sea lions may get an audience soon enough, but they shouldn’t expect sold-out shows.",the-new-york-times,The New York Times
"By Alan Feuer, Juliana Kim and Byron Smith",Occupy City Hall’s New Life as Homeless Camp: ‘Not Pretty All the Time’,Organizers said they were helping vulnerable people. But nearby residents said the camp had turned into an unruly — and at times violent — shantytown.,https://www.nytimes.com/2020/07/09/nyregion/occupy-city-hall-nyc-homeless.html,https://static01.nyt.com/images/2020/07/09/nyregion/09nyunrest-occupy01-promo/09nyunrest-occupy01-promo-articleLarge.jpg,2020-07-09T21:18:57+0000,"When it first kicked off last month, the activist encampment that billed itself as Occupy City Hall was viewed as the latest wave of the city’s George Floyd protests — an innovative political space that, under summer skies, attracted peaceful crowds to speeches and teach-ins focused on a narrow goal: cutting $1 billion from the New York Police Department’s budget.",the-new-york-times,The New York Times
By Choe Sang-Hun,Seoul Mayor Is Found Dead After Harassment Complaint Is Filed,"Mayor Park Won-soon, who vanished after leaving a cryptic message for his daughter, had faced a newly filed complaint from his secretary.",https://www.nytimes.com/2020/07/09/world/asia/seoul-mayor-dead.html,https://static01.nyt.com/images/2020/07/09/world/09skorea-mayor3/merlin_174398244_f52257b9-9670-4e34-9e08-495cb0aece45-articleLarge.jpg,2020-07-09T10:49:12+0000,"SEOUL, South Korea — The mayor of Seoul, the country’s second-most powerful official and a potential presidential candidate, was found dead just days after a secretary in his office told the police that he had sexually harassed her since 2017, the authorities said on Friday.",the-new-york-times,The New York Times
By Gillian R. Brassil and Alan Blinder,"Big Ten Will Play Fall Sports Only Within Conference, if at All",The league’s football teams had been scheduled to participate in some of the most highly anticipated nonconference games of the 2020 season.,https://www.nytimes.com/2020/07/09/sports/ncaafootball/big-ten-fall-sports-in-conference.html,https://static01.nyt.com/images/2020/07/09/sports/09bigten-web-1/merlin_161684175_f3b6a6e5-abef-4abf-ac1b-89ab160c34e9-articleLarge.jpg,2020-07-09T21:21:47+0000,"The Big Ten Conference’s fall sports teams will play only within the league, a decision that will affect football, men’s and women’s cross country, field hockey, men’s and women’s soccer, and women’s volleyball — assuming public health officials advise playing at all amid the coronavirus pandemic.",the-new-york-times,The New York Times
By Erica L. Green,Lawsuits Aim to Block DeVos’s New Sexual Misconduct Rules,"Students, women’s rights and education groups are seeking to delay or derail Education Secretary Betsy DeVos’s broad overhaul of rules that govern sexual misconduct claims.",https://www.nytimes.com/2020/07/09/us/politics/sexual-misconduct-betsy-devos.html,https://static01.nyt.com/images/2020/07/07/us/politics/07dc-lawsuits/merlin_173961402_09ed4913-6672-4b35-aa5a-93fd5cfdd01e-articleLarge.jpg,2020-07-09T21:39:29+0000,"WASHINGTON — Students, women’s rights and education groups are suing to block Education Secretary Betsy DeVos’s campus sexual assault rules from taking effect next month, with plaintiffs as young as 10 joining arguments that the rules will harm students and burden institutions.",the-new-york-times,The New York Times
By Allyson Waller,Campaign Urges NASA to Rename the John C. Stennis Space Center,"The center, in Mississippi, is named for a former senator who opposed civil rights legislation and the Supreme Court ruling that desegregated the nation’s public schools.",https://www.nytimes.com/2020/07/09/us/nasa-rename-john-c-stennis-space-center.html,https://static01.nyt.com/images/2020/07/06/multimedia/00xp-unrest-stennis/merlin_147443475_03d1b076-993c-4558-a6c0-4a643ba760a1-articleLarge.jpg,2020-07-09T09:30:10+0000,"For 32 years, a NASA rocket testing center in southern Mississippi has carried the name of John C. Stennis, a former United States senator who was a champion of racial segregation for most of his time in Congress.",the-new-york-times,The New York Times
,The Timely Agitation of Run the Jewels,Killer Mike and El-P’s anti-government and pro-justice hip-hop feels like it anticipated the current moment.,https://www.nytimes.com/2020/07/09/arts/music/popcast-run-the-jewels.html,https://static01.nyt.com/images/2020/07/09/arts/09popcast/merlin_150120444_91b89018-fd2c-43fb-912b-a0d9fcfc42f9-articleLarge.jpg,2020-07-09T13:52:10+0000,The racial justice protests that have spread across the United States (and the world) in recent weeks have had many soundtracks. But what’s striking about Run the Jewels’ music is how it can feel like it anticipated the current moment.,the-new-york-times,The New York Times
By Brian Seibert,"The Dance on Camera Festival, When Dance Is Only on Camera","Many dance films of recent months have been films by necessity, but the ones in this festival are films by design, for better and worse.",https://www.nytimes.com/2020/07/09/arts/dance/the-dance-on-camera-festival.html,https://static01.nyt.com/images/2020/07/12/arts/12DANCE-CAMERA-1/merlin_174042081_7f5ea8dc-f7b9-43a0-910b-e50d5b19beb4-articleLarge.jpg,2020-07-09T14:00:10+0000,"“We’re all becoming filmmakers,” Annie-B Parson told me in May. She was speaking for her fellow choreographers, and in the months since, her generalization has proved prophetic. With theaters closed, dance companies and dance makers accustomed to stage performance have been rushing to channel their work into a form you can stream. Live dance is dormant, but filmed dance has been busting out all over.",the-new-york-times,The New York Times
By Alex Williams,How Everclear Became a Pandemic Favorite,"Long the stuff of fraternity parties, the 190-proof grain alcohol wants to go from D.I.Y. germ killer to cocktail ingredient.",https://www.nytimes.com/2020/07/09/style/how-everclear-became-a-pandemic-favorite.html,https://static01.nyt.com/images/2020/07/07/fashion/07everclear-1/07everclear-1-articleLarge.jpg,2020-07-09T09:00:07+0000,"You know 190-proof Everclear by reputation. The bartender’s equivalent of jet fuel, this high-octane neutral grain spirit is more than twice the strength of standard vodka, and is illegal in 11 states.",the-new-york-times,The New York Times
,9 New Books We Recommend This Week,Suggested reading from critics and editors at The New York Times.,https://www.nytimes.com/2020/07/09/books/review/9-new-books-we-recommend-this-week.html,https://static01.nyt.com/images/2020/07/09/books/09RecBooks/09RecBooks-articleLarge.jpg,2020-07-09T16:18:17+0000,"It’s probably no coincidence that the same subjects we’re taught to avoid in polite conversation — politics, religion, money — are so irresistible to read about. We’ll save religion for another time, but this week we invite you to think about money by way of Stefano Massini’s epic novel of the Lehman Brothers company, and about politics by way of the other books we recommend, from Robert M. Gates’s treatise on foreign policy to DW Gibson’s tour of President Trump’s border wall. We won’t even discourage you from discussing them, politely, when you’re done.",the-new-york-times,The New York Times
By Giovanni Russonello,"Biden and Bernie, United (at Least Briefly)",Democratic unity materializes in a long set of policy proposals: This is your morning tip sheet.,https://www.nytimes.com/2020/07/09/us/politics/biden-bernie-sanders-policy.html,https://static01.nyt.com/images/2020/04/20/us/onpolitics-2020-still/onpolitics-2020-still-articleLarge.jpg,2020-07-09T11:01:15+0000,"Dems strike a deal on policy, Trump rejects the C.D.C. guidelines for schools, and SCOTUS gives the green light to religious groups refusing birth-control coverage. It’s Thursday, and this is your politics tip sheet. Sign up here to get On Politics in your inbox every weekday.",the-new-york-times,The New York Times
,The Timely Agitation of Run the Jewels,Killer Mike and El-P’s anti-government and pro-justice hip-hop feels like it anticipated the current moment.,https://www.nytimes.com/2020/07/09/arts/music/popcast-run-the-jewels.html,https://static01.nyt.com/images/2020/07/09/arts/09popcast/merlin_150120444_91b89018-fd2c-43fb-912b-a0d9fcfc42f9-articleLarge.jpg,2020-07-09T13:52:10+0000,The racial justice protests that have spread across the United States (and the world) in recent weeks have had many soundtracks. But what’s striking about Run the Jewels’ music is how it can feel like it anticipated the current moment.,the-new-york-times,The New York Times
By Alex Williams,How Everclear Became a Pandemic Favorite,"Long the stuff of fraternity parties, the 190-proof grain alcohol wants to go from D.I.Y. germ killer to cocktail ingredient.",https://www.nytimes.com/2020/07/09/style/how-everclear-became-a-pandemic-favorite.html,https://static01.nyt.com/images/2020/07/07/fashion/07everclear-1/07everclear-1-articleLarge.jpg,2020-07-09T09:00:07+0000,"You know 190-proof Everclear by reputation. The bartender’s equivalent of jet fuel, this high-octane neutral grain spirit is more than twice the strength of standard vodka, and is illegal in 11 states.",the-new-york-times,The New York Times
By Brian Seibert,"The Dance on Camera Festival, When Dance Is Only on Camera","Many dance films of recent months have been films by necessity, but the ones in this festival are films by design, for better and worse.",https://www.nytimes.com/2020/07/09/arts/dance/the-dance-on-camera-festival.html,https://static01.nyt.com/images/2020/07/12/arts/12DANCE-CAMERA-1/merlin_174042081_7f5ea8dc-f7b9-43a0-910b-e50d5b19beb4-articleLarge.jpg,2020-07-09T14:00:10+0000,"“We’re all becoming filmmakers,” Annie-B Parson told me in May. She was speaking for her fellow choreographers, and in the months since, her generalization has proved prophetic. With theaters closed, dance companies and dance makers accustomed to stage performance have been rushing to channel their work into a form you can stream. Live dance is dormant, but filmed dance has been busting out all over.",the-new-york-times,The New York Times
,9 New Books We Recommend This Week,Suggested reading from critics and editors at The New York Times.,https://www.nytimes.com/2020/07/09/books/review/9-new-books-we-recommend-this-week.html,https://static01.nyt.com/images/2020/07/09/books/09RecBooks/09RecBooks-articleLarge.jpg,2020-07-09T16:18:17+0000,"It’s probably no coincidence that the same subjects we’re taught to avoid in polite conversation — politics, religion, money — are so irresistible to read about. We’ll save religion for another time, but this week we invite you to think about money by way of Stefano Massini’s epic novel of the Lehman Brothers company, and about politics by way of the other books we recommend, from Robert M. Gates’s treatise on foreign policy to DW Gibson’s tour of President Trump’s border wall. We won’t even discourage you from discussing them, politely, when you’re done.",the-new-york-times,The New York Times
