author,title,description,url,urlToImage,publishedAt,content,source.id,source.name
By Christopher Flavelle and Lisa Friedman,"NOAA Officials Feared Firings After Trump’s Hurricane Claims, Inspector General Says",The report found White House pressure led to NOAA’s rebuke of forecasters who contradicted Mr. Trump’s inaccurate claim that Hurricane Dorian would hit Alabama.,https://www.nytimes.com/2020/07/09/climate/trump-hurricane-dorian-noaa.html,https://static01.nyt.com/images/2020/07/09/climate/00cli-NOAA/00cli-NOAA-articleLarge.jpg,2020-07-09T19:21:42+0000,"WASHINGTON — The head of the National Oceanic and Atmospheric Administration felt that his job and the jobs of others would be in jeopardy if the agency did not rebuke forecasters who contradicted President Trump’s inaccurate claim last year about the path of Hurricane Dorian, a government report found.",the-new-york-times,The New York Times
By Michael Gold and Daniel E. Slotnik,N.Y.C. Paints ‘Black Lives Matter’ in Front of Trump Tower,The public art project is the latest battle in a feud between President Trump and Mayor Bill de Blasio.,https://www.nytimes.com/2020/07/09/nyregion/blm-trump-tower.html,,2020-07-09T15:27:57+0000,"New York City painted “Black Lives Matter” in large yellow letters on the street outside Trump Tower on Thursday, the latest flare-up in a yearslong feud between President Trump, who rose to fame as a Manhattan real estate developer, and Mayor Bill de Blasio, who once sought to replace him.",the-new-york-times,The New York Times
By Astead W. Herndon,Republican Senators in Arizona and Georgia Have a Problem: The Base,"This November, the uneasy relationship between the most right-wing voters in the Republican Party and the statewide lawmakers who rely on their votes will burst into the open.",https://www.nytimes.com/2020/07/09/us/politics/kelly-loeffler-georgia-senate-arizona.html,https://static01.nyt.com/images/2020/07/02/us/politics/00GOP-base3/merlin_173848620_c1ca518c-7481-47b2-a0db-a73d4624a73c-articleLarge.jpg,2020-07-09T09:00:25+0000,"DILLARD, Ga. — As Representative Doug Collins went booth to booth at a recent Republican jamboree in northeast Georgia’s Rabun County, he was a hero, not an insurgent. No one knocked him for splitting the party with his bid against the state’s junior senator, Kelly Loeffler, who is also a Republican. For many voters in the deeply conservative region, Mr. Collins was the candidate who most represented the values of their political icon: President Trump.",the-new-york-times,The New York Times
By Sopan Deb,A W.N.B.A. Owner Clashes With Players on Protests,"Kelly Loeffler, who is also campaigning for a Senate seat in Georgia, opposes the league’s plan to allow players to wear jerseys in support of the movement.",https://www.nytimes.com/2020/07/09/sports/basketball/kelly-loeffler-atlanta-dream-protests.html,https://static01.nyt.com/images/2020/07/09/sports/09wnba-unrest1/merlin_174364980_eccb5228-7e83-4cad-b036-3c0d70b3962e-articleLarge.jpg,2020-07-09T22:57:24+0000,"On Monday, the W.N.B.A. announced that its upcoming season would be “dedicated to social justice with games honoring the Black Lives Matter movement.”",the-new-york-times,The New York Times
By Declan Walsh,"Cairo Badly Needed a Detox. Lockdown Supplied One, at a Steep Price.","Three months of lockdown slowed its pulse, stripped its grit and exposed a new side to a weary city. But without the noise, bustle and grind, was it really Cairo?",https://www.nytimes.com/2020/07/09/world/middleeast/cairo-lockdown-detox.html,https://static01.nyt.com/images/2020/07/06/world/00cairo-dispatch1/merlin_174278163_69dce3c2-fb1e-4853-b995-058c120abf84-articleLarge.jpg,2020-07-09T09:00:24+0000,"CAIRO — If ever a city needed a good detox, it was Cairo.",the-new-york-times,The New York Times
By Judith Newman,Anything You Say in This Trader Joe’s Line May Be Used Against You,"These neighbors’ signs respond to loud shoppers: “We are so sorry your wife is leaving you,” one read. “And we are SURE the ‘Everything but the Bagel’ Seasoning will help.”",https://www.nytimes.com/2020/07/09/nyregion/trader-joes-line-signs-nyc.html,https://static01.nyt.com/images/2020/07/02/nyregion/00nyvirus-lines1/merlin_174168435_234ae7cd-aca1-44f7-94a5-d8b85e1c9bfb-articleLarge.jpg,2020-07-09T09:00:16+0000,"It began, as so many things do in New York City, with people who would not shut up.",the-new-york-times,The New York Times
By Peter Baker,A Conservative Court and Trump’s Own Appointees Declare Their Independence,"The Supreme Court’s dismissal of President Trump’s claims of immunity was a reminder that institutional prerogatives still matter in Washington, even in a time of extreme partisanship.",https://www.nytimes.com/2020/07/09/us/politics/supreme-court-trump.html,https://static01.nyt.com/images/2020/07/09/us/politics/09dc-court-sub/merlin_174409344_53471b4b-3c8f-40ce-98cb-72e10ca4911e-articleLarge.jpg,2020-07-09T23:38:46+0000,"WASHINGTON — At his campaign rally last month in Tulsa, Okla., President Trump ranked his Supreme Court appointments among his biggest achievements. “Two great Supreme Court judges!” he boasted. “So, we have two justices of the Supreme Court, Justice Gorsuch, Justice Kavanaugh, they’re great. They are — they’re great.”",the-new-york-times,The New York Times
"By Kimiko de Freytas-Tamura, Shawn Hubler, Hailey Fuchs and David Montgomery",Like ‘a Bus Accident a Day’: Hospitals Strain Under New Flood of Covid-19 Patients,"I.C.U. units are reaching capacity. Nurses are falling sick, contributing to shortages. The new coronavirus spikes are challenging hospitals across the United States.",https://www.nytimes.com/2020/07/09/us/coronavirus-hospitals-capacity.html,https://static01.nyt.com/images/2020/07/09/us/09VIRUS-HOSPITALS-jackson/merlin_174017190_17ecdf80-fc0f-4e0c-8e2c-d18ac45cf7cc-articleLarge.jpg,2020-07-09T22:29:06+0000,"TAMPA — As states across the American South and West grapple with shortages of vital testing equipment and a key antiviral drug, hospitals are being flooded with coronavirus patients, forcing them to cancel elective surgeries and discharge patients early, and doctors worry that the escalating hospital crunch may last much longer than in earlier-hit areas like New York.",the-new-york-times,The New York Times
By Adam Liptak,Supreme Court Rules Trump Cannot Block Release of Financial Records,"Two rulings clear the way for prosecutors in New York to seek President Trump’s financial records, but the justices stopped Congress for now.",https://www.nytimes.com/2020/07/09/us/trump-taxes-supreme-court.html,https://static01.nyt.com/images/2020/07/06/us/politics/00dc-scotus-trump-sub2/merlin_174147207_d7424b77-fbb2-4f66-b7ed-693833d252fa-articleLarge.jpg,2020-07-09T14:17:11+0000,WASHINGTON — The Supreme Court cleared the way on Thursday for prosecutors in New York to seek President Trump’s financial records in a stunning defeat for Mr. Trump and a major statement on the scope and limits of presidential power.,the-new-york-times,The New York Times
By Benjamin Mueller,"‘Whac-a-Mole’ Against Virus Sounds Reasonable, Unless You’re the Mole","When the city of Leicester was shocked with a second lockdown, it lashed back with anger and recriminations.",https://www.nytimes.com/2020/07/09/world/europe/09virus-uk-leicester-lockdown.html,https://static01.nyt.com/images/2020/07/08/world/08virus-uklockdown01/merlin_174067629_f30977a0-c815-4903-aa63-1575a8e0ae67-articleLarge.jpg,2020-07-09T15:52:25+0000,"LEICESTER, England — Fresh buttercream wastes away in an empty cake shop. Young men slip past the lockdown border to reopened pubs in nearby towns. And neighbors blame neighbors for a new outbreak of the coronavirus that has stalled their return to something resembling normal life.",the-new-york-times,The New York Times
"By Maggie Haberman, William K. Rashbaum and Nicole Hong",Michael Cohen Returned to Jail in Dispute Over Trump Book,"President Trump’s former personal lawyer balked at signing an agreement not to publish a book while serving his sentence at home, his legal adviser said.",https://www.nytimes.com/2020/07/09/nyregion/michael-cohen-arrested.html,https://static01.nyt.com/images/2020/07/09/nyregion/09cohen/merlin_172709853_a9b2a438-cfa3-4bf7-85dc-e88603b6d583-articleLarge.jpg,2020-07-09T18:26:25+0000,"Michael D. Cohen, President Trump’s onetime lawyer and fixer, was in good spirits on Thursday when he arrived at a Manhattan federal courthouse, where he expected to complete routine paperwork related to his home confinement amid the coronavirus pandemic.",the-new-york-times,The New York Times
By Sydney Franklin,Westchester Home Sales Drop to Recession-Era Lows,"Sales volume declined across New York’s northern suburbs in the second quarter, although there was an uptick in activity in June.",https://www.nytimes.com/2020/07/09/realestate/westchester-home-sales-drop-to-recession-era-lows.html,https://static01.nyt.com/images/2020/07/09/realestate/09suburbsmarket/merlin_145401006_0ac3f724-f0b6-4d14-9e79-d268f8887919-articleLarge.jpg,2020-07-09T04:01:09+0000,"The coronavirus severely hampered the spring sales market for homes in Westchester County, with the number of sales dropping by more than 27 percent in the last three months compared to the same period last year, the largest decline recorded in 11 years.",the-new-york-times,The New York Times
By Deb Amlen,‘Who’s a Good Boy?’,The return of Joe Kidd.,https://www.nytimes.com/2020/07/08/crosswords/daily-puzzle-2020-07-09.html,https://static01.nyt.com/images/2020/07/09/crosswords/09wordplay-goodboy/09wordplay-goodboy-articleLarge.jpg,2020-07-09T02:00:08+0000,THURSDAY PUZZLE — The constructor Joe Kidd — who has a great name that sounds to my ears like it should have belonged to an outlaw of the Old West — made his New York Times Crossword debut in 2017.,the-new-york-times,The New York Times
,"Corrections: July 9, 2020","Corrections that appeared in print on Thursday, July 9, 2020.",https://www.nytimes.com/2020/07/08/pageoneplus/corrections-july-9-2020.html,,2020-07-09T00:41:38+0000,"An article on Wednesday about Mary L. Trump’s reasons for writing a memoir about President Trump, her uncle, misstated the birth order of Ms. Trump and her brother, Fred Trump III. She is younger than him, not older. The article also misidentified a member of the Trump family who sued over an estate. The quote referred to Fred Trump III, not Fred Trump Jr. ",the-new-york-times,The New York Times
By Michael Kimmelman,New York as a Biking City? It Could Happen. And It Should.,"A new report proposes 425 miles of interconnected bike lanes across the five boroughs. Another sees new car-free bridges into Manhattan from Queens, Brooklyn and New Jersey.",https://www.nytimes.com/2020/07/09/arts/bike-bridges-new-york.html,https://static01.nyt.com/images/2020/07/09/arts/09kimmelman-bridge1/09kimmelman-bridge1-articleLarge.jpg,2020-07-09T09:00:21+0000,"If not change, then glimmers of it. Maybe.",the-new-york-times,The New York Times
By Shira Ovide,Can Facebook Ever Stop the Drama?,"How Facebook’s most recent crisis started, and what it says about the company’s role in our lives.",https://www.nytimes.com/2020/07/09/technology/facebook-crisis.html,https://static01.nyt.com/images/2020/07/09/business/09ontech/09ontech-articleLarge.jpg,2020-07-09T16:22:18+0000,This article is part of the On Tech newsletter. You can sign up here to receive it weekdays.,the-new-york-times,The New York Times
By Taylor Lorenz,TikTok Stars Race to Land Reality Shows,The drama among influencers at Hype House and Sway House seems like a natural fit for TV. Will the industry bite?,https://www.nytimes.com/2020/07/09/style/tiktok-stars-race-to-land-reality-shows.html,https://static01.nyt.com/images/2020/07/12/fashion/08INFLUENCER-REALITY-SHOWS9/oakImage-1594258909758-articleLarge.jpg,2020-07-09T17:33:05+0000,"Late Monday night, a group of male TikTok stars who belong to the Gen Z influencer collective known as the Sway House charged up the streets of the Hollywood Hills. They were on their way to the Hype House to confront a fellow TikTok star, Chase Hudson, 18, about comments he had made earlier online.",the-new-york-times,The New York Times
By Elian Peltier,A Melania Trump Statue Is Set on Fire. Its Patron Gets Inspired.,"The American artist who commissioned the work near the first lady’s Slovenian hometown said he wanted to interview the arsonists. “There’s a lot of buzz around the destruction of monuments,” he noted.",https://www.nytimes.com/2020/07/09/world/europe/melania-trump-statue-slovenia.html,,2020-07-09T13:37:51+0000,"LONDON — After a wooden statue of Melania Trump was burned near her birthplace in Slovenia over the weekend, the American artist who commissioned it said that he now wants to interview the arsonist as part of a new project.",the-new-york-times,The New York Times
By Carlotta Gall,NASA Scientist Jailed in Turkey for 3 Years Recounts His Ordeal,"Finally home in Houston, Serkan Golge is still dismayed by the “garbage” evidence linking him to a failed coup and says the country is missing a chance to build its democracy.",https://www.nytimes.com/2020/07/09/world/europe/turkey-erdogan-nasa-scientist-golge.html,https://static01.nyt.com/images/2020/07/09/world/09turkey-golge01/merlin_164383104_2735e198-8bcf-4a44-8143-303a09f775ab-articleLarge.jpg,2020-07-09T14:09:25+0000,"ISTANBUL — When Turkish police officers stopped him as he set out for the airport to return to the United States after a family vacation in Turkey, the country of his birth, Serkan Golge, a NASA scientist and American citizen, was in disbelief.",the-new-york-times,The New York Times
By Niraj Chokshi,"United Airlines says it could furlough up to 36,000 workers.","United Airlines said on Wednesday that it could furlough as many as 36,000 workers, or nearly 40 percent of its staff, starting Oct. 1 if travel remained weak and if enough employees did not accept buyout and early retirement packages.",https://www.nytimes.com/2020/07/09/business/united-airlines-says-it-could-furlough-up-to-36000-workers.html,https://static01.nyt.com/images/2020/07/08/business/08-markets-united2/merlin_171540156_1fc3a4fb-40a4-418a-aa88-3758f5d38b5e-articleLarge.jpg,2020-07-09T10:21:09+0000,"United Airlines said on Wednesday that it could furlough as many as 36,000 workers, or nearly 40 percent of its staff, starting Oct. 1 if travel remained weak and if enough employees did not accept buyout and early retirement packages.",the-new-york-times,The New York Times
By Matt Wolf,"In the Absence of Live Theater, TV Takes, Well, Center Stage","“Staged,” a six-episode sitcom, and “Talking Heads,” a remake of a group of vaunted monologues, show what good can come of a bereft theatrical scene in Britain.",https://www.nytimes.com/2020/07/09/theater/review-staged-talking-heads.html,https://static01.nyt.com/images/2020/07/09/arts/09london-theater1/merlin_174313788_fde98378-cf22-404b-a847-61c60f4aad28-articleLarge.jpg,2020-07-09T05:29:38+0000,"Can we add Michael Sheen and David Tennant to the list of defining double-acts of our time? That’s one response to the giddy pleasures of “Staged,” a delicious comedy series made for the BBC that owes its existence to the theatrical desolation of the coronavirus pandemic.",the-new-york-times,The New York Times
,Exclusive — Venture Fund for Women Raises More Than Expected,"Rethink Impact invests solely in tech start-ups founded by women, which accounted for just 4 percent of all venture deals in the first quarter.",https://www.nytimes.com/2020/07/09/business/dealbook/venture-capital-women.html,https://static01.nyt.com/images/2020/07/09/business/09db-newsletter-rethink/merlin_171933519_e570cd31-cf3f-431b-87dc-9f7fc2b168be-articleLarge.jpg,2020-07-09T10:54:54+0000,Want this delivered to your inbox each morning? Sign up here.,the-new-york-times,The New York Times
By Wesley Morris and Jenna Wortham,So Y’all Finally Get It,America just won’t let us rest.,https://www.nytimes.com/2020/07/09/podcasts/still-processing-black-lives-matter.html,,2020-07-09T19:38:57+0000,"Excerpts from our June 12 live event, where we caught up about the uprisings and resurgence of the Black Lives Matter movement. This is the first of three special summer episodes.",the-new-york-times,The New York Times
By Moris Moreno,Air Travel in the Age of Coronavirus: A Visual Diary of a Flight,"In late June, I flew with my family from Seattle to Boston. This is a step-by-step visual account of my flight.",https://www.nytimes.com/interactive/2020/07/09/travel/coronavirus-air-travel-visual-diary.html,https://static01.nyt.com/images/2020/07/09/travel/09travel-flight-promo/09travel-flight-promo-articleLarge.jpg,2020-07-09T15:00:06+0000,"In late June, I flew with my family from Seattle to Boston. This is a step-by-step visual account of my flight.",the-new-york-times,The New York Times
By Conrad de Aenlle,Stocks That Could Thrive in a Post-Pandemic World,"Life will return to ‘normal,’ but not entirely. Here are some suggestions for investing in a changed world.",https://www.nytimes.com/2020/07/09/business/stocks-after-coronavirus-investors.html,https://static01.nyt.com/images/2020/07/08/business/08virus-mfqpost-01/08virus-mfqpost-01-articleLarge.jpg,2020-07-09T09:00:19+0000,"When facing a crisis as dire as the coronavirus pandemic, it’s natural to think that everything will change utterly and forever by the time it’s over. But people are resilient creatures of habit, so many aspects of life will return to what used to pass for “normal.”",the-new-york-times,The New York Times
By Christopher Clarey,Six Feet? Try Seven Separate Tracks,Call it extreme social distancing. Track and field athletes will compete in eight disciplines at seven different tracks in Europe and the United States.,https://www.nytimes.com/2020/07/09/sports/six-feet-try-seven-separate-tracks.html,https://static01.nyt.com/images/2020/07/09/sports/09zurich-track1/merlin_110865906_365ebaa1-a3bd-410c-b442-d5a6e00d0cc3-articleLarge.jpg,2020-07-09T07:00:09+0000,"At the last summer Olympics, Allyson Felix and Shaunae Miller-Uibo dueled down the final stretch of the 400 meters. In a photo finish, Miller sprawled across the finish line to win the gold medal by seven-hundredths of a second.",the-new-york-times,The New York Times
By Shira Ovide,Can Facebook Ever Stop the Drama?,"How Facebook’s most recent crisis started, and what it says about the company’s role in our lives.",https://www.nytimes.com/2020/07/09/technology/facebook-crisis.html,https://static01.nyt.com/images/2020/07/09/business/09ontech/09ontech-articleLarge.jpg,2020-07-09T16:22:18+0000,This article is part of the On Tech newsletter. You can sign up here to receive it weekdays.,the-new-york-times,The New York Times
By Jeannette Catsoulis,‘Relic’ Review: A Haunted House and a Clouded Mind,Natalie Erika James’s arresting debut deftly merges a classic horror genre with an allegory of dementia.,https://www.nytimes.com/2020/07/09/movies/relic-review-a-haunted-house-and-a-clouded-mind.html,https://static01.nyt.com/images/2020/07/09/arts/09relic-art/merlin_174159114_6a3d0ab5-2065-4b15-a0e2-ddf514eea6ce-articleLarge.jpg,2020-07-09T11:00:09+0000,"The final image of the three generations of women who share the center of “Relic,” Natalie Erika James’s arresting horror debut, isn’t particularly scary. But it’s easily one of the most unsettling, ambiguous and unusual movie tableaus I’ve seen in some time.",the-new-york-times,The New York Times
By Margaret Lyons,How Much Watching Time Do You Have This Weekend?,"Check out an Australian kids show that is legitimately entertaining for viewers of all ages, or a sharp Canadian dramedy starring Kim Cattrall.",https://www.nytimes.com/2020/07/09/arts/television/how-much-watching-time-do-you-have-this-weekend.html,https://static01.nyt.com/images/2020/07/10/arts/09Watching-Bluey/09Watching-Bluey-articleLarge.jpg,2020-07-09T20:17:27+0000,"Every Monday, Wednesday and Friday, our TV critic Margaret Lyons offers hyper-specific viewing recommendations in our Watching newsletter. Read her latest picks below, and sign up for the Watching newsletter here.",the-new-york-times,The New York Times
By Jeannette Catsoulis,‘We Are Little Zombies’ Review: Rocking Away the Pain,"Wry humor, absurd dialogue and unflagging energy propel this dazzling, manic debut from Makoto Nagahisa.",https://www.nytimes.com/2020/07/09/movies/we-are-little-zombies-review.html,https://static01.nyt.com/images/2020/07/09/arts/09littlezombies/merlin_174316446_8573991a-c8ff-4f83-ad16-57fc7ec4eb47-articleLarge.jpg,2020-07-09T11:00:09+0000,"When four suddenly orphaned Japanese 13-year-olds meet at a crematory, they instantly connect over their shared inability to cry — and the likely commingled remains of their parents.",the-new-york-times,The New York Times
,2 Art Gallery Shows to Explore From Home,Galleries and museums are getting creative about presenting work online during the coronavirus crisis. Here are two shows worth viewing virtually.,https://www.nytimes.com/2020/07/09/arts/design/virtual-art-shows.html,https://static01.nyt.com/images/2020/07/09/arts/09virtual-galleries1/merlin_174317832_ea89ab30-d266-4b49-b16b-077deaa7f965-articleLarge.jpg,2020-07-09T14:48:42+0000,"Some of New York’s now-shuttered museum exhibitions — the Museum of Modern Art’s precise Donald Judd retrospective, the Whitney Museum of American Art’s grand survey of Mexican painting — will go back on view later this summer, but one of the best will not re-emerge. “Gerhard Richter: Painting After All,” the final exhibition at the Met Breuer, took years to organize and yet closed after just nine days; since the Metropolitan Museum of Art is now turning over the Breuer building to the Frick Collection, the German artist’s terse photo paintings and doubt-wracked abstractions are being crated up and shipped home.",the-new-york-times,The New York Times
By Josh Chafetz,"Don’t Be Fooled, Trump Is a Winner in the Supreme Court Tax Case",His taxes will probably not become public before the election. And that is what he most cares about.,https://www.nytimes.com/2020/07/09/opinion/trump-taxes-supreme-court-.html,https://static01.nyt.com/images/2020/07/09/opinion/09chafetz/merlin_163853052_340bec53-2509-4f4a-8b7b-3a9a0cbe60f1-articleLarge.jpg,2020-07-09T18:14:02+0000,"The first reports on Thursday’s Supreme Court decisions dealing with the subpoenas for President Trump’s financial records sounded like bad news for the president in his effort to keep them hidden. But don’t be fooled. There were actually two winners, and you wouldn’t know that from the headlines: the president and Chief Justice John Roberts.",the-new-york-times,The New York Times
By Adam Goldman,Judge in Michael Flynn Case Asks for Full Appeals Court Review,"After a divided appeals court panel ordered him to drop the charge against the former national security adviser, a judge asked the full court to review the ruling.",https://www.nytimes.com/2020/07/09/us/politics/michael-flynn-appeals-court.html,https://static01.nyt.com/images/2020/07/09/us/politics/09dc-flynn/merlin_172292805_8752e9b2-cf91-4d21-bf61-d404d36832d3-articleLarge.jpg,2020-07-09T23:03:00+0000,"WASHINGTON — The judge overseeing the case of President Trump’s former national security adviser Michael T. Flynn asked a full appeals court on Thursday to review an order by a panel of its judges to end the prosecution, saying their ruling marked “a dramatic break from precedent that threatens the orderly administration of justice.”",the-new-york-times,The New York Times
By Andrew Keh,"Game Time Beer? For M.L.S., Make That a Kickoff Cappuccino","Bed head, morning breath, fatigue. The 9 a.m. kickoffs for Major League Soccer games restarting this week could be one of the bigger challenges for players taking the field.",https://www.nytimes.com/2020/07/09/sports/soccer/coronavirus-mls-soccer-return.html,https://static01.nyt.com/images/2020/07/07/sports/00Soccer-Early/00Soccer-Early-articleLarge.jpg,2020-07-09T09:00:08+0000,There are things professional soccer players want to eat before games. And there are things they want to eat at 6 a.m. for breakfast.,the-new-york-times,The New York Times
By Ali Watkins,State Attorney General Calls for Stripping N.Y.P.D. Control From Mayor,"Citing police misconduct at protests, the attorney general said an independent panel should oversee the city police and hire the commissioner.",https://www.nytimes.com/2020/07/08/nyregion/letitia-james-nypd-reforms.html,https://static01.nyt.com/images/2020/07/08/nyregion/08nycpolicereform01/merlin_173177016_ef181052-1309-46c3-bec6-8aca7f0f1719-articleLarge.jpg,2020-07-09T00:12:01+0000,"One officer in Brooklyn pulled down a protester’s mask and pepper-sprayed him. Another officer shoved a young woman to the ground, knocking her head against the pavement and giving her a concussion. An officer in Manhattan pulled a gun and waved it at protesters after one of his colleagues was hit in the head with an thrown object.",the-new-york-times,The New York Times
By Dave Caldwell,Reeling Devils Hire Lindy Ruff to Coach,"After an organizational demolition this winter, the Devils tabbed Ruff and made interim general manager Tom Fitzgerald’s role permanent.",https://www.nytimes.com/2020/07/09/sports/hockey/new-jersey-devils-lindy-ruff.html,https://static01.nyt.com/images/2020/07/10/sports/09nhl-devils-print/merlin_174389859_fa179251-c01a-42f3-9b51-37a184e8826a-articleLarge.jpg,2020-07-09T22:39:53+0000,"Lindy Ruff, the Devils’ new head coach, has 736 career wins over 19 seasons but he still concedes that what worked for him in the past may not apply in today’s N.H.L.",the-new-york-times,The New York Times
