author,title,description,url,urlToImage,publishedAt,content,source.id,source.name
By Liam Stack,"In a First, Fordham Will be Led by a Woman, Not a Catholic Priest","Tania Tetlow, a laywoman and former law professor, will take the helm this summer, breaking with a nearly 200-year tradition.",https://www.nytimes.com/2022/02/10/nyregion/fordham-tania-tetlow.html,https://static01.nyt.com/images/2022/02/10/nyregion/fordham-promo/fordham-promo-articleLarge.jpg,2022-02-10T21:18:32+0000,"Fordham University, one of the most prominent Jesuit universities in the United States, announced its new president on Thursday, unveiling a choice that breaks with tradition in two significant ways: For the first time in its nearly 200-year history, the school will be led by a laywoman instead of a priest.",the-new-york-times,The New York Times
By Elisabeth Egan,"The Best-Seller List Has Some Regrets, and That’s OK","In his seventh book, Daniel Pink tells readers how to turn remorse upside down.",https://www.nytimes.com/2022/02/10/books/review/the-power-of-regret-daniel-pink.html,https://static01.nyt.com/images/2022/02/20/books/20Insidethelist-web/20Insidethelist-print-articleLarge.jpg,2022-02-10T10:00:04+0000,"RUE THE DAY As anyone who has suffered from insomnia knows, regret is a many-tentacled monster that hides under your bed and wraps its sticky arms around your brain in the middle of the night. Daniel Pink takes on the subject (and all its slithering, stultifying permutations) in his seventh book, “The Power of Regret,” which enters this week’s hardcover nonfiction list at No. 3. But — there’s always a but when it comes to the life-changing magic of tidying up your mind-set — Pink isn’t here to tell you how to slay the beast. He wants you to look it in the eye, learn something from it, give it a little space on your pillow.",the-new-york-times,The New York Times
By Sheryl Gay Stolberg,"‘We Are Not There Yet’: As States Drop Mask Rules, the C.D.C. Stands Firm","The Biden administration said federal masking guidance would not change for now, but was seeking advice from public health experts on the way forward.",https://www.nytimes.com/2022/02/09/health/mask-rules-cdc.html,,2022-02-10T00:54:58+0000,"WASHINGTON — The White House has been meeting with outside health experts to plan a pandemic exit strategy and a transition to a “new normal,” but the behind-the-scenes effort is crashing into a very public reality: A string of blue-state governors have gotten ahead of President Biden by suddenly abandoning their mask mandates.",the-new-york-times,The New York Times
By The Learning Network,Film Club: ‘Almost Famous: The Queen of Basketball’,Who are the unsung heroes of basketball?,https://www.nytimes.com/2022/02/10/learning/film-club-almost-famous-the-queen-of-basketball.html,https://static01.nyt.com/images/2021/06/24/opinion/opdoc-almostfamous-lusia-alt/opdoc-almostfamous-lusia-alt-articleLarge.png,2022-02-10T21:15:51+0000,"“The Queen of Basketball” is a 22-minute Oscar-nominated film that touches on themes of sports, fame and the barriers faced by women athletes. It tells the story of Lusia “Lucy” Harris Stewart, one of women’s basketball’s most accomplished players, who died in January 2022. She was a pioneer in the sport, scoring the first basket in women’s Olympic history and becoming the first and only woman officially drafted by the N.B.A. And while she was one of the first two women inducted into the Basketball Hall of Fame, she has remained largely unknown, even among basketball enthusiasts.",the-new-york-times,The New York Times
By Sheryl Gay Stolberg,Vacancies in Top Health and Science Jobs May Threaten Biden’s Agenda,"President Biden came into office vowing to respect science, but openings in crucial jobs could hamper progress on medical and technological research.",https://www.nytimes.com/2022/02/10/us/politics/biden-health-science-agenda.html,https://static01.nyt.com/images/2022/02/10/us/politics/10dc-biden-science-1/merlin_201799146_6e7c8fdb-6629-46ea-ae15-32286aedff61-articleLarge.jpg,2022-02-10T23:47:08+0000,"WASHINGTON — President Biden, who came into office vowing to “reinvigorate our national science and technology strategy,” is now facing a leadership vacuum that may threaten his ambitious research agenda, which stretches well beyond fighting the coronavirus pandemic.",the-new-york-times,The New York Times
By Sydney Franklin and Lisa Prevost,Homes for Sale in New York and Connecticut,"This week’s properties are five-bedroom homes in Purchase, N.Y., and Fairfield, Conn.",https://www.nytimes.com/2022/02/10/realestate/housing-market-near-nyc.html,https://static01.nyt.com/images/2022/02/13/realestate/10OTM-REGION-slide-VE3D/10OTM-REGION-slide-VE3D-articleLarge.jpg,2022-02-10T14:00:41+0000,Click on the slide show to see this week’s featured properties:,the-new-york-times,The New York Times
By Alan Blinder,The U.S. men’s hockey team opens its Olympics by beating China.,"With a roster filled with college players, the team outdistanced China, 8-0.",https://www.nytimes.com/2022/02/09/sports/olympics/us-hockey-win-china.html,https://static01.nyt.com/images/2022/02/10/sports/10olympics-briefing-mens-hockey/10olympics-briefing-mens-hockey-articleLarge.jpg,2022-02-10T15:53:12+0000,The United States brought to Beijing its youngest men’s hockey team since 1994.,the-new-york-times,The New York Times
By Roslyn Sulcas,"In ‘The Girl Before,’ Minimalism Offers a Dangerous Sanctuary","This new HBO Max limited series is centered on a futuristic London home with an architect, played by David Oyelowo, who also wants to design his tenants’ lives.",https://www.nytimes.com/2022/02/10/arts/television/the-girl-before.html,https://static01.nyt.com/images/2022/02/10/arts/10girl-before1/merlin_201654183_cd2fc497-3a4d-4ac2-9e0a-f798c5d7e17e-articleLarge.jpg,2022-02-10T14:25:37+0000,"BRISTOL, England — The opening shot of the new HBO Max limited series “The Girl Before” planes over the silvery, slatted-timber facade of a house, then moves into its gorgeously minimal interior. Tall cathedral windows let in muted light; a stone table and wooden chairs stand like art objects framed by smooth concrete and glass walls.",the-new-york-times,The New York Times
By David W. Chen,The N.F.L.’s About-Face on Sports Gambling,The league has partnerships with several companies and casinos and a record number of bets are expected to be placed on the Super Bowl. That would have been unlikely years ago given its stance.,https://www.nytimes.com/2022/02/10/sports/nfl-bets-gambling.html,https://static01.nyt.com/images/2022/02/10/sports/10sb-sports-betting1/merlin_194335317_efcaf149-56ac-4141-8971-0924b84df5fa-articleLarge.jpg,2022-02-10T23:20:33+0000,"During a 2012 deposition, a lawyer for the N.F.L. argued that the league was adamantly opposed to sports gambling because it would “negatively impact our long-term relationship with our fans, negatively impact the perception of our sport across the country.”",the-new-york-times,The New York Times
By Charles M. Blow,Why a New Show About Teachers Is a Sensation,"The new sitcom, which celebrates teachers, comes as the profession is under attack.",https://www.nytimes.com/2022/02/09/opinion/abbott-elementary-teachers.html,https://static01.nyt.com/images/2022/02/09/opinion/09blow1/09blow1-articleLarge.jpg,2022-02-10T01:02:06+0000,"My mother has worked in the school system since I was in preschool. For most of that time she was a teacher. When she retired, she ran for the school board and won. She is now serving her third term. She’ll be 80 years old in November.",the-new-york-times,The New York Times
By Raphael Minder,A New Look for ‘Ulysses’,"Eduardo Arroyo, a Spanish artist who died in 2018, provided drawings, watercolors and collages for an illustrated edition of the James Joyce novel.",https://www.nytimes.com/2022/02/10/books/ulysses-james-joyce-illustrated.html,https://static01.nyt.com/images/2022/02/11/books/10ulysses10/10ulysses10-articleLarge.jpg,2022-02-10T10:00:19+0000,MADRID — James Joyce once said that he hoped his groundbreaking and famously challenging novel “Ulysses” would “keep the professors busy for centuries arguing over what I meant.”,the-new-york-times,The New York Times
By Jonathan Wolfe,Coronavirus Briefing: The School Unmasking Debate,"Without a statewide requirement, it’s up to individual school districts to set their own mask rules.",https://www.nytimes.com/2022/02/10/briefing/coronavirus-briefing-schools-masks-canada-poland.html,https://static01.nyt.com/images/2020/07/21/us/cases_orphan_usa-1595349567192-copy/cases_orphan_usa-1595349567192-articleLarge-v1185.png,2022-02-10T22:40:05+0000,"Now that Democratic states like Connecticut, Massachusetts and New Jersey are lifting their mandates, schools in liberal-leaning communities are being forced to decide: When should the masks come off?",the-new-york-times,The New York Times
By Bret Stephens,"When Did ‘Me,’ ‘We’ and ‘Us’ Become the Media’s Preferred Pronouns?",John Vinocur’s career was a rebuke to what his profession risks becoming.,https://www.nytimes.com/2022/02/09/opinion/jeff-zucker-media-vinocur.html,https://static01.nyt.com/images/2022/02/09/opinion/09stephens1a/09stephens1a-articleLarge.jpg,2022-02-10T00:00:07+0000,"Over drinks not long ago, a friend summed up the way journalism had changed over the course of his career. “Journalists used to act like cynics but at heart we were idealists,” he said. “Now we’re often cynics masquerading as idealists.”",the-new-york-times,The New York Times
By Ben Sisario,Sting Sells His Songwriting Catalog for an Estimated $300 Million,"The deal with Universal Music covers his entire output as a songwriter, including solo work and hits by the Police like “Every Breath You Take.”",https://www.nytimes.com/2022/02/10/arts/music/sting-sells-catalog-universal.html,https://static01.nyt.com/images/2022/02/10/multimedia/10sting-item/10sting-item-articleLarge.jpg,2022-02-10T14:00:26+0000,"Sting has sold his songwriting catalog, including hits with the Police like “Every Breath You Take” and “Every Little Thing She Does Is Magic,” and solo work like “If You Love Somebody Set Them Free,” to the Universal Music Group, in music’s latest blockbuster catalog deal.",the-new-york-times,The New York Times
By Blake Hounshell and Leah Askarinam,You Can Be Mitch McConnell for a Day,A new video game will let players pretend to be the politicians they most admire — or despise.,https://www.nytimes.com/2022/02/09/us/politics/video-game-political-arena.html,https://static01.nyt.com/images/2022/02/09/us/politics/09onpolitics-newsletter-pm/09onpolitics-newsletter-pm-articleLarge.jpg,2022-02-10T00:00:05+0000,Politics is serious business. It often feels existential. Exhausting. Infuriating. Bone-dry. Confusing.,the-new-york-times,The New York Times
By Gal Beckerman,Radical Ideas Need Quiet Spaces,Visibility is one thing. Actually mustering the power to fundamentally rearrange society — that is something else.,https://www.nytimes.com/2022/02/10/opinion/radical-ideas-need-quiet-spaces.html,https://static01.nyt.com/images/2022/02/10/opinion/sunday/10beckerman/10beckerman-articleLarge.jpg,2022-02-10T11:07:50+0000,Consider the Black Lives Matter lawn sign.,the-new-york-times,The New York Times
By Soyica Diggs Colbert,The Creators of ‘On Sugarland’ Build a Site of Mourning and Repair,Ritual and healing are at the center of Whitney White and Aleshea Harris’s new play about a Black community that loses its members to a perpetual war.,https://www.nytimes.com/2022/02/10/theater/on-sugarland-whitney-white-aleshea-harris.html,https://static01.nyt.com/images/2022/02/11/arts/10SUGARLAND1/merlin_201776379_eab5b2f1-182d-4a6a-8a3c-e41dbf528009-articleLarge.jpg,2022-02-10T19:50:51+0000,"In the mobile home-lined cul-de-sac at the center of the new play “On Sugarland,” grief is pervasive. A memorial of dog tags, boots and other personal items of fallen soldiers sits center stage, a reminder of a community’s losses. Daily rituals, from services with singing, dancing and shouting to a boy shaving his father’s chin, move mourning from expressions of sorrow to utterances and activities that keep the dead in communion with the residents.",the-new-york-times,The New York Times
By Whet Moser,"Trump, Inflation, Olympics: Your Thursday Evening Briefing",Here’s what you need to know at the end of the day.,https://www.nytimes.com/2022/02/10/briefing/trump-inflation-olympics.html,https://static01.nyt.com/images/2022/02/10/multimedia/10evening-PROMO/10evening-calls-01-articleLarge.jpg,2022-02-10T22:43:20+0000,(Want to get this newsletter in your inbox? Here’s the sign-up.) ,the-new-york-times,The New York Times
By Annie Murphy Paul,"She Wasn’t on PCP, but Her Own Body Made Her Hallucinate","In “A Molecule Away From Madness,” Sara Manning Peskin explains how neurological aberrations can kill.",https://www.nytimes.com/2022/02/10/books/review/a-molecule-away-from-madness-sara-manning-peskin.html,https://static01.nyt.com/images/2022/03/08/books/review/08PAUL/08PAUL-articleLarge.jpg,2022-02-10T10:00:04+0000,A MOLECULE AWAY FROM MADNESS Tales of the Hijacked Brain By Sara Manning Peskin,the-new-york-times,The New York Times
By Matina Stevis-Gridneff,Inflation in Europe is expected to peak early this year.,The European Commission predicted that higher energy prices and the rising costs of some goods would push first-quarter inflation to 4.8 percent.,https://www.nytimes.com/2022/02/10/business/europe-inflation.html,https://static01.nyt.com/images/2022/02/10/multimedia/10economy-briefing-eu-econforecast/10economy-briefing-eu-econforecast-articleLarge.jpg,2022-02-10T11:06:23+0000,"Inflation in countries using the euro, which has soared to record heights in recent months, is expected to peak in the first quarter of this year, the European Commission said on Thursday, as consumers feel the bite of higher energy prices and rising costs of key goods.",the-new-york-times,The New York Times
,9 New Books We Recommend This Week,Suggested reading from critics and editors at The New York Times.,https://www.nytimes.com/2022/02/10/books/review/9-new-books-we-recommend-this-week.html,https://static01.nyt.com/images/2022/02/10/books/10RecBooks/10RecBooks-articleLarge.jpg,2022-02-10T19:28:19+0000,"We bring you poetry this week — namely, Chelsea B. DesAutels’s debut collection, “A Dangerous Place” — along with a bounty of fiction, representing the past (in Meg Waite Clayton’s “The Postmistress of Paris”), the present (in novels by Jennifer Haigh, Weike Wang and Charmaine Wilkerson) and the future (in Tochi Onyebuchi’s “Goliath”). In nonfiction, we recommend a book about games and two about Chinese culture. Happy reading.",the-new-york-times,The New York Times
By Ben Kenigsberg,‘The Unmaking of a College’ Review: School’s Out Forever?,"This documentary tells the story of a liberal-arts college that faced an existential crisis, and of how students fought back against the way potentially drastic decisions were made.",https://www.nytimes.com/2022/02/10/movies/the-unmaking-of-a-college-review.html,https://static01.nyt.com/images/2022/02/09/arts/unmaking1/merlin_201361557_01602eaf-e055-43de-a0b2-679dfe35b7b8-articleLarge.jpg,2022-02-10T12:00:04+0000,"“The Unmaking of a College” presents Hampshire College in Massachusetts as a canary in the coal mine of liberal-arts education. As a young college (its first students entered in 1970), it has a smaller endowment and fewer decades’ worth of alumni donors than its competitors. That leaves it vulnerable to demographic shifts like a declining college-age population, a problem for small colleges nationwide.",the-new-york-times,The New York Times
By Linda Qiu,Explaining the Claim That the Biden Administration Is Funding ‘Crack Pipes’,Conservatives have homed in on a specific provision in an overdose prevention grant program to make a misleading claim about crack pipes.,https://www.nytimes.com/2022/02/10/us/politics/biden-crack-pipes-claim.html,https://static01.nyt.com/images/2022/02/10/us/politics/10dc-explainer-1/merlin_201730185_debb20f0-7515-4b98-a02a-4229868e5c43-articleLarge.jpg,2022-02-10T23:50:14+0000,WASHINGTON — Republican lawmakers and conservative news outlets have accused the Biden administration of planning to give out pipes for smoking crack cocaine.,the-new-york-times,The New York Times
By Siddhant Adlakha,Hear Lata Mangeshkar in These Four Streaming Films,"Because Mangeshkar lent her voice to several generations of Bollywood stars, these movies double as a highlight reel for Hindi cinema.",https://www.nytimes.com/2022/02/10/movies/lata-mangeshkar-four-films-to-stream.html,https://static01.nyt.com/images/2022/02/09/arts/09mangeshkar-streaming1/09mangeshkar-streaming1-articleLarge.jpg,2022-02-10T16:05:14+0000,They called her the Queen of Melody.,the-new-york-times,The New York Times
By Annabelle Williams,"Patricia Moreno, Spiritual Fitness Leader, Dies at 57",Ms. Moreno’s intenSati program helped bring positive psychology into the exercise world.,https://www.nytimes.com/2022/02/10/health/patricia-moreno-dead.html,https://static01.nyt.com/images/2022/02/11/obituaries/02Moreno-print1/merlin_201219018_b2abf0e3-3627-4af1-b200-218e3cff39cf-articleLarge.jpg,2022-02-10T21:12:46+0000,"Patricia Moreno, who injected a dose of spirituality into the world of fitness and created a popular exercise program called intenSati, which became a staple at some Equinox gyms and a presence on YouTube, died on Jan. 22 at her home in Los Angeles. She was 57.",the-new-york-times,The New York Times
By Jesus Jiménez,"Bob Saget Died After Hitting His Head, Family Says","The comedian and former “Full House” star accidentally hit his head on something and then went to sleep, they said.",https://www.nytimes.com/2022/02/09/us/bob-saget-cause-of-death-head-trauma.html,https://static01.nyt.com/images/2022/03/09/world/09xp-saget-sub/merlin_196253001_b37dfad8-2d93-43e3-bc3d-d6c82b021f19-articleLarge.jpg,2022-02-10T00:53:03+0000,"Bob Saget, the stand-up comedian and actor known for playing Danny Tanner on “Full House,” died of head trauma after he accidentally hit something, his family said in a statement on Wednesday.",the-new-york-times,The New York Times
By Catrin Einhorn,Wolves Will Regain Federal Protection in Much of the U.S.,A federal judge has overturned the Trump-era decision that removed the predators from the endangered species list.,https://www.nytimes.com/2022/02/10/climate/wolves-endangered-species-list.html,https://static01.nyt.com/images/2022/02/10/climate/10cli-wolves/10cli-wolves-articleLarge.jpg,2022-02-10T20:43:20+0000,Gray wolves will regain federal protection across most of the lower 48 United States following a court ruling Thursday that struck down a Trump administration decision to take the animals off the endangered species list.,the-new-york-times,The New York Times
By Jay Caspian Kang,The Anti-C.R.T. Movement and a Vision For a New Right Wing,A conversation with the Manhattan Institute’s Reihan Salam.,https://www.nytimes.com/2022/02/10/opinion/anti-crt-politics.html,https://static01.nyt.com/images/2022/02/10/opinion/10kang-image/10kang-image-articleLarge.jpg,2022-02-10T18:00:04+0000,"It’s become fashionable on the left to think of the American political right as a thicket of vaguely defined ideologies funded, in large part, by shadowy billionaires who want to overthrow democracy. This may very well be true, but what’s changed over the past decade or so is that it’s become a lot easier to track the lineage of right-wing thought. The shadows, mostly, have been lifted.",the-new-york-times,The New York Times
By Kate Conger,Twitter’s mixed fourth quarter shows its challenges ahead.,The company has ambitious targets for growth in the next two years.,https://www.nytimes.com/2022/02/10/technology/twitter-earnings-4q-2021.html,https://static01.nyt.com/images/2022/02/10/business/10economy-briefing-twitter/merlin_190779429_8c1d0fe3-d979-44d9-98ed-beade7184809-articleLarge.jpg,2022-02-10T12:01:06+0000,"Last year, Twitter executives set ambitious goals for their company, with hopes of attracting more than 100 million new users and doubling revenue by 2023. The last three months of 2021, however, showed the challenges the company must overcome before it can hit its objectives.",the-new-york-times,The New York Times
By Christoph Koettl,New satellite images show more Russian forces massing on three sides of Ukraine.,"The Russian buildup includes more forces in Crimea, western Russia and Belarus, adding to fears that Russia could invade Ukraine.",https://www.nytimes.com/2022/02/10/world/europe/russia-ukraine-forces.html,https://static01.nyt.com/images/2022/02/10/video/10ukrainebriefing-sat-new-top/10ukrainebriefing-sat-new-top-articleLarge.jpg,2022-02-10T21:50:52+0000,"Satellite images collected on Wednesday and Thursday reveal new deployment and positioning of Russian military equipment and troops in multiple locations around Ukraine, including Crimea, western Russia and Belarus, adding to an already ominous buildup that has fueled invasion fears.",the-new-york-times,The New York Times
By C. J. Hughes,Homes for Sale in Brooklyn and Manhattan,"This week’s properties are in Midwood, Morningside Heights and the Sutton Place area.",https://www.nytimes.com/2022/02/10/realestate/housing-market-nyc.html,https://static01.nyt.com/images/2022/02/13/realestate/10otm-nyc-slide-HO6I/10otm-nyc-slide-HO6I-articleLarge.jpg,2022-02-10T14:00:45+0000,Click on the slide show to see this week’s featured properties:,the-new-york-times,The New York Times
By Alanis Thames,The Can’t-Miss Kid: Bengals’ Rookie Kicker Aims for Perfection,"Evan McPherson has attempted 12 field goals in the N.F.L. postseason and made each one, including the overtime winner at Kansas City that put Cincinnati in the Super Bowl.",https://www.nytimes.com/2022/02/10/sports/football/bengals-kicker-evan-mcpherson.html,https://static01.nyt.com/images/2022/02/10/sports/10sb-kick-mcpherson/merlin_201109446_bf56685f-0980-41fa-aff1-aba9916301e3-articleLarge.jpg,2022-02-10T16:00:10+0000,"The confidence of the Cincinnati Bengals stretches further than their spunky quarterback and their griddy-ing, yard-guzzling rookie wide receiver.",the-new-york-times,The New York Times
By Brad Plumer,How Billions in Infrastructure Funding Could Worsen Global Warming,"Highway expansions tend to bring more greenhouse gas emissions. A few states are trying to change that dynamic, but it won’t be easy.",https://www.nytimes.com/2022/02/10/climate/highways-climate-change-traffic.html,https://static01.nyt.com/images/2022/02/08/climate/08cli-highways1/merlin_189986454_72d0fa39-4ae9-449f-9fcd-33830e0a1ab6-articleLarge.jpg,2022-02-10T10:00:19+0000,"The highways in Colorado, one of the nation’s fastest-growing states, are frequently clogged with suburban workers driving into Denver, skiers heading high into the Rocky Mountains and trucks rumbling across the Interstates.",the-new-york-times,The New York Times
By Matthew Futterman,"Mikaela Shiffrin finishes her first race of these Olympics, the super-G.","Although she didn’t medal, she said she felt “much more optimistic.”",https://www.nytimes.com/2022/02/10/sports/olympics/mikaela-shiffrin-super-g.html,https://static01.nyt.com/images/2022/02/10/sports/olympics/doug-mills-beijing-olympics-336/doug-mills-beijing-olympics-336-articleLarge.jpg,2022-02-10T23:24:38+0000,"It has been a long time since a ninth place finish felt like a triumph for Mikaela Shiffrin, but there she was, at the finish area of the super-G Friday afternoon, speaking as though she had truly won something.",the-new-york-times,The New York Times
,"Corrections: Feb. 10, 2022","Corrections that appeared in print on Thursday, Feb. 10, 2022.",https://www.nytimes.com/2022/02/09/pageoneplus/corrections-feb-10-2022.html,,2022-02-10T00:57:23+0000,"An article on Wednesday about the dropping of mask mandates by Democratic governors misattributed a quotation about being photographed without a mask at an N.F.L. playoff game. It was Eric Garcetti, the mayor of Los Angeles, who said he held his breath during a photo, not Gov. Gavin Newsom of California.",the-new-york-times,The New York Times
,Why Olga Tokarczuk Likes to Read T.S. Eliot in Translation,"“It’s fascinating to read poetry in its original form, but it’s just as fascinating to read it in a variety of translations. Suddenly the same text takes on new dimensions, as if it were growing in new directions.”",https://www.nytimes.com/2022/02/10/books/review/olga-tokarczuk-by-the-book-interview.html,https://static01.nyt.com/images/2022/02/13/books/review/13BYTHEBOOK-OLGATOKARCZUK/13BYTHEBOOK-OLGATOKARCZUK-articleLarge.jpg,2022-02-10T10:00:02+0000,"“It’s fascinating to read poetry in its original form,” says the Nobel laureate Olga Tokarczuk, whose latest novel in English is “The Books of Jacob,” “but it’s just as fascinating to read it in a variety of translations. Suddenly the same text takes on new dimensions, as if it were growing in new directions.”",the-new-york-times,The New York Times
