author,title,description,url,urlToImage,publishedAt,content,source.id,source.name
By The Associated Press,"Newsom Says California Has the Capacity to Treat 50,000 Virus Patients","On Wednesday, Gov. Gavin Newsom of California said he had been working with healthcare officials to ensure the state did not get overwhelmed with the increase in coronavirus hospitalizations over the past few weeks.",https://www.nytimes.com/video/us/100000007230381/newsom-says-california-has-capacity-to-treat-50000-covid-patients.html,https://static01.nyt.com/images/2020/07/08/autossell/08virus-newsom/08virus-newsom-articleLarge.png,2020-07-09T00:14:46+0000,"On Wednesday, Gov. Gavin Newsom of California said he had been working with healthcare officials to ensure the state did not get overwhelmed with the increase in coronavirus hospitalizations over the past few weeks.",the-new-york-times,The New York Times
,The Very Sweet Way Sarah Broom’s Mother Showed Her Love With Books,“My mother used to buy me any and every book with the word ‘Sarah’ in the title.”,https://www.nytimes.com/2020/07/09/books/review/sarah-broom-by-the-book-interview.html,https://static01.nyt.com/images/2020/07/12/books/review/12ByTheBook/12ByTheBook-articleLarge.jpg,2020-07-09T09:00:08+0000,"“My mother used to buy me any and every book with the word ‘Sarah’ in the title,” says the author, whose 2019 memoir “The Yellow House” is now out in paperback.",the-new-york-times,The New York Times
By Elisabeth Egan,"Elin Hilderbrand Will See You Now, From a Safe Distance",Coronavirus can’t keep this prolific author from her fans.,https://www.nytimes.com/2020/07/09/books/review/28-summers-elin-hilderbrand.html,https://static01.nyt.com/images/2020/07/19/books/review/19insidethelist-web/28insidethelist--print-articleLarge.jpg,2020-07-09T09:00:07+0000," TOUR DE FORCE Surely there are writers across the land reading aloud from new books at intimate, socially distanced backyard gatherings, but Elin Hilderbrand appears to be the summer’s only best-selling author to preside over in-person public events. To date, she has signed copies of “28 Summers” at four independent stores — Bethany Beach Books and Browseabout Books on the Delaware coast, Books & Greetings in Northvale, N.J., and Warwick’s in La Jolla, Calif.",the-new-york-times,The New York Times
By Jeff Wilser,"Teletherapy, Popular in the Pandemic, May Outlast It",Some therapists find that remote therapy is so convenient to their patients that they will continue with it.,https://www.nytimes.com/2020/07/09/well/mind/teletherapy-mental-health-coronavirus.html,https://static01.nyt.com/images/2020/06/30/smarter-living/00well-teletherapy/00well-teletherapy-articleLarge.jpg,2020-07-09T09:00:10+0000,"The 10-year-old girl was afraid that her American Girl dolls — buried in the bedroom closet — would come alive and attack her. As the girl pointed her iPad at the scary closet door in a remote therapy session, her therapist, Daniela Owen, was able to coach her in real-time to conquer the fear of the dolls.",the-new-york-times,The New York Times
By Steve Eder and Ben Protess,Where’s Trump’s Financial Disclosure? The White House Blames the Pandemic,"The annual report was due last week under federal ethics rules, but the White House says it needs more time. The president was already given a 45-day extension.",https://www.nytimes.com/2020/07/08/us/politics/trump-financial-disclosure.html,https://static01.nyt.com/images/2020/07/08/multimedia/08trump-finances/merlin_172863891_cbf7f8bc-5520-4a9f-8a4f-74cc57837b49-articleLarge.jpg,2020-07-09T00:41:59+0000,"President Trump’s annual financial disclosure report was due to be released more than a week ago. But the filing, the only official public document detailing his personal finances, was not published, and neither the White House nor federal ethics officials offered a public explanation.",the-new-york-times,The New York Times
By Anthony Tommasini,"James Harrison, Music Professor and Piano Lover, Dies at 84",Mr. Harrison was a longtime teacher of music theory and a dean of fine arts and humanities at Hunter College in New York City. He has died of complications of Covid-19.,https://www.nytimes.com/2020/07/09/obituaries/james-harrison-dead-coronavirus.html,https://static01.nyt.com/images/2020/07/08/obituaries/08Harrison/merlin_174324882_1594cc8c-0a13-4cac-be3c-e84cfd2dd756-articleLarge.jpg,2020-07-09T13:53:23+0000,This obituary is part of a series about people who have died in the coronavirus pandemic. Read about others here.,the-new-york-times,The New York Times
By Reuters,Melania Trump Statue Removed After Being Set on Fire,A structure made of wood resembling Melania Trump was set on fire near her hometown in Slovenia last weekend.,https://www.nytimes.com/video/us/100000007231708/melania-trump-statue-removed-after-being-set-on-fire.html,https://static01.nyt.com/images/2020/07/09/world/09melania-statue01/merlin_157547895_b026df30-eb9f-44f5-b9e4-4ff291b1176d-articleLarge.jpg,2020-07-09T19:07:55+0000,A structure made of wood resembling Melania Trump was set on fire near her hometown in Slovenia last weekend.,the-new-york-times,The New York Times
,Is Trump’s Fate Sealed?,Is this the end of Trump? What about schools?,https://www.nytimes.com/2020/07/09/opinion/is-trumps-fate-sealed.html,,2020-07-09T09:00:09+0000,Listen and subscribe to our podcast from your mobile device:,the-new-york-times,The New York Times
By Pete Wells and Karsten Moran,Outdoor Dining Offers Fresh Air and Fantasy to a City That Needs Both,New York City’s sidewalks and streets have sprouted oases that evoke destinations from the Greek isles to the New Jersey Turnpike.,https://www.nytimes.com/2020/07/09/dining/outdoor-dining-design-nyc-coronavirus.html,https://static01.nyt.com/images/2020/07/08/dining/08NYOUTDOOR-DESIGN-brasa1/08NYOUTDOOR-DESIGN-brasa1-articleLarge.jpg,2020-07-09T12:53:34+0000,"A new design genre was born last month when New York City began allowing restaurants, which had been closed for on-premises dining since March, to take over miles of sidewalks and streets for outdoor seating. Traditionally, the city’s sidewalk cafes tended to be dull to look at, crowded rows of tables hemmed in by plain metal railings. The new ones are more expressive. Governed by two emergency programs meant to let restaurants earn some money until indoor dining can resume, these structures follow a set of rules for keeping the public safe from the coronavirus and, when the seating is placed in parking spaces, from passing cars. Within and around these rules, however, creativity blossomed.",the-new-york-times,The New York Times
By Joe Coscarelli,5 Arrested in Connection With Pop Smoke Killing,"The Los Angeles Police Department said it had taken three adult men and two minors into custody on Thursday, following the February shooting of the rising rap star in the Hollywood Hills.",https://www.nytimes.com/2020/07/09/arts/music/pop-smoke-arrests.html,https://static01.nyt.com/images/2020/07/09/arts/09POPSMOKEARRESTS/merlin_169178568_d2dea846-49d4-4746-9a57-c62197c4bfe1-articleLarge.jpg,2020-07-09T17:27:39+0000,"Five people, including three adult men and two minors, were arrested early Thursday in connection with the February killing of Pop Smoke, a rising New York rapper, the Los Angeles Police Department announced. No additional information about the arrests or potential charges was provided by the department, which has been investigating the case for months.",the-new-york-times,The New York Times
By Jonathan Wolfe,Coronavirus Briefing: What Happened Today,"There are signs the death rate, which had stayed relatively low during the current surge, is starting to climb.",https://www.nytimes.com/2020/07/09/us/coronavirus-briefing-what-happened-today.html,https://static01.nyt.com/images/2020/07/09/us/oakImage-1594329365020/oakImage-1594329365020-articleLarge.png,2020-07-09T23:09:31+0000,"The coronavirus is reaching terrifying new levels in the United States. The country set another record for new coronavirus cases yesterday, with more than 59,400 infections — the fifth such record in nine days. As of Tuesday, the U.S. had recorded more than three million cases in total.",the-new-york-times,The New York Times
By Charles M. Blow,Call a Thing a Thing,"White supremacy is the biggest racial problem this country faces, and has faced.",https://www.nytimes.com/2020/07/08/opinion/racism-united-states.html,https://static01.nyt.com/images/2020/07/08/opinion/08blow1/merlin_173707008_ffe177c8-ba1a-49e8-bbdf-2aaff62665ff-articleLarge.jpg,2020-07-09T00:59:44+0000,"Now that we are deep into protests over racism, inequality and police brutality — protests that I’ve come to see as a revisiting of Freedom Summer —  it is clear that Donald Trump sees the activation of white nationalism and anti-otherness as his path to re-election. We are engaged in yet another national conversation about race and racism, privilege and oppression.",the-new-york-times,The New York Times
,Trump Calls Supreme Court Ruling a ‘Political Witch Hunt’,"President Trump said that a Supreme Court ruling on Thursday, which would allow prosecutors in New York to seek his financial records, was a “hoax.”",https://www.nytimes.com/video/us/100000007232275/trump-calls-supreme-court-ruling-a-political-witch-hunt.html,https://static01.nyt.com/images/2020/07/09/autossell/09dc-trump-scotus2/09dc-trump-scotus2-articleLarge.png,2020-07-09T23:15:57+0000,"President Trump said that a Supreme Court ruling on Thursday, which would allow prosecutors in New York to seek his financial records, was a “hoax.”",the-new-york-times,The New York Times
By Charlie Warzel,When a Critic Met Facebook: ‘What They’re Doing Is Gaslighting’,"“I think Facebook’s heart is in the right place sometimes. But their heart doesn’t make decisions inside the corporation.""",https://www.nytimes.com/2020/07/09/opinion/facebook-civil-rights-robinson.html,https://static01.nyt.com/images/2020/07/09/opinion/09Warzel/09Warzel-articleLarge.jpg,2020-07-09T09:00:12+0000,"Facebook’s long-awaited civil rights audit is now public and it isn’t flattering. The 100-plus-page report laid bare many of the issues facing the platform — that Facebook does not fully understand how its algorithms drive hate, that anti-Muslim speech is “rampant,” that Facebook’s reforms never fix the problem — and warned the company may “driving people toward self-reinforcing echo chambers of extremism.”",the-new-york-times,The New York Times
By William Baude,"Conservatives, Don’t Give Up on Your Principles or the Supreme Court","Some are turning away from a founding idea, originalism.",https://www.nytimes.com/2020/07/09/opinion/supreme-court-originalism-conservatism.html,https://static01.nyt.com/images/2020/07/09/opinion/09Baude/09Baude-articleLarge.jpg,2020-07-09T23:00:09+0000,"For decades, originalists — many of them conservatives — have argued that courts should interpret the Constitution and other law in keeping with its original meaning. And their views have gained power. Both of President Trump’s appointments to the Supreme Court — Neil Gorsuch and Brett Kavanaugh — have described themselves as originalists, leading many to hope or fear that they would form a conservative majority with Chief Justice John Roberts, Justice Clarence Thomas and Justice Samuel Alito.",the-new-york-times,The New York Times
By Abdi Latif Dahir,Used Clothes Ban May Crimp Kenyan Style. It May Also Lift Local Design.,"Kenya has halted imports of secondhand clothes to prevent the spread of the coronavirus. The move limits fashion selection, but opens doors for the country’s designers and manufacturers.",https://www.nytimes.com/2020/07/09/world/africa/kenya-secondhand-clothes-ban-coronavirus.html,https://static01.nyt.com/images/2020/06/23/world/00kenya-secondhandclothes/merlin_173817324_41b339dd-bbe3-4313-9858-2b5febeae51b-articleLarge.jpg,2020-07-09T07:00:17+0000,"NAIROBI, Kenya — Catherine Muringo’s wardrobe consists of secondhand outfits shipped from all over the world: colorful blouses and jeans from Canada, floral dresses from the United States, trench coats from Australia and leather handbags from the United Kingdom.",the-new-york-times,The New York Times
By Mark Honigsbaum,How Does Anything Go Viral?,"In “The Rules of Contagion” the scientist Adam Kucharski turns to the nonbiological to understand the common features of a virus, whether physical or virtual.",https://www.nytimes.com/2020/07/09/books/review/adam-kucharski-the-rules-of-contagion.html,https://static01.nyt.com/images/2020/07/05/books/review/05Honigsbaum/05Honigsbaum-articleLarge.jpg,2020-07-09T17:08:35+0000,THE RULES OF CONTAGIONWhy Things Spread — and Why They StopBy Adam Kucharski,the-new-york-times,The New York Times
By Scott Cacciola,"As N.B.A. Forges Ahead, LeBron James Is ‘Ready for This Moment’","Much has changed around the league since it shut down in March. But James’s focus on winning has not wavered, his Lakers teammates say, with a shot at a title.",https://www.nytimes.com/2020/07/09/sports/basketball/lakers-nba-restart-lebron-james.html,https://static01.nyt.com/images/2020/07/08/sports/08lakers1/merlin_170210910_cdaea1d9-fcfd-4c91-ac57-1bdcae9b17bd-articleLarge.jpg,2020-07-09T07:00:10+0000,"LOS ANGELES — As N.B.A. teams migrate to Florida for the N.B.A.’s scheduled restart later this month, players have expressed a range of concerns.",the-new-york-times,The New York Times
,Watch All of Paris Fashion Week Online,"From Paris today, it’s Rick Owens, Dries Van Noten, Louis Vuitton, Ungaro and more!",https://www.nytimes.com/2020/07/09/fashion/paris-mens-fashion-week-videos.html,https://static01.nyt.com/images/2020/07/09/fashion/oakImage-1594349482600/oakImage-1594349482600-articleLarge.png,2020-07-09T04:01:03+0000,What was once Paris Men’s Fashion Week is now everyone’s fashion week. Good! It is also fully a digital fashion week — so you’re invited to the proverbial front row seat on your phone or computer. Each video will go live in its show time. Be patient!,the-new-york-times,The New York Times
By Michael Kolomatsky,"At Home, With a Long List of Needed Repairs","How are people paying for the renovations that they can’t ignore any longer? Often, by borrowing.",https://www.nytimes.com/2020/07/09/realestate/at-home-with-a-long-list-of-needed-repairs.html,https://static01.nyt.com/images/2020/07/02/realestate/02-calculator-1593459338897/02-calculator-1593459338897-articleLarge.png,2020-07-09T13:00:15+0000,"While we’re stuck inside during the pandemic, it’s easy to find things that need improvement at home — from emergency repairs to ugly kitchens. So it’s little surprise that many Americans are taking on renovation projects. First quarter 2020 sales were up 7.1 percent at Home Depot and 11.2 percent at Lowe’s compared with the first quarter of 2019. Interest in our own articles about organizing, D.I.Y. renovation and interior design also attests to the trend.",the-new-york-times,The New York Times
By Melina Delkic,"India’s Outbreak, Seoul Mayor, Short Stories: Your Friday Briefing",Here’s what you need to know.,https://www.nytimes.com/2020/07/09/briefing/india-outbreak-seoul-mayor-south-korea.html,https://static01.nyt.com/images/2020/07/06/world/00cairo-dispatch1-asiabriefing-promo/merlin_174278163_69dce3c2-fb1e-4853-b995-058c120abf84-articleLarge.jpg,2020-07-09T18:56:26+0000,(Want to get this briefing by email? Here’s the sign-up.),the-new-york-times,The New York Times
By Ted Loos,A Swiss Dada Pioneer Finally Gets Her Spotlight,"Sophie Taeuber-Arp did it all: Installations, textiles, costumes, abstract art. Nearly 80 years after her death, an online gallery show commemorates her talent (and a major museum exhibition is coming).",https://www.nytimes.com/2020/07/09/arts/design/sophie-taeuber-arp-exhibition.html,https://static01.nyt.com/images/2020/07/10/arts/09ARP1/merlin_173441115_df55f847-3f2a-4785-9981-e1c95bc2af8c-articleLarge.jpg,2020-07-09T16:29:27+0000,"In 1937, the Swiss artist Sophie Taeuber-Arp wrote a letter to a friend, noting her exclusion from an avant-garde exhibition in Paris. While a male Belgian artist in her circle was refused entry too, “as a woman it is ten times harder to hold your position in this caldron.”",the-new-york-times,The New York Times
By Kristen Yoonsoo Kim,‘Tito’ Review: An Oddball Character Study,The filmmaker and actor Grace Glowicki steps into a gender-bending role in an experimental indie that muddles its moral lesson on sexual predation.,https://www.nytimes.com/2020/07/09/movies/tito-review.html,https://static01.nyt.com/images/2020/07/09/arts/09tito1/09tito1-articleLarge.jpg,2020-07-09T11:00:10+0000,"Looking like a cross between Crispin Glover and PJ Harvey, the perpetually hunched-over, often furrow-browed Tito skulks around in fear with a red emergency whistle around his neck. His employment and source of trauma both remain vague. The Canadian director-actor-writer Grace Glowicki plays the title role in her debut feature, gender-bending as a male character with sideburns and baggy clothes. Tito’s reclusive, reticent mannerisms probably would have been a bizarre protrusion during its festival run; now, they feel like universally recognizable quarantine behavior.",the-new-york-times,The New York Times
By Ben Kenigsberg,"‘Bloody Nose, Empty Pockets’ Review: Over Drinks, a Blurry Line Between Truth and Fiction",Bill and Turner Ross’s portrayal of a group of barflies tests the boundaries of documentary filmmaking.,https://www.nytimes.com/2020/07/09/movies/bloody-nose-empty-pockets-review.html,https://static01.nyt.com/images/2020/07/10/arts/09bloodynose-art/merlin_174157650_0229b4b7-983d-4d4e-ad53-47570be287f5-articleLarge.jpg,2020-07-09T11:00:09+0000,"Early in “Bloody Nose, Empty Pockets,” one of the barflies who populates the film talks about working as an actor. “I wanted the truth of every line,” he says. But when he realized that truth was elusive, he says, “I started going after beauty.”",the-new-york-times,The New York Times
By Teo Bugbee,‘The Tobacconist’ Review: Playing Dress-Up in 1930s Vienna,"A coming-of-age drama with attractive cinematography and production design, but no political or philosophical weight.",https://www.nytimes.com/2020/07/09/movies/the-tobacconist-review.html,https://static01.nyt.com/images/2020/07/09/arts/09tobacconist/merlin_174159465_d8409f82-eca4-4a76-993b-42df97562158-articleLarge.jpg,2020-07-09T11:00:11+0000,"The coming-of-age costume drama “The Tobacconist” is set in Vienna during the rise of Nazism, leading up to the German occupation of Austria. But despite taking place during one of the most traumatic periods of modern civilization, the movie itself feels like little more than an amusing trifle, a chance to play dress up with some of history’s most famous figures.",the-new-york-times,The New York Times
By Jonathan Wolfe,Coronavirus Briefing: What Happened Today,"There are signs the death rate, which had stayed relatively low during the current surge, is starting to climb.",https://www.nytimes.com/2020/07/09/us/coronavirus-briefing-what-happened-today.html,https://static01.nyt.com/images/2020/07/09/us/oakImage-1594329365020/oakImage-1594329365020-articleLarge.png,2020-07-09T23:09:31+0000,"The coronavirus is reaching terrifying new levels in the United States. The country set another record for new coronavirus cases yesterday, with more than 59,400 infections — the fifth such record in nine days. As of Tuesday, the U.S. had recorded more than three million cases in total.",the-new-york-times,The New York Times
By Charles M. Blow,Call a Thing a Thing,"White supremacy is the biggest racial problem this country faces, and has faced.",https://www.nytimes.com/2020/07/08/opinion/racism-united-states.html,https://static01.nyt.com/images/2020/07/08/opinion/08blow1/merlin_173707008_ffe177c8-ba1a-49e8-bbdf-2aaff62665ff-articleLarge.jpg,2020-07-09T00:59:44+0000,"Now that we are deep into protests over racism, inequality and police brutality — protests that I’ve come to see as a revisiting of Freedom Summer —  it is clear that Donald Trump sees the activation of white nationalism and anti-otherness as his path to re-election. We are engaged in yet another national conversation about race and racism, privilege and oppression.",the-new-york-times,The New York Times
,Trump Calls Supreme Court Ruling a ‘Political Witch Hunt’,"President Trump said that a Supreme Court ruling on Thursday, which would allow prosecutors in New York to seek his financial records, was a “hoax.”",https://www.nytimes.com/video/us/100000007232275/trump-calls-supreme-court-ruling-a-political-witch-hunt.html,https://static01.nyt.com/images/2020/07/09/autossell/09dc-trump-scotus2/09dc-trump-scotus2-articleLarge.png,2020-07-09T23:15:57+0000,"President Trump said that a Supreme Court ruling on Thursday, which would allow prosecutors in New York to seek his financial records, was a “hoax.”",the-new-york-times,The New York Times
By Charlie Warzel,When a Critic Met Facebook: ‘What They’re Doing Is Gaslighting’,"“I think Facebook’s heart is in the right place sometimes. But their heart doesn’t make decisions inside the corporation.""",https://www.nytimes.com/2020/07/09/opinion/facebook-civil-rights-robinson.html,https://static01.nyt.com/images/2020/07/09/opinion/09Warzel/09Warzel-articleLarge.jpg,2020-07-09T09:00:12+0000,"Facebook’s long-awaited civil rights audit is now public and it isn’t flattering. The 100-plus-page report laid bare many of the issues facing the platform — that Facebook does not fully understand how its algorithms drive hate, that anti-Muslim speech is “rampant,” that Facebook’s reforms never fix the problem — and warned the company may “driving people toward self-reinforcing echo chambers of extremism.”",the-new-york-times,The New York Times
By William Baude,"Conservatives, Don’t Give Up on Your Principles or the Supreme Court","Some are turning away from a founding idea, originalism.",https://www.nytimes.com/2020/07/09/opinion/supreme-court-originalism-conservatism.html,https://static01.nyt.com/images/2020/07/09/opinion/09Baude/09Baude-articleLarge.jpg,2020-07-09T23:00:09+0000,"For decades, originalists — many of them conservatives — have argued that courts should interpret the Constitution and other law in keeping with its original meaning. And their views have gained power. Both of President Trump’s appointments to the Supreme Court — Neil Gorsuch and Brett Kavanaugh — have described themselves as originalists, leading many to hope or fear that they would form a conservative majority with Chief Justice John Roberts, Justice Clarence Thomas and Justice Samuel Alito.",the-new-york-times,The New York Times
By Sarah Miller,Would You Like to Come Over for Dinner … in 10 Years?,Because that’s when I think I may be ready to entertain again.,https://www.nytimes.com/2020/07/09/style/coronavirus-backyard-entertaining.html,https://static01.nyt.com/images/2020/07/12/fashion/04FirstPerson-Entertaining-art/04FirstPerson-Entertaining-art-articleLarge.jpg,2020-07-09T09:00:07+0000,"I like people. I sort of like cooking. Historically, this has all added up to an interest in entertaining that would not be called passionate but could certainly pass for healthy.",the-new-york-times,The New York Times
By Richard Sandomir,"Ola Mae Spinks, Who Helped Preserve a Slave Archive, Dies at 106","In 1972, she and another librarian went to the Library of Congress to bring order to a sprawling collection of interviews with former politicians.",https://www.nytimes.com/2020/07/09/obituaries/ola-mae-spinks-who-helped-preserve-a-politician-archive-dies-at-106.html,https://static01.nyt.com/images/2020/07/10/obituaries/09Spinks1-print/merlin_174384564_00760a0e-b18e-43af-a33c-7db8733feb6a-articleLarge.jpg,2020-07-09T21:34:38+0000,"Ola Mae Spinks, a librarian and descendant of politicians who went to the Library of Congress in 1972 to bring order to a vast but scattered archive of interviews with former politicians, thus helping to preserve them for scholars, died on June 16 at her home in Southfield, Mich. She was 106.",the-new-york-times,The New York Times
By Charlie Savage and Eric Schmitt,Congress Presses Military Leaders on Suspected Russian Bounties,Two House hearings grappled with a C.I.A. assessment that Russia offered payments to kill American troops in Afghanistan — and White House inaction on the months-old judgment.,https://www.nytimes.com/2020/07/09/us/politics/congress-russian-bounties.html,https://static01.nyt.com/images/2020/07/09/us/politics/09dc-intel/09dc-intel-articleLarge.jpg,2020-07-09T23:41:07+0000,"WASHINGTON — The top American military officer delivered the Pentagon’s strongest public expression of concern to date on Thursday about the C.I.A.’s assessment that Russia offered bounties to Afghan militants for killing American troops, even as former top intelligence and military leaders questioned the Trump administration’s inaction.",the-new-york-times,The New York Times
