author,title,description,url,urlToImage,publishedAt,content,source.id,source.name
By Jessica Testa,Fashion Is Getting an Inclusion Rider,Coming soon to the catwalks: a contractual diversity pledge already adopted by some in Hollywood.,https://www.nytimes.com/2022/02/10/style/diversity-fashion.html,https://static01.nyt.com/images/2022/02/10/fashion/10RIDER1/merlin_196971810_7bc4acbd-ec75-44ae-ab92-0eebaf885f52-articleLarge.jpg,2022-02-10T08:00:12+0000,"In 2018, the actress Frances McDormand gave an acerbic Oscars acceptance speech in which she celebrated “hooligans and anarchists” and “feminist mothers,” but also ended on a two-word suggestion to her Hollywood peers, with no further explanation: “inclusion rider.”",the-new-york-times,The New York Times
By Benjamin Mueller,‘Don’t Write It Off’: Advice From Brain Injury Experts After Bob Saget’s Death,People who find themselves alone after a significant knock to the head are at higher risk of harm.,https://www.nytimes.com/2022/02/10/health/bob-saget-brain-injury.html,https://static01.nyt.com/images/2022/02/10/science/10saget-brain/10saget-brain-articleLarge.jpg,2022-02-10T23:04:46+0000,"It appeared to be an ordinary fall: Bob Saget, the actor and comedian, knocked his head on something and, perhaps thinking nothing of it, went to sleep, his family said on Wednesday.",the-new-york-times,The New York Times
By Rachel Nuwer,Lion and Leopard Injuries From Humans Are Recorded in Tooth and Bone,"A study shows that even in a country that is considered a bastion of conservation, many big cats were severely wounded in encounters with human snare traps and shotguns.",https://www.nytimes.com/2022/02/10/science/lions-teeth-bones-injuries.html,https://static01.nyt.com/images/2022/02/10/science/10sci-bigcat-injuries1/merlin_201654639_419e3a00-19bc-4359-a21a-0b4fdfbc489c-articleLarge.jpg,2022-02-10T16:13:03+0000,"Paula White, a wildlife biologist, was examining lion skulls to estimate the animals’ ages when she noticed something strange about their teeth. Instead of just showing the normal, gradual wear that happens over time, a sharp, V-shaped notch was cut into the back edge of some of the big cats’ canines.",the-new-york-times,The New York Times
By Elisabetta Povoledo,2 Americans Convicted of Killing an Italian Officer Appeal Life Sentences,"Lawyers for Finnegan Elder and Gabriel Natale Hjorth, who received Italy’s toughest punishment for a 2019 fatal stabbing, hope to prove that their clients did not deserve such long terms.",https://www.nytimes.com/2022/02/10/world/europe/italy-finnegan-elder-gabriel-natale-hjorth-appeal.html,https://static01.nyt.com/images/2022/02/10/world/10italy-trial/merlin_187309851_e966b859-6bb9-4e1e-9c52-d2692f4f2545-articleLarge.jpg,2022-02-10T16:24:56+0000,"ROME — In the early hours of a summer morning in Rome in 2019, two American teenagers had a brief scuffle on a dark street corner with a pair of police officers. The encounter lasted less than a minute, but one of the officers was stabbed 11 times and left fatally wounded.",the-new-york-times,The New York Times
By The Learning Network,"What’s Going On in This Graph? | Feb. 16, 2022",How has the pandemic affected the wedding business?,https://www.nytimes.com/2022/02/10/learning/whats-going-on-in-this-graph-feb-16-2022.html,https://static01.nyt.com/images/2022/02/10/learning/WeddingsGraphLN/WeddingsGraphLN-articleLarge-v2.png,2022-02-10T18:54:01+0000,This graph shows the annual number of weddings since 1970 and a projection for the coming three years.,the-new-york-times,The New York Times
By Carl Zimmer,Did the ‘Black Death’ Really Kill Half of Europe? New Research Says No.,"Looking at ancient deposits of pollen as markers of agricultural activity, researchers found that the Black Death caused a patchwork of destruction in Europe.",https://www.nytimes.com/2022/02/10/science/black-death.html,https://static01.nyt.com/images/2022/02/15/science/10SCI-blackdeath1/10SCI-blackdeath1-articleLarge.jpg,2022-02-10T16:00:08+0000,"In the mid-1300s, a species of bacteria spread by fleas and rats swept across Asia and Europe, causing deadly cases of bubonic plague. The “Black Death” is one of the most notorious pandemics in historical memory, with many experts estimating that it killed roughly 50 million Europeans, the majority of people across the continent.",the-new-york-times,The New York Times
By Katharine Q. Seelye and Constant Méheut,"Marie-Claire Chevalier, Catalyst for French Abortion Law, Dies at 66","While in high school in 1972, she was raped and became pregnant. Her illegal abortion paved the way for France to decriminalize the procedure in 1975.",https://www.nytimes.com/2022/02/10/world/europe/marie-claire-chevalier-dead.html,https://static01.nyt.com/images/2022/02/08/obituaries/08Chevalier1/merlin_175028664_de6bef5e-182c-4bc2-892e-1e725bdb7e25-articleLarge.jpg,2022-02-10T19:14:55+0000,"Marie-Claire Chevalier was 16 when she was raped by a high school classmate and became pregnant. She then had an abortion, which was illegal at the time unless the woman’s life was in danger.",the-new-york-times,The New York Times
By Annie Karni,Congress Approves Bill to Nullify Forced Arbitration in Sex Abuse Cases,"Senate passage was the latest evidence that Democrats, fresh off a string of legislative failures on their broader domestic agenda, are focusing on narrower measures with bipartisan support.",https://www.nytimes.com/2022/02/10/us/politics/senate-bill-forced-arbitration-sexual-harassment-assault.html,,2022-02-10T19:26:40+0000,"WASHINGTON — Congress approved bipartisan legislation on Thursday barring the use of forced arbitration to address sexual assault and harassment claims in the workplace, sending President Biden a measure aimed at ending a secretive practice often used to shield perpetrators from full and public accountability.",the-new-york-times,The New York Times
By Vanessa Friedman,Streetwear Is Dead,Long live fashion. They are actually one and the same.,https://www.nytimes.com/2022/02/10/style/streetwear-virgil-abloh-balenciaga.html,https://static01.nyt.com/images/2022/02/10/fashion/10STREET1/merlin_195698943_5207bec6-2f6b-40ef-8fae-3d05f5dd7e0c-articleLarge.jpg,2022-02-10T08:00:10+0000,"In late 2019, Virgil Abloh, the boundary-smashing designer who died last year, gave an interview to Dazed in which he declared the end of streetwear.",the-new-york-times,The New York Times
By The Editorial Board,The Ottawa Trucker Protests Are a Test of Democracy,Peaceful protest is a necessary release valve for pandemic fatigue and frustration.,https://www.nytimes.com/2022/02/10/opinion/ottawa-trucker-protests.html,https://static01.nyt.com/images/2022/02/10/opinion/10ottawa1/10ottawa1-articleLarge.jpg,2022-02-10T21:12:53+0000,"By the standards of mass protests around the world, the “Freedom Convoy” snarling Downtown Ottawa ranks as a nuisance. The number of protesters, about 8,000 at their peak, is modest; there have been no serious injuries or altercations, the truckers stopped blaring their horns after residents got a temporary court injunction against them, and most Canadians support neither the truckers nor their cause. Yet what’s happening in Canada deserves close attention in the United States and across the world.",the-new-york-times,The New York Times
By Sopan Deb and Tania Ganguli,Nets’ James Harden Traded to Sixers for Ben Simmons,Harden has been with the Nets since January 2021. Simmons has not played in Philadelphia this season for personal reasons.,https://www.nytimes.com/2022/02/10/sports/basketball/james-harden-trade-ben-simmons-sixers.html,https://static01.nyt.com/images/2022/02/10/sports/10nba-harden-trade-lede/merlin_201202212_013d0702-d9fe-4ddc-a4aa-50f6f4a376b9-articleLarge.jpg,2022-02-10T22:36:08+0000,"The Nets traded James Harden, a former Most Valuable Player Award winner, to the Philadelphia 76ers on Thursday for a package centered on Ben Simmons, the three-time All-Star point guard who has not played this season for personal reasons.",the-new-york-times,The New York Times
By Michael Levenson and Anemona Hartocollis,Colleagues Who Backed Harvard Professor Retract Support Amid Harassment Claims,The retraction came after three female graduate students filed a lawsuit accusing the university of ignoring allegations that an anthropology professor had sexually harassed students for years.,https://www.nytimes.com/2022/02/09/us/harvard-sexual-harassment-letter.html,https://static01.nyt.com/images/2022/02/09/multimedia/09xp-harvard-photo/09xp-harvard-photo-articleLarge.jpg,2022-02-10T04:28:19+0000,"Nearly all of the 38 Harvard professors who signed an open letter defending the character of a colleague who has been accused of sexually harassing students reversed themselves on Wednesday, issuing a new letter titled, “We Retract.”",the-new-york-times,The New York Times
By Roger Cohen,"European leaders say they seek peace, and warn Russia of retaliation for any aggression against Ukraine.","After days of intense diplomacy over the Ukraine crisis, the leaders of France, Germany and Poland said this week that their overriding goal was the preservation of peace in Europe, but warned Russia of dire consequences if it launched further incursions into Ukraine.",https://www.nytimes.com/2022/02/10/world/europe/european-leaders-say-they-seek-peace-and-warn-russia-of-retaliation-for-any-aggression-against-ukraine.html,,2022-02-10T10:01:07+0000,"After days of intense diplomacy over the Ukraine crisis, the leaders of France, Germany and Poland said this week that their overriding goal was the preservation of peace in Europe, but warned Russia of dire consequences if it launched further incursions into Ukraine.",the-new-york-times,The New York Times
By Andrew E. Kramer,Armed Nationalists in Ukraine Pose a Threat Not Just to Russia,Kyiv is encouraging the arming of nationalist paramilitary groups to thwart a Russian invasion. But they could also destabilize the government if it agrees to a peace deal they reject.,https://www.nytimes.com/2022/02/10/world/europe/ukraine-nationalism-russia-invasion.html,https://static01.nyt.com/images/2022/02/10/world/10ukraine-nationalists/merlin_201804351_b3469e89-2e4a-4885-ab05-63f77f62e9f9-articleLarge.jpg,2022-02-10T21:24:18+0000,"KYIV, Ukraine — The Ukrainian political activist and militia member sat before his party’s flag leaving little doubt about his readiness for action. The flag depicted two axes crossed against a field of red.",the-new-york-times,The New York Times
By Vivian Yee and Mohammed Abdusamee,Libya Slides Deeper Into Chaos as Parliament Picks New Government,"The current prime minister, Abdul Hamid Dbeiba, rejected Parliament’s decision, raising concerns that the oil-rich African nation was returning to a divide with two rival governments.",https://www.nytimes.com/2022/02/10/world/middleeast/libya-tripoli-parliament-election.html,https://static01.nyt.com/images/2022/02/10/world/10Libya/merlin_201792504_c009962a-9220-4096-86e8-bb2c2c775f99-articleLarge.jpg,2022-02-10T21:48:34+0000,CAIRO — Libya hurtled deeper into political chaos on Thursday when its Parliament voted to install a new interim government over the objections of the current prime minister.,the-new-york-times,The New York Times
By Joey Roulette,What Is Starship? SpaceX Builds Its Next-Generation Rocket,"The giant, gleaming spacecraft is being designed to carry NASA astronauts to the moon, as well as the dreams of Elon Musk’s space company.",https://www.nytimes.com/article/elon-musk-starship.html,https://static01.nyt.com/images/2022/02/10/science/10sci-starship1/10sci-starship1-articleLarge.jpg,2022-02-10T17:38:07+0000,"NASA wants to use it to land American astronauts on the moon. The Pentagon wants to use it to whisk military cargo around the world in minutes. Astronomers, satellite companies and aspiring space tourists are eyeing its potential to drastically slash the cost of getting to space. Elon Musk says it is “the holy grail of space technology” and sees it as crucial to his ultimate goal of colonizing Mars.",the-new-york-times,The New York Times
By Nicole Daniels,What Does Love Feel Like to You?,"Do you feel most loved when showered in grand gestures and commitments? Or do you most experience love through smaller, everyday acts of care?",https://www.nytimes.com/2022/02/10/learning/what-does-love-feel-like-to-you.html,https://static01.nyt.com/images/2022/02/06/magazine/06mag-poem/06mag-poem-articleLarge-v2.jpg,2022-02-10T12:47:20+0000,"Have you ever been in love? What different kinds of love have you experienced — romantic, platonic or familial? Is love something that you enjoy dreaming about or talking about with friends or family members? Or do you think that you’re still learning what love is and how it can feel?",the-new-york-times,The New York Times
By Matthew Futterman,"Mikaela Shiffrin, Always Steady on Her Skis, Has Lost Her Footing","For the second time in three days at the Games, Shiffrin skied off course early in the race. The experience is shaking the two-time gold medalist to her core as she gets ready for the super-G.",https://www.nytimes.com/2022/02/10/sports/olympics/mikaela-shiffrin-olympics-disqualification.html,https://static01.nyt.com/images/2022/02/09/sports/olympics/09oly-shiffrin-pullback/09oly-shiffrin-pullback-articleLarge.jpg,2022-02-10T05:01:07+0000,Follow our latest coverage of the 2022 Winter Olympics.,the-new-york-times,The New York Times
By Polina Barskova and Victoria Chang,Poem: A Sunny Morning in the Square,"In this poem, a Polish city is filled with ghosts of Jews who are still trying to speak, warning us about the perils of war and inhumanity. ",https://www.nytimes.com/2022/02/10/magazine/poem-a-sunny-morning-in-the-square.html,https://static01.nyt.com/images/2022/02/13/magazine/13mag-poem/13mag-poem-articleLarge-v2.jpg,2022-02-10T10:00:05+0000,"This poem in translation is about the deportation of Jews from the town of Bialystok, Poland. It aptly captures the destabilized and paradoxical nature of memory and history. Bialystok at once “grows silent and speaks” and is “stocked with soldiers in the amount of one.” Even the poem’s title describes the morning as “Sunny” while the first line foretells the killing: “My half-baked flesh.” In this poem, Bialystok is filled with ghosts who are still trying to speak, warning us about the perils of war and inhumanity. We just need to hear and listen to the past. Selected by Victoria Chang",the-new-york-times,The New York Times
By Farhad Manjoo,Facebook Has an Innovation Problem,We’re seeing the limits of Facebook’s strategy to buy or copy other people’s best ideas.,https://www.nytimes.com/2022/02/10/opinion/facebook-stock-meta-innovation.html,,2022-02-10T10:00:19+0000,"There has been no shortage of explanations for the sudden, spectacular swoon in Facebook’s stock value last week. Meta, Facebook’s parent company, said in an earnings report that its user growth had stalled. Young people, its most valuable demographic, keep spending time on TikTok, the irresistible short-video app that has become Facebook’s most formidable competitor in years.",the-new-york-times,The New York Times
By Sarah Weinman,Anne Simpson Thought She Knew Her Husband. She Didn’t.,"In Paul Vidich’s elegant new spy novel, “The Matchmaker,” an American translator living in Berlin grapples with some difficult truths.",https://www.nytimes.com/2022/02/10/books/review/new-crime-and-mystery-novels.html,https://static01.nyt.com/images/2022/02/13/books/review/13CRIME/13CRIME-articleLarge.jpg,2022-02-10T10:00:05+0000,"Anne Simpson is learning her marriage isn’t as good as she thought. An American translator living and working in West Berlin in the weeks before the wall falls in 1989, she believes she and her East German husband “had found the happiness that was possible between a man and a woman of different backgrounds and different languages — an earned love.” But his disappearance, which opens Paul Vidich’s newest spy novel, THE MATCHMAKER: A Spy in Berlin (Pegasus Crime, 262 pp., $25.95), brings both the C.I.A. and West German intelligence to her doorstep, upending everything she thought she knew about her husband of two years.",the-new-york-times,The New York Times
By Rebecca Davis O'Brien,2 Men Sentenced in Sex-Trafficking Ring That Preyed on Teenage Girls,Five members of a family-run operation trafficked girls between Mexico and Queens and pushed them into prostitution.,https://www.nytimes.com/2022/02/10/nyregion/sex-trafficking-queens-mexico.html,https://static01.nyt.com/images/2022/02/10/nyregion/SEX-TRAFFICKING/SEX-TRAFFICKING-articleLarge.jpg,2022-02-10T23:39:29+0000,"Delia was 13 when she started dating Francisco Melendez-Perez, a 16-year-old she met in a park in Mexico. She thought that he was handsome and nice, and that he would bring stability and love to her life.",the-new-york-times,The New York Times
By The Learning Network,Royal Dining,"Tell us a story, real or made up, that is inspired by this image.",https://www.nytimes.com/2022/02/10/learning/royal-dining.html,https://static01.nyt.com/images/2017/08/22/science/22BREAKFAST/22BREAKFAST-articleLarge-v2.jpg,2022-02-10T10:00:06+0000,"Use your imagination to write the opening of a short story or poem inspired by this photo — or, tell us about a memory from your own life that this image makes you think of.",the-new-york-times,The New York Times
By Stephen Castle,Boris Johnson warns that the Ukraine crisis is reaching a perilous moment.,"Britain said it was readying 1,000 more troops to support NATO allies in case of a humanitarian crisis caused by Russian aggression against Ukraine.",https://www.nytimes.com/2022/02/10/world/europe/boris-johnson-ukraine-crisis.html,,2022-02-10T12:09:35+0000,"Emphasizing Britain’s “immovable” commitment to NATO, Prime Minister Boris Johnson on Thursday pledged more military support for the alliance and said he thought that Russia had not yet decided whether to invade Ukraine, but warned that the most perilous moment of the crisis was fast approaching.",the-new-york-times,The New York Times
By Mike Ives,"‘Contactless’ Humanitarian Aid Has Its Perks, and Pitfalls",Covid-era travel restrictions have mostly prevented expatriate aid workers from flying into Pacific island nations after natural disasters. The results are mixed.,https://www.nytimes.com/2022/02/10/world/asia/tonga-aid-tsunami-volcano.html,https://static01.nyt.com/images/2022/02/10/world/10tonga-aid-01/10tonga-aid-01-articleLarge.jpg,2022-02-10T10:58:02+0000,"In pre-Covid times, the Red Cross would have flown in foreign specialists to help a remote island nation like Tonga recover from a natural disaster.",the-new-york-times,The New York Times
By Mark Landler,"Upheaval in Northern Ireland, With Brexit at Its Center","A dispute over trading checks has left the main pro-British party in disarray, creating the potential for a momentous political shift.",https://www.nytimes.com/2022/02/10/world/europe/northern-ireland-brexit.html,https://static01.nyt.com/images/2022/02/10/world/10nireland01/merlin_188819532_e89b0909-6f9c-4a94-b0ec-09ae5f1fa209-articleLarge.jpg,2022-02-10T13:38:16+0000,"BELFAST, Northern Ireland — Michelle O’Neill was forced to greet visitors this week in a drab upstairs meeting room at the rear of the Stormont Parliament Buildings in Belfast, its faded posters and scattered chairs a stark contrast to the classical grandeur of the chambers at the front of the complex.",the-new-york-times,The New York Times
By Tejal Rao,Recipes That Know How to Party,"You don’t have to love Buffalo wings to love spicy, snackable finger food.",https://www.nytimes.com/2022/02/10/dining/vegetarian-super-bowl-recipes.html,https://static01.nyt.com/images/2021/10/26/dining/kc-nashville-style-hot-tofu-sliders-copy/kc-nashville-style-hot-tofu-sliders-articleLarge.jpg,2022-02-10T18:00:05+0000,"One of the things I miss most about my prepandemic eating habits is the casual intimacy of sharing food. I don’t just mean passing things around, but eating them with my hands: tearing from the same big piece of injera, or scooping the same bowl of curry with sticky rice.",the-new-york-times,The New York Times
By Jeremy W. Peters,Sarah Palin says her suit against The Times made her a ‘David’ vs. a ‘Goliath’,The former governor of Alaska claims that The Times acted recklessly in writing and publishing an editorial in 2017 that incorrectly linked a mass shooting in Arizona to her political rhetoric.,https://www.nytimes.com/2022/02/10/business/media/sarah-palin-nyt-libel-case.html,https://static01.nyt.com/images/2022/02/10/multimedia/10palin-trial/10palin-trial-articleLarge.jpg,2022-02-10T10:01:43+0000,"Sarah Palin, the former governor of Alaska who has receded from the public eye since being Senator John McCain’s running mate in 2008 and a hero to many conservatives who hoped she might one day run for president herself, took the stand on Thursday in her libel trial against The New York Times and reprised her once familiar role as an unforgiving critic of the mainstream media.",the-new-york-times,The New York Times
By Catherine Porter,‘This Is Not My City’: Protesters Turn a Quiet Capital Upside Down,"The Ottawa protesters are giddy with their sense of collective purpose. But local residents see the demonstration as an unruly, disrespectful and even dangerous occupation.",https://www.nytimes.com/2022/02/10/world/canada/ottawa-truckers-protest.html,https://static01.nyt.com/images/2022/02/09/world/09ottawa-dispatch-2/merlin_201722940_1f61210d-41f1-4689-8eda-0b7c1a4d1ef7-articleLarge.jpg,2022-02-10T08:00:13+0000,OTTAWA — Canada’s most important — and most notoriously boring — city has found itself stuck in a never-ending tailgate party.,the-new-york-times,The New York Times
By J. Hoberman,‘Romance’: But What Does She Really Want?,"Long out of distribution, Catherine Breillat’s 1999 film returns, newly restored, as the centerpiece of a retrospective on the filmmaker at the IFC Center.",https://www.nytimes.com/2022/02/10/arts/romance-catherine-breillat-ifc.html,https://static01.nyt.com/images/2022/02/11/arts/11REWIND/11REWIND-articleLarge.jpg,2022-02-10T16:24:44+0000,"Sixteen years before “50 Shades of Grey” normalized the spectacle of female masochism onscreen, Catherine Breillat’s “Romance” pushed buttons. Breillat, the self-proclaimed “pariah of French cinema,” has said she designed her film as a “war machine against censorship” — although, as it was inspired by a bold speech on artistic freedom and women’s rights she delivered in Iran in 1997, a better term might be jihad.",the-new-york-times,The New York Times
By Madeleine Ngo,"Angry Customers, More Work and Longer Hours Strain Pharmacists","Pharmacists and technicians, who have played a critical role in administering Covid-19 tests and vaccines, say they are burned out nearly two years into the pandemic.",https://www.nytimes.com/2022/02/10/us/politics/pharmacists-strain-covid.html,https://static01.nyt.com/images/2022/02/10/us/politics/00dc-pharmacies-1/merlin_201167187_631eb055-0781-4940-a52d-c6f5eabb4881-articleLarge.jpg,2022-02-10T10:00:07+0000,"WASHINGTON — Ken O’Shea spent eight years working in retail pharmacies, first as a technician and then as a pharmacist. He liked working on the front lines and seeing his patients get better over time.",the-new-york-times,The New York Times
By Kurt Streeter and Carlos Gonzalez,"In Inglewood, Optimism and Anxiety Neighbor Super Bowl Stadium","The southwestern Los Angeles County city has been jolted by the economic promise of SoFi Stadium, the site of Super Bowl LVI. Its residents described their changing neighborhood to our columnist.",https://www.nytimes.com/2022/02/10/sports/football/where-is-the-super-bowl-2022.html,https://static01.nyt.com/images/2022/02/09/sports/09streeter-sot-stadium/merlin_201576264_10d5395f-66e0-47b5-91fe-b74611772d80-articleLarge.jpg,2022-02-10T05:01:10+0000,"INGLEWOOD, Calif. — Greg and Terry Dulan cannot wait for the Super Bowl.",the-new-york-times,The New York Times
By Thomas Fuller,Deaf Football Players Forge a Path to the Super Bowl,"After a record-breaking season, four players from the California School for the Deaf, Riverside, were invited to Sunday’s game as honorary captains.",https://www.nytimes.com/2022/02/10/us/super-bowl-honorary-captains-school-deaf-riverside.html,https://static01.nyt.com/images/2022/02/10/multimedia/10california-briefing-promo/10california-briefing-csdr-articleLarge.jpg,2022-02-10T13:42:11+0000,"Minutes before the Super Bowl gets underway on Sunday, four high school students from Riverside will be standing on the field in the glare of the national spotlight.",the-new-york-times,The New York Times
By Steven Kurutz,Too Young to Feel So Old,"After nearly two years spent in a computer crouch, my favorite sweater and I have gone fuzzy.",https://www.nytimes.com/2022/02/10/style/self-care/covid-pandemic-aging.html,https://static01.nyt.com/images/2022/02/10/fashion/0FEELING-OLD1/0FEELING-OLD1-articleLarge.jpg,2022-02-10T15:29:50+0000,I was 43 when the pandemic began. I am now 60.,the-new-york-times,The New York Times
By Jeanna Smialek,Inflation probably climbed at fastest pace in four decades in January.,Consumer Price Index data released on Thursday could show the biggest annual price increase since early 1982.,https://www.nytimes.com/2022/02/10/business/economy/inflation-expectations.html,https://static01.nyt.com/images/2022/02/10/business/10dc-inflation01/merlin_201716304_c3d912ce-6ccf-4ce6-947c-fa14287613be-articleLarge.jpg,2022-02-10T10:01:43+0000,A key inflation measure set for release Thursday morning is expected to show that prices continued to climb at the fastest pace in 40 years.,the-new-york-times,The New York Times
