author,title,description,url,urlToImage,publishedAt,content,source.id,source.name
By Concepción de León,‘Minamata’ Review: A Crisis Slowly Revealed,"In Andrew Levitas’s newest film, Johnny Depp portrays a real-life photojournalist who helped expose an ecological disaster in 1970s Japan.",https://www.nytimes.com/2022/02/10/arts/minamata-review.html,https://static01.nyt.com/images/2022/02/10/arts/10minamata-art/10minamata-art-articleLarge.jpg,2022-02-10T12:00:06+0000,"Despite being the central character, Johnny Depp is the least interesting part of “Minamata,” Andrew Levitas’s film based on the true story of the photojournalist W. Eugene Smith who, in the 1970s, helped to expose the devastating impact of mercury poisoning on coastal communities in Japan.",the-new-york-times,The New York Times
"By Lucy King, Adam Westbrook and Jonah M. Kessel",See the True Cost of Your Cheap Chicken,Modern poultry farming keeps chicken cheap but steals the dignity of both animal and farmer.,https://www.nytimes.com/2022/02/10/opinion/factory-farming-chicken.html,https://static01.nyt.com/images/2021/07/26/autossell/AG_2b/AG_2b-articleLarge.jpg,2022-02-10T10:00:08+0000,“We’re Cooked” is an Opinion Video series about our broken food system and the three chances you get to help fix it — and save the planet — every day.,the-new-york-times,The New York Times
,5 Things to Do This Weekend,Our critics and writers have selected noteworthy cultural events to experience virtually and in person in New York City.,https://www.nytimes.com/2022/02/10/arts/things-to-do-this-weekend.html,https://static01.nyt.com/images/2022/02/11/arts/10wkd-arts-roundup2/merlin_201716109_d2f1826a-885d-46ca-a7fd-33c128fa892b-articleLarge.jpg,2022-02-10T10:00:14+0000,"Flying Lotus’s headlining performance at Carnegie Hall marks a new level of mainstream acclaim for a beat maker who came up through Los Angeles’s hip-hop underground. It’s a career first, but not a family first: FlyLo (whose real name is Steven Ellison) is, after all, the grandnephew of John and Alice Coltrane.",the-new-york-times,The New York Times
By Mimi Vu,"In Hokkaido, Rich History and Tranquil Bathhouses","Where to stay, eat and explore on the northern Japanese island.",https://www.nytimes.com/2022/02/10/t-magazine/hokkaido-japan-travel-hotels.html,https://static01.nyt.com/images/2022/02/08/t-magazine/08tmag-notc-slide-SOUB/08tmag-notc-slide-SOUB-articleLarge.jpg,2022-02-10T13:00:07+0000,"Long admired for its snow-blanketed peaks, glacier blue lakes and bubbling volcanic hot springs, the northern Japanese island of Hokkaido has in recent years also become a thriving cultural destination, enticing visitors with its local cuisine (the region produces some of the country’s finest seafood, beef, cheese, kombu and whisky), onsen resorts and efforts to honor the heritage of its Indigenous Ainu people. The most recent hotel addition, Hoshino Resorts’ KAI Poroto, which opened last month, is located on Hokkaido’s southwestern coast near the new Upopoy National Ainu Museum and Park. Guests of the ryokan hotel — which consists of 42 rooms that each look out onto Lake Poroto (poroto ko means “big lake” in the Ainu language) — can spend the day immersing themselves in Hokkaido’s Indigenous history through the museum’s various exhibitions, before returning to the resort for a dip at either of the two bathhouses — one of which features a ketunni (or “tripod-frame”) design — with their alkaline waters rich in humic and fulvic acids. For travelers hoping for a sportier trip, head northwest a couple of hours to Niseko and book a stay at Raku Suisan, an intimate ryokan at the foot of four of the town’s famed ski resorts. With views of Mount Yotei and Mount Annupuri, each of the hotel’s 18 rooms offers a private open-air hot-spring bath. Meanwhile, the private onsen baths at Grand Blissen Hotel in Jozankei, just an hour outside the city of Sapporo, overlook the surrounding Shikotsu-Toya National Park, a popular hiking destination. To refuel, head to downtown Sapporo, where you’ll find local urban fare at Sapporo Tsunagu Yokocho, an indoor market consisting of 15 izakaya-style restaurants that offer everything from sushi to fried octopus balls.",the-new-york-times,The New York Times
By Niraj Chokshi,"California sues Tesla, saying the company permitted racial discrimination at its factory.",The suit comes months after a jury awarded a former Black employee at the electric carmaker’s San Francisco-area factory $137 million.,https://www.nytimes.com/2022/02/10/technology/tesla-racial-discrimination-california-suit.html,https://static01.nyt.com/images/2022/02/10/business/10tesla-lawsuit-01/merlin_195854652_45caae9b-e0fe-4556-9225-65bd089f2fcf-articleLarge.jpg,2022-02-10T21:42:03+0000,"A California state agency is suing Tesla, accusing it of allowing racial discrimination and harassment to flourish at its San Francisco Bay Area factory in a lawsuit that was made public on Thursday.",the-new-york-times,The New York Times
By Jeanna Smialek and Madeleine Ngo,Rapid Inflation Stokes Unease From Wall Street to Washington,"Consumer Price Index data showed prices climbing faster than expected, picking up across a broad array of goods and services.",https://www.nytimes.com/2022/02/10/business/economy/inflation-cpi-january-2022.html,https://static01.nyt.com/images/2022/02/10/business/10dc-inflation01/merlin_201716304_c3d912ce-6ccf-4ce6-947c-fa14287613be-articleLarge.jpg,2022-02-10T13:36:15+0000,"A key inflation measure released on Thursday showed that prices are climbing at the fastest pace in 40 years and broadening to touch nearly every corner of the American economy, heightening the risk that they will stay elevated for longer and that policymakers may have to react more aggressively.",the-new-york-times,The New York Times
By Emily Lordi,The Radical Experimentation of Black Psychedelia,One of the most lasting and influential artistic movements of the 20th century was created with and for Black artists. Why has their contribution been so overlooked?,https://www.nytimes.com/2022/02/10/t-magazine/black-psychedelia.html,https://static01.nyt.com/images/2022/02/10/t-magazine/10tmag-psychedelia-slide-6QTA-copy/10tmag-psychedelia-slide-6QTA-copy-articleLarge.jpg,2022-02-10T12:00:32+0000,"IN DECEMBER OF 1968, the TV show host Ed Sullivan introduced the group Sly and the Family Stone onto his stage. An ensemble of seven Black and white men and women in sequined blazers, platinum wigs and vinyl vests, they played a rapid-fire medley of their most affirming hits: “Everyday People,” “Dance to the Music,” “Sing a Simple Song,” “I Want to Take You Higher.” They had just released their third studio album, “Life” (1968), and everyone looks excited, although Sly Stone alone appears confident that the whole thing will come off. We see why when he leaves the organ and heads out into the studio audience with his sister Rose: After her solo, he performs a dance routine drawn from Africa, patting juba. “We look like we just landed in a spaceship from Venus,” the group’s original drummer, Greg Errico, tells me of the clip. Men in the audience are wearing suits that “weren’t even cool suits — they look like accountants.” Before heading back to the stage, Stone finds what may have been the one Black man in the crowd and slaps him five. If the group couldn’t make any more time for themselves (hence their pack-it-all-in medley), they could make a little more space and, for a moment, paint it Black.",the-new-york-times,The New York Times
By Rob Tannenbaum,How Hip-Hop Inched Its Way to the Super Bowl Halftime Stage,"At Sunday’s game, Dr. Dre, Snoop Dogg and Kendrick Lamar will lead the first-ever halftime performance with rap at its center. The genre has taken a roundabout path to get there.",https://www.nytimes.com/2022/02/10/arts/music/super-bowl-halftime-hip-hop.html,https://static01.nyt.com/images/2022/02/11/arts/09HALFTIME-WALKUP-COMBO-1/09HALFTIME-WALKUP-COMBO-1-articleLarge.jpg,2022-02-10T15:43:04+0000,"On Sunday at SoFi Stadium in Inglewood, Calif., the Super Bowl halftime show will feature the local rap heroes Dr. Dre, Snoop Dogg and Kendrick Lamar, placing hip-hop firmly at the center of the annual spectacle, which is routinely watched by more than 100 million people, for the first time.",the-new-york-times,The New York Times
By Giulia Heyward,Nevada abruptly drops its statewide mask mandate.,"Schools and private businesses can still set their own mask rules, Gov. Steve Sisolak said on Thursday.",https://www.nytimes.com/2022/02/10/us/nevada-mask-mandate.html,,2022-02-10T20:14:39+0000,"Nevada’s governor announced on Thursday that the state was dropping its statewide mask mandate, “effective immediately,” the latest in a parade of states governed by Democrats to loosen restrictions.",the-new-york-times,The New York Times
By ‘Sway',The Sandy Hook Father Who Refused to Let Alex Jones Win,"Conspiracy theories have loomed over the school shooting in which his son, Noah, died. Leonard Pozner reflects on how the truth can triumph online.",https://www.nytimes.com/2022/02/10/opinion/sway-kara-swisher-leonard-pozner.html,https://static01.nyt.com/images/2022/02/10/opinion/10sway-pozner-image/10sway-pozner-image-articleLarge.png,2022-02-10T10:00:07+0000,"From the big lie to Bill Gates’s supposed Covid vaccine microchips, the internet loves a conspiracy theory. In this conversation, Kara Swisher revisits one that is almost a decade old: that Sandy Hook was a hoax. After a shooter at Sandy Hook Elementary School killed 26 people, including Noah Pozner, his father, Leonard Pozner, began seeing online musings that the tragedy was a production of crisis actors and part of a scheme to attack Second Amendment rights. The conspiracies were rampant on Facebook pages, Twitter feeds, WordPress blogs and YouTube videos — and they were amplified in particular by the far-right broadcaster and conspiracist Alex Jones on his media outlet Infowars.",the-new-york-times,The New York Times
By Reid J. Epstein and Michael S. Schmidt,Archives Found Possible Classified Material in Boxes Returned by Trump,The National Archives consulted with the Justice Department about the discovery after the former president sent back documents that he had improperly taken from the White House when he left office.,https://www.nytimes.com/2022/02/09/us/politics/national-archives-trump-classified-material.html,https://static01.nyt.com/images/2022/02/09/us/politics/09dc-archives-image/merlin_182384259_b34ee56f-1b6b-4718-971b-c952139cc386-articleLarge.jpg,2022-02-10T00:59:44+0000,"The National Archives and Records Administration discovered what it believed was classified information in documents Donald J. Trump had taken with him from the White House as he left office, according to a person briefed on the matter.",the-new-york-times,The New York Times
By Philip Galanes,I Stopped Drinking. Why Should That Affect My Social Life?,A reader whose migraines made alcohol consumption intolerable feels misunderstood — and left out of happy hour.,https://www.nytimes.com/2022/02/10/style/drinking-sober-social-qs.html,https://static01.nyt.com/images/2021/06/20/fashion/socialqs-2021-artwork/socialqs-2021-artwork-articleLarge.jpg,2022-02-10T14:00:03+0000,"Drinking alcohol gives me horrific migraines, so I stopped entirely. The problem: I used to bond with my friends at fancy cocktail bars and happy hours. I don’t make my drinking their problem, and I’ve told them I’d still like to go with them. (They know I quit drinking because of migraines, not a substance problem.) Still, they often exclude me when they go to bars or alcohol-centered activities. I feel rejected. Some of them even ask: “Are your migraines really that bad?” How should I handle this?",the-new-york-times,The New York Times
By Michael Kolomatsky,Remote Work Opens Up Cheaper Housing Options,House hunters are searching to move from expensive larger cities to smaller cheaper ones.,https://www.nytimes.com/2022/02/10/realestate/remote-work-housing.html,https://static01.nyt.com/images/2022/02/10/realestate/10calculator-1643830159212/10calculator-1643830159212-articleLarge.png,2022-02-10T14:30:09+0000,"If there’s a silver lining to this pandemic, it’s been the growth of working from home. While remote workers miss out on face-to-face interaction, they may save money on commuting, office clothes, work lunches and other expenses. And of course, many can freely search out of town for their next home.",the-new-york-times,The New York Times
By Nicolas Rapold,‘Death on the Nile’ Review: Dead in the Water,Kenneth Branagh’s second adaptation of Agatha Christie’s Hercule Poirot stories forgets the simple pleasures of ensemble excess and pure messing about.,https://www.nytimes.com/2022/02/10/movies/death-on-the-nile-review.html,https://static01.nyt.com/images/2022/02/09/arts/death1/merlin_201361029_318e5cc6-f7b0-4304-b6f4-e5a3f4ee629e-articleLarge.jpg,2022-02-10T12:00:04+0000,"The trickiest part of a murder mystery isn’t solving the crime. It’s keeping the intrigue and fun alive until then. “Death on the Nile,” Kenneth Branagh’s second adaptation of Agatha Christie’s Hercule Poirot stories, forgets the simple pleasures of ensemble excess and pure messing about.",the-new-york-times,The New York Times
By The Learning Network,Word of the Day: expunge,This word has appeared in 27 articles on NYTimes.com in the past year. Can you use it in a sentence?,https://www.nytimes.com/2022/02/10/learning/word-of-the-day-expunge.html,https://static01.nyt.com/images/2021/11/10/learning/LN-image-WOTD-expunge/LN-image-WOTD--17-articleLarge.png,2022-02-10T07:00:02+0000,"The word expunge has appeared in 27 articles on NYTimes.com in the past year, including on Oct. 14 in “F.B.I. Official Fired Under Trump Wins Back His Pension” by Adam Goldman:",the-new-york-times,The New York Times
By Michael M. Grynbaum,The Times is allowed to publish Project Veritas documents until a full appeal.,A state appeals court said a judge’s order preventing publication of the documents would not be enforced until a formal appeal could be heard.,https://www.nytimes.com/2022/02/10/business/media/project-veritas-new-york-times.html,https://static01.nyt.com/images/2022/02/10/business/10veritas/merlin_168723207_8ec30599-99b0-4130-a14d-d3ef1fdfeab6-articleLarge.jpg,2022-02-10T15:28:25+0000,The New York Times is free to publish documents pertaining to the conservative group Project Veritas after a New York State appeals court temporarily stayed an order by a state trial judge that had been denounced by First Amendment advocates and journalism groups.,the-new-york-times,The New York Times
By Catherine Hickley,Native Hawaiians Collect Ancestors’ Skulls From European Museums,"A delegation from Hawaii is on a five-city tour to bring human remains home, some of thousands of such remnants in Europe taken from around the world.",https://www.nytimes.com/2022/02/10/arts/design/hawaii-remains-europe.html,https://static01.nyt.com/images/2022/02/10/arts/10hawaii-remains3/merlin_201645603_ad3b06b6-b725-4fcb-93a3-c784fe3b9891-articleLarge.jpg,2022-02-10T18:19:09+0000,"BERLIN — Edward Halealoha Ayau, a lawyer from Hawaii, remembers a mission his grandmother gave him over 30 years ago: Bring your ancestors home.",the-new-york-times,The New York Times
By Amy Nicholson,‘Blacklight’ Review: He’s Off the Books (But You’ve Read This One Before),Liam Neeson plays a top-secret operative in an action movie that teeters between subverting the genre and obeying convention.,https://www.nytimes.com/2022/02/10/movies/blacklight-review.html,https://static01.nyt.com/images/2022/02/10/multimedia/10blacklight-review/10blacklight-review-articleLarge.jpg,2022-02-10T12:00:06+0000,"Liam Neeson is an action star with a particular set of skills: he can drive fast, punch hard and emote with a depth that makes his shenanigans seem inspired by Ingmar Bergman. In “Blacklight,” Mark Williams’s quirky yet middling thriller, Neeson plays an off-the-books operative who takes secret orders directly from the director of the F.B.I. (Aidan Quinn), a power-mad, old-guard bureaucrat irritated that he can’t profess his love for J. Edgar Hoover without triggering “politically correct puppets.”",the-new-york-times,The New York Times
By Reid J. Epstein and Shane Goldmacher,How the G.O.P.’s Censure Fight Exposes the Party’s Deeper Divide,Upcoming primaries will test whether embracing Donald J. Trump’s election falsehoods is a litmus test for Republican voters.,https://www.nytimes.com/2022/02/10/us/politics/trump-election-lies-republicans.html,https://static01.nyt.com/images/2022/02/09/us/politics/09pol-repub-image/09pol-repub-image-articleLarge-v3.jpg,2022-02-10T19:34:13+0000,"WASHINGTON — More than a year after the 2020 election, Donald J. Trump’s false claims of election fraud remain a destabilizing force for the Republican Party, dividing an activist base galvanized by a lie from elites in Washington who are hoping to hold the party together long enough to win back power in Congress in the upcoming midterm elections.",the-new-york-times,The New York Times
By Anton Troianovski,"With Buildup on Land and Sea, Russia Closes in on Ukraine","Military drills in Belarus, deployments in western Russia and Crimea, and planned naval exercises in the Black Sea gave an ominous undertone to a continuing diplomatic scramble.",https://www.nytimes.com/2022/02/10/world/europe/russia-ukraine-military-deployment.html,https://static01.nyt.com/images/2022/02/10/world/10ukraine-ledeall1/merlin_201714237_4bcc7bd4-ff35-4e26-9b7d-458ddfd006ee-articleLarge.jpg,2022-02-10T21:20:31+0000,"MOSCOW — Thousands of Russian troops on Thursday began 10 days of exercises in Belarus, and Ukraine warned of upcoming Russian naval drills so extensive they would block shipping lanes, as the Kremlin continued to tighten its military vise on Ukraine.",the-new-york-times,The New York Times
By John Branch,"Shaun White, on his farewell tour, prepares for his final runs.","Shaun White was at the bottom of the halfpipe, chatty and relieved, just as the sun was sinking. He was talking about making it through to another Winter Olympics final, two days away, and maybe, just maybe, finishing his career, at 35, with another gold medal.",https://www.nytimes.com/2022/02/10/sports/olympics/shaun-white-on-his-farewell-tour-prepares-for-his-final-runs.html,https://static01.nyt.com/images/2022/02/11/multimedia/11olympics-briefing-branch-shaun-TopArt/11olympics-briefing-branch-shaun-TopArt-articleLarge.jpg,2022-02-10T23:24:40+0000,"Shaun White was at the bottom of the halfpipe, chatty and relieved, just as the sun was sinking. He was talking about making it through to another Winter Olympics final, two days away, and maybe, just maybe, finishing his career, at 35, with another gold medal.",the-new-york-times,The New York Times
By Hari Kumar and Emily Schmall,A Bellwether for Narendra Modi as India’s Largest State Goes to the Polls,"While many voters say they are concerned about the economy, the prime minister’s party has placed a focus on religion, with often polarizing effects.",https://www.nytimes.com/2022/02/10/world/asia/india-election-modi-uttar-pradesh.html,https://static01.nyt.com/images/2022/02/10/world/10india-election-01/10india-election-01-articleLarge.jpg,2022-02-10T10:37:30+0000,"MEERUT, India — An election now underway in India’s most populous state is being closely watched as a referendum on Prime Minister Narendra Modi’s eight years in office, during which he has often pursued a Hindu-first agenda that observers say has empowered his supporters’ polarizing emphasis on religious identity.",the-new-york-times,The New York Times
By Melina Delkic,Your Friday Briefing: Russia’s Large-Scale Military Drills,Troops along the Ukraine border bring unease.,https://www.nytimes.com/2022/02/10/briefing/russia-belarus-trump-calls-olympics.html,https://static01.nyt.com/images/2022/02/10/world/11ambriefing-asia-promo/11ambriefing-asia-ukraine-articleLarge-v2.jpg,2022-02-10T20:50:27+0000,Thousands of Russian troops began 10 days of military exercises in Belarus on Thursday while the diplomatic efforts to avoid a war in Ukraine showed few signs of progress.,the-new-york-times,The New York Times
By The Learning Network,"What Students Are Saying About Black History, Food-Centric Traditions and Wordle","Teenage comments in response to our recent writing prompts, and an invitation to join the ongoing conversation.",https://www.nytimes.com/2022/02/10/learning/what-students-are-saying-about-black-history-food-centric-traditions-and-wordle.html,https://static01.nyt.com/images/2022/01/14/crosswords/14wordle-wordplay-CECLN/14wordle-wordplay-articleLarge.png,2022-02-10T21:48:48+0000,"This week on The Learning Network, one of our writing prompts asked teenagers to tell us what they have learned about Black history at home or in school. We also wanted to know if they celebrate any special cultural or holiday traditions that involve food, and we asked them to weigh in on the meteoric rise of the game Wordle.",the-new-york-times,The New York Times
By Constant Méheut,The Paris police ban a protest convoy inspired by the Ottawa demonstration.,"The group takes its name, Convoi de la Liberté, from Canada’s Freedom Convoy, and like the Canadian protest, has brought together people espousing a wide range of motivations.",https://www.nytimes.com/2022/02/10/world/canada/paris-police-ban-convoy-ottawa.html,,2022-02-10T15:40:36+0000,"The Paris police issued an order on Thursday banning the entry of a convoy of truckers and drivers heading from southern France to protest against the country’s vaccination pass program, part of a movement directly inspired by Canada’s trucker-led protests.",the-new-york-times,The New York Times
By Laurie Gwen Shapiro,An Amelia Earhart Mystery Solved (Not That Mystery),How the pilot’s long-lost aviator helmet came to spend the better part of a century in a closet somewhere in Minnesota.,https://www.nytimes.com/2022/02/10/nyregion/amelia-earhart-aviator-helmet.html,https://static01.nyt.com/images/2022/02/13/nyregion/13amelia-earhart/11amelia-earhart-articleLarge.jpg,2022-02-10T10:00:16+0000,"The response from the experts was always the same: So, your mom told you this aviator’s helmet belonged to Amelia Earhart? That’s great, they’d say, but we’re going to need a little more proof.",the-new-york-times,The New York Times
By Jesse McKinley,How a Long Island Republican Used a Mask Rebellion to Revive His Career,"Since a surprise win on Long Island, Bruce Blakeman has been on a seemingly single-minded mission to challenge and defy Gov. Kathy Hochul over mask mandates.",https://www.nytimes.com/2022/02/10/nyregion/bruce-blakeman-republican-masks.html,https://static01.nyt.com/images/2022/02/04/nyregion/00BLAKEMAN2/00BLAKEMAN2-articleLarge.jpg,2022-02-10T10:00:20+0000,"Bruce Blakeman, who has emerged as the leader of suburban Long Island’s revolt against mask mandates, has lost his fair share of elections.",the-new-york-times,The New York Times
,"Quotation of the Day: Despite Omicron Surge, Denmark Lifts All Covid-19 Restrictions","Quotation of the Day for Thursday, February 10, 2022.",https://www.nytimes.com/2022/02/09/todayspaper/quotation-of-the-day-despite-omicron-surge-denmark-lifts-all-covid-19-restrictions.html,,2022-02-10T02:30:54+0000,“Omicron has turned the epidemiological situation into a Rorschach test where you can see what you want to see in it.”,the-new-york-times,The New York Times
By Lisa Kennedy,‘The Pact’ Review: A Faustian Bargain,"When a baroness summons a young poet to her estate and suggests they make a deal, he should have hightailed it back down the road.",https://www.nytimes.com/2022/02/10/movies/the-pact-review.html,https://static01.nyt.com/images/2022/02/10/arts/10pact-review/merlin_201361464_56789b92-a167-406f-93d2-5bd7a2226386-articleLarge.jpg,2022-02-10T12:00:06+0000,"Is there no equivalent to the phrase “If it looks too good to be true, it is” in Danish? Because when a baroness in “The Pact” summons a young poet to her estate north of Copenhagen and suggests they make a bargain, he should have hightailed it back down the road to his modest home, his kind wife and their towheaded toddler. But he doesn’t.",the-new-york-times,The New York Times
By Ruth La Ferla,The Fine Art of Staging a Blockbuster,"With a string of successes, Matthew Yokobosky is giving the Brooklyn Museum’s fashion exhibitions an edge over similar fare at the Met.",https://www.nytimes.com/2022/02/10/style/the-fine-art-of-staging-a-blockbuster.html,https://static01.nyt.com/images/2022/02/10/fashion/10Yokobosky1/10Yokobosky1-articleLarge.jpg,2022-02-10T08:00:14+0000,"Growing up in the town of Republic in southwestern Pennsylvania, Matthew Yokobosky would visit the local tailor most days after school. “His name was Danny Mariotti, and I used to go and watch him sew,” he said.",the-new-york-times,The New York Times
By Michael Levenson,London Police Commissioner Announces Resignation,"The commissioner, Cressida Dick, announced her resignation under pressure from the mayor over reports of bullying, misogyny and racism on the force.",https://www.nytimes.com/2022/02/10/world/europe/london-police-cressida-dick-resigns-racism.html,https://static01.nyt.com/images/2022/02/10/multimedia/10xp-met-01/10xp-met-01-articleLarge.jpg,2022-02-10T20:35:05+0000,"The commissioner of the Metropolitan Police Service in London announced on Thursday that she would step down, under pressure from the mayor over reports of bullying, misogyny and racism on the force.",the-new-york-times,The New York Times
