author,title,description,url,urlToImage,publishedAt,content,source.id,source.name
NBCNews.com,"A Gathering Storm, Part 4","Jim Huden is a beloved character in Punta Gorda, Florida, as a respected businessman and the leader of a popular bar band—Buck Naked and the Exhibitionists. Then the death of a childhood friend brings him to Washington State, where he meets the gorgeous pagea…",https://www.nbcnews.com/dateline/video/a-gathering-storm-part-4-83210309849,https://media14.s-nbcnews.com/j/MSNBC/Components/Video/202005/dtl_ep_hitmanrepeatpt4_200508_1920x1080.nbcnews-fp-1200-630.jpg,2020-05-08T16:48:18Z,,nbc-news,NBC News
NBCNews.com,"A Gathering Storm, Part 3","The investigation into the murder of Russel Douglas is at a dead end. Then an anonymous, mysterious tip call gives detectives their first solid lead.",https://www.nbcnews.com/dateline/video/a-gathering-storm-part-3-83209285945,https://media14.s-nbcnews.com/j/MSNBC/Components/Video/202005/dtl_ep_hitmanrepeatpt3_200508_1920x1080.nbcnews-fp-1200-630.jpg,2020-05-08T16:44:22Z,,nbc-news,NBC News
NBCNews.com,"A Gathering Storm, Part 2","The family of murder victim, Russel Douglas, rallies to the side of his widow, even as homicide detectives have questions for her.",https://www.nbcnews.com/dateline/video/a-gathering-storm-part-2-83210309762,https://media14.s-nbcnews.com/j/MSNBC/Components/Video/202005/dtl_ep_hitmanrepeatpt2_1920x1080.nbcnews-fp-1200-630.jpg,2020-05-08T16:42:57Z,,nbc-news,NBC News
NBCNews.com,FULL EPISODE: A Gathering Storm,"In August 2004, all eyes were on Hurricane Charley as it pounded Punta Gorda, a small town on Florida’s Gulf Coast. In the midst of the tempest, one Florida man was holed up in a hotel room, seeking shelter from the storm and hiding from his past.",https://www.nbcnews.com/dateline/video/full-episode-a-gathering-storm-83210309740,https://media12.s-nbcnews.com/j/MSNBC/Components/Video/202005/dtl_ep_hitmanrepeatpt1_200508_1920x1080.nbcnews-fp-1200-630.jpg,2020-05-08T16:40:35Z,,nbc-news,NBC News
David K. Li,Amtrak's Acela line resuming service on June 1,Amtrak's Acela line resuming service on June 1,https://www.nbcnews.com/health/health-news/live-blog/2020-05-08-coronavirus-news-n1202636/ncrd1202926,https://media4.s-nbcnews.com/j/newscms/2020_19/3340551/200508-coronavirus-live-blog-social-only_c25d7fa6d3242ec63e1c271efad6be22.nbcnews-fp-1200-630.jpg,2020-05-08T16:35:09Z,"The Acela line, Amtrak's upscale service between Boston and Washington, D.C., will be back on track in three weeks, the rail service announced on Friday.
Beginning June 1, there will be three weekday Acela round trips, and the frequency of Northeast Regional… [+7885 chars]",nbc-news,NBC News
NBCNews.com,Burlesque and burgers: Oregon strip club now serving up ‘Food 2 Go-Go’,"When Lucky Devil Lounge in Portland was forced to close its doors in March due to COVID-19, it quickly pivoted its business to stay afloat.",https://www.nbcnews.com/video/burlesque-and-burgers-oregon-strip-club-now-serving-up-food-2-go-go-83209797825,https://media12.s-nbcnews.com/j/MSNBC/Components/Video/202005/d_ov_feature_stripclubpivot_200508__178288.nbcnews-fp-1200-630.jpg,2020-05-08T16:34:43Z,,nbc-news,NBC News
Elisha Fieldstadt,N.J. nursing home where 17 bodies were stuffed into tiny morgue fined $220K,"The Andover Subacute and Rehabilitation II facility in Sussex County, New Jersey, must pay $220,235 after 17 bodies were found in a small morgue there.",https://www.nbcnews.com/news/us-news/n-j-nursing-home-where-17-bodies-were-stuffed-tiny-n1202771,https://media3.s-nbcnews.com/j/newscms/2020_19/3323236/200424-nursing-home-new-jersey-ew-208p_936b772eabae0585f3151c4a4651157d.nbcnews-fp-1200-630.jpg,2020-05-08T16:32:07Z,"The New Jersey nursing home where 17 bodies were found stuffed into a tiny morgue last month was hit with a massive fine after federal inspectors found that residents there were put at risk of ""serious injury, harm impairment or death.""
The Andover Subacute … [+5764 chars]",nbc-news,NBC News
Dan Good,"Cuba has 12 new COVID-19 cases, its lowest total in weeks","Cuba has seen 1,741 confirmed cases of the coronavirus, with 74 deaths.",https://www.nbcnews.com/health/health-news/live-blog/2020-05-08-coronavirus-news-n1202636/ncrd1203001,https://media4.s-nbcnews.com/j/newscms/2020_19/3340551/200508-coronavirus-live-blog-social-only_c25d7fa6d3242ec63e1c271efad6be22.nbcnews-fp-1200-630.jpg,2020-05-08T16:24:02Z,"Cuba announced 12 new cases of COVID-19 Friday, the country's lowest total in weeks.
Of the new cases, 75 percent were asymptomatic. One person, a 77-year-old, also died, officials said.
Cuba has seen 1,741 confirmed cases of the coronavirus, with 74 deaths… [+6947 chars]",nbc-news,NBC News
NBCNews.com,"Deep in the Woods, Part 6","After more than two years, Kelli Bordeaux’s family and friends finally get answers and a measure of justice.",https://www.nbcnews.com/dateline/video/deep-in-the-woods-part-6-83209797517,https://media11.s-nbcnews.com/j/MSNBC/Components/Video/202005/dtl_ep_armymedicreppt6_200508_1920x1080.nbcnews-fp-1200-630.jpg,2020-05-08T16:18:05Z,,nbc-news,NBC News
NBCNews.com,"Deep in the Woods, Part 5",Kelli Bordeaux has been missing for nearly two years. But David Marshburn has a new idea about how to bring Kelli home.,https://www.nbcnews.com/dateline/video/deep-in-the-woods-part-5-83205701990,https://media14.s-nbcnews.com/j/MSNBC/Components/Video/202005/dtl_ep_armymedicreppt5_200508_1920x1080.nbcnews-fp-1200-630.jpg,2020-05-08T16:15:51Z,,nbc-news,NBC News
NBCNews.com,"Deep in the Woods, Part 4","Secretly, a private investigator conducts his own search for Kelli Bordeaux, sometimes using unorthodox methods.",https://www.nbcnews.com/dateline/video/deep-in-the-woods-part-4-83207749990,https://media13.s-nbcnews.com/j/MSNBC/Components/Video/202005/dtl_ep_armymedicreppt4_200508_1920x1080.nbcnews-fp-1200-630.jpg,2020-05-08T16:14:54Z,,nbc-news,NBC News
"Hans Nichols, Lauren Egan",Pence staff member tests positive for coronavirus,The news comes the day after it became public that a White House aide to Trump also tested positive.,https://www.nbcnews.com/health/health-news/live-blog/2020-05-08-coronavirus-news-n1202636/ncrd1202981,https://media4.s-nbcnews.com/j/newscms/2020_19/3340551/200508-coronavirus-live-blog-social-only_c25d7fa6d3242ec63e1c271efad6be22.nbcnews-fp-1200-630.jpg,2020-05-08T16:10:58Z,"An aide to Vice President Mike Pence tested positive for the coronavirus, the second administration staffer known to become infected with the virus, an administration official said Friday.
Pence's flight to Des Moines was delayed by roughly an hour Friday mo… [+8058 chars]",nbc-news,NBC News
Mariana Zapata,Best mattresses 2020: eco-friendly designs,"Shopping for a new mattress? Mattresses sporting organic cotton, natural latex, Tencel and organic wool may help alleviate environmental impact.",https://www.nbcnews.com/shopping/eco-friendly/best-eco-friendly-mattress-n1193591,https://media3.s-nbcnews.com/j/newscms/2020_19/3342271/200508-matress-al-1113_5a0f32189f635ea5a6c577fab2830c11.nbcnews-fp-1200-630.jpg,2020-05-08T16:10:22Z,"Not too long ago, comfort and price could be the only factors at play when people shopped for a new mattress. But as plastic chemical pollution takes a toll on the world, environmental impact is increasingly on consumers' minds. The upside? There's a growing … [+6824 chars]",nbc-news,NBC News
Reuters,U.S. post office loss doubles as it warns COVID-19 will hit its finances,U.S. post office loss doubles as it warns COVID-19 will hit its finances,https://www.nbcnews.com/health/health-news/live-blog/2020-05-08-coronavirus-news-n1202636/ncrd1202976,https://media4.s-nbcnews.com/j/newscms/2020_19/3340551/200508-coronavirus-live-blog-social-only_c25d7fa6d3242ec63e1c271efad6be22.nbcnews-fp-1200-630.jpg,2020-05-08T16:10:11Z,"WASHINGTON The U.S. Postal Service on Friday said it lost $4.5 billion in the quarter ending in March, more than double its loss over the same period last year, and warned COVID-19 could severely hurt its finances over the next 18 months.
The agency said its… [+8227 chars]",nbc-news,NBC News
NBCNews.com,"Deep in the Woods, Part 3","After 72 hours, Kelli Bordeaux’s family, friends and community members launch a massive search for her.",https://www.nbcnews.com/dateline/video/deep-in-the-woods-part-3-83208773760,https://media11.s-nbcnews.com/j/MSNBC/Components/Video/202005/dtl_ep_armymedicreppt3_200508_1920x1080.nbcnews-fp-1200-630.jpg,2020-05-08T16:09:29Z,,nbc-news,NBC News
NBCNews.com,"Deep in the Woods, Part 2","Army medic Kelli Bordeaux has mysteriously  vanished. Worried, her boyfriend Justin Thompson alerts authorities.",https://www.nbcnews.com/dateline/video/deep-in-the-woods-part-2-83207749900,https://media12.s-nbcnews.com/j/MSNBC/Components/Video/202005/dtl_ep_armymedicreppt2_200508_1920x1080.nbcnews-fp-1200-630.jpg,2020-05-08T16:08:27Z,,nbc-news,NBC News
Hans Nichols and Lauren Egan,Pence staff member tests positive for coronavirus,"An aide to Vice President Mike Pence tested positive for the coronavirus ahead of the vice president's trip to Iowa Friday, the second administration staffer known to become infected with the virus.",https://www.nbcnews.com/politics/white-house/pence-staff-member-tests-positive-coronavirus-n1202946,https://media3.s-nbcnews.com/j/newscms/2020_14/3294911/200403-mike-pence-se-131p_b8cef0779f16e7b575104b1db1d8235c.nbcnews-fp-1200-630.jpg,2020-05-08T16:07:10Z,"WASHINGTON An aide to Vice President Mike Pence tested positive for the coronavirus, the second administration staffer known to become infected with the virus, an administration official said Friday.
Pence's flight to Des Moines was delayed by roughly an hou… [+862 chars]",nbc-news,NBC News
NBCNews.com,FULL EPISODE: Deep in the Woods,On Friday the 13th a popular young Army medic goes missing in North Carolina. Where is Kelli Bordeaux?,https://www.nbcnews.com/dateline/video/full-episode-deep-in-the-woods-83205701866,https://media12.s-nbcnews.com/j/MSNBC/Components/Video/202005/dtl_ep_armymedicreppt1_200508_1920x1080.nbcnews-fp-1200-630.jpg,2020-05-08T16:06:26Z,,nbc-news,NBC News
Dan Good,"Nancy Pelosi responds to April jobs report, calls for increased COVID-19 relief and testing",House Speaker Nancy Pelosi called for additional coronavirus relief efforts following Friday's April jobs numbers showing the national unemployment rate at 14.7 percent.,https://www.nbcnews.com/health/health-news/live-blog/2020-05-08-coronavirus-news-n1202636/ncrd1202971,https://media4.s-nbcnews.com/j/newscms/2020_19/3340551/200508-coronavirus-live-blog-social-only_c25d7fa6d3242ec63e1c271efad6be22.nbcnews-fp-1200-630.jpg,2020-05-08T16:05:23Z,"House Speaker Nancy Pelosi called for additional coronavirus relief efforts following Friday's April jobs numbers showing the national unemployment rate at 14.7 percent.
Our nation is in the midst of an historic health and economic crisis, and even this reco… [+8673 chars]",nbc-news,NBC News
Kevin Truong,LGBTQ support groups lend an ear — virtually,"“We know that our services are life-saving,” one youth therapist explained, “so we immediately said, ‘OK, how do we do this virtually?’”",https://www.nbcnews.com/feature/nbc-out/lgbtq-support-groups-lend-ear-virtually-n1202901,https://media3.s-nbcnews.com/j/newscms/2020_19/3340916/200507-kathryn-gonzales-virtual-storytime-se-129p_5596b24041d43e46a821a3884eabe32c.nbcnews-fp-1200-630.jpg,2020-05-08T16:03:00Z,James Phelps understands the challenges of feeling isolated. He said it comes from his own experience growing up gay in rural Oregon. Thats why when businesses and organizations across the country began shutting down nonessential services amid the coronavirus… [+6091 chars],nbc-news,NBC News
Gary Grumbach and Shaquille Brewster,"In the month since his 2020 exit, Sanders has sent mixed signals","Bernie Sanders has endorsed Joe Biden, but his team is still fighting for delegates and he has not used his fundraising network to help the apparent nominee yet.",https://www.nbcnews.com/politics/2020-election/month-his-2020-exit-sanders-has-sent-mixed-signals-n1203131,https://media2.s-nbcnews.com/j/newscms/2020_19/3342651/200508-bernie-sanders-al-1437_7e739f887d83f0606141696aeb1a6542.nbcnews-fp-1200-630.jpg,2020-05-08T19:59:00Z,"Bernie Sanders suspended his presidential campaign exactly one month ago Friday, and days later he endorsed Joe Biden, the apparent Democratic presidential nominee. But Sanders and the remains of his campaign apparatus are in some ways acting as if the campai… [+5500 chars]",nbc-news,NBC News
NBCNews.com,"Unraveled, Part 6","As police close in on the killer, hard questions need to be answered.",https://www.nbcnews.com/dateline/video/unraveled-part-6-83222085634,https://media14.s-nbcnews.com/j/MSNBC/Components/Video/202005/dtl_ep_phxkillerpt6_200508_1920x1080.nbcnews-fp-1200-630.jpg,2020-05-08T19:57:29Z,,nbc-news,NBC News
NBCNews.com,"Unraveled, Part 5",Police are confident they've identified the killer and are in a race against the clock to find him.,https://www.nbcnews.com/dateline/video/unraveled-part-5-83219525863,https://media14.s-nbcnews.com/j/MSNBC/Components/Video/202005/dtl_ep_phxkillerpt5_200508_1920x1080.nbcnews-fp-1200-630.jpg,2020-05-08T19:55:11Z,,nbc-news,NBC News
Whitson Gordon,The best video games in recent years,"Shop the best video games for the most popular video game consoles, including Animal Crossing, Overwatch, Red Dead Redemption 2, Witcher 3 and more.",https://www.nbcnews.com/shopping/tech-gadgets/best-video-games-xbox-nintendo-ps4-n1194731,https://media1.s-nbcnews.com/j/newscms/2020_19/3342266/200508-video-games-al-1112_47ae931427c17984361e6205da713bd2.nbcnews-fp-1200-630.jpg,2020-05-08T19:55:07Z,"Video games have grown increasingly popular among anyone working from home or otherwise obeying stay-at-home orders. In fact, some gained popularity among unexpected audiences long before COVID-19 spread around the world. If youre looking for an engaging past… [+5879 chars]",nbc-news,NBC News
NBCNews.com,"Unraveled, Part 4",A woman's past comes back to haunt her as she realizes her personal ties to the murders.,https://www.nbcnews.com/dateline/video/unraveled-part-4-83221061520,https://media13.s-nbcnews.com/j/MSNBC/Components/Video/202005/dtl_ep_phxkillerpt4_200508_1920x1080.nbcnews-fp-1200-630.jpg,2020-05-08T19:53:31Z,,nbc-news,NBC News
David K. Li,Judge refuses to toss charges against accused college scammer Lori Loughlin,"Judge refuses to toss charges against Lori Loughlin, the ""Full House"" star implicated in the massive ""Operation Varsity Blues"" college admission scandal.",https://www.nbcnews.com/news/us-news/judge-refuses-toss-charges-against-accused-college-scammer-lori-loughlin-n1203201,https://media1.s-nbcnews.com/j/newscms/2019_14/2809236/190403-lori-loughlin-court-ew-239p_a5e7e29b6db8f3fd1ff012ca5534243a.nbcnews-fp-1200-630.jpg,2020-05-08T19:52:02Z,"A federal judge in Boston on Friday refused to dismiss charges against actress Lori Loughlin, ruling that investigators did ""not fabricate evidence"" against her in a massive college-admissions scandal.
Loughlin, her fashion designer husband Mossimo Giannulli… [+2556 chars]",nbc-news,NBC News
NBCNews.com,"Unraveled, Part 3","Police receive hundreds of tips, but the most crucial one comes from a caller 200 miles away.",https://www.nbcnews.com/dateline/video/unraveled-part-3-83220549807,https://media12.s-nbcnews.com/j/MSNBC/Components/Video/202005/dtl_ep_phxkillerpt3_200508_1920x1080.nbcnews-fp-1200-630.jpg,2020-05-08T19:50:54Z,,nbc-news,NBC News
NBCNews.com,"Unraveled, Part 2","As police scramble to solve Pitt's murder, the killer strikes again.",https://www.nbcnews.com/dateline/video/unraveled-part-2-83219525719,https://media11.s-nbcnews.com/j/MSNBC/Components/Video/202005/dtl_ep_phxkillerpt2_200508_1920x1080.nbcnews-fp-1200-630.jpg,2020-05-08T19:49:00Z,,nbc-news,NBC News
NBCNews.com,FULL EPISODE: Unraveled,"Nationally known forensic psychiatrist Steven Pitt had a booming career and loving fiance, but lost everything in an instant.",https://www.nbcnews.com/dateline/video/full-episode-unraveled-83220037862,https://media14.s-nbcnews.com/j/MSNBC/Components/Video/202005/dtl_ep_phxkillerpt1_200508_1920x1080.nbcnews-fp-1200-630.jpg,2020-05-08T19:46:22Z,,nbc-news,NBC News
Gwen Aviles,Tennessee Titans president's retirement announcement overshadowed by unique facial hair,Underwood began his career as legal counsel to the team and helped facilitate its move from Houston to Tennessee after its 1996 season.,https://www.nbcnews.com/pop-culture/pop-culture-news/tennessee-titans-president-announced-his-retirement-after-40-years-people-n1203056,https://media1.s-nbcnews.com/j/newscms/2020_19/3342336/200508-steve-underwood-ew-1212p_c9cb4c3b46692db8cab30dc61d68526c.nbcnews-fp-1200-630.jpg,2020-05-08T19:42:07Z,"The Tennessee Titans' president Steve Underwood is retiring after 40 years with the team, but the announcement was somewhat overshadowed by his unique mustache and beard combo.
""Tennessee Titans team president Steve Underwood's facial hair is the only thing … [+1308 chars]",nbc-news,NBC News
Daniella Silva,"Rural Maine retail stores, restaurants can soon reopen with restrictions",Maine Gov. Janet Mills said Friday retail stores and restaurants could begin reopening with restrictions  in the next two weeks in certain rural counties where community transmission was not present.,https://www.nbcnews.com/health/health-news/live-blog/2020-05-08-coronavirus-news-n1202636/ncrd1203226,https://media4.s-nbcnews.com/j/newscms/2020_19/3340551/200508-coronavirus-live-blog-social-only_c25d7fa6d3242ec63e1c271efad6be22.nbcnews-fp-1200-630.jpg,2020-05-08T19:36:37Z,"Maine Gov. Janet Mills said Friday that retail stores and restaurants could begin reopening with restrictions over the next two weeks in certain rural counties where community transmission of coronavirus was not present. 
With low case counts, no evidence of… [+8182 chars]",nbc-news,NBC News
"Dennis Romero, Matthew Kwiecinski","Oregon strip club pivots to preparing food, and its dancers deliver","The Lucky Devil Lounge, a strip club in Portland, Oregon, has transformed itself into Lucky Devil Eats to stay afloat during the global pandemic.",https://www.nbcnews.com/health/health-news/live-blog/2020-05-08-coronavirus-news-n1202636/ncrd1203216,https://media4.s-nbcnews.com/j/newscms/2020_19/3340551/200508-coronavirus-live-blog-social-only_c25d7fa6d3242ec63e1c271efad6be22.nbcnews-fp-1200-630.jpg,2020-05-08T19:30:09Z,"The Lucky Devil Lounge, a strip club in Portland, Oregon, has transformed itself into Lucky Devil Eats to stay afloat during the global pandemic.
Its dancers deliver food made in the strip club's kitchen, and those who order takeout from Food 2 Go-Go get to … [+7262 chars]",nbc-news,NBC News
Andrea Cavallier,Accused serial killer being investigated in 1992 slaying of Tammy Jo Zywicki,"Tammy Jo Zywicki went missing on her drive from Evanston, Illinois, to Grinnell College in Iowa in the summer of 1992. Her body was found nine days later in Missouri. She had been sexually assaulted and stabbed eight times. In May of 2020, truck driver Clark …",https://www.nbcnews.com/dateline/accused-serial-killer-clark-perry-baldwin-being-investigated-1992-slaying-n1203211,https://media3.s-nbcnews.com/j/newscms/2020_19/3342746/tammy_main_art_c83b38244fb6861d5335996bdbcfb6e3.nbcnews-fp-1200-630.jpg,2020-05-08T19:30:07Z,"A former long-haul truck driver from Iowa who was charged Wednesday in the killings of three women that took place in the 1990s could be responsible for several other homicides, according to the Iowa Division of Criminal Investigation (DCI). 
Clark Perry Bal… [+3467 chars]",nbc-news,NBC News
Corky Siemaszko,Senators call out CDC contractor for alleged safety failings,Six U.S. senators called out federal contractor Maximus on Friday for allegedly failing to follow social distancing guidelines at a Mississippi call center.,https://www.nbcnews.com/news/us-news/senators-urge-federal-contractor-accused-flouting-cdc-rules-meet-worried-n1203116,https://media4.s-nbcnews.com/j/newscms/2020_16/3310421/200415-maximus-hg-google-ac-920p_4286bea18d320cc6ad3d3b33d1be3774.nbcnews-fp-1200-630.jpg,2020-05-08T19:08:24Z,"Six U.S. senators on Friday urged a federal contractor accused of failing to follow social distancing guidelines at a Mississippi call center to meet with workers worried about their safety.
Their letter came after a whistleblower claimed in an NBC News repo… [+2557 chars]",nbc-news,NBC News
Dennis Romero and Matthew Kwiecinski,Oregon strip club now delivers food — and a dance on the side,"A strip club in Portland, Oregon, has pivoted to food delivery and pick-up, with its dancers becoming essential workers in the process.",https://www.nbcnews.com/news/us-news/oregon-strip-club-pivots-preparing-food-its-dancers-deliver-n1202551,https://media3.s-nbcnews.com/j/newscms/2020_19/3341586/200507-strip-club-drive-through-ac-817p_d91225df26c6020d8c58f75dda06d6c5.nbcnews-fp-1200-630.jpg,2020-05-08T19:06:22Z,"A strip club in Portland, Oregon, has found a novel way to stay afloat during the global pandemic.
The Lucky Devil Lounge transformed itself into Lucky Devil Eats, which has dancers deliver food, and Food 2 Go-Go, a drive-up service where takeout orders come… [+1846 chars]",nbc-news,NBC News
Tim Fitzsimons and Reuters,Germany is 5th country to ban conversion therapy for minors,"The discredited therapeutic practice purports to turn a gay person straight, and jurisdictions around the world have moved to prohibit it.",https://www.nbcnews.com/feature/nbc-out/germany-5th-country-ban-conversion-therapy-minors-n1203166,https://media3.s-nbcnews.com/j/newscms/2020_19/3342346/200508-lgbtq-germany-se-1220p_a5443e4c617016ab23a81629412313fa.nbcnews-fp-1200-630.jpg,2020-05-08T19:00:00Z,"Germanys legislature on Thursday passed a ban on the advertising and practice of so-called gay conversion therapy for people under age 18, joining a growing list of countries and local jurisdictions that have moved to prohibit the debunked practice in minors.… [+3446 chars]",nbc-news,NBC News
NBCNews.com,"The Figure in the Garage, Part 6",A jailhouse informant lays out a story about how Don Fluitt was murdered. Family and friends prepare for trial and remember the well-loved Don Fluitt.,https://www.nbcnews.com/dateline/video/the-figure-in-the-garage-part-6-83215429891,https://media14.s-nbcnews.com/j/MSNBC/Components/Video/202005/dtl_ep_abqfirept6_200508_1920x1080.nbcnews-fp-1200-630.jpg,2020-05-08T18:45:21Z,,nbc-news,NBC News
NBCNews.com,"The Figure in the Garage, Part 5",Terry White changes his story and then goes missing. Can detectives solve the case with their primary suspect on the run?,https://www.nbcnews.com/dateline/video/the-figure-in-the-garage-part-5-83215429876,https://media14.s-nbcnews.com/j/MSNBC/Components/Video/202005/dtl_ep_abqfirept5_200508_1920x1080.nbcnews-fp-1200-630.jpg,2020-05-08T18:44:27Z,,nbc-news,NBC News
NBCNews.com,"The Figure in the Garage, Part 4",Three people emerge as potential suspects in Don Fluitt’s murder. A DNA hit changes the course of the investigation.,https://www.nbcnews.com/dateline/video/the-figure-in-the-garage-part-4-83216453951,https://media14.s-nbcnews.com/j/MSNBC/Components/Video/202005/dtl_ep_abqfirept4_200508_1920x1080.nbcnews-fp-1200-630.jpg,2020-05-08T18:42:14Z,,nbc-news,NBC News
NBCNews.com,"The Figure in the Garage, Part 3",A neighbor’s surveillance camera uncovers a mysterious hooded figure at the scene of Don Fluitt’s murder. Will the detective be able to turn a tantalizing image into a concrete suspect?,https://www.nbcnews.com/dateline/video/the-figure-in-the-garage-part-3-83216965547,https://media13.s-nbcnews.com/j/MSNBC/Components/Video/202005/dtl_ep_abqfirept3_200508_1920x1080.nbcnews-fp-1200-630.jpg,2020-05-08T18:39:43Z,,nbc-news,NBC News
NBCNews.com,"The Figure in the Garage, Part 2",Friends and family reel from the loss of Don Fluitt after his brutal murder in December 2016. Detective Matt Caplan begins to suss out a suspect list.,https://www.nbcnews.com/dateline/video/the-figure-in-the-garage-part-2-83215429838,https://media13.s-nbcnews.com/j/MSNBC/Components/Video/202005/dtl_ep_abqfirept2_200508_1920x1080.nbcnews-fp-1200-630.jpg,2020-05-08T18:38:12Z,,nbc-news,NBC News
NBCNews.com,FULL EPISODE: The Figure in the Garage,"A brutal murder sends shockwaves through a small community north of Albuquerque, New Mexico. But who would’ve wanted to hurt loving father Don Fluitt?",https://www.nbcnews.com/dateline/video/full-episode-the-figure-in-the-garage-83215941862,https://media12.s-nbcnews.com/j/MSNBC/Components/Video/202005/dtl_ep_abqfirept1_200508_1920x1080.nbcnews-fp-1200-630.jpg,2020-05-08T18:35:53Z,,nbc-news,NBC News
Erika Edwards,1st child in U.S. dies from mysterious COVID-19-linked illness,COVID-19 child inflammatory syndrome: A 5 year-old boy in New York has died from a severe inflammatory condition linked to COVID-19.,https://www.nbcnews.com/health/kids-health/boy-5-dies-covid-19-linked-inflammatory-syndrome-n1203076,https://media2.s-nbcnews.com/j/newscms/2020_09/3243516/200225-coronavirus-al-1227_91a8334230bc8344d8d0d1a1ade82096.nbcnews-fp-1200-630.jpg,2020-05-08T18:33:55Z,"A 5-year-old boy in New York has become the first child in the United States to die from a condition called pediatric multisymptom inflammatory syndrome that is believed to be linked to COVID-19.
New York Gov. Andrew Cuomo said during a briefing Friday that … [+1831 chars]",nbc-news,NBC News
