author,title,description,url,urlToImage,publishedAt,content,source.id,source.name
David K. Li,Dad of Ahmaud Arbery says of his killing: 'He didn't deserve to go out like that',"Arbery, who would have turned 26 on Friday, was shot to death after being chased by two men who thought he was a burglar.",https://www.nbcnews.com/news/us-news/dad-ahmaud-arbery-says-his-killing-georgia-he-didn-t-n1203036,https://media1.s-nbcnews.com/j/newscms/2020_19/3342386/200508-marcus-arbery-sr-ew-1242p_48915dcec2e439d8b793b26fcecf3ffc.nbcnews-fp-1200-630.jpg,2020-05-08T18:26:00Z,"The father of Georgia shooting victim Ahmaud Arbery said Friday of his son's death, ""He didn't deserve to go out like that.""
""He just loved people. He's the kind of young man that if he had a dollar, and you asked him for that $1, he would give it to you,"" t… [+1649 chars]",nbc-news,NBC News
Kaitlin Sullivan,Extreme heat-humidity hitting decades sooner than expected,Extreme combinations of heat and humidity are occurring decades earlier than expected thanks to climate change. Extreme wet bulb temperatures threaten human health.,https://www.nbcnews.com/health/health-news/extreme-combos-heat-humidity-hitting-globe-decades-sooner-expected-threatening-n1203026,https://media3.s-nbcnews.com/j/newscms/2020_19/3339791/200506-heat-wave-texas-2011-ac-627p_cb5749cfe36aa76ef4a6d1d82c06f566.nbcnews-fp-1200-630.jpg,2020-05-08T18:02:23Z,"Dangerous levels of heat and humidity have been recorded around the globe 50 years earlier than expected, according to a study published Friday that was led by Columbia University researchers.
The findings add to growing concerns that climate change will mak… [+5821 chars]",nbc-news,NBC News
"Dareh Gregorian, Winston Wilde, Freddie Tunnard",'Can I carry the empty ones?': Pence caught joking about delivery of boxes on hot mic,'Can I carry the empty ones?': Pence caught joking about delivery of boxes on hot mic,https://www.nbcnews.com/health/health-news/live-blog/2020-05-08-coronavirus-news-n1202636/ncrd1203121,https://media4.s-nbcnews.com/j/newscms/2020_19/3340551/200508-coronavirus-live-blog-social-only_c25d7fa6d3242ec63e1c271efad6be22.nbcnews-fp-1200-630.jpg,2020-05-08T18:01:32Z,"Vice President Mike Pence's delivery of personal protective equipment to a nursing home in Virginia came complete with a joke offer to carry empty boxes, video of the delivery shows.
An out-of-context video snippet of the moment went viral on Friday thanks t… [+8746 chars]",nbc-news,NBC News
April Glaser,Apple to reopen some stores next week,"Apple will reopen a handful of its stores across the country starting next week, the company said Friday.",https://www.nbcnews.com/health/health-news/live-blog/2020-05-08-coronavirus-news-n1202636/ncrd1203426,https://media4.s-nbcnews.com/j/newscms/2020_19/3340551/200508-coronavirus-live-blog-social-only_c25d7fa6d3242ec63e1c271efad6be22.nbcnews-fp-1200-630.jpg,2020-05-08T21:54:54Z,"Apple will reopen a handful of its stores across the country starting next week, the company said Friday.
The first Apple Store to reopen since the country went into lockdown to prevent the spread of the coronavirus will be on Monday in Boise, Idaho. Later i… [+9390 chars]",nbc-news,NBC News
Suzanne Ciechalski,"Hyatt, American Airlines to give staff at Elmhurst hospital free vacations","Staff at hard-hit Elmhurst hospital in Queens, New York City, will receive free vacations from Hyatt Hotels and American Airlines, the companies announced Friday.",https://www.nbcnews.com/health/health-news/live-blog/2020-05-08-coronavirus-news-n1202636/ncrd1203391,https://media4.s-nbcnews.com/j/newscms/2020_19/3340551/200508-coronavirus-live-blog-social-only_c25d7fa6d3242ec63e1c271efad6be22.nbcnews-fp-1200-630.jpg,2020-05-08T21:41:58Z,"Hyatt Hotels and American Airlines are joining forces to to give more than 4,000 employees at hard-hit Elmhurst hospital in New York City complimentary vacations when they are able to take time off, the companies announced Friday. 
The three-night vacations … [+9149 chars]",nbc-news,NBC News
NBCNews.com,Supporters dedicate their runs to Ahmaud Arbery,"While the cries for justice grow in the case of Ahmaid Arbery’s fatal shooting in Georgia, supporters dedicated their runs to him on the day that would have been his 26th birthday.",https://www.nbcnews.com/video/supporters-dedicate-their-runs-to-ahmaud-arbery-black-man-killed-in-georgia-83224645855,https://media12.s-nbcnews.com/j/MSNBC/Components/Video/202005/run-split.nbcnews-fp-1200-630.jpg,2020-05-08T21:31:49Z,,nbc-news,NBC News
Willem Marx,'It's only getting worse': Brazil's doctors urge more measures to stem coronavirus,"Brazil's doctors are calling for stricter measures as the daily death toll shows little sign of easing and the country has the world's highest rate of transmission, according to a study.",https://www.nbcnews.com/news/latino/it-s-only-getting-worse-brazil-s-doctors-urge-more-n1203106,https://media4.s-nbcnews.com/j/newscms/2020_19/3342626/200508-coronavirus-brazil-gravedigger-se-221p_cd26696dd97982c8231eed2b640cd9f0.nbcnews-fp-1200-630.jpg,2020-05-08T21:31:15Z,"Brazil's doctors are calling for stricter measures as the daily coronavirus death toll shows little sign of easing while the nations turbulent politics threaten to undermine efforts to combat the spread of the outbreak.
Case numbers have been doubling approx… [+6736 chars]",nbc-news,NBC News
Jessica Hilo,"Cast of ""Community"" to reunite for relief efforts","The cast of cult comedy ""Community"" is reuniting for a virtual table read to benefit COVID-19 relief efforts, according to Variety.",https://www.nbcnews.com/health/health-news/live-blog/2020-05-08-coronavirus-news-n1202636/ncrd1203416,https://media4.s-nbcnews.com/j/newscms/2020_19/3340551/200508-coronavirus-live-blog-social-only_c25d7fa6d3242ec63e1c271efad6be22.nbcnews-fp-1200-630.jpg,2020-05-08T21:26:44Z,"Cast of ""Community"" television show.Sony Pictures Television
The cast of cult comedy Community is reuniting for a virtual table read to benefit COVID-19 relief efforts, according to Variety.
The May 18th show will feature castmembers Joel McHale, Gillian Ja… [+7696 chars]",nbc-news,NBC News
Lauren Egan,No masks and little social distancing at White House meeting,"""So the only reason we would wear masks is if we were trying to protect ourselves from you, in the media,"" said Louie Gohmert, R-Texas, during the meeting at the White House Friday.",https://www.nbcnews.com/politics/white-house/no-masks-little-social-distancing-white-house-meeting-despite-two-n1203336,https://media2.s-nbcnews.com/j/newscms/2020_19/3342791/200508-donald-trump-panel-ew-341p_9ea3d3981917729b17acb60a32180bf5.nbcnews-fp-1200-630.jpg,2020-05-08T21:24:00Z,"WASHINGTON Two White House aides may have tested positive for the coronavirus in the past two days, but President Donald Trump continued to hold public events Friday with limited social distancing and without requiring participants to wear face masks.
Two do… [+4627 chars]",nbc-news,NBC News
NBCNews.com,Solar City: Building Around Nature (Part 4),"After Syd Kitson initially purchased the 91,000 acre plot from the Babcock family in 2006, he turned around and sold 73,000 acres at a discount to the State of Florida to be put into preservation forever. 

By the time Syd Kitson and his team began constructi…",https://www.nbcnews.com/nightly-news/video/solar-city-building-around-nature-part-4-83224645835,https://media14.s-nbcnews.com/j/MSNBC/Components/Video/202005/brad_with_gator0.nbcnews-fp-1200-630.jpg,2020-05-08T21:23:52Z,,nbc-news,NBC News
,The Week in Pictures,The Week in Pictures,https://www.nbcnews.com/health/health-news/live-blog/2020-05-08-coronavirus-news-n1202636/ncrd1203411,https://media4.s-nbcnews.com/j/newscms/2020_19/3340551/200508-coronavirus-live-blog-social-only_c25d7fa6d3242ec63e1c271efad6be22.nbcnews-fp-1200-630.jpg,2020-05-08T21:18:16Z,"California governor: All registered voters will receive mail-in ballots
California Gov. Gavin Newsom, citing risks brought by the coronavirus pandemic, on Friday ordered election officials to mail all registered voters in the state a ballot that can be fille… [+7601 chars]",nbc-news,NBC News
April Glaser,Apple to reopen some stores next week,"The first Apple Store to reopen since the country went into lockdown to prevent the spread of the coronavirus will be on Monday in Boise, Idaho.",https://www.nbcnews.com/tech/tech-news/apple-reopen-some-stores-next-week-n1203381,https://media4.s-nbcnews.com/j/newscms/2020_19/1768001/161026-apple-logo-store-211p_9edbb31f4f99299459c72087d8868ed8.nbcnews-fp-1200-630.jpg,2020-05-08T21:03:00Z,"Apple will reopen a handful of its stores across the country starting next week, the company said Friday.
The first Apple Store to reopen since the country went into lockdown to prevent the spread of the coronavirus will be on Monday in Boise, Idaho. Later i… [+1987 chars]",nbc-news,NBC News
David K. Li,California governor: All registered voters will receive mail-in ballots,California Governor Gavin Newsom orders that all registered voters get mail-in ballots,https://www.nbcnews.com/health/health-news/live-blog/2020-05-08-coronavirus-news-n1202636/ncrd1203361,https://media4.s-nbcnews.com/j/newscms/2020_19/3340551/200508-coronavirus-live-blog-social-only_c25d7fa6d3242ec63e1c271efad6be22.nbcnews-fp-1200-630.jpg,2020-05-08T20:55:27Z,"California Gov. Gavin Newsom, citing risks brought by the coronavirus pandemic, on Friday ordered election officials to mail all registered voters in the state a ballot that can be filled out at home.
Each county clerk is required to mail ballots before Nove… [+8541 chars]",nbc-news,NBC News
Denise Chow,"As world shelters, scientists raise alarm on another threat: An active hurricane season",Hurricane season is still weeks away but experts are already anticipating that this year could be more active than normal — a forecast that emergency officials may find troubling as much of the country remains in the grips of the coronavirus pandemic.,https://www.nbcnews.com/science/environment/hurricane-season-expected-be-worse-normal-n1203246,https://media3.s-nbcnews.com/j/newscms/2020_18/2564006/ss-180912-hurricane-florence-mn-05_6d3872b0857fded7035c69ba0add10b2.nbcnews-fp-1200-630.jpg,2020-05-08T20:50:36Z,"Hurricane season is still weeks away but experts are already anticipating that this year could be more active than normal a forecast that emergency officials may find troubling as much of the country remains in the grips of the coronavirus pandemic.
The seas… [+3906 chars]",nbc-news,NBC News
Ellen Lamont,Netflix is leaning into 'dating experiments' — too bad the conclusions are useless,Such trite conceptualizations of love offer only slightly more insight than your average episode of “The Bachelor.” And a lot more judgment.,https://www.nbcnews.com/think/opinion/netflix-shows-too-hot-handle-love-blind-offer-more-stereotypes-ncna1202496,https://media4.s-nbcnews.com/j/newscms/2020_19/3342636/200508-too-hot-to-handle-ew-232p_c8df3923fdfd220df172a825f4d29d4e.nbcnews-fp-1200-630.jpg,2020-05-08T20:42:35Z,"On Friday, the cast of the hit Netflix show Too Hot to Handle appeared in a special reunion episode a few short weeks after the series premiered in April. Drama predictably ensued. This shouldnt be a surprise for the millions of people who binged the series a… [+7556 chars]",nbc-news,NBC News
Suzanne Ciechalski,Granddaughter of COVID-19 victim who worked at Smithfield Foods speaks out,"Vy Mai sent a message to Smithfield Foods after her grandpa died from COVID-19. Her aunt and uncle, Smithfield employees, also tested positive for coronavirus.",https://www.nbcnews.com/news/us-news/woman-heartbroken-smithfield-foods-response-grandfather-s-death-coronavirus-n1202576,https://media3.s-nbcnews.com/j/newscms/2020_19/3341641/200507-vy-mai-ac-1034p_896e04d17a02f1cf3c433e3b1c1ee1f7.nbcnews-fp-1200-630.jpg,2020-05-08T20:42:00Z,"A Nebraska woman said she's heartbroken by the response she got from Smithfield Foods after reaching out to share that her grandfather had died from coronavirus and that her aunt and uncle, employees at a plant for the world's largest pork processor, also bec… [+3676 chars]",nbc-news,NBC News
NBCNews.com,Solar City: Building Around Nature (Part 2),"By the time Syd Kitson and his team began constructing the development, they had performed multiple water, wildlife and vegetation studies and formed a plan that allowed for construction that wouldn’t disrupt the surrounding ecosystem.",https://www.nbcnews.com/nightly-news/video/solar-city-building-around-nature-part-2-83224133621,https://media12.s-nbcnews.com/j/MSNBC/Components/Video/202005/bill0.nbcnews-fp-1200-630.jpg,2020-05-08T20:41:53Z,,nbc-news,NBC News
Variety and Reuters,"'RuPaul's Drag Race All Stars' moves back to VH1 from Showtime, reveals cast","The initial decision to move ""All Stars"" to Showtime caught some flack from fans displeased that they would need to subscribe to the pay cable network to see it.",https://www.nbcnews.com/feature/nbc-out/rupaul-s-drag-race-all-stars-moves-back-vh1-showtime-n1203146,https://media2.s-nbcnews.com/j/newscms/2020_15/3304406/200410-rupaul-scret-drag-race-se-436p_c2e2f6ae6350d5d49a4f97cf184bfb21.nbcnews-fp-1200-630.jpg,2020-05-08T20:40:57Z,"LOS ANGELES Shantay, they stay... at VH1.
After the February announcement that ""RuPaul's Drag Race All Stars"" would move from VH1 to Showtime for its fifth season, producers revealed on Friday that the series will in fact remain on VH1 when it premieres on J… [+3561 chars]",nbc-news,NBC News
Erika Edwards,Birx to help lead remdesivir distribution effort as hospitals struggle to access drug,"Hospitals are struggling to access coronavirus treatment drug remdesivir, which was given FDA emergency use authorization. The drug has shown some benefits treating COVID-19.",https://www.nbcnews.com/health/health-news/birx-help-lead-remdesivir-distribution-effort-hospitals-struggle-access-drug-n1202951,https://media3.s-nbcnews.com/j/newscms/2020_17/3318766/200422-remdesivir-ew-1119a_db8f25e224c0a19cf164d527727b3a00.nbcnews-fp-1200-630.jpg,2020-05-08T20:37:25Z,"Dr. Deborah Birx has been tapped to help manage the distribution of remdesivir to hospitals nationwide, the White House said Friday, amid growing frustration among physicians who say they have been unable to access the drug for their sickest COVID-19 patients… [+3612 chars]",nbc-news,NBC News
NBCNews.com,Queen Elizabeth II delivers address honoring VE Day 75th anniversary,"Queen Elizabeth II addressed the United Kingdom in a recorded speech to commemorate the 75th anniversary of VE Day, when World War II ended in Europe.",https://www.nbcnews.com/video/queen-elizabeth-ii-delivers-address-honoring-ve-day-75th-anniversary-83221573725,https://media11.s-nbcnews.com/j/MSNBC/Components/Video/202005/queen-thumb.nbcnews-fp-1200-630.jpg,2020-05-08T20:21:07Z,,nbc-news,NBC News
Julie Tsirkin and Haley Talbot and Garrett Haake,Was it essential for the Senate to return to Washington?,The Senate’s first week back on Capitol Hill amid coronavirus cases still rising in DC accomplished little. Which left some senators asking “Why are we here?”,https://www.nbcnews.com/politics/congress/was-it-essential-senate-return-washington-n1203181,https://media4.s-nbcnews.com/j/newscms/2020_19/3342601/200508-senate-hearing-ew-214p_ee3b607aa9ac2e4c8d6c7cb6e5ba22da.nbcnews-fp-1200-630.jpg,2020-05-08T20:18:05Z,"WASHINGTON The Senates first week back in Washington, where the number of coronavirus cases is expected to peak later in the month, included confirming two nominees who had virtually no opposition, and a hearing on Justin Walker, President Donald Trumps contr… [+5000 chars]",nbc-news,NBC News
Martha C. White,Workers without college degree hit hardest by record unemployment,"While the April jobs report was catastrophic, economists say the data reveals fault lines that put America’s poorest and least-educated workers at risk of falling through the cracks.",https://www.nbcnews.com/business/economy/workers-without-college-degree-hit-hardest-record-unemployment-n1202986,https://media3.s-nbcnews.com/j/newscms/2020_19/3283211/200325-coronavirus-small-business-restaurant-new-york-se-1115a_4aef08c069161019024ceb90a3fd6b60.nbcnews-fp-1200-630.jpg,2020-05-08T20:14:45Z,"While the April jobs report released Friday was catastrophic by any measure, labor economists say the data reveals the economic fault lines that put Americas poorest and least-educated workers at risk of falling through the cracks.
The Bureau of Labor Statis… [+4454 chars]",nbc-news,NBC News
"Jacob Soboroff, Hans Nichols, Peter Alexander, Lauren Egan, Dareh Gregorian",Pence's press secretary tests positive for coronavirus,Pence's press secretary tests positive for coronavirus,https://www.nbcnews.com/health/health-news/live-blog/2020-05-08-coronavirus-news-n1202636/ncrd1203296,https://media4.s-nbcnews.com/j/newscms/2020_19/3340551/200508-coronavirus-live-blog-social-only_c25d7fa6d3242ec63e1c271efad6be22.nbcnews-fp-1200-630.jpg,2020-05-08T20:03:31Z,"One of Vice President Mike Pence's closest aides, press secretary Katie Miller, confirmed to NBC News that she has tested positive for the coronavirus  making her the second administration staffer known to have become infected this week.
Miller, the wife of … [+8372 chars]",nbc-news,NBC News
Linda Givetash and Michele Neubert and David Rudge,"WWII forces would 'admire' U.K. today, queen says on 75th anniversary of war's end in Europe",Queen Elizabeth II praised the public response to the coronavirus crisis on the 75th anniversary of World War II's Victory in Europe (VE) day.,https://www.nbcnews.com/news/world/wwii-forces-would-admire-u-k-today-queen-elizabeth-says-n1202686,https://media4.s-nbcnews.com/j/newscms/2020_15/3296741/200406-queen-speech-mc-1017_31295a3903dde13a24f403d6cc7a0614.nbcnews-fp-1200-630.JPG,2020-05-08T20:00:54Z,"World War II soldiers, sailors and airmen ""would recognize and admire"" the spirit shown by the British public during the current coronavirus lockdown, Queen Elizabeth II said on the 75th anniversary of the war ending in Europe.
In her third address to the na… [+3756 chars]",nbc-news,NBC News
NBCNews.com,Queen Elizabeth II marks V-E Day 75th anniversary with speech,"Queen Elizabeth II delivered a speech to mark and celebrate the 75th anniversary of V-E Day, the end of World War II in Europe.",https://www.nbcnews.com/now/video/queen-elizabeth-ii-marks-v-e-day-75th-anniversary-with-speech-83231813920,https://media12.s-nbcnews.com/j/MSNBC/Components/Video/202005/ott_now_queen75ve_200508_1920x1080.nbcnews-fp-1200-630.jpg,2020-05-08T23:40:50Z,,nbc-news,NBC News
Dennis Romero,Say goodbye to ketchup bottles: FDA issues guidelines for reopening eateries,The U.S. Food and Drug Administration on Friday issued guidelines for food establishments permitted by their state and local governments to reopen.,https://www.nbcnews.com/health/health-news/live-blog/2020-05-08-coronavirus-news-n1202636/ncrd1203471,https://media4.s-nbcnews.com/j/newscms/2020_19/3340551/200508-coronavirus-live-blog-social-only_c25d7fa6d3242ec63e1c271efad6be22.nbcnews-fp-1200-630.jpg,2020-05-08T23:14:20Z,"The U.S. Food and Drug Administration on Friday issued guidelines for food establishments permitted by their state and local governments to reopen.
Among the recommendations: Workers should continue wearing face coverings, businesses should implement ""no tou… [+9467 chars]",nbc-news,NBC News
The Associated Press,Colombian company creates bed that can double as coffin,A Colombian advertising company is pitching a novel if morbid solution to shortages of hospital beds and coffins during the coronavirus pandemic: combine them.,https://www.nbcnews.com/health/health-news/live-blog/2020-05-08-coronavirus-news-n1202636/ncrd1203476,https://media4.s-nbcnews.com/j/newscms/2020_19/3340551/200508-coronavirus-live-blog-social-only_c25d7fa6d3242ec63e1c271efad6be22.nbcnews-fp-1200-630.jpg,2020-05-08T23:07:55Z,"Rodolfo Gomez and his employees demonstrate a cardboard box they say can serve as both a hospital bed and a coffin.
Fernando Vergara / AP
BOGOTA, Colombia A Colombian advertising company is pitching a novel if morbid solution to shortages of hospital beds a… [+8212 chars]",nbc-news,NBC News
NBCNews.com,Calif. Gov. Newsom says all registered voters to receive mail-in ballot,"California Gov. Gavin Newsom announced that all registered voters in the state will receive a mail-in ballot before the November election, but that physical polling places will also be available.",https://www.nbcnews.com/video/calif-gov-newsom-says-all-registered-voters-to-receive-mail-in-ballot-83230789657,https://media12.s-nbcnews.com/j/MSNBC/Components/Video/202005/f_mo_la_newsom_vote_200508__553493.nbcnews-fp-1200-630.jpg,2020-05-08T23:06:56Z,,nbc-news,NBC News
The Associated Press,Colombian company creates bed that can double as coffin,"A Colombian advertising company, ABC Displays, is pitching a novel if morbid solution to shortages of hospital beds and coffins during the coronavirus pandemic: combine them.",https://www.nbcnews.com/news/world/colombian-company-creates-bed-can-double-coffin-n1203451,https://media1.s-nbcnews.com/j/newscms/2020_19/3343241/200508-bogota-coffin-cardboard-ac-653p_8827d78effdc5cd5a27897d832a0679b.nbcnews-fp-1200-630.jpg,2020-05-08T23:00:31Z,"BOGOTA, Colombia (AP) A Colombian advertising company is pitching a novel if morbid solution to shortages of hospital beds and coffins during the coronavirus pandemic: combine them.
ABC Displays has created a cardboard bed with metal railings that designers … [+1590 chars]",nbc-news,NBC News
NBCNews.com,A special Mother's Day for mother-daughter nurses fighting coronavirus,"Gina Tuazon was ecstatic when her daughter, Chelsea, decided to follow in her footsteps into nursing. Now the pair work on the same floor at Mount Sinai Hospital in New York, a touching journey they cherish this Mother’s Day on the front lines of the pandemic.",https://www.nbcnews.com/nightly-news/video/a-special-mother-s-day-for-mother-daughter-nurses-fighting-coronavirus-83230277856,https://media12.s-nbcnews.com/j/MSNBC/Components/Video/202005/nn_cbe_mother_daughter_nurses_200508_1920x1080.nbcnews-fp-1200-630.jpg,2020-05-08T22:59:24Z,,nbc-news,NBC News
NBCNews.com,Dallas cafeteria workers keep families fed with schools closed,"Cafeteria manager Yolanda Fisher and her colleagues have served more than 60,000 meals to families in need since Dallas schools shut down because of the coronavirus pandemic.",https://www.nbcnews.com/nightly-news/video/dallas-cafeteria-workers-keep-families-fed-with-schools-closed-83230277812,https://media12.s-nbcnews.com/j/MSNBC/Components/Video/202005/nn_lho_cafeteria_worker_200508_1920x1080.nbcnews-fp-1200-630.jpg,2020-05-08T22:55:23Z,,nbc-news,NBC News
Dennis Romero,Sheriff sues China over virus-related losses,"The sheriff of a Louisiana parish filed a federal lawsuit Friday against China, claiming it unleashed coronavirus and then lied about how potent it was.",https://www.nbcnews.com/health/health-news/live-blog/2020-05-08-coronavirus-news-n1202636/ncrd1203456,https://media4.s-nbcnews.com/j/newscms/2020_19/3340551/200508-coronavirus-live-blog-social-only_c25d7fa6d3242ec63e1c271efad6be22.nbcnews-fp-1200-630.jpg,2020-05-08T22:50:05Z,"The sheriff of a Louisiana parish filed a federal lawsuit Friday against China, claiming it essentially unleashed coronavirus.
Tangipahoa Parish Sheriff Daniel Edwards is the brother of Louisiana Gov. John Bel Edwards, who said Friday that state Attorney Gen… [+9244 chars]",nbc-news,NBC News
NBCNews.com,Inside Microsoft’s high-tech plan to speed up coronavirus vaccine efforts,A massive new project by Microsoft hopes to use supercomputers to decipher what’s in a coronavirus survivor’s blood that helped them recover. The effort aims to help researchers develop a vaccine.,https://www.nbcnews.com/nightly-news/video/inside-microsoft-s-high-tech-plan-to-speed-up-coronavirus-vaccine-efforts-83230789534,https://media12.s-nbcnews.com/j/MSNBC/Components/Video/202005/nn_ksa_microsoft_antibodies_200508_1920x1080.nbcnews-fp-1200-630.jpg,2020-05-08T22:49:28Z,,nbc-news,NBC News
NBCNews.com,Father and son make first court appearance in death of Ahmaud Arbery,Gregory and Travis McMichael were denied bail in their first court appearance after the death of 25-year-old Ahmaud Arbery. The father and son have been charged with felony murder.,https://www.nbcnews.com/nightly-news/video/father-and-son-make-first-court-appearance-in-death-of-ahmaud-arbery-83230789507,https://media13.s-nbcnews.com/j/MSNBC/Components/Video/202005/nn_bal_ahmaud_arbery_200508_1920x1080.nbcnews-fp-1200-630.jpg,2020-05-08T22:47:10Z,,nbc-news,NBC News
NBCNews.com,Most of the U.S. will be partially reopened by this weekend,Nearly every state in the country will have eased some coronavirus restrictions by this weekend. Georgia was the first state to reopen two weeks ago and has seen a 40 percent increase in cases.,https://www.nbcnews.com/nightly-news/video/most-of-the-u-s-will-be-partially-reopened-by-this-weekend-83229765758,https://media13.s-nbcnews.com/j/MSNBC/Components/Video/202005/nn_mal_us_reopening_200508_1920x1080.nbcnews-fp-1200-630.jpg,2020-05-08T22:43:45Z,,nbc-news,NBC News
NBCNews.com,Food bank lines grow across the U.S. as unemployment soars,"Many Americans are turning to food banks for help, while farmers are struggling to get their products to customers. States are now working to get those resources to families in need.",https://www.nbcnews.com/nightly-news/video/food-bank-lines-grow-across-the-u-s-as-unemployment-soars-83229253965,https://media12.s-nbcnews.com/j/MSNBC/Components/Video/202005/nn_ggu_food_distribution_supply_200508_1920x1080.nbcnews-fp-1200-630.jpg,2020-05-08T22:41:30Z,,nbc-news,NBC News
