author,title,description,url,urlToImage,publishedAt,content,source.id,source.name
,Widow sues over NC trucker's death in Chesapeake Bay plunge,"NORFOLK, Va. (AP) — The widow of a North Carolina truck driver who died when his rig plunged off Virginia’s Chesapeake Bay Bridge-Tunnel in 2017 is suing for $6 million.",https://apnews.com/f40f881e6dfb54407e5b53fd4850698e,https://bloximages.newyork1.vip.townnews.com/roanoke.com/content/tncms/custom/image/00f1ee32-f2d0-11e6-9926-f7249dbfe53a.jpg,2020-01-25T18:16:46Z,"NORFOLK, Va. (AP) The widow of a North Carolina truck driver who died when his rig plunged off Virginias Chesapeake Bay Bridge-Tunnel in 2017 is suing for $6 million.
The lawsuit filed by Billie Jo Chen against the CBBT says the bridge-tunnels own wind and g… [+2426 chars]",associated-press,Associated Press
,Raimondo announces nominees for university board of trustees,"PROVIDENCE, R.I. (AP) — Rhode Island Gov. Gina Raimondo has announced 17 nominations to the board of trustees for the University of Rhode Island.",https://apnews.com/4d9878163ec527fe3f707207c4531e69,https://bloximages.newyork1.vip.townnews.com/roanoke.com/content/tncms/custom/image/00f1ee32-f2d0-11e6-9926-f7249dbfe53a.jpg,2020-01-25T18:14:31Z,"PROVIDENCE, R.I. (AP) Rhode Island Gov. Gina Raimondo has announced 17 nominations to the board of trustees for the University of Rhode Island.
The board's responsibilities include overseeing employment and hiring the president, as well as real estate, purch… [+747 chars]",associated-press,Associated Press
,2 found dead in Colorado's Rocky Mountain National Park,"ESTES PARK, Colo. (AP) — Two people were found dead in Rocky Mountain National Park in north-central Colorado, park officials said.",https://apnews.com/9c95b468a1b5705392ba031df1745790,https://bloximages.newyork1.vip.townnews.com/roanoke.com/content/tncms/custom/image/00f1ee32-f2d0-11e6-9926-f7249dbfe53a.jpg,2020-01-25T18:11:54Z,"ESTES PARK, Colo. (AP) Two people were found dead in Rocky Mountain National Park in north-central Colorado, park officials said.
Park Rangers had been notified about a suicidal person Friday afternoon and were searching for that individual when their vehicl… [+800 chars]",associated-press,Associated Press
,Kenosha County: Shoreline damage is state of emergency,"KENOSHA, Wis. (AP) — Kenosha County has declared a state of emergency after a winter storm earlier this month caused shoreline flooding and damage.",https://apnews.com/3633761639c92b227e370586fb979ab9,https://bloximages.newyork1.vip.townnews.com/roanoke.com/content/tncms/custom/image/00f1ee32-f2d0-11e6-9926-f7249dbfe53a.jpg,2020-01-25T18:11:17Z,"KENOSHA, Wis. (AP) Kenosha County has declared a state of emergency after a winter storm earlier this month caused shoreline flooding and damage.
The declaration is the first step in requesting federal disaster relief. The Jan. 11 storm brought strong winds … [+949 chars]",associated-press,Associated Press
,"Gene Corrigan, ex-ACC commissioner and NCAA head, dies at 91","GREENSBORO, N.C. (AP) — Former Atlantic Coast Conference Commissioner and NCAA President Gene Corrigan has died. He was 91.",https://apnews.com/24e3716d0d8daf6fcfaa5b2993eaad76,https://bloximages.newyork1.vip.townnews.com/roanoke.com/content/tncms/custom/image/00f1ee32-f2d0-11e6-9926-f7249dbfe53a.jpg,2020-01-25T18:11:14Z,"GREENSBORO, N.C. (AP) Former Atlantic Coast Conference Commissioner and NCAA President Gene Corrigan has died. He was 91.
The league said Saturday he died peacefully overnight surrounded by his family in Charlottesville, Virginia.
Corrigan was the ACCs thir… [+1504 chars]",associated-press,Associated Press
,Salma Hayek apologizes for praising controversial new novel,"NEW YORK (AP) — Salma Hayek is apologizing for promoting a controversial new novel, Jeanine Cummins' “American Dirt,” without actually reading it.",https://apnews.com/72caf2ff7ea49bc69eb1fe435dac4ed9,https://bloximages.newyork1.vip.townnews.com/roanoke.com/content/tncms/assets/v3/editorial/e/2e/e2edaad9-dbb6-592f-95c6-8ed4b7331b1c/5e2c860931fa5.image.jpg?crop=1701%2C957%2C0%2C130&resize=1120%2C630&order=crop%2Cresize,2020-01-25T18:11:07Z,"NEW YORK (AP) Salma Hayek is apologizing for promoting a controversial new novel, Jeanine Cummins' American Dirt, without actually reading it.
“American Dirt,” published Tuesday, tells the story of a Mexican woman and her 8-year-old son fleeing to the U.S. b… [+1367 chars]",associated-press,Associated Press
,"Police: 2 men hospitalized after shooting, stabbing in Maine","GARDINER, Maine (AP) — One man was shot and another stabbed in an altercation that's being investigated by state police, officials said Saturday.",https://apnews.com/442f82164531003f61b87e8197e7228d,https://bloximages.newyork1.vip.townnews.com/roanoke.com/content/tncms/custom/image/00f1ee32-f2d0-11e6-9926-f7249dbfe53a.jpg,2020-01-25T18:04:40Z,"GARDINER, Maine (AP) One man was shot and another stabbed in an altercation that's being investigated by state police, officials said Saturday.
State police used a tracking dog to find a suspected assailant hiding in the foundation of an abandoned building, … [+714 chars]",associated-press,Associated Press
By NICOLE WINFIELD Associated Press,Cardinal at center of 2 Popes storm doubles down on celibacy,"VATICAN CITY (AP) — A Vatican cardinal at the center of a storm over a book about celibacy and the Catholic priesthood is denouncing the “brutality” of criticism directed at him and his collaborator, Emeritus Pope Benedict XVI.",https://apnews.com/0967d5598e4c36a34b3f5babc5ebde87,https://bloximages.newyork1.vip.townnews.com/roanoke.com/content/tncms/assets/v3/editorial/9/c7/9c761a9e-bb67-5ca3-9c6a-f47399a88393/5e1d98ea0776d.image.jpg?crop=1229%2C691%2C0%2C496&resize=1120%2C630&order=crop%2Cresize,2020-01-25T18:00:45Z,"VATICAN CITY (AP) A Vatican cardinal at the center of a storm over a book about celibacy and the Catholic priesthood is denouncing the brutality of criticism directed at him and his collaborator, Emeritus Pope Benedict XVI.
In an interview with Italian daily… [+2693 chars]",associated-press,Associated Press
MATT SUGAM Associated Press,No. 24 Rutgers tops Nebraska 75-72 on Baker's 3-pointer,"PISCATAWAY, NJ (AP) — Geo Baker hit a 3-pointer with 1.2 seconds left to send No. 24 Rutgers past Nebraska 75-72 Saturday to raise the Scarlet Knights' home record to 14-0.",https://apnews.com/5ee09530db876b0a29a73a344e1da8fc,https://bloximages.newyork1.vip.townnews.com/stltoday.com/content/tncms/custom/image/4ce82390-59b2-11e6-a3c5-b77ec6e8d16d.png?resize=600%2C517,2020-01-25T21:58:18Z,"PISCATAWAY, NJ (AP) Geo Baker hit a 3-pointer with 1.2 seconds left to send No. 24 Rutgers past Nebraska 75-72 Saturday to raise the Scarlet Knights' home record to 14-0.
Rutgers had four double-digit scorers, with Akwaski Yeboah leading the way with 20 poin… [+1011 chars]",associated-press,Associated Press
,"Rayman, Ivanauskas lead Colgate past American 79-69","WASHINGTON (AP) — Will Rayman scored 19 points and grabbed 16 rebounds, four players reached double-figure scoring and Colgate defeated American 79-69 Saturday.",https://apnews.com/4b02496da398407dd6ce6d78c0486a4e,https://bloximages.newyork1.vip.townnews.com/stltoday.com/content/tncms/custom/image/4ce82390-59b2-11e6-a3c5-b77ec6e8d16d.png?resize=600%2C517,2020-01-25T21:57:05Z,"WASHINGTON (AP) Will Rayman scored 19 points and grabbed 16 rebounds, four players reached double-figure scoring and Colgate defeated American 79-69 Saturday.
The 6-foot-9 Rayman was 8-for-9 shooting and snatched 11 of his 16 rebounds off the defensive glass… [+906 chars]",associated-press,Associated Press
,Atalanta back into Champions League contention with 7-0 rout,ROME (AP) — Atalanta revived its chances of earning another Champions League campaign with a 7-0 rout at Torino in Serie A on Saturday.,https://apnews.com/1e4839e3fe4251eb0d1b5e7f8f0511b1,https://bloximages.newyork1.vip.townnews.com/stltoday.com/content/tncms/assets/v3/editorial/3/d1/3d111488-b4f6-58cc-a60d-fd7a5b936915/5e2cbdf9edbe7.image.jpg?crop=1763%2C992%2C0%2C92&resize=1120%2C630&order=crop%2Cresize,2020-01-25T21:55:54Z,"ROME (AP) Atalanta revived its chances of earning another Champions League campaign with a 7-0 rout at Torino in Serie A on Saturday.
Josip Ilicic scored a hat trick, including one goal from near the halfway line, and Luis Muriel added a brace as the Bergamo… [+966 chars]",associated-press,Associated Press
,Kentucky prosecutor who urged pardon absent from courtroom,"HOPKINSVILLE, Ky. (AP) — A Kentucky prosecutor has been absent from court in the weeks following the release of the letter where he asked former Gov. Matt Bevin to pardon a man convicted of sexual abuse.",https://apnews.com/3a1563404636a9c8a68152ffa6c3b9ee,https://bloximages.newyork1.vip.townnews.com/roanoke.com/content/tncms/custom/image/00f1ee32-f2d0-11e6-9926-f7249dbfe53a.jpg,2020-01-25T21:52:37Z,"HOPKINSVILLE, Ky. (AP) A Kentucky prosecutor has been absent from court in the weeks following the release of the letter where he asked former Gov. Matt Bevin to pardon a man convicted of sexual abuse.
Two judges in Christian County said there is an agreemen… [+1405 chars]",associated-press,Associated Press
,Judge finds probable cause to charge Wyoming man with murder,"CHEYENNE, Wyo. (AP) — A Wyoming judge has found probable cause to pursue a first-degree murder charge against a Cheyenne man charged with killing his girlfriend in November.",https://apnews.com/6f9f56add3b322e5008912b2c4ddd5a7,https://bloximages.newyork1.vip.townnews.com/roanoke.com/content/tncms/custom/image/00f1ee32-f2d0-11e6-9926-f7249dbfe53a.jpg,2020-01-25T21:52:05Z,"CHEYENNE, Wyo. (AP) A Wyoming judge has found probable cause to pursue a first-degree murder charge against a Cheyenne man charged with killing his girlfriend in November.
A preliminary hearing was held Friday for Joseph Underwood, 45, in the Nov. 1 death of… [+1509 chars]",associated-press,Associated Press
,"Police: Husband kills wife, self near Yakima","SELAH, Wash. (AP) —",https://apnews.com/5e257b98d4dd33f603f113811a37f9c7,https://bloximages.newyork1.vip.townnews.com/roanoke.com/content/tncms/custom/image/00f1ee32-f2d0-11e6-9926-f7249dbfe53a.jpg,2020-01-25T21:49:24Z,"SELAH, Wash. (AP) 
Police say a man killed his 30-year-old wife at their home near Yakima.
Officers were called to the couples home around 1:20 a.m. Friday for a welfare check on 30-year-old Daniel Escamilla, Selah police said.
The Yakima-Herald Republic r… [+414 chars]",associated-press,Associated Press
By ELLIOT SPAGAT Associated Press,Border Patrol allows replanting after bulldozing garden,"SAN DIEGO (AP) — The Border Patrol, reacting to a breach it discovered in a steel-pole border wall believed to be used by smugglers, gave activists no warning this month when it bulldozed the U.S. side of a cross-border garden…",https://apnews.com/6c30228f3a0bccc5782681567d02f603,https://bloximages.newyork1.vip.townnews.com/richmond.com/content/tncms/custom/image/6a12cdcc-99eb-11e9-910a-20677ce06c14.jpg?resize=600%2C600,2020-01-25T21:48:41Z,"SAN DIEGO (AP) The Border Patrol, reacting to a breach it discovered in a steel-pole border wall believed to be used by smugglers, gave activists no warning this month when it bulldozed the U.S. side of a cross-border garden on an iconic bluff overlooking the… [+4368 chars]",associated-press,Associated Press
,Ex-trooper denies collecting pay for holidays he didn't work,"FALL RIVER, Mass. (AP) — A retired Massachusetts State Police lieutenant has pleaded not guilty to collecting more than $11,500 in holiday pay he had not earned.",https://apnews.com/6544f421c5241eb1aec5d08fe0ac87c6,https://bloximages.newyork1.vip.townnews.com/roanoke.com/content/tncms/custom/image/00f1ee32-f2d0-11e6-9926-f7249dbfe53a.jpg,2020-01-25T21:47:45Z,"FALL RIVER, Mass. (AP) A retired Massachusetts State Police lieutenant has pleaded not guilty to collecting more than $11,500 in holiday pay he had not earned.
David Andrade, 47, of Westport, was released on personal recognizance after pleading not guilty Fr… [+794 chars]",associated-press,Associated Press
By BARRY WILNER AP Sports Writer,Chen soars to personal best and US short program victory,"GREENSBORO, N.C. (AP) — Coming off illness and spending much of his days as a full-time college student, Nathan Chen shouldn't have been capable of setting a personal best Saturday at the U.S. Figure Skating Championships.",https://apnews.com/9e13a58d7cc7f8388620914ffac6cb9f,https://bloximages.newyork1.vip.townnews.com/stltoday.com/content/tncms/assets/v3/editorial/5/c8/5c80e138-3b99-5479-a0f1-177f98c5ec50/5e28aa9585739.image.jpg?crop=1763%2C992%2C0%2C91&resize=1120%2C630&order=crop%2Cresize,2020-01-25T21:47:18Z,"It's the way Raf teaches us, Chen said of being on his own in Connecticut, with Arutunian in California. When we're young he wants us to be productive and learn to be self-sufficient as kids. By the time we're at this level, we still need him and he is a grea… [+1197 chars]",associated-press,Associated Press
,Defense shines as Winthrop defeats Presbyterian 72-57,"ROCK HILL, S.C. (AP) — Hunter Hale recorded 19 points as Winthrop won its 10th consecutive game, topping Presbyterian 72-57 on Saturday. Micheal Anumba added 11 points and six rebounds for the Eagles, who forced a season-high 26 turnovers.",https://apnews.com/d4c11e1136a4401f3d3e1196fe07c197,https://bloximages.newyork1.vip.townnews.com/stltoday.com/content/tncms/custom/image/4ce82390-59b2-11e6-a3c5-b77ec6e8d16d.png?resize=600%2C517,2020-01-25T21:47:11Z,"ROCK HILL, S.C. (AP) Hunter Hale recorded 19 points as Winthrop won its 10th consecutive game, topping Presbyterian 72-57 on Saturday. Micheal Anumba added 11 points and six rebounds for the Eagles, who forced a season-high 26 turnovers.
D.J. Burns had 10 po… [+678 chars]",associated-press,Associated Press
,LaRavia scores 20 to carry Indiana St. past Bradley 61-53,"TERRE HAUTE, Ind. (AP) — Jake LaRavia had 20 points and 10 rebounds as Indiana State won its eighth consecutive home game, topping Bradley 61-53 on Saturday.",https://apnews.com/9bd508df6fe26aae282aea10bf44978a,https://bloximages.newyork1.vip.townnews.com/stltoday.com/content/tncms/custom/image/4ce82390-59b2-11e6-a3c5-b77ec6e8d16d.png?resize=600%2C517,2020-01-25T21:46:33Z,"TERRE HAUTE, Ind. (AP) Jake LaRavia had 20 points and 10 rebounds as Indiana State won its eighth consecutive home game, topping Bradley 61-53 on Saturday.
LaRavia shot 8 for 10 from the free-throw line. He added four blocks.
Christian Williams had 13 point… [+819 chars]",associated-press,Associated Press
,Michigan regulators approve smaller utility rate increase,"FORT WAYNE, Ind. (AP) — Michigan regulators this week approved a rate increase for Indiana Michigan Power, though one significantly smaller than initially sought by the utility.",https://apnews.com/56c5d6a4d4d57c8edc0a6be09c8e1b03,https://bloximages.newyork1.vip.townnews.com/roanoke.com/content/tncms/custom/image/00f1ee32-f2d0-11e6-9926-f7249dbfe53a.jpg,2020-01-25T21:46:12Z,"FORT WAYNE, Ind. (AP) Michigan regulators this week approved a rate increase for Indiana Michigan Power, though one significantly smaller than initially sought by the utility.
The Michigan Public Service Commission approved an agreement Thursday allowing the… [+812 chars]",associated-press,Associated Press
,Johnson leads Appalachian St. past Coastal Carolina 78-58,"CONWAY, S.C. (AP) — Isaac Johnson matched his career high with a season-high 22 points as Appalachian State romped past Coastal Carolina 78-58 on Saturday.",https://apnews.com/e5ae59adf63e56cd8d6ecdcfb1494c9a,https://bloximages.newyork1.vip.townnews.com/stltoday.com/content/tncms/custom/image/4ce82390-59b2-11e6-a3c5-b77ec6e8d16d.png?resize=600%2C517,2020-01-25T21:43:58Z,"CONWAY, S.C. (AP) Isaac Johnson matched his career high with a season-high 22 points as Appalachian State romped past Coastal Carolina 78-58 on Saturday.
The Mountaineers built a 21-4 lead and never trailed. They extended the lead to 40-22 at intermission. T… [+1007 chars]",associated-press,Associated Press
,3 Indiana teens charged in fatal rollover accident,Three Anderson teens have been charged for their alleged roles in a crash last weekend that killed a 19-year-old Ball State University student.,https://apnews.com/3eac1ef56fedf54edc71fe1a6aaffc4f,https://bloximages.newyork1.vip.townnews.com/roanoke.com/content/tncms/custom/image/00f1ee32-f2d0-11e6-9926-f7249dbfe53a.jpg,2020-01-25T21:43:26Z,"Three Anderson teens have been charged for their alleged roles in a crash last weekend that killed a 19-year-old Ball State University student.
According to the (Muncie) Star Press, police said 19-year-old Sophie D. Robbins of Dunkirk was driving in Anderson… [+1043 chars]",associated-press,Associated Press
By DANICA COTO Associated Press,5.0 quake hits southern Puerto Rico amid ongoing tremors,"SAN JUAN, Puerto Rico (AP) — A 5.0 magnitude earthquake hit southern Puerto Rico on Saturday at a shallow depth, raising concerns about unstable infrastructure in a region that has been hit by quakes every day for nearly a month.",https://apnews.com/64a128465991d199aed6bc25c51171ed,https://bloximages.newyork1.vip.townnews.com/richmond.com/content/tncms/custom/image/6a12cdcc-99eb-11e9-910a-20677ce06c14.jpg?resize=600%2C600,2020-01-25T21:43:00Z,"SAN JUAN, Puerto Rico (AP) A 5.0 magnitude earthquake hit southern Puerto Rico on Saturday at a shallow depth, raising concerns about unstable infrastructure in a region that has been hit by quakes every day for nearly a month.
The U.S. Geological Survey sai… [+1747 chars]",associated-press,Associated Press
,Figueroa lifts St. John's over DePaul 79-66,CHICAGO (AP) — LJ Figueroa scored a career-high 28 points as St. John's topped DePaul 79-66 on Saturday. Mustapha Heron added 20 points for the Red Storm.,https://apnews.com/1a53c6f81d1deca07d8f33d5af380805,https://bloximages.newyork1.vip.townnews.com/stltoday.com/content/tncms/custom/image/4ce82390-59b2-11e6-a3c5-b77ec6e8d16d.png?resize=600%2C517,2020-01-25T21:42:32Z,"CHICAGO (AP) LJ Figueroa scored a career-high 28 points as St. John's topped DePaul 79-66 on Saturday. Mustapha Heron added 20 points for the Red Storm.
Rasheem Dunn had 13 points and eight rebounds for St. John's (13-8, 2-6 Big East Conference), which ended… [+842 chars]",associated-press,Associated Press
,Navajo Nation purchases land that includes gravel pit,"WINDOW ROCK, Ariz. (AP) — The Navajo Nation has purchased 1250 acres (506 hectares) of land that includes a gravel pit that the tribe plans to use to obtain sand and gravel for road work and other projects.",https://apnews.com/fc73c07858fbf2073e16d40918544864,https://bloximages.newyork1.vip.townnews.com/roanoke.com/content/tncms/custom/image/00f1ee32-f2d0-11e6-9926-f7249dbfe53a.jpg,2020-01-25T21:39:48Z,"WINDOW ROCK, Ariz. (AP) The Navajo Nation has purchased 1250 acres (506 hectares) of land that includes a gravel pit that the tribe plans to use to obtain sand and gravel for road work and other projects.
The Gallup Independent reported that gravel pit's ope… [+890 chars]",associated-press,Associated Press
By JIM VERTUNO AP Sports Writer,Watford scores 22 and LSU overcomes Texas rally 69-67,"AUSTIN, Texas (AP) — Trendon Watford scored 22 points and LSU survived a furious second-half rally by Texas to earn a 69-67 win Saturday, the eighth in a row for the surging Tigers.",https://apnews.com/55d236b0f64b7b0d40b0e563e0bb02b8,https://bloximages.newyork1.vip.townnews.com/stltoday.com/content/tncms/assets/v3/editorial/4/94/4948cd03-78cc-505c-b800-55dc47bd791f/5e2cbacf9123e.image.jpg?crop=1220%2C686%2C0%2C505&resize=1120%2C630&order=crop%2Cresize,2020-01-25T21:37:15Z,"AUSTIN, Texas (AP) Trendon Watford scored 22 points and LSU survived a furious second-half rally by Texas to earn a 69-67 win Saturday, the eighth in a row for the surging Tigers.
Watford's tough layup put the Tigers up 62-60 before Skylar Mays made two free… [+1249 chars]",associated-press,Associated Press
,Trooper's duties limited pending probe into fatal shooting,"NEW HAVEN, Conn. (AP) — A coalition of religious leaders and the family of a 19-year-old man shot and killed by a Connecticut State Police trooper have come to an agreement with the state on the duty status of the…",https://apnews.com/bfd3a501f197117426b420ba43a16833,https://bloximages.newyork1.vip.townnews.com/roanoke.com/content/tncms/custom/image/00f1ee32-f2d0-11e6-9926-f7249dbfe53a.jpg,2020-01-25T21:34:42Z,"NEW HAVEN, Conn. (AP) A coalition of religious leaders and the family of a 19-year-old man shot and killed by a Connecticut State Police trooper have come to an agreement with the state on the duty status of the trooper involved in the shooting, a pastor anno… [+1251 chars]",associated-press,Associated Press
,Funk scores 26 to lead Army over Navy 73-66,"ANNAPOLIS, Md. (AP) — Tommy Funk matched his career high with a season-high 26 points as Army beat Navy 73-66 on Saturday.",https://apnews.com/2a8fd87498627da8ea946a966e3b2728,https://bloximages.newyork1.vip.townnews.com/stltoday.com/content/tncms/custom/image/4ce82390-59b2-11e6-a3c5-b77ec6e8d16d.png?resize=600%2C517,2020-01-25T21:33:53Z,"ANNAPOLIS, Md. (AP) Tommy Funk matched his career high with a season-high 26 points as Army beat Navy 73-66 on Saturday.
Matt Wilson had 18 points for Army (9-10, 4-4 Patriot League), which won its fourth consecutive game. Josh Caldwell added 10 points and 1… [+632 chars]",associated-press,Associated Press
,Trio carries Massachusetts to 73-64 upset win over Duquesne,"AMHERST, Mass. (AP) — Freshman Tre Mitchell tossed in 25 points, Preston Santos and Samba Diallo posted double-doubles and Massachusetts upset Duquesne 73-64 on Saturday.",https://apnews.com/4413f0616c4bac93feb6b2fe200dfe2e,https://bloximages.newyork1.vip.townnews.com/stltoday.com/content/tncms/custom/image/4ce82390-59b2-11e6-a3c5-b77ec6e8d16d.png?resize=600%2C517,2020-01-25T21:32:57Z,"AMHERST, Mass. (AP) Freshman Tre Mitchell tossed in 25 points, Preston Santos and Samba Diallo posted double-doubles and Massachusetts upset Duquesne 73-64 on Saturday.
Mitchell sank 8 of 15 shots from the floor, including two 3-pointers, and added eight reb… [+1016 chars]",associated-press,Associated Press
,Brodeur scores 19 to carry Penn over Temple 66-59,PHILADELPHIA (AP) — AJ Brodeur had 19 points as Penn topped Temple 66-59 on Saturday.,https://apnews.com/f79faf7b6b7ddb8ba971072807ed26c7,https://bloximages.newyork1.vip.townnews.com/stltoday.com/content/tncms/custom/image/4ce82390-59b2-11e6-a3c5-b77ec6e8d16d.png?resize=600%2C517,2020-01-25T21:30:41Z,"PHILADELPHIA (AP) AJ Brodeur had 19 points as Penn topped Temple 66-59 on Saturday.
Jordan Dingle had 15 points for Penn (8-7). Devon Goodman added 12 points. Ryan Betley had 11 points and a career-high 14 rebounds.
Both teams set season lows for points in … [+605 chars]",associated-press,Associated Press
,"Youngstown State needs overtime to hold off Green Bay, 98-94","YOUNGSTOWN, Ohio (AP) — Devin Morgan knocked down a career-high six 3-pointers and Darius Quisenberry scored the final six points in overtime to help Youngstown State hold off Wisconsin-Green Bay, 98-94 on Saturday afternoon.",https://apnews.com/8ffee1682d4f09dba8e37499be930066,https://bloximages.newyork1.vip.townnews.com/stltoday.com/content/tncms/custom/image/4ce82390-59b2-11e6-a3c5-b77ec6e8d16d.png?resize=600%2C517,2020-01-25T21:26:05Z,"YOUNGSTOWN, Ohio (AP) Devin Morgan knocked down a career-high six 3-pointers and Darius Quisenberry scored the final six points in overtime to help Youngstown State hold off Wisconsin-Green Bay, 98-94 on Saturday afternoon.
Morgan hit his sixth trey from the… [+899 chars]",associated-press,Associated Press
,2 found dead after shooting at senior living facility,"ANTHEM, Ariz. (AP) — Two people were found dead by Maricopa County sheriff's deputies investigating a shooting Saturday at a senior living facility in an unincorporated area of Anthem in far north metro Phoenix, the Sheriff's Office said.",https://apnews.com/25981b78291b9ac06fa683e4b16d5f8d,https://bloximages.newyork1.vip.townnews.com/roanoke.com/content/tncms/custom/image/00f1ee32-f2d0-11e6-9926-f7249dbfe53a.jpg,2020-01-25T21:23:39Z,"Please purchase a subscription to continue reading.
A subscription is required to continue reading.
If you are a current subscriber please click Sign Up or Login to activate your digital access. If not, please click Sign Up to subscribe.
If you are a curre… [+138 chars]",associated-press,Associated Press
,2 SC teens accused of murder of man found slain in car,"ELGIN, S.C. (AP) — Two teenagers are in custody accused in the fatal shooting of a South Carolina man earlier this month.",https://apnews.com/e902ddc8eb4b3d13b6aedc8aa2786b53,https://bloximages.newyork1.vip.townnews.com/roanoke.com/content/tncms/custom/image/00f1ee32-f2d0-11e6-9926-f7249dbfe53a.jpg,2020-01-25T21:21:18Z,"ELGIN, S.C. (AP) Two teenagers are in custody accused in the fatal shooting of a South Carolina man earlier this month.
The Kershaw County Sheriff's Office on Friday announced the arrests of a 17-year-old boy and Albertina Hattie Jolera Bennett, 18. They eac… [+1566 chars]",associated-press,Associated Press
