author,title,description,url,urlToImage,publishedAt,content,source.id,source.name
,Thiem beats Tsitsipas in 3 sets in ATP Finals opener,LONDON (AP) — Dominic Thiem made sure this year's ATP Finals didn't begin the same way last year's ended.,https://apnews.com/9e09c348f8ee5e1ca5dd945cc59e0186,https://bloximages.newyork1.vip.townnews.com/stltoday.com/content/tncms/assets/v3/editorial/5/40/540e42b2-50da-50f3-a77e-42866055f7b6/5fb16dcc63f70.image.jpg?crop=1820%2C1024%2C0%2C57&resize=1120%2C630&order=crop%2Cresize,2020-11-15T17:42:16Z,"LONDON (AP) Dominic Thiem made sure this year's ATP Finals didn't begin the same way last year's ended.
Thiem outlasted Stefanos Tsitsipas in a rematch of the 2019 final, beating the defending champ… [+1189 chars]",associated-press,Associated Press
,Hall of Fame Dodgers manager Lasorda hospitalized in ICU,"FULLERTON, Calif. (AP) — Hall of Fame manager Tom Lasorda has been hospitalized in Southern California.",https://apnews.com/b5ad46fc249a5ef735a73d07e3c928a9,https://bloximages.newyork1.vip.townnews.com/stltoday.com/content/tncms/assets/v3/editorial/a/13/a13b6128-c562-5d85-8b8d-f643439bc656/5fb16945a789a.image.jpg?crop=1649%2C928%2C0%2C164&resize=1120%2C630&order=crop%2Cresize,2020-11-15T17:20:35Z,FILE - Los Angeles Dodgers former manager and Hall of Famer Tommy Lasorda attends a news conference where Baseball Commissioner Rob Manfred announced that Dodger Stadium will host the All-Star Game i… [+1432 chars],associated-press,Associated Press
,BioNTech scientist: Vaccine could halve virus transmission,"LONDON (AP) — One of the scientists behind the experimental coronavirus vaccine developed by BioNTech and Pfizer said Sunday that he was confident that it could halve the transmission of the virus, resulting in a “dramatic” curb of the virus’…",https://apnews.com/1e1991fc666eebc4f2a2a0a78cb271ce,https://bloximages.newyork1.vip.townnews.com/roanoke.com/content/tncms/assets/v3/editorial/3/37/337cd327-bc36-5f67-ab9d-37620a07979f/5fb1692e13773.image.jpg?crop=1694%2C953%2C0%2C135&resize=1120%2C630&order=crop%2Cresize,2020-11-15T17:10:01Z,"This handout photo taken in Oct. 2020 and provided by Pfizer shows part of a ""freezer farm,"" a football field-sized facility for storing finished COVID-19 vaccines, in Puurs, Belgium. Pfizer's experi… [+1696 chars]",associated-press,Associated Press
,BioNTech scientist: Vaccine could halve virus transmission,"LONDON (AP) — One of the scientists behind the experimental coronavirus vaccine developed by BioNTech and Pfizer said Sunday that he was confident that it could halve the transmission of the virus, resulting in a “dramatic” curb of the virus’…",https://apnews.com/1e1991fc666eebc4f2a2a0a78cb271ce,https://bloximages.newyork1.vip.townnews.com/stltoday.com/content/tncms/assets/v3/editorial/d/22/d22a075c-385f-5b0c-a36d-9f3546df6fc8/5fb169d6b9a67.image.jpg?crop=1694%2C953%2C0%2C135&resize=1120%2C630&order=crop%2Cresize,2020-11-15T17:10:01Z,"LONDON (AP) One of the scientists behind the experimental coronavirus vaccine developed by BioNTech and Pfizer said Sunday that he was confident that it could halve the transmission of the virus, res… [+1088 chars]",associated-press,Associated Press
By The Associated Press,"Eagles get Jeffery, Sanders back for game against Giants",The NFC East-leading Philadelphia Eagles have gotten healthier on offense in time for another division game.,https://apnews.com/83a5420ff069c5dd28e8fa80e911cf19,https://bloximages.newyork1.vip.townnews.com/stltoday.com/content/tncms/assets/v3/editorial/a/45/a45d3b48-4ed0-51f8-8c02-14e5611dd984/5fb16678decbf.image.jpg?crop=1763%2C992%2C0%2C91&resize=1120%2C630&order=crop%2Cresize,2020-11-15T17:09:46Z,"PHILADELPHIA-NY GIANTS
Eagles: WR J.J. Arcega-Whiteside, WR Quez Watkins, QB Nate Sudfeld, DB Craig James, RB Jason Huntley, OL Brett Toth
Giants: WR Dante Pettis, ILB T.J. Brunson, OL Kyle Murphy,… [+820 chars]",associated-press,Associated Press
By The Associated Press,How Ranked Teams Fared,1. Muskego (8-0) beat Arrowhead 38-0.,https://apnews.com/052429bc85373129fa5c3ca2bc25667d,https://bloximages.newyork1.vip.townnews.com/stltoday.com/content/tncms/custom/image/4ce82390-59b2-11e6-a3c5-b77ec6e8d16d.png?resize=600%2C517,2020-11-15T17:09:33Z,"7. Grafton (5-2) lost to West De Pere 7-3.
8. Marshall (6-1) lost to New Holstein 20-8.
9. Wrightstown (6-1) beat Oconto Falls 28-6.
10. Lake Mills (6-2) beat Mauston 56-20.
1. Edgar (8-0) beat P… [+627 chars]",associated-press,Associated Press
By The Associated Press,The Latest: NFL backloads schedule on fall Masters Sunday,The Latest on Week 10 in the NFL (all times EST):,https://apnews.com/8304d85d8910511390693511f913fc5f,https://bloximages.newyork1.vip.townnews.com/stltoday.com/content/tncms/assets/v3/editorial/c/31/c31a5e72-5ea8-5411-ac70-18daf6912a0b/5fb162f393594.image.jpg?crop=1763%2C992%2C0%2C91&resize=1120%2C630&order=crop%2Cresize,2020-11-15T16:55:36Z,"Fans sit in the stands before the first half of an NFL football game between the Carolina Panthers and the Tampa Bay Buccaneers, Sunday, Nov. 15, 2020, in Charlotte , N.C.
Gerry Broome
The Latest o… [+793 chars]",associated-press,Associated Press
By ANDREW SELIGMAN AP Sports Writer,"Vikings-Bears game stirs college memories for Cousins, Foles","CHICAGO (AP) — Kirk Cousins remembers signing to play for Michigan State, then finding out a few weeks later some prospect from football-obsessed Texas was joining the Spartans as part of Mark Dantonio's first recruiting class.",https://apnews.com/beafad6b5b67bdf9a5bf986d1821f9d0,https://bloximages.newyork1.vip.townnews.com/stltoday.com/content/tncms/assets/v3/editorial/8/a7/8a739d02-d36f-5487-b777-ef9684bef6ab/5fb162f4d9d17.image.jpg?crop=1763%2C992%2C0%2C91&resize=1120%2C630&order=crop%2Cresize,2020-11-15T16:55:12Z,"Foles was the MVP of the Philadelphia Eagles' Super Bowl 52 victory over Tom Brady and the New England Patriots. After an injury-filled season in Jacksonville where he lost his starting job, he got t… [+1312 chars]",associated-press,Associated Press
,"Algerian president finishes virus treatment, undergoes tests","ALGIERS, Algeria (AP) — Algerian President Abdelmadjid Tebboune has finished his treatment for COVID-19 in an undisclosed location in Germany, and is undergoing medical tests, his office said Sunday.",https://apnews.com/6acd84c2671b9f2c54c5b6a0c4e5a3d7,https://bloximages.chicago2.vip.townnews.com/billingsgazette.com/content/tncms/assets/v3/editorial/8/e0/8e0b2fe5-4b72-58d5-9b03-914c1fd3d16a/5fa2a70818fce.image.jpg?crop=1763%2C992%2C0%2C91&resize=1120%2C630&order=crop%2Cresize,2020-11-15T16:54:01Z,"FILE - In this Thursday, Dec. 19, 2019 file photo, Algerian president Abdelmadjid Tebboune delivers a speech during an inauguration ceremony in the presidential palace, in Algiers, Algeria. Tebboune … [+2015 chars]",associated-press,Associated Press
By STEFANIE DAZIO Associated Press,Los Angeles County deputies fatally shoot armed man,"LOS ANGELES (AP) — Los Angeles County deputies fatally shot a Black man early Sunday morning after he allegedly pointed a revolver in their direction, authorities said.",https://apnews.com/1dbcb656c9215350526dcb00e56e45f6,https://bloximages.newyork1.vip.townnews.com/roanoke.com/content/tncms/custom/image/00f1ee32-f2d0-11e6-9926-f7249dbfe53a.jpg,2020-11-15T16:44:05Z,"LOS ANGELES (AP) Los Angeles County deputies fatally shot a Black man early Sunday morning after he allegedly pointed a revolver in their direction, authorities said.
The man, whose name has not bee… [+1099 chars]",associated-press,Associated Press
,Scottsdale tribe builds 5-acre memorial to USS Arizona,PHOENIX (AP) — The Salt River Pima-Maricopa Indian Community has built the 5-acre memorial near Scottsdale as a tribute to those who were aboard the USS Arizona when it was attacked and sank at Pearl Harbor in December 1941.,https://apnews.com/0860c39eac83a44c04364e35653893e2,https://bloximages.newyork1.vip.townnews.com/roanoke.com/content/tncms/assets/v3/editorial/e/6b/e6b0d6c4-e122-5848-a105-45187b584976/5fb15bc2dda36.image.jpg?crop=1763%2C992%2C0%2C91&resize=1120%2C630&order=crop%2Cresize,2020-11-15T16:24:35Z,PHOENIX (AP) The Salt River Pima-Maricopa Indian Community has built the 5-acre memorial near Scottsdale as a tribute to those who were aboard the USS Arizona when it was attacked and sank at Pearl H… [+1009 chars],associated-press,Associated Press
Janie Har,"Experts, owners question California business shutdown policy - Associated Press",SAN FRANCISCO (AP) — California’s coronavirus cases are surging and health officials say social gatherings and people not wearing masks or keeping their distance are fueling the rise. Yet it’s...,https://apnews.com/article/public-health-california-san-francisco-infectious-diseases-coronavirus-pandemic-b984084e57c55b4ddc55fc420e757a46,https://storage.googleapis.com/afs-prod/media/c55e56794f8f40b5847b78dfede0ab65/3000.jpeg,2020-11-15T16:20:43Z,SAN FRANCISCO (AP) Californias coronavirus cases are surging and health officials say social gatherings and people not wearing masks or keeping their distance are fueling the rise. Yet its businesses… [+6653 chars],associated-press,Associated Press
By JANIE HAR and DON THOMPSON Associated Press,"Experts, owners question California business shutdown policy",SAN FRANCISCO (AP) — California’s coronavirus cases are surging and health officials say social gatherings and people not wearing masks or keeping their distance are fueling the rise. Yet it’s businesses that are paying the price in the form of…,https://apnews.com/b984084e57c55b4ddc55fc420e757a46,https://bloximages.newyork1.vip.townnews.com/roanoke.com/content/tncms/assets/v3/editorial/2/bb/2bba4973-3b0d-5139-9823-f57dfe45fc4c/5fb15bca1e672.image.jpg?crop=1763%2C992%2C0%2C91&resize=1120%2C630&order=crop%2Cresize,2020-11-15T16:16:23Z,"When those rates rise, more limits are imposed and that's what's happening in much of California by next week more than half the 58 counties will have moved to more restrictive tiers. Four of the sta… [+1171 chars]",associated-press,Associated Press
Ricardo Alonso-zaldivar,Biden advisers to meet vaccine firms as Trump stalls handoff - The Associated Press,"<ol><li>Biden advisers to meet vaccine firms as Trump stalls handoff  The Associated Press
</li><li>Fauci: 'It would be better' if government health officials could start working with incoming Biden-Harris administration  CNN
</li><li>Fauci: ‘Of course it w…",https://apnews.com/article/joe-biden-donald-trump-pandemics-public-health-anthony-fauci-74cf3579be1f0ab3e051cf9b0291ae70,https://storage.googleapis.com/afs-prod/media/0f96c27c2d5a4b35bc55f2c96ebcf718/3000.jpeg,2020-11-15T16:13:44Z,WASHINGTON (AP) Joe Bidens scientific advisers will meet with vaccine makers in coming days as the presidential transition remains stalled because of President Donald Trumps refusal to acknowledge th… [+4945 chars],associated-press,Associated Press
,500 reported arrested in Belarus protests,"KYIV, Ukraine (AP) — A human rights group in Belarus said more than 500 people were arrested in protests around the country calling for authoritarian President Alexander Lukashenko to step down.",https://apnews.com/08bfc91ef675b6218079e41f626a5ccd,https://bloximages.newyork1.vip.townnews.com/roanoke.com/content/tncms/assets/v3/editorial/c/e2/ce25189a-f93d-540f-a0de-4708444c62ff/5fb157c832d57.image.jpg?crop=1764%2C992%2C0%2C90&resize=1120%2C630&order=crop%2Cresize,2020-11-15T16:12:48Z,"KYIV, Ukraine (AP) A human rights group in Belarus said more than 500 people were arrested in protests around the country calling for authoritarian President Alexander Lukashenko to step down.
The S… [+1218 chars]",associated-press,Associated Press
,Sabalenka beats Mertens in Linz for 3rd title of season,"LINZ, Austria (AP) — Aryna Sabalenka beat Elise Mertens 7-5, 6-2 to win the season-ending Upper Austria Ladies Linz on Sunday for her third title of the season.",https://apnews.com/ab966711db7d443dab3acf8fd61fe472,https://bloximages.newyork1.vip.townnews.com/stltoday.com/content/tncms/custom/image/4ce82390-59b2-11e6-a3c5-b77ec6e8d16d.png?resize=600%2C517,2020-11-15T16:10:21Z,"LINZ, Austria (AP) Aryna Sabalenka beat Elise Mertens 7-5, 6-2 to win the season-ending Upper Austria Ladies Linz on Sunday for her third title of the season.
The 11th-ranked Sabalenka from Belarus … [+1105 chars]",associated-press,Associated Press
James Macpherson,North Dakota nurses worry about working with sick colleagues - The Associated Press,"<ol><li>North Dakota nurses worry about working with sick colleagues  The Associated Press
</li><li>North Dakota governor orders statewide mask mandate to curb spread of COVID-19  Fox News
</li><li>Gov. Burgum's New Requirements for Businesses & Gatherings;…",https://apnews.com/article/pandemics-bismarck-fargo-north-dakota-coronavirus-pandemic-c7680d009417c8cd66ffe9b8e3c53c47,https://storage.googleapis.com/afs-prod/media/edd7963f14e44b539c01e9ed2b1f8b5b/3000.jpeg,2020-11-15T16:07:18Z,"BISMARCK, N.D. (AP) Like many medical workers around the world, Fargo emergency room nurse Adam Johnston cant escape the grim reality of the coronavirus pandemic. It follows him everywhere: at work, … [+5751 chars]",associated-press,Associated Press
by SABINA NIKSIC,Bosnians vote in local elections overshadowed by pandemic,"SARAJEVO, Bosnia-Herzegovina (AP) — Bosnians voted Sunday in nationwide municipal elections amid concerns that the turnout will be hurt by a major surge in coronavirus infections and deaths....",https://apnews.com/1b6c0f28d2cf34ea2b376c8b7087ccc5,https://storage.googleapis.com/afs-prod/media/3e88336cf814496cb6e3a8b9ba205ef3/3000.jpeg,2020-11-15T16:05:15Z,"SARAJEVO, Bosnia-Herzegovina (AP) Bosnians voted Sunday in nationwide municipal elections amid concerns that the turnout will be hurt by a major surge in coronavirus infections and deaths. 
Some 3 m… [+2509 chars]",associated-press,Associated Press
By FRANK JORDANS Associated Press,Britain's Prince Charles attends German remembrance ceremony,"BERLIN (AP) — Prince Charles called Sunday for Britain and Germany to remember their long and close ties, reaffirmed by the nations' reconciliation after two world wars, now that the U.K. tries to find its place outside — but also…",https://apnews.com/a68214547c9d90acbd0fba2b38dea20e,https://bloximages.newyork1.vip.townnews.com/roanoke.com/content/tncms/assets/v3/editorial/9/5f/95f8a8f7-ef47-5397-8bd2-bddd34bf011e/5fb157d1b95f2.image.jpg?crop=1729%2C973%2C0%2C112&resize=1120%2C630&order=crop%2Cresize,2020-11-15T16:04:46Z,"The royal couple were received Sunday by German President Frank-Walter Steinmeier and his wife, Elke Buedenbender, at Bellevue Palace. The palace was built in the late 18th century by Prince Augustus… [+1252 chars]",associated-press,Associated Press
By RICARDO ALONSO-ZALDIVAR and WILL WEISSERT Associated Press,Biden advisers to meet vaccine firms as Trump stalls handoff,WASHINGTON (AP) — Joe Biden's scientific advisers will meet with vaccine makers in coming days as the presidential transition remains stalled because of President Donald Trump's refusal to acknowledge that he lost the election. That delayed handoff to the nex…,https://apnews.com/74cf3579be1f0ab3e051cf9b0291ae70,https://bloximages.newyork1.vip.townnews.com/stltoday.com/content/tncms/assets/v3/editorial/a/44/a44fe2a3-ee52-5fbd-b704-7b0534b90bce/5fb15838ad5b8.image.jpg?crop=1828%2C1028%2C0%2C52&resize=1120%2C630&order=crop%2Cresize,2020-11-15T16:04:33Z,"By RICARDO ALONSO-ZALDIVAR and WILL WEISSERT
Associated Press
WASHINGTON (AP) Joe Biden's scientific advisers will meet with vaccine makers in coming days as the presidential transition remains sta… [+1357 chars]",associated-press,Associated Press
By MENELAOS HADJICOSTIS Associated Press,"Erdogan backs two-state Cyprus deal, puts talks in doubt","NICOSIA, Cyprus (AP) — Turkish President Recep Tayyip Erdogan appeared to throw into doubt a new bid to restart dormant Cyprus reunification talks, saying Sunday that a two-state deal rather than the long-established federal formula is the way forward.",https://apnews.com/62119c3a708cb7202a81d7717b726e0f,https://bloximages.newyork1.vip.townnews.com/roanoke.com/content/tncms/assets/v3/editorial/8/89/889a3c08-1261-5f0d-868b-ee8dba014477/5fb154de03c2b.image.jpg?crop=1763%2C992%2C0%2C92&resize=1120%2C630&order=crop%2Cresize,2020-11-15T16:03:16Z,"By MENELAOS HADJICOSTIS
Associated Press
NICOSIA, Cyprus (AP) Turkish President Recep Tayyip Erdogan appeared to throw into doubt a new bid to restart dormant Cyprus reunification talks, saying Sun… [+1148 chars]",associated-press,Associated Press
By JOHN MARSHALL AP Basketball Writer,Planning travel becomes more complicated during pandemic,"Planning travel for college basketball teams can be complicated. Flights and hotels have to be booked, buses rented, meals planned. Schedules have to be worked around practices and games.",https://apnews.com/95a6c3ec6673f97f8767f23e8bb7784c,https://bloximages.newyork1.vip.townnews.com/stltoday.com/content/tncms/assets/v3/editorial/b/11/b111f392-ccba-5f5c-8ca8-bdbeb08d5aa7/5fac1c2b23348.image.jpg?crop=1763%2C992%2C0%2C91&resize=1120%2C630&order=crop%2Cresize,2020-11-15T19:59:05Z,"FILE - In this Wednesday, March 4, 2020, file photo, Arkansas coach Eric Musselman reacts on the sidelines against LSU during the first half of an NCAA college basketball game in Fayetteville, Ark. T… [+1355 chars]",associated-press,Associated Press
,Dustin Johnson wins first Masters played in the fall with record score of 268,"AUGUSTA, Ga. (AP) — Dustin Johnson wins first Masters played in the fall with record score of 268.",https://apnews.com/2af6a13ca60d204d4530d01b691978c6,https://bloximages.newyork1.vip.townnews.com/stltoday.com/content/tncms/custom/image/4ce82390-59b2-11e6-a3c5-b77ec6e8d16d.png?resize=600%2C517,2020-11-15T19:53:57Z,"AUGUSTA, Ga. (AP) Dustin Johnson wins first Masters played in the fall with record score of 268.
Copyright 2020 The Associated Press. All rights reserved. This material may not be published, broadca… [+164 chars]",associated-press,Associated Press
By STEFANIE DAZIO Associated Press,"Off-duty deputy shot in Los Angeles, suspect at large","LOS ANGELES (AP) — An off-duty Los Angeles County deputy was shot early Sunday morning while he was driving and returned fire at the suspect, authorities said.",https://apnews.com/a57fe97d3062ccf7b88a0d45f92d8007,https://bloximages.newyork1.vip.townnews.com/roanoke.com/content/tncms/custom/image/00f1ee32-f2d0-11e6-9926-f7249dbfe53a.jpg,2020-11-15T19:37:16Z,"LOS ANGELES (AP) An off-duty Los Angeles County deputy was shot early Sunday morning while he was driving and returned fire at the suspect, authorities said.
The deputy, whose name has not been rele… [+968 chars]",associated-press,Associated Press
,De Boer gets 1st win as Netherlands coach,Frank de Boer finally has his first win as Netherlands coach after Georginio Wijnaldum scored a swift brace Sunday to lead his team to a 3-1 victory over Bosnia-Herzegovina in the Nations League.,https://apnews.com/4aa0ded23e0646a498903db61810a1d2,https://bloximages.newyork1.vip.townnews.com/stltoday.com/content/tncms/assets/v3/editorial/0/b4/0b489979-6804-523f-89d2-79b2784b9879/5fb185f7f11e7.image.jpg?crop=1763%2C992%2C0%2C91&resize=1120%2C630&order=crop%2Cresize,2020-11-15T19:27:15Z,"Frank de Boer finally has his first win as Netherlands coach after Georginio Wijnaldum scored a swift brace Sunday to lead his team to a 3-1 victory over Bosnia-Herzegovina in the Nations League.
Wi… [+1306 chars]",associated-press,Associated Press
By TIM REYNOLDS AP Basketball Writer,AP source: Lakers on verge of acquiring Dennis Schröder,"The NBA offseason, such as it was, is over. A wild few days of decisions and player movement await.",https://apnews.com/6d9b083233b21ae057865f6555f847ce,https://bloximages.newyork1.vip.townnews.com/stltoday.com/content/tncms/assets/v3/editorial/b/2b/b2be3955-c3f3-5d98-8740-2353a839160b/5faa845de3644.image.jpg?crop=1763%2C992%2C0%2C91&resize=1120%2C630&order=crop%2Cresize,2020-11-15T19:16:30Z,"By TIM REYNOLDS
AP Basketball Writer
The NBA offseason, such as it was, is over. A wild few days of decisions and player movement await.
Teams may begin making trades Monday, according to a memo s… [+1705 chars]",associated-press,Associated Press
,"Washington governor announces new restrictions on businesses, activities as COVID-19 cases surge across the state","OLYMPIA, Wash. (AP) — Washington governor announces new restrictions on businesses, activities as COVID-19 cases surge across the state.",https://apnews.com/5a448fdff82259bcfd717c737665d35f,https://bloximages.newyork1.vip.townnews.com/stltoday.com/content/tncms/custom/image/4ce82390-59b2-11e6-a3c5-b77ec6e8d16d.png?resize=600%2C517,2020-11-15T19:04:03Z,"""We are totally mystified about the whole thing, said Richard Baron, co-founder and chairman of McCormack Baron Salazar.",associated-press,Associated Press
By RALPH D. RUSSO AP College Football Writer,AP Top 25: Tulsa in at 25; Indiana set for top-10 matchup,No. 25 Tulsa is ranked in The Associated Press college football poll for the first time in 10 years and No. 9 Indiana is set to play the first top-10 matchup in program history.,https://apnews.com/6648af1de9ecdc2ca1a08d9429f8d100,https://bloximages.newyork1.vip.townnews.com/stltoday.com/content/tncms/assets/v3/editorial/4/cd/4cd4ec31-4420-5f4b-ac3a-c4e48ea6014f/5fb0c8957feb0.image.jpg?crop=1763%2C992%2C0%2C91&resize=1120%2C630&order=crop%2Cresize,2020-11-15T19:02:27Z,"POLL POINTS
Clemson has now been ranked in the top five for 50 consecutive weeks, the longest active streak in college football and the third-longest streak in the history of the AP poll.
The Tiger… [+709 chars]",associated-press,Associated Press
,POLL ALERT: Alabama still No. 1 as top 8 unchanged; No. 9 Indiana set for top-10 matchup with Ohio State; Tulsa No. 25.,NEW YORK (AP) — POLL ALERT: Alabama still No. 1 as top 8 unchanged; No. 9 Indiana set for top-10 matchup with Ohio State; Tulsa No. 25.,https://apnews.com/032dd93d6e3b51ee716f4db42695e455,https://bloximages.newyork1.vip.townnews.com/stltoday.com/content/tncms/custom/image/4ce82390-59b2-11e6-a3c5-b77ec6e8d16d.png?resize=600%2C517,2020-11-15T19:00:41Z,"""There I am thinking, 'Am I the right person to do this?' This is going to be a big leap. But I think I can do this,"" he says.",associated-press,Associated Press
,"Brazilians vote in local elections, with eye on 2022 race",RIO DE JANEIRO (AP) — Brazilians voted for mayors and councilors nationwide on Sunday in an election that could be an early indicator of President Jair Bolsonaro's prospects if he runs for...,https://apnews.com/74d0bec1765427893592c8d00ea52c48,https://storage.googleapis.com/afs-prod/media/a08f30bc369040d7a1b701f2b7b4d9a2/2792.jpeg,2020-11-15T18:40:37Z,RIO DE JANEIRO (AP) Brazilians voted for mayors and councilors nationwide on Sunday in an election that could be an early indicator of President Jair Bolsonaros prospects if he runs for re-election i… [+903 chars],associated-press,Associated Press
,COVID-19-related data breach affects thousands in Delaware,"DOVER, Del. (AP) — Public health officials in Delaware on Sunday disclosed that the personal information of thousands of people who were tested for the coronavirus this summer was mistakenly...",https://apnews.com/bf27bc0c73c34a834c19910fe05f8f36,https://apnews.com/images/ShareLogo2.png,2020-11-15T18:37:17Z,"DOVER, Del. (AP) Public health officials in Delaware on Sunday disclosed that the personal information of thousands of people who were tested for the coronavirus this summer was mistakenly shared wit… [+1287 chars]",associated-press,Associated Press
,"Peru's interim president resigns after massive protests, chaos embroil nation","LIMA, Peru (AP) — Peru's interim president resigns after massive protests, chaos embroil nation.",https://apnews.com/b1d24ae1ab7eb4b85aed2d589a3fc6cd,https://apnews.com/images/ShareLogo2.png,2020-11-15T18:22:47Z,"LIMA, Peru (AP) Perus interim president resigns after massive protests, chaos embroil nation.",associated-press,Associated Press
By TOM WITHERS AP Sports Writer,Cavs guard Kevin Porter Jr. arrested on weapons charges,CLEVELAND (AP) — The Cleveland Cavaliers said they have spoken to guard Kevin Porter Jr. following his arrest early Sunday on weapons possession.,https://apnews.com/9eea4755da7a56f7fdf030a3e65da924,https://bloximages.newyork1.vip.townnews.com/stltoday.com/content/tncms/assets/v3/editorial/6/7f/67f6b653-bc0c-5ff1-86bd-ce8dd5f3919c/5fb17afb74a75.image.jpg?crop=1763%2C992%2C0%2C92&resize=1120%2C630&order=crop%2Cresize,2020-11-15T18:21:15Z,"FILE - Cleveland Cavaliers' Kevin Porter Jr. poses during the NBA basketball team's media day in Independence, Ohio, in this Sept. 30, 2019, file photo. The Cleveland Cavaliers said they have spoken … [+1551 chars]",associated-press,Associated Press
By STEVE REED AP Sports Writer,AP source: Bucs team flight to Charlotte delayed 6 1/2 hours,"CHARLOTTE, N.C. (AP) — A person familiar with the situation says the Tampa Bay Buccaneers' team flight to Charlotte, North Carolina, on Saturday was delayed about 6 1/2 hours due to mechanical issues and the team didn’t arrive at its…",https://apnews.com/dc503bae8069ea6d42a7c4b1d76dd183,https://bloximages.newyork1.vip.townnews.com/stltoday.com/content/tncms/assets/v3/editorial/1/e8/1e8156dd-3340-590f-81d6-4a3ae2398fec/5fb17b29046d1.image.jpg?crop=1763%2C992%2C0%2C91&resize=1120%2C630&order=crop%2Cresize,2020-11-15T18:15:22Z,"Tampa Bay Buccaneers quarterback Tom Brady (12) walks the turf before the first half of an NFL football game between the Carolina Panthers and the Tampa Bay Buccaneers, Sunday, Nov. 15, 2020, in Char… [+1391 chars]",associated-press,Associated Press
