author,title,description,url,urlToImage,publishedAt,content,source.id,source.name
"By MICHAEL R. SISAK, TOM HAYS and JENNIFER PELTZ Associated Press","Week 1 of Weinstein trial: Vile allegations, X-rated gifts","NEW YORK (AP) — Harvey Weinstein trundled into court this week for the start of a New York City rape trial, facing the prospect of a conviction that could put him in prison for the rest of his life.",https://apnews.com/eb4a5438a7613293fb2c47b2cd7410fc,https://bloximages.chicago2.vip.townnews.com/billingsgazette.com/content/tncms/assets/v3/editorial/4/45/445bf7f5-00cf-5b62-9f29-a508d20e2d70/5e2b2d99062d3.image.jpg?crop=1763%2C992%2C0%2C91&resize=1120%2C630&order=crop%2Cresize,2020-01-25T14:30:43Z,"NEW YORK (AP) Harvey Weinstein trundled into court this week for the start of a New York City rape trial, facing the prospect of a conviction that could put him in prison for the rest of his life.
Within the first three days of the #MeToo-era trial, the once… [+7357 chars]",associated-press,Associated Press
,"Suit: Fred Meyer worker called woman, daughter racist slurs","PORTLAND, Ore. (AP) — A 45-year-old Portland woman has filed a lawsuit accusing grocer Fred Meyer of racial discrimination after she said an employee called her racist slurs.",https://apnews.com/f25da5e483d14042cc481ebe4d610bcc,https://bloximages.newyork1.vip.townnews.com/roanoke.com/content/tncms/custom/image/00f1ee32-f2d0-11e6-9926-f7249dbfe53a.jpg,2020-01-25T14:30:41Z,"PORTLAND, Ore. (AP) A 45-year-old Portland woman has filed a lawsuit accusing grocer Fred Meyer of racial discrimination after she said an employee called her racist slurs.
Melita Bullitt said in the lawsuit that she was shopping with her daughter at the gro… [+1005 chars]",associated-press,Associated Press
,"Heavy rains in Brazil cause flooding, landslides; 11 killed","RIO DE JANEIRO (AP) — Heavy rains caused flooding and landslides in southeast Brazil, killing at least 11 people, authorities said Saturday.",https://apnews.com/6a661b1964f00fce517e8aa879af9561,https://bloximages.newyork1.vip.townnews.com/roanoke.com/content/tncms/custom/image/00f1ee32-f2d0-11e6-9926-f7249dbfe53a.jpg,2020-01-25T14:29:20Z,"RIO DE JANEIRO (AP) Heavy rains caused flooding and landslides in southeast Brazil, killing at least 11 people, authorities said Saturday.
Two people died on Saturday in Belo Horizonte, the capital of Minas Gerais state, civil defense officials said. A total… [+300 chars]",associated-press,Associated Press
,Maine woman stalked by drone; police unable to help,"GORHAM, Maine (AP) — A Maine woman who was harassed by a drone for two days says police told her they could nothing about it.",https://apnews.com/3eef6347d91f19baf9a8c8f041a8c34b,https://bloximages.newyork1.vip.townnews.com/roanoke.com/content/tncms/custom/image/00f1ee32-f2d0-11e6-9926-f7249dbfe53a.jpg,2020-01-25T14:27:15Z,"GORHAM, Maine (AP) A Maine woman who was harassed by a drone for two days says police told her they could nothing about it.
Mary Dunham says a drone tracked her in her car on Tuesday as she drove to a gas station, where she called police, and then to her hom… [+1360 chars]",associated-press,Associated Press
Mesfin Fekadu,Doubts loom over nominating process for GRAMMYS...,LOS ANGELES (AP) — Questions have loomed for years around the nominations process for the Grammy Awards. But the doubts reached a new level this week after the Recording Academy's just-ousted CEO...,https://apnews.com/b633680a101ecc691fc291450d1b7413,https://storage.googleapis.com/afs-prod/media/61ac9ba4a17242f090e77132033d28a3/2711.jpeg,2020-01-25T14:22:39Z,"LOS ANGELES (AP) Questions have loomed for years around the nominations process for the Grammy Awards. But the doubts reached a new level this week after the Recording Academys just-ousted CEO claimed the show is rigged and full of conflicts of interest.
The… [+6047 chars]",associated-press,Associated Press
By MIKE CATALINI Associated Press,"With Trump's help, NJ's Van Drew courts former foes",President Donald Trump is expected to draw a crowd — and headlines — Tuesday when he comes to the New Jersey shore to reward newly minted Republican Rep. Jeff Van Drew with a rally for leaving the Democrats and opposing…,https://apnews.com/c6ba3315030a049704b37ec4d442e282,https://bloximages.newyork1.vip.townnews.com/roanoke.com/content/tncms/assets/v3/editorial/0/0d/00da566a-b1f4-54f9-bdf6-9df6f4a0b0c1/5e2c515a5c6b9.image.jpg?crop=1763%2C992%2C0%2C92&resize=1120%2C630&order=crop%2Cresize,2020-01-25T14:21:11Z,"President Donald Trump is expected to draw a crowd and headlines Tuesday when he comes to the New Jersey shore to reward newly minted Republican Rep. Jeff Van Drew with a rally for leaving the Democrats and opposing impeachment.
Despite the boost from the pr… [+3995 chars]",associated-press,Associated Press
By KIM CHANDLER Associated Press,Jeff Sessions stresses Trump loyalty in Alabama Senate race,"VESTAVIA HILLS, Ala. (AP) — Former Attorney General Jeff Sessions, giving a recent campaign speech to a suburban Republican club, recalled his 2016 decision to endorse then-presidential candidate Donald Trump at a time when many party members were uncertain a…",https://apnews.com/844b66ce83b5c332d52f093f15c11d3a,https://bloximages.newyork1.vip.townnews.com/roanoke.com/content/tncms/assets/v3/editorial/5/1a/51abb7cd-0182-5211-b433-b92a8245b3ef/5e2c515c5e3d7.image.jpg?crop=1628%2C916%2C0%2C85&resize=1120%2C630&order=crop%2Cresize,2020-01-25T14:19:25Z,"VESTAVIA HILLS, Ala. (AP) Former Attorney General Jeff Sessions, giving a recent campaign speech to a suburban Republican club, recalled his 2016 decision to endorse then-presidential candidate Donald Trump at a time when many party members were uncertain abo… [+4621 chars]",associated-press,Associated Press
,Port Ludlow man who ran guardianship firm stole from clients,"TACOMA, Wash. (AP) — A Kitsap County man who was supposed to be handling money for disabled and elderly clients has instead admitted to stealing it.",https://apnews.com/0f11ffaf2bd83dfcee70f59c2629c90e,https://bloximages.newyork1.vip.townnews.com/roanoke.com/content/tncms/custom/image/00f1ee32-f2d0-11e6-9926-f7249dbfe53a.jpg,2020-01-25T14:10:41Z,"TACOMA, Wash. (AP) A Kitsap County man who was supposed to be handling money for disabled and elderly clients has instead admitted to stealing it.
Wayne Jerome Houston, of Port Ludlow, pleaded guilty in U.S. District Court in Tacoma on Friday to fraud. The U… [+691 chars]",associated-press,Associated Press
,Lincoln neighbor who later ran Sears remembered in lecture,"SPRINGFIELD, Ill. (AP) — The story of a boy who grew up across the street from Abraham Lincoln's family and later presided over one the nation's larger retailers will be told in the annual George L. Painter Looking for Lincoln…",https://apnews.com/d47fa7fc4979ce48aeb1931e2fe6c7e4,https://bloximages.newyork1.vip.townnews.com/roanoke.com/content/tncms/custom/image/00f1ee32-f2d0-11e6-9926-f7249dbfe53a.jpg,2020-01-25T14:10:00Z,"SPRINGFIELD, Ill. (AP) The story of a boy who grew up across the street from Abraham Lincoln's family and later presided over one the nation's larger retailers will be told in the annual George L. Painter Looking for Lincoln Lecture.
Julius Rosenwald spent h… [+745 chars]",associated-press,Associated Press
,"Illinois hunters harvested more than 153,000 deer in season","SPRINGFIELD, Ill. (AP) — Hunters brought in more than 153,000 deer during the latest archery and firearm seasons, according to updates totals that Illinois officials released this week.",https://apnews.com/8fe7337cb943f3fb6c947ee05a787b73,https://bloximages.newyork1.vip.townnews.com/roanoke.com/content/tncms/custom/image/00f1ee32-f2d0-11e6-9926-f7249dbfe53a.jpg,2020-01-25T14:06:34Z,"SPRINGFIELD, Ill. (AP) Hunters brought in more than 153,000 deer during the latest archery and firearm seasons, according to updates totals that Illinois officials released this week.
The Illinois Department of Natural Resources said in a statement that hunt… [+718 chars]",associated-press,Associated Press
,Zoo celebrating rare Amur leopard cubs' first birthday,"BRIDGEPORT, Conn. (AP) — A Connecticut zoo is celebrating the first birthdays of two rare Amur leopard cubs.",https://apnews.com/9ced3e5b318bcf1450e560279fa255cc,https://bloximages.newyork1.vip.townnews.com/roanoke.com/content/tncms/custom/image/00f1ee32-f2d0-11e6-9926-f7249dbfe53a.jpg,2020-01-25T14:05:43Z,"BRIDGEPORT, Conn. (AP) A Connecticut zoo is celebrating the first birthdays of two rare Amur leopard cubs.
The Beardsley Zoo in Bridgeport has activities planned throughout the day Saturday in honor of Orion and his sister Kallisto, who were born at the zoo … [+935 chars]",associated-press,Associated Press
,Governor's budget would expand child tax credit,"ALBANY, N.Y. (AP) — New York's governor wants to expand the state's child tax credit to help families cover the costs of raising children.",https://apnews.com/766558afb39805de7088c30583998ddd,https://bloximages.newyork1.vip.townnews.com/roanoke.com/content/tncms/custom/image/00f1ee32-f2d0-11e6-9926-f7249dbfe53a.jpg,2020-01-25T14:01:18Z,"ALBANY, N.Y. (AP) New York's governor wants to expand the state's child tax credit to help families cover the costs of raising children.
Gov. Andrew Cuomo's recently released budget proposal would expand New York's child tax credit to children under four. Cu… [+866 chars]",associated-press,Associated Press
,Columbus diocese task force examining sexual abuse policies,"COLUMBUS, Ohio (AP) — The Roman Catholic Diocese of Columbus has taken steps to examine its policies regarding the sexual abuse of minors with the creation of a task force, and has hired a law firm to determine whether more…",https://apnews.com/79100bc49b2ac0bbed922f9d815b88b7,https://bloximages.newyork1.vip.townnews.com/roanoke.com/content/tncms/custom/image/00f1ee32-f2d0-11e6-9926-f7249dbfe53a.jpg,2020-01-25T14:01:14Z,"COLUMBUS, Ohio (AP) The Roman Catholic Diocese of Columbus has taken steps to examine its policies regarding the sexual abuse of minors with the creation of a task force, and has hired a law firm to determine whether more names should be added to a list of cr… [+1343 chars]",associated-press,Associated Press
By SARAH HONOSKY The Lynchburg News & Advance,Virginia community recalls mass shooting on 10th anniversary,"APPOMATTOX, Va. (AP) — Every Sunday for the last decade, Father Jim Gallagher has lit a candle at Our Lady of Peace Parish in Appomattox County.",https://apnews.com/b0cba5bce3f34a6880488ad693f2c6fb,https://bloximages.newyork1.vip.townnews.com/richmond.com/content/tncms/assets/v3/editorial/f/85/f85777be-c44d-5439-8f5f-8d16dd0bb084/5e2c4db1ad531.image.jpg?crop=1763%2C992%2C0%2C91&resize=1120%2C630&order=crop%2Cresize,2020-01-25T14:00:15Z,"APPOMATTOX, Va. (AP) Every Sunday for the last decade, Father Jim Gallagher has lit a candle at Our Lady of Peace Parish in Appomattox County.
Resting on the surface of the piano, in front of the honey-hued pews, the flame burns in honor of the eight people … [+9509 chars]",associated-press,Associated Press
By MEREDITH COHN The Baltimore Sun,Baltimore sugar plant works to recover after bad harvests,"BALTIMORE (AP) — Under the neon Domino Sugars sign in Baltimore’s Inner Harbor, a century-old refinery steadily produces the crucial ingredient in American candy, soda and other foods.",https://apnews.com/bd0cb68314b055eb2dce762dd2b3a5f8,https://bloximages.newyork1.vip.townnews.com/roanoke.com/content/tncms/custom/image/00f1ee32-f2d0-11e6-9926-f7249dbfe53a.jpg,2020-01-25T14:00:12Z,"BALTIMORE (AP) Under the neon Domino Sugars sign in Baltimores Inner Harbor, a century-old refinery steadily produces the crucial ingredient in American candy, soda and other foods.
The already busy plant soon might need to burn even more calories.
Unusuall… [+8708 chars]",associated-press,Associated Press
By CATHY DYSON Fredericksburg Free Lance-Star,Civil War-era sword finds a home in Virginia museum,"SPOTSYLVANIA, Va. (AP) — The sword soon to be displayed at the Spotsylvania County Museum was pulled, not out of stone like Excalibur, but from under the floorboards of a historic church at Spotsylvania Courthouse.",https://apnews.com/807d548e5702b577cd619223e72c7827,https://bloximages.newyork1.vip.townnews.com/richmond.com/content/tncms/assets/v3/editorial/a/de/ade5e627-a049-5ca0-ac3a-91163d897b48/5e2c4db593c4b.image.jpg?crop=1763%2C992%2C0%2C91&resize=1120%2C630&order=crop%2Cresize,2020-01-25T14:00:11Z,"SPOTSYLVANIA, Va. (AP) The sword soon to be displayed at the Spotsylvania County Museum was pulled, not out of stone like Excalibur, but from under the floorboards of a historic church at Spotsylvania Courthouse.
And, after spending parts of three centuries … [+4430 chars]",associated-press,Associated Press
By JOSEPH A. GAMBARDELLO The Philadelphia Inquirer,The origin of stromboli has roots in Delaware County,"MEDIA, Penn. (AP) — In researching the origin of the word stromboli for the hot meat-filled Italian sandwich that is a feature at many pizzerias, the folks at the Oxford English Dictionary found their way to a cryptic entry in…",https://apnews.com/3af55ae59d0005d2cbc6fb4ac7f4f4a7,https://bloximages.newyork1.vip.townnews.com/roanoke.com/content/tncms/custom/image/00f1ee32-f2d0-11e6-9926-f7249dbfe53a.jpg,2020-01-25T14:00:11Z,"MEDIA, Penn. (AP) In researching the origin of the word stromboli for the hot meat-filled Italian sandwich that is a feature at many pizzerias, the folks at the Oxford English Dictionary found their way to a cryptic entry in the April 10, 1950, copy of the Ph… [+4399 chars]",associated-press,Associated Press
By HANNAH PENNINGTON The Herald-Dispatch,West Virginia students explore real-world uses of drones,"HUNTINGTON, W.Va. (AP) — Thirty gifted education students from across Cabell County put their heads together, with the buzzing of drones just inches above them, to solve real-world problems the morning of Jan. 21 at the Robert C. Byrd Institute…",https://apnews.com/66203fff624be64cff8c3255eefddf20,https://bloximages.newyork1.vip.townnews.com/roanoke.com/content/tncms/custom/image/00f1ee32-f2d0-11e6-9926-f7249dbfe53a.jpg,2020-01-25T14:00:10Z,"HUNTINGTON, W.Va. (AP) Thirty gifted education students from across Cabell County put their heads together, with the buzzing of drones just inches above them, to solve real-world problems the morning of Jan. 21 at the Robert C. Byrd Institute in Huntington.
… [+3214 chars]",associated-press,Associated Press
By LYNN BERRY Associated Press,Pompeo lashes out at journalist; NPR defends its reporter,"WASHINGTON (AP) — Secretary of State Mike Pompeo lashed out in anger Saturday at an NPR reporter who accused him of shouting expletives at her after she asked him in an interview about Ukraine. In a direct and personal attack,…",https://apnews.com/968bb9a73fde1ce0c083df55fafe72c1,https://bloximages.newyork1.vip.townnews.com/tulsaworld.com/content/tncms/assets/v3/editorial/5/5b/55b5c72c-a196-53fd-84c4-0783efcaa87f/5e2b214eb1a40.image.jpg?crop=1763%2C992%2C0%2C91&resize=1120%2C630&order=crop%2Cresize,2020-01-25T17:59:27Z,"WASHINGTON (AP) Secretary of State Mike Pompeo lashed out in anger Saturday at an NPR reporter who accused him of shouting expletives at her after she asked him in an interview about Ukraine. In a direct and personal attack, America's chief diplomat said the … [+2362 chars]",associated-press,Associated Press
,"Death sentence tossed, new trial ordered in 2 1990 slayings",PHILADELPHIA (AP) — A judge has thrown out the death sentence imposed on a Philadelphia man in one of two 1990 killings and ordered a new trial in the second slaying.,https://apnews.com/6142af429ca45fb524f42405b0b2440d,https://bloximages.newyork1.vip.townnews.com/roanoke.com/content/tncms/custom/image/00f1ee32-f2d0-11e6-9926-f7249dbfe53a.jpg,2020-01-25T17:58:24Z,"PHILADELPHIA (AP) A judge has thrown out the death sentence imposed on a Philadelphia man in one of two 1990 killings and ordered a new trial in the second slaying.
The Philadelphia Inquirer reports that Common Pleas Judge Leon Tucker granted a defense petit… [+1529 chars]",associated-press,Associated Press
,CEO chosen for state's new paid family medical leave program,"HARTFORD, Conn. (AP) — The CEO of a Hartford organization that serves people with intellectual disabilities has been named to oversee Connecticut's fledgling paid family and medical leave authority.",https://apnews.com/965a2c99b4cce379abda79eb9184eaca,https://bloximages.newyork1.vip.townnews.com/roanoke.com/content/tncms/custom/image/00f1ee32-f2d0-11e6-9926-f7249dbfe53a.jpg,2020-01-25T17:56:13Z,"HARTFORD, Conn. (AP) The CEO of a Hartford organization that serves people with intellectual disabilities has been named to oversee Connecticut's fledgling paid family and medical leave authority.
Andrea Barton Reeves was chosen from a pool of 170 candidates… [+1093 chars]",associated-press,Associated Press
,Applachian Power Co. renews search for solar projects,"ROANOKE, Va. (AP) — More than a year after requesting proposals for large-scale solar farms, Appalachian Power Co. is still searching for projects.",https://apnews.com/412c4558721b84e3d27c745e7ee15980,https://bloximages.newyork1.vip.townnews.com/richmond.com/content/tncms/custom/image/6a12cdcc-99eb-11e9-910a-20677ce06c14.jpg?resize=600%2C600,2020-01-25T17:55:53Z,"ROANOKE, Va. (AP) More than a year after requesting proposals for large-scale solar farms, Appalachian Power Co. is still searching for projects.
The utility, which issued its call for solar farms in November 2018, recently renewed that request when the firs… [+1407 chars]",associated-press,Associated Press
,Applachian Power Co. renews search for solar projects,"ROANOKE, Va. (AP) — More than a year after requesting proposals for large-scale solar farms, Appalachian Power Co. is still searching for projects.",https://apnews.com/412c4558721b84e3d27c745e7ee15980,https://bloximages.newyork1.vip.townnews.com/roanoke.com/content/tncms/custom/image/00f1ee32-f2d0-11e6-9926-f7249dbfe53a.jpg,2020-01-25T17:55:53Z,"ROANOKE, Va. (AP) More than a year after requesting proposals for large-scale solar farms, Appalachian Power Co. is still searching for projects.
The utility, which issued its call for solar farms in November 2018, recently renewed that request when the firs… [+1407 chars]",associated-press,Associated Press
,"Louisiana's 2019 ""I Voted"" sticker honored for creativity","MONROE, La. (AP) — Louisiana's 2019 “I Voted” sticker has won a national award for originality and creativity from the U.S. Election Assistance Commission.",https://apnews.com/b0e3a3c9ab20b7bf80f137c98abadbf7,https://bloximages.newyork1.vip.townnews.com/richmond.com/content/tncms/custom/image/6a12cdcc-99eb-11e9-910a-20677ce06c14.jpg?resize=600%2C600,2020-01-25T17:54:52Z,"MONROE, La. (AP) Louisiana's 2019 I Voted sticker has won a national award for originality and creativity from the U.S. Election Assistance Commission.
The sticker, created by Cajun artist Tony Bernard of Lafayette, featured a pelican wearing a crown centere… [+993 chars]",associated-press,Associated Press
,Suspect in summer slaying heading to court,"PITTSFIELD, Mass. (AP) — A man charged with shooting a woman as she sat in a parked car on a Pittsfield, Massachusetts street last summer is heading to court for his arraignment.",https://apnews.com/1a0ddbd77e3d449939ee6a6572420853,https://bloximages.newyork1.vip.townnews.com/roanoke.com/content/tncms/custom/image/00f1ee32-f2d0-11e6-9926-f7249dbfe53a.jpg,2020-01-25T17:53:37Z,"PITTSFIELD, Mass. (AP) A man charged with shooting a woman as she sat in a parked car on a Pittsfield, Massachusetts street last summer is heading to court for his arraignment.
Tyler Sumner, 25, of Adams, is scheduled to be arraigned Wednesday in Berkshire S… [+746 chars]",associated-press,Associated Press
,Fire at Killington's Grand Hotel forces evacuation of guests,"KILLINGTON, Vt. (AP) — Killington's Grand Hotel had to evacuate guests because of a chimney fire that spread to an attic early Saturday, officials said.",https://apnews.com/05ac6a2cf8e3c22c769f23f9904f3d92,https://bloximages.newyork1.vip.townnews.com/roanoke.com/content/tncms/custom/image/00f1ee32-f2d0-11e6-9926-f7249dbfe53a.jpg,2020-01-25T17:51:32Z,"KILLINGTON, Vt. (AP) Killington's Grand Hotel had to evacuate guests because of a chimney fire that spread to an attic early Saturday, officials said.
Multiple fire crews responded to bring the fire under control while guests were evacuated to Snowshed Base … [+373 chars]",associated-press,Associated Press
,Armed robbery suspect fatally shot by officer in Columbus,"COLUMBUS, Ohio (AP) — An armed man wearing a hockey-type mask barged into the back of a Bob Evans restaurant in Columbus on Saturday morning, demanded that a manager open a safe and was fatally wounded by an officer during…",https://apnews.com/a9fd4c95b6aeec21503f39c07b5738ac,https://bloximages.newyork1.vip.townnews.com/roanoke.com/content/tncms/custom/image/00f1ee32-f2d0-11e6-9926-f7249dbfe53a.jpg,2020-01-25T17:47:57Z,"COLUMBUS, Ohio (AP) An armed man wearing a hockey-type mask barged into the back of a Bob Evans restaurant in Columbus on Saturday morning, demanded that a manager open a safe and was fatally wounded by an officer during a confrontation behind the restaurant,… [+753 chars]",associated-press,Associated Press
,Coca-Cola bottler building $60M warehouse in South Georgia,"TIFTON, Ga. (AP) — One of America's largest Coca-Cola bottlers is making a $60 million investment in rural South Georgia that the company says will create about 200 new jobs.",https://apnews.com/fe368482954231a64f5a7762fad9c12f,https://bloximages.newyork1.vip.townnews.com/roanoke.com/content/tncms/custom/image/00f1ee32-f2d0-11e6-9926-f7249dbfe53a.jpg,2020-01-25T17:47:18Z,"TIFTON, Ga. (AP) One of America's largest Coca-Cola bottlers is making a $60 million investment in rural South Georgia that the company says will create about 200 new jobs.
Coca-Cola Bottling Company UNITED CEO John Sherman was on hand as officials broke gro… [+841 chars]",associated-press,Associated Press
By JOVANA GEC Associated Press,Trump envoy hails deal to resume Serbia-Kosovo rail service,"BELGRADE, Serbia (AP) — U.S. President Donald Trump’s special envoy for Serbia and Kosovo said Saturday that an agreement to resume railway service between the two Balkan rivals is important for both nations.",https://apnews.com/74e969a39601fea5f810b85ff809eceb,https://bloximages.newyork1.vip.townnews.com/roanoke.com/content/tncms/assets/v3/editorial/6/12/612c2ce8-2bd6-51a2-984d-46852985cc47/5e2ae476055a6.image.jpg?crop=1762%2C991%2C0%2C92&resize=1120%2C630&order=crop%2Cresize,2020-01-25T17:45:38Z,"BELGRADE, Serbia (AP) U.S. President Donald Trumps special envoy for Serbia and Kosovo said Saturday that an agreement to resume railway service between the two Balkan rivals is important for both nations.
Richard Grenell, who is the U.S. ambassador to Germa… [+1623 chars]",associated-press,Associated Press
By STEVEN WINE AP Sports Writer,Super Bowl back in Miami for 11th time after 10-year hiatus,MIAMI (AP) — It’s appropriate the Super Bowl to end droughts is Miami-bound.,https://apnews.com/2ead03c0422b5b280418dfc9b8ba619a,https://bloximages.newyork1.vip.townnews.com/roanoke.com/content/tncms/assets/v3/editorial/9/a0/9a04abd3-6bde-5193-bb74-b30dddbcc97d/5e2c7efd2d904.image.jpg?crop=1845%2C1038%2C0%2C42&resize=1120%2C630&order=crop%2Cresize,2020-01-25T17:44:51Z,"MIAMI (AP) Its appropriate the Super Bowl to end droughts is Miami-bound.
The Kansas City Chiefs are playing in the game for the first time in 50 years against the San Francisco 49ers, who have a chance to win their first NFL title in 25 years. And the game … [+4721 chars]",associated-press,Associated Press
By JOSH DUBOW AP Pro Football Writer,49ers' Super Bowl run has similarities to 1981 title team,"SANTA CLARA, Calif. (AP) — A first-time NFL coach turning a losing franchise into a contender in his third year and getting the label of an offensive genius.",https://apnews.com/75db74db64051e01c6305506993dbef4,https://bloximages.newyork1.vip.townnews.com/roanoke.com/content/tncms/assets/v3/editorial/6/69/669f887a-0df5-5616-a951-08311dc4d45b/5e2c7f001ebdc.image.jpg?crop=1770%2C996%2C0%2C87&resize=1120%2C630&order=crop%2Cresize,2020-01-25T17:44:08Z,"SANTA CLARA, Calif. (AP) A first-time NFL coach turning a losing franchise into a contender in his third year and getting the label of an offensive genius.
A charismatic quarterback in his third season in San Francisco emerging as a leader and a face of the … [+4941 chars]",associated-press,Associated Press
,"Woman sleeping near garage run over, dies in Portland","PORTLAND, Ore. (AP) — A 47-year-old woman who was sleeping near an apartment complex garage was run over and has died at a hospital, police said.",https://apnews.com/d51cbed9f95eb74bb237e89e33c88666,https://bloximages.newyork1.vip.townnews.com/roanoke.com/content/tncms/custom/image/00f1ee32-f2d0-11e6-9926-f7249dbfe53a.jpg,2020-01-25T17:40:19Z,"PORTLAND, Ore. (AP) A 47-year-old woman who was sleeping near an apartment complex garage was run over and has died at a hospital, police said.
The Portland Police Bureau said officers were sent to an apartment building at around 6:30 a.m. Friday and found a… [+726 chars]",associated-press,Associated Press
