author,title,description,url,urlToImage,publishedAt,content,source.id,source.name
By DAVE CAMPBELL AP Pro Football Writer,"NFL at 100: Afterthought as it is, Pro Bowl has rich history","With James Lofton's rookie season off to a strong start in 1978, another member of the Green Bay Packers casually tossed some praise his way in the locker room one day in early December.",https://apnews.com/8b9c4b5338fa76266d804fb2b80f72a2,https://bloximages.newyork1.vip.townnews.com/roanoke.com/content/tncms/assets/v3/editorial/e/74/e740e991-8781-56e9-bbb9-cf64bf2bab46/5e2b9aae7c874.image.jpg?crop=1722%2C969%2C0%2C117&resize=1120%2C630&order=crop%2Cresize,2020-01-25T01:27:47Z,"With James Lofton's rookie season off to a strong start in 1978, another member of the Green Bay Packers casually tossed some praise his way in the locker room one day in early December.
Keep up the production, his pal said, and he might find himself in the … [+4862 chars]",associated-press,Associated Press
,"China reports over 1,280 virus cases, death toll at 41","BEIJING (AP) — China's National Health Commission has reported the number of people infected with a new virus has risen to 1,287 with 41 deaths.",https://apnews.com/b2810cebad305f66112a0c68be0f8c9a,https://bloximages.newyork1.vip.townnews.com/roanoke.com/content/tncms/assets/v3/editorial/5/97/5970bdb1-2707-5774-81a9-7ee023838ce1/5e2b970a0214b.image.jpg?crop=1763%2C992%2C0%2C91&resize=1120%2C630&order=crop%2Cresize,2020-01-25T01:10:24Z,"BEIJING (AP) China's National Health Commission has reported the number of people infected with a new virus has risen to 1,287 with 41 deaths.
The commission said Saturday the latest tally comes from 29 provinces across China, including 237 patients in serio… [+548 chars]",associated-press,Associated Press
,"Parts of Phoenix airport briefly evacuated, flights delayed",PHOENIX (AP) — An airport official says part of Phoenix Sky Harbor Airport were briefly evacuated on Friday while police investigated a possible threat.,https://apnews.com/c9f898fa93f5e63e684eb9787c6efc41,https://bloximages.newyork1.vip.townnews.com/roanoke.com/content/tncms/custom/image/00f1ee32-f2d0-11e6-9926-f7249dbfe53a.jpg,2020-01-25T01:09:46Z,"Please purchase a subscription to continue reading.
A subscription is required to continue reading.
If you are a current subscriber please click Sign Up or Login to activate your digital access. If not, please click Sign Up to subscribe.
If you are a curre… [+138 chars]",associated-press,Associated Press
,"Police: Reno crash victim fatally shot, suspect arrested","RENO, Nev. (AP) — Reno police have arrested a 34-year-old suspect in the fatal shooting of a man who was found dead in his vehicle following a crash a few blocks from the Reno-Sparks Livestock Events Center.",https://apnews.com/76f78d72bbbaa69c9537552f4a7e3761,https://bloximages.newyork1.vip.townnews.com/roanoke.com/content/tncms/custom/image/00f1ee32-f2d0-11e6-9926-f7249dbfe53a.jpg,2020-01-25T01:06:55Z,"RENO, Nev. (AP) Reno police have arrested a 34-year-old suspect in the fatal shooting of a man who was found dead in his vehicle following a crash a few blocks from the Reno-Sparks Livestock Events Center.
Daniel Munoz of Reno was being held Friday without b… [+758 chars]",associated-press,Associated Press
By DOUG FERGUSON AP Golf Writer,Players Championship raises purse to $15 million,"SAN DIEGO (AP) — The PGA Tour is raising the prize money at The Players Championship to $15 million, making it the largest purse in golf unless any of the majors decide to up the ante this year.",https://apnews.com/b1030a42a8b501e6ac278756b5b1d464,https://bloximages.newyork1.vip.townnews.com/stltoday.com/content/tncms/assets/v3/editorial/e/5d/e5d9d411-c2a5-5988-a10c-9b34863482fa/5e2b9a9a5bb98.image.jpg?crop=1763%2C992%2C0%2C91&resize=1120%2C630&order=crop%2Cresize,2020-01-25T01:04:53Z,"Rory McIlroy of Northern Ireland waves to the gallery after hitting out of a fairway bunker on the fourth hole of the South Course at Torrey Pines Golf Course during the second round of the Farmers Insurance golf tournament Friday Jan. 24, 2020, in San Diego.… [+1313 chars]",associated-press,Associated Press
By MATTHEW DALY Associated Press,"Trial highlights: Dems cry cover-up, Trump hails activists","WASHINGTON (AP) — From the floor of the Senate, Democratic impeachment prosecutors said Friday that President Donald Trump tried to cover up his actions with Ukraine, another reason to remove him from office.",https://apnews.com/9767a1ade5819d2eb989bc8b21724500,https://bloximages.newyork1.vip.townnews.com/roanoke.com/content/tncms/assets/v3/editorial/9/db/9db98ee7-12b5-58f1-9cbe-b3cdbe5e1a80/5e2b88c7dfe78.image.jpg?crop=1919%2C1079%2C0%2C0&resize=1120%2C630&order=crop%2Cresize,2020-01-25T01:01:41Z,"WASHINGTON (AP) From the floor of the Senate, Democratic impeachment prosecutors said Friday that President Donald Trump tried to cover up his actions with Ukraine, another reason to remove him from office.
A few blocks away, Trump told anti-abortion activis… [+4061 chars]",associated-press,Associated Press
,Plane with 3 on board crashes near Payson,"PAYSON, Ariz. (AP) — Authorities are looking for the wreckage of a plane that crashed near Payson.",https://apnews.com/2cce67a1006a7f80b3e900043a601288,https://bloximages.newyork1.vip.townnews.com/roanoke.com/content/tncms/custom/image/00f1ee32-f2d0-11e6-9926-f7249dbfe53a.jpg,2020-01-25T01:01:02Z,"PAYSON, Ariz. (AP) Authorities are looking for the wreckage of a plane that crashed near Payson.
The Gila County Sheriffs Office says three people were on board the plane when it crashed around 3 p.m. on Friday.
Its unclear whether the pilot and passengers … [+266 chars]",associated-press,Associated Press
,"China reports number of cases of new virus has increased to 1,287 and the death toll has risen to 41","BEIJING (AP) — China reports number of cases of new virus has increased to 1,287 and the death toll has risen to 41.",https://apnews.com/ec901a7bdf22b18482a87644ee0296a9,https://bloximages.newyork1.vip.townnews.com/richmond.com/content/tncms/custom/image/6a12cdcc-99eb-11e9-910a-20677ce06c14.jpg?resize=600%2C600,2020-01-25T00:57:29Z,,associated-press,Associated Press
By STEPHEN WHYNO AP Hockey Writer,Bettman: NHL Puck and player tracking to start in playoffs,Puck and player tracking is coming to the NHL beginning in the playoffs.,https://apnews.com/c101dfa4f820760ca481529364513189,https://bloximages.newyork1.vip.townnews.com/stltoday.com/content/tncms/assets/v3/editorial/c/76/c767f5c7-6434-5c1b-acb2-8f06057da097/5e2b96cd69931.image.jpg?crop=1763%2C992%2C0%2C91&resize=1120%2C630&order=crop%2Cresize,2020-01-25T00:52:41Z,"NHL Commissioner Gary Bettman speaks with members of the media before being inducted into the U.S. Hockey Hall of Fame, Thursday, Dec. 12, 2019, in Washington.
Patrick Semansky
Puck and player tracking is coming to the NHL beginning in the playoffs.
Commis… [+1276 chars]",associated-press,Associated Press
By TOM KRISHER AP Auto Writer,Fiat Chrysler denies union bribery allegations in GM lawsuit,"DETROIT (AP) — Fiat Chrysler is moving to dismiss a racketeering lawsuit filed by rival General Motors, denying allegations that it bribed union officials to impose higher labor costs on GM.",https://apnews.com/d3976afd85a77a709306df4b0c59c602,https://bloximages.newyork1.vip.townnews.com/roanoke.com/content/tncms/assets/v3/editorial/e/5c/e5cf37c8-13bc-5e4d-83ab-dc7ce2eb4d80/5e2b941a2c2b9.image.jpg?crop=1763%2C992%2C0%2C91&resize=1120%2C630&order=crop%2Cresize,2020-01-25T00:52:05Z,"DETROIT (AP) Fiat Chrysler is moving to dismiss a racketeering lawsuit filed by rival General Motors, denying allegations that it bribed union officials to impose higher labor costs on GM.
In papers filed Friday with the federal court in Detroit, FCA argued … [+3200 chars]",associated-press,Associated Press
By MATTHEW DALY Associated Press,"Trial highlights: Dems cry cover-up, Trump hails activists","WASHINGTON (AP) — From the floor of the Senate, Democratic impeachment prosecutors said Friday that Trump tried to cover up his actions with Ukraine, another reason to remove him from office.",https://apnews.com/9767a1ade5819d2eb989bc8b21724500,https://bloximages.newyork1.vip.townnews.com/tulsaworld.com/content/tncms/assets/v3/editorial/8/4d/84d9856a-6d35-5533-a1c1-aaaf5024e3a3/5e2b899219397.image.jpg?crop=1919%2C1079%2C0%2C0&resize=1120%2C630&order=crop%2Cresize,2020-01-25T00:51:50Z,"WASHINGTON (AP) From the floor of the Senate, Democratic impeachment prosecutors said Friday that President Donald Trump tried to cover up his actions with Ukraine, another reason to remove him from office.
A few blocks away, Trump told anti-abortion activis… [+4061 chars]",associated-press,Associated Press
,"Longtime fugitive guilty of conspiracy, drug trafficking","JACKSON, Miss. (AP) — A federal jury has convicted a Mississippi man, who had been on the run for more than a decade, for his role in a drug trafficking operation that spanned many states.",https://apnews.com/bb94cf792dea184ed04dd4772e49f85a,https://bloximages.newyork1.vip.townnews.com/roanoke.com/content/tncms/custom/image/00f1ee32-f2d0-11e6-9926-f7249dbfe53a.jpg,2020-01-25T00:50:52Z,"JACKSON, Miss. (AP) A federal jury has convicted a Mississippi man, who had been on the run for more than a decade, for his role in a drug trafficking operation that spanned many states.
Daniel Robert, 43, of Meridian, was found guilty Thursday of two counts… [+1688 chars]",associated-press,Associated Press
By EDITH M. LEDERER Associated Press,UN alarm at education crisis: 258 million kids not in school,"UNITED NATIONS (AP) — The U.N. deputy chief said Friday there is an “alarming” crisis in education, pointing to the 258 million children under the age of 17 who are not going to school — and only 49 percent completing…",https://apnews.com/f0d7239038c859fbd2e079ffe3251869,https://bloximages.newyork1.vip.townnews.com/richmond.com/content/tncms/custom/image/6a12cdcc-99eb-11e9-910a-20677ce06c14.jpg?resize=600%2C600,2020-01-25T00:43:20Z,"UNITED NATIONS (AP) The U.N. deputy chief said Friday there is an alarming crisis in education, pointing to the 258 million children under the age of 17 who are not going to school and only 49 percent completing secondary education.
In addition, about 770 mi… [+3476 chars]",associated-press,Associated Press
By TIM REYNOLDS AP Basketball Writer,Spoelstra says Butler's All-Star starting snub is 'a joke',MIAMI (AP) — Erik Spoelstra has a suggestion for All-Star voting: Ditch the positions.,https://apnews.com/e8ef5ef9ef8abd0727b987cbc97abd6f,https://bloximages.newyork1.vip.townnews.com/stltoday.com/content/tncms/assets/v3/editorial/0/28/028070d5-195a-5a44-b115-630fbe5cb363/5e2b93742976d.image.jpg?crop=1763%2C992%2C0%2C92&resize=1120%2C630&order=crop%2Cresize,2020-01-25T00:38:47Z,"MIAMI (AP) Erik Spoelstra has a suggestion for All-Star voting: Ditch the positions.
A day after the NBA revealed the starters for the Feb. 16 All-Star Game two guards and three forwards from each conference the Miami Heat coach said he wonders why the leagu… [+2325 chars]",associated-press,Associated Press
By JOHN HANNA AP Political Writer,GOP Kansas Rep. Watkins changes voter registration 2nd time,"TOPEKA, Kan. (AP) — A freshman Kansas congressman has changed his voter registration for the second time in six weeks after coming under investigation for potentially violating state election laws for previously listing a UPS Inc. store as his residence.",https://apnews.com/07b5cc37067da9b23bd489a8e6eaddbe,https://bloximages.newyork1.vip.townnews.com/richmond.com/content/tncms/custom/image/6a12cdcc-99eb-11e9-910a-20677ce06c14.jpg?resize=600%2C600,2020-01-25T00:29:30Z,"TOPEKA, Kan. (AP) A freshman Kansas congressman has changed his voter registration for the second time in six weeks after coming under investigation for potentially violating state election laws for previously listing a UPS Inc. store as his residence.
Repub… [+2305 chars]",associated-press,Associated Press
By REBECCA SANTANA Associated Press,New Orleans: Protesters demand action on damaged hotel,"NEW ORLEANS (AP) — Dozens of protesters marched from the site of the partially collapsed Hard Rock Hotel on the edge of the French Quarter to City Hall on Friday, demanding that something be done about the hotel and that…",https://apnews.com/64ea6b9e9036d04c32b11c123833f26f,https://bloximages.newyork1.vip.townnews.com/richmond.com/content/tncms/assets/v3/editorial/7/41/741d7c4f-5bce-5518-a57a-8d40a0e5a0b1/5e2b8cefe9902.image.jpg?crop=1616%2C909%2C0%2C125&resize=1120%2C630&order=crop%2Cresize,2020-01-25T00:28:28Z,"NEW ORLEANS (AP) Dozens of protesters marched from the site of the partially collapsed Hard Rock Hotel on the edge of the French Quarter to City Hall on Friday, demanding that something be done about the hotel and that the two bodies still inside be recovered… [+2653 chars]",associated-press,Associated Press
By DOUG FERGUSON AP Golf Writer,Palmer with 62 takes 2-shot lead at Torrey Pines,"SAN DIEGO (AP) — Ryan Palmer had a round as magnificent as the weather at Torrey Pines, making 11 birdies for a 10-under 62 on the North Course to build a two-shot lead over Brandt Snedeker in the Farmers Insurance…",https://apnews.com/bc4d5a942eb8ecd0615cd3e62fc64cb2,https://bloximages.newyork1.vip.townnews.com/roanoke.com/content/tncms/assets/v3/editorial/6/e5/6e5878ee-7dc7-586b-97d8-3265f3010bd2/5e2b8cc59d0ca.image.jpg?crop=1764%2C992%2C0%2C90&resize=1120%2C630&order=crop%2Cresize,2020-01-25T00:22:50Z,"SAN DIEGO (AP) Ryan Palmer had a round as magnificent as the weather at Torrey Pines, making 11 birdies for a 10-under 62 on the North Course to build a two-shot lead over Brandt Snedeker in the Farmers Insurance Open.
For so many others, it wasn't all that … [+1470 chars]",associated-press,Associated Press
Associated Press,Royals star Pérez becomes US Citizen at team's fan event,"KANSAS CITY, Mo. (AP) — Already a World Series MVP, six-time All-Star and five-time Gold Glove catcher, Salvador Pérez became something else when he stepped onto the main stage at the Kansas City Royals' annual FanFest: a U.S. citizen.",https://apnews.com/69a25cb253051110f3c33b053251f56a,https://bloximages.newyork1.vip.townnews.com/stltoday.com/content/tncms/custom/image/4ce82390-59b2-11e6-a3c5-b77ec6e8d16d.png?resize=600%2C517,2020-01-25T00:20:51Z,"KANSAS CITY, Mo. (AP) Already a World Series MVP, six-time All-Star and five-time Gold Glove catcher, Salvador Pérez became something else when he stepped onto the main stage at the Kansas City Royals' annual FanFest: a U.S. citizen.
Pérez took his oath of c… [+1146 chars]",associated-press,Associated Press
By JANIE McCAULEY AP Sports Writer,AP Source: Warriors close to trading Cauley-Stein to Dallas,SAN FRANCISCO (AP) — The Golden State Warriors were working Friday to finalize a trade to send center Willie Cauley-Stein to the Dallas Mavericks for a second-round draft pick this summer.,https://apnews.com/56c454a1801fc7adc814b0ddbb6b0519,https://bloximages.newyork1.vip.townnews.com/roanoke.com/content/tncms/assets/v3/editorial/a/cd/acd1f63e-fdb6-5996-8f45-78f9fcb07a83/5e2933724e435.image.jpg?crop=1881%2C1058%2C0%2C21&resize=1120%2C630&order=crop%2Cresize,2020-01-25T00:14:07Z,"SAN FRANCISCO (AP) The Golden State Warriors were working Friday to finalize a trade to send center Willie Cauley-Stein to the Dallas Mavericks for a second-round draft pick this summer.
A person with direct knowledge of the trade discussions confirmed the s… [+963 chars]",associated-press,Associated Press
,Ex-gymnastics coach gets 50 years in prison for sex assaults,"FORT WORTH, Texas (AP) — A former gymnastics coach was sentenced Friday to 50 years in prison for sexually assaulting young female gymnasts in North Texas and Oklahoma.",https://apnews.com/a70a75bc87c158786d94a24324ecf886,https://bloximages.newyork1.vip.townnews.com/roanoke.com/content/tncms/custom/image/00f1ee32-f2d0-11e6-9926-f7249dbfe53a.jpg,2020-01-25T00:11:28Z,"FORT WORTH, Texas (AP) A former gymnastics coach was sentenced Friday to 50 years in prison for sexually assaulting young female gymnasts in North Texas and Oklahoma.
Skipper Crawley, 53, of Kemp, Texas, pleaded guilty in a Tarrant County state district cour… [+822 chars]",associated-press,Associated Press
,Woman dies after clothing caught in raisin machine,"SANGER, Calif. (AP) — A woman died Friday after her clothing got caught in a raisin processing machine in California's Central Valley, authorities said.",https://apnews.com/770cdb86fc9669a7add8a12946880122,https://bloximages.newyork1.vip.townnews.com/roanoke.com/content/tncms/custom/image/00f1ee32-f2d0-11e6-9926-f7249dbfe53a.jpg,2020-01-25T00:10:11Z,"SANGER, Calif. (AP) A woman died Friday after her clothing got caught in a raisin processing machine in California's Central Valley, authorities said.
The 33-year-old woman was working at the Del Rey Packing plant in Sanger, east of Fresno, according to the … [+712 chars]",associated-press,Associated Press
,Parents held in death of baby that was found in trash bin,"NORTH LAS VEGAS, Nev. (AP) — The parents of a 3-month-old baby found dead last weekend in a North Las Vegas trash bin have been arrested on felony child abuse and destroying evidence charges, police said Friday.",https://apnews.com/f3aae7d8caa237e63cb0edc98b782286,https://bloximages.newyork1.vip.townnews.com/roanoke.com/content/tncms/custom/image/00f1ee32-f2d0-11e6-9926-f7249dbfe53a.jpg,2020-01-25T00:05:21Z,"NORTH LAS VEGAS, Nev. (AP) The parents of a 3-month-old baby found dead last weekend in a North Las Vegas trash bin have been arrested on felony child abuse and destroying evidence charges, police said Friday.
Raul Ramos, 52, and Adriana Hernandez, 32, were … [+1051 chars]",associated-press,Associated Press
,Judge OKs classified information status in terrorism case,"LITTLE ROCK, Ark. (AP) — A judge in Arkansas has allowed a U.S. government official to help guard against the release of classified information during the upcoming terrorism trial of a Yemeni citizen accused of providing material support to al-Qaida.",https://apnews.com/13c8efe0f236b0de964d1747ffcff3ab,https://bloximages.chicago2.vip.townnews.com/billingsgazette.com/content/tncms/custom/image/77758902-e169-11e5-a168-77ef9f7ff013.png,2020-01-25T00:04:00Z,"LITTLE ROCK, Ark. (AP) A judge in Arkansas has allowed a U.S. government official to help guard against the release of classified information during the upcoming terrorism trial of a Yemeni citizen accused of providing material support to al-Qaida.
U.S. Dist… [+1539 chars]",associated-press,Associated Press
By BRIAN HALL Associated Press,"Westbrook scores season-high 45, Rockets beat Wolves 131-124","MINNEAPOLIS (AP) — Russell Westbrook scored a season-high 45 points and had 10 assists, and the Houston Rockets overcame another tough night from James Harden to rally past the Minnesota Timberwolves 131-124 on Friday night.",https://apnews.com/c1adc62d6a244c8d3bacb41cf4aa78f9,https://bloximages.newyork1.vip.townnews.com/stltoday.com/content/tncms/assets/v3/editorial/a/fb/afb17994-0a01-591b-9d83-4411b13604f9/5e2bc113e55f7.image.jpg?crop=1609%2C905%2C0%2C190&resize=1120%2C630&order=crop%2Cresize,2020-01-25T03:47:51Z,"MINNEAPOLIS (AP) Russell Westbrook scored a season-high 45 points and had 10 assists, and the Houston Rockets overcame another tough night from James Harden to rally past the Minnesota Timberwolves 131-124 on Friday night.
Westbrook helped key a second-half … [+2670 chars]",associated-press,Associated Press
,Man sentenced to life in prison for transgender wife's death,"NORTH ADAMS, Mass. (AP) — A Massachusetts man pleaded guilty Thursday to killing his transgender wife and was sentenced to life in prison, prosecutors said.",https://apnews.com/22840b1a17592e1066bc980679ecc49d,https://bloximages.newyork1.vip.townnews.com/roanoke.com/content/tncms/custom/image/00f1ee32-f2d0-11e6-9926-f7249dbfe53a.jpg,2020-01-25T03:47:29Z,"NORTH ADAMS, Mass. (AP) A Massachusetts man pleaded guilty Thursday to killing his transgender wife and was sentenced to life in prison, prosecutors said.
Mark Steele-Knudslien, 49, of North Adams, pleaded guilty in Berkshire Superior Court to second-degree … [+899 chars]",associated-press,Associated Press
JOHN JACKSON Associated Press,"Hield scores 21, Kings beat Bulls 98-81 to snap 6-game skid","CHICAGO (AP) — Buddy Hield scored 21 points, Harrison Barnes added 19 and the Sacramento Kings beat the Chicago Bulls 98-81 on Friday night to snap a six-game losing streak.",https://apnews.com/783b81af3fcdeffa7956b437b634b6f2,https://bloximages.newyork1.vip.townnews.com/stltoday.com/content/tncms/assets/v3/editorial/c/a1/ca11a6dd-a32e-594b-8526-b3104b474cd3/5e2bc118632a7.image.jpg?crop=1763%2C992%2C0%2C91&resize=1120%2C630&order=crop%2Cresize,2020-01-25T03:46:13Z,"CHICAGO (AP) Buddy Hield scored 21 points, Harrison Barnes added 19 and the Sacramento Kings beat the Chicago Bulls 98-81 on Friday night to snap a six-game losing streak.
De'Aaron Fox had 18 points, seven assists and six rebounds as the Kings led virtually … [+2976 chars]",associated-press,Associated Press
,No damage as 4.6-magnitude quake rattles California desert,"BARSTOW, Calif. (AP) — A small earthquake rattled the Southern California desert on Friday, but there were no immediate reports of damage or injuries.",https://apnews.com/bca87b0e9b9271a55dc0f9e7918e489d,https://bloximages.newyork1.vip.townnews.com/roanoke.com/content/tncms/custom/image/00f1ee32-f2d0-11e6-9926-f7249dbfe53a.jpg,2020-01-25T03:43:59Z,"BARSTOW, Calif. (AP) A small earthquake rattled the Southern California desert on Friday, but there were no immediate reports of damage or injuries.
A temblor with a preliminary magnitude of 4.6 struck at 7:03 p.m. and was centered about 14 miles northeast o… [+355 chars]",associated-press,Associated Press
By BRETT MARTEL AP Sports Writer,"Jokic, Nuggets, control boards in 113-106 win over Pelicans",NEW ORLEANS (AP) — Nikola Jokic had 27 points and 12 rebounds and the Denver Nuggets beat the New Orleans Pelicans 113-106 on Friday night.,https://apnews.com/65febe738004ae97346e66f7f494dca8,https://bloximages.newyork1.vip.townnews.com/stltoday.com/content/tncms/assets/v3/editorial/d/55/d5590729-6bee-584e-b33c-cd7de57f2b30/5e2bbe5173485.image.jpg?crop=1763%2C992%2C0%2C91&resize=1120%2C630&order=crop%2Cresize,2020-01-25T03:43:12Z,"NEW ORLEANS (AP) Nikola Jokic had 27 points and 12 rebounds and the Denver Nuggets beat the New Orleans Pelicans 113-106 on Friday night.
Zion Williamson scored 15 points in about 21 minutes for New Orleans. The Pelicans dropped to 0-2 since the NBA's top ov… [+2230 chars]",associated-press,Associated Press
,No. 24 South Dakota women roll to 79-25 victory,"VERMILLION, S.D. (AP) — Ciara Duffy had 13 points with seven assists in a balanced South Dakota offense and the No. 24 Coyotes rolled past Purdue Fort Wayne 79-25 on Friday night for their seventh straight victory.",https://apnews.com/8fe4fa04a37600359317efc97eb30721,https://bloximages.newyork1.vip.townnews.com/stltoday.com/content/tncms/custom/image/4ce82390-59b2-11e6-a3c5-b77ec6e8d16d.png?resize=600%2C517,2020-01-25T03:40:38Z,"VERMILLION, S.D. (AP) Ciara Duffy had 13 points with seven assists in a balanced South Dakota offense and the No. 24 Coyotes rolled past Purdue Fort Wayne 79-25 on Friday night for their seventh straight victory.
The Coyotes (18-2, 7-0) had won their previou… [+933 chars]",associated-press,Associated Press
By CLIFF BRUNT AP Sports Writer,"Gallinari scores 25, leads Thunder past Hawks 140-111","OKLAHOMA CITY (AP) — Danilo Gallinari scored 25 points, and the Oklahoma City Thunder beat the Atlanta Hawks 140-111 on Friday night for their fourth straight win.",https://apnews.com/4a1f6c1b3091db4ef3f5950115e0cd9c,https://bloximages.newyork1.vip.townnews.com/stltoday.com/content/tncms/assets/v3/editorial/5/bb/5bb85874-9b9b-5586-ae67-bea3dfbccd14/5e2bbe579af23.image.jpg?crop=1763%2C992%2C0%2C91&resize=1120%2C630&order=crop%2Cresize,2020-01-25T03:40:21Z,"OKLAHOMA CITY (AP) Danilo Gallinari scored 25 points, and the Oklahoma City Thunder beat the Atlanta Hawks 140-111 on Friday night for their fourth straight win.
Shai Gilgeous-Alexander scored 24 points and Dennis Schroder added 21 for the Thunder, who shot … [+2008 chars]",associated-press,Associated Press
,"McDonald scores 24, No. 18 Arizona women beat Arizona State","TUCSON, Ariz. (AP) — Aari McDonald had nine of her 24 points in the fourth quarter and finished with 11 rebounds to help No. 18 Arizona beat No. 16 Arizona State 59-53 on Friday night.",https://apnews.com/c208f78fe33980daf7b8f2abb3763f01,https://bloximages.newyork1.vip.townnews.com/stltoday.com/content/tncms/custom/image/4ce82390-59b2-11e6-a3c5-b77ec6e8d16d.png?resize=600%2C517,2020-01-25T03:34:42Z,"TUCSON, Ariz. (AP) Aari McDonald had nine of her 24 points in the fourth quarter and finished with 11 rebounds to help No. 18 Arizona beat No. 16 Arizona State 59-53 on Friday night.
Dominique McBryde's 3-pointer with 3:05 to go sparked a 7-0 run for the Wil… [+730 chars]",associated-press,Associated Press
