author,title,description,url,urlToImage,publishedAt,content,source.id,source.name
"Analysis by Chris Cillizza, CNN Editor-at-large",The towering hypocrisy of Senate Republicans on a SCOTUS vacancy,"On March 16, 2016, President Barack Obama nominated Merrick Garland to fill the vacancy caused by the death of Justice Antonin Scalia the previous month.",https://www.cnn.com/2020/07/21/politics/mitch-mcconnell-merrick-garland-scotus-vacancy/index.html,https://cdn.cnn.com/cnnnext/dam/assets/200629115837-01-scotus-justices-file-super-tease.jpg,2020-07-21T15:29:47Z,"(CNN)On March 16, 2016, President Barack Obama nominated Merrick Garland to fill the vacancy caused by the death of Justice Antonin Scalia the previous month.
On March 16, 2016, Senate Republicans m… [+5874 chars]",cnn,CNN
"Samantha Waldenberg, CNN","She marched on Washington, got her law degree at 62 and beat cancer twice. Then coronavirus took her","Anna Levine always carried her pocket Constitution, and she knew it cover to cover. She was always ready to cite certain parts of it if she saw any injustice, racism or discrimination in the world.",https://www.cnn.com/2020/07/21/us/anna-levine-covid-battle-trnd/index.html,https://cdn.cnn.com/cnnnext/dam/assets/200720224155-anna-levine-covid-battle-super-tease.jpg,2020-07-21T15:23:56Z,,cnn,CNN
,Amazon driver surprises cancer patient with act of kindness,An Amazon driver surprised a cancer patient with a heartfelt card and flowers in addition to his package delivery.,https://www.cnn.com/videos/us/2020/07/21/amazon-driver-act-of-kindness-cancer-patient-newsource-orig-vpx.cnn,https://cdn.cnn.com/cnnnext/dam/assets/200721105515-amazon-driver-act-of-kindness-cancer-patient-newsource-orig-vpx-00000000-super-tease.jpg,2020-07-21T15:08:49Z,Chat with us in Facebook Messenger. Find out what's happening in the world as it unfolds.,cnn,CNN
"Sunlen Serfaty, CNN",Lawmaker pushes amendments on sexual harassment in the military for annual defense bill,"Rep. Jackie Speier is pushing for several amendments to be included in the National Defense Authorizations Act to address sexual harassment in the military, in response to Spc. Vanessa Guillén's killing in Texas earlier this year.",https://www.cnn.com/2020/07/21/politics/jackie-speier-amendment-vanessa-guillen-ndaa/index.html,https://cdn.cnn.com/cnnnext/dam/assets/200703211755-vanessa-guillen-base-texas-asesinada-fort-hood-suicidio-sospechoso-seg-pkg-miguel-angel-antonanzas-00001322-super-tease.jpg,2020-07-21T15:08:30Z,"(CNN)Rep. Jackie Speier is pushing for several amendments to be included in the National Defense Authorizations Act to address sexual harassment in the military, in response to Spc. Vanessa Guillén's… [+2541 chars]",cnn,CNN
"Rob Picheta, CNN",A very rare gene could explain why some women don't need pain relief during childbirth,"Women who don't need an epidural during childbirth might be carriers of a rare genetic variant that gives them a much higher threshold for pain, scientists have discovered.",https://www.cnn.com/2020/07/21/health/childbirth-pain-threshold-study-scli-scn-intl/index.html,https://cdn.cnn.com/cnnnext/dam/assets/200721100207-child-birth-stock-super-tease.jpg,2020-07-21T15:00:42Z,,cnn,CNN
"Jack Guy, CNN Business",'Tenet' is the latest Hollywood film to be delayed because of the pandemic,"Warner Bros. has delayed the release of the Christopher Nolan movie ""Tenet"" because of the continued impact of the coronavirus pandemic.",https://www.cnn.com/2020/07/21/media/tenet-christopher-nolan-delay-scli-intl/index.html,https://cdn.cnn.com/cnnnext/dam/assets/200721084441-tenet-christopher-nolan-super-tease.jpg,2020-07-21T14:54:00Z,,cnn,CNN
"Ben Church, CNN","Alex Zanardi transferred to specialist neuro-rehabilitation center, a month since horrific crash","Ex-Formula One driver and Paralympic champion Alex Zanardi has been transferred from hospital to a specialist neuro-rehabilitation center, after suffering a horrific cycling crash in June.",https://edition.cnn.com/2020/07/21/sport/alex-zanardi-transfer-hospital-rehabilitation-spt-intl/index.html,https://cdn.cnn.com/cnnnext/dam/assets/120905074835-zanardi1-story-top.jpg,2020-07-21T14:52:17Z,,cnn,CNN
Opinion by Jen Psaki,The GOP is using the courts to gut voting rights,Jen Psaki writes that American voters should be greatly concerned by Republican efforts to use the Supreme Court to suppress voting across the country -- all in an attempt to hold onto the White House and Senate. She argues they must vote to make sure Trump d…,https://www.cnn.com/2020/07/21/opinions/gop-supreme-court-gut-voting-rights-psaki/index.html,https://cdn.cnn.com/cnnnext/dam/assets/200211125827-new-hampshire---february-11-super-tease.jpg,2020-07-21T14:49:07Z,"Jen Psaki, a CNN political commentator, was the White House communications director and State Department spokeswoman during the Obama administration. She is the founder of Evergreen Consulting. Follo… [+6470 chars]",cnn,CNN
"David Goldman, CNN Business",Starbucks is getting rid of the most annoying thing about Starbucks Rewards,"This fall, you'll be able to pay for Starbucks drinks on your app using -- get this -- a credit card, Apple Pay, Google Pay or even cash. And yes, you'll still be able to collect stars for rewards.",https://www.cnn.com/2020/07/21/tech/starbucks-rewards-credit-card/index.html,https://cdn.cnn.com/cnnnext/dam/assets/200721092031-starbucks-app-stock-super-tease.jpg,2020-07-21T14:45:02Z,"New York (CNN Business)This fall, you'll be able to pay for Starbucks drinks on your app using -- get this -- a credit card, Apple Pay, Google Pay or even cash. And yes, you'll still be able to colle… [+2143 chars]",cnn,CNN
"Jordan Valinsky, CNN Business",Wendy's launches a rewards program,Wendy's is hoping to expand its fervent fan base with a new rewards program.,https://www.cnn.com/2020/07/21/business/wendys-rewards-launch/index.html,https://cdn.cnn.com/cnnnext/dam/assets/200721091408-wendys-drive-thru-restricted-super-tease.jpg,2020-07-21T14:34:27Z,,cnn,CNN
"Scottie Andrew, CNN","Greta Thunberg will donate $114,000 to fight the coronavirus in the Brazilian Amazon",Teen climate activist Greta Thunberg will donate a portion of a $1.14 million prize to fighting coronavirus in the Brazilian Amazon.,https://www.cnn.com/2020/07/21/world/greta-thunberg-donate-covid-amazon-trnd/index.html,https://cdn.cnn.com/cnnnext/dam/assets/200502123259-thunberg-coronavirus-donation-trnd-super-tease.jpg,2020-07-21T14:30:03Z,"(CNN)Teen climate activist Greta Thunberg will donate a portion of a $1.14 million prize to fighting coronavirus in the Brazilian Amazon. 
This week, Thunberg won the very first Gulbenkian Prize for… [+2452 chars]",cnn,CNN
"Analysis by Chris Cillizza, CNN Editor-at-large",Analysis: The 1 thing NOT to expect from Trump's daily briefings,"On Monday, President Donald Trump totally reversed course on how he is handling the ongoing coronavirus pandemic -- posting a picture wearing a mask and announcing that he would restart the coronavirus daily(ish) briefings that ended in late April.",https://www.cnn.com/2020/07/21/politics/donald-trump-coronavirus-briefings-daily/index.html,https://cdn.cnn.com/cnnnext/dam/assets/200406175011-01-coronavirus-briefing-0406-trump-super-tease.jpg,2020-07-21T14:19:48Z,"THE POINT -- NOW ON YOUTUBE! 
In each episode of his weekly YouTube show, Chris Cillizza will delve a little deeper into the surreal world of politics. Click to subscribe!",cnn,CNN
,David Schwimmer says 'Friends' reunion is happening soon,"David Schwimmer talked about the impending ""Friends"" reunion special on ""The Tonight Show Starring Jimmy Fallon.""",https://www.cnn.com/videos/entertainment/2020/07/21/friends-reunion-schwimmer-tonight-show-orig-vstop-bdk.cnn,https://cdn.cnn.com/cnnnext/dam/assets/200721094352-friends-cast-2002-emmy-awards-super-tease.jpg,2020-07-21T14:11:39Z,Chat with us in Facebook Messenger. Find out what's happening in the world as it unfolds.,cnn,CNN
"Devan Cole, CNN",Senate Democrats introduce legislation aimed at decreasing use of federal force in Portland and other cities,"Oregon's two Democratic senators are pushing legislation that aims to scale back the use of federal law enforcement agents against protesters in Portland and other cities, as well as prevent agents from making arrests without displaying clear identification.",https://www.cnn.com/2020/07/21/politics/portland-senate-legislation-federal-agents-id-crowd-control/index.html,https://cdn.cnn.com/cnnnext/dam/assets/200720115937-02-portland-protests-0719-super-tease.jpg,2020-07-21T14:01:43Z,"Washington (CNN)Oregon's two Democratic senators are pushing legislation that aims to scale back the use of federal law enforcement agents against protesters in Portland and other cities, as well as … [+2856 chars]",cnn,CNN
"Anneken Tappe, CNN Business","Women are hit harder by this recession, and governments need to act now, IMF warns","The pandemic recession is hurting women more than men, potentially undoing years of progress if lawmakers don't step up efforts to improve conditions for women, economists at the International Monetary Fund warned Tuesday.",https://www.cnn.com/2020/07/21/economy/imf-covid-inequality-women/index.html,https://cdn.cnn.com/cnnnext/dam/assets/200720153629-international-monetary-fund-file-super-tease.jpg,2020-07-21T14:00:21Z,,cnn,CNN
Kylie Atwood,"Trump blasts Beijing in public, but privately Trump org imports tons of Chinese goods","President Donald Trump has cast himself as tough on China and promised that his trade negotiations with Beijing would economically benefit everyday Americans, even as Trump-owned properties have continued to contribute to the trade deficit with the country he…",https://www.cnn.com/2020/07/21/politics/trump-org-china-imports/index.html,https://cdn.cnn.com/cnnnext/dam/assets/200501233348-conclu-eeuu-china-super-tease.jpg,2020-07-21T14:00:15Z,"Washington (CNN)President Donald Trump has cast himself as tough on China and promised that his trade negotiations with Beijing would economically benefit everyday Americans, even as Trump-owned prop… [+6028 chars]",cnn,CNN
"Jeremy Herb, Manu Raju and Zachary Cohen, CNN",Democrats raise concerns over Russian-linked campaign targeting Biden,"Congressional Democrats' request to the FBI to brief lawmakers on foreign election interference included concerns about a Russian-linked ""disinformation"" campaign to target former Vice President Joe Biden in the 2020 election, according to a source familiar w…",https://www.cnn.com/2020/07/21/politics/joe-biden-russia-foreign-interference/index.html,https://cdn.cnn.com/cnnnext/dam/assets/200206104937-03-adam-schiff-lead-image-super-tease.jpg,2020-07-21T17:56:15Z,"Washington (CNN)Congressional Democrats' request to the FBI to brief lawmakers on foreign election interference included concerns about a Russian-linked ""disinformation"" campaign to target former Vic… [+6965 chars]",cnn,CNN
"Haley Byrd, CNN",GOP congressman verbally accosted AOC on steps of Capitol Hill: report,"Rep. Ted Yoho, a Florida Republican, got into a heated exchange with Democratic Rep. Alexandria Ocasio-Cortez of New York on Monday, cursing as he walked away from their conversation. According to an account published in The Hill, Yoho said ""f**king bitch"" as…",https://www.cnn.com/2020/07/21/politics/aoc-ted-yoho-confrontation/index.html,https://cdn.cnn.com/cnnnext/dam/assets/200721122912-ted-yoho-alexandria-ocasio-cortez-split-super-tease.jpg,2020-07-21T17:54:20Z,"Editor's note: This story contains vulgar language.
 (CNN)Rep. Ted Yoho, a Florida Republican, got into a heated exchange with Democratic Rep. Alexandria Ocasio-Cortez of New York on Monday, cursing… [+1607 chars]",cnn,CNN
"David Shortell, CNN",US charges Chinese hackers over 'sweeping' intrusions including Covid-19 research,"US prosecutors have charged two alleged Chinese hackers over a ""sweeping global computer intrusion campaign"" that they say was supported by the country's government and aimed at coronavirus treatment and vaccine research.",https://www.cnn.com/2020/07/21/politics/china-hackers-coronavirus/index.html,https://cdn.cnn.com/cnnnext/dam/assets/191119094816-department-of-justice-building-super-tease.jpg,2020-07-21T17:50:28Z,"(CNN)US prosecutors have charged two alleged Chinese hackers over a ""sweeping global computer intrusion campaign"" that they say was supported by the country's government and aimed at coronavirus trea… [+3797 chars]",cnn,CNN
"Ali Zaslav, CNN","Senate GOP plans another round of direct checks in next relief bill, McConnell says","Senate Republicans plan to include a second round of direct payments, or stimulus checks, for Americans in the next coronavirus relief package, Majority Leader Mitch McConnell announced Tuesday.",https://www.cnn.com/2020/07/21/politics/mitch-mcconnell-direct-payments-gop-plan/index.html,https://cdn.cnn.com/cnnnext/dam/assets/190716153938-mitch-mcconell-trump-racist-tweets-super-tease.jpg,2020-07-21T17:48:29Z,"(CNN)Senate Republicans plan to include a second round of direct payments, or stimulus checks, for Americans in the next coronavirus relief package, Majority Leader Mitch McConnell announced Tuesday.… [+2167 chars]",cnn,CNN
"Ali Zaslav, CNN","Senate GOP plans another round of direct checks for Americans in next relief bill, McConnell says","Senate Republicans plan to include a second round of direct payments, or stimulus checks, for Americans in the next coronavirus relief package, Majority Leader Mitch McConnell announced Tuesday.",https://www.cnn.com/2020/07/21/politics/mitch-mcconnell-direct-payments-gop-plan/index.html,https://cdn.cnn.com/cnnnext/dam/assets/190716153938-mitch-mcconell-trump-racist-tweets-super-tease.jpg,2020-07-21T17:48:29Z,"(CNN)Senate Republicans plan to include a second round of direct payments, or stimulus checks, for Americans in the next coronavirus relief package, Majority Leader Mitch McConnell announced Tuesday.… [+2167 chars]",cnn,CNN
"Amy Woodyatt, CNN",Scientists are one step closer to delaying aging,Scientists at the University of California San Diego may be one step closer to being able to delay the aging process.,https://www.cnn.com/2020/07/21/health/slow-aging-intl-scli-scn/index.html,https://cdn.cnn.com/cnnnext/dam/assets/200721130020-02-genetic-engineered-long-life-super-tease.jpg,2020-07-21T17:43:30Z,,cnn,CNN
By Krystin Arneson,There's a huge Nike sale at Nordstrom Rack right now,"Nordstrom Rack is a reliable one-stop shop for deals for the whole family, with Nordstrom's famous selection of brand names and designer labels — including go-tos like Free People, Ray-Ban and Nike — offered at serious discounts every day. And from now until …",https://www.cnn.com/2020/07/21/cnn-underscored/nike-sale-nordstrom-rack/index.html,https://cdn.cnn.com/cnnnext/dam/assets/200721103409-nike-lead-super-169.jpg,2020-07-21T17:36:43Z,"Nordstrom Rack is a reliable one-stop shop for deals for the whole family, with Nordstroms famous selection of brand names and designer labels including go-tos like Free People, Ray-Ban and Nike offe… [+2395 chars]",cnn,CNN
By Jacob Krol,Brilliant picture and lofty price highlight Samsung's entry 8K TV,"These days, 8k isn't exactly common place. But Samsung is trying to change that with their Q800T 8K QLED TV. After spending a few weeks testing it out, we highlight what sets it apart.",https://www.cnn.com/2020/07/21/cnn-underscored/samsung-q800t-review-8k-qled/index.html,https://cdn.cnn.com/cnnnext/dam/assets/200721130940-underscored-samsung-qled-tv-lead-super-169.jpg,2020-07-21T17:36:05Z,"These days, 4K TVs are pretty much the norm from nearly every manufacturer. But what about 8K? Samsung and Sony hit the ground running with the next generation of TVs at CES in January. 
Weve spent … [+7793 chars]",cnn,CNN
Allison Gordon,People are using honest obituaries to blame governors for coronavirus deaths and invite them to their loved ones' funerals,"Isabelle Papadimitriou was a dedicated respiratory therapist who worked to help others breathe. When coronavirus robbed the 64-year-old of her breath, her daughter Fiana Tulip knew she had to speak out.",https://www.cnn.com/2020/07/21/us/texas-obituary-covid-abbott-trnd/index.html,https://cdn.cnn.com/cnnnext/dam/assets/200721124320-02-texas-obituary-covid-abbott-trnd-super-tease.jpg,2020-07-21T17:31:55Z,"(CNN)Isabelle Papadimitriou was a dedicated respiratory therapist who worked to help others breathe. When coronavirus robbed the 64-year-old of her breath, her daughter Fiana Tulip knew she had to sp… [+3491 chars]",cnn,CNN
"Catherine E. Shoichet, CNN",A judge ordered the US to accept new DACA applications. It's unclear if the Trump administration will,Arlette Morales sent in her DACA application weeks ago. Every day the 17-year-old races to check the mail to see if she's gotten a response.,https://www.cnn.com/2020/07/21/politics/daca-new-applications/index.html,https://cdn.cnn.com/cnnnext/dam/assets/200721091458-01-daca-supreme-court-decision-0618-super-tease.jpg,2020-07-21T17:30:42Z,,cnn,CNN
"Nathaniel Meyersohn, CNN Business","While most retailers struggle, Aldi plans to open 70 new US stores","Retailers are expected to close stores in record numbers this year, but German discount grocery chain Aldi is still expanding in the United States.",https://www.cnn.com/2020/07/21/business/aldi-store-openings/index.html,https://cdn.cnn.com/cnnnext/dam/assets/200721110745-aldi-store-file-super-tease.jpg,2020-07-21T17:27:41Z,,cnn,CNN
"Max Claypool and Judson Jones, CNN",A tropical system will bring heavy rain to the Gulf Coast this weekend,"A tropical system in the Caribbean could develop into the seventh named storm of the Atlantic hurricane season. Even if it doesn't form, the system will bring heavy rain and stormy conditions to the Gulf Coast over the weekend.",https://www.cnn.com/2020/07/21/weather/possible-tropical-storm-caribbean/index.html,https://cdn.cnn.com/cnnnext/dam/assets/200721083217-hurricane-rain-accum-super-tease.jpg,2020-07-21T17:27:13Z,,cnn,CNN
"Analysis by Chris Cillizza, CNN Editor-at-large",Florida's governor just can't seem to get it right on coronavirus,"If there's a face of the botched handling of coronavirus in the United States -- other than President Donald Trump, of course -- it's that of Florida Republican Gov. Ron DeSantis.",https://www.cnn.com/2020/07/21/politics/ron-desantis-florida-coronavirus/index.html,https://cdn.cnn.com/cnnnext/dam/assets/200626160351-ron-desantis-0506-super-tease.jpg,2020-07-21T17:23:16Z,"THE POINT -- NOW ON YOUTUBE! 
In each episode of his weekly YouTube show, Chris Cillizza will delve a little deeper into the surreal world of politics. Click to subscribe!",cnn,CNN
"Brad Parks and Kay Jones, CNN","In Chicago, 25 people were shot Monday after 12 people were killed over the weekend","The Trump administration is preparing to send federal agents to Chicago this week, two law enforcement officials told CNN.",https://www.cnn.com/2020/07/21/us/chicago-shootings/index.html,https://cdn.cnn.com/cnnnext/dam/assets/200628085836-01-chicago-police-badge-file-super-tease.jpg,2020-07-21T17:21:03Z,,cnn,CNN
,Biden says he's considering four Black women to be his running mate,,https://www.cnn.com/collections/biden-intl-072120/,,2020-07-21T17:16:45Z,,cnn,CNN
"Swati Gupta and Jack Guy, CNN",Rare yellow turtle discovered,A farmer in eastern India has found a yellow turtle which experts say is the product of albinism.,https://www.cnn.com/2020/07/21/asia/india-yellow-turtle-found-scli-intl/index.html,https://cdn.cnn.com/cnnnext/dam/assets/200721114135-03-india-yellow-turtle-super-tease.jpg,2020-07-21T17:04:22Z,,cnn,CNN
"Ashley Strickland, CNN","A massive asteroid shower hit Earth and the moon 800 million years ago, study says","Earth and the moon were bombarded by an asteroid shower 800 million years ago larger than the asteroid responsible for the extinction of the dinosaurs, according to a new study. It may have triggered major events shaping this place we now call home.",https://www.cnn.com/2020/07/21/world/moon-earth-asteroid-shower-scn/index.html,https://cdn.cnn.com/cnnnext/dam/assets/200721153140-earth-moon-asteroid-shower-illustration-super-tease.jpg,2020-07-21T16:59:05Z,,cnn,CNN
"Allison Morrow, CNN Business","Michael Brooks, political commentator and podcast host, dies at 37","Michael Brooks, a progressive political commentator and co-host of the ""Majority Report"" podcast, died of a ""sudden medical condition,"" the show announced on Twitter Monday. He was 37.",https://www.cnn.com/2020/07/21/media/michael-brooks-dead-majority-report/index.html,https://cdn.cnn.com/cnnnext/dam/assets/200721115509-michael-brooks-super-tease.jpg,2020-07-21T16:53:02Z,,cnn,CNN
"Parija Kavilanz, CNN Business",Walmart stores will close on Thanksgiving Day this year,"Walmart will close its stores on Thanksgiving Day for the first time in more than 30 years, the world's largest retailer said Tuesday.",https://www.cnn.com/2020/07/21/business/walmart-thanksgiving-day-closed/index.html,https://cdn.cnn.com/cnnnext/dam/assets/200721110902-walmart-interior-0717-super-tease.jpg,2020-07-21T16:51:19Z,,cnn,CNN
"Scott McLean, CNN Business","Give us higher pay not woke words, says ex-driver taking on Uber in the UK","Yaseen Aslam never set out to drive for a living. But in 2006, laid off from his job in tech with few other options, he found work as a taxi driver. He stuck with it because it offered flexibility and paid well — £500 ($635) in a weekend, after expenses. In 2…",https://www.cnn.com/2020/07/21/tech/uber-uk-court-case-blm/index.html,https://cdn.cnn.com/cnnnext/dam/assets/200721120243-02-uber-uk-court-case-super-tease.jpg,2020-07-21T16:47:42Z,"London (CNN Business)Yaseen Aslam never set out to drive for a living. But in 2006, laid off from his job in tech with few other options, he found work as a taxi driver. He stuck with it because it o… [+5620 chars]",cnn,CNN
"Analysis by Brian Lowry, CNN",Comic-Con is usually a crowded mess. That's all the more reason to miss it,"There might be no event less conducive to social distancing than Comic-Con, the annual pop-culture gathering that packs 130,000 people into San Diego's convention center. The reasons to complain about the annual event are, suddenly, the reasons to miss it.",https://www.cnn.com/2020/07/21/entertainment/comic-con-at-home-column/index.html,https://cdn.cnn.com/cnnnext/dam/assets/180718105449-comic-con-star-wars-super-tease.jpg,2020-07-21T16:47:05Z,"(CNN)There might be no event less conducive to social distancing than Comic-Con, the annual pop-culture gathering that packs 130,000 people into San Diego's convention center. Granted, there are a lo… [+3500 chars]",cnn,CNN
"Matias Grez, CNN",Natalie Portman and Serena Williams among investors in new LA soccer team,"Actress Natalie Portman, tennis star Serena Williams and her daughter Alexis Olympia Ohanian are part of a majority woman-founded group that will own the newest soccer team in the United States.",https://edition.cnn.com/2020/07/21/football/los-angeles-womens-soccer-team-serena-williams-natalie-portman-spt-intl/index.html,https://cdn.cnn.com/cnnnext/dam/assets/200721165024-natalie-portman-super-tease.jpg,2020-07-21T16:45:18Z,,cnn,CNN
"Sarah Mucha and Arlette Saenz, CNN",Biden launches week-long $15 million ad blitz in battleground states,"Presumptive Democratic presidential nominee Joe Biden's campaign is kicking up its advertising investments in key battleground states, announcing a new $15 million ad buy in broadcast, radio and digital over the next week.",https://www.cnn.com/2020/07/21/politics/biden-battleground-ad/index.html,https://cdn.cnn.com/cnnnext/dam/assets/200630133344-02-biden-0630-super-tease.jpg,2020-07-21T16:41:39Z,"(CNN)Presumptive Democratic presidential nominee Joe Biden's campaign is kicking up its advertising investments in key battleground states, announcing a new $15 million ad buy in broadcast, radio and… [+3907 chars]",cnn,CNN
"Julia Horowitz, CNN Business",Robinhood halts plans to launch outside the United States,Robinhood is halting its planned launch in the United Kingdom as the popular stock trading app faces fresh scrutiny in its home market.,https://www.cnn.com/2020/07/21/investing/robinhood-uk-trading-app/index.html,https://cdn.cnn.com/cnnnext/dam/assets/200721124318-restricted-file-robinhood-app-2018-super-tease.jpg,2020-07-21T16:40:27Z,,cnn,CNN
"Kevin Liptak, CNN","Trump sometimes receives multiple coronavirus tests in a day, White House says","President Donald Trump sometimes receives multiple coronavirus tests in a day, the White House said Tuesday, explaining his continued reluctance to wear a mask in public even as he begins to encourage his supporters to do so.",https://www.cnn.com/2020/07/21/politics/donald-trump-coronavirus-tests/index.html,https://cdn.cnn.com/cnnnext/dam/assets/200406175011-01-coronavirus-briefing-0406-trump-super-tease.jpg,2020-07-21T16:35:43Z,"Washington (CNN)President Donald Trump sometimes receives multiple coronavirus tests in a day, the White House said Tuesday, explaining his continued reluctance to wear a mask in public even as he be… [+2131 chars]",cnn,CNN
