author,title,description,url,urlToImage,publishedAt,content,source.id,source.name
"Ashley Fantz, Casey Tolan and Alessandra Freitas, CNN",Alvin Ailey dance theater official fired after sexual misconduct allegations,"The Alvin Ailey American Dance Theater, one of the most prominent dance companies in the US and an iconic institution in the world of Black performing arts, on Monday fired a senior artistic director amid allegations of sexual harassment.",https://www.cnn.com/2020/07/20/us/alvin-ailey-dance-school-troy-powell-invs/index.html,https://cdn.cnn.com/cnnnext/dam/assets/200720175851-troy-powell-restricted-super-tease.jpg,2020-07-21T01:50:07Z,,cnn,CNN
,CNN anchor tries to translate Trump's Fox News interview,CNN's John Berman discusses comments President Donald Trump made during an interview on Fox News with Chris Wallace.,https://www.cnn.com/videos/politics/2020/07/21/donald-trump-eventually-ill-be-right-sot-vpx-kth-berman-ac360.cnn,https://cdn.cnn.com/cnnnext/dam/assets/200720211211-berman-kth-super-tease.jpg,2020-07-21T01:44:29Z,Chat with us in Facebook Messenger. Find out what's happening in the world as it unfolds.,cnn,CNN
"By Jacopo Prisco, CNN",The AN-225: How the Cold War created the world's largest airplane,"There's a reason crowds flock to see the Soviet-built AN-225 wherever it lands. Created to carry the USSR's space shuttle, this behemoth of the skies is still working today, and is still the world's biggest airplane in regular operation.",https://www.cnn.com/travel/article/an-225-worlds-largest-airplane/index.html,https://cdn.cnn.com/cnnnext/dam/assets/200707180719-an225-landing-super-tease.jpg,2020-07-21T01:27:18Z,"(CNN) The first powered plane flight, performed by the Wright Brothers over the windswept beach of North Carolina's Kitty Hawk in 1903, covered 120 feet. That historic flight would fit entirely in th… [+8787 chars]",cnn,CNN
"Daniel Renjifo, CNN",Nigerian fashion label Tiffany Amber swaps couture for PPE,Company founder Folake Akindele Coker pivoted her fashion label into PPE production after she realized that a prolonged lockdown in Nigeria would impact consumer sales.,https://www.cnn.com/2020/07/20/africa/nigeria-fashion-tiffany-amber-coronavirus-ppe-spc-intl/index.html,https://cdn.cnn.com/cnnnext/dam/assets/200715102210-tiffany-amber-fashion-nigeria-restricted-super-tease.jpg,2020-07-21T01:21:46Z,"(CNN)These days, things look a little different when Folake Akindele Coker gets to her office. ""I arrive at 9am, all geared (up) for this invisible enemy,"" she says. The 45-year-old designer and foun… [+3305 chars]",cnn,CNN
"Ted Barrett and Manu Raju, CNN","Republican leaders vow to fill a potential Supreme Court vacancy this year, despite some apprehension","Senate Republican leaders, undeterred by the scathing criticism leveled against them for blocking President Barack Obama's election-year Supreme Court nominee in 2016, are signaling that they are prepared to confirm a nominee by President Donald Trump even if…",https://www.cnn.com/2020/07/20/politics/supreme-court-senate-republicans-election-year/index.html,https://cdn.cnn.com/cnnnext/dam/assets/141103165630-john-thune-file-super-tease.jpg,2020-07-21T00:59:26Z,"(CNN)Senate Republican leaders, undeterred by the scathing criticism leveled against them for blocking President Barack Obama's election-year Supreme Court nominee in 2016, are signaling that they ar… [+3884 chars]",cnn,CNN
"George Ramsay, CNN",'Violence and abuse are too often a part of the child athlete's experience' in Japan -- report,"Hitting children with bats and sticks, slapping them across the face, and holding their heads underwater to simulate drowning are some of the abusive coaching techniques allegedly used in Japan as revealed in a report by Human Rights Watch (HRW).",https://edition.cnn.com/2020/07/20/sport/japan-child-athletes-abuse-hurman-rights-watch-report-spt-intl/index.html,https://cdn.cnn.com/cnnnext/dam/assets/200720200324-japan-flag-super-tease.jpg,2020-07-21T00:19:42Z,"(CNN)Hitting children with bats and sticks, slapping them across the face, and holding their heads underwater to simulate drowning are some of the abusive coaching techniques allegedly used in Japan … [+5213 chars]",cnn,CNN
"James Griffiths, CNN","Indigenous Australians had their languages taken from them, and it's still causing issues today",The mass death of Australian languages has proven to be the perfect laboratory for studying language decline and the effects it has had on Indigenous communities.,https://www.cnn.com/2020/07/20/australia/australia-indigenous-language-rights-intl-hnk/index.html,https://cdn.cnn.com/cnnnext/dam/assets/200716165659-australia-indigenous-school-1893-super-tease.jpg,2020-07-21T00:13:05Z,"(CNN)""I'm Fanny Smith. I was born on Flinders Island. I'm the last of the Tasmanians.""
The audio is scratchy and distorted, sounding at times like it is being spoken through a wall. Yet the voice sp… [+17829 chars]",cnn,CNN
,CNN's Dana Bash reveals why Trump flipped on wearing mask,CNN's Dana Bash reports President Donald Trump tweeted a photo of himself wearing a face mask because of his poor poll numbers.,https://www.cnn.com/videos/politics/2020/07/20/trump-face-masks-coronavirus-bash-tsr-vpx.cnn,https://cdn.cnn.com/cnnnext/dam/assets/200720174606-trump-tweets-mask-photo-super-tease.jpg,2020-07-21T00:12:59Z,Chat with us in Facebook Messenger. Find out what's happening in the world as it unfolds.,cnn,CNN
"David Close, Jill Martin and Amanda Jackson, CNN",NFL and players union agree on daily Covid-19 testing to start training camps,"With football season around the corner, the National Football League and the players union have agreed on a daily Covid-19 testing protocol so that training camps can begin.",https://www.cnn.com/2020/07/20/us/nfl-training-camps-covid-test-trnd/index.html,https://cdn.cnn.com/cnnnext/dam/assets/200720212612-nfl-players-union-restricted-super-tease.jpg,2020-07-21T03:42:07Z,,cnn,CNN
,CNN anchor fact-checks Trump's Fox interview: Give us a break,CNN's Brianna Keilar fact-checks claims about the coronavirus pandemic made by President Trump during an interview with Fox News' Chris Wallace.,https://www.cnn.com/videos/politics/2020/07/20/trump-fox-news-chris-wallace-intv-keilar-fact-check-nr-vpx.cnn,https://cdn.cnn.com/cnnnext/dam/assets/200720163153-brianna-keilar-07202020-super-tease.jpg,2020-07-21T03:40:34Z,Chat with us in Facebook Messenger. Find out what's happening in the world as it unfolds.,cnn,CNN
,ACLU backing Michael Cohen and suing DOJ...,"ACLU backing Michael Cohen and suing DOJ...

 
 
 
 (Second column, 1st story, link)

 

 

 
 
 Drudge Report Feed needs your support!   Become a Patron",https://view.newsletters.cnn.com/messages/1595298792213774fc650dd99/raw?utm_term=1595298792213774fc650dd99&utm_source=Reliable+Sources+-+July+20%2C+2020,,2020-07-21T03:22:37Z,"Brian Stelter here.Here's the latest on Mark Esper, Barbara Fedida, Bob Costas, Nicki Minaj, ""Tenet,"" Sarah Cooper, and many more...
BREAKING:
ACLU is backing Michael Cohen and suing the DOJ
Last … [+1586 chars]",cnn,CNN
Kara Scannell,Michael Cohen sues Attorney General William Barr for retaliation in latest attempt to get out of prison,"Lawyers for Michael Cohen filed a petition seeking his immediate release from prison, alleging that President Donald Trump's former personal attorney was taken back into custody because a tell-all book he is writing about his years as the President's fixer.",https://www.cnn.com/2020/07/20/politics/michael-cohen-lawsuit-william-barr/index.html,https://cdn.cnn.com/cnnnext/dam/assets/200720224731-michael-cohen-0521-super-tease.jpg,2020-07-21T03:20:10Z,"(CNN)Lawyers for Michael Cohen filed a petition seeking his immediate release from prison, alleging that President Donald Trump's former personal attorney was taken back into custody because a tell-a… [+3000 chars]",cnn,CNN
Opinion by S.E. Cupp,"S.E. Cupp: If Trump is serious, it's very, very good news","CNN's S.E. Cupp writes that as lame and late as Trump's attempt at lifting his standing in the polls is, his Monday tweet of himself finally wearing a mask ""is much more than just empty symbolism.""",https://www.cnn.com/2020/07/20/opinions/trump-mask-tweet-good-news-cupp/index.html,https://cdn.cnn.com/cnnnext/dam/assets/200720174606-trump-tweets-mask-photo-super-tease.jpg,2020-07-21T03:11:30Z,"S.E. Cupp is a CNN political commentator and the host of ""SE Cupp Unfiltered."" The views expressed in this commentary are solely hers. View more opinion articles on CNN.
 (CNN)In presidential politi… [+4203 chars]",cnn,CNN
"Katelyn Polantz, CNN",'There's no way to have 100% security': Federal judge reflects on violent threats 15 years after losing loved ones,Federal Judge Joan Humphrey Lefkow on Monday addressed the risks to federal judges following the Sunday shooting of a US district judge's family members -- a case that appears similar to the one that left her own mother and husband dead 15 years ago.,https://www.cnn.com/2020/07/20/politics/federal-judges-threats-security-lefkow-salas-shootings/index.html,https://cdn.cnn.com/cnnnext/dam/assets/170427152358-lefkow-murders-super-tease.jpg,2020-07-21T02:34:42Z,(CNN)Federal Judge Joan Humphrey Lefkow on Monday addressed the risks to those who sit on the bench following the Sunday shooting of a US district judge's family members -- a case that appears simila… [+5217 chars],cnn,CNN
"Paul P. Murphy and Amanda Jackson, CNN",Dozens of moms formed a human shield to protect protesters from officers outside a federal courthouse in Portland,"As a mom in Portland, Oregon, was watching the unrest unfolding in her city, she felt compelled to get involved and protect protesters.",https://www.cnn.com/2020/07/20/us/wall-of-moms-portland-protest-trnd/index.html,https://cdn.cnn.com/cnnnext/dam/assets/200720152452-03-portland-protest-0719-super-tease.jpg,2020-07-21T02:17:23Z,"(CNN)As a mom in Portland, Oregon, was watching the unrest unfolding in her city, she felt compelled to get involved and protect protesters.
For more than 50 days, protests over racial inequality an… [+3829 chars]",cnn,CNN
"James Frater and Michelle Toh, CNN Business",EU leaders agree on landmark stimulus plan to help Europe recover from coronavirus crisis,"After almost five days of fraught discussions, European Union leaders have agreed on a 750 billion euro (almost $858 billion) stimulus plan to help fund Europe's recovery from the coronavirus crisis.",https://www.cnn.com/2020/07/21/economy/eu-stimulus-coronavirus/index.html,https://cdn.cnn.com/cnnnext/dam/assets/200721000810-eu-summit-coronavirus-recovery-plan-super-tease.jpg,2020-07-21T05:21:01Z,,cnn,CNN
"By <a href=""/profiles/joshua-berlinger"">Joshua Berlinger</a> and <a href=""/profiles/steve-george"">Steve George</a>, CNN",The latest on the coronavirus pandemic,"The coronavirus pandemic has brought countries to a standstill. In many places, as countries reopen, Covid-19 cases are on the rise. Follow here for the latest.",https://www.cnn.com/world/live-news/coronavirus-pandemic-07-21-20-intl/index.html,https://cdn.cnn.com/cnnnext/dam/assets/200213175739-03-coronavirus-0213-super-tease.jpg,2020-07-21T04:37:07Z,"Its hard to draw many conclusions at this point from the vaccine data published Monday by the University of Oxford, said Dr. Peter Hotez, professor and dean of Tropical Medicine at the US' Baylor Col… [+1363 chars]",cnn,CNN
"Analysis by Stephen Collinson, CNN",Trump's pandemic reversals betray anxiety about November election hopes,"Donald Trump's sudden rediscovery of the pandemic, his endorsement of masks and the return of his notorious briefings suggest a belated realization that public scorn over his denial-plagued leadership could end his presidency.",https://www.cnn.com/2020/07/21/politics/donald-trump-coronavirus-masks-briefings-election-2020/index.html,https://cdn.cnn.com/cnnnext/dam/assets/200717161626-01-trump-file-0423-super-tease.jpg,2020-07-21T04:34:27Z,,cnn,CNN
"Amir Vera and Rebekah Riess, CNN",Detroit police officer charged for allegedly shooting 3 photojournalists with rubber pellets,A Detroit police officer was charged with three counts of felonious assault on Monday in connection with the shooting of three photojournalists with rubber pellets during a protest in May.,https://www.cnn.com/2020/07/21/us/detroit-police-officer-charged-three-journalists/index.html,https://cdn.cnn.com/cnnnext/dam/assets/200720204447-detroit-police-0531-super-tease.jpg,2020-07-21T04:29:58Z,,cnn,CNN
"Ryan Browne, CNN",US works to bolster Ukraine's Navy to confront Russian threat,"The US is working to bolster Ukraine's navy, a force that was decimated by Russia's seizure of Crimea in 2014, an effort that comes as Moscow strengthens its own forces in the region in a buildup that some officials see as a threat to NATO's southeastern flan…",https://www.cnn.com/2020/07/21/politics/us-ukraine-navy/index.html,https://cdn.cnn.com/cnnnext/dam/assets/181130113814-ukraine-russia-tension-super-tease.jpg,2020-07-21T04:23:30Z,"(CNN)The US is working to bolster Ukraine's navy, a force that was decimated by Russia's seizure of Crimea in 2014, an effort that comes as Moscow strengthens its own forces in the region in a buildu… [+6749 chars]",cnn,CNN
"Analysis by Zachary B. Wolf, CNN",The surgeon general is begging you to wear a mask. Trump finally agrees,"First, there was very good news on the vaccine front Monday. Read more here.",https://www.cnn.com/2020/07/21/politics/what-matters-july-20/index.html,https://cdn.cnn.com/cnnnext/dam/assets/200720174606-trump-tweets-mask-photo-super-tease.jpg,2020-07-21T04:21:09Z,,cnn,CNN
Analysis by Ronald Brownstein,Why Trump can't make the election about Biden,Reality counts. That may be the biggest message of the 2020 presidential campaign so far.,https://www.cnn.com/2020/07/21/politics/trump-voter-confidence-2020-election/index.html,https://cdn.cnn.com/cnnnext/dam/assets/200717161626-01-trump-file-0423-super-tease.jpg,2020-07-21T04:18:38Z,,cnn,CNN
"Amir Vera, CNN",San Francisco Giants' players kneel during national anthem in exhibition game against Oakland,At least three San Francisco Giants players knelt during the national anthem in Monday's game against the Oakland Athletics.,https://www.cnn.com/2020/07/21/us/san-francisco-giants-kneel-national-anthem-spt-trnd/index.html,https://cdn.cnn.com/cnnnext/dam/assets/200720233051-01-san-francisco-giants-kneel-national-anthem-super-tease.jpg,2020-07-21T04:14:39Z,,cnn,CNN
"Kristen Rogers, CNN","Racial discrimination may harm Black people's cognitive health, study finds","Stress can change your brain, and racial discrimination may exacerbate that process for Black women, a new study finds.",https://www.cnn.com/2020/07/21/health/racism-cognitive-function-study-wellness/index.html,https://cdn.cnn.com/cnnnext/dam/assets/200720134420-poor-cognitive-function-wellness-super-tease.jpg,2020-07-21T04:03:02Z,,cnn,CNN
,"'They are going to get over it,' governor downplays kids getting virus",CNN's Don Lemon and former Harvard Medical School professor William Haseltine discuss recent comments by Missouri Governor Mike Parson that children need to return to school despite the risk of contracting coronavirus.,https://www.cnn.com/videos/us/2020/07/21/missouri-gov-kids-return-to-school-sot-haseltine-ctn-vpx.cnn,https://cdn.cnn.com/cnnnext/dam/assets/200720133339-gov-mike-parson-0707-super-tease.jpg,2020-07-21T04:00:46Z,Chat with us in Facebook Messenger. Find out what's happening in the world as it unfolds.,cnn,CNN
"Sara Sidner and Jason Kravarik, CNN",California went from bending the curve to a major coronavirus surge. What happened?,"For the past 15 weeks, sleep is about the only time when Catherine Davis isn't thinking about Covid-19.",https://www.cnn.com/2020/07/21/us/california-coronavirus-surge/index.html,https://cdn.cnn.com/cnnnext/dam/assets/200721015606-01-california-coronavirus-surge-super-tease.jpg,2020-07-21T07:47:23Z,,cnn,CNN
,Navy vet says authorities beat him at Portland protest,"Video appears to show authorities beating and pepper spraying Chris David, a 53-year-old Navy veteran who attended a protest in Portland, Oregon.",https://www.cnn.com/videos/us/2020/07/21/portland-protest-chris-david-navy-vet-ken-cuccinelli-response-sot-vpx.cnn,https://cdn.cnn.com/cnnnext/dam/assets/200720004800-portland-protester-beaten-video-super-tease.jpg,2020-07-21T07:33:57Z,Chat with us in Facebook Messenger. Find out what's happening in the world as it unfolds.,cnn,CNN
"Jill Martin, CNN",Alyssa Nakken made MLB history as the first woman to coach on the field during a major league game,"Alyssa Nakken, the first female coach on a Major League Baseball staff in league history, became the first woman to coach on the field during a major league game on Monday.",https://www.cnn.com/2020/07/21/us/woman-coach-san-francisco-giants-spt-trnd/index.html,https://cdn.cnn.com/cnnnext/dam/assets/200721025709-alyssa-nakken-san-francisco-giants-restricted-super-tease.jpg,2020-07-21T07:22:31Z,,cnn,CNN
"Madeline Holcombe and Raja Razek, CNN",Body found in Minneapolis building burned during George Floyd protests,Minneapolis police said officers found the body of a man in a building burned down during the protests over the death of George Floyd in May.,https://www.cnn.com/2020/07/21/us/minneapolis-protest-body-found/index.html,https://cdn.cnn.com/cnnnext/dam/assets/200721013056-minneapolis-building-body-found-super-tease.jpg,2020-07-21T07:14:58Z,,cnn,CNN
,Covid-19 survivors grapple with lingering effects,"From breathlessness to fatigue to memory loss, many Covid-19 survivors have reported lingering symptoms. Researchers in Italy and the UK are working against the clock to answer the many questions on the virus' long-term effects. CNN's Isa Soares reports.",https://www.cnn.com/videos/world/2020/07/21/italy-uk-coronavirus-covid-19-long-term-effects-soares-pkg-intl-hnk-vpx.cnn,https://cdn.cnn.com/cnnnext/dam/assets/200721141814-covid-19-survivor-long-recovery-super-tease.jpg,2020-07-21T06:50:13Z,Chat with us in Facebook Messenger. Find out what's happening in the world as it unfolds.,cnn,CNN
"Christina Maxouris, CNN",The surge in US cases has left labs overwhelmed and Covid-19 tests delayed,More Americans are testing positive for coronavirus all over the US at record-breaking numbers and the surge is slowing down testing.,https://www.cnn.com/2020/07/21/health/us-coronavirus-tuesday/index.html,https://cdn.cnn.com/cnnnext/dam/assets/200720231116-02-us-coronavirus-tuesday-florida-super-tease.jpg,2020-07-21T06:48:44Z,"(CNN)More Americans are testing positive for coronavirus all over the US at record-breaking numbers and the surge is slowing down testing. 
Labs across the country are now facing what seems like an … [+7295 chars]",cnn,CNN
"Madeline Holcombe, CNN",Murder charges filed in 34-year-old killing in Oklahoma,"Cigarette butts and fingerprints from an Oklahoma rest stop 35 years ago have led a suspect identified in a cold case, according to the state's attorney general.",https://www.cnn.com/2020/07/21/us/oklahoma-cold-case-aikman-murder-charges/index.html,https://cdn.cnn.com/cnnnext/dam/assets/200720233729-earl-wilson-mugshot-super-tease.jpg,2020-07-21T06:47:39Z,,cnn,CNN
"Jessie Yeung, CNN",Luxury homes in Australia are falling into the ocean due to coastal erosion,"In a coastal neighborhood in Australia's New South Wales state, luxury beachfront homes are in danger of collapsing into the ocean.",https://www.cnn.com/2020/07/21/australia/australia-coastal-erosion-homes-intl-hnk-scli/index.html,https://cdn.cnn.com/cnnnext/dam/assets/200720231758-01-australia-coastal-erosion-homes-intl-hnk-scli-restricted-super-tease.jpg,2020-07-21T06:19:17Z,"(CNN)In a coastal neighborhood in Australia's New South Wales state, luxury beachfront homes are in danger of collapsing into the ocean.
Residents in more than 40 houses along Wamberal Beach, locate… [+4304 chars]",cnn,CNN
"Analysis by Josh Campbell, CNN",Neither side is backing down as federal agents and protesters clash in Portland,"Neither side is backing down as protesters and federal agents continue to periodically clash in downtown Portland following an infusion of federal resources in the area, and the Trump administration persists in seeking political gain from ongoing tensions.",https://www.cnn.com/2020/07/21/us/analysis-portland-protests-federal-agents/index.html,https://cdn.cnn.com/cnnnext/dam/assets/200720115937-02-portland-protests-0719-super-tease.jpg,2020-07-21T09:46:55Z,"Portland, Oregon (CNN)It's classic entrenchment with no end in sight.
Neither side is backing down as protesters and federal agents continue to periodically clash in downtown Portland following an i… [+8275 chars]",cnn,CNN
"Eric Bradner and Sarah Mucha, CNN",Biden unveils 'caregiving economy' plan for expanded child care and home care,"Presumptive Democratic presidential nominee Joe Biden on Tuesday proposed new tax credits for those who care for children, seniors and disabled people and said he would build tens of thousands of new child-care facilities as part of a plan to bolster what his…",https://www.cnn.com/2020/07/21/politics/joe-biden-caregiving-plan/index.html,https://cdn.cnn.com/cnnnext/dam/assets/200716171720-02-biden-sc-church-super-tease.jpg,2020-07-21T09:38:02Z,"(CNN)Presumptive Democratic presidential nominee Joe Biden on Tuesday proposed new tax credits for those who care for children, seniors and disabled people and said he would build tens of thousands o… [+3803 chars]",cnn,CNN
"Esha Mitra and Nectar Gan, CNN",Tens of thousands displaced in Assam as floods heap misery on pandemic stricken region,"Unrelenting monsoon rains have triggered severe flooding in the Indian state of Assam, killing at least 85 people, displacing tens of thousands residents and drowning rare wildlife in a national park.",https://www.cnn.com/2020/07/21/weather/india-assam-flood-intl-hnk/index.html,https://cdn.cnn.com/cnnnext/dam/assets/200721014230-india-assam-flooding-restricted-super-tease.jpg,2020-07-21T09:28:27Z,"(CNN)Unrelenting monsoon rains have triggered severe flooding in the Indian state of Assam, killing at least 85 people, displacing tens of thousands residents and drowning rare wildlife in a national… [+5739 chars]",cnn,CNN
"Jill Disis and Philip Wang, CNN Business",US sanctions 11 Chinese companies over human rights abuses in Xinjiang,The United States is restricting 11 Chinese companies from buying American technology and other goods because it says they're linked to alleged human rights violations in Xinjiang.,https://www.cnn.com/2020/07/21/business/us-sanctions-china-companies-xinjiang-intl-hnk/index.html,https://cdn.cnn.com/cnnnext/dam/assets/200721031231-us-sanctions-companies-xinjiang-super-tease.jpg,2020-07-21T09:14:22Z,,cnn,CNN
,Barcelona's latest virus outbreak is a warning to other cities,"In Barcelona and surrounding areas in Spain's Catalonia region, some 3 million residents are being urged to stay home to curb a major coronavirus outbreak. Almost 3,000 new infections were found over the weekend. CNN's Atika Shubert reports.",https://www.cnn.com/videos/world/2020/07/21/barcelona-catalonia-spain-coronavirus-covid-19-outbreak-contact-tracing-shubert-pkg-intl-ldn-vpx.cnn,https://cdn.cnn.com/cnnnext/dam/assets/200721094844-barcelona-catalonia-spain-coronavirus-covid-19-outbreak-contact-tracing-shubert-pkg-intl-ldn-vpx-00021109-super-tease.jpg,2020-07-21T09:04:45Z,Chat with us in Facebook Messenger. Find out what's happening in the world as it unfolds.,cnn,CNN
"Haley Byrd, CNN",House to vote on annual defense bill Tuesday,"The House is expected to vote Tuesday on a $740 billion national defense authorization bill, which would grant a 3% pay raise for troops and require the military to remove the names of Confederate soldiers and leaders from military bases.",https://www.cnn.com/2020/07/21/politics/house-to-vote-ndaa-confederate-names-military-bases/index.html,https://cdn.cnn.com/cnnnext/dam/assets/200213150327-pentagon-building-aerial-file-super-tease.jpg,2020-07-21T09:01:23Z,"(CNN)The House is expected to vote Tuesday on a $740 billion national defense authorization bill, which would grant a 3% pay raise for troops and require the military to remove the names of Confedera… [+3670 chars]",cnn,CNN
"Hollie Silverman, CNN",The US Marshals has been protecting the judicial process since 1789. And they're facing more threats,The shooting death of the son of a federal judge in New Jersey has highlighted the dangers that members of the judiciary face while carrying out their duties.,https://www.cnn.com/2020/07/21/us/us-marshals-judges-threats/index.html,https://cdn.cnn.com/cnnnext/dam/assets/200720232821-empty-courtroom-restricted-super-tease.jpg,2020-07-21T08:54:25Z,"(CNN)The shooting death of the son of a federal judge in New Jersey has highlighted the dangers that members of the judiciary face while carrying out their duties.
Judges have been a target of viole… [+2604 chars]",cnn,CNN
"George Ramsay, CNN",Cristiano Ronaldo scores twice to set another scoring record as Juventus moves closer to Serie A title,Cristiano Ronaldo passed the 50-goal landmark in Serie A as his second-half brace saw Juventus defeat Lazio 2-1 and move eight points clear at the top of table.,https://edition.cnn.com/2020/07/21/football/cristiano-ronaldo-juventus-lazio-serie-a-spt-intl/index.html,https://cdn.cnn.com/cnnnext/dam/assets/200721084718-ronaldo-goal-celebration-super-tease.jpg,2020-07-21T08:53:38Z,,cnn,CNN
