author,title,description,url,urlToImage,publishedAt,content,source.id,source.name
"Chauncey Alcorn, CNN Business",Tyson will close its biggest pork plant after workers call out sick with coronavirus,Tyson Foods is closing its largest pork plant as a growing number of workers become ill from coronavirus infections.,https://www.cnn.com/2020/04/22/business/tyson-pork-plant-iowa-coronavirus/index.html,https://cdn.cnn.com/cnnnext/dam/assets/200422145525-tyson-waterloo-iowa-file-super-tease.jpg,2020-04-22T16:09:27Z,,cnn,CNN
"Barbara Starr, CNN Pentagon Correspondent",26 US Navy ships currently have coronavirus cases,"There are currently coronavirus cases on 26 US Navy warships, and another 14 have been hit by the virus but the crew members impacted have recovered, a senior Navy official told CNN Wednesday.",https://www.cnn.com/2020/04/22/politics/us-navy-coronavirus-cases/index.html,https://cdn.cnn.com/cnnnext/dam/assets/200401090526-02-uss-theodore-roosevelt-guam-grab-super-tease.jpg,2020-04-22T16:02:58Z,"Washington (CNN)There are currently coronavirus cases on 26 US Navy warships, and another 14 have been hit by the virus but the crew members impacted have recovered, a senior Navy official told CNN Wednesday.
The 26 ships with current cases are in port or ma… [+3002 chars]",cnn,CNN
Jacob Krol,Motorola's Edge+ aims to stick out with a waterfall edge OLED and flagship specs,"Motorola is returning to the fast lane of smartphones with The Edge and Edge+. While they don't fold or get compact like the Razr, these are both flagships, so they're not as affordable as an iPhone SE.",https://www.cnn.com/2020/04/22/cnn-underscored/motorola-edge-plus-pricing-features-buy/index.html,https://cdn.cnn.com/cnnnext/dam/assets/200422114918-1-underscored-motorola-edge-super-tease.jpg,2020-04-22T16:00:17Z,"Motorola is returning to the fast lane of smartphones with The Edge and Edge+. While they don't fold or get compact like the Razr, these are both flagships, so they're not as affordable as an iPhone SE. 
The Edge+, a $999 flagship with a huge 6.7-inch displa… [+6369 chars]",cnn,CNN
,"Watch: Anderson reacts to mayor's 'China' remark: Wow, that's really ignorant",CNN's Anderson Cooper speaks with Las Vegas Mayor Carolyn Goodman about the decision to reopen casinos in her city amid the coronavirus pandemic.,https://www.cnn.com/videos/politics/2020/04/22/carolyn-goodman-las-vegas-mayor-coronavirus-china-cooper-sot-vpx.cnn,https://cdn.cnn.com/cnnnext/dam/assets/200422154011-lv-mayor-cooper-super-tease.jpg,2020-04-22T19:46:20Z,Chat with us in Facebook Messenger. Find out what's happening in the world as it unfolds.,cnn,CNN
"Analysis by Chris Cillizza, CNN Editor-at-large",Why the CDC director wasn't misquoted on coronavirus -- no matter what the White House says,"On Tuesday, in an interview with The Washington Post, CDC Director Robert Redfield issued a somewhat dire warning about the coronavirus -- and how long it might be with us.",https://www.cnn.com/2020/04/22/politics/robert-redfield-cdc-mcenany/index.html,https://cdn.cnn.com/cnnnext/dam/assets/170807195619-who-is-kayleigh-mcenany-orig-alee-00000000-super-tease.jpg,2020-04-22T19:34:23Z,"THE POINT -- NOW ON YOUTUBE! 
In each episode of his weekly YouTube show, Chris Cillizza will delve a little deeper into the surreal world of politics. Click to subscribe!",cnn,CNN
"Paul LeBlanc, CNN",Las Vegas mayor won't give businesses social distancing guidelines for reopening: 'They better figure it out. That's their job',Las Vegas Mayor Carolyn Goodman on Wednesday repeatedly called for the city's businesses to reopen while refusing to provide any social distancing guidelines on how to do so safely.,https://www.cnn.com/2020/04/22/politics/las-vegas-mayor-social-distancing-cnntv/index.html,https://cdn.cnn.com/cnnnext/dam/assets/200422141042-carolyn-goodman-super-tease.jpg,2020-04-22T19:33:48Z,,cnn,CNN
"Matt McFarland, CNN Business",'We're getting flat out hammered right now.' UPS employees on working during the pandemic,"At UPS, the most frantic time of year is typically around the winter holidays. Then things level off. But these days, as the coronavirus pandemic spurs American households and businesses to buy almost everything online, the deliveries have seemed relentless.",https://www.cnn.com/2020/04/22/economy/ups-delivery-truck-drivers-coronavirus/index.html,https://cdn.cnn.com/cnnnext/dam/assets/200416122234-ups-delivery-worker-0406-restricted-super-tease.jpg,2020-04-22T19:29:06Z,"Washington, DC (CNN)At UPS, the most frantic time of year is typically around the winter holidays. Thenthings level off. But these days, as the coronavirus pandemic spurs American households and businesses to buy almost everything online,the deliveries have s… [+7755 chars]",cnn,CNN
Elizabeth Wallace,Skip the supermarket: Get meat delivered to your doorstep with these services,,https://www.cnn.com/2020/04/22/cnn-underscored/best-meat-delivery-service-boost/index.html,https://cdn.cnn.com/cnnnext/dam/assets/200330140824-meat-lead-super-tease.jpg,2020-04-22T19:23:12Z,"CNN Underscored has interviewed experts and found the best options to help you cope during this uncertain time. Find all of our coronavirus-related coverage here, and let us know your thoughts here.
Craving meat, and finding it in short supply on those rare … [+11044 chars]",cnn,CNN
Benjamin Levin,These are the best over-ear headphones of 2020,,https://www.cnn.com/2020/04/22/cnn-underscored/best-over-ear-headphones-boost/index.html,https://cdn.cnn.com/cnnnext/dam/assets/200409193142-1-underscored-best-over-ear-headphones-lead-super-tease.jpg,2020-04-22T19:19:52Z,"When you're looking to get the most out of your music, a great pair of headphones can make all the difference. Over-ear headphones, at times affectionately referred to as cans, can give you some of the best sound. But with such an abundance of options, it's n… [+30589 chars]",cnn,CNN
"Chris Isidore, CNN Business",United's unusual plan to sell $1 billion of stock,"United Airlines, whose shares have plummeted in value by 68% in the last nine weeks, is planning to raise $1 billion by selling additional shares of its badly battered stock.",https://www.cnn.com/2020/04/22/business/united-stock-sale/index.html,https://cdn.cnn.com/cnnnext/dam/assets/200416122141-01-united-airlines-0412-san-francisco-super-tease.jpg,2020-04-22T19:15:28Z,,cnn,CNN
Ellen McAlpine,Casetify drops 100% compostable cases on Earth Day,"One of our favorite phone case brands just dropped big news. Casetify has launched a collection of 100% compostable and biodegradable phone cases this Earth Day. Just note, these cases are only compostable at industrial composting facilities, but if you don't…",https://www.cnn.com/2020/04/22/cnn-underscored/casetify-conscious-compostable-cases/index.html,https://cdn.cnn.com/cnnnext/dam/assets/200422141625-underscored-casetify-compostable-lead-super-tease.jpg,2020-04-22T19:12:36Z,"One of our favorite phone case brands just dropped big news. Casetify has launched a collection of 100% compostable and biodegradable phone cases this Earth Day. Just note, these cases are only compostable at industrial composting facilities, but if you don't… [+3295 chars]",cnn,CNN
Opinion by Leah A. Plunkett,We've made new rules to protect our families. We must protect kids' privacy too.,"Leah A. Plunkett writes that the coronavirus pandemic has rushed our lives -- and our children's lives -- online. Meanwhile, companies can use user data however they like. While dishonorable in the best of times, it is immoral in the face of a crisis -- parti…",https://www.cnn.com/2020/04/22/opinions/digital-data-privacy-minors-children-plunkett/index.html,https://cdn.cnn.com/cnnnext/dam/assets/200421092433-work-from-home-0401-super-tease.jpg,2020-04-22T19:12:05Z,Leah A. Plunkett is the author of SHARENTHOOD: Why We Should Think Before We Talk About Our Kids Online. She is an associate dean and professor at University of New Hampshire Franklin Pierce School of Law and a faculty associate at the Berkman Klein Center fo… [+7515 chars],cnn,CNN
"Maegan Vazquez, CNN",Trump announces national parks to reopen but doesn't offer dates or details,"President Donald Trump announced Wednesday that national parks and public lands will be reopening following coronavirus-related closures, but it's not clear when the administration will implement the reopenings across states with varying levels of public heal…",https://www.cnn.com/2020/04/22/politics/donald-trump-national-parks-reopen-coronavirus/index.html,https://cdn.cnn.com/cnnnext/dam/assets/200419142106-yosemite-national-park-black-bear-file-super-tease.jpg,2020-04-22T19:08:38Z,"Washington (CNN)President Donald Trump announced Wednesday that national parks and public lands will be reopening following coronavirus-related closures, but it's not clear when the administration will implement the reopenings across states with varying level… [+2915 chars]",cnn,CNN
,Trump promoted these drugs nearly 50 times. He abruptly stopped.,President Donald Trump repeatedly suggested hydroxychloroquine as a treatment for Covid-19 patients. Early trials of the drug found it does not help and sometimes has negative side effects.,https://www.cnn.com/videos/politics/2020/04/22/hydroxychloroquine-trump-covid-19-study-mh-orig.cnn,https://cdn.cnn.com/cnnnext/dam/assets/200421192313-donald-trump-immigration-order-coronavirus-green-cards-briefing-acosta-bts-tsr-vpx-00000310-super-tease.jpg,2020-04-22T19:04:13Z,Chat with us in Facebook Messenger. Find out what's happening in the world as it unfolds.,cnn,CNN
"Sandee LaMotte, CNN","You can't hide your stress from your kids, study says","Even if you're trying to protect them, it's not a good idea to hide your stress from your children, a new study says.",https://www.cnn.com/2020/04/22/health/parents-stress-kids-wellness/index.html,https://cdn.cnn.com/cnnnext/dam/assets/200422134220-stressed-parent-kids-super-tease.jpg,2020-04-22T19:00:03Z,"(CNN)Parenting in the age of coronavirus is packed with stress. After all, you're juggling home schooling, work (or the lack of it) and the new realities of social distancing and isolation while trying to keep your family healthy and safe.
But if you're tryi… [+2820 chars]",cnn,CNN
"Matt Egan, CNN Business",How negative oil prices could set the stage for the next price boom,The boom-to-bust oil market is experiencing one of its darkest moments in history.,https://www.cnn.com/2020/04/22/business/negative-oil-prices-spike/index.html,https://cdn.cnn.com/cnnnext/dam/assets/180709135451-gfx-oil-cost-negative-super-tease.jpg,2020-04-22T18:59:11Z,,cnn,CNN
Kai Burkhardt,Your guide to picking the right bidet for you and your budget,,https://www.cnn.com/2020/04/22/cnn-underscored/best-bidet-boost/index.html,https://cdn.cnn.com/cnnnext/dam/assets/200315113958-underscored-bidet-lead-super-tease.jpg,2020-04-22T18:43:29Z,"We've interviewed experts and found the best options to help you cope during this uncertain time. Find all of our coronavirus-related coverage here, and let us know your thoughts here.
With the global spread of coronavirus, many people are stocking up on sup… [+9224 chars]",cnn,CNN
"Arman Azad, CNN","Two cats in New York confirmed to have coronavirus, making them the first pets in the US known to be infected","Two cats in New York have been infected with the novel coronavirus, federal officials announced Wednesday. Both had mild respiratory symptoms and are expected to make a full recovery.",https://www.cnn.com/2020/04/22/health/cats-new-york-coronavirus-trnd/index.html,https://cdn.cnn.com/cnnnext/dam/assets/200422133837-cat-coronavirus-super-tease.jpg,2020-04-22T18:42:26Z,,cnn,CNN
"Ashley Strickland, CNN","Tectonic plates helped early Earth evolve 3.2 billion years ago, and that shaped how life developed","Earth is estimated to be 4.5 billion years old, but understanding when it evolved from a sizzling hot ball to a planet that could host life is a little more difficult.",https://www.cnn.com/2020/04/22/world/earth-plate-tectonics-timeline-scn/index.html,https://cdn.cnn.com/cnnnext/dam/assets/200422124340-01-plate-tectonics-study-super-tease.jpg,2020-04-22T18:42:02Z,,cnn,CNN
"Kevin Liptak and Kaitlan Collins, CNN",Trump's coronavirus briefing casting keeps people guessing,"President Donald Trump, despite claiming otherwise, has fixated on the television ratings of his daily coronavirus briefings, comparing the numbers to television shows such as ABC's ""The Bachelor."" And like the dating competition he's cited five times on Twit…",https://www.cnn.com/2020/04/22/politics/trump-fauci-briefings-coronavirus/index.html,https://cdn.cnn.com/cnnnext/dam/assets/200413100246-01-trump-fauci-0321-super-tease.jpg,2020-04-22T18:22:26Z,"(CNN)President Donald Trump, despite claiming otherwise, has fixated on the television ratings of his daily coronavirus briefings, comparing the numbers to television shows such as ABC's ""The Bachelor."" And like the dating competition he's cited five times on… [+9491 chars]",cnn,CNN
"Eliott C. McLaughlin, CNN",Here's who's really in charge of protecting the public,"The White House has rolled out a plan to reopen the country, but some state officials say they're ignoring the directives, while others rush to reopen before health officials -- and even the administration's three-phase plan -- say it's wise.",https://www.cnn.com/2020/04/22/us/local-leaders-coronavirus-reopening-authority/index.html,https://cdn.cnn.com/cnnnext/dam/assets/200418183339-01-florida-schools-coronavirus-restricted-super-tease.jpg,2020-04-22T18:09:00Z,"(CNN)The White House has rolled out a plan to reopen the country, but some state officials say they're ignoring the directives, while others rush to reopen before health officials -- and even the administration's three-phase plan -- say it's wise.
Then there… [+13116 chars]",cnn,CNN
"Analysis by Chris Cillizza, CNN Editor-at-large",Gretchen Whitmer's rise just took another hit,"On Tuesday, Michigan Gov. Gretchen Whitmer canceled a no-bid state contract dealing with coronavirus testing that she had announced just the previous day after complaints emerged because two of the firms involved were connected to state and national Democrati…",https://www.cnn.com/2020/04/22/politics/gretchen-whitmer-coronavirus-protests/index.html,https://cdn.cnn.com/cnnnext/dam/assets/180806215847-01-gretchen-whitmer-super-tease.jpg,2020-04-22T18:08:17Z,"THE POINT -- NOW ON YOUTUBE! 
In each episode of his weekly YouTube show, Chris Cillizza will delve a little deeper into the surreal world of politics. Click to subscribe!",cnn,CNN
Ellen McAlpine,Celebrate Earth Day with eco-friendly and sustainable tech,"This Earth Day, it's more important than ever to search for sustainable alternatives to the products we purchase. It's no secret we haven't been kind to our planet in the past. Right now there's about 8 million metric tons of plastic in our oceans.",https://www.cnn.com/2020/04/22/cnn-underscored/eco-friendly-tech-roundup/index.html,https://cdn.cnn.com/cnnnext/dam/assets/200422130420-underscored-earthtech-lead-super-tease.jpg,2020-04-22T18:02:18Z,"This Earth Day, it's more important than ever to search for sustainable alternatives to the products we purchase. It's no secret we haven't been kind to our planet in the past. Right now there's about 8 million metric tons of plastic in our oceans. 
It can b… [+10572 chars]",cnn,CNN
"Kristen Rogers, CNN","What women need most after giving birth, especially now","Becoming a mother is a variable experience, fluctuating in its joys and challenges. A new study to inform the World Health Organization's maternity care guidelines reported firsthand perspectives of what women value and need most after birth.",https://www.cnn.com/2020/04/22/health/women-postnatal-care-coronavirus-wellness/index.html,https://cdn.cnn.com/cnnnext/dam/assets/200421155547-02-postnatal-wellness-stock-super-tease.jpg,2020-04-22T18:00:08Z,"(CNN)Becoming a mother is a variable experience, fluctuating in its joys and challenges before, during and after birth. 
These phases are of equal importance, but the postnatal period (post-birth) is key to a mother's well-being, her adaptation to changes an… [+12671 chars]",cnn,CNN
"Jeremy Diamond, CNN",Some ex-felons excluded from small business relief in spite of Trump's criminal justice reform platform,"Like millions of other small business owners facing the financial weight of the coronavirus pandemic, Vincent Bragg saw the federal government's Payroll Protection Program as a potential lifeline.",https://www.cnn.com/2020/04/22/politics/trump-ex-felons-small-business-relief/index.html,https://cdn.cnn.com/cnnnext/dam/assets/180406151135-mnuchin-trump-boeing-super-tease.jpg,2020-04-22T21:52:41Z,"(CNN)Like millions of other small business owners facing the financial weight of the coronavirus pandemic, Vincent Bragg saw the federal government's Payroll Protection Program as a potential lifeline.
But the fifth question on the loan application immediate… [+6431 chars]",cnn,CNN
CNN,READ: House Democrats establish coronavirus spending committee,"House Democrats released text of a resolution to establish the new select committee to investigate coronavirus spending, giving it broad power to investigate how money is being spent and to examine the US preparedness of the crisis -- as well as deliberations…",https://www.cnn.com/2020/04/22/politics/read-resolution-house-spending-committee/index.html,https://cdn.cnn.com/cnnnext/dam/assets/200326145443-05-nancy-pelosi-lead-image-super-tease.jpg,2020-04-22T21:50:55Z,"(CNN)House Democrats released text of a resolution to establish the new select committee to investigate coronavirus spending, giving it broad power to investigate how money is being spent and to examine the US preparedness of the crisis -- as well as delibera… [+130 chars]",cnn,CNN
"Barbara Starr, CNN Pentagon Correspondent",US assesses Iran successfully launched a military satellite for the first time,"The United States has assessed that Iran successfully launched a military satellite into orbit for the first time on Wednesday, according to two US Defense Department officials.",https://www.cnn.com/2020/04/22/politics/iran-military-satellite-launch/index.html,https://cdn.cnn.com/cnnnext/dam/assets/200422163329-iran-military-satellite-launch-super-tease.jpg,2020-04-22T21:50:51Z,,cnn,CNN
Annie Grayer,Harvard will not accept federal funds from CARES act,"Harvard University said on Wednesday that it would not accept the federal funds allocated to it under the CARES Act Higher Education Emergency Relief Fund, one day after declining to do so following President Donald Trump's call for the university to return t…",https://www.cnn.com/2020/04/22/politics/harvard-coronavirus-funds/index.html,https://cdn.cnn.com/cnnnext/dam/assets/190522155055-harvard-campus-super-tease.jpg,2020-04-22T21:48:40Z,"(CNN)Harvard University said on Wednesday that it would not accept the federal funds allocated to it under the CARES Act Higher Education Emergency Relief Fund, one day after declining to do so following President Donald Trump's call for the university to ret… [+4189 chars]",cnn,CNN
"Leah Asmelash, CNN","Muffet McGraw, Notre Dame's legendary women's basketball coach, is retiring after 33 years","Muffet McGraw, famed head coach of the Notre Dame women's basketball team, has stepped down after 33 seasons with the team. She will be replaced by Niele Ivey, current assistant coach for the Memphis Grizzlies.",https://www.cnn.com/2020/04/22/us/muffet-mcgraw-notre-dame-retire-spt-trnd/index.html,https://cdn.cnn.com/cnnnext/dam/assets/200422165547-muffet-mcgraw-retire-restircted-super-tease.jpg,2020-04-22T21:43:46Z,"(CNN)Muffet McGraw, famed head coach of the Notre Dame women's basketball team, has stepped down after 33 seasons with the team.
McGraw made the announcement Wednesday.
""I am grateful to have worked with the best assistant coaches in the business, and I hav… [+2047 chars]",cnn,CNN
"Sandra Gonzalez, CNN",Clive Davis producing Whitney Houston biopic,"The story of one of the biggest music stars of our time is coming to the big screen. Clive Davis and Pat Houston are on board to produce a film currently titled ""I Wanna Dance with Somebody,"" the story of singer Whitney Houston.",https://www.cnn.com/2020/04/22/entertainment/whitney-houston-movie/index.html,https://cdn.cnn.com/cnnnext/dam/assets/190917162206-encuentro-whitney-houston-super-tease.jpg,2020-04-22T21:42:38Z,,cnn,CNN
"Paul Vercammen, Stella Chan and Theresa Waldrop, CNN",Kristin Smart case: Investigators find 'items of interest' in home search,"Investigators in the case of Kristin Smart, a woman missing for almost 24 years in California, found ""items of interest"" in a search carried out Wednesday.",https://www.cnn.com/2020/04/22/us/kristin-smart-search-warrant-paul-flores/index.html,https://cdn.cnn.com/cnnnext/dam/assets/160907210104-kristin-smart-missing-person-case-update-pkg-00000918-super-tease.jpg,2020-04-22T21:35:28Z,,cnn,CNN
"Caroline Kelly, CNN",Senator's mayo-heavy tuna melt tutorial met with jeers,Sen. Mark Warner looked to bring some levity to the public amid the coronavirus outbreak by sharing a cooking tutorial this week -- but even some of his colleagues decried his culinary choice as fishy and heavy-handed.,https://www.cnn.com/2020/04/22/politics/mark-warner-tuna-melt/index.html,https://cdn.cnn.com/cnnnext/dam/assets/181129104647-sen-mark-warner-11-29-01-super-tease.jpg,2020-04-22T21:22:08Z,"(CNN)Sen. Mark Warner looked to bring some levity to the public amid the coronavirus outbreak by sharing a cooking tutorial this week -- but even some of his colleagues decried his culinary choice as fishy and heavy-handed.
The Virginia Democrat took to Inst… [+2087 chars]",cnn,CNN
"Katie Lobosco and Curt Merrill, CNN",California got the most money but more Texas businesses got coronavirus relief than anywhere else,"More small businesses in Texas were approved for money from the federal government's initial coronavirus emergency lending program than in any other state -- including harder-hit New York, California and Florida.",https://www.cnn.com/2020/04/22/politics/small-business-relief-cares-act-state-by-state/index.html,https://cdn.cnn.com/cnnnext/dam/assets/200422154624-01-small-businesses-texas-restricted-super-tease.jpg,2020-04-22T21:05:48Z,,cnn,CNN
"Jackie Wattles, CNN Business",SpaceX moves ahead with Starlink satellite launch amid pandemic,"While much of the world economy stands still, SpaceX is running full speed ahead.",https://www.cnn.com/2020/04/22/tech/spacex-starlink-satellite-launch-scn/index.html,https://cdn.cnn.com/cnnnext/dam/assets/190529132731-spacex-starlink-mission-super-tease.jpg,2020-04-22T20:57:15Z,,cnn,CNN
"Kaitlan Collins, Jeremy Diamond and Betsy Klein, CNN",Director of key federal vaccine agency says his departure was retaliation,The director of the office involved in developing a coronavirus vaccine says he was abruptly dismissed from his post in part because he resisted efforts to widen the availability of a coronavirus treatment pushed by President Donald Trump.,https://www.cnn.com/2020/04/22/politics/rick-bright-barda-trump-coronavirus/index.html,https://cdn.cnn.com/cnnnext/dam/assets/200421192313-donald-trump-immigration-order-coronavirus-green-cards-briefing-acosta-bts-tsr-vpx-00000310-super-tease.jpg,2020-04-22T20:51:12Z,,cnn,CNN
"Zach Wade, CNN",Quickly catch up on the day's news,Here's what you might have missed on CNN.,https://www.cnn.com/2020/04/22/app-news-section/quickly-catch-up-april-22/index.html,https://cdn.cnn.com/cnnnext/dam/assets/170406155124-hogwarts-outside-super-tease.jpg,2020-04-22T20:50:57Z,,cnn,CNN
"Maggie Fox, CNN","Covid-19 causes sudden strokes in young adults, doctors say","The new coronavirus appears to be causing sudden strokes in adults in their 30s and 40s who are not otherwise terribly ill, doctors reported Wednesday.",https://www.cnn.com/2020/04/22/health/strokes-coronavirus-young-adults/index.html,https://cdn.cnn.com/cnnnext/dam/assets/200407115136-emergency-room-workers-coronavirus-super-tease.jpg,2020-04-22T20:49:45Z,"(CNN)The new coronavirus appears to be causing sudden strokes in adults in their 30s and 40s who are not otherwise terribly ill, doctors reported Wednesday.
They said patients may be unwilling to call 911 because they have heard hospitals are overwhelmed by … [+2522 chars]",cnn,CNN
,READ: Statement from leader of federal vaccine agency about his reassignment,"Dr. Rick Bright, the director of the agency responsible for leading the charge on the production and purchase of vaccines in the Trump administration, released a statement Wednesday blaming political motives for his abrupt reassignment.",https://www.cnn.com/2020/04/22/politics/read-whistleblower-vaccine-development/index.html,https://cdn.cnn.com/cnnnext/dam/assets/190222184317-white-house-exterior-super-tease.jpg,2020-04-22T20:48:53Z,"(CNN)Dr. Rick Bright, the director of the agency responsible for leading the charge on the production and purchase of vaccines in the Trump administration, released a statement Wednesday blaming political motives for his abrupt reassignment.
Read the stateme… [+3324 chars]",cnn,CNN
"Devan Cole and Sarah Mucha, CNN",Biden scores endorsements from Al Gore and Jay Inslee on Earth Day,"Former Vice President Joe Biden received endorsements from Washington Gov. Jay Inslee and former Vice President Al Gore on Wednesday, winning support from the climate change champions on the 50th anniversary of Earth Day.",https://www.cnn.com/2020/04/22/politics/joe-biden-jay-inslee-al-gore-endorsement-earth-day-cnntv/index.html,https://cdn.cnn.com/cnnnext/dam/assets/200315221114-45-cnn-debate-0315-biden-super-tease.jpg,2020-04-22T20:39:23Z,,cnn,CNN
