author,title,description,url,urlToImage,publishedAt,content,source.id,source.name
The School of Life,The School of Life presents: Self-discovery in self-isolation,What if our real problem was not so much that we are not allowed to go anywhere -- but that we don't know how to make the most of what is already to hand?,https://www.cnn.com/2020/04/22/health/confinement-coronavirus-school-of-life-wellness/index.html,https://cdn.cnn.com/cnnnext/dam/assets/200421132452-02-confinement-super-tease.jpg,2020-04-22T09:34:56Z,"The article is by The School of Life, in partnership with CNN, as part of a series on living more philosophically during the coronavirus pandemic.
 (CNN)At some point in the 1650s, the French philosopher and mathematician Blaise Pascal jotted down one of the… [+11086 chars]",cnn,CNN
"Madeline Holcombe and Chris Boyette, CNN",South Dakota dirt track plans race with 700 spectators despite governor telling fans not to go,"Hundreds of people are scheduled to attend two large auto races over the weekend in South Dakota, but Governor Kristi Noem warned that it is not a good idea amid the pandemic.",https://www.cnn.com/2020/04/22/us/south-dakota-races-coronavirus/index.html,https://cdn.cnn.com/cnnnext/dam/assets/200422044741-gov-kristi-noem-030520-restricted-super-tease.jpg,2020-04-22T09:27:38Z,,cnn,CNN
"Rob Picheta, CNN","Coronavirus pandemic will cause global famines of 'biblical proportions,' UN warns","The world is facing multiple famines of ""biblical proportions"" in just a matter of months, the UN has said, warning that the coronavirus pandemic will push an additional 130 million people to the brink of starvation.",https://www.cnn.com/2020/04/22/africa/coronavirus-famine-un-warning-intl/index.html,https://cdn.cnn.com/cnnnext/dam/assets/200422040123-02-un-warning-famine-super-tease.jpg,2020-04-22T09:19:07Z,"London (CNN)The world is facing multiple famines of ""biblical proportions"" in just a matter of months, the UN has said, warning that the coronavirus pandemic will push an additional 130 million people to the brink of starvation.
Famines could take hold in ""a… [+3891 chars]",cnn,CNN
"Radina Gigova, CNN","The DRC's health system is on 'life support' as it fights several killer diseases, including coronavirus","The people of the Democratic Republic of Congo (DRC) have faced an onslaught of deadly diseases in recent years, including measles, polio, malaria and Ebola. Now they are also battling the new coronavirus.",https://www.cnn.com/2020/04/22/africa/drc-coronavirus-killer-diseases-intl/index.html,https://cdn.cnn.com/cnnnext/dam/assets/200414232438-02-drc-deadly-diseases-super-tease.jpg,2020-04-22T09:16:09Z,"(CNN)The people of the Democratic Republic of Congo (DRC) have faced an onslaught of deadly diseases in recent years, including measles, polio, malaria and Ebola.
Now the central African nation, with a crumbling and overwhelmed health system, is facing anoth… [+7193 chars]",cnn,CNN
,Asian wet markets get bad press. See what they're really like,"A common sight across Asia, wet markets traditionally sell fresh produce and live animals. Some include wild animal products linked to diseases. CNN's Kristie Lu Stout explains the diverse array of wet markets in Asia.",https://www.cnn.com/videos/world/2020/04/22/asia-wet-markets-explained-coronavirus-lu-stout-pkg-intl-hnk-vpx.cnn,https://cdn.cnn.com/cnnnext/dam/assets/200422160257-asia-wet-markets-explained-coronavirus-lu-stout-pkg-intl-hnk-vpx-00024113-super-tease.jpg,2020-04-22T09:14:29Z,Chat with us in Facebook Messenger. Find out what's happening in the world as it unfolds.,cnn,CNN
"By <a href=""/profiles/meg-wagner"">Meg Wagner</a>",Coronavirus pandemic in the US,"The US coronavirus outbreak has altered daily life in almost every way. Here's the latest updates on US Covid-19 cases, deaths, the lockdown, the government response, unemployment and more.",https://www.cnn.com/us/live-news/us-coronavirus-update-04-22-20/index.html,https://cdn.cnn.com/cnnnext/dam/assets/200213175739-03-coronavirus-0213-super-tease.jpg,2020-04-22T09:00:16Z,"A second coronavirus outbreak could emerge this winter in conjunction with the flu season to make for an even more dire health crisis, the director of the Centers for Disease Control and Prevention told The Washington Post in an interview.
""There's a possibi… [+1170 chars]",cnn,CNN
"Augie Martin, CNN",This California town is testing every resident for coronavirus and antibodies,A remote Northern California hamlet became one of the first places in the world Monday to attempt to comprehensively test all of its residents for Covid-19 and the antibodies believed to make one immune from infection.,https://www.cnn.com/2020/04/22/us/california-town-testing-every-resident/index.html,https://cdn.cnn.com/cnnnext/dam/assets/200422043556-01-bolinas-california-testing-0420-super-tease.jpg,2020-04-22T08:59:40Z,,cnn,CNN
"Christina Maxouris, CNN",US could see a higher summer death toll and CDC warns of a possibly worse coronavirus outbreak in winter,"A leading US model has upped its projected coronavirus death toll in August to 66,000 -- a 10% increase from its previous prediction.",https://www.cnn.com/2020/04/22/health/us-coronavirus-wednesday/index.html,https://cdn.cnn.com/cnnnext/dam/assets/200422031827-los-angeles-testing-0420-super-tease.jpg,2020-04-22T08:32:37Z,,cnn,CNN
"Judson Jones, CNN Meteorologist",Another series of tornadoes could hammer the Southern Plains and Deep South this week,"Hundreds of tornadoes have been reported across the eastern half of the US since April 1. Now, another storm system could generate even more over the next two days, from the Southern Plains to the Deep South.",https://www.cnn.com/2020/04/22/weather/tornado-forecast-severe-outbreak/index.html,https://cdn.cnn.com/cnnnext/dam/assets/200421163651-weather-severe-outbreak-card-image-20200421-super-tease.jpg,2020-04-22T08:03:16Z,"(CNN)Hundreds of tornadoes have been reported across the eastern half of the US since April 1. Now, another storm system could generate even more over the next two days, from the Southern Plains to the Deep South. 
This storm threat includes parts of Oklahom… [+3083 chars]",cnn,CNN
"Alaa Elassar, CNN",The Florida Aquarium just became the first in the world to reproduce ridged cactus coral in human care,"The Florida Aquarium has made a breakthrough that will help save ""America's Great Barrier Reef,"" the third largest coral reef in the world.",https://www.cnn.com/2020/04/22/us/florida-aquarium-first-reproduce-ridhed-cactus-coral-trnd/index.html,https://cdn.cnn.com/cnnnext/dam/assets/200421194957-01-florida-aquarium-first-reproduce-ridhed-cactus-coral-super-tease.jpg,2020-04-22T08:02:25Z,,cnn,CNN
"Julia Horowitz, CNN Business",Even Netflix is worried about what comes next,"It's a good time to be a company whose business booms when people stay at home. But even Netflix, which is experiencing surging subscriber growth, may face tougher times ahead.",https://www.cnn.com/2020/04/22/investing/premarket-stocks-trading/index.html,https://cdn.cnn.com/cnnnext/dam/assets/190416085157-netflix-file-restricted-super-tease.jpg,2020-04-22T11:58:48Z,"A version of this story first appeared in CNN Business' Before the Bell newsletter. Not a subscriber? You can sign up right here.
London (CNN Business)It's a good time to be a company whose business booms when people stay at home. But even Netflix(NFLX), whi… [+4700 chars]",cnn,CNN
"text by Stacey Lastoe, CNN; video by Diana Diroy, CNN","The safari industry is no stranger to hardship, but what will it take to recover now?",Covid-19's arrival in Africa has severely limited travel in and out of the continent. The restrictions have hit safari operators hard. When will a recovery come -- and what will it look like?,https://www.cnn.com/travel/article/african-safaris-covid-19-impact/index.html,https://cdn.cnn.com/cnnnext/dam/assets/200411221642-14-brave-africa-safari-super-tease.jpeg,2020-04-22T11:51:22Z,"text by Stacey Lastoe, CNN; video by Diana Diroy, CNNPublished 22nd April 2020
(CNN) The last Hippo Creek Safari was cut short in mid-March, the veteran tour operator's guest flew out of Botswana several days early once news of impending lockdowns hit. She n… [+12536 chars]",cnn,CNN
Opinion by David A. Andelman,Biden must choose 'the woman in Michigan',"David Andelman makes the case that there's only one choice for former Vice President Joe Biden's own VP pick: Gretchen Whitmer, dubbed ""the woman in Michigan"" by President Donald Trump. Her experience as a governor gives her the managerial chops needed to rig…",https://www.cnn.com/2020/04/22/opinions/vice-president-pick-biden-whitmer-andelman/index.html,https://cdn.cnn.com/cnnnext/dam/assets/200408162257-07-hf-gretchen-whitmer-0406-super-tease.jpg,2020-04-22T11:44:15Z,"David A. Andelman, executive director of The Red Lines Project, is a contributor to CNN, where his columns won the Deadline Club Award for Best Opinion Writing. Author of ""A Shattered Peace: Versailles 1919 and the Price We Pay Today,"" and the forthcoming ""A … [+5051 chars]",cnn,CNN
"Eliza Mackintosh, CNN","What you need to know about coronavirus on Wednesday, April 22","The US state of Missouri is suing China over the coronavirus crisis, seeking damages for what it described as a campaign of ""deception"" and insufficient action to halt a ""preventable"" pandemic.",https://www.cnn.com/2020/04/22/world/coronavirus-newsletter-04-22-20-intl/index.html,https://cdn.cnn.com/cnnnext/dam/assets/200130165125-corona-virus-cdc-image-super-tease.jpg,2020-04-22T11:39:13Z,"A version of this story appeared in the April 22 edition of CNN's Coronavirus: Fact vs. Fiction newsletter. Sign up here to receive the need-to-know headlines every weekday.
 (CNN)The coronavirus blame game has reached a new level after Missouri announced it… [+6114 chars]",cnn,CNN
,"With no people, safari owners fear a rise in poaching",Safari operators say a lack of business has a secondary sinister affect on the animals in the African wilderness areas.,https://www.cnn.com/videos/travel/2020/04/22/safaris-closed-poaching-increase-travel-orig.cnn,https://cdn.cnn.com/cnnnext/dam/assets/200411221005-07-brave-africa-safari-super-tease.jpeg,2020-04-22T11:38:58Z,Chat with us in Facebook Messenger. Find out what's happening in the world as it unfolds.,cnn,CNN
"Bukola Adebayo, CNN","Nigerian woman, 68, gives birth to twins after four IVF attempts","A Nigerian woman has given birth to twins, a boy, and a girl at the age of 68.",https://www.cnn.com/2020/04/22/africa/nigerian-woman-68-gives-birth-intl/index.html,https://cdn.cnn.com/cnnnext/dam/assets/200422061848-02-nigerian-woman-68-gives-birth-intl-super-tease.jpg,2020-04-22T11:36:35Z,"Lagos, Nigeria (CNN)A Nigerian woman has given birth to twins, a boy, and a girl at the age of 68. 
Margaret Adenuga went through three IVF procedures before finally having twins. 
Her husband Noah Adenuga, 77 told CNN the couple, who married in 1974 had lo… [+230 chars]",cnn,CNN
"Coy Wire, CNN Sports anchor and former NFL player",'I went from palm trees to snowmen but couldn't have been happier.' What is it like to get drafted into the NFL?,"Before going into journalism, CNN World Sport correspondent Coy Wire played safety and linebacker in the NFL, and here he gives his insight into what it is like to be drafted into the league - a process he went through in 2002.",https://edition.cnn.com/2020/04/22/sport/nfl-draft-2020-spt-intl/index.html,https://cdn.cnn.com/cnnnext/dam/assets/200421165523-coy-wire-draft-2-super-tease.jpeg,2020-04-22T11:20:45Z,"(CNN)They say when you have a near death experience, your life flashes before your eyes. When you're waiting to be drafted into the NFL, the same thing happens. 
You reflect on what it has taken to get to this moment: not just the training, the dedication, t… [+4128 chars]",cnn,CNN
"Chris Isidore, CNN Business",Delta reports its first loss in five years as coronavirus ravages airlines,"Delta Air Lines lost $534 million in the first three months of the year, its first quarterly loss in more than five years. It became the first airline to report the financial blow caused by the outbreak of the coronavirus.",https://www.cnn.com/2020/04/22/business/delta-losses/index.html,https://cdn.cnn.com/cnnnext/dam/assets/200421121637-delta-airport-empty-counters-super-tease.jpg,2020-04-22T11:20:22Z,"New York (CNN Business)Delta Air Lines lost $534 million in the first three months of the year, its first quarterly loss in more than five years. It became the first airline to report the financial blow caused by the outbreak of the coronavirus.
The airline … [+1309 chars]",cnn,CNN
,Everyone is still traveling ... in their living room,,https://www.cnn.com/collections/intl-coronavirus-wellbeing-0422/,,2020-04-22T11:20:09Z,,cnn,CNN
"by Channon Hodge, Alisha Emrahimji, and David Williams",Everyone is still traveling ... in their living room,"Instead of commiserating about canceled travel plans, TikTok and Instagram users are using the #travelfromhome hashtag to recreate vacation scenes at home.",https://www.cnn.com/travel/article/travel-from-home-challenge/index.html,https://cdn.cnn.com/cnnnext/dam/assets/200421215147-travel-from-home-challenge-ski-super-tease.jpg,2020-04-22T11:10:18Z,"Channon Hodge, Alisha Emrahimji, and David WilliamsPublished 22nd April 2020
(CNN) Just a few weeks ago, engineer Philipp Klein Herrero emerged from his sleeping bag, scaled a snowy mountain, skied off the top slopes and hit a near 360 degree turn before cra… [+4832 chars]",cnn,CNN
By CNN Business,"US futures point to higher open despite oil meltdown: April 22, 2020",Investors continue to worry about the coronavirus pandemic's impact on the economy. Here's what's moving markets today.,https://www.cnn.com/business/live-news/stock-market-news-042220/index.html,https://cdn.cnn.com/cnnnext/dam/assets/200420062649-new-york-stock-exchange-building-0409-super-tease.jpg,2020-04-22T10:51:14Z,"Oil prices continued their epic crash Wednesday as Brent crude futures, the main benchmark for global contracts, plunged by as much as 17% to their lowest level since 1999.
The collapse follows a historic rout on Monday when US oil for May delivery traded at… [+728 chars]",cnn,CNN
"Toyin Owoseje, CNN",This is why Bruce Willis is isolating with ex Demi Moore and not his wife,Bruce Willis and Demi Moore's daughter Scout Willis has revealed why her divorced parents have chosen to isolate together during the coronavirus pandemic.,https://www.cnn.com/2020/04/22/entertainment/bruce-willis-demi-moore-isolating-pandemic-intl-scli/index.html,https://cdn.cnn.com/cnnnext/dam/assets/200407093218-bruce-willis-demi-moore-tallulah-willis-super-tease.jpg,2020-04-22T10:49:25Z,,cnn,CNN
"Forrest Brown, CNN",Green buildings: 18 examples of sustainable architecture around the world,"From a skyscraper-turned-wind-turbine to a shopping complex inspired by termites, find out the operating secrets of 18 of the greenest buildings around the world.",https://www.cnn.com/style/article/green-buildings-world-sustainable-design/index.html,https://cdn.cnn.com/cnnnext/dam/assets/200316115331-04-green-buildings-around-the-world-restricted-super-tease.jpg,2020-04-22T10:16:50Z,"There are a lot of ways to size up buildings, whether by measuring their height, comparing styles of architecture or dissecting their histories. But in the era of climate change, more and more emphasis is being placed on a building's ""green"" credentials, as e… [+12735 chars]",cnn,CNN
Opinion by Rafia Zakaria,Trump's moves on immigration reveal his true motives,President Donald Trump's reckless tweet and subsequent narrower comments about immigration suspension show -- among other things -- how his administration is planning to use the Covid-19 pandemic to further its agenda of severely limiting immigration to the U…,https://www.cnn.com/2020/04/22/opinions/trump-immigration-tweet-denigrates-america-zakaria/index.html,https://cdn.cnn.com/cnnnext/dam/assets/200421121631-10-trump-0420-super-tease.jpg,2020-04-22T10:15:00Z,"Rafia Zakaria is the author of ""The Upstairs Wife: An Intimate History of Pakistan"" (Beacon 2015) and ""Veil"" (Bloomsbury 2017). She is a columnist for Dawn newspaper in Pakistan and The Baffler. The views expressed in this commentary are her own. View more op… [+7924 chars]",cnn,CNN
"AJ Willingham, CNN","5 things to know for April 22: Coronavirus, stimulus, medicine, immigration, Poland",Here's what else you need to know to Get Up to Speed and On with Your Day.,https://www.cnn.com/2020/04/22/us/five-things-april-22-trnd/index.html,https://cdn.cnn.com/cnnnext/dam/assets/200420143421-grocery-masks-super-tease.jpg,2020-04-22T10:05:06Z,"(CNN)It's Earth Day, and what a strange time to be celebrating. Here's a reminder that being kind to the Earth is, in a way, also being kind to yourself. And both deserve to be cared for.
Here's what you need to know to Get Up to Speed and On with Your Day. … [+4819 chars]",cnn,CNN
"Jeremy Herb, Lauren Fox and Phil Mattingly, CNN",Watchdogs scramble to keep tabs on billions in stimulus spending,"Hundreds of billions of dollars are flowing every day from the largest emergency economic package in US history. The watchdogs, if they're even in place, are now just trying to keep up.",https://www.cnn.com/2020/04/22/politics/oversight-congress-spending-stimulus/index.html,https://cdn.cnn.com/cnnnext/dam/assets/150918101743-james-clyburn-september-6-2012-super-tease.jpg,2020-04-22T10:01:09Z,"(CNN)Hundreds of billions of dollars are flowing every day from the largest emergency economic package in US history. The watchdogs, if they're even in place, are now just trying to keep up. 
The oversight work is starting, but there are already questions ab… [+9619 chars]",cnn,CNN
"Analysis by Zachary B. Wolf, CNN",Is now the time for Covid tattoos?,"Congress is in the process of passing another stimulus package, this one largely focused on refilling the already-depleted aid for small businesses and billions to beef up coronavirus testing. Read more here.",https://www.cnn.com/2020/04/22/politics/what-matters-april-21/index.html,https://cdn.cnn.com/cnnnext/dam/assets/200420184548-02-kemp-coronavirus-briefing-0420-super-tease.jpg,2020-04-22T10:00:31Z,,cnn,CNN
Elizabeth Wallace,"How to make coffee: In a pot, in a French press and more",You're probably finding yourself making more coffee at home than ever before. So we asked the experts about all the different ways you can prepare your own delicious brew at home.,https://www.cnn.com/2020/04/22/cnn-underscored/how-to-make-coffee/index.html,https://cdn.cnn.com/cnnnext/dam/assets/200420160741-coffeemakinglead-super-tease.jpg,2020-04-22T13:57:00Z,"CNN Underscored has interviewed experts to find the best options to help you cope during this uncertain time. Find all our coronavirus-related coverage here, and let us know your thoughts here.
In these challenging times, rituals are comforting. Whether it's… [+16040 chars]",cnn,CNN
,Jellyfish seen swimming in Venice canals,A jellyfish was spotted swimming through Venice's unusually clean canals after the national lockdown significantly reduced the traffic on the city's waterways.,https://www.cnn.com/videos/world/2020/04/22/jellyfish-venice-canal-lockdown-scn-lon-orig-tp.cnn,https://cdn.cnn.com/cnnnext/dam/assets/200422143835-jellyfish-venice-canals-super-tease.jpg,2020-04-22T13:54:48Z,Chat with us in Facebook Messenger. Find out what's happening in the world as it unfolds.,cnn,CNN
"Phil Mattingly and Lauren Fox, CNN",The Washington dynamics on rescue aid have started to shift,The US Congress will soon send another half-trillion dollar rescue package to the President's desk.,https://www.cnn.com/2020/04/22/politics/state-of-play-congress-aid/index.html,https://cdn.cnn.com/cnnnext/dam/assets/200409162006-07-week-in-photos-0409-super-tease.jpg,2020-04-22T13:48:11Z,,cnn,CNN
"Lisa Respers France, CNN","Goldie Hawn, Kate Hudson and baby make history with People cover","Goldie Hawn, her daughter Kate Hudson and Kate's daughter Rani are the first multi-generational cover stars of People's annual ""Beautiful"" issue.",https://www.cnn.com/2020/04/22/entertainment/goldie-hawn-kate-hudson-cover-trnd/index.html,https://cdn.cnn.com/cnnnext/dam/assets/200422082339-01-goldie-hawn-kate-hudson-file-super-tease.jpg,2020-04-22T13:33:28Z,,cnn,CNN
"Luke McGee, CNN","Bedspreads, bookshelves and nostrils laid bare. The week British politics joined the 21st century",The British Parliament has seen many historic days over the centuries. Yet it will have experienced few stranger than the spectacle that took place on Wednesday afternoon.,https://www.cnn.com/2020/04/22/uk/british-parliament-goes-virtual-intl-gbr/index.html,https://cdn.cnn.com/cnnnext/dam/assets/200422122639-05-pmq-0422-super-tease.jpg,2020-04-22T13:20:46Z,"London (CNN)The British Parliament has seen many historic days over the centuries. Yet it will have experienced few stranger than the spectacle that took place on Wednesday afternoon. 
Spotty internet connections, up-the-nostril camera angles and garish drap… [+4138 chars]",cnn,CNN
"Leah Asmelash, CNN","Darts, iRacing and baseball from Taiwan. A guide to the sports airing now, since most go-tos are gone","There are still (yes, still!) some sports available for sports fans. We may not have NBA playoff games, but at least we can get something.",https://www.cnn.com/2020/04/22/us/sports-still-live-coronavirus-trnd/index.html,https://cdn.cnn.com/cnnnext/dam/assets/200422090001-06-sports-on-now-split-restricted-super-tease.jpg,2020-04-22T13:13:34Z,,cnn,CNN
"Jordan Valinsky, CNN Business",Abigail Disney on Disney furloughs: 'What the actual f---'?,Abigail Disney is flabbergasted over the Walt Disney Co.'s decision to furlough hundreds of thousands low-paid workers after paying its executives millions of dollars.,https://www.cnn.com/2020/04/22/business/abigail-disney-furloughs-bonus-pay-coronavirus-trnd/index.html,https://cdn.cnn.com/cnnnext/dam/assets/200422070625-01-abigail-disney-file-super-tease.jpg,2020-04-22T13:08:34Z,,cnn,CNN
"Don Riddell, CNN",Men and women footballers experiencing 'glaring' rise in mental health issues during lockdown,"Many people are struggling with the threat of Covid-19. There's the fear of the virus, concerns about the economy and the financial impact of an extended lockdown and the loss of a supposedly normal life that we all used to take for granted.",https://edition.cnn.com/2020/04/22/football/football-depression-coronavirus-rise-lockdown-spt-intl/index.html,https://cdn.cnn.com/cnnnext/dam/assets/200422103216-football-depression-tease-super-tease.jpg,2020-04-22T13:03:48Z,"(CNN)Many people are struggling with the threat of Covid-19. There's the fear of the virus, concerns about the economy and the financial impact of an extended lockdown and the loss of a supposedly normal life that we all used to take for granted.
Professiona… [+6830 chars]",cnn,CNN
"Ashley Strickland, CNN",Newly discovered bats are related to those associated with the pandemic,"Four new species of African leaf-nosed bats have been discovered, and they're related to the horseshoe bats that have become known as the host for novel coronavirus.",https://www.cnn.com/2020/04/22/world/leaf-nosed-bats-discovery-scn/index.html,https://cdn.cnn.com/cnnnext/dam/assets/200421142844-01-leaf-nosed-bats-discovery-super-tease.jpg,2020-04-22T13:01:57Z,,cnn,CNN
Jacob Krol,Apple's iPhone SE brings unprecedented value at $399,"It's time to talk about the second-generation iPhone SE. It's not just the latest iPhone to join the family, but it's the most affordable with the starting price of $399. It's the successor to the original iPhone SE that was released in 2016. This second-gene…",https://www.cnn.com/2020/04/22/cnn-underscored/apple-iphone-se-second-generation-review/index.html,https://cdn.cnn.com/cnnnext/dam/assets/200421225430-1-underscored-apple-iphone-se-2020-review-super-tease.jpg,2020-04-22T13:00:10Z,"It's time to talk about the second-generation iPhone SE. It's not just the latest iPhone to join the family, but it's the most affordable with the starting price of $399. It's the successor to the original iPhone SE that was released in 2016. This second-gene… [+16672 chars]",cnn,CNN
"Chandelis Duster and Nikki Carvajal, CNN",Trump on Twitter tells US Navy to 'shoot down and destroy' Iranian boats that harass US ships,"President Donald Trump tweeted Wednesday that he has instructed the US Navy to ""shoot down and destroy any and all Iranian gunboats"" that harass US ships.",https://www.cnn.com/2020/04/22/politics/trump-us-navy-iranian-ships-tweet/index.html,https://cdn.cnn.com/cnnnext/dam/assets/200414235810-donald-trump-april-14-2020-01-super-tease.jpg,2020-04-22T12:55:16Z,,cnn,CNN
"Ryan Bergeron, CNN",Loki the therapy dog is delivering care packages to ICU nurses during the pandemic,"Therapy Dog ""Dogtor"" helping get ""Hero Healing Kits"" with elf-care essentials to healthcare workers.",https://www.cnn.com/2020/04/22/us/iyw-coronavirus-therapy-dog-care-packages-healthcare-workers-trnd/index.html,https://cdn.cnn.com/cnnnext/dam/assets/200421092736-02-iyw-coronavirus-therapy-dog-care-packages-super-tease.jpg,2020-04-22T12:37:39Z,,cnn,CNN
,Former 'The Voice' contestant returns to work as nurse,"Musician and former ""The Voice"" contestant Felicia Temple returned from touring in London to work as an ICU nurse in New Jersey amid the Covid-19 pandemic.",https://www.cnn.com/videos/entertainment/2020/04/22/former-the-voice-contestant-returns-to-work-as-nurse-mxp-vpx.hln,https://cdn.cnn.com/cnnnext/dam/assets/200422082725-felicia-temple-split-as-contestant-and-nurse-super-tease.jpg,2020-04-22T12:33:23Z,Chat with us in Facebook Messenger. Find out what's happening in the world as it unfolds.,cnn,CNN
