author,title,description,url,urlToImage,publishedAt,content,source.id,source.name
,Jonathan Karl critiques 'political stunts' at press briefings - CNN Video,"ABC's Jonathan Karl, head of the White House Correspondents' Association, says press briefings ""have begun to look purely political."" He says press secretary Kayleigh McEnany is using them ""over and over again to undermine the press, not inform the press."" He…",https://www.cnn.com/videos/business/2020/07/12/jonathan-karl-critiques-political-stunts-at-press-briefings.cnn,https://cdn.cnn.com/cnnnext/dam/assets/200712135428-rs-b-block-karl-super-tease.jpg,2020-07-12T20:03:00Z,Chat with us in Facebook Messenger. Find out what's happening in the world as it unfolds.,cnn,CNN
,CNN fact-checker: Dr. Fauci's corrections were necessary,"When it's most critical for President Donald Trump and top health officials to be working together, CNN is learning that the White House may be trying to actively discredit Dr. Anthony Fauci, the nation's top infectious disease expert. CNN's Daniel Dale weigh…",https://www.cnn.com/videos/politics/2020/07/12/dr-anthony-fauci-donald-trump-rift-coronavirus-pandemic-dale-tsr-vpx.cnn,https://cdn.cnn.com/cnnnext/dam/assets/200712193001-dr-anthony-fauci-donald-trump-rift-coronavirus-pandemic-dale-tsr-vpx-00000515-super-tease.jpg,2020-07-12T23:48:06Z,Chat with us in Facebook Messenger. Find out what's happening in the world as it unfolds.,cnn,CNN
Opinion by Dean Obeidallah,What Trump's mask can't hide,"Reacting to Donald Trump publicly wearing a mask on a visit to the Walter Reed hospital, Dean Obeidallah writes that Trump's previous undermining of the recommendation on face coverings to prevent the spread of Covid-19 only made the consequences of the pande…",https://www.cnn.com/2020/07/12/opinions/trump-mask-coronavirus-covid-19-obeidallah/index.html,https://cdn.cnn.com/cnnnext/dam/assets/200711173758-trump-mask-walter-reed-july-11-super-tease.jpg,2020-07-12T23:33:33Z,"Dean Obeidallah, a former attorney, is the host of SiriusXM radio's daily program ""The Dean Obeidallah Show"" and a columnist for The Daily Beast. Follow him @DeanObeidallah. The opinions expressed in… [+4849 chars]",cnn,CNN
"Clare Duffy, CNN Business",Facebook's future keeps getting murkier,"For nearly two months, Facebook has been scrambling to get a handle on a wave of criticism over its policies on moderating content, particularly hateful speech and misinformation that spreads on its platforms.",https://www.cnn.com/2020/07/12/tech/facebook-content-moderation-controversy/index.html,https://cdn.cnn.com/cnnnext/dam/assets/200712174408-facebook-headquarters-logo-file-restricted-super-tease.jpg,2020-07-12T23:11:05Z,"New York (CNN Business)For nearly two months, Facebook has been scrambling to get a handle on a wave of criticism over its policies on moderating content, particularly hateful speech and misinformati… [+5635 chars]",cnn,CNN
Opinion by John Avlon,Trump is the anti-Lincoln,"John Avlon writes that while Donald Trump likes to compare himself to Abraham Lincoln, the comparison falls apart on matters of character and temperament and political beliefs.",https://www.cnn.com/2020/07/12/opinions/trump-is-anti-lincoln-avlon/index.html,https://cdn.cnn.com/cnnnext/dam/assets/200504152704-donald-trump-abraham-lincoln-split-super-tease.jpg,2020-07-12T23:09:18Z,"John Avlon is a senior political analyst at CNN. The views expressed in this commentary are his own. Read more opinion on CNN.
 (CNN)President Donald Trump is famously unencumbered by a sense of his… [+6887 chars]",cnn,CNN
,Skateboarding musician warms hearts in pandemic,A man's impromptu performances aboard a Onewheel electric skateboard have helped earn him some money during a time when live music venues are closed.,https://www.cnn.com/videos/us/2020/07/12/coronavirus-guitarist-skateboard-instagram-chavis-flagg-atlanta-orig-llr.cnn,https://cdn.cnn.com/cnnnext/dam/assets/200712135659-atlanta-coronavirus-guitarist-super-tease.jpg,2020-07-12T23:09:08Z,Chat with us in Facebook Messenger. Find out what's happening in the world as it unfolds.,cnn,CNN
"Alaa Elassar, CNN",A massive fire has destroyed a 249-year-old church in California,California firefighters are investigating the origin of a fire that destroyed a historic 249-year-old Catholic church.,https://www.cnn.com/2020/07/12/us/san-gabriel-mission-fire-trnd/index.html,https://cdn.cnn.com/cnnnext/dam/assets/200712161806-01-california-church-fire-san-gabriel-mission-trnd-super-tease.jpg,2020-07-12T22:45:30Z,"(CNN)California firefighters are investigating the origin of a fire that destroyed a historic 249-year-old Catholic church.
In the early morning hours Saturday, firefighters responded to a fire at t… [+3113 chars]",cnn,CNN
,Turkey converting Hagia Sophia back into a mosque,Turkish president Recep Tayyip Erdogan has ordered the conversion of the city's historic Hagia Sophia back into a mosque after a court annulled a 1934 presidential decree that made it a museum. CNN's Arwa Damon reports.,https://www.cnn.com/videos/world/2020/07/12/turkey-erdogan-hagia-sophia-damon-vpx.cnn,https://cdn.cnn.com/cnnnext/dam/assets/200712153657-01-hagia-sophia-mosque-pope-francis-super-tease.jpg,2020-07-12T22:09:41Z,Chat with us in Facebook Messenger. Find out what's happening in the world as it unfolds.,cnn,CNN
"Analysis by Chris Cillizza, CNN Editor-at-large",Why the dumb mask debate isn't over,"With just 114 days until the 2020 election, it will be here before you know it. Every Sunday, I will outline the 5 BIG storylines you need to know to understand the upcoming week on the campaign trail. And they're ranked -- so the No. 1 story is the most impo…",https://www.cnn.com/2020/07/12/politics/us-election-2020-week-ahead/index.html,https://cdn.cnn.com/cnnnext/dam/assets/200711185808-03-trump-walter-reed-0711-super-tease.jpg,2020-07-12T22:01:47Z,"THE POINT -- NOW ON YOUTUBE! 
In each episode of his weekly YouTube show, Chris Cillizza will delve a little deeper into the surreal world of politics. Click to subscribe!",cnn,CNN
