author,title,description,url,urlToImage,publishedAt,content,source.id,source.name
"Stephen Collinson and Shasta Darlington, CNN",How long can we live under lockdown?,"To quote Morrissey, every day is like Sunday.",https://www.cnn.com/2020/04/21/world/meanwhile-in-america-april-21-intl/index.html,https://cdn.cnn.com/cnnnext/dam/assets/200406163922-empty-spaces-brazil-0405-super-tease.jpg,2020-04-22T01:50:44Z,"This analysis was excerpted from the April 21 edition of CNN's Meanwhile in America, the daily email about US politics for global readers. Click here to read past editions and subscribe. 
 (CNN)To quote Morrissey, every day is like Sunday.
The first thing y… [+2939 chars]",cnn,CNN
,In photos: Love during lockdown,"The novel coronavirus has ended lives and upended lives, with new cases of Covid-19 being reported in places around the world each day. Among the considerations people have had to face during the pandemic is whether or not to get married, and, if so, how and …",https://www.cnn.com/2020/04/21/world/gallery/love-during-lockdown/index.html,https://cdn.cnn.com/cnnnext/dam/assets/200421104900-01-weddings-coronavirus-unf-super-tease.jpg,2020-04-22T01:41:14Z,"A couple kisses after their wedding ceremony, which included only witnesses, in Vilnius, Lithuania, on April 3.
The novel coronavirus has ended lives and upended lives, with new cases of Covid-19 being reported in places around the world each day. Among the … [+639 chars]",cnn,CNN
"Curt Devine and Drew Griffin, CNN","Abbott's rapid tests can produce false negatives under certain conditions, the company says",The maker of a rapid coronavirus test widely used across the United States and distributed by the federal government has warned that its device can produce false negatives if a special solution is used to move or store patients' samples.,https://www.cnn.com/2020/04/21/health/abbott-laboratories-coronavirus-rapid-test/index.html,https://cdn.cnn.com/cnnnext/dam/assets/200421184341-abbott-labs-id-now-0410-super-tease.jpg,2020-04-22T01:35:13Z,"(CNN)The maker of a rapid coronavirus test widely used across the United States and distributed by the federal government has warned that its device can produce false negatives if a special solution is used to move or store patients' samples.
Abbott Laborato… [+4107 chars]",cnn,CNN
,Family spoke to dad on phone for 30 hours before his passing,A family merged their phone calls together to be a part of the last moments their father had in his hospital bed before dying from coronavirus.,https://www.cnn.com/videos/us/2020/04/22/30-hours-phone-call-father-family-coronavirus-vpx.cnn,https://cdn.cnn.com/cnnnext/dam/assets/200421210842-adair-fam-super-tease.jpg,2020-04-22T01:21:10Z,Chat with us in Facebook Messenger. Find out what's happening in the world as it unfolds.,cnn,CNN
"By <a href=""/profiles/joshua-berlinger"">Joshua Berlinger</a> and Adam Renton, CNN",Coronavirus pandemic: Updates from around the world,"The global coronavirus pandemic has brought countries around the world to a standstill. Here's the latest updates on worldwide Covid-19 cases, deaths, government responses, and more.",https://www.cnn.com/world/live-news/coronavirus-pandemic-04-22-20-intl/index.html,https://cdn.cnn.com/cnnnext/dam/assets/200213175739-03-coronavirus-0213-super-tease.jpg,2020-04-22T01:12:12Z,"The novel coronavirus lingers for as long as three weeks in the bodies of patients with severe disease, Chinese researchers reported Tuesday.
The virus can be found deep in the lungs and in the stool of patients, and the sicker they are, the longer it stays,… [+2001 chars]",cnn,CNN
,CNN reporter describes 'eeriness' after returning to Wuhan,"CNN's David Culver returns to Wuhan, China, after his departure before the city went into lockdown three months ago.",https://www.cnn.com/videos/world/2020/04/22/culver-return-wuhan-china-coronavirus-vpx.cnn,https://cdn.cnn.com/cnnnext/dam/assets/200421204956-culver-in-wuhan-super-tease.jpg,2020-04-22T01:05:31Z,Chat with us in Facebook Messenger. Find out what's happening in the world as it unfolds.,cnn,CNN
"Maggie Fox, CNN",NIH Covid-19 treatment guidelines warn against drug combo pushed by Trump,"Doctors should not use a drug combination strongly pushed by President Donald Trump to treat patients with coronavirus infections, a National Institutes of Health panel says in new guidelines published Tuesday. And any other experimental drugs should only be …",https://www.cnn.com/2020/04/21/health/nih-covid-19-treatment-guidelines/index.html,https://cdn.cnn.com/cnnnext/dam/assets/200326235359-hydroxychloroquine-super-tease.jpg,2020-04-22T00:53:28Z,"(CNN)Doctors should not use a drug combination strongly pushed by President Donald Trump to treat patients with coronavirus infections, a National Institutes of Health panel says in new guidelines published Tuesday. And any other experimental drugs should onl… [+4733 chars]",cnn,CNN
"Maggie Fox, CNN",NIH Covid-19 treatment guidelines warn against drug combo pushed by Trump,"Doctors should not use a drug combination strongly pushed by President Donald Trump to treat patients with coronavirus infections, a National Institutes of Health panel says in new guidelines published Tuesday. And any other experimental drugs should only be …",https://www.cnn.com/2020/04/21/health/nih-covid-19-treatment-guidelines/index.html,https://cdn.cnn.com/cnnnext/dam/assets/200326235359-hydroxychloroquine-super-tease.jpg,2020-04-22T00:53:28Z,"(CNN)Doctors should not use a drug combination strongly pushed by President Donald Trump to treat patients with coronavirus infections, a National Institutes of Health panel says in new guidelines published Tuesday. And any other experimental drugs should onl… [+4733 chars]",cnn,CNN
"Peter Bergen, CNN National Security Analyst",Infectious disease expert: We're only in the second inning of the pandemic,Infectious disease expert Michael Osterholm discussed the coronavirus with Peter Bergen. He decries the lack of a national long-term strategy for the pandemic and notes that there are real questions about the efficacy of the antibody tests that are being deve…,https://www.cnn.com/2020/04/21/opinions/bergen-osterholm-interview-two-opinion/index.html,https://cdn.cnn.com/cnnnext/dam/assets/200213175739-03-coronavirus-0213-super-tease.jpg,2020-04-22T00:33:07Z,"Peter Bergen is CNN's national security analyst, a vice president at New America and a professor of practice at Arizona State University. He is the editor of the Coronavirus Daily Brief and author of the new book ""Trump and His Generals: The Cost of Chaos.""
… [+21610 chars]",cnn,CNN
"Leah Asmelash, CNN",Scientists discover a new snake and name it after Salazar Slytherin,The fictional world is colliding with the scientific one.,https://www.cnn.com/2020/04/21/world/salazar-slytherin-pit-viper-trnd/index.html,https://cdn.cnn.com/cnnnext/dam/assets/200421185527-slytherin-salazar-pit-viper-trnd-super-tease.jpg,2020-04-22T00:27:25Z,,cnn,CNN
"Jennifer Hansler, Curt Merrill and Isaac Yee, CNN",The many times Trump has praised China's handling of the coronavirus pandemic,"President Donald Trump has repeatedly criticized the World Health Organization over the past week for being ""China-centric"" and failing to ""objectively assess the situation on the ground and to call out China's lack of transparency"" as the coronavirus death t…",https://www.cnn.com/2020/04/21/politics/trump-china-praise-coronavirus-timeline/index.html,https://cdn.cnn.com/cnnnext/dam/assets/200416013606-donald-trump-april-15-2020-01-super-tease.jpg,2020-04-22T00:20:56Z,,cnn,CNN
"Jennifer Hansler, Curt Merrill and Isaac Yee, CNN",The many times Trump has praised China's handling of the coronavirus pandemic,"President Donald Trump has repeatedly criticized the World Health Organization over the past week for being ""China-centric"" and failing to ""objectively assess the situation on the ground and to call out China's lack of transparency"" as the coronavirus death t…",https://www.cnn.com/2020/04/21/politics/trump-china-praise-coronavirus-timeline/index.html,https://cdn.cnn.com/cnnnext/dam/assets/200416013606-donald-trump-april-15-2020-01-super-tease.jpg,2020-04-22T00:20:56Z,,cnn,CNN
"Analysis by Stephen Collinson, CNN",Trump and Biden launch battle over China that could define 2020 election,President Donald Trump and presumptive Democratic nominee Joe Biden are unleashing the first shots over China and the coronavirus pandemic that could turn into a critical showdown in November's election.,https://www.cnn.com/2020/04/21/politics/trump-biden-china-2020/index.html,https://cdn.cnn.com/cnnnext/dam/assets/200416131206-3-trump-biden-split-super-tease.jpg,2020-04-22T00:01:24Z,,cnn,CNN
Opinion by Jill Filipovic,Governors reopening their states are endangering American lives,Jill Filipovic writes proud ignorance and do-nothing dangerousness is largely a Republican problem -- and it's costing American lives,https://www.cnn.com/2020/04/21/opinions/gop-governors-dangerous-covid-19-response-filipovic/index.html,https://cdn.cnn.com/cnnnext/dam/assets/200421143031-ga-tn-sc-governors-split-super-tease.jpg,2020-04-22T03:43:34Z,"Jill Filipovic is a journalist based in New York and author of the book ""The H-Spot: The Feminist Pursuit of Happiness."" Follow her on Twitter. The opinions expressed in this commentary are solely her own. View more opinion articles on CNN.
 (CNN)How do you … [+7388 chars]",cnn,CNN
,Dr. Gupta reacts to Georgia's safety guidelines: All risk and no reward,"CNN's Dr. Sanjay Gupta reacts to the latest safety guidelines released from Georgia's Board of Cosmetology and Barbers, following Georgia Gov. Brian Kemp's announcement that some businesses will be allowed to reopen this week.",https://www.cnn.com/videos/politics/2020/04/22/gupta-brian-kemp-georgia-guidelines-ctn-vpx.cnn,https://cdn.cnn.com/cnnnext/dam/assets/200421220836-sanjay-gupta-don-lemon-split-super-tease.jpg,2020-04-22T03:11:04Z,Chat with us in Facebook Messenger. Find out what's happening in the world as it unfolds.,cnn,CNN
Theresa Waldrop,His family stayed on the phone for 30 hours -- until he died,"Like so many people who have lost loved ones to Covid-19, Abby Adair Reinhard wasn't able to be at the hospital with her dying father, Don Adair.",https://www.cnn.com/2020/04/21/us/30-hours-phone-call-father-family-coronavirus/index.html,https://cdn.cnn.com/cnnnext/dam/assets/200421220021-02-don-reinhard-super-tease.jpg,2020-04-22T02:51:45Z,"(CNN)Like so many people who have lost loved ones to Covid-19, Abby Adair Reinhard wasn't able to be at the hospital with her dying father, Don Adair.
A nurse offered to put the hospital telephone next to Adair's ear, and Adair Reinhard and her three sibling… [+1919 chars]",cnn,CNN
Opinion by Michael D'Antonio,The long-dead muse inspiring Trump's daily briefing show,Michael D'Antonio writes that Americans need an actual president -- not just someone who plays one on TV,https://www.cnn.com/2020/04/21/opinions/trump-briefings-muse-dantonio/index.html,https://cdn.cnn.com/cnnnext/dam/assets/200420143129-03-trump-briefing-0419-super-tease.jpg,2020-04-22T02:24:51Z,"Michael D'Antonio is the author of the book ""Never Enough: Donald Trump and the Pursuit of Success"" and co-author with Peter Eisner of ""The Shadow President: The Truth About Mike Pence."" The opinions expressed in this commentary are those of the author. View … [+6218 chars]",cnn,CNN
"Stephy Chung, CNN",Dissident artist Ai Weiwei says virus has only strengthened China's 'police state',"The artist has been critical of China's handling of the outbreak and believes the ""arrogance and success"" of the government's authoritarian tactics will lead it into another crisis.",https://www.cnn.com/style/article/ai-weiwei-coronavirus-pandemic/index.html,https://cdn.cnn.com/cnnnext/dam/assets/200420182627-ai-weiwei-portrait-super-tease.jpg,2020-04-22T02:14:49Z,"artsPublished 22nd April 2020
As the world grapples with unprecedented lockdown measures, Ai Weiwei finds himself in familiar territory. The outspoken artist spent nearly three months in a tiny room while detained by authorities in China in 2011. 
He was la… [+6894 chars]",cnn,CNN
"Daniel Dale, Maegan Vazquez and David Wright, CNN",Fact check: President Trump's false claims from Tuesday's coronavirus briefing,President Donald Trump uttered fewer false claims than usual at the White House coronavirus briefing on Tuesday.,https://www.cnn.com/2020/04/21/politics/trump-fact-check-april-21/index.html,https://cdn.cnn.com/cnnnext/dam/assets/200421203945-pba-trump-super-tease.jpg,2020-04-22T02:05:56Z,,cnn,CNN
"Lauren M. Johnson, CNN",Piles of ice crash into homes as it melts on Minnesota's lakes,"Warmer weather means Lake Mille Lacs in Minnesota is starting to thaw, and as it does ice waves are slowly crashing into homes on the shore.",https://www.cnn.com/2020/04/21/us/ice-shove-in-minnesota-trnd-weather/index.html,https://cdn.cnn.com/cnnnext/dam/assets/200421211423-ice-shove-minnesota-super-tease.jpg,2020-04-22T02:00:36Z,,cnn,CNN
"Christina Maxouris and Joe Sutton, CNN",Missouri is suing China over coronavirus impacts saying the country did 'little to stop the spread of the disease',"Missouri is suing the Chinese government and other top institutions for the role they played in the coronavirus pandemic and the effects it has had on the state, accusing the country of covering up information, silencing whistleblowers and doing little to sto…",https://www.cnn.com/2020/04/22/us/missouri-lawsuit-china-coronavirus/index.html,https://cdn.cnn.com/cnnnext/dam/assets/200422000930-missouri-attorney-general-eric-schmitt-file-restricted-super-tease.jpg,2020-04-22T05:58:41Z,"(CNN)Missouri is suing the Chinese government and other top institutions for the role they played in the coronavirus pandemic and the effects it has had on the state, accusing the country of covering up information, silencing whistleblowers and doing little t… [+2654 chars]",cnn,CNN
"Helen Regan, CNN",Air pollution falls by unprecedented levels in major global cities during coronavirus lockdowns,"Lockdowns restricting travel and industry imposed to halt the spread of coronavirus have resulted in unprecedented reductions in deadly air pollution around the world, new analysis shows.",https://www.cnn.com/2020/04/22/world/air-pollution-reduction-cities-coronavirus-intl-hnk/index.html,https://cdn.cnn.com/cnnnext/dam/assets/200401105309-20200401-indian-gate-air-pollution-split-super-tease.jpg,2020-04-22T04:59:50Z,"(CNN)Lockdowns restricting travel and industry imposed to halt the spread of coronavirus have resulted in unprecedented reductions in deadly air pollution around the world, new analysis shows. 
Major cities that suffer from the world's worst air pollution ha… [+5631 chars]",cnn,CNN
"Analysis by James Griffiths, CNN",Coronavirus is both a crisis and an opportunity for China's aggressive new diplomacy,"The coronavirus crisis presents a key opportunity for China to solidify its status as a superpower. At the same time, however, it has been unable to avoid intense scrutiny and criticism.",https://www.cnn.com/2020/04/22/asia/china-diplomacy-coronavirus-crisis-opportunity-intl-hnk/index.html,https://cdn.cnn.com/cnnnext/dam/assets/200421163349-china-honor-guard-2019-super-tease.jpg,2020-04-22T04:46:44Z,,cnn,CNN
"Rebecca Wright and Salman Saeed, CNN Business",Bangladeshi garment workers face ruin as global brands ditch clothing contracts,"When Fatema Akther arrived for work at the Alif Casual Wear garment factory in Dhaka in late March, she had no idea it would be her last day.",https://www.cnn.com/2020/04/22/business/bangladesh-garment-factories/index.html,https://cdn.cnn.com/cnnnext/dam/assets/200421234921-02-bangladesh-garments-super-tease.jpg,2020-04-22T04:38:17Z,"By Rebecca Wright and Salman Saeed, CNN Business
Updated 12:53 AM ET, Wed April 22, 2020
Chat with us in Facebook Messenger. Find out what's happening in the world as it unfolds.
Hong Kong/Dhaka, Bangladesh (CNN Business)When Fatema Akther arrived for work… [+9256 chars]",cnn,CNN
"Jacqueline Howard, CNN","Covid-19 fears keep people from hospitals, but doctors say call 911 for heart attack and stroke","Fears of Covid-19 are keeping people away from hospitals. But some truly ill people need to be calling 911, doctors say in a new report.",https://www.cnn.com/2020/04/22/health/coronavirus-hospitals-heart-health-statement/index.html,https://cdn.cnn.com/cnnnext/dam/assets/200420151528-rural-hospitals-coronavirus-04-super-tease.jpg,2020-04-22T04:34:40Z,"(CNN)As the world continues to fight the coronavirus pandemic, a message from health officials has been consistent and clear: stay home.
Yet in the case of a life-threatening medical emergency such as heart attack or stroke, the American Heart Association, t… [+8658 chars]",cnn,CNN
"Sherisse Pham, CNN Business",Facebook invests $5.7 billion for 9.99% stake in India's Jio Platforms,"Facebook is investing $5.7 billion into Jio Platforms, the digital technology arm of Indian billionaire Mukesh Ambani's sprawling conglomerate Reliance Industries.",https://www.cnn.com/2020/04/22/tech/facebook-india-reliance-jio/index.html,https://cdn.cnn.com/cnnnext/dam/assets/200421220728-reliance-jio-file-restricted-super-tease.jpg,2020-04-22T04:33:39Z,,cnn,CNN
,Covid-19 patient gave birth during outbreak. Now she can't see her baby,Johana Mendoza Chancay was hospitalized for coronavirus while pregnant. She describes the emotional experience of being placed in a coma as doctors tried to save her and her baby.,https://www.cnn.com/videos/us/2020/04/22/woman-gives-birth-while-hospitalized-with-coronavirus-johana-mendoza-chancay-cpt-bts-vpx.cnn,https://cdn.cnn.com/cnnnext/dam/assets/200421235916-covid-19-baby-coma-johana-mendoza-chancay-super-tease.jpg,2020-04-22T04:12:56Z,Chat with us in Facebook Messenger. Find out what's happening in the world as it unfolds.,cnn,CNN
"Oliver Darcy, CNN Business",Fox News falls out of love with hydroxychloroquine,"Fox News has fallen out of love with hydroxychloroquine. After weeks of unrelenting coverage hyping the antimalarial drug as a potential game-changing treatment for the coronavirus, the network has all but stopped mentioning it on its airwaves. So has Preside…",https://www.cnn.com/2020/04/22/media/fox-news-hydroxychloroquine-reliable-sources/index.html,https://cdn.cnn.com/cnnnext/dam/assets/200422000255-01-hydroxychloroquine-pills-restricted-super-tease.jpg,2020-04-22T04:07:48Z,,cnn,CNN
"Analysis by Stephen Collinson, CNN",Divisions on battling coronavirus deepen as Trump and Southern states push opening,"The fragile American consensus on battling the coronavirus is fracturing along bitter political fault lines, as early state openings threaten to undermine the nationwide effort to slow the pandemic.",https://www.cnn.com/2020/04/22/politics/donald-trump-coronavirus-economy/index.html,https://cdn.cnn.com/cnnnext/dam/assets/200421143630-trump-encourages-stay-at-home-super-tease.jpg,2020-04-22T04:06:52Z,,cnn,CNN
"Madeline Holcombe and Sonia Moghe, CNN",NYC launches team to combat coronavirus discrimination,"With a spike in anti-Asian discrimination related to the coronavirus pandemic, New York City has formed a team to respond to the incidents.",https://www.cnn.com/2020/04/22/us/new-york-coronavirus-discrimination-harassment-response-team/index.html,https://cdn.cnn.com/cnnnext/dam/assets/200422030317-01-nyc-coronavirus-0421-super-tease.jpg,2020-04-22T07:59:08Z,"(CNN)With a spike in anti-Asian discrimination related to the coronavirus pandemic, New York City has formed a team to respond to the incidents.
The New York City Commission on Human Rights announced Sunday that the coronavirus response team would handle rep… [+3266 chars]",cnn,CNN
"Ryan Prior, CNN",Is your family's chewing and slurping driving you insane? Here's what to do,Many of us know the experience of feeling enraged while sitting with a friend or a family member who's eating a little loudly and that sound makes you want to scream. But there is something else you can do.,https://www.cnn.com/2020/04/22/health/chewing-sound-what-to-do-wellness/index.html,https://cdn.cnn.com/cnnnext/dam/assets/200421134053-mouth-chewing-eating-stock-super-tease.jpg,2020-04-22T07:33:49Z,,cnn,CNN
"Kristen Rogers, CNN","On a pandemic Earth Day, be good to the environment and to yourself","Earth Day 2020 marks the 50th anniversary of the birth of the modern environmental movement in 1970. Celebrating may be unusual this year, but there's no shortage of activities that are good for your health, the planet and safe during a pandemic.",https://www.cnn.com/2020/04/22/health/earth-day-ideas-coronavirus-wellness/index.html,https://cdn.cnn.com/cnnnext/dam/assets/200421094737-woman-running-outside-stock-super-tease.jpg,2020-04-22T07:30:29Z,,cnn,CNN
"AJ Willingham, CNN","How does the National Guard keep people safe during a pandemic? By cleaning, sewing and packing","If there's one thing the Covid-19 crisis has taught us, it's that unusual times call for unusual solutions.",https://www.cnn.com/2020/04/22/us/national-guard-covid-coronavirus-response-trnd/index.html,https://cdn.cnn.com/cnnnext/dam/assets/200421163229-03-national-guard-covid-coronavirus-response-trnd-super-tease.jpg,2020-04-22T07:25:21Z,"(CNN)If there's one thing the Covid-19 crisis has taught us, it's that unusual times call for unusual solutions. 
That's why in Rotterdam, New York, a group of trained soldiers and airmen sat in a call center for weeks, taking more than 118,000 calls from co… [+6329 chars]",cnn,CNN
,Evening news briefing from CNN,"Evening news briefing from CNN on Tuesday, April 21.",https://www.cnn.com/videos/us/2020/04/21/daily-news-briefing-04212020-2.cnn,https://cdn.cnn.com/cnnnext/dam/assets/200421182222-coronavirus-covid-frenk-mora-salud-secretario-fase-3-perspectivas-entrevista-mexico-cnne-00011718-super-tease.jpg,2020-04-22T07:04:51Z,Chat with us in Facebook Messenger. Find out what's happening in the world as it unfolds.,cnn,CNN
,John Oliver takes aim at Fox News coronavirus coverage,"John Oliver takes a deep dive into conservative media pushing misinformation about the coronavirus on ""HBO's Last Week Tonight.""",https://www.cnn.com/videos/media/2020/04/22/john-oliver-fox-news-coronavirus-eg-orig.cnn,https://cdn.cnn.com/cnnnext/dam/assets/200422025527-john-oliver-fox-news-super-tease.jpg,2020-04-22T07:02:48Z,Chat with us in Facebook Messenger. Find out what's happening in the world as it unfolds.,cnn,CNN
"Eliza Mackintosh, CNN","As Poland defies 'European values,' women resist on streets and online",A proposed bill banning abortion in Poland presented a fresh challenge for women's rights activists there: how to protest in the time of coronavirus.,https://www.cnn.com/2020/04/22/europe/poland-protest-abortion-lockdown-intl/index.html,https://cdn.cnn.com/cnnnext/dam/assets/200415104945-04-poland-abortion-protest-0414-super-tease.jpg,2020-04-22T06:55:06Z,,cnn,CNN
"Madeline Holcombe, CNN",She was diagnosed with coronavirus and had to deliver her baby 26 weeks early while in a coma,Johana Mendoza Chancay hasn't been in the same room with her baby since she delivered in a medically induced coma.,https://www.cnn.com/2020/04/22/health/chancay-coma-baby-delivery-trnd/index.html,https://cdn.cnn.com/cnnnext/dam/assets/200422013327-chancay-baby-delivery-super-tease.jpg,2020-04-22T06:32:46Z,,cnn,CNN
"Tara John, Nectar Gan and Swati Gupta, CNN",90% of the world's students are in lockdown. It's going to hit poor kids much harder than rich ones,Theoni Bosman Quarshie has been cramped into a two-bedroom London public housing apartment with her mother and younger sister since the UK went into coronavirus lockdown in mid-March.,https://www.cnn.com/2020/04/22/world/coronavirus-vulnerable-children-intl-gbr/index.html,https://cdn.cnn.com/cnnnext/dam/assets/200416115523-uk-coronavirus-schools-closed-file-super-tease.jpg,2020-04-22T06:15:06Z,,cnn,CNN
"Stephanie Mansour, CNN",How to combat poor at-home work posture,"Working from home presents many questions to sort out. One of the more important is: Where do you actually work? The answer matters because it's important to focus on good posture to prevent a tight neck, sore back and aching wrists.",https://www.cnn.com/2020/04/22/health/poor-posture-work-from-home-remote-wellness/index.html,https://cdn.cnn.com/cnnnext/dam/assets/200420175428-work-from-home-posture-stock-super-tease.jpg,2020-04-22T09:49:29Z,"(CNN)Working from home presents many questions to sort out. One of the more important is: Where do you actually work?
On the couch? At your dining room table? At the counter? In bed?
The answer matters because it's important to focus on good posture while w… [+6802 chars]",cnn,CNN
"Sarah Moon, CNN",The earliest known US virus-related fatalities have been confirmed in California as more deaths are investigated,"Two coronavirus-related deaths confirmed in Northern California's Santa Clara County from early February are the earliest known deaths from the virus in the US. 
The deaths were from February 6 and February 17 -- up to three weeks before the first known US de…",https://www.cnn.com/2020/04/22/us/california-deaths-earliest-in-us/index.html,https://cdn.cnn.com/cnnnext/dam/assets/200205145513-us-centers-for-disease-control-and-prevention-coronavirus-test-kit-super-tease.jpg,2020-04-22T09:49:24Z,(CNN)Two coronavirus-related deaths confirmed in Northern California's Santa Clara County from early February are the earliest known deaths from the virus in the US. The deaths were from February 6 and February 17 -- up to three weeks before the first known U… [+680 chars],cnn,CNN
