author,title,description,url,urlToImage,publishedAt,content,source.id,source.name
David Shulkin for CNN Business Perspectives,Hospitals were struggling before the pandemic. Now they face financial disaster,"In addition to the devastating loss of life from COVID-19, financial losses to US hospitals across the country will be staggering, writes David Shulkin, former secretary for the U.S. Department of Veteran Affairs.",https://www.cnn.com/2020/04/22/perspectives/hospitals-funding-coronavirus/index.html,https://cdn.cnn.com/cnnnext/dam/assets/200421094905-boston-medical-center-0415-restricted-super-tease.jpg,2020-04-22T12:12:10Z,"The Honorable David Shulkin MD was the ninth secretary for the U.S. Department of Veteran Affairs, having served in both the Trump and Obama administrations. He is now working with organizations and businesses to ensure that medical expertise informs their CO… [+4139 chars]",cnn,CNN
"Chandelis Duster, CNN",NYT: Trump family seeks rent break for DC hotel from Trump administration,"The Trump family business is asking the federal government to give President Donald Trump's hotel in Washington, DC, a break on its monthly lease payments during the coronavirus pandemic, The New York Times reported Tuesday.",https://www.cnn.com/2020/04/22/politics/trump-dc-hotel-lease-relief-request-gsa/index.html,https://cdn.cnn.com/cnnnext/dam/assets/200415152236-trump-hotel-super-tease.jpg,2020-04-22T12:08:12Z,"Washington (CNN)The Trump family business is asking the federal government to give President Donald Trump's hotel in Washington, DC, a break on its monthly lease payments during the coronavirus pandemic, The New York Times reported Tuesday.
The Trump Organiz… [+1937 chars]",cnn,CNN
"Matt Egan, CNN Business",Trump orders Chevron to halt oil production in Venezuela,"The Trump Administration ordered Chevron to halt oil production in Venezuela, dealing another blow to the American oil giant's century-long relationship with the crisis-ravaged OPEC nation.",https://www.cnn.com/2020/04/22/business/chevron-venezuela-oil-trump/index.html,https://cdn.cnn.com/cnnnext/dam/assets/200422091110-01-pipeline-venezuela-file-super-tease.jpg,2020-04-22T15:58:05Z,,cnn,CNN
"Lisa Respers France, CNN",Ansel Elgort's nude Instagram photo helped raise thousands for coronavirus relief,Well played Ansel Elgort.,https://www.cnn.com/2020/04/22/entertainment/ansel-elgort-nude-coronavirus/index.html,https://cdn.cnn.com/cnnnext/dam/assets/200422091340-ansel-elgort-0105-super-tease.jpg,2020-04-22T15:48:01Z,,cnn,CNN
,Traveling again with bed sheets and laundry machines,TikTok and Instagram users have figured out ways to reimagine their vacation plans using a little stop animation and a slew of camera tricks.,https://www.cnn.com/videos/travel/2020/04/22/travel-from-home-challenge-travel-orig.cnn,https://cdn.cnn.com/cnnnext/dam/assets/200421214820-travel-from-home-challenge-dana-super-tease.jpg,2020-04-22T15:35:57Z,Chat with us in Facebook Messenger. Find out what's happening in the world as it unfolds.,cnn,CNN
Jason Cipriani,A few iPad mini models are on sale at Amazon,"Apple's iPad mini is the smallest tablet in its lineup, and it's perfect for reading a book, catching up on email, or streaming your favorite Netflix series. And now, Amazon is marking down the iPad mini, with the caveat that most models won't ship for a few …",https://www.cnn.com/2020/04/22/cnn-underscored/ipad-mini-sale-amazon/index.html,https://cdn.cnn.com/cnnnext/dam/assets/200422113319-ipad-mini-lead-super-tease.jpg,2020-04-22T15:35:02Z,"Apple's iPad mini is the smallest tablet in its lineup, and it's perfect for reading a book, catching up on email, or streaming your favorite Netflix series. With a 7.9-inch screen and the ability to connect a Bluetooth keyboard to it, you can even use it to … [+1830 chars]",cnn,CNN
"Alisha Ebrahimji, CNN",Coronavirus destroyed decades-long graduation dreams,"Whether they flunked out ""spectacularly,"" just missed graduation or never went to college fresh out of high school, adult students say they're feeling the hit from coronavirus canceling college as much as the 20-somethings.",https://www.cnn.com/2020/04/22/us/adult-student-graduation-trnd/index.html,https://cdn.cnn.com/cnnnext/dam/assets/140603111607-graduation-caps-super-169.jpg,2020-04-22T15:30:13Z,"(CNN)Whether they flunked out ""spectacularly,"" just missed graduation or never went to college fresh out of high school, adult students say they're feeling the hit from coronavirus canceling college as much as the 20-somethings.
For some, the dream of gradua… [+4508 chars]",cnn,CNN
"Sara Ashley O'Brien, CNN Business",Fear and a firing inside an Amazon warehouse,"For nearly three years, Bashir Mohamed worked night shifts at an Amazon warehouse in Shakopee, Minnesota. As a ""stower"" at the facility, he was responsible for registering products into an inventory system before storing them on shelves for others to pick and…",https://www.cnn.com/2020/04/22/tech/amazon-warehouse-bashir-mohamed/index.html,https://cdn.cnn.com/cnnnext/dam/assets/190215140850-01-amazon-package-file-super-tease.jpg,2020-04-22T15:29:17Z,"(CNN Business)For nearly three years, Bashir Mohamed worked night shifts at an Amazon warehouse in Shakopee, Minnesota. As a ""stower"" at the facility, he was responsible for registering products into an inventory system before storing them on shelves for othe… [+10109 chars]",cnn,CNN
,Two Californians died of coronavirus weeks before previously known first US death,,https://www.cnn.com/collections/us-virus-intl-042220/,,2020-04-22T15:27:20Z,,cnn,CNN
"George Ramsay, CNN",Activists argue Saudi involvement in English football club takeover is attempt to 'whitewash the abuses of the regime',"Newcastle United may be a four-time English champion with a rich history, but the football club, owned by a controversial British retail magnate who is widely reviled by the club's fans, has few achievements to cheer about of late.",https://edition.cnn.com/2020/04/22/football/newcastle-united-takeover-saudi-arabia-football-premier-league-spt-intl-gbr/index.html,https://cdn.cnn.com/cnnnext/dam/assets/200422091533-mohammed-bin-salman-super-tease.jpg,2020-04-22T15:26:01Z,"(CNN)Newcastle United may be a four-time English champion with a rich history, but the football club, owned by a controversial British retail magnate who is widely reviled by the club's fans, has few achievements to cheer about of late.
All that could be abo… [+6320 chars]",cnn,CNN
"Mick Krever and Amy Woodyatt, CNN",Dutch court allows euthanasia in advanced dementia cases,"Doctors in the Netherlands may legally euthanize patients with severe dementia who previously provided a written request for the procedure, the country's highest court ruled Tuesday.",https://www.cnn.com/2020/04/22/europe/netherlands-euthanasia-dementia-intl-scli/index.html,https://cdn.cnn.com/cnnnext/dam/assets/200422053949-supreme-court-the-hague-netherlands-0421-super-tease.jpg,2020-04-22T15:24:11Z,,cnn,CNN
"Sarah Mucha, CNN",Biden says he expects VP selection panel to be formed by May 1,"Joe Biden on Tuesday night shared new insights into the timing of his vice presidential selection process, saying he expects the group that will vet the potential candidates will be formed by May 1 and that the list of contenders will be narrowed down sometim…",https://www.cnn.com/2020/04/22/politics/biden-vice-president-pick/index.html,https://cdn.cnn.com/cnnnext/dam/assets/200417134513-106-joe-biden-lead-image-super-tease.jpg,2020-04-22T15:22:55Z,"(CNN)Joe Biden on Tuesday night shared new insights into the timing of his vice presidential selection process, saying he expects the group that will vet the potential candidates will be formed by May 1 and that the list of contenders will be narrowed down so… [+2358 chars]",cnn,CNN
"Analysis by Chris Cillizza, CNN Editor-at-large",The Senate just proved Donald Trump wrong -- again -- on Russian interference in 2016,"On Tuesday, something very, very important happened on Capitol Hill.",https://www.cnn.com/2020/04/22/politics/senate-intelligence-committee-donald-trump-russia/index.html,https://cdn.cnn.com/cnnnext/dam/assets/200406181617-trump-hands-up-super-tease.jpg,2020-04-22T15:22:29Z,"THE POINT -- NOW ON YOUTUBE! 
In each episode of his weekly YouTube show, Chris Cillizza will delve a little deeper into the surreal world of politics. Click to subscribe!",cnn,CNN
"Kathryn Vasel, CNN Business",These folks have always worked from home full-time. Here's what they say you should know,"Working from home has been a big adjustment for millions of workers as we try to stop the spread of coronavirus. But for some company employees, remote life is all they know.",https://www.cnn.com/2020/04/22/success/work-from-home-expert-tips/index.html,https://cdn.cnn.com/cnnnext/dam/assets/190214225321-20190214-working-remote-super-tease.jpg,2020-04-22T15:20:13Z,,cnn,CNN
"Kristen Holmes, Kaitlan Collins and Eric Bradner, CNN","Trump tells Georgia governor he supports move to reopen despite public health experts' concerns, source says","President Donald Trump and Vice President Mike Pence both called Georgia Gov. Brian Kemp on Tuesday night and expressed support and praise for the Republican's move to reopen businesses in his state starting Friday, a source familiar with the call said.",https://www.cnn.com/2020/04/22/politics/trump-pence-georgia-governor-brian-kemp/index.html,https://cdn.cnn.com/cnnnext/dam/assets/200421231147-01-georgia-lockdown-super-tease.jpg,2020-04-22T15:19:26Z,,cnn,CNN
,Internet goes wild for video of Stanley Tucci making a cocktail,Actor Staley Tucci takes to Instagram to show off his bartending skills with a video of himself teaching followers how to make the perfect Negroni.,https://www.cnn.com/videos/entertainment/2020/04/22/stanley-tucci-makes-cocktail-in-quarantine-mxp-vpx.hln,https://cdn.cnn.com/cnnnext/dam/assets/200421171257-stanley-tucci-negroni-super-tease.jpg,2020-04-22T15:16:04Z,Chat with us in Facebook Messenger. Find out what's happening in the world as it unfolds.,cnn,CNN
"Calum Trenaman, CNN",Pescara soccer club chooses Italian boy's jersey design,Italian soccer club Pescara picked a 6-year-old's jersey design after the Serie B side launched a competition for young fans to design a jersey for the team.,https://edition.cnn.com/2020/04/22/football/pescara-new-jersey-spt-intl/index.html,https://cdn.cnn.com/cnnnext/dam/assets/200422115634-pescara-new-jersey-super-tease.jpg,2020-04-22T15:07:44Z,,cnn,CNN
"Christina Macfarlane and Ben Morse, CNN",Andy Murray predicts tennis will be 'one of the last sports to get back to normality',"As tennis tournaments are forced to push back their starting dates because of the coronavirus pandemic, Andy Murray says tennis will be ""one of the last sports to get back to normality.""",https://edition.cnn.com/2020/04/22/tennis/andy-murray-tennis-coronavirus-time-out-spt-intl/index.html,https://cdn.cnn.com/cnnnext/dam/assets/200422104153-andy-murray-tease-super-tease.jpg,2020-04-22T15:01:14Z,,cnn,CNN
"Hanna Ziady, CNN Business","She paid $68,000 to do an MBA at Cambridge. Now she's studying via Zoom in India",Srishti Warman spent years dreaming about doing an MBA at Cambridge University's Judge Business School.,https://www.cnn.com/2020/04/22/business/business-schools-coronavirus/index.html,https://cdn.cnn.com/cnnnext/dam/assets/200422030757-srishti-warman-super-tease.jpg,2020-04-22T14:55:31Z,,cnn,CNN
"Jeanne Sahadi, CNN Business",'We did everything right.' Small businesses left in limbo waiting for government loans,The federal money for Main Street was supposed to come fast. But most small businesses haven't seen any yet.,https://www.cnn.com/2020/04/22/success/small-businesses-that-missed-out-on-loans/index.html,https://cdn.cnn.com/cnnnext/dam/assets/200421124629-01-sammy-mcdowell-super-tease.jpg,2020-04-22T14:43:08Z,,cnn,CNN
"Lisa Respers France, CNN",Demi Lovato has advice about mental health during the pandemic,"Demi Lovato has long been open about her mental health struggles, and she's encouraging others to seek help if they need it.",https://www.cnn.com/2020/04/22/entertainment/demi-lovato-coronavirus/index.html,https://cdn.cnn.com/cnnnext/dam/assets/180724194049-demi-lovato-11192017-super-tease.jpg,2020-04-22T14:35:00Z,,cnn,CNN
,Lockdowns lead to air pollution drops in major cities,A study shows that air pollution levels have fallen by unprecedented levels in several major global cities amid coronavirus lockdowns.,https://www.cnn.com/videos/world/2020/04/22/air-quality-cities-coronavirus-lon-orig-mrg.cnn,https://cdn.cnn.com/cnnnext/dam/assets/200401105309-20200401-indian-gate-air-pollution-split-super-tease.jpg,2020-04-22T14:28:33Z,Chat with us in Facebook Messenger. Find out what's happening in the world as it unfolds.,cnn,CNN
"Veronica Stracqualursi, CNN",Republican-led Wisconsin legislature sues to reopen state from stay-at-home order,Wisconsin's Republican-led legislature filed a lawsuit Tuesday in an attempt to reopen the state and block the extension of a stay-at-home order issued by state health officials to slow the spread of the coronavirus.,https://www.cnn.com/2020/04/22/politics/wisconsin-legislature-sues-to-reopen-state-coronavirus/index.html,https://cdn.cnn.com/cnnnext/dam/assets/200421163908-wisconsin-capitol-file-super-tease.jpg,2020-04-22T14:22:33Z,"(CNN)Wisconsin's Republican-led legislature filed a lawsuit Tuesday in an attempt to reopen the state and block the extension of a stay-at-home order issued by state health officials to slow the spread of the coronavirus. 
The lawsuit was filed against Wisco… [+4654 chars]",cnn,CNN
"Lisa Respers France, CNN","Niles Fitch playing Disney's first black, live action prince","""This Is Us"" actor Niles Fitch is making Disney history.",https://www.cnn.com/2020/04/22/entertainment/niles-fitch-disney-prince/index.html,https://cdn.cnn.com/cnnnext/dam/assets/200422145111-niles-fitch-file-super-tease.jpg,2020-04-22T14:21:38Z,,cnn,CNN
"Opinion by Lauren E. Oakes, Sarah H. Olson, and James Watson","Preventing pandemics, global warming and environmental degradation all at once","Scientists with the Wildlife Conservation Society write that as the world faces three urgent challenges --Covid-19, climate change, and the destruction of natural environments -- the problems feed into each other, and their solutions are intertwined.",https://www.cnn.com/2020/04/22/opinions/pandemics-global-warming-linked/index.html,https://cdn.cnn.com/cnnnext/dam/assets/191003141444-amazon-wildfire-090619-super-tease.jpeg,2020-04-22T14:21:21Z,"Lauren E. Oakes is a conservation scientist with the Wildlife Conservation Society, an adjunct professor at Stanford University in the Department of Earth System Science, and the author of ""In Search of the Canary Tree."" Sarah H. Olson is the associate direct… [+4798 chars]",cnn,CNN
,Massive 'ice shoves' crash into lakeside homes,"See 30-foot-tall ice walls, also known as ""ice shoves,"" move into lakeside homes in Minnesota. Warm weather has caused the ice on the lake to thaw causing ice waves to crash into homes on the shore.",https://www.cnn.com/videos/us/2020/04/22/ice-shoves-crash-into-homes-minnesota-ns-orig-vpx.cnn,https://cdn.cnn.com/cnnnext/dam/assets/200422081648-ice-shoves-in-mn-super-tease.jpg,2020-04-22T14:12:39Z,Chat with us in Facebook Messenger. Find out what's happening in the world as it unfolds.,cnn,CNN
"Sara Ashley O'Brien, CNN Business",Coronavirus training by text message: How some companies are keeping workers informed,"For Marcela Sapone, the decision to expand her company into food and essential deliveries during the coronavirus pandemic didn't come without careful consideration for its thousands of workers.",https://www.cnn.com/2020/04/22/tech/stopcovid-worker-training/index.html,https://cdn.cnn.com/cnnnext/dam/assets/200422093955-02-hello-alfred-training-super-tease.jpg,2020-04-22T14:00:17Z,"(CNN Business)For Marcela Sapone, the decision to expand her company into food and essential deliveries during the coronavirus pandemic didn't come without careful consideration for its thousands of workers.
For the past three years, Hello Alfred has partner… [+3542 chars]",cnn,CNN
Christina Vercelletto,28 fun backyard games for kids of all ages,"Since outdoor space is precious nowadays, it's time to make the most of it. We rounded up some of the most creative outdoor games for kids.",https://www.cnn.com/2020/04/22/cnn-underscored/kids-outdoor-games/index.html,https://cdn.cnn.com/cnnnext/dam/assets/200415135023-backyard-lead-super-tease.jpg,2020-04-22T17:55:35Z,"CNN Underscored has interviewed experts to find the best options to help you cope during this uncertain time. Find all our coronavirus-related coverage here, and let us know your thoughts here.
The bad news is we're still on coronavirus lockdown. But here's … [+11871 chars]",cnn,CNN
Elizabeth Wallace,The comfiest pants for lounging around the house,,https://www.cnn.com/2020/04/22/cnn-underscored/best-lounge-pants-boost/index.html,https://cdn.cnn.com/cnnnext/dam/assets/200317123400-comfypantslead-super-tease.jpg,2020-04-22T17:48:55Z,"CNN Underscored has interviewed experts to find the best options to help you cope during this uncertain time. Find all our coronavirus-related coverage here, and let us know your thoughts here.
Whether you've been told to work from home for the next few week… [+7279 chars]",cnn,CNN
CNN staff,Every Day is Earth Day: Dr. Sanjay Gupta's coronavirus podcast for April 22,"This year, the 50th anniversary of Earth Day comes in the midst of a pandemic. CNN's Chief Medical Correspondent Dr. Sanjay Gupta talks to Bill Weir, CNN's chief climate correspondent, about the parallels between the Covid-19 and climate change.",https://www.cnn.com/2020/04/22/health/sanjay-gupta-podcast-april-22-wellness/index.html,https://cdn.cnn.com/cnnnext/dam/assets/200402114757-gupta-coronavirus-podcast-top-super-tease.jpg,2020-04-22T17:39:18Z,"(CNN)This year, the 50th anniversary of Earth Day comes in the midst of a pandemic. CNN's Chief Medical Correspondent Dr. Sanjay Gupta talks to Bill Weir, CNN's chief climate correspondent, about the parallels between Covid-19 and climate change, as well as w… [+11469 chars]",cnn,CNN
"Sandra Gonzalez, CNN",'Westworld' renewed for Season 4,"""Westworld's"" adventures are not stopping any time soon.",https://www.cnn.com/2020/04/22/entertainment/westworld-season-4/index.html,https://cdn.cnn.com/cnnnext/dam/assets/200305124637-westworld-season-3-super-tease.jpg,2020-04-22T17:38:27Z,,cnn,CNN
"Toyin Owoseje, CNN",Joshua Jackson and Jodie Turner-Smith announce birth of their first child,"Joshua Jackson and Jodie Turner-Smith have welcomed their first child, a girl.",https://www.cnn.com/2020/04/22/entertainment/joshua-jackson-jodie-tuner-smith-baby-intl-scli/index.html,https://cdn.cnn.com/cnnnext/dam/assets/200422121306-joshua-jackson-jodie-turner-smith-0202-restricted-super-tease.jpg,2020-04-22T17:30:50Z,,cnn,CNN
"Manu Raju and Clare Foran, CNN","In shift, House plans Thursday vote to create panel to investigate coronavirus spending",The House now plans to vote on Thursday to set up a powerful new oversight committee with subpoena power to probe the trillions of dollars of federal spending in response to the crisis caused by the coronavirus pandemic.,https://www.cnn.com/2020/04/22/politics/coronavirus-oversight-committee-house/index.html,https://cdn.cnn.com/cnnnext/dam/assets/160218191310-james-clyburn-july-8-2015-super-tease.jpg,2020-04-22T17:10:10Z,"Washington (CNN)The House now plans to vote on Thursday to set up a powerful new oversight committee with subpoena power to probe the trillions of dollars of federal spending in response to the crisis caused by the coronavirus pandemic.
The Democratic-led co… [+4323 chars]",cnn,CNN
"Manu Raju and Clare Foran, CNN","In shift, House plans Thursday vote to create panel to investigate coronavirus spending",The House now plans to vote on Thursday to set up a powerful new oversight committee with subpoena power to probe the trillions of dollars of federal spending in response to the crisis caused by the coronavirus pandemic.,https://www.cnn.com/2020/04/22/politics/coronavirus-oversight-committee-house/index.html,https://cdn.cnn.com/cnnnext/dam/assets/160218191310-james-clyburn-july-8-2015-super-tease.jpg,2020-04-22T17:10:10Z,"Washington (CNN)The House now plans to vote on Thursday to set up a powerful new oversight committee with subpoena power to probe the trillions of dollars of federal spending in response to the crisis caused by the coronavirus pandemic.
The Democratic-led co… [+4323 chars]",cnn,CNN
"Shelby Lin Erdman, CNN",Top health experts caution against reopening society before coronavirus testing capacity expands,"As several states make plans for reopening their communities amid the continuing coronavirus pandemic, a group of top public health experts cautioned Tuesday against reopening society before testing capacity expands significantly.",https://www.cnn.com/2020/04/22/health/coronavirus-testing-capacity-expansion/index.html,https://cdn.cnn.com/cnnnext/dam/assets/200420160644-01-coronavirus-antibody-test-ny-0414-super-tease.jpg,2020-04-22T17:02:29Z,"(CNN)States may be planning to reopen businesses and communities despite the continuing coronavirus pandemic, but a group of top public health experts cautioned Tuesday against doing so before testing capacity expands significantly.
The president of Harvard'… [+5115 chars]",cnn,CNN
"Veronica Stracqualursi and Abby Phillip, CNN","19 coronavirus cases connected to Wisconsin primary election, state health official says","At least 19 people in Wisconsin who said they voted in-person or worked the polls for the state's April 7 primary election have tested positive for the coronavirus, according to the state health department.",https://www.cnn.com/2020/04/22/politics/wisconsin-april-7-election-coronavirus-cases/index.html,https://cdn.cnn.com/cnnnext/dam/assets/200407141647-08-wisconsin-voting-lines-0407-super-tease.jpg,2020-04-22T16:39:18Z,"(CNN)At least 19 people in Wisconsin who said they voted in-person or worked the polls for the state's April 7 primary election have tested positive for the coronavirus, according to the state health department.
Wisconsin Department of Health Services Deputy… [+3476 chars]",cnn,CNN
"Jordan Valinsky, CNN Business",Victoria's Secret deal to go private hits a roadblock,Sycamore Partners wants to terminate its plan to buy a majority stake in Victoria's Secret from L Brands two months after the $525 million deal was reached.,https://www.cnn.com/2020/04/22/business/victorias-secret-l-brands-sycamore/index.html,https://cdn.cnn.com/cnnnext/dam/assets/200422114635-01-victorias-secret-closed-0324-super-tease.jpg,2020-04-22T16:39:02Z,,cnn,CNN
Opinion by John Avlon,"When Denver backed off social distancing in the 1918 pandemic, the results were deadly","John Avlon writes that just like now with Covid-19, during the 1918 flu pandemic, some local leaders, like then-Denver Mayor William Fitz Randolph Mills, caved into pressures to ignore social distancing and open up after protests, but it backfired.",https://www.cnn.com/2020/04/22/opinions/denver-1918-lesson-avlon/index.html,https://cdn.cnn.com/cnnnext/dam/assets/200421153836-01-denver-colorado-1918-flu-super-tease.jpg,2020-04-22T16:34:00Z,"John Avlon is a senior political analyst at CNN. The opinions expressed in this commentary are his own. View more opinion on CNN.
 (CNN)Politicians were feeling pressure during the pandemic. Businesses were agitating to reopen and deaths were going down, esp… [+6309 chars]",cnn,CNN
"Scottie Andrew and Kay Jones, CNN",Three infants were abandoned at the same apartment complex in three different years. DNA tests show they are siblings,Orlando police are working to identify their parents,https://www.cnn.com/2020/04/22/us/three-abandoned-babies-same-parents-trnd/index.html,https://cdn.cnn.com/cnnnext/dam/assets/200422120552-three-babies-abandoned-same-parents-trnd-super-tease.jpg,2020-04-22T16:33:36Z,,cnn,CNN
"Eric Bradner, Jessica Dean and Ryan Nobles, CNN",Biden memo urges surrogates to fault Trump 'for unimaginable pain and suffering' due to coronavirus response,"Joe Biden's campaign is telling Democrats to hammer President Donald Trump's handling of the coronavirus crisis by focusing on ""the four 'C's"": ""The Chinese government,"" ""cover-up,"" ""chaos,"" and ""corporate favoritism.""",https://www.cnn.com/2020/04/22/politics/joe-biden-memo-trump-coronavirus/index.html,https://cdn.cnn.com/cnnnext/dam/assets/200416131206-3-trump-biden-split-super-tease.jpg,2020-04-22T16:27:22Z,"(CNN)Joe Biden's campaign is telling Democrats to hammer President Donald Trump's handling of the coronavirus crisis by focusing on ""the four 'C's"": ""The Chinese government,"" ""cover-up,"" ""chaos,"" and ""corporate favoritism."" 
The new focus was outlined in a m… [+3025 chars]",cnn,CNN
Lesley Kennedy,The best online flower delivery options for various occasions,Sending a colorful flower arrangement during this time of social distancing may be the perfect way to brighten someone's day.,https://www.cnn.com/2020/04/22/cnn-underscored/best-online-flowers/index.html,https://cdn.cnn.com/cnnnext/dam/assets/200421135044-flowers-lead-super-tease.jpg,2020-04-22T16:10:38Z,"CNN Underscored has interviewed experts and found the best options to help you cope during this uncertain time. Find all our coronavirus-related coverage here, and let us know your thoughts here.
Sending a colorful flower arrangement during this time of soci… [+6307 chars]",cnn,CNN
