author,title,description,url,urlToImage,publishedAt,content,source.id,source.name
"Manu Raju and Haley Byrd, CNN",House Republicans air grievances against Liz Cheney over support for Dr. Fauci and splitting with Trump,"Several House Republicans attacked House GOP Conference Chairwoman Liz Cheney of Wyoming for supporting Dr. Anthony Fauci and splitting with President Donald Trump on a variety of issues over the past few months during a conference meeting Tuesday morning, a …",https://www.cnn.com/2020/07/21/politics/house-republican-meeting-liz-cheney/index.html,https://cdn.cnn.com/cnnnext/dam/assets/180817124025-01-liz-cheney-lead-image-super-tease.jpg,2020-07-21T16:25:46Z,(CNN)Several House Republicans attacked House GOP Conference Chairwoman Liz Cheney of Wyoming for supporting Dr. Anthony Fauci and splitting with President Donald Trump on a variety of issues over th… [+2687 chars],cnn,CNN
Opinion by Alice Driver,"The US passport, once prized, is now an object of suspicion","As Covid-19 cases continue to rise in the US, for the first time in my life, I am witnessing how the lack of US leadership on Covid-19 is devaluing the US passport I carry, says Alice Driver, who previously has crossed borders with privilege and ease to cover…",https://www.cnn.com/2020/07/21/opinions/covid-19-united-states-of-america-driver/index.html,https://cdn.cnn.com/cnnnext/dam/assets/200711111043-us-passport-super-tease.jpg,2020-07-21T16:25:02Z,"Alice Driver is a freelance journalist whose work focuses on migration, human rights and gender equality. She is based in Mexico City. Driver is the author of ""More or Less Dead: Feminicide, Haunting… [+5894 chars]",cnn,CNN
"Julia Horowitz, CNN Business",Hard-won recovery deal could tempt investors into Europe,Investors eying Europe for opportunities as it continues to recover from the Covid-19 pandemic have another reason to pump money in the region.,https://www.cnn.com/2020/07/21/investing/eu-recovery-plan-euro-stocks/index.html,https://cdn.cnn.com/cnnnext/dam/assets/200721080755-ursula-von-der-leyen-european-summit-belgium-0721-super-tease.jpg,2020-07-21T16:20:48Z,,cnn,CNN
By Ellen McAlpine,Our pick for best luxury coffee maker is almost $100 off,"Our luxury pick for best drip coffee maker, the Technivorm Moccamaster, is on sale for $262.65, the lowest price we've seen since May.",https://www.cnn.com/2020/07/21/cnn-underscored/technivorm-moccamaster-sale-amazon/index.html,https://cdn.cnn.com/cnnnext/dam/assets/200721091141-moccamaster-lead-super-169.jpg,2020-07-21T16:16:34Z,"If months of quarantining has forced you to swap your local coffee shop for a homemade brew consider adding the Technivorm Moccamaster, our luxury pick for best drip coffee maker, to your kitchen cou… [+2009 chars]",cnn,CNN
"Kate Sullivan and Sarah Mucha, CNN",Biden considering four Black women to be his running mate,"Presumptive Democratic presidential nominee Joe Biden said Monday he was considering four Black women to be his running mate, and has been receiving extensive vetting briefings about each potential candidate.",https://www.cnn.com/2020/07/21/politics/joe-biden-four-black-women-vice-president/index.html,https://cdn.cnn.com/cnnnext/dam/assets/200709162554-01-joe-biden-dunmore-pennsylvania-july-9-2020-super-tease.jpg,2020-07-21T16:05:53Z,"Washington (CNN)Presumptive Democratic presidential nominee Joe Biden said Monday he was considering four Black women to be his running mate, and has been receiving extensive vetting briefings about … [+2395 chars]",cnn,CNN
,Camerota reacts to new lawsuit: I guess Fox News is rotten to the core,CNN's Alisyn Camerota reacts to a lawsuit filed in federal court against Fox News which accused former host Ed Henry of rape and alleged that he retaliated against two women who rejected his advances.,https://www.cnn.com/videos/business/2020/07/21/stelter-fox-news-lawsuit-ed-henry-camerota-sot-newday-vpx.cnn,https://cdn.cnn.com/cnnnext/dam/assets/200721100440-fox-news-alisyn-camerota-brian-stelter-super-tease.jpg,2020-07-21T19:54:59Z,Chat with us in Facebook Messenger. Find out what's happening in the world as it unfolds.,cnn,CNN
,See video of Trump just hours after mask tweet,"President Trump tweeted a rare photo of himself in a face mask after struggling in the polls, but just hours later he was seen in public without one.",https://www.cnn.com/videos/politics/2020/07/21/trump-video-mask-photo-tweet-nr-vpx.cnn,https://cdn.cnn.com/cnnnext/dam/assets/200720174606-trump-tweets-mask-photo-super-tease.jpg,2020-07-21T19:45:59Z,Chat with us in Facebook Messenger. Find out what's happening in the world as it unfolds.,cnn,CNN
"Fredreka Schouten and David Wright, CNN",Political spending at Trump properties tops $22 million,President Donald Trump's political operation continues to drive donors' money to his real-estate empire.,https://www.cnn.com/2020/07/21/politics/trump-campaign-spending-at-trump-properties/index.html,https://cdn.cnn.com/cnnnext/dam/assets/200101113107-03-trump-1231-super-tease.jpg,2020-07-21T19:45:10Z,"(CNN)Roughly $400,000 related to a donor retreat at the President's Florida beach club. More than $37,500 in rent last month at a Trump-owned office tower in New York and another $3,400 in ""legal and… [+3634 chars]",cnn,CNN
"Katie Lobosco, CNN",Trump keeps pushing for a payroll tax cut. Here's what that means.,President Donald Trump is pushing Congress to include a payroll tax cut in the next economic relief package.,https://www.cnn.com/2020/07/21/politics/payroll-tax-cut-trump-congress-relief-negotiations/index.html,https://cdn.cnn.com/cnnnext/dam/assets/200721124236-payroll-tax-cut-trump-stimulus-super-tease.jpg,2020-07-21T19:39:14Z,"Washington (CNN)President Donald Trump is pushing Congress to include a payroll tax cut in the next economic relief package. 
He unsuccessfully pressed for oneearlier in the year, and renewed commen… [+3546 chars]",cnn,CNN
,CBS reporter dies after falling off of moped in New York,"Nina Kapur, a 26-year-old reporter in New York, died after she fell from a moped that had been rented from Revel, a popular moped sharing service.",https://www.cnn.com/videos/business/2020/07/21/nina-kapur-cbs-reporter-death-new-york-revel-moped-eg-orig.cnnbusiness,https://cdn.cnn.com/cnnnext/dam/assets/200720145605-01-nina-kapur-cbs2-reporter-dies-moped-accident-trnd-super-tease.jpg,2020-07-21T19:33:00Z,Chat with us in Facebook Messenger. Find out what's happening in the world as it unfolds.,cnn,CNN
"Ted Barrett, CNN",Senate votes to limit some military equipment transfers to police departments,"The Senate voted overwhelmingly Tuesday to put some limits on the transfer of military equipment from the Defense Department to state and local police departments, even as it rejected a more stringent measure aimed at preventing ""weapons of war,"" in the words…",https://www.cnn.com/2020/07/21/politics/senate-votes-military-equipment-police-departments/index.html,https://cdn.cnn.com/cnnnext/dam/assets/200616231417-04-police-military-equipment-super-tease.jpg,2020-07-21T19:30:26Z,"(CNN)The Senate voted overwhelmingly Tuesday to put some limits on the transfer of military equipment from the Defense Department to state and local police departments, even as it rejected a more str… [+3390 chars]",cnn,CNN
,Farmer finds rare yellow turtle,A farmer found a yellow Indian flapshell turtle in eastern India. Experts say its color is the product of albinism.,https://www.cnn.com/videos/world/2020/07/21/india-yellow-turtle-found-orig-mss.cnn,https://cdn.cnn.com/cnnnext/dam/assets/200721114135-03-india-yellow-turtle-super-tease.jpg,2020-07-21T19:22:24Z,Chat with us in Facebook Messenger. Find out what's happening in the world as it unfolds.,cnn,CNN
,Reporter says GOP lawmaker called Ocasio-Cortez a f***ing b**** after exchange,"Rep. Ted Yoho (R-FL) got into a heated exchange with Rep. Alexandria Ocasio-Cortez (D-NY), cursing as he walked away from their conversation. According to an account published in The Hill, Yoho said ""f**king bitch"" as he walked away. CNN's Manu Raju reports.",https://www.cnn.com/videos/politics/2020/07/21/alexandria-ocasio-cortez-ted-yoho-confrontation-sot-vpx-nr.cnn,https://cdn.cnn.com/cnnnext/dam/assets/200721122912-ted-yoho-alexandria-ocasio-cortez-split-super-tease.jpg,2020-07-21T19:18:35Z,Chat with us in Facebook Messenger. Find out what's happening in the world as it unfolds.,cnn,CNN
"David Williams, CNN",You can help a Georgia woman celebrate turning 105. All it takes is a birthday card,"A Georgia woman's family can't throw her the blowout 105th birthday party they've been looking forward to, so they're asking people around the world to send birthday cards to help celebrate.",https://www.cnn.com/2020/07/21/us/105-year-old-birthday-cards-trnd/index.html,https://cdn.cnn.com/cnnnext/dam/assets/200721120454-cards-105-birthday-coronavirus-trnd-super-tease.jpg,2020-07-21T19:09:38Z,"(CNN)A Georgia woman's family can't throw her the blowout 105th birthday party they've been looking forward to, so they're asking people around the world to send birthday cards to help celebrate.
He… [+2082 chars]",cnn,CNN
Adrianne Morales,LeBron James on Kobe Bryant: 'A day doesn't go by when I don't think about him',"It's been 6 months since Kobe Bryant, his daughter Gianna, and seven others were killed in a helicopter crash en route to a basketball tournament in Southern California.",https://www.cnn.com/2020/07/21/us/lebron-james-kobe-bryant-think-spt-trnd/index.html,https://cdn.cnn.com/cnnnext/dam/assets/200128160506-kobe-lebron-hug-super-tease.jpg,2020-07-21T19:06:42Z,"(CNN)It's been nearly 6 months since Kobe Bryant, his daughter Gianna, and seven others were killed in a helicopter crash en route to a basketball tournament in Southern California.
And not one of t… [+1559 chars]",cnn,CNN
"Jordan Valinsky, CNN Business",Men's Wearhouse and Jos. A. Bank are closing hundreds of stores,"Tailored Brands, which owns suit sellers Men's Wearhouse and Jos. A. Bank, is shuttering hundreds of stores and drastically reducing its corporate workforce as the coronavirus pandemic continues to decimate the retail industry.",https://www.cnn.com/2020/07/21/business/tailored-brands-closures/index.html,https://cdn.cnn.com/cnnnext/dam/assets/200721141620-mens-wearhouse-store-restricted-super-tease.jpg,2020-07-21T19:03:19Z,"New York (CNN Business)Tailored Brands, which owns suit sellers Men's Wearhouse and Jos. A. Bank, is shuttering hundreds of stores and drastically reducing its corporate workforce as the coronavirus … [+2439 chars]",cnn,CNN
,Heat is relentless across the East,Heat continues to bake the East with severe storms also in the forecast today. Chad Myers has a look at what you can expect and a look at possible tropical rain this weekend.,https://www.cnn.com/videos/weather/2020/07/21/daily-weather-video-heat-severe-storms-tropical-rain-gulf.cnn,https://cdn.cnn.com/cnnnext/dam/assets/200721074844-daily-weather-video-heat-severe-storms-tropical-rain-gulf-00003905-super-tease.jpg,2020-07-21T18:57:52Z,Chat with us in Facebook Messenger. Find out what's happening in the world as it unfolds.,cnn,CNN
"Allen Kim and David Close, CNN",NBA announces zero positive Covid-19 test results after over a week inside the Disney bubble,"As the NBA gears up to resume its season on July 30, the league along with the National Basketball Players Association (NBPA) announced that there were no positive Covid-19 test results from the 346 players that were tested since July 13.",https://www.cnn.com/2020/07/21/us/nba-coronavirus-tests-spt-trnd/index.html,https://cdn.cnn.com/cnnnext/dam/assets/200721134028-01-nba-restart-0720-orlando-restricted-super-tease.jpg,2020-07-21T18:57:05Z,"(CNN)As the NBA gears up to resume its season on July 30, the league along with the National Basketball Players Association (NBPA) announced that there were no positive Covid-19 test results from the… [+1357 chars]",cnn,CNN
,Moms try to protect protestors in Portland,"Dozens of moms formed a human shield to protect protesters from officers outside a federal courthouse in Portland, Oregon.",https://www.cnn.com/videos/us/2020/07/21/portland-moms-defend-protestors-sot-mxp-vpx.hln,https://cdn.cnn.com/cnnnext/dam/assets/200720152452-03-portland-protest-0719-super-tease.jpg,2020-07-21T18:51:58Z,Chat with us in Facebook Messenger. Find out what's happening in the world as it unfolds.,cnn,CNN
"Jen Christensen, CNN","Three simple acts can stop Covid-19 outbreaks, study finds","Coronavirus could be stopped if everyone used masks, washed their hands and stayed apart, anew study finds.",https://www.cnn.com/2020/07/21/health/covid-19-three-things-will-stop-it-wellness/index.html,https://cdn.cnn.com/cnnnext/dam/assets/200519115531-04-stores-social-distance-super-tease.jpg,2020-07-21T18:34:07Z,"(CNN)If people washed their hands regularly, wore masks, and kept their social distance from each other, these three simple behaviors could stop most all of the Covid-19 pandemic, even without a vacc… [+3153 chars]",cnn,CNN
"Kevin Liptak, Maegan Vazquez and Ariane de Vogue, CNN",Trump signs order targeting undocumented immigrants in the US census,President Donald Trump signed a presidential memorandum on Tuesday that would exclude undocumented immigrants from being counted in congressional districts when district lines are redrawn next year.,https://www.cnn.com/2020/07/21/politics/white-house-census-undocumented-immigrants/index.html,https://cdn.cnn.com/cnnnext/dam/assets/200720113243-02-trump-oval-office-0720-super-tease.jpg,2020-07-21T18:26:53Z,Washington (CNN)President Donald Trump signed a presidential memorandum on Tuesday that would exclude undocumented immigrants from being counted in congressional districts when district lines are red… [+2254 chars],cnn,CNN
,READ: Trump executive order on undocumented immigrants and US census,,https://www.cnn.com/2020/07/21/politics/read-executive-order-census/index.html,https://cdn.cnn.com/cnnnext/dam/assets/190403130708-census-2020-super-tease.jpg,2020-07-21T18:24:49Z,,cnn,CNN
"Alicia Lee, CNN",MLB pitcher says he's using his platform to 'implement change' after kneeling during the National Anthem,"As the National Anthem rang out across the baseball field, Los Angeles Angels' relief pitcher Keynan Middleton took a knee and raised his fist, adding his voice to the widespread protests against racial injustice and police brutality.",https://www.cnn.com/2020/07/21/us/los-angeles-angels-keynan-middleton-kneel-anthem-spt-trnd/index.html,https://cdn.cnn.com/cnnnext/dam/assets/200721120324-keynan-middleton-0708-super-tease.jpg,2020-07-21T18:24:04Z,"(CNN)As the National Anthem rang out across the baseball field Monday, Los Angeles Angels' relief pitcher Keynan Middleton took a knee and raised his fist, adding his voice to the widespread protests… [+958 chars]",cnn,CNN
"Kathryn Vasel, CNN Business",Small businesses are struggling to pay the rent,"Editor's Note: A version of this story appeared in CNN's Work Transformed newsletter. To get it in your inbox, sign up for free here.",https://www.cnn.com/2020/07/21/success/finding-a-job-work-transformed/index.html,https://cdn.cnn.com/cnnnext/dam/assets/200721111600-finding-a-job-work-transformed-super-tease.jpg,2020-07-21T18:20:22Z,,cnn,CNN
"Brynn Gingras and Eric Levenson, CNN",Investigators examining if killing of men's rights activist last week is connected to attack at federal judge's home,"Authorities are investigating any possible connections between Roy Den Hollander, the men's rights attorney suspected shooting a federal judge's family on Sunday, and the murder of another men's rights activist in California last week, according to a law enfo…",https://www.cnn.com/2020/07/21/us/marc-angelucci-mens-rights-killing/index.html,https://cdn.cnn.com/cnnnext/dam/assets/200721123940-marc-angelucci-mens-rights-killing-house-super-tease.jpg,2020-07-21T18:19:27Z,"(CNN)Authorities are investigating any possible connections between Roy Den Hollander, the men's rights attorney suspected shooting a federal judge's family on Sunday, and the murder of another men's… [+3590 chars]",cnn,CNN
"Brynn Gingras and Eric Levenson, CNN",Investigators examining if killing of men's rights activist last week is connected to attack at federal judge's home,"Authorities are investigating any possible connections between Roy Den Hollander, the men's rights attorney suspected shooting a federal judge's family on Sunday, and the murder of another men's rights activist in California last week, according to a law enfo…",https://www.cnn.com/2020/07/21/us/marc-angelucci-mens-rights-killing/index.html,https://cdn.cnn.com/cnnnext/dam/assets/200721123940-marc-angelucci-mens-rights-killing-house-super-tease.jpg,2020-07-21T18:19:27Z,"(CNN)Authorities are investigating any possible connections between Roy Den Hollander, the men's rights attorney suspected shooting a federal judge's family on Sunday, and the murder of another men's… [+3590 chars]",cnn,CNN
,Sen. Duckworth warns Trump: Don't even think about it,Sen. Tammy Duckworth (D-IL) warns President Donald Trump about sending federal law enforcement agents to Chicago.,https://www.cnn.com/videos/politics/2020/07/21/duckworth-trump-chicago-warning-crn-vpx.cnn,https://cdn.cnn.com/cnnnext/dam/assets/180206113644-tammy-duckworth-trump-split-super-tease.jpg,2020-07-21T18:17:48Z,Chat with us in Facebook Messenger. Find out what's happening in the world as it unfolds.,cnn,CNN
"Matt Egan, CNN Business",Chevron CEO reveals how a near-disaster led to the biggest oil deal of the year,"Chevron CEO Michael Wirth wisely walked away from last year's battle over Anadarko Petroleum. Now, Chevron is back with the biggest takeover since the pandemic threw the industry into chaos.",https://www.cnn.com/2020/07/21/business/chevron-noble-deal-michael-wirth/index.html,https://cdn.cnn.com/cnnnext/dam/assets/200721113510-chevron-refinery-california-restricted-super-tease.jpg,2020-07-21T18:05:26Z,,cnn,CNN
,"Trump blasts Beijing in public, but privately Trump org imports tons of Chinese goods",,https://www.cnn.com/collections/trump-china-intl-072120/,,2020-07-21T18:03:53Z,,cnn,CNN
"Donie O'Sullivan and Marshall Cohen, CNN Business","Facebook begins labeling, but not fact-checking, posts from Trump and Biden","After President Donald Trump posted an unfounded claim to Facebook on Tuesday that mail-in voting could lead to a ""corrupt election,"" the social network slapped a label on it. But the label did not attempt to fact-check the post as true or false. Instead, it …",https://www.cnn.com/2020/07/21/tech/facebook-label-trump-biden/index.html,https://cdn.cnn.com/cnnnext/dam/assets/200721120416-restricted-split-donald-trump-joe-biden-super-tease.jpg,2020-07-21T18:00:44Z,"New York (CNN Business)After President Donald Trump posted an unfounded claim to Facebook(FB) on Tuesday that mail-in voting could lead to a ""corrupt election,"" the social network slapped a label on … [+3183 chars]",cnn,CNN
,"Keilar fires back at Trump campaign official: It is 2020, sir!",CNN's Brianna Keilar talks to Trump campaign communications director Tim Murtaugh about coronavirus testing.,https://www.cnn.com/videos/politics/2020/07/21/tim-murtaugh-trump-campaign-coronavirus-testing-keilar-intv-vpx.cnn,https://cdn.cnn.com/cnnnext/dam/assets/200721164745-murtaugh-keilar-super-tease.jpg,2020-07-21T21:56:44Z,Chat with us in Facebook Messenger. Find out what's happening in the world as it unfolds.,cnn,CNN
"Gregory Wallace, CNN",Montana governor sues over 'unconstitutional' federal land agency head,"Montana's Democratic governor is challenging the Trump administration's Bureau of Land Management chief, accusing him of holding the office unconstitutionally.",https://www.cnn.com/2020/07/21/politics/william-perry-pendley-montana-governor-bureau-land-management/index.html,https://cdn.cnn.com/cnnnext/dam/assets/191008133143-william-perry-pendley-headshot-super-tease.jpg,2020-07-21T21:44:23Z,"(CNN)Montana's Democratic governor is challenging the Trump administration's Bureau of Land Management chief, accusing him of holding the office unconstitutionally. 
Gov. Steve Bullock filed a lawsu… [+3227 chars]",cnn,CNN
,Will you get another stimulus check? Watch the latest,"CNN's Jake Tapper and Phil Mattingly discuss reporting that Senate Republicans and the Trump administration are negotiating a new stimulus plan that could include a second round of direct payments, or stimulus checks.",https://www.cnn.com/videos/politics/2020/07/21/trump-white-house-gop-stimulus-coronavirus-mattingly-vpx.cnn,https://cdn.cnn.com/cnnnext/dam/assets/200721172833-trump-white-house-gop-stimulus-coronavirus-mattingly-vpx-00004412-super-tease.jpg,2020-07-21T21:44:10Z,Chat with us in Facebook Messenger. Find out what's happening in the world as it unfolds.,cnn,CNN
"Alicia Wallace, CNN Business","Coke says it will kill more 'zombie' brands, weeks after dropping Odwalla","Coca-Cola is on an operation to take out some ""zombies.""",https://www.cnn.com/2020/07/21/business/coke-zombie-brands-coronavirus/index.html,https://cdn.cnn.com/cnnnext/dam/assets/200721115035-coke-zombie-brands-coronavirus-super-tease.jpg,2020-07-21T21:19:01Z,,cnn,CNN
"Allen Kim, CNN",NFL player may retire over neck surgery put on hold due to the pandemic,NFL safety Reshad Jones is contemplating retirement after a planned neck surgery was postponed due to the coronavirus pandemic.,https://www.cnn.com/2020/07/21/us/reshad-jones-nfl-spt-trnd/index.html,https://cdn.cnn.com/cnnnext/dam/assets/200721143713-reshad-jones-nfl-dolphins-trnd-super-tease.jpg,2020-07-21T21:12:38Z,,cnn,CNN
"Caroline Kelly, CNN",Maryland governor warns that testing shortages could make Covid-19 situation even worse,"Maryland Republican Gov. Larry Hogan predicted Tuesday that in light of ongoing spikes in coronavirus cases, testing shortages and delays could make the pandemic even worse.",https://www.cnn.com/2020/07/21/politics/covid-testing-shortage-maryland-governor-hogan-cnntv/index.html,https://cdn.cnn.com/cnnnext/dam/assets/200721145227-amanpour-hogan-super-tease.jpg,2020-07-21T21:06:38Z,"(CNN)Maryland Republican Gov. Larry Hogan warned Tuesday that coronavirus testing shortages and delays could make the pandemic even worse.
""We're still having, now with this resurgence here in the U… [+2708 chars]",cnn,CNN
"Caroline Kelly, CNN",Maryland governor warns that testing shortages could make Covid-19 situation even worse,"Maryland Republican Gov. Larry Hogan predicted Tuesday that in light of ongoing spikes in coronavirus cases, testing shortages and delays could make the pandemic even worse.",https://www.cnn.com/2020/07/21/politics/covid-testing-shortage-maryland-governor-hogan-cnntv/index.html,https://cdn.cnn.com/cnnnext/dam/assets/200721145227-amanpour-hogan-super-tease.jpg,2020-07-21T21:06:38Z,"(CNN)Maryland Republican Gov. Larry Hogan warned Tuesday that coronavirus testing shortages and delays could make the pandemic even worse.
""We're still having, now with this resurgence here in the U… [+2708 chars]",cnn,CNN
"Analysis by Chris Cillizza, CNN Editor-at-large",The Point: Why today's fight among House Republicans *actually* matters,It's easy to dismiss intra-party squabbles in Congress as the sort of soap opera junk that reporters love and regular people could care less about. And lots of times that's true!,https://www.cnn.com/2020/07/21/politics/liz-cheney-house-republicans-jim-jordan/index.html,https://cdn.cnn.com/cnnnext/dam/assets/131113204506-liz-cheney-story-top.jpg,2020-07-21T21:05:43Z,"THE POINT -- NOW ON YOUTUBE! 
In each episode of his weekly YouTube show, Chris Cillizza will delve a little deeper into the surreal world of politics. Click to subscribe!",cnn,CNN
"Jackie Wattles, CNN Business",United posts unsurprising $1.6 billion loss as pandemic takes a toll,,https://www.cnn.com/2020/07/21/investing/united-airlines-earnings-covid/index.html,https://cdn.cnn.com/cnnnext/dam/assets/200721115211-02-united-airlines-0708-super-tease.jpg,2020-07-21T21:05:29Z,,cnn,CNN
"Paul LeBlanc, CNN",Fauci responds to Trump: 'I consider myself more a realist than an alarmist',"Dr. Anthony Fauci, the nation's top infectious disease expert, said Tuesday he considered himself ""more a realist than an alarmist"" after President Donald Trump on Sunday labeled him ""a little bit of an alarmist"" even as the coronavirus pandemic worsens.",https://www.cnn.com/2020/07/21/politics/fauci-trump-coronavirus-cnntv/index.html,https://cdn.cnn.com/cnnnext/dam/assets/200720165426-anthony-fauci-washington-nationals-mask-0630-super-tease.jpg,2020-07-21T20:27:00Z,"(CNN)Dr. Anthony Fauci, the nation's top infectious disease expert, said Tuesday he considered himself ""more a realist than an alarmist"" after President Donald Trump on Sunday labeled him ""a little b… [+1829 chars]",cnn,CNN
"Devan Cole, Laurie Ure and Paul LeBlanc, CNN",Ohio state House speaker arrested in connection to $60 million bribery scheme,The Republican speaker of Ohio's House of Representatives was arrested by federal officials Tuesday on charges connected to a $60 million bribery scheme.,https://www.cnn.com/2020/07/21/politics/larry-householder-ohio-speaker-arrested/index.html,https://cdn.cnn.com/cnnnext/dam/assets/200721113449-larry-householder-2019-file-super-tease.jpg,2020-07-21T20:22:14Z,,cnn,CNN
"Devan Cole, Laurie Ure and Paul LeBlanc, CNN",Ohio state House speaker arrested in connection to $60 million bribery scheme,The Republican speaker of Ohio's House of Representatives was arrested by federal officials Tuesday on charges connected to a $60 million bribery scheme.,https://www.cnn.com/2020/07/21/politics/larry-householder-ohio-speaker-arrested/index.html,https://cdn.cnn.com/cnnnext/dam/assets/200721113449-larry-householder-2019-file-super-tease.jpg,2020-07-21T20:22:14Z,,cnn,CNN
