author,title,description,url,urlToImage,publishedAt,content,source.id,source.name
Adam Sabes,New York Hamptons ritzy rental homes invaded by woman on multiple occasions: report,"A woman has been periodically attempting to enter ritzy rental homes in the New York Hamptons and has been caught at least seven times, according to the New York Post.",https://www.foxnews.com/us/new-york-hamptons-rental-homes-woman-invaded-multiple-occasions-report,https://static.foxnews.com/foxnews.com/content/uploads/2022/07/ALL_PHOTO_FS_NY_Goldilocks_Reportedly_Sleeping_Hamptons_Estates_5.png,2022-07-18T01:28:35Z,"A woman in New York has been periodically entering rental homes in the ritzy Hamptons area on multiple occasions since the end of May.
The woman, Peace Ofoego, 32, has been caught by police three ti… [+6412 chars]",fox-news,Fox News
Yael Halon,Biden is solely responsible for sabotaging the US economy and energy sector: Levin,"'Life, Liberty & Levin' host Mark Levin said President Biden bears full responsibility for destroying the U.S. economy and weakening its energy sector.",https://www.foxnews.com/media/biden-sabotoging-us-economy-energy-mark-levin,https://static.foxnews.com/foxnews.com/content/uploads/2021/08/Biden-mark-levine.jpg,2022-07-18T01:08:42Z,"President Biden is solely responsible for ""sabotaging"" the U.S. economy and energy industry, ""Life, Liberty &amp; Levin"" host Mark Levin said on his show Sunday, urging viewers to see past the White … [+2878 chars]",fox-news,Fox News
Lindsay Kornick,Tom Cotton blasts Biden's Middle East visit: Biden 'let Iran rush forward with a nuclear weapon',"Sen. Tom Cotton, R-Ark., explained the complex politics beyond Saudi Arabia in the wake of President Biden’s recent trip on “Sunday Night in America.”",https://www.foxnews.com/media/tom-cotton-blasts-biden-middle-east-visit-iran-rush-forward-nuclear-weapon,https://static.foxnews.com/foxnews.com/content/uploads/2022/07/BIDEN-SAUDI-ARABIA-FIST-BUMP.jpg,2022-07-18T00:59:45Z,"Sen. Tom Cotton, R-Ark., discussed the ongoing issues surrounding the Middle East while appearing on ""Sunday Night in America"" with Fox News host Trey Gowdy. 
President Biden recently received wides… [+4035 chars]",fox-news,Fox News
Fox News Staff,Trey Gowdy: President Biden should expect some scrutiny after his recent Middle East trip,Fox News host Trey Gowdy said 'there was no shortage of issues to confront' on President Biden's trip to the Middle East and weighs in on the scrutiny the president now faces on 'Sunday Night in America.',https://www.foxnews.com/media/trey-gowdy-president-biden-should-expect-scrutiny-middle-east-trip,https://cf-images.us-east-1.prod.boltdns.net/v1/static/694940094001/d324cc3b-a185-4c08-9148-c936f8d895e7/aa4db608-4a38-4233-813c-da32e41ef618/1280x720/match/image.jpg,2022-07-18T00:06:10Z,"TREY GOWDY: President Biden just returned from the Middle East and there was no shortage of issues to confront. Gas prices are crippling American consumers, so increased OPEC production no doubt came… [+2127 chars]",fox-news,Fox News
Fox News Staff,Steve Hilton: Biden's visit to Saudi Arabia is the second most disgraceful moment of his presidency,"Fox News host Steve Hilton weighs in on President Biden's visit to Saudi Arabia calling it ""the second most disgraceful moment of the Biden presidency"" on ""The Next Revolution.""",https://www.foxnews.com/media/steve-hilton-biden-saudi-arabia-disgraceful-moment-presidency,https://cf-images.us-east-1.prod.boltdns.net/v1/static/694940094001/9a3183f8-8fd0-488e-a46d-636f3370d994/102db8ac-bf90-479e-a6ca-f9ac1352ab59/1280x720/match/image.jpg,2022-07-18T03:16:21Z,"Fox News host Steve Hilton ripped President Biden for ""fist bumping"" Saudi Arabia Crown Prince Mohammed bin Salman and begging for Saudi oil on ""The Next Revolution"" Sunday night. 
STEVE HILTON: We … [+1935 chars]",fox-news,Fox News
Joe Silverstein,NY Mag column declares ‘death’ of ‘Democrats’ domestic ambitions:’ A ‘catastrophe’ with ‘a thousand fathers’,New York Magazine published a piece Friday which argued that Democrats' failure to enact their policy agenda has broader causes than just Sen. Joe Manchin.,https://www.foxnews.com/media/ny-mag-column-declares-death-democrats-domestic-ambitions-catastrophe-thousand-fathers,https://static.foxnews.com/foxnews.com/content/uploads/2021/06/Biden-G7-AP-5.jpg,2022-07-18T02:37:50Z,"New York Magazine's Intelligencer published an opinion piece Friday that argued the Biden administration and Democrat-controlled Congress' failures are due to more than Sen. Joe Manchin, D-W.Va., who… [+3885 chars]",fox-news,Fox News
Lindsay Kornick,Mayor Bowser claims illegal immigrants crowding DC homeless shelters are asylum seekers 'tricked' onto buses,"Washington D.C. Mayor Muriel Bowser claimed on ""Face the Nation"" that asylum seekers are tricked into being bused into her city as opposed all over the United States.",https://www.foxnews.com/media/mayor-bowser-claims-illegal-immigrants-crowding-dc-homeless-shelters-asylum-seekers-tricked-buses,https://static.foxnews.com/foxnews.com/content/uploads/2022/02/DC-Mayor-Muriel-Browser.jpg,2022-07-18T02:06:29Z,"Washington D.C. Mayor Muriel Bowser appeared on CBS ""Face the Nation"" on Sunday to discuss the persistent homelessness problem plaguing her city.
Host Margaret Brennen brought up a Washington Post r… [+2932 chars]",fox-news,Fox News
Lawrence Richard,"Zelenskyy fires head of Ukraine Security Service, announces hundreds of criminal treason cases","Ukrainian President Volodymyr Zelenskyy said his country is undergoing a ""self-purification"" process as he looks to root out officials and law enforcement officers who are guilty of corruption and treason.",https://www.foxnews.com/world/zelenskyy-fires-head-ukraine-security-service-announces-hundreds-criminal-treason-cases,https://static.foxnews.com/foxnews.com/content/uploads/2022/07/GettyImages-1239741353.jpg,2022-07-18T05:57:35Z,"Ukrainian President Volodymyr Zelenskyy fired two senior members of his administration, including the Head of the Security Service of Ukraine, he said during a nightly address.
Zelenskyy said on Sun… [+3749 chars]",fox-news,Fox News
Lawrence Richard,"Uvalde shooting report finds 'culture of noncompliance' among staff, 'tacitly condoned' by administrators","The Texas House of Representatives determined that Robb Elementary School staff in Uvalde violated safety protocols in a ""culture of noncompliance.""",https://www.foxnews.com/us/uvalde-shooting-report-finds-culture-noncompliance-staff-tacitly-condoned-administrators,https://static.foxnews.com/foxnews.com/content/uploads/2022/07/GettyImages-14035138771.jpg,2022-07-18T05:01:33Z,"School administrators ""did not adequately prepare"" for a potential shooter at Robb Elementary School in Uvalde, Texas, according to a report released by the Texas House of Representatives Investigati… [+3185 chars]",fox-news,Fox News
Landon Mion,"Virginia woman fatally stabbed by husband inside home, suspect fled: police","A Virginia woman was stabbed and killed Sunday in her Fairfax County home by her husband, who investigators are still searching for, according to police.",https://www.foxnews.com/us/virginia-woman-fatally-stabbed-husband-inside-home-suspect-fled-police,https://static.foxnews.com/foxnews.com/content/uploads/2020/06/fairfax-county-police.jpg,2022-07-18T07:13:05Z,"A Virginia woman was stabbed and killed in her home by her husband on Sunday, and the suspect is on the loose, police said.
Fairfax County Police responded to a call saying someone was stabbed insid… [+1807 chars]",fox-news,Fox News
Lawrence Richard,"California robbers steal $100 million of jewelry from armored vehicle near Los Angeles, official says",Robbers in California stole millions of dollars worth of jewelry and gems from a Brink's armored truck as it was transporting the merchandise from San Francisco to Los Angeles.,https://www.foxnews.com/us/california-robbers-steal-jewelry-armored-vehicle-los-angeles,https://static.foxnews.com/foxnews.com/content/uploads/2022/07/GettyImages-1382387547.jpg,2022-07-18T07:06:49Z,"Thieves in Southern California stole millions of dollars worth of gems and jewelry from an armored vehicle last week, officials said.
Brandy Swanson, a director at the International Gem and Jewelry … [+2102 chars]",fox-news,Fox News
Landon Mion,Maryland GOP Senate candidate arrested for allegedly filing false child trafficking report,"A GOP Senate in Maryland has been arrested after he allegedly made false statements about child trafficking at an adult book store, according to police.",https://www.foxnews.com/us/maryland-gop-senate-candidate-arrested-allegedly-filing-false-child-trafficking-report,https://static.foxnews.com/foxnews.com/content/uploads/2022/07/Ryan-Dark-White.jpg,2022-07-18T06:55:56Z,"A Republican running for U.S. Senate in Maryland was arrested Friday for allegedly filing a false report about a girl being trafficked at an adult book store, police said.
Ryan Dark White, also know… [+2425 chars]",fox-news,Fox News
"Stephanie Pagones, Rebecca Rosenberg","Notorious Rikers Island NYC lock-up, Correction Dept. grappling with staffing & safety as inmate deaths mount",City corrections staff and loved ones of inmates who have died in New York City jail custody are blaming the lack of safety for inmates and employees on a lack of adequate staffing levels.,https://www.foxnews.com/us/notorious-rikers-island-nyc-lock-up-correction-dept-grappling-staffing-safety-inmate-deaths-mount,https://static.foxnews.com/foxnews.com/content/uploads/2022/07/Rikers-inmate-Elijah-Muhammed.jpg,2022-07-18T06:30:30Z,"New York Citys Department of Correction among its facilities, the notorious Rikers Island lock-up is grappling with staffing woes amid nearly a dozen inmate deaths so far this year and a new $25 mill… [+11038 chars]",fox-news,Fox News
Simon Hankinson,"Celebrities say they'll leave US but curiously, they're still here...",Celebrities attract a lot of attention when they vow to leave the US over political differences. But their emotional pledges are typically nothing more than hot air.,https://www.foxnews.com/opinion/celebrities-leave-us,https://static.foxnews.com/foxnews.com/content/uploads/2022/02/Billie-Joe-Armstrong-1.jpg,2022-07-18T06:00:53Z,"After the Supreme Courts Dobbs decision, Green Day frontman Billie Joe Armstrong told fans at a London concert that he would renounce his citizenship. Dont bet on it.
Armstrong is no stranger to pre… [+5939 chars]",fox-news,Fox News
"Joseph Wulfsohn, Kristen Altus",Glenn Greenwald explains media shift against Biden: 'Democrats are petrified' he’s going to run again,"Independent journalist Glenn Greenwald accused the media of doing the bidding of Democratic leakers who are attempting to ""sabotage"" President Biden ahead of 2024.",https://www.foxnews.com/media/glenn-greenwald-explains-media-shift-against-biden-democrats-petrified,https://static.foxnews.com/foxnews.com/content/uploads/2022/07/Image-from-iOS-25.jpg,2022-07-18T06:00:44Z,"The legacy media has taken a hostile turn against President Biden in recent months between questioning his fitness and casting doubt on a reelection bid, but independent journalist Glenn Greenwald be… [+8132 chars]",fox-news,Fox News
Rebecca Rosenberg,'Where the Crawdads Sing' author Delia Owens wanted for questioning in murder,"Zambian authorities want to question Delia Owens, author of best-selling novel-turned-movie “Where the Crawdads Sing” about a deadly shooting that became a nationally televised snuff film.",https://www.foxnews.com/us/where-crawdads-sing-author-caught-up-murder-investigation,https://static.foxnews.com/foxnews.com/content/uploads/2022/07/IMG_1066.jpg,2022-07-18T06:00:19Z,"WARNING: Story below contains spoilers 
The movie adaptation of the best-selling novel ""Where the Crawdads Sing"" hits theaters Friday but the authors connection to a murder in Zambia thats nearly th… [+10819 chars]",fox-news,Fox News
Landon Mion,"Shooting at tourist hotspot on Spain's coast leaves 1 dead, 5 injured","At least five people were wounded in a Marbella, Spain nightclub early Monday morning, according to police. The gunman is among those who were wounded.",https://www.foxnews.com/world/shooting-tourist-hotspot-spains-coast-leaves-1-dead-5-injured,https://static.foxnews.com/foxnews.com/content/uploads/2022/07/Spain-police.jpg,2022-07-18T09:49:48Z,"A shooting at a nightclub in Marbella, Spain, early Monday morning has left at least one person dead and five injured, including the gunman, according to police.
Four victims have suffered gunshot w… [+866 chars]",fox-news,Fox News
James Laverty,Rep. Ronny Jackson: Why President Biden Won’t Finish His First Term,"On this episode, Will sits down with Rep. Ronny Jackson (R-TX) to discuss his upcoming book, Holding The Line. Rep. Jackson draws on his experience serving as the White House physician for three U.S. Presidents to explain why he believes President Biden is no…",https://radio.foxnews.com/2022/07/18/rep-ronny-jackson-why-president-biden-wont-finish-his-first-term/,https://radio.foxnews.com/wp-content/uploads/2021/07/FEATURED_IMAGE_THE_WILL_CAIN_PODCAST.png,2022-07-18T09:00:51Z,"On this episode, Will sits down with Rep. Ronny Jackson (R-TX) to discuss his upcoming book, Holding The Line. Rep. Jackson draws on his experience serving as the White House physician for three U.S.… [+313 chars]",fox-news,Fox News
William Sanchez,“Weakness on the World Stage”: Rep. Arrington On President Biden’s Trip to the Mideast,"As Americans continue to grapple with high gas prices, President Biden has taken his first presidential trip to the Middle East in hopes of working with Saudi Arabia to increase oil production. The President’s four-day trip to Saudi Arabia and Israel was also…",https://radio.foxnews.com/2022/07/18/the-fox-news-rundown-7-18-2022/,https://radio.foxnews.com/wp-content/uploads/2020/05/Rundown-Featured-Image-NEW.png,2022-07-18T09:00:30Z,"As Americans continue to grapple with high gas prices, President Biden has taken his first presidential trip to the Middle East in hopes of working with Saudi Arabia to increase oil production. The P… [+1090 chars]",fox-news,Fox News
"Jonathan Crowe, David Bernstein","Insurance delays hurt patients and doctors, but Congress can fix it","Patients are experiencing delays in care, and insurers are driving the delays, which ultimately hurt patients and hand-cuff doctors.",https://www.foxnews.com/opinion/insurance-delays-hurt-patients-doctors-congress-can-fix-it,https://media2.foxnews.com/BrightCove/694940094001/2017/07/24/694940094001_5518567749001_5518549927001-vs.jpg,2022-07-18T09:00:28Z,"Across the country, patients are experiencing delays in care that can have life-threatening consequences. And the worst part? Insurers are driving this delay, hurting patients and hand-cuffing doctor… [+5774 chars]",fox-news,Fox News
Lawrence Richard,Uvalde police release bodycam footage showing controversial school shooting response,"Bodycam footage from a Uvalde police officer shows the chaotic scene of the mass shooting at Robb Elementary School in Uvalde, Texas, that left 19 children and two teachers dead on May 24, 2022.",https://www.foxnews.com/us/uvalde-police-release-bodycam-footage-showing-controversial-school-shooting-response,https://static.foxnews.com/foxnews.com/content/uploads/2022/07/508291.jpg,2022-07-18T08:43:53Z,"The bodycam footage of a Uvalde police officer who responded to the mass shooting at Robb Elementary School in Uvalde, Texas has been released, showing the officers gathering together outside the sch… [+7932 chars]",fox-news,Fox News
Landon Mion,Georgia suspect armed with crossbow shoots victim in Atlanta,"A suspect armed with a crossbow shot someone in Atlanta Saturday night, according to local police. The victim in the incident is in stable condition.",https://www.foxnews.com/us/georgia-suspect-armed-crossbow-shoots-victim-atlanta,https://static.foxnews.com/foxnews.com/content/uploads/2021/08/ATL_Police_Car.jpg,2022-07-18T08:08:23Z,"A suspect in Georgia armed with a crossbow allegedly shot and injured another person in Atlanta, according to authorities.
The victim is in stable condition at a local hospital, Atlanta Police said.… [+1205 chars]",fox-news,Fox News
Ryan Gaydos,MLB Draft 2022: Rangers take Kumar Rocker with No. 3 selection in stunner,"The Texas Rangers quickly scooped up Kumar Rocker with the No. 3 pick of the draft, reuniting him with his Vanderbilt teammate Jack Leiter.",https://www.foxnews.com/sports/mlb-draft-2022-rangers-kumar-rocker,https://static.foxnews.com/foxnews.com/content/uploads/2022/07/Kumar-Rocker.jpg,2022-07-18T11:46:30Z,"MLB fans did not have to wonder too long about where Kumar Rocker was going to go in the draft on Sunday.
After the Baltimore Orioles selected Jackson Holliday No. 1 and the Arizona Diamondbacks sel… [+1915 chars]",fox-news,Fox News
Ryan Gaydos,Cameron Smith looks to see 'how many beers fit' in the Claret Jug after Open Championship win,Cameron Smith won the Open Championship on Sunday with an incredible performance to beat out Cameron Young and Rory McIlroy,https://www.foxnews.com/sports/cameron-smith-beers-claret-jug-open-championship-win,https://static.foxnews.com/foxnews.com/content/uploads/2022/07/Cam-Smith3.jpg,2022-07-18T11:32:41Z,"Cameron Smiths first reaction to winning the Open Championship on Sunday was seeing how he was going to turn the Claret Jug into the Claret Chug.
Smith came all the way back to win the tournament. H… [+1968 chars]",fox-news,Fox News
Bailee Hill,Uvalde victim's uncle on 'horrendous' police response to school shooting: 'Get out of law enforcement',"A Uvalde victim's uncle slammed Texas officials for the massacre response claiming they 'failed' the children, local community, and the state as a whole",https://www.foxnews.com/media/uvalde-victims-uncle-horrendous-police-response-school-shooting-get-law-enforcement,https://cf-images.us-east-1.prod.boltdns.net/v1/static/694940094001/dc133b3f-44cd-4e32-96ba-5990553a3612/5eba6885-7dbc-4aab-a8cf-76d7df66c029/1280x720/match/image.jpg,2022-07-18T11:28:31Z,"A Ulvalde school shooting victim's uncle spoke out Monday after a bombshell report, including police body camera footage, showed that more than 370 law enforcement officials responded to the massacre… [+1922 chars]",fox-news,Fox News
Gary Gastelu,Scott Dixon ties Mario Andretti for second in all-time Indy car wins,Scott Dixon's win at the Honda Indy Toronto IndyCar race tied him with Mario Andretti for second on the all-time Indy car wins list at 52 victories.,https://www.foxnews.com/auto/scott-dixon-ties-mario-andretti-indycar-wins,https://static.foxnews.com/foxnews.com/content/uploads/2022/07/dixon-cup.jpg,2022-07-18T11:21:30Z,"Scott Dixon's victory at the Honda Indy Toronto race on Sunday moved him into a second-place tie with Mario Andretti on the all-time Indy car wins list.
The 41-year-old Dixon ended a 22-race winless… [+2485 chars]",fox-news,Fox News
Ryan Gaydos,"MLB Draft 2022: Jackson Holliday, Druw Jones make history as the top two picks",Jackson Holliday and Druw Jones were the Nos. 1 and 2 overall selections on Sunday and made history doing so.,https://www.foxnews.com/sports/mlb-draft-jackson-holliday-druw-jones-make-history,https://static.foxnews.com/foxnews.com/content/uploads/2022/07/Jackson-Holliday.jpg,2022-07-18T11:13:04Z,"Jackson Holliday and Druw Jones made history on Sunday night when the two baseball players were selected Nos. 1 and 2 respectively in the MLB Draft.
The Baltimore Orioles took high school shortstop … [+2631 chars]",fox-news,Fox News
Fox News Staff,"Armed ‘good Samaritan’ neutralizes gunman, Jennifer Lopez shares wedding details and more top headlines","Armed ‘good Samaritan’ neutralizes gunman, Jennifer Lopez shares wedding details and more top headlinesfoxnews.com",https://www.foxnews.com/us/good-samaritan-neutralizes-gunman-mall-shooting,https://static.foxnews.com/foxnews.com/content/uploads/2022/07/indiana-1.jpg,2022-07-18T10:48:28Z,"Good morning and welcome to Fox News morning newsletter, Fox News First. Subscribe now to get Fox News First in your email. And here's what you need to know to start your day ...
HERO WITH A HANDGUN… [+3320 chars]",fox-news,Fox News
Gary Gastelu,The $109K Ford F-150 Raptor R is the brand's most powerful pickup,The 2023 Ford F-150 Raptor R is the brand's most powerful and expensive pickup ever. The high performance off-roader features a 700 hp supercharged V8.,https://www.foxnews.com/auto/ford-f-150-raptor-r-powerful-pickup,https://static.foxnews.com/foxnews.com/content/uploads/2022/07/61f44baf-raptor-4.jpg,2022-07-18T10:42:42Z,"Ford has revved up the F-150 Raptor.
The 2023 F-150 Raptor R is a higher performance version of the desert racing-inspired pickup that has been a hit for the brand for over a decade.
The top of the… [+3037 chars]",fox-news,Fox News
Reuters,Iran sanctions 61 more Americans as nuclear talks hit impasse,"Iran announced sanctions on 61 Americans Saturday, including former Secretary of State Mike Pompeo, after they backed the Iranian dissident group, Mujahideen-e-Khalq (MEK).",https://www.foxnews.com/world/iran-sanctions-61-americans-nuclear-talks-impasse,https://static.foxnews.com/foxnews.com/content/uploads/2022/06/Iran-Atrocities-Tribunal.jpeg,2022-07-18T10:40:27Z,"Iran has imposed sanctions on 61 more Americans, including former Secretary of State Mike Pompeo, for backing an Iranian dissident group, Tehran said on Saturday as months of talks to revive a 2015 n… [+2352 chars]",fox-news,Fox News
Ryan Gaydos,"Florida's Anthony Richardson drops 'AR-15' nickname, no longer wants to be 'associated' with gun","Anthony Richardson decided to drop the ""AR-15"" nickname as he no longer wants to be ""associated"" with an assault rifle",https://www.foxnews.com/sports/florida-anthony-richardson-drops-ar-15-nickname,https://static.foxnews.com/foxnews.com/content/uploads/2022/07/Anthony-Richardson.jpg,2022-07-18T10:40:23Z,"Florida quarterback Anthony Richardson will drop the nickname ""AR-15"" over the recent mass shootings across the U.S. and will work with his representatives to rebrand, he wrote on his website.
Richa… [+2247 chars]",fox-news,Fox News
Ronn Blitzer,"Sen. Rick Scott predicts 'bloodbath' for Dems in midterms, says issues like inflation will be focus, not Trump",Florida Senator Rick Scott said that Republicans will do well in November's midterm elections regardless of whether former President Donald Trump runs for president again.,https://www.foxnews.com/politics/sen-rick-scott-predicts-bloodbath-dems-midterms-issues-inflation-focus-not-trump,https://static.foxnews.com/foxnews.com/content/uploads/2021/09/Sen-Rick-Scott.jpg,2022-07-18T10:37:38Z,"Sen. Rick Scott, R-Fla., is confident that Republicans will be successful in November's midterm elections and retake control of the Senate, regardless of whether former President Trump announces anot… [+4150 chars]",fox-news,Fox News
Stephen Sorace,"Maryland deli worker pepper sprayed, stabbed while trying to stop theft of tip jar: police","Bryant Whack, 32, was arrested after stealing a tip jar from a deli in Gaithersburg, Maryland, and assaulting an store worker who tried to stop him, authorities said.",https://www.foxnews.com/us/maryland-deli-worker-pepper-sprayed-stabbed-trying-stop-theft-tip-jar-police,https://static.foxnews.com/foxnews.com/content/uploads/2022/07/Bryant-Whack-mugshot.jpg,2022-07-18T10:34:20Z,"A Maryland man was arrested Thursday after pepper spraying and stabbing a deli employee who tried to stop him from stealing the business tip jar, authorities said.
Bryant Whack, 32, of Silver Spring… [+1084 chars]",fox-news,Fox News
Associated Press,Christopher Bell takes New Hampshire NASCAR Cup Series race for second career win,Joe Gibbs Racing's Christopher Bell picked up his first NASCAR Cup Series win of 2022 at New Hampshire Motor Speedway to put himself in playoff contention.,https://www.foxnews.com/auto/christopher-bell-hampshire-nascar-cup-series,https://static.foxnews.com/foxnews.com/content/uploads/2022/07/bell-1.jpg,2022-07-18T10:30:25Z,Joe Gibbs had a New Hampshire race victory to celebrate and a future dinner to fill his belly courtesy of the 21-pound lobster awarded to winner Christopher Bell but some things still didn't feel rig… [+4711 chars],fox-news,Fox News
Stephanie Pagones,Parkland shooter Nikolas Cruz: Florida trial begins over whether gunman will face death penalty,"The penalty trial for Florida school shooter Nikolas Cruz, who killed 17 people in Parkland in 2018, is set to begin on Monday with opening statements and testimony.",https://www.foxnews.com/us/parkland-shooter-nikolas-cruz-florida-trial-begins-whether-gunman-face-death-penalty,https://static.foxnews.com/foxnews.com/content/uploads/2022/07/AP22196708430122.jpg,2022-07-18T13:50:08Z,"The penalty trial for Florida school shooter Nikolas Cruz begins Monday, as jurors will decide whether the 23-year-old will be executed or sentenced to life without parole for the 2018 massacre of 17… [+4064 chars]",fox-news,Fox News
