author,title,description,url,urlToImage,publishedAt,content,source.id,source.name
,Trump celebrates White House demolition as new ballroom rises: ‘Music to my ears’,"The White House fired back after several reports criticized President Donald Trump's addition of a grand, $200 million ballroom to the historic property with examples of past work.",https://www.foxnews.com/politics/trump-celebrates-white-house-demolition-new-ballroom-rises-music-my-ears,https://static.foxnews.com/foxnews.com/content/uploads/2025/10/white-house-construction-on-new-ballroom.jpg,2025-10-22T01:57:46Z,"President Donald Trump's privately funded $200 million White House ballroom is the latest ""bold, necessary addition"" to the executive residence, officials said, describing the East Wing construction … [+4142 chars]",fox-news,Fox News
,Giants release kicker Jude McAtamney after game-changing extra point miss with seconds left,The New York Giants released kicker Jude McAtamney after his missed extra points contributed to their 33-32 loss to the Denver Broncos on Sunday.,https://www.foxnews.com/sports/giants-release-kicker-jude-mcatamney-after-game-changing-extra-point-miss-seconds-left,https://static.foxnews.com/foxnews.com/content/uploads/2025/10/judge-mcatamney.jpg,2025-10-22T01:45:29Z,"Two days after the New York Giants epic collapse to the Denver Broncos, theyve released one of the players responsible for the 33-32 loss. 
Kicker Jude McAtamney, who missed multiple extra points in… [+2543 chars]",fox-news,Fox News
,"Jets owner Woody Johnson critiques Justin Fields, defends Aaron Glenn amid the team’s underwhelming start","New York Jets boss Woody Johnson maintained his support for coach Aaron Glenn despite the team's winless record. However, Johnson did express concerns about Justin Fields' performance.",https://www.foxnews.com/sports/jets-owner-woody-johnson-critiques-justin-fields-defends-aaron-glenn-amid-teams-underwhelming-start,https://static.foxnews.com/foxnews.com/content/uploads/2025/10/woody-johnson-owner-new-york-jets.jpg,2025-10-22T01:37:14Z,"Aaron Glenn returned to the New York Jets, the franchise where he began his playing career, for his first NFL head coaching opportunity.
Jets owner Woody Johnson continues to back first-year coach A… [+2508 chars]",fox-news,Fox News
,"Texas couple arrested after body of special needs son, 26, discovered buried in backyard","A Texas couple was arrested after investigators found the body of their adult special needs son buried in their backyard, according to investigators.",https://www.foxnews.com/us/texas-couple-arrested-after-body-special-needs-son-26-discovered-buried-backyard,https://static.foxnews.com/foxnews.com/content/uploads/2025/10/texas-couple-arrested-special-needs-son-discovered-buried-backyard.png,2025-10-22T01:27:31Z,"A Texas couple was arrested after investigators found the body of their adult special needs son buried in their backyard, according to investigators.
The remains of Jonathan Kinman, 26, were found w… [+1891 chars]",fox-news,Fox News
,"MSNBC's Jen Psaki jokes Usha Vance scared of her husband, ripped for 'disgusting' comments","MSNBC host Jen Psaki faced backlash after suggesting Vice President JD Vance was ""scarier"" than President Donald Trump and that his wife, Usha, is scared of him.",https://www.foxnews.com/media/msnbcs-jen-psaki-jokes-usha-vance-scared-her-husband-ripped-disgusting-comments,https://static.foxnews.com/foxnews.com/content/uploads/2025/03/vances.jpg,2025-10-22T01:14:51Z,"MSNBC host Jen Psaki was denounced for her ""disgusting"" comments Tuesday suggesting Vice President JD Vance's wife Usha is scared of him.
Psaki made the remarks on the ""I've Had It"" podcast, where s… [+2913 chars]",fox-news,Fox News
,Protests erupt as ICE agents raid NYC Chinatown street vendors allegedly selling counterfeit goods,"Federal authorities arrested between 15 and 40 vendors during an immigration enforcement operation in Manhattan's Chinatown, sparking protests and political backlash.",https://www.foxnews.com/us/protests-erupt-ice-agents-raid-nyc-chinatown-street-vendors-allegedly-selling-counterfeit-goods,https://static.foxnews.com/foxnews.com/content/uploads/2025/10/immigration-raid-chinatown-fox-news-002.jpg,2025-10-22T01:07:54Z,A federal raid in New York Citys Chinatown targeting criminal activity tied to the sale of counterfeit goods turned chaotic Friday as protesters clashed with Immigration and Customs Enforcement (ICE)… [+3884 chars],fox-news,Fox News
,Jessica Alba shows off beach body while on filming break in Australia,"Jessica Alba shares beach photos from Australia, where she's filming the action thriller ""The Mark"" after her recent divorce filing from Cash Warren.",https://www.foxnews.com/entertainment/jessica-alba-shows-off-beach-body-while-filming-break-australia,https://static.foxnews.com/foxnews.com/content/uploads/2025/10/jessicathumb-02.jpg,2025-10-22T00:40:49Z,"Jessica Alba is enjoying some downtime on the beach in Australia.
The 44-year-old celebrity posted a series of pictures and videos on her Instagram Monday captioning them, ""Down Under [Australian fl… [+2526 chars]",fox-news,Fox News
,'NYU Communists' vow to fight capitalism with Marxist revolution at 'No Kings' rally,"The ""NYU Communists"" group handed out ""The Communist"" newspapers at the ""No Kings"" rally in New York City on Saturday, vowing to fight back against capitalism.",https://www.foxnews.com/us/nyu-communists-vow-fight-capitalism-marxist-revolution-no-kings-rally,https://static.foxnews.com/foxnews.com/content/uploads/2025/10/washington-no-kings-protest.jpg,2025-10-22T00:12:29Z,"FIRST ON FOX: An apparent group of New York University (NYU) students
 handed out a Communist newspaper at the ""No Kings"" protest in New York City over the weekend, and vowed to ""overthrow capitalis… [+3116 chars]",fox-news,Fox News
,Trump warns ‘I’d rather have a Democrat than a communist’ as NYC mayoral race enters homestretch,"Trump said New York City may elect a “communist"" mayor, adding he’d prefer a Democrat but said he’d speak to Mamdani if elected and warned the city is in decline.",https://www.foxnews.com/politics/trump-warns-rather-have-democrat-than-communist-nyc-mayoral-race-enters-homestretch,https://static.foxnews.com/foxnews.com/content/uploads/2025/07/mamdani-trump-getty.png,2025-10-22T00:01:00Z,"President Donald Trump said Tuesday that he believes New York City could soon elect a ""communist"" mayor and signaled hed prefer a Democrat to take the reins at City Hall over a far-left candidate.
A… [+2492 chars]",fox-news,Fox News
,Convicted felon federally charged after threatening Atlanta airport while armed with AR-15 rifle,"Georgia man faces federal charges after allegedly threatening to shoot up Atlanta airport. Police said they found loaded AR-15 in his truck, preventing potential tragedy.",https://www.foxnews.com/us/convicted-felon-federally-charged-after-threatening-atlanta-airport-while-armed-ar-15-rifle,https://static.foxnews.com/foxnews.com/content/uploads/2025/10/atlanta-airport-ar15-threat-arrest-fox-news-004.jpg,2025-10-22T02:01:53Z,"A Georgia man accused of threatening to ""shoot up"" Hartsfield-Jackson Atlanta International Airport has been federally charged after authorities say he arrived at the busy travel hub with an AR-15-st… [+3321 chars]",fox-news,Fox News
