author,title,description,url,urlToImage,publishedAt,content,source.id,source.name
,"'Brazen' Louvre thieves made targeted heist, jewels could be melted down: expert","Brazen robbers stole priceless French crown jewels from the Louvre Museum's Apollo Gallery in broad daylight Saturday in what an expert calls a ""targeted heist.""",https://www.foxnews.com/world/brazen-louvre-thieves-made-targeted-heist-jewels-could-melted-down-expert,https://static.foxnews.com/foxnews.com/content/uploads/2025/10/louvre-heist-police-investigating2.jpg,2025-10-20T01:30:13Z,"The gang of thieves who robbed the Louvre Museum on Sunday and made off with some of Frances most famous crown jewels might end up melting their loot down, an ex-FBI art crime expert said.
Tim Carpe… [+3618 chars]",fox-news,Fox News
,Jared Kushner details working around '50 years of stupid word games' in Middle East for ceasefire deal,"President Donald Trump’s son-in-law Jared Kushner spoke to CBS’ “60 Minutes"" with U.S. Special Envoy Steve Witkoff about helping to negotiate the Gaza ceasefire deal.",https://www.foxnews.com/media/jared-kushner-details-working-around-50-years-stupid-word-games-middle-east-ceasefire-deal,https://static.foxnews.com/foxnews.com/content/uploads/2025/10/jared-kushner-leaving.jpg,2025-10-20T01:08:18Z,"President Donald Trumps son-in-law, Jared Kushner, dove into details on Sunday's ""60 Minutes"" about negotiating the Gaza ceasefire deal and peace, following decades of ""stupid word games"" in the regi… [+2860 chars]",fox-news,Fox News
,Actor Robert de Niro surprises MSNBC panel with f-bomb on live TV,"Actor Robert De Niro dropped a surprise f-bomb on MSNBC’s “The Weekend"" while promoting the nationwide “No Kings"" protests against President Donald Trump.",https://www.foxnews.com/media/actor-robert-de-niro-surprises-msnbc-panel-f-bomb-live-tv,https://static.foxnews.com/foxnews.com/content/uploads/2025/10/robert-de-niro-actor.jpg,2025-10-20T01:00:59Z,"Actor Robert De Niro surprised MSNBCs ""The Weekend"" panel after dropping an f-bomb during Sundays show while describing Democratic pushback against President Donald Trump.
De Niro appeared on the sh… [+2166 chars]",fox-news,Fox News
,"NFL Week 7 scores: Eagles, Broncos get impressive victories",NFL Week 7 is nearly in the books and the fans were able to watch a few nail-biting games on Sunday with the Philadelphia Eagles and Denver Broncos picking up wins.,https://www.foxnews.com/sports/nfl-week-7-scores-eagles-broncos-get-impressive-victories,https://static.foxnews.com/foxnews.com/content/uploads/2025/10/nfl-eagles-jalen-hurts-101925-1.jpg,2025-10-20T00:51:02Z,"The dust has nearly settled in the seventh week of the 2025 NFL season and there were some massive games on the docket that saw Super Bowl contenders pick up huge victories.
Two teams that came to m… [+1588 chars]",fox-news,Fox News
,Broncos erase 19-point deficit to shock Giants behind Bo Nix's 4 touchdowns,"Denver Broncos quarterback Bo Nix engineered a comeback victory in the fourth quarter against the New York Giants on Sunday evening, 33-32.",https://www.foxnews.com/sports/broncos-erase-19-point-deficit-shock-giants-behind-bo-nixs-4-touchdowns,https://static.foxnews.com/foxnews.com/content/uploads/2025/10/nfl-broncos-bo-nix-101925-1.jpg,2025-10-20T00:08:57Z,"The Denver Broncos were punched in the mouth, but they were never knocked out.
Second-year quarterback Bo Nix led Denver to a 33-point fourth quarter and guided the Broncos on a 19-point comeback vi… [+2361 chars]",fox-news,Fox News
,Brandy abruptly ends concert mid-performance due to dehydration,"Brandy walked off stage during her Chicago concert at United Center due to health issues, never returning to complete her performance on ""The Boy is Mine"" tour.",https://www.foxnews.com/entertainment/brandy-abruptly-ends-concert-mid-performance-dehydration,https://static.foxnews.com/foxnews.com/content/uploads/2025/10/brandy-norwood.jpg,2025-10-20T00:08:23Z,"Brandy walked off the stage Saturday during the Chicago stop of ""The Boy is Mine"" tour due to health issues.
In videos shared on social media, Brandy told the crowd at the United Center that she nee… [+2221 chars]",fox-news,Fox News
,"Christian McCaffrey's offensive explosion, 49ers' defense help stymie Falcons in win",San Francisco 49ers star running back Christian McCaffrey dominated the Atlanta Falcons' defense while the NFC South team's offense had no answers.,https://www.foxnews.com/sports/christian-mccaffreys-offensive-explosion-49ers-defense-help-stymie-falcons-win,https://static.foxnews.com/foxnews.com/content/uploads/2025/10/nfl-49ers-christian-mccaffrey-101925-1.jpg,2025-10-20T03:29:22Z,"Christian McCaffrey and the San Francisco 49ers defense had a night.
The star running back had 201 yards from scrimmage and two touchdowns as San Francisco topped the Atlanta Falcons, 20-10, on Sund… [+1642 chars]",fox-news,Fox News
,Blue Jays force Game 7 with crucial win over Mariners,The Toronto Blue Jays forced a Game 7 in the American League Championship Series on Sunday night with a huge win over the Seattle Mariners.,https://www.foxnews.com/sports/blue-jays-force-game-7-crucial-win-over-mariners,https://static.foxnews.com/foxnews.com/content/uploads/2025/10/mlb-blue-jays-101925-1.jpg,2025-10-20T03:01:25Z,"The Toronto Blue Jays are still alive.
Toronto jumped out to a 4-0 lead in Game 6 of the American League Championship Series against the Seattle Mariners and never looked back. Toronto won the game,… [+1821 chars]",fox-news,Fox News
,Sharon Osbourne mourns loss of beloved dog Elvis two months after husband Ozzy's death,"Television personality Sharon Osbourne mourns the loss of her dog Elvis, who passed away this week after giving her 14 precious years of companionship.",https://www.foxnews.com/entertainment/sharon-osbourne-mourns-loss-beloved-dog-elvis-two-months-husband-ozzys-death,https://static.foxnews.com/foxnews.com/content/uploads/2025/10/sharon-osbourne.jpg,2025-10-20T02:58:25Z,"Sharon Osbourne is grieving the loss of her ""darling"" dog Elvis.
The former talk show host announced the death of her pet pooch in an Instagram post shared with her millions of followers Sunday afte… [+2025 chars]",fox-news,Fox News
,"Trump reacts to 'No Kings' protests by saying 'I'm not a king, I work my ass off'","Trump calls global No Kings Day protests 'a joke,' tells reporters he's 'not a king' and works hard for America after weekend demonstrations.",https://www.foxnews.com/politics/trump-reacts-no-kings-protests-saying-im-not-king-i-work-my-ass-off,https://static.foxnews.com/foxnews.com/content/uploads/2025/10/los-angeles-anti-trump-protest-fox-news.jpg,2025-10-20T02:07:55Z,"President Donald Trump reacted Sunday night to global ""No Kings Day"" protesters who filled streets around the world a day earlier, saying he is not a king and works his ""ass off to make our country g… [+2253 chars]",fox-news,Fox News
,"DAN GAINOR: The England we love is lost. If we don’t change, America will be, too","British Prime Minister Keir Starmer faces criticism as England grapples with terror attacks, mass protests and cultural changes that could foreshadow America's future.",https://www.foxnews.com/opinion/dan-gainor-england-we-love-lost-we-dont-change-america-be-too,https://static.foxnews.com/foxnews.com/content/uploads/2025/10/london-free-palestine.jpg,2025-10-20T09:00:44Z,"I went to England on a history vacation. It turned into an archaeological expedition, uncovering the bones of a once-great civilization. 
All the tourist sites are still there. You can still see the… [+5864 chars]",fox-news,Fox News
,The big money takeover is wrecking college sports. It doesn't have to be that way,Rep. Michael Baumgartner raises concerns about the future of sports and education as hedge funds gain influence over college athletics through private capital deals.,https://www.foxnews.com/opinion/big-money-takeover-wrecking-college-sports-doesnt-have-way,https://static.foxnews.com/foxnews.com/content/uploads/2024/11/james-franklin-1.jpg,2025-10-20T09:00:34Z,"College sports are being re-engineered in real time not by coaches, campus leaders or even Congress, but by hedge funds. The Big Ten is advancing a multibillion-dollar private-capital deal that would… [+5446 chars]",fox-news,Fox News
,I’ve been a college president and higher education needs to embrace diversity of beliefs,American universities must balance academic freedom with responsibility while addressing ongoing campus disruptions and restoring order after years of protests.,https://www.foxnews.com/opinion/ive-been-college-president-higher-education-needs-embrace-diversity-beliefs,https://static.foxnews.com/foxnews.com/content/uploads/2025/10/rutgers-campus-sign.jpg,2025-10-20T09:00:22Z,"""The hostages are back."" 
This simple declaration, delivered by President Donald Trump in his Oct. 13 speech in Jerusalem, is more than a mere statement of fact. It is a historic and much-needed rep… [+5678 chars]",fox-news,Fox News
,Vikings' TJ Hockenson rips NFL officials after TD catch was overturned,Minnesota Vikings tight end T.J. Hockenson was upset with NFL officials' decision to overturn his touchdown catch in a crucial moment on Sunday.,https://www.foxnews.com/sports/vikings-tj-hockenson-rips-nfl-officials-after-td-catch-overturned,https://static.foxnews.com/foxnews.com/content/uploads/2025/10/nfl-vikings-tj-hockenson-101925-2.jpg,2025-10-20T11:27:26Z,"Minnesota Vikings tight end T.J. Hockenson was upset with his touchdown catch being overturned in the 28-22 loss to the Philadelphia Eagles on Sunday afternoon.
Hockenson thought he had a crucial to… [+1969 chars]",fox-news,Fox News
,"Trump calls Jay Jones an 'animal,' says 'anybody would be put in prison for what he said'",President Donald Trump called Virginia Democratic attorney general nominee Jay Jones an 'animal' over text messages wishing death on political opponents.,https://www.foxnews.com/politics/trump-calls-jay-jones-animal-says-anybody-would-put-prison-what-he-said,https://static.foxnews.com/foxnews.com/content/uploads/2025/10/donald-trump-air-force-one.jpg,2025-10-20T11:15:24Z,"President Donald Trump condemned Virginia Democratic attorney general nominee Jay Jones
 as an ""animal"" on Sunday, saying anyone else would find themselves ""in prison"" for his text messages wishing … [+3036 chars]",fox-news,Fox News
,'Brazen' thieves rob Louvre of crown jewels in 'targeted heist' and more top headlines,Get all the stories you need-to-know from the most powerful name in news delivered first thing every morning to your inbox.,https://www.foxnews.com/us/brazen-thieves-rob-louvre-crown-jewels-targeted-heist-more-top-headlines,https://static.foxnews.com/foxnews.com/content/uploads/2025/10/louvre-musuem-paris-file.jpg,2025-10-20T11:13:16Z,"Good morning and welcome to Fox News' morning newsletter, Fox News First. And here's what you need to know to start your day ...
TOP 3
1. 'Brazen' thieves rob Louvre of crown jewels in 'targeted he… [+3283 chars]",fox-news,Fox News
,"Letitia James up against 'by the book' prosecutor 'who means business,' former Kentucky AG Cameron says","Daniel Cameron applauds prosecutor Lindsay Halligan's handling of Letitia James' indictment, calling it proper law enforcement rather than political weaponization.",https://www.foxnews.com/politics/prosecutor-letitia-james-case-means-business-cut-dry-case-former-state-ag,https://static.foxnews.com/foxnews.com/content/uploads/2025/10/halligan-cameron.jpg,2025-10-20T11:00:48Z,Former Republican Kentucky Attorney General Daniel Cameron applauded the prosecutor handling Democratic New York Attorney General Letitia James' indictment on charges of bank fraud and making false s… [+9128 chars],fox-news,Fox News
,‘America First’ attorney general distances himself from McConnell — his former boss — as Kentucky race defines GOP future,"Former attorney general Daniel Cameron is campaigning for the Republican primary to replace Sen. Mitch McConnell in Kentucky, as multiple candidates claim to be the ""America First"" option.",https://www.foxnews.com/politics/america-first-attorney-general-distances-himself-from-mcconnell-his-former-boss-kentucky-race-defines-gop-future,https://static.foxnews.com/foxnews.com/content/uploads/2025/10/daniel-cameron-kentucky.png,2025-10-20T11:00:47Z,"EXCLUSIVE: Former Kentucky Attorney General Daniel Cameron once a protégé of Sen. Mitch McConnell is now running to replace him, casting himself as an unapologetic ""America First"" conservative unafra… [+4718 chars]",fox-news,Fox News
,Cheryl Hines refused RFK Jr.'s offer to fake separation during heated presidential campaign,"In her new memoir, ""Unscripted,"" Cheryl Hines discusses the dramatic moments and tells Fox News Digital the emotional toll of Robert F. Kennedy Jr.'s 2024 presidential campaign.",https://www.foxnews.com/entertainment/cheryl-hines-rfk-jr-fake-separation-presidential-campaign,https://static.foxnews.com/foxnews.com/content/uploads/2025/10/rfk-jr-cheryl-hines.jpg,2025-10-20T11:00:45Z,"Cheryl Hines is shedding light on the intense and sometimes extreme moments that defined her life with presidential candidate Robert F. Kennedy Jr. during his 2024 campaign.
Hines revealed that at o… [+4722 chars]",fox-news,Fox News
,"Even small amounts of alcohol linked to higher dementia risk in older adults, study shows","Genetic analysis reveals people with higher alcohol consumption have 15-16% greater dementia risk, suggesting reducing alcohol intake could prevent cognitive decline.",https://www.foxnews.com/health/even-small-amounts-alcohol-linked-higher-dementia-risk-older-adults-study-shows,https://static.foxnews.com/foxnews.com/content/uploads/2025/10/older-woman-drinking-wine.jpg,2025-10-20T11:00:22Z,"Even small amounts of alcohol consumption could put older adults at a higher risk of dementia.
Thats according to a recent study led by the University of Oxford in the U.K. in collaboration with Yal… [+6013 chars]",fox-news,Fox News
,'Goofballs' and hostages: GOP senators say Schumer's shutdown tactics destroying the Senate,Senate Republicans worry that Senate Democrats are creating a new blueprint for future funding fights but aren't ready to negotiate with on demands until after the government reopens.,https://www.foxnews.com/politics/goofballs-hostages-gop-senators-say-schumers-shutdown-tactics-destroying-senate,https://static.foxnews.com/foxnews.com/content/uploads/2025/10/schumer-shutdown-trap.jpg,2025-10-20T11:00:17Z,"Senate Republicans are worried about the precedent that Senate Democrats have set for future funding fights as the shutdown continues into its 20th day.
Senate Minority Leader Chuck Schumer, D-N.Y.,… [+4124 chars]",fox-news,Fox News
,"Hong Kong cargo plane skids off runway, killing two","Hong Kong airport experienced its worst disaster in decades when a Boeing 737 cargo jet crashed into a security patrol vehicle, killing two officers.",https://www.foxnews.com/world/hong-kong-cargo-plane-skids-runway-killing-two,https://static.foxnews.com/foxnews.com/content/uploads/2025/10/hong-kong-airport.jpg,2025-10-20T10:31:25Z,"Two airport security officers in Hong Kong were killed early Monday after a cargo jet arriving from Dubai veered off the runway during landing and slammed into a patrol vehicle, authorities said.
Th… [+306 chars]",fox-news,Fox News
,Bari Weiss reportedly 'stunned' '60 Minutes' crew by asking why the country thinks they're 'biased': report,"The New York Times released a report on Sunday about an alleged meeting between CBS News editor-in-chief Bari Weiss and the staff behind CBS’ “60 Minutes.""",https://www.foxnews.com/media/bari-weiss-reportedly-stunned-60-minutes-crew-asking-why-country-thinks-theyre-biased-report,https://static.foxnews.com/foxnews.com/content/uploads/2025/09/bari-weiss-november-2024.jpg,2025-10-20T10:30:37Z,"CBS News editor-in-chief Bari Weiss allegedly ""stunned"" the staff behind CBS ""60 Minutes"" by asking them why they believed people considered them biased, a new report claimed Sunday.
New York Times … [+2556 chars]",fox-news,Fox News
,"Archaeologists unearth ancient bishop's lavish bathhouse, shedding light on early Christian life","Archaeologists recently discovered a 2,150-square-foot Byzantine bishop's bathhouse in ancient Olympus, Turkey, dating back to the 5th-6th centuries A.D.",https://www.foxnews.com/travel/archaeologists-unearth-ancient-bishops-lavish-bathhouse-shedding-light-christian-life,https://static.foxnews.com/foxnews.com/content/uploads/2025/10/turkey-bishops-bathhouse-found-christianity-history-archaeology-1.jpg,2025-10-20T10:00:29Z,"Archaeologists recently discovered the remnants of an ancient bishop's luxury a vast bathhouse, unheard of among modern clergy.
The discovery was made in Olympus, an ancient Lycian port city in the … [+2119 chars]",fox-news,Fox News
,Is Trump’s ‘heat’ on Venezuela the start of a wider campaign for regime change?,Experts and some lawmakers suspect that Trump's quest targeting alleged drug boats in the Caribbean is designed to exert pressure on Venezuelan President Nicolás Maduro so he's ousted.,https://www.foxnews.com/politics/trumps-heat-venezuela-start-wider-campaign-regime-change,https://static.foxnews.com/foxnews.com/content/uploads/2025/10/venezuela-strikes-maduro.jpg,2025-10-20T10:00:29Z,"President Donald Trump said he believes Venezuela is ""feeling heat"" amid his administrations war against alleged drug boats in the Caribbean, which has taken out at least two vessels in just the past… [+6117 chars]",fox-news,Fox News
,"'AI Homeless Man' TikTok prank sparks parental panic, juvenile arrests","A viral TikTok trend called the “AI Homeless Man Prank"" is sparking parental panic and police warnings with users sending AI-generated images of homeless men inside their homes.",https://www.foxnews.com/media/ai-homeless-man-tiktok-prank-sparks-parental-panic-juvenile-arrests,https://static.foxnews.com/foxnews.com/content/uploads/2025/10/police-response-to-tiktok-prank.png,2025-10-20T10:00:22Z,"A viral TikTok trend known as the ""AI Homeless Man Prank"" is spurring parental panic and prompting police response across the country, as users create AI-altered images showing a homeless man inside … [+2388 chars]",fox-news,Fox News
,Democrat mayor's 'gaslighting' amid serial killer fears called out by grieving family,"Houston officials face mounting pressure as 16 bodies have been pulled from the city's bayous this year, sparking debate over whether a serial killer is targeting victims.",https://www.foxnews.com/us/democrat-mayors-gaslighting-amid-serial-killer-fears-called-out-grieving-family,https://static.foxnews.com/foxnews.com/content/uploads/2025/10/houston-bayou-victim-kenneth-cutting-jr.png,2025-10-20T10:00:09Z,"There's something beneath the surface of Houstons waters, as city police pull body after body from the bayous. Now one family is demanding answers about how a 22-year-old ended up dead with no wounds… [+5884 chars]",fox-news,Fox News
,Reporter's Notebook: Government shutdown stalls as Democrats demand Obamacare subsidy extension,"Republicans and Democrats battle over healthcare subsidies in shutdown negotiations, with premium increases affecting millions of Americans on Obamacare exchanges.",https://www.foxnews.com/politics/reporters-notebook-government-shutdown-stalls-democrats-demand-obamacare-subsidy-extension,https://static.foxnews.com/foxnews.com/content/uploads/2025/10/senate-minority-leader-chuck-schumer-1.jpg,2025-10-20T13:56:27Z,"Government shutdowns can be pretty boring.
Until a shutdown impacts you.
Theres a missed paycheck. Flight delays. You cant visit the Smithsonian. Questions about food and drug safety.
You get the … [+8147 chars]",fox-news,Fox News
,"Warren McVea, Super Bowl champion and pioneer football player, dead at 79","Warren McVea, a former Kansas City Chiefs running back and trailblazer in Texas college football, has died, his family said on Sunday. He was 79.",https://www.foxnews.com/sports/warren-mcvea-super-bowl-champion-pioneer-football-player-dead-79,https://static.foxnews.com/foxnews.com/content/uploads/2025/10/nfl-chiefs-warren-mcvea-102025-2.jpg,2025-10-20T13:51:21Z,"Warren McVea, a former NFL running back who won a Super Bowl and a pioneer in Texas football, has died, his family said Sunday. He was 79.
Tracey Ellis, McVeas daughter, said her father died at home… [+1594 chars]",fox-news,Fox News
,Prince Andrew being investigated for allegedly asking bodyguard to get accuser’s personal information: report,Prince Andrew reportedly faces Metropolitan Police investigation for allegedly asking his taxpayer-funded protection officer to obtain personal information about Virginia Giuffre.,https://www.foxnews.com/entertainment/prince-andrew-being-investigated-allegedly-asking-bodyguard-get-accusers-personal-information-report,https://static.foxnews.com/foxnews.com/content/uploads/2025/10/prince-andrew-met-police-investigation.jpg,2025-10-20T13:37:21Z,Prince Andrew is reportedly being investigated by the Metropolitan Police for allegedly asking one of his taxpayer-funded personal protection officers to obtain personal information about Virginia Gi… [+4983 chars],fox-news,Fox News
,Jayden Daniels' mom demands fans to 'stop manifesting' former NFL star after latest injury,The mother of Washington Commanders star Jayden Daniels implored fans to stop comparing her son to former NFL quarterback Robert Griffin III.,https://www.foxnews.com/sports/jayden-daniels-mom-demands-fans-stop-manifesting-former-nfl-star-after-latest-injury,https://static.foxnews.com/foxnews.com/content/uploads/2025/10/nfl-commanders-jayden-daniels-102025-2.jpg,2025-10-20T13:11:33Z,"Washington Commanders quarterback Jayden Daniels left Sundays loss to the Dallas Cowboys early after he suffered a hamstring injury in the third quarter.
The injury prompted fans to compare the seco… [+1476 chars]",fox-news,Fox News
,"Democratic Houston mayor slams Mamdani, says they're in 'different universes'","Houston Mayor John Whitmire, a Democrat, called out New York City mayoral candidate Zohran Mamdani in an interview with The New York Times published Sunday.",https://www.foxnews.com/media/democratic-houston-mayor-slams-mamdani-says-theyre-different-universes,https://static.foxnews.com/foxnews.com/content/uploads/2025/10/mayor-john-whitmore.jpg,2025-10-20T13:02:24Z,"Democratic Houston Mayor John Whitmire slammed New York City mayoral frontrunner Zohran Mamdani during an interview published Sunday, saying the two were from different universes.
The mayor said Mam… [+1797 chars]",fox-news,Fox News
,House GOP announces $24M cash haul as government shutdown drags on,The House GOP's campaign arm is announcing its latest fundraising numbers for the third quarter of 2025 as it ramps up for the 2026 elections.,https://www.foxnews.com/politics/house-gop-announces-24m-cash-haul-government-shutdown-drags,https://static.foxnews.com/foxnews.com/content/uploads/2025/10/mike-johnson-shutdown-press-conference.jpg,2025-10-20T13:00:53Z,"FIRST ON FOX: House Republicans' campaign arm is announcing it brought in nearly $24 million in the months of July through September this year.
More than half of that roughly $13.95 million came in … [+2937 chars]",fox-news,Fox News
,"Trump returns to DC as dim outlook lingers, no end in sight for shutdown","President Donald Trump blames Democrats for the federal government shutdown entering its third week, as the political stalemate continues over health care subsidies.",https://www.foxnews.com/politics/trump-returns-dc-shutdown-drags-on-faces-deepening-health-care-stalemate,https://static.foxnews.com/foxnews.com/content/uploads/2025/10/trump-cloudy-air-force-one.png,2025-10-20T13:00:26Z,"With the federal government still closed, President Donald Trump
 begins the week back from Florida at the center of a political stalemate that shows no signs of easing.
The standoff, now dragging … [+1765 chars]",fox-news,Fox News
,"Trump doubles down on Colombia crackdown, calls Petro ‘lunatic,’ vows to end all US payments over drugs",Trump threatens tariffs against Colombia as tensions escalate with President Gustavo Petro over cocaine trafficking and drug war cooperation.,https://www.foxnews.com/politics/trump-doubles-down-colombia-crackdown-calls-petro-lunatic-vows-end-all-us-payments-over-drugs,https://static.foxnews.com/foxnews.com/content/uploads/2025/10/9906d6f1-trump-air-force-one.jpg,2025-10-20T12:27:58Z,"President Donald Trump on Sunday doubled down on his criticism of Colombia, calling its far-left president, Gustavo Petro, a ""lunatic"" and the ""worst president theyve ever had"" as he reiterated his v… [+4861 chars]",fox-news,Fox News
,New details revealed after Marine Corps live-fire round hits patrol car near Camp Pendleton,California Highway Patrol releases report on artillery mishap that struck patrol car during Marine Corps anniversary celebration attended by Vice President JD Vance.,https://www.foxnews.com/us/new-details-revealed-after-marine-corps-live-fire-round-hits-patrol-car-near-camp-pendleton,https://static.foxnews.com/foxnews.com/content/uploads/2025/10/jd-vance-camp-pendleton-california-highway-patrol-shrapnel.jpg,2025-10-20T12:20:15Z,"In a newly released report from the California Highway Patrol (CHP), new details have been revealed about the live-fire mishap involving a patrol vehicle near Camp Pendleton during Vice President JD … [+1782 chars]",fox-news,Fox News
