author,title,description,url,urlToImage,publishedAt,content,source.id,source.name
Brie Stimson,US says China blocking return of American passenger jets amid coronavirus rules,"The Trump administration late Friday accused China of blocking U.S. passenger flights into the country amid coronavirus restrictions, according to a report.",https://www.foxnews.com/politics/us-says-china-blocking-return-of-american-passenger-jets-amid-coronavirus-rules,https://static.foxnews.com/foxnews.com/content/uploads/2020/04/iStock-962445754.jpg,2020-05-23T10:40:40Z,"Get all the latest news on coronavirus and more delivered daily to your inbox. Sign up here.
The Trump administration late Friday accused China of blocking U.S. passenger flights into the country am… [+2352 chars]",fox-news,Fox News
Richard Fowler,"Richard Fowler: Biden isn’t a racist, despite his ‘you ain’t black’ comment and claims by Republicans",A rhetorical slip by former Vice President Joe Biden in an interview with a black radio talk show host Friday is being blown out of all proportion by supporters of President Trump in an effort to score political points.,https://www.foxnews.com/opinion/richard-fowler-biden-isnt-a-racist-despite-his-you-aint-black-comment-and-claims-by-republicans,https://cf-images.us-east-1.prod.boltdns.net/v1/static/694940094001/afaa41bc-2fe9-400f-8b61-941c135864d8/35ab2f16-ed64-41f5-97d0-870d765d30d1/1280x720/match/image.jpg,2020-05-23T10:00:57Z,"Get all the latest news on coronavirus and more delivered daily to your inbox.  Sign up here. 
Black Americans face many problems today – disproportionate deaths and job losses caused by the coronav… [+5619 chars]",fox-news,Fox News
Melissa Roberto,Brandi Glanville claims she sprays her kids with bleach water when they enter the house,Brandi Glanville revealed she sprays her kids with bleach when they enter her house.,https://www.foxnews.com/entertainment/brandi-glanville-sprays-kids-bleach-water,https://static.foxnews.com/foxnews.com/content/uploads/2018/10/Brandi-Glanville-Getty-2018.jpg,2020-05-23T13:58:52Z,"Get all the latest news on coronavirus and more delivered daily to your inbox.  Sign up here. 
Brandi Glanville has admitted she’s a bit of a clean freak when it comes to keeping her house germ-free… [+3253 chars]",fox-news,Fox News
Associated Press,Naomi Osaka tops Serena Williams on Forbes' list of sports annual earnings,Naomi Osaka has been a Grand Slam champion and No. 1 in the WTA rankings -- and now she’s No. 1 on another list: top-earning female athlete.,https://www.foxnews.com/sports/naomi-osaka-serena-williams-forbes-sports-annual-earnings,https://static.foxnews.com/foxnews.com/content/uploads/2020/05/Naomi-Osaka-Serena-Williams-AP.jpg,2020-05-23T13:36:12Z,"Naomi Osaka has been a Grand Slam champion and No. 1 in the WTA rankings -- and now she’s No. 1 on another list: top-earning female athlete.
According to a story posted on Forbes.com on Friday, the … [+924 chars]",fox-news,Fox News
Associated Press,"SEC, Big 12 to allow football workouts on campus next month","Southeastern Conference schools will be able to bring athletes in all sports back to campus for voluntary activities starting June 8 at the discretion of each university, and the Big 12 plans to welcome football players back to campus a week later.",https://www.foxnews.com/sports/sec-big-12-football-workouts-campus,https://static.foxnews.com/foxnews.com/content/uploads/2020/04/Joe-Burrow15.jpg,2020-05-23T13:24:35Z,"Southeastern Conference schools will be able to bring athletes in all sports back to campus for voluntary activities starting June 8 at the discretion of each university, and the Big 12 plans to welc… [+5283 chars]",fox-news,Fox News
Robert Gearty,Long Island cops announce new break in Gilgo Beach serial killer case,Detectives in the Gilgo Beach serial killer cold case on Long Island have announced a major break in the case.,https://www.foxnews.com/us/long-island-cold-case-cops-announce-new-break-in-gilgo-beach-serial-killer-case,https://static.foxnews.com/foxnews.com/content/uploads/2020/05/Gilgo-Beach-Getty.jpg,2020-05-23T13:24:15Z,"Detectives trying to solve the Gilgo Beach slayings on Long Island have announced a major break in the case.
A victim known as ""Jane Doe #6"" has been identified using DNA and genetic genealogy, the … [+1714 chars]",fox-news,Fox News
Adam Shaw,NAACP pushes back on Biden’s claim it endorsed him after ‘you ain’t black’ furor,The NAACP on Friday pushed back on a claim by presumptive Democratic nominee Joe Biden that the civil rights organization had endorsed him “every time I’ve run” -- stating that the group never endorses any political candidate.,https://www.foxnews.com/politics/naacp-pushes-back-biden-endorsement-you-aint-black,https://cf-images.us-east-1.prod.boltdns.net/v1/static/694940094001/a8c8f11f-45ee-4871-afb5-ff7eff085332/17965083-e940-4048-9006-06dad646a4ba/1280x720/match/image.jpg,2020-05-23T13:14:27Z,The NAACP on Friday pushed back on a claim by presumptive Democratic nominee Joe Biden that the civil rights organization had endorsed him “every time I’ve run” -- stating that the group never endors… [+2644 chars],fox-news,Fox News
Associated Press,Mexico cancels soccer season because of coronavirus pandemic,"Mexico’s Liga MX canceled the remainder of its spring season without crowning a champion for the first time, a decision caused by the new coronavirus pandemic.",https://www.foxnews.com/sports/mexico-cancels-soccer-season-coronavirus,https://static.foxnews.com/foxnews.com/content/uploads/2020/05/Mexico-Soccer-Stadium-AP.jpg,2020-05-23T13:05:20Z,"Mexico’s Liga MX canceled the remainder of its spring season without crowning a champion for the first time, a decision caused by the new coronavirus pandemic.
Teams had played 10 of the Clausura's … [+1157 chars]",fox-news,Fox News
Julia Musto,Iraq War veteran Rob Smith says Biden's 'ain't black' comment insulted millions of African-American voters,"Joe Biden's comments alleging that African-Americans unsure about whether to support him or President Trump ""ain't black"" were shockingly offensive and erased millions of hard-working black voters, Iraq war veteran and Turning Point USA spokesman Rob Smith st…",https://www.foxnews.com/media/rob-smith-joe-biden-breakfast-club-comments-shocking,https://static.foxnews.com/foxnews.com/content/uploads/2020/04/AP20120804425025.jpg,2020-05-23T13:03:39Z,"Joe Biden's statement that African-Americans ""ain't black"" if they even consider voting for President Trump was deeply offensive, Iraq War veteran and political analyst Rob Smith said Saturday.
""The… [+2401 chars]",fox-news,Fox News
Janice Dean,"Janice Dean: Coronavirus cost my in-laws their lives. Gov. Cuomo, our vulnerable loved ones deserved better",My in-laws the Newmans are not just statistics on a chart. Michael and Dolores were wonderful people who lived important lives.,https://www.foxnews.com/opinion/janice-dean-coronavirus-in-laws-cuomo,https://cf-images.us-east-1.prod.boltdns.net/v1/static/694940094001/188c29c7-25cf-45dd-b84d-700733e0de18/727ee987-bfa7-4b17-ad85-3e3d7a715c40/1280x720/match/image.jpg,2020-05-23T13:00:42Z,"Get all the latest news on coronavirus and more delivered daily to your inbox. Sign up here.
It hit me when my kids’ school principal called. She had heard the news from another parent that our chil… [+8897 chars]",fox-news,Fox News
Ryan Tillman,Colleges left in limbo over whether to move classes online next year,Students’ ability to return back to campus this fall will directly depend on how efficiently their state reopens.,https://www.foxnews.com/us/colleges-left-in-limbo-online-classes,https://static.foxnews.com/foxnews.com/content/uploads/2020/05/University-of-Michigan-iStock.jpg,2020-05-23T12:39:55Z,"Get all the latest news on coronavirus and more delivered daily to your inbox.  Sign up here.
Higher education will continue this fall, but many colleges and universities remain uncertain of how tha… [+5109 chars]",fox-news,Fox News
Julia Musto,Michigan gym owner who defied coronavirus orders calls on America to do the same,A Michigan gym owner who defied Democratic Gov. Gretchen Whitmer's COVID-19 executive mandates explained he protested with the Open the States movement on Friday to help rally Americans to the cause.,https://www.foxnews.com/media/michigan-gym-owner-coronavirus-resistance,https://static.foxnews.com/foxnews.com/content/uploads/2020/05/JAMES.jpg,2020-05-23T12:31:50Z,"Get all the latest news on coronavirus and more delivered daily to your inbox. Sign up here.
A Michigan gym owner who defied Democratic Gov. Gretchen Whitmer'sCOVID-19 executive mandates explained w… [+2892 chars]",fox-news,Fox News
Joshua Rogers,Joshua Rogers: We promised to love each other 'for better or worse' – Here's how it turned out,"In each of our 12 years of marriage, there’s been some major, stressful event that has rattled my wife and me.",https://www.foxnews.com/opinion/love-better-or-worse-joshua-rogers,https://cf-images.us-east-1.prod.boltdns.net/v1/static/694940094001/5c99985c-425c-41dd-865d-16d5d6848067/0c70bebf-7d46-476a-b618-fb9ef37e8281/1280x720/match/image.jpg,2020-05-23T12:00:38Z,"When my wife and I stood at the altar and promised to love each other “for better or worse,” we had no idea how much of the “worse” times we would go through.
In each of our 12 years of marriage, th… [+2045 chars]",fox-news,Fox News
Melissa Roberto,Pixar's new short film 'Out' features first gay main character,"Pixar has unveiled its first gay main character in its new short film ""Out"" released on Friday.",https://www.foxnews.com/entertainment/pixar-short-out-first-gay-main-character,https://static.foxnews.com/foxnews.com/content/uploads/2020/05/Pixar-Out-PIXAR.jpg,2020-05-23T15:34:18Z,"Get all the latest news on coronavirus and more delivered daily to your inbox.  Sign up here. 
Pixar has unveiled its first gay main character in its new short film ""Out"" released on Friday.
The co… [+2125 chars]",fox-news,Fox News
Peter Aitken,"Grocery store fills salad bar with alcohol, candy during pandemic restrictions",One grocery store is making creative use of a currently underused space.,https://www.foxnews.com/food-drink/grocery-store-salad-bar-alcohol-candy,https://static.foxnews.com/foxnews.com/content/uploads/2020/05/97994709_2698412880380254_1706967140420026368_n.jpg,2020-05-23T15:32:33Z,"Get all the latest news on coronavirus and more delivered daily to your inbox. Sign up here.
A grocery store has brought “happy hour” to their signature salad bars during the coronavirus pandemic. … [+1584 chars]",fox-news,Fox News
Marisa Schultz,Returning to a new normal: Trump spends Saturday at his Virginia golf course,President Trump spent a sunny Saturday at his golf resort outside of Washington DC. in another sign that the commander-in-chief is seeking to resume his normal schedule.,https://www.foxnews.com/politics/returning-to-normal-trump-spends-saturday-at-his-golf-course,https://static.foxnews.com/foxnews.com/content/uploads/2020/05/Trump-Golfing-getty.jpg,2020-05-23T15:29:53Z,"President Trump spent a sunny Saturday at his golf resort outside Washington, D.C. in another sign that the commander-in-chief is eager to resume a normal schedule amid the coronavirus pandemic.
TRU… [+1543 chars]",fox-news,Fox News
Carrie Severino,Carrie Severino: Far-left Obama-appointed judge launches political attack on conservative Federalist Society,Many judges have political backgrounds before joining the federal bench. But the problem with Judge McConnell is that he brought his left-wing politics with him to the courthouse.,https://www.foxnews.com/opinion/carrie-severino-far-left-obama-appointed-judge-launches-political-attack-on-conservative-federalist-society,http://media.foxbusiness.com/BrightCove/854081161001/201602/2482/854081161001_4758163712001_dcd5cae5-d1b0-43b8-920d-ab271a7da60c.jpg,2020-05-23T15:00:44Z,"U.S. District Judge John McConnell is an unabashed liberal, big donor to the Democratic Party, and a longtime friend of Sen. Sheldon Whitehouse, a far-left Democrat from the judge’s home state of Rho… [+5944 chars]",fox-news,Fox News
Nicole Rabon,Why Women Are Losing More Jobs Than Men During Pandemic Downturn,"""We're Momming Today"" with Kelsey Bolar, a new mom and Senior Policy Analyst with the Independent Women's Forum about social repercussions women and families can expect when the coronavirus eases. Will more moms stay-at-home? Will more women take on new roles…",https://radio.foxnews.com/2020/05/23/why-women-are-losing-more-jobs-than-men-during-pandemic-downturn/,https://radio.foxnews.com/wp-content/uploads/2020/05/kelseybolar-1.jpg,2020-05-23T15:00:23Z,,fox-news,Fox News
Robert Gearty,San Francisco firefighters battle large warehouse fire near Fisherman's Wharf,More than 130 San Francisco firefighters battled a large fire that broke out early Saturday at a warehouse near landmark Fisherman’s Wharf.,https://www.foxnews.com/us/san-francisco-firefighters-battle-large-warehouse-fire-near-fishermans-wharf,https://static.foxnews.com/foxnews.com/content/uploads/2020/05/Pier-45-Fire-SF-FIRE-DEPT-3.jpg,2020-05-23T14:54:00Z,"More than 130 San Francisco firefighters battled a large fire that broke out early Saturday at a warehouse near landmark Fisherman’s Wharf.
The fire was reported around 4:30 a.m. local time at Pier … [+1017 chars]",fox-news,Fox News
Associated Press,NHLPA approves going forward with 24-team playoff talks,"The NHL Players’ Association's executive committee authorized moving forward in talks with the league on returning to play from the coronavirus suspension, approving 24 teams making the playoffs with other aspects still to be negotiated",https://www.foxnews.com/sports/nhlpa-approves-24-team-playoff-talks,https://static.foxnews.com/foxnews.com/content/uploads/2020/03/NHL-net.jpg,2020-05-23T14:46:25Z,"The NHL Players’ Association's executive committee authorized moving forward in talks with the league on returning to play from the coronavirus suspension, approving 24 teams making the playoffs with… [+5158 chars]",fox-news,Fox News
Peter Aitken,"Father of patient who beat elderly man at Detroit nursing home says son shouldn't have been there, suffers from mental issues",New details provide more context behind the brutal video that has gone viral.,https://www.foxnews.com/us/patient-beat-elderly-man-suffers-mental-issues,https://static.foxnews.com/foxnews.com/content/uploads/2020/05/Westwood-Nursing-Center-GOOGLE-MAPS.jpg,2020-05-23T14:35:37Z,"Get all the latest news on coronavirus and more delivered daily to your inbox. Sign up here.
The father of a man captured on video beating up a Detroit nursing home resident has claimed that his son… [+2152 chars]",fox-news,Fox News
Julia Musto,Fmr. Acting AG Matt Whitaker says FBI launching review of Michael Flynn probe was 'obviously a good move',"FBI Director Christopher Wray's decision to order an internal review of the bureau's investigation into ex-Trump national security adviser Michael Flynn was ""obviously a good move,"" former Acting Attorney General Matt Whitaker asserted Saturday.",https://www.foxnews.com/media/matt-whitaker-fbi-review-flynn-investigation,https://static.foxnews.com/foxnews.com/content/uploads/2020/05/c53d7d33-image.jpg,2020-05-23T14:30:03Z,"FBI Director Christopher Wray's decision to order an internal review of the bureau's investigation into Michael Flynn was ""obviously a good move,"" former Acting Attorney General Matt Whitaker asserte… [+2746 chars]",fox-news,Fox News
Robert Gearty,Search for missing Colorado mom leads authorities to riverfront property,The search for a missing Colorado woman took investigators to a riverfront property where construction was taking place.,https://www.foxnews.com/us/search-for-missing-colorado-mom-suzanne-morphew-leads-to-riverfront-property,https://static.foxnews.com/foxnews.com/content/uploads/2020/05/suzanne.jpg,2020-05-23T14:09:22Z,"The search for a missing Colorado woman took investigators to a riverfront property where construction was taking place.
Suzanne Morphew, 49, disappeared after going on a bike ride on Mother’s Day.… [+1356 chars]",fox-news,Fox News
Julia Musto,Joe Piscopo says it's time for America to fully reopen: 'You can't take the rights of the people away',"It's time for America to reopen its doors once again, New Jersey comedian and co-owner of Retro Fitness Joe Piscopo urged Saturday.",https://www.foxnews.com/media/joe-piscopo-time-for-america-to-fully-reopen,https://static.foxnews.com/foxnews.com/content/uploads/2020/05/27590be1-image.jpg,2020-05-23T14:03:59Z,"Get all the latest news on coronavirus and more delivered daily to your inbox. Sign up here.
It's time for America to reopen its doors once again, New Jersey comedian and co-owner of Retro Fitness J… [+2317 chars]",fox-news,Fox News
Jessica Smartt,Jessica Smartt: Coronavirus -- How your kids remember this time in history depends on you,We parents are the lens through which our children interpret reality. And that means…you guessed it…COVID-19 is our moment.,https://www.foxnews.com/opinion/coronavirus-kids-history-jessica-smartt,https://static.foxnews.com/foxnews.com/content/uploads/2020/04/spain-children-lockdown2.jpg,2020-05-23T14:00:07Z,A few months ago the kids and I were eating sandwiches when my phone blared with a warning: a tornado was on the ground ten miles away. We didn’t know how bad or how big; we only knew it was heading … [+5253 chars],fox-news,Fox News
Robert Gearty,"Missing Ohio woman, 18, found safe: Left to 'start a new life'",An 18-year-old Ohio woman was been found safe Saturday six days after her mother reported her missing.,https://www.foxnews.com/us/missing-ohio-woman-18-found-safe-left-to-start-a-new-life,https://static.foxnews.com/foxnews.com/content/uploads/2020/05/Madison-Bell-Ross-County-Sheriff-1.jpg,2020-05-23T17:51:20Z,"An 18-year-old Ohio woman was found safe Saturday six days after her mother reported her missing.
Madison Bell, of Greenfield, disappeared after telling her mother she was going to a tanning salon t… [+1005 chars]",fox-news,Fox News
Julia Musto,Ohio Gov. Mike DeWine says careful reopening process showing positive results,"The careful reopening process in Ohio has shown positive results, Republican Gov. Mike DeWine reported Saturday.",https://www.foxnews.com/media/mike-dewine-coronavirus-reopening-process,https://static.foxnews.com/foxnews.com/content/uploads/2020/05/b3530ec9-image.jpg,2020-05-23T17:30:20Z,"Get all the latest news on coronavirus and more delivered daily to your inbox. Sign up here.
The careful reopening process in Ohio has shown positive results, Republican Gov. Mike DeWine reported Sa… [+2445 chars]",fox-news,Fox News
Peter Aitken,Boris Johnson resists calls to fire top aide who drove 250 miles to visit parents during lockdown,Johnson defended the actions of an aid who defied lockdown measures to visit the other end of the country.,https://www.foxnews.com/world/johnson-resists-fire-aide-during-lockdown,https://static.foxnews.com/foxnews.com/content/uploads/2020/05/Dominic-Cummings-REUTERS.jpg,2020-05-23T17:20:47Z,"Get all the latest news on coronavirus and more delivered daily to your inbox. Sign up here.
British Prime Minister Boris Johnson is resisting calls to fire his top advisor after the man drove 250 m… [+2809 chars]",fox-news,Fox News
Melissa Roberto,Nick Cordero's wife says he's 'defying odds' following setback in coronavirus fight,Nick Cordero's wife shared a positive update on Friday in the actor's ongoing battle with the novel coronavirus.,https://www.foxnews.com/entertainment/nick-cordero-wife-defying-odds-coronavirus,https://static.foxnews.com/foxnews.com/content/uploads/2020/04/Nick-Cordero.jpg,2020-05-23T17:20:01Z,"Get all the latest news on coronavirus and more delivered daily to your inbox.  Sign up here.
Nick Cordero's wife shared a positive update on Friday in the actor's ongoing battle with the novel coro… [+1882 chars]",fox-news,Fox News
Sam Dorman,NASA astronaut touts 'great partnership' with SpaceX ahead of historic launch,"Astronaut Rex Walheim expressed confidence in NASA's partnership with SpaceX, indicating that the public-private partnership would help the U.S. reach new frontiers in space.",https://www.foxnews.com/media/nasa-astronaut-walheim-spacex,https://static.foxnews.com/foxnews.com/content/uploads/2020/05/Rex-Walheim-FOX.jpg,2020-05-23T17:17:01Z,"Astronaut Rex Walheim on Saturday expressed confidence that NASA's partnership with SpaceX will help the U.S. reach new frontiers in space.
Fox News host Neil Cavuto asked Walheim whether he thought… [+2224 chars]",fox-news,Fox News
Julia Musto,Darrell Issa sues California over 'unconstitutional' November vote election,"California Democratic Gov. Gavin Newsom's executive order for an all mail-in ballot election is unconstitutional and signals possible manipulation ahead of November, Congressman Darrell Issa, R-Calif., asserted Saturday.",https://www.foxnews.com/media/rep-darrell-issa-suing-over-californias-unconstitutional-vote-by-mail-order,https://static.foxnews.com/foxnews.com/content/uploads/2020/05/bae8efef-image.jpg,2020-05-23T16:43:06Z,"CaliforniaGov. Gavin Newsom's executive order mandating a vote-by-mail election in November is unconstitutional and must be stopped, Republican congressional candidate.Darrell Issa asserted Saturday.… [+3242 chars]",fox-news,Fox News
Robert Gearty,"Missouri hairstylist went to work with coronavirus symptoms, exposed 91 clients, co-workers: officials",Missouri health officials have issued a public warning after a hairstylist exposed 91 people to the coronavirus at a hair salon.,https://www.foxnews.com/us/missouri-hairstylist-went-to-work-with-coronavirus-symptoms-exposed-91-clientsm-co-workers-officials,https://static.foxnews.com/foxnews.com/content/uploads/2020/05/Great-Clips-GOOGLE-MAPS.jpg,2020-05-23T16:36:16Z,"Get all the latest news on coronavirus and more delivered daily to your inbox. Sign up here.
Missouri health officials have issued a public warning after a hairstylist exposed 91 people to the coron… [+1576 chars]",fox-news,Fox News
Paulina Dedaj,Former NFL quarterback Ryan Leaf arrested for domestic battery,"Former NFL quarterback Ryan Leaf was arrested in California on Friday for one count of domestic battery, reports day.",https://www.foxnews.com/sports/ryan-leaf-arrested-domestic-battery,https://static.foxnews.com/foxnews.com/content/uploads/2020/05/Ryan-Leaf-Chargers.jpg,2020-05-23T16:29:14Z,"Former NFL quarterback Ryan Leaf was arrested in California on Friday for one count of domestic battery, reports day.
Leaf, 44, was taken into custody at around 2 p.m. and booked into the Larry D. S… [+1250 chars]",fox-news,Fox News
Adam Shaw,"Biden takes heat from left-wing activists, Bernie aides for ‘you ain’t black’ remarks","Presumptive Democratic nominee Joe Biden is taking heat from the left-wing of his own party, as well as aides to former rival Sen. Bernie Sanders, I-Vt., for his latest controversy -- in which he said in an interview that those black Americans having a hard t…",https://www.foxnews.com/politics/biden-left-wing-activists-bernie-sanders-aides-black-comments,https://cf-images.us-east-1.prod.boltdns.net/v1/static/694940094001/60b9f4c7-dd0f-472d-aaa9-449deb50f418/6812dd4c-797e-48be-998b-b1232f68b4ae/1280x720/match/image.jpg,2020-05-23T16:14:59Z,"Presumptive Democratic nominee Joe Biden is taking heat from left-wing activists and aides to former rival Sen. Bernie Sanders, I-Vt. after saying that black Americans having a hard time ""figuring ou… [+3113 chars]",fox-news,Fox News
Sam Dorman,"DHS chief says travel restrictions on Europe, China 'more important now than ever'","Homeland Security (DHS) Secretary Chad Wolf reiterated the need for travel restrictions from foreign countries, arguing on Saturday that they were ""more important now than they ever have been.""",https://www.foxnews.com/media/chad-wolf-travel-restrictions-china-europe,https://static.foxnews.com/foxnews.com/content/uploads/2020/05/ChadWolf_1.jpg,2020-05-23T16:09:27Z,"Get all the latest news on coronavirus and more delivered daily to your inbox.  Sign up here.
Homeland Security Secretary Chad Wolf said Saturday that restrictions on people coming here from other c… [+1760 chars]",fox-news,Fox News
Barnini Chakraborty,Epstein's alleged madam Ghislaine Maxwell wins questioning delay in sexual battery lawsuit,"Ghislaine Maxwell, the alleged madam of disgraced financierJeffrey Epstein, won a critical request on Friday to delay questioning in a civil suit filed against her on the grounds that her sworn testimony could incriminate her should there be a criminal case a…",https://www.foxnews.com/us/jeffrey-epstein-ghislaine-maxwell-questioning-delay,https://media2.foxnews.com/BrightCove/694940094001/2019/12/28/694940094001_6118598540001_6118595443001-vs.jpg,2020-05-23T16:06:29Z,"Ghislaine Maxwell, the alleged madam of disgraced financier Jeffrey Epstein, won a critical request on Friday to delay questioning in a civil suit filed against her on the grounds that her sworn test… [+3618 chars]",fox-news,Fox News
