author,title,description,url,urlToImage,publishedAt,content,source.id,source.name
Associated Press,South Dakota attorney general speaks publicly about fatal crash: 'I believe I have not committed any crime',"PIERRE, S.D. — South Dakota Attorney General Jason Ravnsborg said he's confident he didn't commit a crime when he struck and killed a man as he drove along a dark highway in September.",https://www.foxnews.com/us/south-dakota-attorney-general-fatal-crash,https://static.foxnews.com/foxnews.com/content/uploads/2020/09/gettyimages-south-dakota-Jason-Ravnsborg.jpg,2020-12-16T19:38:11Z,"PIERRE, S.D. — South Dakota Attorney General Jason Ravnsborg said he's confident he didn't commit a crime when he struck and killed a man as he drove along a dark highway in September.
It's the firs… [+2366 chars]",fox-news,Fox News
Tom Tiffany,Rep. Tom Tiffany: COVID and our kids – there's a better way to keep students safe and in school,"We are learning more about COVID-19 every day, and we should apply that knowledge by updating K-12 COVID protocols.",https://www.foxnews.com/opinion/covid-kids-students-safe-school-tom-tiffany,https://cf-images.us-east-1.prod.boltdns.net/v1/static/694940094001/ccbcb1df-aade-446d-ae14-20d8dae5114c/8b5c1d7e-b5e1-4c64-a13d-19053b8fba30/1280x720/match/image.jpg,2020-12-16T19:36:09Z,"The test results are in. Consensus is building that America’s students should be back in the classroom. From the American Academy of Pediatrics, who pushed for a return to in-person learning in June,… [+6531 chars]",fox-news,Fox News
admin,FOX NEWS CHANNEL SMASHES RECORDS WITH HIGHEST-RATED YEAR IN CABLE NEWS HISTORY ACROSS TOTAL DAY AND PRIMETIME VIEWERSHIP,"FNC Finishes 2020 as Most-Watched Basic Cable Network for Fifth Consecutive Year, Becomes First Cable News Network Ever to End Year with More Than Three Million Viewers in Primetime    FNC Remains the Number One Television Network in Weekday Primetime, Outpac…",http://press.foxnews.com/2020/12/fox-news-channel-smashes-records-with-highest-rated-year-in-cable-news-history-across-total-day-and-primetime-viewership/,,2020-12-16T19:35:24Z,"FNC Finishes 2020 as Most-Watched Basic Cable Network for Fifth Consecutive Year, Becomes First Cable News Network Ever to End Year with More Than Three Million Viewers in Primetime   
FNC Remains t… [+11109 chars]",fox-news,Fox News
Stephanie Pagones,"Georgia babysitter arrested in toddler’s death had history of violence, drug use: report","The Georgia babysitter charged with murdering a toddler who was found allegedly beaten to death earlier this month has a history of violence and drug use, according to a report.",https://www.foxnews.com/us/georgia-babysitter-arrested-in-toddlers-death-reportedly-had-history-of-violence-drug-use,https://static.foxnews.com/foxnews.com/content/uploads/2020/12/AtlantaGirlKilledSplit.jpg,2020-12-16T19:33:41Z,"The Georgia babysitter charged with murdering a toddler who was found allegedly beaten to death earlier this month has a history of violence and drug use, according to a report.
Kirstie Flood, a 29-… [+2002 chars]",fox-news,Fox News
Marisa Schultz,Rep.-elect Lauren Boebert blasts Democrats for trying to ban her from carrying gun at Capitol,"Rep.-elect Lauren Boebert, a gun-rights enthusiast, slammed an effort by House Democrats to ban lawmakers from carrying guns at the Capitol, pledging to fight back against any attempt to restrict her Second Amendment rights.",https://www.foxnews.com/politics/rep-elect-lauren-boebert-ban-concealed-carry-us-capitol,https://static.foxnews.com/foxnews.com/content/uploads/2020/11/gettyimages-Lauren-Boebert1.jpg,2020-12-16T19:32:11Z,"Rep.-elect Lauren Boebert, a gun-rights enthusiast, slammed an effort by House Democrats to ban lawmakers from carrying guns at the Capitol, pledging to fight back against any attempt to restrict her… [+4408 chars]",fox-news,Fox News
Brian Flood,"Treatment of Cuomo, Kavanaugh misconduct allegations reveals glaring double standard, media critics say","New York Gov. Andrew Cuomo and Justice Brett Kavanaugh were both accused of sexual misconduct without evidence, but the mainstream media only cared about one of the stories and critics believe this is simply the latest example of bias against conservatives.",https://www.foxnews.com/media/sexual-misconduct-claims-andrew-cuomo-brett-kavanaugh-double-standard,https://cf-images.us-east-1.prod.boltdns.net/v1/static/694940094001/2dc6da55-790e-41a0-bc37-00a00612d842/5b5b1043-3e66-44c3-b2c7-4d83f28a257c/1280x720/match/image.jpg,2020-12-16T19:30:49Z,"New York Gov. Andrew Cuomo and Justice Brett Kavanaugh were both accused of sexual misconduct without evidence, but the mainstream media only cared about one of the stories and critics believe this i… [+5332 chars]",fox-news,Fox News
Alexandria Hein,Alaska health care worker suffers adverse reaction after COVID-19 vaccine,"A health care worker in Alaska is doing ""well"" after suffering an adverse reaction minutes after receiving Pfizer's COVID-19 vaccine, officials said.",https://www.foxnews.com/health/alaska-health-care-worker-suffers-adverse-reaction-after-covid-19-vaccine,https://static.foxnews.com/foxnews.com/content/uploads/2020/12/vaccine_resized_moderna.jpg,2020-12-16T19:22:00Z,"A health care worker in Alaska is doing ""well"" after suffering an adverse reaction minutes after receiving Pfizer's COVID-19 vaccine, officials said. The health care worker, who is identified as a mi… [+974 chars]",fox-news,Fox News
Janine Puhak,Twitter users confused by video of home chef rinsing off ground beef: 'Screamed',There go our appetites.,https://www.foxnews.com/food-drink/tiktok-uesrs-video-home-chef-beef,https://static.foxnews.com/foxnews.com/content/uploads/2020/12/iStock-465004701.jpg,2020-12-16T19:20:09Z,"There go our appetites.
Though many have experimented in the kitchen this year, some social media users now have a beef among one another after debating whether or not a home chef was in the wrong f… [+1412 chars]",fox-news,Fox News
Bradford Betz,"Biden gets Buttigieg husband's name wrong, calls him 'Kristen'",President-elect Joe Biden during a speech on Wednesday accidentally referred to the husband of former South Bend Mayor Pete Buttigieg by the wrong name.,https://www.foxnews.com/politics/biden-calls-buttigieg-husbands-name-wrong-calls-him-kristen,https://static.foxnews.com/foxnews.com/content/uploads/2020/12/AP20351623256137.jpg,2020-12-16T19:19:15Z,"President-elect Joe Biden during a speech on Wednesday accidentally referred to the husband of former South Bend Mayor Pete Buttigieg by the wrong name. 
The gaffe came while Biden was formally anno… [+1366 chars]",fox-news,Fox News
Jessica Napoli,'The Cosby Show' star Keshia Knight Pulliam engaged,She met fellow actor Brad James while filming the TV movie 'Pride and Prejudice: Atlanta.',https://www.foxnews.com/entertainment/the-cosby-show-keshia-knight-pulliam-engaged,https://static.foxnews.com/foxnews.com/content/uploads/2020/12/keshiapulliam.jpg,2020-12-16T19:11:10Z,"Keshia Knight Pulliam, best known for her role as Rudy Huxtable on ""The Cosby Show,"" is engaged to fellow actor Brad James.
The 39-year-old actor popped the big question to the 41-year-old actress e… [+1802 chars]",fox-news,Fox News
Tyler McCarthy,Danielle Brooks shares support for Lizzo amid her own public body positivity struggles,Danielle Brooks shared her support for Lizzo amid her own struggles with public weight loss.,https://www.foxnews.com/entertainment/danielle-brooks-lizzo-public-body-positivity-struggles,https://static.foxnews.com/foxnews.com/content/uploads/2020/12/Brooks-Lizzo-Getty-AP.jpg,2020-12-16T19:10:37Z,"Danielle Brooks shared her support for Lizzo amid her own struggles with public weight loss. 
Lizzo caught backlash recently after sharing the details of her detox diet. Many fans questioned why the… [+2555 chars]",fox-news,Fox News
Jeanette Settembre,"Denny's employee quits job after customers refuse to wear masks, video shows",A Denny's employee quits after customers refuse to wear masks inside the restaurant.,https://www.foxnews.com/lifestyle/dennys-employee-quits-job-customers-refuse-masks,https://static.foxnews.com/foxnews.com/content/uploads/2020/12/DennysIstock333.jpg,2020-12-16T19:05:43Z,"A fed-up Denny’s employee quit her job after customers challenged the restaurant's current mask-wearing requirement during the COVID pandemic.
A Denny’s server at the restaurant chain's location in … [+2482 chars]",fox-news,Fox News
Gary Gastelu,Bulletproof Ferrari 458 Speciale is a $625G direct hit to your wallet,AddArmor has built a bulletproof Ferrari 458 Speciale using its lightweight ballistic protection tech. The car can take a hit from a .44 Magnum without penetrating the cabin.,https://www.foxnews.com/lifestyle/bulletproof-ferrari-458-speciale,https://static.foxnews.com/foxnews.com/content/uploads/2020/12/add-2.jpg,2020-12-16T19:02:41Z,"As fast as they are, Ferraris can't quite outrun speeding bullets, but now there’s one that doesn't have to.
(AddArmor)
Armored car outfitter AddArmor has built a bulletproof Ferrari 458 Speciale u… [+1126 chars]",fox-news,Fox News
Warrior Maven,Pentagon Joint Chiefs cites 500-ship Navy fleet as 'aim point',"Chairman of the Joint Chiefs of Staff Gen. Mark Milley is directly, and without hesitation, saying that a much larger 500-ship U.S. Navy will be necessary to contain Chinese expansionist ambitions.",https://www.foxnews.com/tech/pentagon-joint-chiefs-cites-500-ship-navy-fleet-as-aim-point,https://static.foxnews.com/foxnews.com/content/uploads/2020/12/USS-Theodore-Roosevelt.jpg,2020-12-16T18:54:24Z,"Chairman of the Joint Chiefs of Staff Gen. Mark Milley is directly, and without hesitation, saying that a much larger 500-ship U.S. Navy will be necessary to contain Chinese expansionist ambitions.
… [+3592 chars]",fox-news,Fox News
Brooke Crothers,"FTC cracks down on investment scams, files complaints","The Federal Trade Commission is moving against scammers that promise quick financial independence or unrealistic investment returns, among other alleged scams.",https://www.foxnews.com/tech/ftc-cracks-down-on-investment-scams,https://static.foxnews.com/foxnews.com/content/uploads/2020/02/laptop-istock.jpg,2020-12-16T18:50:26Z,"The Federal Trade Commission is moving against scammers that promise quick financial independence or unrealistic investment returns, among other alleged scams.
Along with 19 federal, state and local… [+2710 chars]",fox-news,Fox News
Paul Steinhauser,"Biden pushes back against critics, touts 'Cabinet of firsts'","After weeks of pressure from all sides of the Democratic Party’s vast coalition over the makeup of his incoming administration, President-elect Joe Biden on Wednesday pushed back against his critics as he made another history-making Cabinet nomination.",https://www.foxnews.com/politics/biden-responds-critics-cabinet-picks,https://static.foxnews.com/foxnews.com/content/uploads/2020/12/8d0ac08f-AP20351645750460-e1608142820899.jpg,2020-12-16T18:38:35Z,"After weeks of pressure from all sides of the Democratic Party’s vast coalition over the makeup of his incoming administration, President-elect Joe Biden on Wednesday pushed back against his critics … [+2833 chars]",fox-news,Fox News
Michael Hollan,Utah man builds monolith to cheer up wife battling cancer,"There’s no mystery behind this monolith, it was put here to make people smile.",https://www.foxnews.com/real-estate/utah-man-monolith-cheer-wife-cancer-neighborhood,https://static.foxnews.com/foxnews.com/content/uploads/2020/12/Utah-monolith.jpg,2020-12-16T18:36:37Z,"There’s no mystery behind this monolith – it was made to make people smile.
Following reports that mysterious monoliths have randomly appeared across the world, a man from Utah decided to build his … [+2184 chars]",fox-news,Fox News
Associated Press,Kansas State latest to skip bowl game due to COVID-19,Kansas State became the latest team to withdraw from bowl consideration Wednesday when the school paused all football activities indefinitely amid an outbreak of positive COVID-19 tests and contact tracing that would have prevented them from fielding enough p…,https://www.foxnews.com/sports/kansas-state-latest-to-skip-bowl-game-due-to-covid-19,https://static.foxnews.com/foxnews.com/content/uploads/2020/12/Wildcats.jpg,2020-12-16T18:36:33Z,Kansas State became the latest team to withdraw from bowl consideration Wednesday when the school paused all football activities indefinitely amid an outbreak of positive COVID-19 tests and contact t… [+1816 chars],fox-news,Fox News
Julia Musto,GOP lawmakers' second Christmas tree vanishes from Wisconsin Capitol,"In their second attempt, two Wisconsin Republican lawmakers put up an artificial Christmas tree in the Capitol Rotunda on Tuesday, just hours after a first tree was removed.",https://www.foxnews.com/us/wi-republican-lawmakers-second-tree-in-capitol-removed,https://static.foxnews.com/foxnews.com/content/uploads/2020/12/AP20342610132308.jpg,2020-12-16T18:36:07Z,"Their second Christmas wish fared no better than their first.
Two WisconsinRepublicanlawmakers who put up an artificial Christmas tree in the state's Capitol Rotunda on Tuesday, just hours after a f… [+2760 chars]",fox-news,Fox News
Paulina Dedaj,MLB investigating Omar Vizquel over domestic abuse allegations: report,"MLB is reportedly investigating allegations that legendary shortstop Omar Vizquel abused his estranged wife, physically and emotionally, for years before she finally fled the relationship in August out of fear for her own safety.",https://www.foxnews.com/sports/mlb-investigating-omar-vizquel-domestic-abuse-allegations,https://static.foxnews.com/foxnews.com/content/uploads/2020/12/Omar-Vizquel.jpg,2020-12-16T18:35:56Z,"MLB is reportedly investigating allegations that legendary shortstop Omar Vizquel abused his estranged wife, physically and emotionally, for years before she finally fled the relationship in August o… [+3044 chars]",fox-news,Fox News
Associated Press,"Bills, Steelers, Saints closing in on division titles","Despite an impressive prime-time win over the Steelers, Bills Mafia can't celebrate a playoff berth just yet.",https://www.foxnews.com/sports/bills-steelers-saints-closing-in-on-division-titles,https://static.foxnews.com/foxnews.com/content/uploads/2020/11/Stefon-Diggs.jpg,2020-12-16T18:28:05Z,"Despite an impressive prime-time win over the Steelers, Bills Mafia can't celebrate a playoff berth just yet.
But it's getting closer.
CLICK HERE TO GET MORE SPORTS COVERAGE ON FOXNEWS.COM
The Bil… [+1262 chars]",fox-news,Fox News
John Toldi,"McConnell Warns GOP on Electoral Mischief, Trump Says He Caved Too Soon","Howie Kurtz on Mitch McConnell recognizing the election victory by Joe Biden and Kamala Harris, Pfizer renegotiating deal to make more vaccines for the U.S. and Pete Buttigieg being named Transportation Secretary.



Follow Howie on Twitter: @HowardKurtz…",https://radio.foxnews.com/2020/12/16/mcconnell-warns-gop-on-electoral-mischief-trump-says-he-caved-too-soon/,https://radio.foxnews.com/wp-content/uploads/2020/06/FEATURED_IMAGE_Media_Buzz_Meter.png,2020-12-16T18:21:53Z,,fox-news,Fox News
New York Post,"Peruvian cops dressed as Santa Claus, elf have last laugh in drug raid","Peruvian narcs disguised as Santa Claus and his elf were not exactly spreading cheer on a sleigh when they jumped out of an undercover van and broke down the door of a man who made the naughty list, Reuters reported.",https://www.foxnews.com/world/peruvian-cops-dressed-as-santa-claus-elf-have-last-laugh-in-drug-raid,https://static.foxnews.com/foxnews.com/content/uploads/2020/12/santa-arrest-03.jpg,2020-12-16T18:15:03Z,"Police Navidad!
Peruviannarcs disguised as Santa Claus and his elf were not exactly spreading cheer on a sleigh when they jumped out of an undercover van and broke down the door of a man who made th… [+1185 chars]",fox-news,Fox News
Stephanie Pagones,Murder suspect's escape from custody at McDonald's drive-thru caught on video,Surveillance footage shows a 22-year-old murder suspect’s daring escape from police custody when he fled from a private transport vehicle that had stopped to get take out from a McDonald’s in Indiana.,https://www.foxnews.com/us/indiana-police-murder-suspect-vehicle-in-mcdonalds-drive-thru,https://static.foxnews.com/foxnews.com/content/uploads/2020/12/screen-grab-prison-escape-1.png,2020-12-16T18:14:35Z,Surveillance footage shows a 22-year-old murder suspect’s daring escape from police custody when he fled from a private transport vehicle that had stopped to get take out from a McDonald’s in Indiana… [+3405 chars],fox-news,Fox News
Alexandria Hein,Can you get coronavirus from Christmas cards?,"It’s well-established through research that the highest risk of transmission is through close contact with an infected person, but what about if an infected person licks the envelope of a Christmas card before sticking it in the mail?",https://www.foxnews.com/health/can-you-get-coronavirus-from-christmas-cards,https://static.foxnews.com/foxnews.com/content/uploads/2020/12/christmas_card_istock.jpg,2020-12-16T18:10:22Z,"Coronavirus numbers are surging across the nation, causing many to take a look at how the virus is being transmitted. It’s well-established through research that the highest risk of transmission is t… [+2445 chars]",fox-news,Fox News
Brooke Singman,"Hunter Biden in 2017 sent 'best wishes' from 'entire Biden family' to China firm chairman, requested $10M wire","Correspondence between Hunter Biden and CEFC Chairman Ye Jianming from 2017 shows President-elect Joe Biden's son extending ""best wishes from the entire Biden family,"" and urging the chairman to ""quickly"" send a $10 million wire to ""properly fund and operate""…",https://www.foxnews.com/politics/hunter-biden-letter-chinese-cefc-chairman-wire-request,https://static.foxnews.com/foxnews.com/content/uploads/2020/10/Hunter-Biden-china-thumb.jpg,2020-12-16T18:06:10Z,"Correspondence between Hunter Biden and CEFC Chairman Ye Jianming from 2017 shows President-elect Joe Biden's son extending ""best wishes from the entire Biden family,"" and urging the chairman to ""qui… [+10201 chars]",fox-news,Fox News
Ronn Blitzer,Senate hearing explodes as Johnson accuses Dem of spreading Russian disinformation: 'You lied repeatedly!',"A Senate Homeland Security Committee hearing broke out into a heated exchange between Chairman Ron Johnson, R-Wis., and ranking member Gary Peters, D-Mich., when the GOP leader accused Peters of lying and spreading Russian disinformation.",https://www.foxnews.com/politics/senate-election-hearing-clash-johnson-peters,https://static.foxnews.com/foxnews.com/content/uploads/2020/12/Ron-Johnson-Gary-Peters.jpg,2020-12-16T18:05:09Z,"A Senate Homeland Security Committee hearing broke out into a heated exchange between Chairman Ron Johnson, R-Wis., and ranking member Gary Peters, D-Mich., when the GOP leader accused Peters of lyin… [+2871 chars]",fox-news,Fox News
Wyatt DobrovichFago,Sen. John Barrasso (R-WY) Reveals Details Of Final COVID Relief Package,Leaders on capitol hill are said to be close to an agreement on another round of coronavirus relief. The relief package is reported to have a price tag of around 900 billion and is said to include a second round of direct payments to Americans. The agreement …,https://radio.foxnews.com/2020/12/16/sen-john-barrasso-r-wy-reveals-details-of-final-covid-relief-package/,https://radio.foxnews.com/wp-content/uploads/2020/04/Barrasso.jpg,2020-12-16T21:57:34Z,Leaders on capitol hill are said to be close to an agreement on another round of coronavirus relief. The relief package is reported to have a price tag of around 900 billion and is said to include a … [+2069 chars],fox-news,Fox News
Jessica Napoli,Ant Anstead spending Christmas in England with two older kids after split from ex Christina,The TV presenter has hardly been able to see them in person during the pandemic.,https://www.foxnews.com/entertainment/ant-anstead-spending-christmas-england-split-christina,https://static.foxnews.com/foxnews.com/content/uploads/2020/08/Ant-Anstead.jpg,2020-12-16T21:53:23Z,"Ant Anstead is leaving the U.S. for Christmas and heading back to England.
The 41-year-old TV personality is going to spend the holidays with his two older children, Amelie, 17,  and Archie, 14, who… [+2565 chars]",fox-news,Fox News
Vandana Rambaran,"Cuomo says 80,000 doses of coronavirus vaccine will go to NY nursing homes","New York Gov. Andrew Cuomo said Wednesday nursing home residents will receive the next 80,000 doses of the COVID-19 vaccine, as the state worries about the health of their population's most vulnerable residents.",https://www.foxnews.com/politics/cuomo-says-80000-doses-of-covid-19-vaccine-will-go-to-ny-nursing-homes,https://static.foxnews.com/foxnews.com/content/uploads/2020/12/AP20350733209549.jpg,2020-12-16T21:53:13Z,"New York Gov. Andrew Cuomo said Wednesday nursing home residents will receive the next 80,000 doses of the COVID-19 vaccine, as the state worries about the health of their population's most vulnerabl… [+2493 chars]",fox-news,Fox News
Paulina Dedaj,Cowboys owner Jerry Jones doubles down on coach Mike McCarthy's future,"Dallas Cowboys owner Jerry Jones is backing coach Mike McCarthy, calling the rumors about his potential firing “ridiculous.”",https://www.foxnews.com/sports/cowboys-owner-jerry-jones-mike-mccarthys-future,https://static.foxnews.com/foxnews.com/content/uploads/2020/11/Mike-McCarthy.jpg,2020-12-16T21:50:10Z,"Dallas Cowboys owner Jerry Jones is backing coach Mike McCarthy, calling the rumors about his potential firing ""ridiculous."" 
Jones addressed the issue during an interview with KRLD on Tuesday, doub… [+1484 chars]",fox-news,Fox News
Morgan Phillips,Biden inaugural committee offers special VIP access to corporations that donate $1 million,"For a donation of $1 million, President-elect Joe Biden’s inaugural committee is offering a special VIP package to organizations.",https://www.foxnews.com/politics/biden-inauguration-1-million-vip-chair,https://static.foxnews.com/foxnews.com/content/uploads/2020/12/AP20350034759334.jpg,2020-12-16T21:49:43Z,"For a donation of $1 million, President-elect Joe Biden’s inaugural committee is offering a special VIP package to organizations. 
The committee is offering four package options to donors, depending… [+1897 chars]",fox-news,Fox News
Joshua Nelson,California restaurant owner who yelled at inspectors blasts 'extremely unfair' coronavirus restrictions,A California restaurant owner cited for keeping his business open in violation of a state coronavirus lockdown joined Fox News Wednesday to discuss the viral video of his confrontation with health inspectors.,https://www.foxnews.com/us/california-restaurant-owner-yells-health-inspectors-coronavirus-viral-video,https://cf-images.us-east-1.prod.boltdns.net/v1/static/694940094001/3ec3b79b-8d86-48d1-bd82-19248fc70fca/51e7f97c-a87d-4c71-aafb-544d1f0f7b97/1280x720/match/image.jpg,2020-12-16T21:48:10Z,A California restaurant owner cited for keeping his business open in violation of a state coronavirus lockdown joined Fox News Wednesday to discuss the viral video of his confrontation with health in… [+2238 chars],fox-news,Fox News
Stephanie Nolasco,Scott Baio reacts to Don Most’s comments about ‘Happy Days’ fundraiser: ‘Entertainment shouldn’t be political’,Scott Baio still has love for Don Most – despite their different political views.,https://www.foxnews.com/entertainment/scott-baio-reacts-don-most-comments-happy-days-fundraiser,https://static.foxnews.com/foxnews.com/content/uploads/2020/12/Don-Most-Scott-Baio.jpg,2020-12-16T21:45:11Z,"EXCLUSIVE: Scott Baio still has love for Don Most – despite their differences in political views.
The actor, who starred as Chachi in the ‘70s sitcom""Happy Days,"" is coming forward after his co-star… [+5086 chars]",fox-news,Fox News
Chris Stirewalt,Nuts about flakes,How about some fresh nuggets to float in your cocoa?,https://www.foxnews.com/politics/nuts-about-flakes,https://cf-images.us-east-1.prod.boltdns.net/v1/static/694940094001/7dc20162-a4eb-4121-a9f5-e6cc55f8f6ae/96be7866-2261-4787-be71-79c9686f7ee4/1280x720/match/image.jpg,2020-12-16T21:43:03Z,"**Want FOX News Halftime Report in your inbox every day? Sign up here.**  
On the roster: Nuts about flakes - I’ll Tell You What: Manage your expectations - Definitely maybe: Congress closes in on d… [+15702 chars]",fox-news,Fox News
Charles Creitz,Sen. Johnson blasts Sen. Peters after election fraud hearing dustup,"Senate Homeland Security Chairman Ron Johnson, R-Wis., said that his committee hearing fireworks with Ranking Member Gary Peters, D-Mich., were based on the fact Peters previously entered the widely-discredited Steele dossier into the Senate record following …",https://www.foxnews.com/politics/sen-johnson-blasts-sen-peters-after-election-fraud-hearing-dustup,https://static.foxnews.com/foxnews.com/content/uploads/2020/12/image-2020-12-16T161713.663.jpg,2020-12-16T21:39:26Z,"Senate Homeland Security Chairman Ron Johnson, R-Wis., said that his committee hearing fireworks with Ranking Member Gary Peters, D-Mich., were based on the fact Peters previously entered the widely-… [+2706 chars]",fox-news,Fox News
,More than 60 million people under winter storm advisories in Northeast,Fox News chief meteorologist Rick Reichmuth tracks the storm’s path on ‘Your World.’,http://video.foxnews.com/v/6216734277001/,https://cf-images.us-east-1.prod.boltdns.net/v1/static/694940094001/7dc20162-a4eb-4121-a9f5-e6cc55f8f6ae/96be7866-2261-4787-be71-79c9686f7ee4/1280x720/match/image.jpg,2020-12-16T21:30:41Z,,fox-news,Fox News
