author,title,description,url,urlToImage,publishedAt,content,source.id,source.name
Donna Brazile,Donna Brazile: Biden is a true friend of black Americans – His ‘you ain’t black’ comment doesn’t change that,"I’ve known Joe Biden for decades, and I know it’s absolutely absurd for anyone to call him a racist in reaction to his poor choice of words in an interview Friday with an African-American radio host.",https://www.foxnews.com/opinion/donna-brazile-biden-is-a-true-friend-of-black-americans-his-you-aint-black-comment-doesnt-change-that,https://cf-images.us-east-1.prod.boltdns.net/v1/static/694940094001/4cf67612-7a1e-4693-864a-2c34738b41d7/fd762a57-1a2d-4eb0-9873-026b9fcffa7b/1280x720/match/image.jpg,2020-05-23T19:52:55Z,"I’ve known Joe Biden for decades, and I know it’s absolutely absurd for anyone to call him a racist in reaction to his poor choice of words in an interview Friday with an African-American radio host.… [+6694 chars]",fox-news,Fox News
Tucker Carlson,Tucker Carlson: Coronavirus and the shocking abuse happening in nursing homes. This tragedy wasn't by accident,"If and when we're finally able to assess the coronavirus pandemic rationally and honestly, it'll be clear that it was mostly a disaster for the old and the sick.",https://www.foxnews.com/opinion/tucker-carlson-coronavirus-abuse-nursing-homes,https://cf-images.us-east-1.prod.boltdns.net/v1/static/694940094001/1a8294c4-5823-4704-a040-75e5b1383884/1b463a00-9c2e-45aa-8f07-049c3502b4f7/1280x720/match/image.jpg,2020-05-23T19:00:03Z,"Get all the latest news on coronavirus and more delivered daily to your inbox. Sign up here.
Months from now, if and when we're finally able to assess the coronavirus pandemic rationally and honestl… [+6297 chars]",fox-news,Fox News
Peter Aitken,Experts find bones of dozens of mammoths in Mexico City,An already promising discovery has exploded into a wealth of potential information.,https://www.foxnews.com/science/experts-find-bones-of-dozens-of-mammoths-in-mexico-city,https://static.foxnews.com/foxnews.com/content/uploads/2020/05/Mammoth-Mexico-AP.jpg,2020-05-23T18:46:46Z,"Archeologists have discovered bones belonging to some 60 mammoths to the north of Mexico City, according to reports. 
The site expands on an already exciting trove of a dozen skeletons and human tra… [+2404 chars]",fox-news,Fox News
Melissa Roberto,"Hana Kimura, pro wrestler and Netflix star, dead at 22",Japanese professional wrestler and Netflix star Hana Kimura has died. She was 22.,https://www.foxnews.com/entertainment/hana-kimura-wrestler-netflix-dead,https://static.foxnews.com/foxnews.com/content/uploads/2020/05/hana-kimura-getty.jpg,2020-05-23T18:37:58Z,"Japanese professional wrestler and Netflix star Hana Kimura has died. She was 22.
World Wonder Ring Stardom confirmed Kimura's death in a tweet on Friday.
""Stardom fans, We are very sorry to report… [+1196 chars]",fox-news,Fox News
Julia Musto,"Sen. Tim Scott blasts Joe Biden's comment on black voters as 'arrogant,' 'condescending'","2020 Democratic presidential candidate Joe Biden's statement that African-Americans ""ain't black"" if they even consider voting for President Trump was condescending and arrogant, Sen. Tim Scott, R-S.C., asserted Saturday.",https://www.foxnews.com/media/sen-tim-scott-biden-comments-black-electorate-arrogant-condescending,https://static.foxnews.com/foxnews.com/content/uploads/2020/05/AP20134737450476.jpg,2020-05-23T18:34:51Z,"2020 Democratic presidential candidateJoe Biden'sstatement that African-Americans ""ain't black"" if they even consider voting for President Trump was condescending and arrogant, Sen. Tim Scott, R-S.C.… [+2330 chars]",fox-news,Fox News
Paulina Dedaj,Former Oregon signee Luke Hill arrested after allegedly opening fire on URI signee over ex-girlfriend: report,"Former University of Oregon football signee Luke Hill was arrested Tuesday for first-degree attempted murder and several other charges after he allegedly opened fire on a University of Rhode Island Basketball signee over a dispute involving his ex-girlfriend,…",https://www.foxnews.com/sports/former-oregon-signee-luke-hill-arrested-after-allegedly-opening-fire-on-uri-signee-over-ex-girlfriend-report,https://static.foxnews.com/foxnews.com/content/uploads/2020/05/Luke-Hill-Mugshot.jpg,2020-05-23T18:33:19Z,"Former University of Oregon football signee Luke Hill was arrested and charged Tuesday with first-degree attempted murder and other felony charges after he allegedly opened fire on another athlete.
… [+2027 chars]",fox-news,Fox News
Marisa Schultz,Cuomo attempts to deflect blame of deadly nursing home coronavirus debacle on to Trump,New York Gov. Andrew Cuomo Saturday doubled down on his state's now-scrapped nursing home policy that critics say contributed to thousands of coronavirus deaths and instead blamed the problem on President Trump and his administration.,https://www.foxnews.com/politics/cuomo-blames-trump-nursing-home-debacle-new-york-coronavirus,https://static.foxnews.com/foxnews.com/content/uploads/2020/05/AP20129773805701.jpg,2020-05-23T18:26:49Z,"Get all the latest news on coronavirus and more delivered daily to your inbox.  Sign up here.
New York Gov. Andrew Cuomo Saturday doubled down on his state's now-scrapped nursing home policy that cr… [+3905 chars]",fox-news,Fox News
Melissa Roberto,"Tippi Hedren, 90, still lives with '13 or 14 lions and tigers,' granddaughter Dakota Johnson reveals","Tippi Hedren is still a big cat enthusiast at age 90, her granddaughter Dakota Johnson revealed.",https://www.foxnews.com/entertainment/tippi-hedren-lives-13-14-lions-tigers-dakota-johnson-reveals,https://static.foxnews.com/foxnews.com/content/uploads/2020/05/tippi-hedren-tiger-getty.jpg,2020-05-23T18:15:40Z,"Get all the latest news on coronavirus and more delivered daily to your inbox.  Sign up here.
Tippi Hedren is still a big cat enthusiast at age 90.
Hedren, the actress who shot to fame thanks to he… [+3046 chars]",fox-news,Fox News
Adam Shaw,House Democrats press ICE on alleged family separation in detention centers,House Democrats this week wrote to the Trump administration expressing concern about reports that Immigration and Customs Enforcement (ICE) has been pursuing family separation at detention centers -- reports that ICE denies.,https://www.foxnews.com/politics/house-democrats-ice-family-separation-detention,https://cf-images.us-east-1.prod.boltdns.net/v1/static/694940094001/75868604-a85f-4ffe-a9cf-96c6d93c0f1c/92277512-c889-4151-94d3-4644c88f6563/1280x720/match/image.jpg,2020-05-23T21:57:27Z,House Democrats this week wrote to the Trump administration expressing concern about reports that Immigration and Customs Enforcement (ICE) has been pursuing family separation at detention centers --… [+4065 chars],fox-news,Fox News
Sam Dorman,"NYT reporter, in now-deleted tweets, claims there's 'a difference between being politically black and racially black'","New York Times correspondent Nikole Hannah-Jones caught a flurry of attention Friday after attempting to distinguish between being ""politically black and racially black.""",https://www.foxnews.com/media/nikole-hannah-jones-politically-racially-black,https://static.foxnews.com/foxnews.com/content/uploads/2020/05/Nikole-Hannah-Jones-Getty.jpg,2020-05-23T21:43:28Z,"New York Times correspondent Nikole Hannah-Jones caught a flurry of attention Friday after attempting to distinguish between being ""politically black and racially black.""
""There is a difference betw… [+1106 chars]",fox-news,Fox News
Jack Brewer,Jack Brewer: Biden knew exactly what he was doing on 'The Breakfast Club',"Former Vice President Biden waited until the end of his Breakfast Club interview to send his well thought out, blunt and direct message to Black America.",https://www.foxnews.com/opinion/biden-breakfast-club-jack-brewer,https://cf-images.us-east-1.prod.boltdns.net/v1/static/694940094001/27855214-4865-49c3-90c0-61c72784814e/ba1ea863-0cc3-42ef-a461-d5219f57ae93/1280x720/match/image.jpg,2020-05-23T21:41:36Z,"When I called President Trump “the first black president” at a White House round table discussion on February 27, during Black History Month, I was verbally attacked, harassed and mocked by the liber… [+4779 chars]",fox-news,Fox News
Marisa Schultz,NY's daily coronavirus death rate falls below 100 for first time since March as Cuomo eyes Long Island reopening,"Coronavirus deaths dropped below 100 in a single day in New York, Gov. Andrew Cuomo said Saturday, who marked the positive trend by announcing Long Island could reopen Wednesday.",https://www.foxnews.com/politics/new-york-covid-daily-deaths-drop-below-100-long-island-to-reopen,https://static.foxnews.com/foxnews.com/content/uploads/2020/04/cuomo.jpg,2020-05-23T21:36:26Z,Coronavirus deaths dropped below 100 in a single day in New York state -- the first time since March 24 -- and the positive trends in fighting the virus mean Long Island can reopen as soon as Wednesd… [+1569 chars],fox-news,Fox News
Caitlin McFall,"Charlamagne tha God says Biden an 'intricate part' of system that 'needs to be dismantled': 'What have you done for me, lately?'","Radio host Charlamagne tha God is pushing back one day after former Vice President Joe Biden said on his show “The Breakfast Club” that African-American voters ""ain’t black” if they can’t decide whether to vote for him or incumbent President Trump.",https://www.foxnews.com/politics/charlamagne-tha-god-pushes-back-biden-you-aint-black-comments-intricate-part-system-dismantled,https://static.foxnews.com/foxnews.com/content/uploads/2020/03/Charlamagne-Tha-God-Biden_Getty-AP.jpg,2020-05-23T21:28:44Z,"Radio host Charlamagne tha God is pushing back one day after former Vice President Joe Biden said on his show “The Breakfast Club” that African-American voters ""ain’t black” if they can’t decide whet… [+1973 chars]",fox-news,Fox News
John James,"John James: Joe Biden, don’t tell me I ‘ain’t black’ because I’m a Republican Trump supporter",Biden thinks he knows what’s best for black people: dependence on and lockstep obedience to the liberal agenda and power preservation.,https://www.foxnews.com/opinion/john-james-joe-biden-dont-tell-me-i-aint-black-because-im-a-republican-trump-supporter,https://cf-images.us-east-1.prod.boltdns.net/v1/static/694940094001/29481774-a1c1-40d2-8647-7292514f6667/8b16855e-b3c9-4477-8c54-06cf06a26c5c/1280x720/match/image.jpg,2020-05-23T21:25:29Z,"The Democratic Party has taken the black vote for granted for decades, but on Friday former Vice President Joe Biden took this view to a new and very hurtful level. During a morning interview on a po… [+4102 chars]",fox-news,Fox News
Sam Dorman,Biden adviser Symone Sanders bristles at question about 'you ain't black' remarks: 'I'm not going to do this',One of former Vice President Joe Biden's top advisers appeared bristled Friday by NBC anchor Chuck Todd's question about the presumptive Democratic nominee's comments on black Trump supporters.,https://www.foxnews.com/media/biden-adviser-symone-sanders-question-chuck-todd-you-aint-black,https://static.foxnews.com/foxnews.com/content/uploads/2020/05/Chuck-Todd-Symone-Sanders-MSNBC-GETTY.jpg,2020-05-23T21:00:43Z,"One of former Vice President Joe Biden's top advisers appeared bristled Friday by NBC anchor Chuck Todd's question about the presumptive Democratic nominee's comments on black Trump supporters.
“I t… [+2954 chars]",fox-news,Fox News
Benjamin Hall,"US dependence on Chinese imports posing potential threat on national security, think tank says","A new report by a British think tank shows that the U.S. is strategically dependent on China for 414 categories of imports, of which 114 service its critical national infrastructure -- and in some cases, these could pose a national security risk.",https://www.foxnews.com/world/us-dependence-on-chinese-imports-posing-potential-threat-on-national-security-think-tank-says,https://cf-images.us-east-1.prod.boltdns.net/v1/static/694940094001/cde4817f-a269-4943-b93f-eb5b9573e07b/67b8f7ff-9989-44d9-a678-39add107d84a/1280x720/match/image.jpg,2020-05-23T20:45:57Z,"Get all the latest news on coronavirus and more delivered daily to your inbox. Sign up here.
A new report by a British think tank shows that the U.S. is strategically dependent on China for 414 cate… [+2859 chars]",fox-news,Fox News
Newt Gingrich,"Gingrich & DeSantis: How Congress can give Americans an extra $11,000 without costing taxpayers a penny","Now more than ever, America needs the economic boost and financial security that price transparency in health care will provide.",https://www.foxnews.com/opinion/gingrich-desantis-congress-11000-taxpayers,https://cf-images.us-east-1.prod.boltdns.net/v1/static/694940094001/607d5413-115d-4f59-b33b-8a32cc8d97ee/32090d02-16e5-48a9-a199-9738e975f2db/1280x720/match/image.jpg,2020-05-23T20:34:46Z,"Get all the latest news on coronavirus and more delivered daily to your inbox. Sign up here.
Washington is gearing up to pass another multi-trillion-dollar COVID-19 relief package. However necessary… [+5039 chars]",fox-news,Fox News
Adam Shaw,Trump campaign launches 'You Ain't Black' website amid Biden controversy,President Trump’s 2020 campaign has quickly created a new website as part of efforts to capitalize on a controversy that has engulfed Democratic rival Joe Biden -- after the former vice president said that black Americans who have a hard time “figuring out” w…,https://www.foxnews.com/politics/trump-campaign-launches-you-aint-black-website-biden-controversy,https://cf-images.us-east-1.prod.boltdns.net/v1/static/694940094001/60508549-5b1a-4563-a870-da907e13cd97/99d674d5-f58b-4e6e-866c-77507dcc97b2/1280x720/match/image.jpg,2020-05-23T20:28:52Z,President Trump’s 2020 campaign has quickly created a new website as part of efforts to capitalize on a controversy that has engulfed Democratic rival Joe Biden -- after the former vice president sai… [+2354 chars],fox-news,Fox News
Nick Givas,Mississippi church granted injunction to hold services just days after being burned to the ground,"The First Pentecostal Church of Holly Springs in Mississippi was granted an injunction Friday to hold in-person services pending appeal, just three days after an arsonist burned the building to the ground.",https://www.foxnews.com/faith-values/mississippi-church-injunction-hold-services-days-after-burned-to-ground,https://static.foxnews.com/foxnews.com/content/uploads/2020/05/North-Mississippi-Church.jpg,2020-05-23T23:43:54Z,"Get all the latest news on coronavirus and more delivered daily to your inbox. Sign up here.
The First Pentecostal Church of Holly Springs in Mississippi was granted an injunction Friday to hold in-… [+3966 chars]",fox-news,Fox News
Michael Ruiz,Air Force pilot who died in Vietnam honored by Texas high school student with stunning video tribute,"Air Force Major Eugene P. Beresik, an elite flight instructor and decorated combat pilot during the Vietnam War, was shot out of the sky over the Gulf of Tonkin almost exactly 52 years ago.",https://www.foxnews.com/us/air-force-pilot-vietnam-honored-texas-high-school-student-tribute,https://static.foxnews.com/foxnews.com/content/uploads/2020/05/Beresik-2.png,2020-05-23T23:40:40Z,"Air Force Maj. Eugene P. Beresik, an elite flight instructor and decorated combat pilot during the Vietnam War, was piloting a plane that was shot down over the Gulf of Tonkin almost exactly 52 years… [+4594 chars]",fox-news,Fox News
Peter Aitken,"Russia's Putin pushes for 'war history,' 'patriotism' courses in schools",Russian President Vladimir Putin has submitted legislation that would add “patriotism” and “war history” to Russia’s required education.,https://www.foxnews.com/world/putin-pushes-patriotism-war-history-courseschools,https://static.foxnews.com/foxnews.com/content/uploads/2020/04/AP20107574237291.jpg,2020-05-23T23:30:32Z,"Russian President Vladimir Putin has submitted legislation that would add “patriotism” and “war history” to Russia’s required education. 
The proposal was submitted Thursday but requires approval in… [+1695 chars]",fox-news,Fox News
Julia Musto,"Hurricanes are growing stronger as climate warms, new NOAA study shows","Hurricanes are reportedly strengthening as the Earth's climate grows warmer, according to a new study.",https://www.foxnews.com/science/hurricanes-growing-stronger-climate-warms,https://static.foxnews.com/foxnews.com/content/uploads/2020/05/HurricaneAlex_1.jpg,2020-05-23T23:10:15Z,"Hurricanes are reportedly strengthening as the Earth's climate grows warmer, according to a new study.
Although studying how hurricanes have changed over time is difficult and the tools scientists u… [+3155 chars]",fox-news,Fox News
Marisa Schultz,Team Trump campaigning at beaches Memorial Day weekend,The Trump campaign is delivering sky-high 2020 messages to beachgoers this Memorial Day weekend from the Jersey Shore down to the Florida Panhandle.,https://www.foxnews.com/politics/team-trump-campaigning-beaches-memorial-day-weekend,https://static.foxnews.com/foxnews.com/content/uploads/2019/01/Trump-2020.jpg,2020-05-23T23:05:40Z,"The Trump campaign is delivering sky-high 2020 messages to beachgoers this Memorial Day weekend from the Jersey Shore down to the Florida Panhandle.
President Trump's campaign will fly ""Keep America… [+2297 chars]",fox-news,Fox News
Robert Gearty,Florida woman charged with manslaughter initially claimed man fell on knife: police,"A Florida woman has been arrested in a man’s fatal stabbing after initially telling investigators the victim died after falling on a knife, authorities said.",https://www.foxnews.com/us/florida-woman-charged-manslaughter-fatal-stabbing-claimed-man-fell-knife-police,https://static.foxnews.com/foxnews.com/content/uploads/2020/05/Lillian-Patterson-Marion-County-Sheriffs-Office.jpg,2020-05-23T22:53:50Z,"A Florida woman has been arrested in a man’s fatal stabbing after initially telling investigators the victim died after falling on a knife, authorities said.
Lilliam Patterson, 19, was charged Satur… [+1396 chars]",fox-news,Fox News
Victor Garcia,Jim Gray says 'NBA will be back' and 'will crown a champion this season',"Veteran sports journalist and Fox News contributor Jim Gray appeared on ""America's News HQ"" Saturday and reacted to the news that the NBA was in talks with Disney to use the ESPN Wide World of Sports Complex in Bay Lake, Fla., predicting that the basketball s…",https://www.foxnews.com/media/jim-gray-nba-predictions-coronavirus,https://cf-images.us-east-1.prod.boltdns.net/v1/static/694940094001/acbac75c-1628-4d89-a87a-eceffbc448e9/b41eb03e-1fc4-4d9d-a965-ae114c914745/1280x720/match/image.jpg,2020-05-23T22:36:48Z,"Get all the latest news on coronavirus and more delivered daily to your inbox. Sign up here.
Veteran sports journalist and Fox News contributor Jim Gray appeared on ""America's News HQ"" Saturday and … [+2942 chars]",fox-news,Fox News
Adam Brandon,"Adam Brandon: Congress, focus on nursing homes and our vulnerable elderly, not bailouts",In the coronavirus fight is it too much to ask that emergency funding instead goes to where it's clearly needed most?,https://www.foxnews.com/opinion/congress-nursing-homes-elderly-bailouts-adam-brandon,https://cf-images.us-east-1.prod.boltdns.net/v1/static/694940094001/150d685b-5bde-4afd-a4d8-7394c033b368/2a4e165e-6371-4dd9-8bf6-ea0ae59c943d/1280x720/match/image.jpg,2020-05-23T22:29:28Z,"Get all the latest news on coronavirus and more delivered daily to your inbox. Sign up here. 
Congress has already passed relief packages totaling $3.6 trillion in response to the coronavirus pandem… [+4787 chars]",fox-news,Fox News
Paulina Dedaj,Gen. Mark Milley to serve as grand marshal at NASCAR's 61st Coca-Cola 600: report,"NASCAR is back after being suspended for more than 10 weeks amid the coronavirus outbreak, and giving the command to fire things up at the Coca-Cola 600 on Sunday will reportedly be none other than Chairman of the Joint Chiefs of Staff Gen. Mark Milley.",https://www.foxnews.com/auto/gen-mark-milley-grand-marshal-nascar-coca-cola-600,https://static.foxnews.com/foxnews.com/content/uploads/2020/05/Mark-Milley-AP.jpg,2020-05-23T22:22:52Z,"NASCAR is back after being suspended for more than 10 weeks amid the coronavirus outbreak, and giving the command to fire things up at the Coca-Cola 600 on Sunday will reportedly be none other than C… [+1753 chars]",fox-news,Fox News
Paulina Dedaj,NFL changes Colin Kaepernick's status from 'retired' to 'UFA' on league site after backlash,The NFL came under fire Friday after listing former San Francisco 49ers’ Colin Kaepernick as “retired” on the league’s official website.,https://www.foxnews.com/sports/nfl-colin-kaepernick-status-retired-ufa-backlash,https://static.foxnews.com/foxnews.com/content/uploads/2019/08/NFL-Colin-Kaepernick3.jpg,2020-05-23T22:14:11Z,"The NFL came under fire Friday after listing former San Francisco 49ers’ Colin Kaepernick as “retired” on the league’s official website.
The former quarterback's girlfriend Nessa Diab took to Twitte… [+1111 chars]",fox-news,Fox News
Sam Dorman,NY Gov. Cuomo revises social distancing order amid First Amendment law suit,"New York Gov. Andrew Cuomo significantly revised a social distancing order on Friday, after the American Civil Liberties Union (ACLU) had accused him of unconstitutionally protecting religious services over other types of gatherings amid the coronavirus outbr…",https://www.foxnews.com/politics/new-york-cuomo-revises-social-distancing-amid-lawsuit,https://static.foxnews.com/foxnews.com/content/uploads/2020/05/cuomo-e1589299035930.jpg,2020-05-23T22:05:40Z,"Get all the latest news on coronavirus and more delivered daily to your inbox.  Sign up here.
New York Gov. Andrew Cuomo significantly revised a social distancing order on Friday, after the American… [+3241 chars]",fox-news,Fox News
