author,title,description,url,urlToImage,publishedAt,content,source.id,source.name
Ann Schmidt,Ohio nursing home residents ‘deer hunt’ with nerf guns in adorable video,"On Monday, residents of the Continental Manor nursing home in Blanchester, Ohio, used nerf guns to go on a “deer hunt” with staff members at the facility.",https://www.foxnews.com/lifestyle/ohio-nursing-home-residents-deer-hunt-nerf-guns,https://static.foxnews.com/foxnews.com/content/uploads/2020/12/iStock-1180368362.jpg,2020-12-04T02:54:38Z,"Oh deer! 
Residents of an Ohio nursing home went for a holiday “deer hunt” earlier this week.
On Monday, the staff at Continental Manor in Blanchester, Ohio, dressed as reindeer while residents sit… [+1107 chars]",fox-news,Fox News
Daniel Canova,Seahawks' Josh Gordon reinstated by the NFL,Troubled wide receiver Josh Gordon will get another opportunity to play in the NFL.,https://www.foxnews.com/sports/seahawks-josh-gordon-reinstated-by-the-nfl,https://static.foxnews.com/foxnews.com/content/uploads/2019/12/2e05ea1f-Josh-Gordon.jpg,2020-12-04T02:54:09Z,"Troubled wide receiver Josh Gordon will get another opportunity to play in the NFL.
The league announced that it conditionally reinstated Gordon for the final two weeks of the 2020 season. Gordon is… [+2381 chars]",fox-news,Fox News
Frank Miles,"Amid coronavirus, UK official warns of bird flu risk: 'Get prepared!'","Amid the second wave of the coronavirus pandemic, Chief Veterinary Officer Christine Middlemiss in the United Kingdom tweeted a warning about bird flu after a H5N8 strain was found at a turkey farm in northern England.",https://www.foxnews.com/world/amid-coronavirus-uk-warns-of-bird-flu-risk-get-prepared,https://a57.foxnews.com/media2.foxnews.com/thumbnails/i/041713/640/360/041713_sr_roberts_640.jpg,2020-12-04T02:50:12Z,"Amid the second wave of the coronavirus pandemic, Chief Veterinary Officer Christine Middlemiss in the United Kingdom tweeted a warning about bird flu after a H5N8 strain was found at a turkey farm i… [+616 chars]",fox-news,Fox News
Michael Ruiz,GOP congresswoman-elect thinks this will get Dems to support concealed carry,An incoming Republican congresswoman from Colorado has a lighthearted proposal on how to get Democrats to accept the concealed carry of firearms.,https://www.foxnews.com/politics/gop-congresswoman-elect-dems-concealed-carry,https://static.foxnews.com/foxnews.com/content/uploads/2020/12/Lauren-Boebert-AP.jpg,2020-12-04T02:49:57Z,"An incoming Republican congresswoman from Colorado has a lighthearted proposal on how to get Democrats to accept the concealed carry of firearms.
“Democrats should think of concealed carry as masks … [+1934 chars]",fox-news,Fox News
Associated Press,Cheers! Or not: 'Scandalous' 1st Christmas card up for sale,The first commercially printed Christmas card is up for sale — a merry Victorian-era scene that scandalized some who denounced it as humbug when it first appeared in 1843.,https://www.foxnews.com/us/cheers-or-not-scandalous-1st-christmas-card-up-for-sale,https://static.foxnews.com/foxnews.com/content/uploads/2020/12/christmas.jpeg,2020-12-04T02:48:30Z,"The first commercially printed Christmas card is up for sale — a merry Victorian-era scene that scandalized some who denounced it as humbug when it first appeared in 1843.
The card, being sold onlin… [+2325 chars]",fox-news,Fox News
Louis Casiano,LA County sheriff: Deputies won't enforce Newsom's stay-at-home order,Los Angeles County Sheriff Alex Villanueva will not instruct his deputies to enforce a new stay-at-home order announced by Gov. Gavin Newsom on Thursday that could force businesses to temporarily shutdown as coronavirus rates continue to soar statewide.,https://www.foxnews.com/us/la-county-sheriff-newsoms-stay-at-home,https://static.foxnews.com/foxnews.com/content/uploads/2020/12/Newsom-Villaneuva-AP-REUTERS.jpg,2020-12-04T02:48:16Z,Los Angeles County Sheriff Alex Villanueva will not instruct his deputies to enforce a new statewide stay-at-home order announced Thursday that could force businesses to temporarily shut down as coro… [+2407 chars],fox-news,Fox News
Nate Day,Michelle Pfeiffer shows off fiery red hairstyle for movie role,"Michelle Pfeiffer showed off her bold red locks for the film ""French Exit.""",https://www.foxnews.com/entertainment/michelle-pfeiffer-hair-transformation-movie-role,https://static.foxnews.com/foxnews.com/content/uploads/2020/12/Michelle-Pfeiffer.jpg,2020-12-04T02:46:02Z,"Michelle Pfeiffer has a new look -- sort of. 
The lauded actress, 62, has been known for her luxurious blonde hair since she burst onto the scene in Hollywood several decades ago.
From ""Scarface"" t… [+2184 chars]",fox-news,Fox News
Brittany De Lea,Raphael Warnock dismisses controversy over past sermon remarks as 'distraction',"Rev. Raphael Warnock, the top Democratic candidate in a heated runoff race for a Georgia Senate seat, is calling criticism over his past sermons a distraction with the election about one month away.",https://www.foxnews.com/politics/raphael-warnock-sermon-remarks-distraction,https://static.foxnews.com/foxnews.com/content/uploads/2020/12/Warnock-Loeffler-split.jpg,2020-12-04T02:44:54Z,"Rev. Raphael Warnock, the top Democratic candidate in a heated runoff race for a Georgia Senate seat, is calling criticism over his past sermons a distraction with the election about one month away.… [+1517 chars]",fox-news,Fox News
Caitlin McFall,"Trump lawyers claim 40,000 double votes in latest Nevada lawsuit","In a last ditch effort to alter the 2020 presidential election results, the Trump campaign filed another lawsuit telling a Nevada judge they had evidence of deceased people voting and thousands of “double votes.”",https://www.foxnews.com/politics/trump-lawyers-claim-40000-double-votes-in-latest-nevada-lawsuit,https://static.foxnews.com/foxnews.com/content/uploads/2020/12/AP20325844673927.jpg,2020-12-04T02:41:24Z,"In a last ditch effort to alter the 2020 presidential election results, the Trump campaign filed another lawsuit telling a Nevada judge they had evidence of deceased people voting and thousands of “d… [+2601 chars]",fox-news,Fox News
Cortney Moore,"Texas restaurant pays server $2,000 tip after customer allegedly left fraudulent payment","A restaurant in Texas has endured a wild set of twists and turns after its waitress was tipped $2,000.",https://www.foxnews.com/lifestyle/texas-restaurant-pays-server-2000-tip-customer-fraudulent-payment,https://static.foxnews.com/foxnews.com/content/uploads/2020/12/Red-Hook-Seafood-and-Bar-San-Antonio.png,2020-12-04T02:37:39Z,"A restaurant in Texas has endured a wild set of twists and turns after its waitress was tipped $2,000.
The Red Hook Seafood and Bar in San Antonio was unable to process the payment left for server E… [+2728 chars]",fox-news,Fox News
New York Post,Americans want to see Fauci get vaccine before they do: poll,"More than 40 percent of Americans say they would be more likely get the COVID-19 vaccine if they saw Dr. Anthony Fauci get inoculated first — preferring him as a guinea pig over any politician and even Tom Hanks, according to a new poll.",https://www.foxnews.com/us/americans-want-to-see-fauci-get-vaccine-before-they-do-poll,https://cf-images.us-east-1.prod.boltdns.net/v1/static/694940094001/5affd312-5021-48bd-bd9a-ed5c5607ccf8/f467789e-3b2b-44ee-be75-39e8312c303c/1280x720/match/image.jpg,2020-12-04T02:31:35Z,More than 40% of Americans say they would be more likely to get the COVID-19 vaccine if they saw Dr. Anthony Fauci get inoculated first — preferring him as a guinea pig over any politician and even a… [+2170 chars],fox-news,Fox News
Michael Ruiz,"Nearly 2,000 New Yorkers have died from coronavirus since Cuomo's book announced","Nearly 2,000 New Yorkers have died from the coronavirus since Gov. Andrew Cuomo announced a book on his handling of the pandemic earlier this year.",https://www.foxnews.com/politics/new-yorkers-coronavirus-cuomos-book,https://static.foxnews.com/foxnews.com/content/uploads/2020/10/AP20302734497808.jpg,2020-12-04T02:29:27Z,"Nearly 2,000 New Yorkers have died from the coronavirus since Gov. Andrew Cuomo announced a book on his handling of the pandemic earlier this year.
It’s called “American Crisis: Leadership Lessons f… [+2362 chars]",fox-news,Fox News
New York Post,"De Blasio’s $1B NYPD cut left 2,500 homeless complaints unanswered","Homeless people living on the streets of New York City are being left out in the cold — and out of control — due to Mayor Bill de Blasio’s decision to cut $1 billion from the NYPD’s budget, The New York Post has learned.",https://www.foxnews.com/us/de-blasios-1b-nypd-cut-left-2500-homeless-complaints-unanswered,https://cf-images.us-east-1.prod.boltdns.net/v1/static/694940094001/2337fced-2bd8-47ba-a89d-f974b613dcce/21c32f30-6144-427a-a202-4a5052c72ede/1280x720/match/image.jpg,2020-12-04T02:28:27Z,"Homeless people living on the streets of New York City are being left out in the cold — and out of control — due to Mayor Bill de Blasio’s decision to cut $1 billion from the NYPD’s budget, The New Y… [+2419 chars]",fox-news,Fox News
Sam Dorman,"Loeffler vs. Warnock on crime, police: Where they stand","Georgia's hotly-contested Senate races come as the nation is reeling from an uproar surrounding criminal justice, suggesting the issue will be even more prominent than usual in determining the balance of power in Congress.",https://www.foxnews.com/politics/loeffler-vs-warnock-on-crime-police-where-they-stand,https://static.foxnews.com/foxnews.com/content/uploads/2020/11/LoefflerWarnockSplit.jpg,2020-12-04T02:25:44Z,"Georgia's hotly-contested Senate races come as the nation is reeling from an uproar surrounding criminal justice, suggesting the issue will be even more prominent than usual in determining the balanc… [+3489 chars]",fox-news,Fox News
New York Post,11-year-old boy dies after shooting himself during Zoom class,"An 11-year-old boy died after he shot himself in his California home during a Zoom class this week, according to a new report.",https://www.foxnews.com/us/11-year-old-boy-dies-shooting-himself-zoom-class,https://static.foxnews.com/foxnews.com/content/uploads/2020/12/Lodi.jpg,2020-12-04T02:21:08Z,"An 11-year-old boy died after he shot himself in his California home during a Zoom class this week, according to a news report. 
The pre-teen was attending the virtual class with his microphone and … [+1303 chars]",fox-news,Fox News
Ann Schmidt,Small puppy rescued from carpet python’s grip in Australian backyard,"Jasper, a 9-week-old puppy was attacked by a carpet python last week before his owner rescued him. The moment was captured on video and posted to YouTube.",https://www.foxnews.com/lifestyle/small-puppy-rescued-carpet-python-australia,https://static.foxnews.com/foxnews.com/content/uploads/2020/12/iStock-496439984.jpg,2020-12-04T02:19:21Z,"A 9-week-old puppy in Australia had to be rescued after he was attacked by a carpet python last week.  
The moment that Jasper, the Staffordshire/German shepherd mix, was attacked and rescued was ca… [+2075 chars]",fox-news,Fox News
Daniel Canova,Thompson High School in Alabama scores 10 points in 18 seconds to win state championship game,"Thompson High School in Alabama came away with one of the most incredible victories during the Alabama Class 7A state title game against Auburn High School. Trailing by nine points with just over one minute to go in the game, Thompson did the impossible.",https://www.foxnews.com/sports/thompson-high-school-alabama-scores-10-points-18-seconds-win-state-championship-game,https://static.foxnews.com/foxnews.com/content/uploads/2020/12/Football-iStock-2.jpg,2020-12-04T02:13:42Z,Thompson High School in Alabama came away with one of the most incredible victories during the Alabama Class 7A state title game against Auburn High School. Trailing by nine points with just over one… [+1498 chars],fox-news,Fox News
James Leggate,Carnival Cruise Line sets date for inaugural sailing of its largest-ever ship,It had previously been scheduled to debut in February 2021.,https://www.foxnews.com/travel/carnival-cruise-line-sets-date-inaugural-sailing-largest-ship,https://static.foxnews.com/foxnews.com/content/uploads/2020/12/Mardi-Gras-Sea-Trial.jpg,2020-12-04T02:12:32Z,"Carnival Cruise Line’s largest ship to date has a date for its first voyage.
The Mardi Gras will set sail on April 24, 2021, the cruise line announced Thursday. It had previously been scheduled to d… [+2949 chars]",fox-news,Fox News
Nate Day,"Warren Berlinger, 'Happy Days' and 'Cannonball Run' actor, dead at 83","The star's daughter confirmed her father died on Wednesday in Valencia, Calif., at Henry Mayo Newhall Hospital.",https://www.foxnews.com/entertainment/warren-berlinger-happy-days-cannonball-run-actor-dead,https://static.foxnews.com/foxnews.com/content/uploads/2020/12/Warren-Berlinger.jpg,2020-12-04T02:10:56Z,"Warren Berlinger, an actor known for his roles in ""Happy Days"" and ""The Cannonball Run,"" has died. He was 83.
His daughter, Elizabeth Berlinger, Tarantini confirmed to People magazine that her fathe… [+1880 chars]",fox-news,Fox News
Caitlin McFall,Giuliani concludes back to back voter fraud hearings in Georgia,"Georgia became the fourth state to hold hearings with President Trump’s personal attorney Rudy Giuliani on Thursday, following a long night of hearings in Michigan.",https://www.foxnews.com/politics/giuliani-back-to-back-voter-fraud-hearings-georgia,https://static.foxnews.com/foxnews.com/content/uploads/2020/12/AP20330597409656.jpg,2020-12-04T02:10:06Z,"Georgia became the fourth state to hold hearings with President Trump’s personal attorney Rudy Giuliani on Thursday, following a long night of hearings in Michigan.
Though Thursday’s hearings were m… [+4465 chars]",fox-news,Fox News
Fox News,LIVE UPDATES: Trump refuses to say he has confidence in Barr,Follow for the latest updates on the 2020 election.,https://www.foxnews.com/politics/live-updates-trump-refuses-to-say-he-has-confidence-in-barr,https://static.foxnews.com/foxnews.com/content/uploads/2020/12/Trump-Barr-AP.jpg,2020-12-04T05:30:26Z,President Trump Thursday wouldn't say whether he still has confidence in Attorney General William Barr two days after the AG said the Justice Department hadn't seen widespread election fraud that cou… [+1136 chars],fox-news,Fox News
Joseph Wulfsohn,"CNN's Jake Tapper, Don Lemon gush over Biden interview: He said 'a lot of the right answers'","CNN anchors Jake Tapper and Don Lemon appeared giddy after Tapper wrapped up his exclusive interview with President-elect Biden and Vice President-elect Harris, their first joint sitdown since the 2020 presidential election.",https://www.foxnews.com/media/cnn-jake-tapper-don-lemon-biden-harris-interview,https://static.foxnews.com/foxnews.com/content/uploads/2020/12/tapper-lemon-split-1110p.jpg,2020-12-04T05:19:51Z,"CNN anchors Jake Tapper and Don Lemon appeared giddy after Tapper wrapped up his exclusive interview with President-elect Biden and Vice President-elect Harris, their first joint sitdown since the 20… [+3276 chars]",fox-news,Fox News
Edmund DeMarche,Trump doubles down on defense bill veto threat over Section 230,,https://www.foxnews.com/politics/trump-doubles-down-on-defense-bill-veto-threat-over-section-230,https://cf-images.us-east-1.prod.boltdns.net/v1/static/694940094001/749f3bd0-ce92-42de-82dc-bede5ce791b3/34acd455-c458-4d4e-a63e-9266e33c9bf3/1280x720/match/image.jpg,2020-12-04T05:10:44Z,President Trump tweeted late Thursday that he would follow through on his earlier threat to veto the National Defense Authorization Act if it did not include a repeal of Section 230 of the 1996 Commu… [+1483 chars],fox-news,Fox News
Angelica Stabile,Perdue fronts positive outlook on Georgia Senate runoffs: Voters see ‘value of split government’,"The much-anticipated Georgia Senate runoff races carry high stakes for both political parties, but Sen. David Perdue, R-Ga., explained on “The Ingraham Angle” Thursday that he has high hopes for a GOP victory.",https://www.foxnews.com/politics/david-perdue-georgia-runoffs-voters-value-split-government,https://static.foxnews.com/foxnews.com/content/uploads/2020/12/58ab74a4-image.jpg,2020-12-04T04:56:55Z,"The much-anticipated Georgia Senate runoff races carry high stakes for both political parties, but Sen. David Perdue, R-Ga., explained on “The Ingraham Angle” Thursday that he has high hopes for a GO… [+1191 chars]",fox-news,Fox News
Charles Creitz,Georgia Gov. Kemp claims GOP secretary of state has yet to order signature audit,"Georgia GOP Gov. Brian Kemp, who has been under fire from President Trump and  others over the handling of election canvassing has gone in his state, told ""The Ingraham Angle"" Thursday that state law gives the secretary of state power to audit or adjust elect…",https://www.foxnews.com/politics/brian-kemp-georgia-brad-raffensperger-signature-audit,https://static.foxnews.com/foxnews.com/content/uploads/2020/12/image-2020-12-03T230703.429.jpg,2020-12-04T04:38:56Z,"Georgia GOP Gov. Brian Kemp, who has been under fire from President Trump and  others over the handling of election canvassing has gone in his state, told ""The Ingraham Angle"" Thursday that state law… [+2675 chars]",fox-news,Fox News
Fox News,LIVE UPDATES: Georgia county defends election handling in hearing,Follow for the latest updates on the Trump campaign's 2020 legal challenges.,https://www.foxnews.com/politics/live-updates-georgia-county-defends-election-handling-in-hearing,https://static.foxnews.com/foxnews.com/content/uploads/2020/12/AP20330597412236-e1606836180589.jpg,2020-12-04T04:38:52Z,"The chairman of Georgia's Fulton County Board of Commissioners Thursday defended the county's election process in front of the Georgia Senate Government Oversight Committee.
<ul><ul><li>Fulton Count… [+1428 chars]",fox-news,Fox News
Nate Day,"Heidi Klum says daughter Leni, 16, has an interest in modeling and hosting TV",Heidi Klum revealed that her 16-year-old daughter Leni has an interest in modeling and hosting television.,https://www.foxnews.com/entertainment/heidi-klum-daughter-leni-16-interest-modeling,https://static.foxnews.com/foxnews.com/content/uploads/2020/12/Heidi-Klum.jpg,2020-12-04T04:36:24Z,"Heidi Klum's daughter is ready to follow in her mother's footsteps.
The international modeling icon shares her 16-year-old daughter, Leni, who was adopted by the singer Seal. She also shares three y… [+2265 chars]",fox-news,Fox News
Joseph Wulfsohn,"CNN boss rips 'useful idiot' Rudy Giuliani for pushing Hunter Biden 'disinformation campaign,' audiotape shows","CNN President Jeff Zucker blasted Trump lawyer Rudy Giuliani over his involvement in the Hunter Biden email controversy in the final weeks of the 2020 election, according to the latest batch of leaked conference call recordings released on Thursday.",https://www.foxnews.com/media/cnn-jeff-zucker-rudy-giuliani-useful-idiot-hunter-biden,https://static.foxnews.com/foxnews.com/content/uploads/2020/12/Zucker-Giuliani.jpg,2020-12-04T04:10:07Z,"CNN President Jeff Zucker blasted Trump lawyer Rudy Giuliani over his involvement in the Hunter Biden email controversy in the final weeks of the 2020 election, according to the latest batch of leake… [+10058 chars]",fox-news,Fox News
Charles Creitz,"Hannity: New video shows suspicious suitcases in Georgia, gift cards for voters in Nevada",Sean Hannity devoted part of his opening monologue Thursday to a discussion of new election fraud allegations stemming from videotapes in Georgia and Nevada.,https://www.foxnews.com/media/sean-hannity-2020-election-georgia-nevada-suspicious-suitcases,https://static.foxnews.com/foxnews.com/content/uploads/2020/12/Hannity-Media-mob-ignoring-sworn-affidavits-from-hundreds-of-election-whistleblowers.jpg,2020-12-04T04:09:04Z,"Sean Hannity devoted part of his opening monologue Thursday to a discussion of new election fraud allegations stemming from videotapes in Georgia and Nevada.
In Georgia, the host said, surveillance … [+1249 chars]",fox-news,Fox News
Nate Day,"Another 'Grey's Anatomy' alum returns in Season 17, leaving fans emotional: 'I'm not okay'","""Grey's Anatomy"" brought back a classic alum in a sweet reunion for Ellen Pompeo's Meredith Grey",https://www.foxnews.com/entertainment/another-greys-anatomy-alum-returns-in-season-17-leaving-fans-emotional,https://static.foxnews.com/foxnews.com/content/uploads/2020/12/Greys-Anatomy-Meredith.jpg,2020-12-04T07:45:25Z,"SPOILER ALERT
""Grey's Anatomy"" has brought back another iconic character.
Following the surprise return of Patrick Dempsey's Dr. Derek Shepherd, Dr. George O'Malley made a brief return as well.
T.… [+2610 chars]",fox-news,Fox News
Brie Stimson,Coronavirus vaccine producer executives say distribution would start 'hours' after approval,Executives for three companies producing coronavirus vaccines said in an interview Thursday they would aim to start distributing doses hours after their vaccine is approved by the Food and Drug Administration.,https://www.foxnews.com/health/coronavirus-vaccine-producer-executives-say-distribution-would-start-hours-after-approval,https://static.foxnews.com/foxnews.com/content/uploads/2020/12/iStock-1205972800-12.jpg,2020-12-04T07:38:22Z,Executives for three companies producing coronavirus vaccines said in an interview Thursday they would try to start distributing doses immediately after their vaccine is approved by the Food and Drug… [+2135 chars],fox-news,Fox News
Fox News,LIVE UPDATES: Doug Collins urges Republicans to vote in Georgia runoffs,Follow for the latest updates on the Senate runoffs in Georgia.,https://www.foxnews.com/politics/live-updates-doug-collins-urges-republicans-to-vote-in-georgia-runoffs,https://static.foxnews.com/foxnews.com/content/uploads/2020/11/AP20331587026413-1.jpg,2020-12-04T06:36:25Z,"Rep. Doug Collins Thursday said Republicans in Georgia need to vote in the January runoffs even if they're disappointed in the presidential election results or concerned about fraud. 
""People cannot… [+1026 chars]",fox-news,Fox News
Fox News,LIVE UPDATES: LA County sheriff says deputies won't enforce governor's stay-at-home order,Follow for the latest updates on the coronavirus pandemic.,https://www.foxnews.com/health/live-updates-la-county-sheriff-says-deputies-wont-enforce-governors-stay-at-home-order,https://static.foxnews.com/foxnews.com/content/uploads/2020/12/19c4f95e-covid-positive-.jpg,2020-12-04T06:32:11Z,"Los Angeles County Sheriff Alex Villanueva said his deputies won't enforce a new statewide stay-at-home order announced by Gov. Gavin Newsom Thursday.
The order came as cases have surged across the … [+1224 chars]",fox-news,Fox News
Dom Calicchio,"Marco Rubio slams AOC for criticizing Paycheck Protection Program: ‘Work more, tweet less’",U.S. Sen. Marco Rubio hailed the federal Paycheck Protection Program (PPP) as a bipartisan success in coronavirus-relief aid for American workers on Thursday after the program received criticism from a high-profile Democrat.,https://www.foxnews.com/politics/marco-rubio-slams-aoc-for-criticizing-paycheck-protection-program-work-more-tweet-less,https://static.foxnews.com/foxnews.com/content/uploads/2020/12/rubio-aoc-split-1244a.jpg,2020-12-04T06:12:24Z,U.S. Sen. Marco Rubio hailed the federal Paycheck Protection Program (PPP) as a bipartisan success in coronavirus-relief aid for American workers on Thursday after the program received criticism from… [+5130 chars],fox-news,Fox News
Michael Bartiromo,"Toddler busted after creating secret hiding space in cabinet to watch cartoons, eat crackers","A 2-year-old boy has become the envy of the internet's introverts after creating a hidden oasis in his family’s basement cabinet, complete with snacks, a blanket and even an iPad streaming his cartoons.",https://www.foxnews.com/lifestyle/mom-finds-son-2-relaxing,https://static.foxnews.com/foxnews.com/content/uploads/2020/12/NOah43.jpg,2020-12-04T09:00:24Z,"Can we go play at Noah’s house?
A 2-year-old boy has become the envy of internet introverts after creating a hidden oasis in his family’s basement cabinet, complete with snacks, a blanket and even a… [+2099 chars]",fox-news,Fox News
Joseph Wulfsohn,GOP critics fire back after AOC suggests Republicans can't handle working as a waitress,"Rep. Alexandria Ocasio-Cortez, D-N.Y. took Republicans to task who have previously mocked her background as a waitress by suggesting that they themselves can't handle such a job.",https://www.foxnews.com/politics/gop-critics-fire-back-after-aoc-suggests-republicans-cant-handle-working-as-a-waitress,https://static.foxnews.com/foxnews.com/content/uploads/2020/11/aoc-2.jpg,2020-12-04T08:48:16Z,"Rep. Alexandria Ocasio-Cortez, D-N.Y. took Republicans to task who have previously mocked her background as a waitress by suggesting that they themselves can't handle such a job. 
The Democratic ""Sq… [+2421 chars]",fox-news,Fox News
Cortney Moore,"TikTok chef goes viral for hotel cooking series that uses clothes irons, coffee makers in unconventional ways",TikTokers are welcoming a new star for his hotel cooking adventures.,https://www.foxnews.com/food-drink/tiktok-chef-viral-hotel-cooking-series-clothes-irons-coffee,https://static.foxnews.com/foxnews.com/content/uploads/2020/12/iStock-903093652-hotel-food-tray.jpg,2020-12-04T08:40:35Z,"TikTokers are welcoming a new star for his hotel cooking adventures.
Jago Randles, an English chef who traveled to Canada for work at a mountain resort in Whistler, British Columbia, has gone viral … [+2196 chars]",fox-news,Fox News
