author,title,description,url,urlToImage,publishedAt,content,source.id,source.name
Chantz Martin,Colorado's Travis Hunter sends subtle message after Richard Sherman called the two-way star 'bland',"The Super Bowl champion cornerback recently suggested Hunter was a “bland"" wide receiver and was not a natural when it comes to running routes.",https://www.foxnews.com/sports/colorados-travis-hunter-sends-subtle-message-after-richard-sherman-called-two-way-star-bland,https://static.foxnews.com/foxnews.com/content/uploads/2024/09/Travis-Hunter-Colorado.jpg,2024-09-28T23:53:02Z,"Travis Hunter is one of the most dynamic stars in college football. 
Colorado's wide receiver and defensive back subtly responded to critical comments that former NFL player Richard Sherman recently… [+2267 chars]",fox-news,Fox News
Ryan Morik,Fans boo Tim Walz as he leaves Michigan-Minnesota game: 'Get out of here!',"As Minnesota Gov Tim Walz, Kamala Harris' running mate, left Saturday's Minnesota-Michigan game, he was booed by several fans outside the Big House.",https://www.foxnews.com/sports/fans-boo-tim-walz-he-leaves-michigan-minnesota-game-get-out-here,https://static.foxnews.com/foxnews.com/content/uploads/2024/09/GettyImages-2172855375.jpg,2024-09-28T23:40:06Z,"A rough afternoon for Minnesota Gov. Tim Walz got even tougher.
Vice President Kamala Harris' running mate attended Saturday's game between Minnesota and Michigan in Ann Arbor, taking in the action … [+1877 chars]",fox-news,Fox News
Ashley Hume,Ellen DeGeneres reveals 3 health diagnoses after 'excruciating pain': 'I could disintegrate in the shower',"Ellen DeGeneres revealed that she has osteoporosis, obsessive-compulsive disorder and ADHD. The comedian opened up about aging during her new Netflix special.",https://www.foxnews.com/entertainment/ellen-degeneres-reveals-3-recent-health-diagnoses,https://static.foxnews.com/foxnews.com/content/uploads/2024/09/ellen.jpg,2024-09-28T23:25:27Z,"Ellen DeGeneres revealed that she has been diagnosed with osteoporosis, obsessive-compulsive disorder and ADHD.
During her final Netflix special ""For Your Consideration, which premiered on Tuesday, … [+5594 chars]",fox-news,Fox News
Christina Coulter,"Nantucket parents fear for children amid spike in migrant crime: 'As a father, it truly scares me'","A Nantucket father told Fox News Digital the island is ""not what it once was"" after illegal immigrants were arrested for sex crimes and assault on the island.",https://www.foxnews.com/us/nantucket-dad-fears-children-amid-spike-migrant-crime-as-father-truly-scares-me,https://static.foxnews.com/foxnews.com/content/uploads/2024/04/Immigration-and-Customs-Enforcement-Agent.jpg,2024-09-28T23:24:30Z,"NANTUCKET, Mass. Local parents fear for their kids' safety after federal agents nabbed five illegal immigrants, including a member of the notorious gang MS-13, for alleged crimes that include sexual … [+6636 chars]",fox-news,Fox News
Andrea Margolis,Trump visits Wisconsin town shaken by migrant crime: 'Crossed Kamala's wide-open border',"Former President Trump spoke to supporters in Prairie du Chien, Wisconsin, on Saturday, focusing on the arrest of an alleged Tren de Aragua gang member accused of sex crimes.",https://www.foxnews.com/politics/trump-visits-wisconsin-town-shaken-migrant-crime-crossed-kamalas-wide-open-border,https://static.foxnews.com/foxnews.com/content/uploads/2024/09/WI-TRUMP-PRAIRIE-DU-CHEIN-1.png,2024-09-28T23:20:36Z,"Former President Trump campaigned in the Wisconsin town of Prairie du Chien on Saturday, making migrant crime a core part of his speech after a rape suspect was arrested in the small, rural community… [+2638 chars]",fox-news,Fox News
Kristine Parks,"Washington, D.C., political bar takes down Republican symbol after fierce backlash","A newly opened politically-themed bar in. Washington, D.C., faced community backlash for featuring a GOP symbol, along with a Democratic symbol, as part of its logo.",https://www.foxnews.com/media/washington-d-c-political-bar-takes-down-republican-symbol-after-fierce-backlash,https://static.foxnews.com/foxnews.com/content/uploads/2024/09/GettyImages-982613264-scaled.jpg,2024-09-28T23:00:31Z,"A newly opened politics-themed bar in Washington, D.C., was forced to remove a GOP political symbol from its building after facing community backlash.
The bar, called ""Political Pattie's,"" reportedl… [+2737 chars]",fox-news,Fox News
Sarah Rumpf-Whitten,Tren de Aragua members of violent Venezuelan migrant gang arrested in Texas: HSI,"Homeland Security Investigations in San Antonio, Texas arrested two Venezuelan nationals during a crackdown on the violent transnational gang Tren de Aragua.",https://www.foxnews.com/us/tren-de-aragua-members-violent-venezuelan-migrant-gang-arrested-texas-hsi,https://static.foxnews.com/foxnews.com/content/uploads/2024/03/tattoos.jpg,2024-09-28T22:14:00Z,"Homeland Security agents in Texas successfully apprehended two Venezuelan nationals who were members of the bloodthirsty gang, Tren de Aragua (TdA), which has established operations throughout the U.… [+2430 chars]",fox-news,Fox News
Sarah Rumpf-Whitten,Tren de Aragua members of famed Venezuelan migrant gang arrested in Texas: HSI,"Homeland Security Investigations in San Antonio, Texas arrested two Venezuelan nationals during a crackdown on the violent transnational gang Tren de Aragua.",https://www.foxnews.com/us/tren-de-aragua-members-famed-venezuelan-migrant-gang-arrested-texas-hsi,https://static.foxnews.com/foxnews.com/content/uploads/2024/03/tattoos.jpg,2024-09-28T22:12:00Z,"Homeland Security agents in Texas successfully apprehended two Venezuelan nationals who were members of the bloodthirsty gang, Tren de Aragua (TdA), which has established operations throughout the U.… [+2430 chars]",fox-news,Fox News
Ryan Morik,Auburn cheeleader knocks down Oklahoma player running onto field while performing stunts,"As the Oklahoma Sooners entered the field ahead of their game against Auburn, a Tigers cheerleader knocked down a Sooners defensive back while performing stunts.",https://www.foxnews.com/sports/auburn-cheeleader-knocks-down-oklahoma-player-running-onto-field-while-performing-stunts,https://static.foxnews.com/foxnews.com/content/uploads/2024/09/auburn-pylon.jpg,2024-09-28T22:08:36Z,"Oklahoma's Saturday afternoon didn't get off to the best start, but neither did Auburn's cheerleading program.
The 21st-ranked Sooners are visiting the Tigers Saturday for an SEC matchup, and there … [+1610 chars]",fox-news,Fox News
