author,title,description,url,urlToImage,publishedAt,content,source.id,source.name
Peter Caterina,Senator Joni Ernst: President Biden Working With Iran Is Angering Our Partners In The Middle East,"Senator Joni Ernst (R-IA) spoke to Brian Kilmeade about President Biden’s Middle East trip and his administration working toward a new Iran nuclear agreement. Ernst asks, why do we continue to work with Iran, which is the enemy not only to the United States, …",https://radio.foxnews.com/2022/07/18/senator-joni-ernst-president-biden-working-with-iran-is-angering-our-partners-in-the-middle-east/,https://radio.foxnews.com/wp-content/uploads/2022/07/AP22197596943829.jpg,2022-07-18T17:00:46Z,"Senator Joni Ernst (R-IA) spoke to Brian Kilmeade about President Biden’s Middle East trip and his administration working toward a new Iran nuclear agreement. Ernst asks, why do we continue to work w… [+636 chars]",fox-news,Fox News
Kate Pearce,Eric Reed Is Off To The Races,"On this episode, Janice is at the racetrack with Trainer of Kentucky Derby-winner Rich Strike, Eric Reed to discuss his journey from growing up in a family of horsemen to steering Rich Strike to pull off a long-shot victory.",https://radio.foxnews.com/2022/07/18/eric-reed-is-off-to-the-races/,https://radio.foxnews.com/wp-content/uploads/2022/07/FEATURED_IMAGE_THE_JANICE_DEAN_PODCAST.png,2022-07-18T17:00:17Z,"On this episode, Janice is at the racetrack with Trainer of Kentucky Derby-winner Rich Strike, Eric Reed to discuss his journey from growing up in a family of horsemen to steering Rich Strike to pull… [+382 chars]",fox-news,Fox News
Kate Pearce,The Sun Always Shines On Coney Island,"On this episode, Janice shares some of her favorite parts of her time as one of the official judges of Coney Island's Nathan's Famous Hot Dog Eating Contest.",https://radio.foxnews.com/2022/07/18/the-sun-always-shines-on-coney-island/,https://radio.foxnews.com/wp-content/uploads/2022/07/FEATURED_IMAGE_THE_JANICE_DEAN_PODCAST.png,2022-07-18T17:00:10Z,"FOX News Senior Meteorologist Janice Dean brings the sunshine on her new podcast, The Janice Dean Podcast. Every week Janice focuses on a person, place, or thing that deserves attention because it ma… [+801 chars]",fox-news,Fox News
Kate Pearce,Brian Kilmeade Makes The Dean’s List,"On the first episode of The Janice Dean Podcast, Janice sits down Brian Kilmeade to explain how he achieved his dream of being a news anchor.",https://radio.foxnews.com/2022/07/18/brian-kilmeade-makes-the-deans-list/,https://radio.foxnews.com/wp-content/uploads/2022/07/FEATURED_IMAGE_THE_JANICE_DEAN_PODCAST.png,2022-07-18T17:00:02Z,"FOX News Senior Meteorologist Janice Dean brings the sunshine on her new podcast, The Janice Dean Podcast. Every week Janice focuses on a person, place, or thing that deserves attention because it ma… [+771 chars]",fox-news,Fox News
Lauryn Overhultz,"Jennifer Lopez, Ben Affleck's 20-year journey to marriage and happily ever after",Jennifer Lopez and Ben Affleck are married after a 20-year journey to find their happily ever after. The couple obtained a marriage license Saturday in Nevada.,https://www.foxnews.com/entertainment/jennifer-lopez-ben-affleck-20-year-journey-marriage,https://static.foxnews.com/foxnews.com/content/uploads/2022/07/Jennifer_Lopez_Ben_Affleck_Then_Now.jpg,2022-07-18T16:58:48Z,"Jennifer Lopez and Ben Affleck got married this weekend in Las Vegas after a 20-year journey.
Lopez, 52, announced her marriage to Affleck, 49, in her newsletter. 
""We did it,"" Lopez wrote, along w… [+6833 chars]",fox-news,Fox News
Danielle Wallace,"NYC sees 11 separate shootings, stabbings hours after Adams vowed to ‘turn this crime thing around’ - Fox News","<ol><li>NYC sees 11 separate shootings, stabbings hours after Adams vowed to ‘turn this crime thing around’  Fox News
</li><li>Gun violence erupts in NYC over the weekend  PIX11 News
</li><li>Morning Briefing: July 18, 2022  Spectrum News NY1
</li><li>At l…",https://www.foxnews.com/us/nyc-sees-eleven-separate-shootings-stabbings-hours-adams-vowed-turn-crime-thing-around,https://static.foxnews.com/foxnews.com/content/uploads/2022/07/2022-01-24T214807Z_1106796750_RC2W5S902CAD_RTRMADP_3_NEW-YORK-CRIME-ADAMS-1.jpg,2022-07-18T16:24:26Z,"New York City witnessed 11 separate shooting and stabbing incidents within a six-hour time frame after Democratic Mayor Eric Adams promised Sunday to ""turn this crime thing around"" in the Big Apple. … [+4340 chars]",fox-news,Fox News
Emma Colton,"Portland, the site of massive George Floyd protests, has been ravaged by violent crime since - Fox News","A study examining crime in Portland found a 144% increase in homicides from Jan. 2019 to June 2021, and a 241% increase non-fatal shootings in from Jan. 2019 to Dec. 2021.",https://www.foxnews.com/us/portland-site-massive-george-floyd-protests-ravaged-violent-crime-since,https://static.foxnews.com/foxnews.com/content/uploads/2020/09/GettyImages-Portland.jpg,2022-07-18T16:13:02Z,"Violent crime in Portland, Oregon, has drastically risen over the last three years, most precipitously in 2020, when the city saw near-nightly protests and riots over the death of George Floyd. 
""Th… [+4726 chars]",fox-news,Fox News
Paul Steinhauser,"Senate Democrats crush GOP rivals in latest fundraising reports, but will it translate to victory in November?","Senate Democratic incumbents and candidates are crushing their Republican challengers and opponents the campaign cash dash, but will that lead to victory in the midterm elections?",https://www.foxnews.com/politics/senate-democrats-crush-gop-rivals-latest-fundraising-reports-translate-victory-november,https://static.foxnews.com/foxnews.com/content/uploads/2022/06/raphael-warnock.jpg,2022-07-18T16:00:11Z,"The top outside group that works to elect and re-elect Democratic senators walloped its Republican rival in the latest fundraising quarterly reports.
The Senate Majority PAC reported on Monday that … [+5216 chars]",fox-news,Fox News
Michael Addvensky,Tom Rinaldi: How The New Podcast WESLEY Explores The Tragic Story Of A Murdered MLB Player,"Fox Sports reporter Tom Rinaldi joins Fox Across America With Jimmy Failla to discuss his new original podcast WESLEY, which tells the story of Lyman Wesley Bostock Jr., the only player in the history of Major League Baseball to be murdered in-season. “In the…",https://radio.foxnews.com/2022/07/18/tom-rinaldi-how-the-new-podcast-wesley-explores-the-tragic-story-of-a-murdered-mlb-player/,https://radio.foxnews.com/wp-content/uploads/2022/07/rinaldi.jpg,2022-07-18T19:55:24Z,"Fox Sports reporter Tom Rinaldi joins Fox Across America With Jimmy Failla to discuss his new original podcast WESLEY, which tells the story of Lyman Wesley Bostock Jr., the only player in the histor… [+1157 chars]",fox-news,Fox News
Michael Addvensky,Mark Brnovich: Bowser Complaining About Illegal Immigrants In D.C. Demonstrates The Classic Hypocrisy Of The Far Left,Arizona Attorney General Mark Brnovich joins Fox Across America With Jimmy Failla to weigh in on Washington D.C. Mayor Muriel Bowser complaining about illegal migrants being bused into her city and overcrowding homeless shelters. “This is the classic hypocris…,https://radio.foxnews.com/2022/07/18/mark-brnovich-bowser-complaining-about-illegal-immigrants-in-d-c-demonstrates-the-classic-hypocrisy-of-the-far-left/,https://radio.foxnews.com/wp-content/uploads/2022/04/Mark-Brnovich.jpg,2022-07-18T19:54:23Z,Arizona Attorney General Mark Brnovich joins Fox Across America With Jimmy Failla to weigh in on Washington D.C. Mayor Muriel Bowser complaining about illegal migrants being bused into her city and o… [+811 chars],fox-news,Fox News
Stephanie Pagones,Indiana mall shooter waited in food court bathroom for over an hour; Victims include married couple,"Investigators are still working to determine the motive behind a 20-year-old's decision to open fire in an Indiana mall on Sunday evening, killing three and hurting two more.",https://www.foxnews.com/us/indiana-mall-shooter-waited-food-court-bathroom-over-hour-victims-include-married-couple,https://static.foxnews.com/foxnews.com/content/uploads/2022/07/Crime-Scene.jpg,2022-07-18T19:31:37Z,The gunman who opened fire in an Indiana mall on Sunday evening was a 20-year-old man who brought two firearms to the building and waited inside a bathroom for more than an hour before fatally shooti… [+4241 chars],fox-news,Fox News
Adam Shaw,Florida AG Moody urges Biden to declare fentanyl a weapon of mass destruction,"Florida Attorney General Ashley Moody is calling for fentanyl to be declared a weapon of mass destruction, after two mass overdose incidents in the Sunshine State.",https://www.foxnews.com/politics/florida-ag-moody-urges-biden-declare-fentanyl-weapon-mass-destruction,https://static.foxnews.com/foxnews.com/content/uploads/2022/04/ashley-moody-thumb-final.png,2022-07-18T19:15:02Z,EXCLUSIVE: Florida Attorney General Ashley Moody is calling for illicit fentanyl to be declared a weapon of mass destruction after two mass overdoses in her state -- and amid an increase in overdoses… [+6296 chars],fox-news,Fox News
Louis Casiano,"Southern California 7-Eleven robbery suspect charged with murder linked to crime spree, officials say","The suspects involved in a series of 7-Eleven robberies spanning three California counties were charged Monday, including one facing three murder counts, officials said",https://www.foxnews.com/us/southern-california-7-eleven-robbery-murder-crime-spree,https://static.foxnews.com/foxnews.com/content/uploads/2022/07/7-eleven-robberies.jpg,2022-07-18T19:08:58Z,Two suspects involved in a series of deadly robberies that targeted 7-Eleven convenience stores across Southern California last week that left two dead were hit with a slew of criminal charges Monday… [+2743 chars],fox-news,Fox News
Paul Steinhauser,2024 Watch: Former Vice President Mike Pence returning to New Hampshire next month,"Former Vice President Mike Pence will return next month to New Hampshire, sparking further speculation about the likelihood that Pence is gearing up for a White House run in 2024",https://www.foxnews.com/politics/2024-watch-former-vice-president-mike-pence-returning-new-hampshire,https://static.foxnews.com/foxnews.com/content/uploads/2022/06/Mike-Pence-Bedford-NH-Dec-2021.jpg,2022-07-18T19:04:04Z,"MANCHESTER, N.H. Former Vice President Mike Pence will return next month to New Hampshire, sparking further speculation about the likelihood that Pence is gearing up for a White House run in 2024.
P… [+4060 chars]",fox-news,Fox News
Haley Chi-Sing,Some China areas extend their lockdowns and testing amid COVID-19 omicron variant spread,"Major Chinese cities, including Shanghai, have re-implemented mass testing sites and lockdown measures as COVID-19 cases continue to rise across the country.",https://www.foxnews.com/world/china-areas-extend-lockdowns-testing-covid-19-omicron-variant-spread,https://static.foxnews.com/foxnews.com/content/uploads/2022/05/China-COVID-4-1.jpg,2022-07-18T19:01:46Z,"Major Chinese cities, including Shanghai, have instituted mass testing sites and are extending lockdown mandates amid a rise in COVID-19 cases.
The Chinese government reported approximately 390 dail… [+2444 chars]",fox-news,Fox News
William Sanchez,War On Ukraine: Ukraine’s President Zelenskyy Fires Top Spy Chief,"Ukrainian President Volodymyr Zelenskyy has fired two senior members of his administration, including the head of his security agency, saying there was a failure to purge Russian spies from their departments. Incompetence and out and out treason are said to h…",https://radio.foxnews.com/2022/07/18/war-on-ukraine-ukraines-president-zelenskyy-fires-top-spy-chief/,https://radio.foxnews.com/wp-content/uploads/2022/02/War-On-Ukraine-Graphic.png,2022-07-18T19:00:31Z,"Ukrainian President Volodymyr Zelenskyy has fired two senior members of his administration, including the head of his security agency, saying there was a failure to purge Russian spies from their dep… [+465 chars]",fox-news,Fox News
Kelly Laco,"Winsome Sears to Biden: 'stop gaslighting' Americans on gas prices, 'begging' Saudis for oil",Lt. Gov. Winsome Sears is criticizing President Biden for his handling of the energy crisis and the chaotic withdrawal from Afghanistan during a large Christian conference supporting Israel.,https://www.foxnews.com/politics/winsome-sears-biden-stop-gaslighting-americans-gas-prices-begging-saudis-oil,https://static.foxnews.com/foxnews.com/content/uploads/2021/11/2021-11-03T055509Z_92393159_RC2SMQ9MHQZT_RTRMADP_3_USA-ELECTION-VIRGINIA-YOUNGKIN.jpg,2022-07-18T18:55:41Z,"ARLINGTON, Va. EXCLUSIVE: Virginia's Lieutenant Governor Winsome Earle-Sears is challenging President Biden to ""stop gaslighting"" Americans on a series of issues ranging from rising gas prices to the… [+6410 chars]",fox-news,Fox News
Brooke Singman,Biden administration streamlines SIV program for Afghans who worked alongside US troops in Afghanistan,The Biden administration is changing the Special Immigrant Visa Program to streamline the process for Afghan applicants who worked alongside U.S. troops in Afghanistan.,https://www.foxnews.com/politics/biden-administration-streamlines-siv-program-afghans-worked-alongside-us-troops-afghanistan,https://static.foxnews.com/foxnews.com/content/uploads/2021/08/kabul1.jpg,2022-07-18T18:47:53Z,"The Biden administration on Monday announced changes to the Special Immigrant Visa Program, streamlining the process and demonstrating its commitment to the ""thousands of brave Afghans"" who worked wi… [+4413 chars]",fox-news,Fox News
Associated Press,North Carolina woman injured after jumping out of moving police car,A North Carolina woman was taken into custody after assaulting her boyfriend in front of an officer. She then attempted to escape custody by jumping out of a moving police car.,https://www.foxnews.com/us/north-carolina-woman-injured-after-jumping-out-moving-police-car,https://static.foxnews.com/foxnews.com/content/uploads/2022/06/ALL_CUSTOM_FS_LOCAL_NEWS_NC_GENERAL.png,2022-07-18T18:47:33Z,"A North Carolina woman taken into custody on an assault charge suffered life-threatening injuries when she escaped her handcuffs, managed to lower a rear window and jumped out of a moving police car,… [+1284 chars]",fox-news,Fox News
Associated Press,World Athletics Championships: Jamaica sweeps the 100 meters as Shelly-Ann Fraser-Pryce dominates the race,Jamaica sweeps the 100 meter as Shelly-Ann Fraser Pryce moves into Usian Bolt level territory in terms of being the most celebrated runners in Jamaican history.,https://www.foxnews.com/sports/world-athletics-championship-jamaica-sweeps-100-meters-shelly-ann-fraser-pryce,https://static.foxnews.com/foxnews.com/content/uploads/2022/07/Fraser-Pryce-celebrates-copy.jpg,2022-07-18T18:44:10Z,"That mile-wide smile would come a split-second later. When Shelly-Ann Fraser-Pryce saw her name come up first Sunday night in the 100-meter final, she pumped her right fist in the air twice and let o… [+8695 chars]",fox-news,Fox News
Associated Press,NYC Penn Station reaches new funding deal with state,A multibillion-dollar redevelopment funding deal has been reached between Penn Station and the state of New York. The plan will create new commercial and residential buildings.,https://www.foxnews.com/us/nyc-penn-station-reaches-new-funding-deal-state,https://static.foxnews.com/foxnews.com/content/uploads/2022/07/AP22199615357323.jpg,2022-07-18T18:36:30Z,"A funding agreement was reached for the multibillion-dollar redevelopment of New Yorks aging Penn Station, the country's busiest rail hub.
Gov. Kathy Hochul and Mayor Eric Adams announced details of… [+3473 chars]",fox-news,Fox News
Michael Ruiz,Missing Maine parents and toddler: Aerial search comes up empty as detectives visit last known location,"Police in Maine are asking for the public's help help finding missing Jill Sidebotham, her ex-boyfriend Nicholas Hansen and their 2-year-old daughter Lydia.",https://www.foxnews.com/us/missing-maine-parents-toddler-aerial-search-comes-up-empty-detectives-visit-last-known-location,https://static.foxnews.com/foxnews.com/content/uploads/2022/07/Maine-missing-split.jpg,2022-07-18T18:33:05Z,"Maine police are asking for the public to come forward with any details or possible sightings of a missing mom, her ex and their 2-year-old daughter, who vanished almost three weeks ago.
Jill Sidebo… [+3193 chars]",fox-news,Fox News
Associated Press,"Washington lawmakers, wildlife officials study how e-bikes effect trails",Washington state wildlife officials are looking into the effects of e-bikes on trails in the state in order to decide whether these bikes should be allowed.,https://www.foxnews.com/us/washington-lawmakers-wildlife-officials-study-how-e-bikes-effect-trails,https://static.foxnews.com/foxnews.com/content/uploads/2022/06/ALL_CUSTOM_FS_LOCAL_NEWS_WA_GENERAL.png,2022-07-18T18:25:12Z,"The use of electric bikes is surging, so lawmakers and wildlife officials are studying their impacts on trails to determine where they should be allowed.
The Washington Department Fish and Wildlife … [+1901 chars]",fox-news,Fox News
Stephanie Nolasco,"Fitness icon Denise Austin, 65, and daughter Katie model bikinis for SI Swimsuit runway show: ‘Proud mama’","Denise Austin, her daughter Katie Austin, and several Sports Illustrated Swimsuit models appeared for the live broadcast of the fashion show during Miami Swim Week.",https://www.foxnews.com/entertainment/fitness-denise-austin-daughter-katie-si-swimsuit-runway-show,https://static.foxnews.com/foxnews.com/content/uploads/2022/07/Getty_DeniseAustin.jpg,2022-07-18T18:24:29Z,"Denise Austin and her daughter Katie Austin made a major splash at the 2022 Sports Illustrated Swimsuit Runway Show.
On Saturday, mother and daughter proudly rocked bikinis on the catwalk for the li… [+10787 chars]",fox-news,Fox News
Gary Gastelu,Massive muscle: A 909 horsepower Dodge Challenger is reportedly in the works,"A Dodge Challenger Hellcat muscle car running on E85 fuel could potentially be rated at 909 horsepower, according to a new report with info on the secret project.",https://www.foxnews.com/auto/massive-muscle-horsepower-dodge-challenger,https://media2.foxnews.com/BrightCove/694940094001/2017/10/06/694940094001_5600117180001_5600094867001-vs.jpg,2022-07-18T18:21:25Z,"The numbers seem to add up.
When the Dodge Challenger SRT Hellcat debuted in 2015 with a 707 hp supercharged Hellcat V8 under the hood, many thought peak muscle car had been achieved.
Not quite.
I… [+2265 chars]",fox-news,Fox News
Phillip Nieto,"Who is Armie Hammer: his family, career, scandal, and recovery",Armie Hammer spent over a decade building an acting career before sexual misconduct allegations and substance abuse damaged it.,https://www.foxnews.com/entertainment/armie-hammer-family-career-scandal-recovery,https://static.foxnews.com/foxnews.com/content/uploads/2022/07/Armie_Hammer.jpg,2022-07-18T18:18:58Z,"Armie Hammer is an American actor whose career has fallen off the map due to sexual abuse allegations and struggles with drug addiction. 
Beginning his career with just a few guest television appear… [+3643 chars]",fox-news,Fox News
Fox News,Is Khloe Kardashian in a relationship? Past partners include Lamar Odom and Tristan Thompson,"Khloe Kardashian is a reality star that was on ""Keeping Up with the Kardashians."" All of her relationships quickly became public, including her rocky one with Tristan Thompson.",https://www.foxnews.com/entertainment/khloe-kardashian-relationship-past-partners-include-lamar-odom-tristan-thompson,https://static.foxnews.com/foxnews.com/content/uploads/2022/07/khloe-kardashian-los-angeles.jpg,2022-07-18T18:18:11Z,"Khloe Kardashian has been in many public relationships during her time in the spotlight. Most recently, there have been rumors circulating that she has been linked to an unnamed private equity invest… [+3662 chars]",fox-news,Fox News
Danielle Wallace,Justice Breyer to teach at Harvard Law School after leaving SCOTUS bench,"Justice Stephen Breyer, whose retirement allowed President Biden to nominate Ketanji Brown Jackson, is to join Harvard law school after leaving the Supreme Court bench.",https://www.foxnews.com/politics/justice-breyer-teach-harvard-law-school-leaving-scotus-bench,https://static.foxnews.com/foxnews.com/content/uploads/2022/01/2022-01-26T180919Z_3_LYNXMPEI0P0UM_RTROPTP_4_USA-COURT-BREYER.jpg,2022-07-18T18:17:20Z,"Retired Justice Stephen Breyer is to join Harvard Law School after leaving the Supreme Court bench. 
Harvard said Friday that Breyer, who retired from the Supreme Court on June 30, is re-joining its… [+3624 chars]",fox-news,Fox News
Angelica Stabile,Florida cop dives into dark water to rescue dog from drowning,"Bob Stebbins, a Lighthouse Point police officer, rescued a little dog from drowning off the coast of Florida earlier this month by jumping into the water.",https://www.foxnews.com/lifestyle/florida-cop-rescue-dog-drowning,https://static.foxnews.com/foxnews.com/content/uploads/2020/01/police-gun-badge.jpg,2022-07-18T18:16:37Z,"A Florida cop saved the life of a little pup who lost its way.
Lighthouse Point Police Department Officer Bob Stebbins sprang into action earlier this month when a dog was drowning off the Florida c… [+1166 chars]",fox-news,Fox News
Danielle Wallace,"NYC sees disturbing sex crime trend, as police hunt serial assailants attacking women on Manhattan streets","The New York Police Department is asking the public for help tracking down two suspects wanted in a string of sexual assaults, as new data shows an uptick in sex crimes citywide.",https://www.foxnews.com/us/nyc-sees-disturbing-sex-crime-trend-police-hunt-serial-assailants-attacking-women-manhattan-streets,https://static.foxnews.com/foxnews.com/content/uploads/2022/07/nypd-criminal-sex-act-1.jpg,2022-07-18T18:16:11Z,"New York City police are hunting two offenders accused of sexually motivated attacks against women walking the streets of the Big Apple, as NYPD data reveals a disturbing uptick in the crime trend. … [+4403 chars]",fox-news,Fox News
Reuters,Here are the health risks of extreme heat,Extreme heat this summer can be dangerous and even life-threatening. Here is what you need to know to stay safe and healthy during a heatwave.,https://www.foxnews.com/health/health-risks-extreme-heat,https://static.foxnews.com/foxnews.com/content/uploads/2022/07/extreme_heat_wave_risks.jpg,2022-07-18T18:13:43Z,"Heat affects health in a number of ways.
Heat exhaustion, which can include dizziness, headaches, shaking and thirst, can affect anyone, and is not usually serious, providing the person cools down w… [+3211 chars]",fox-news,Fox News
Brooke Singman,"VP Harris: 'We will not let the filibuster stand in our way' in protecting voting rights, abortion access","Vice President Kamala Harris said she and President Biden ""will not let the filibuster"" stand in the way of protecting voting rights and abortion access.",https://www.foxnews.com/politics/harris-not-let-filibuster-stand-our-way-protecting-voting-rights-abortion-access,https://static.foxnews.com/foxnews.com/content/uploads/2021/11/Kamala-Harris.jpg,2022-07-18T18:12:06Z,"Vice President Kamala Harris on Monday said she and President Biden ""will not let the filibuster stand in our way"" on protecting abortion access and voting rights, while urging voters to cast ballots… [+5289 chars]",fox-news,Fox News
Reuters,Financially strained sexual health clinics are on the frontline to respond to monkeypox,"Sexual health clinics are well situated to identify and treat cases of monkeypox, which is largely affecting men who have sex with men. But resources at these clinics are stretched.",https://www.foxnews.com/health/financially-strained-sexual-health-clinics-frontline-respond-monkeypox,https://static.foxnews.com/foxnews.com/content/uploads/2022/06/Monkeypox-Vaccine-1.jpg,2022-07-18T18:08:23Z,"Sexual health clinics on the frontline of the monkeypox response are already financially stretched, leaving the United States and UK ill-equipped to tackle the first major global health test since th… [+5440 chars]",fox-news,Fox News
Ronn Blitzer,Florida woman attacked by alligators at country club identified - Fox News,"<ol><li>Florida woman attacked by alligators at country club identified  Fox News
</li><li>Elderly woman killed by two alligators after falling into Florida pond  CBS News
</li><li>Report: Elderly woman killed by alligators at Florida golf course  SILive.co…",https://www.foxnews.com/us/florida-woman-attacked-balligators-country-club-identified,https://static.foxnews.com/foxnews.com/content/uploads/2021/06/iStock-1171368832.jpg,2022-07-18T18:02:04Z,"The woman who was attacked by alligators when she fell into a pond at a Florida country club has been identified, according to a local report.
Residents of the Boca Royale neighborhood where the wom… [+1535 chars]",fox-news,Fox News
Charles Creitz,"White House pushes back on Saudi fist bump critics: Biden cared 'about the meeting, not the greeting'",President Biden came under fire from critics over a fist bump with Saudi Crown Prince Mohammed bin Salman as advisers insisted he stood up to the Saudis.,https://www.foxnews.com/media/white-house-pushes-back-saudi-handshake-critics-biden-cared-about-meeting-greeting,https://static.foxnews.com/foxnews.com/content/uploads/2022/07/BIDEN-SAUDI-ARABIA-FIST-BUMP.jpg,2022-07-18T21:58:13Z,"A top White House adviser pushed back on ongoing criticism over President Biden's fist-bump with Saudi Crown Prince Mohammed bin Salman al Saud, as well as belief he did not make an issue out of U.S.… [+2789 chars]",fox-news,Fox News
