author,title,description,url,urlToImage,publishedAt,content,source.id,source.name
,NFL legend calls out 'disinterested' Dolphins after blowout loss to Browns,Pro Football Hall of Famer Bill Cowher called out the Miami Dolphins on Sunday following their putrid performance against the Cleveland Browns.,https://www.foxnews.com/sports/nfl-legend-calls-out-disinterested-dolphins-after-blowout-loss-browns,https://static.foxnews.com/foxnews.com/content/uploads/2025/10/nfl-dolphins-tua-tagovailoa-102025-1.jpg,2025-10-20T12:04:05Z,"Pro Football Hall of Famer Bill Cowher put the Miami Dolphins on notice following their 31-6 loss to the Cleveland Browns on the road on Sunday afternoon.
The Dolphins struggled in all phases of the… [+2266 chars]",fox-news,Fox News
,"Bank robbers turn blue state into hot spot for heists as bandits grow bolder, industry leader warns","FBI data shows Colorado recorded 104 bank robberies in 2023, ranking third nationally as banking leaders express concern about rising crime trends.",https://www.foxnews.com/us/bank-robbers-turn-blue-state-hot-spot-heists-bandits-grow-bolder-industry-leader-warns,https://static.foxnews.com/foxnews.com/content/uploads/2025/10/small-colorado-mountain-town.png,2025-10-20T12:00:57Z,"Despite a national decline in bank robberies over the past several years, Colorado remains among the top states for these crimes a fact that concerns local banking leaders who report an uptick in hei… [+6276 chars]",fox-news,Fox News
,Tim Curry admits he was ‘dreading’ working with ‘Legend’ co-star Tom Cruise,"Tim Curry reveals in his new memoir ""Vagabond"" that he was dreading working with Tom Cruise during their filming of 1985's ""Legend.""",https://www.foxnews.com/entertainment/tim-curry-admits-he-dreading-working-legend-co-star-tom-cruise,https://static.foxnews.com/foxnews.com/content/uploads/2025/10/tim-curry-tom-cruise.jpg,2025-10-20T12:00:56Z,"Tim Curry didn't hold back when voicing his opinion of Tom Cruise, with whom he co-starred in Ridley Scott's 1985 fantasy film ""Legend.""
Curry played the demonic villain Darkness, who seeks to plung… [+7495 chars]",fox-news,Fox News
,Kiwi could help ease a very common digestive condition — here's how,"King's College London researchers recently found that kiwis, rye bread and mineral water help relieve chronic constipation in the first evidence-based dietary guidelines for adults.",https://www.foxnews.com/food-drink/kiwi-could-help-ease-common-digestive-condition-heres-how,https://static.foxnews.com/foxnews.com/content/uploads/2025/10/woman-eating-kiwi.jpg,2025-10-20T12:00:35Z,"If your digestive system's been a bit sluggish, scientists have found some new solutions including a fruit you might already have at home.
Researchers in the United Kingdom recently published new gu… [+2486 chars]",fox-news,Fox News
,Charlotte teen arrested 111 times in 2 years still walking free in soft-on-crime blue city: police,"A 15-year-old in Charlotte, North Carolina has been arrested 111 times since August 2023 and released again despite violent crime concerns and repeat offender issues.",https://www.foxnews.com/us/charlotte-teen-arrested-111-times-2-years-still-walking-free-soft-crime-blue-city-police,https://static.foxnews.com/foxnews.com/content/uploads/2025/10/sergeant-todd-martin.jpg,2025-10-20T15:49:09Z,"A Charlotte, North Carolina, teenager with 111 arrests in just two years has once again been released, as the blue city wrestles with repeat offenders.
During a Wednesday news conference, the Charlo… [+3029 chars]",fox-news,Fox News
,Teens face new PG-13 limits on Instagram,New Instagram parental controls allow families to manage teen screen time and content limits through the Family Center with stricter safety settings.,https://www.foxnews.com/tech/teens-face-new-pg-13-limits-instagram,https://static.foxnews.com/foxnews.com/content/uploads/2023/08/1-Instagram.jpg,2025-10-20T15:40:06Z,"Instagram is turning up the parental controls. The app will now treat teen accounts more like a PG-13 movie, automatically filtering out mature or risky content for anyone under 18. That means teens … [+10520 chars]",fox-news,Fox News
,Bongino details FBI’s ‘zero-fail mission’ after hunting stand found near Trump’s Air Force One exit area,FBI uses forensic tools to investigate hunting stand discovered near President Donald Trump's Air Force One exit area at Palm Beach International Airport.,https://www.foxnews.com/media/bongino-details-fbis-zero-fail-mission-after-hunting-stand-found-near-trumps-air-force-one-exit-area,https://static.foxnews.com/foxnews.com/content/uploads/2025/08/trump-boards-air-force-one.jpg,2025-10-20T15:30:49Z,"The FBI is using all ""forensic tools"" at its disposal to probe a recently discovered hunting stand overlooking President Donald Trump's Air Force One exit area at the Palm Beach International Airport… [+1818 chars]",fox-news,Fox News
,Giants' Brian Burns rages after team blows 19-point lead to Broncos,New York Giants star Brian Burns was irate with the team's play-calling at the end of their disastrous 33-32 loss to the Denver Broncos on Sunday.,https://www.foxnews.com/sports/giants-brian-burns-rages-after-team-blows-19-point-lead-broncos,https://static.foxnews.com/foxnews.com/content/uploads/2025/10/nfl-giants-brian-burns-102025-1.jpg,2025-10-20T15:29:24Z,"New York Giants linebacker Brian Burns racked up two sacks in the teams devastating loss to the Denver Broncos on Sunday and expressed his frustrations with the play-calling at the end of the game.
… [+1720 chars]",fox-news,Fox News
,"Brazen Louvre robbery crew may have been hired by collector, prosecutor says",Paris Prosecutor Laure Beccuau says thieves who stole priceless jewelry from the Louvre Museum in a seven-minute heist may have been hired by a collector.,https://www.foxnews.com/world/brazen-louvre-robbery-crew-may-have-been-hired-collector-prosecutor-says,https://static.foxnews.com/foxnews.com/content/uploads/2025/10/louvre-museum-heist.jpg,2025-10-20T15:28:16Z,"The thieves who brazenly robbed the Louvre Museum in Paris and stole priceless jewelry in one of the most daring museum heists in recent memory may have been hired by a private collector, officials s… [+2918 chars]",fox-news,Fox News
,"Karine Jean-Pierre insists to skeptical CBS anchors that Biden was treated unfairly, always seemed sharp",Former White House Press Secretary Karine Jean-Pierre was pressed on her defense of former President Joe Biden on Monday as CBS anchors wondered how she didn't witness his decline.,https://www.foxnews.com/media/karine-jean-pierre-insists-skeptical-cbs-anchors-biden-treated-unfairly-always-seemed-sharp,https://static.foxnews.com/foxnews.com/content/uploads/2025/10/jean-pierre-biden-cbs.jpg,2025-10-20T15:28:07Z,CBS News anchors Tony Dokoupil and Gayle King pressed former White House press secretary Karine Jean-Pierre on Monday over her frustrations with the Democratic Party's efforts to push former Presiden… [+3201 chars],fox-news,Fox News
,Details emerge in death of ex-NFL star Doug Martin,Former Tampa Bay Buccaneers star running back Doug Martin reportedly died in police custody on Saturday after suffering a medical emergency.,https://www.foxnews.com/sports/details-emerge-death-ex-nfl-star-doug-martin,https://static.foxnews.com/foxnews.com/content/uploads/2025/10/nfl-bucs-doug-martin-102025-1.jpg,2025-10-20T15:03:48Z,"Details around the death of former Tampa Bay Buccaneers and Oakland Raiders running back Doug Martin began to trickle out on Sunday after his family said that he had passed away.
The former NFL star… [+2704 chars]",fox-news,Fox News
,"Bill Maher admits more 'perspective' on George W Bush during interview with cousin Billy, wants him on podcast",HBO's Bill Maher told Billy Bush he had been too harsh on George W. Bush and said he would love to have the former Republican president on his podcast.,https://www.foxnews.com/media/bill-maher-admits-more-perspective-george-w-bush-during-interview-cousin-billy-wants-him-podcast,https://static.foxnews.com/foxnews.com/content/uploads/2025/10/maher-bush-podcast.jpg,2025-10-20T15:01:52Z,"HBO host Bill Maher told TV personality Billy Bush in an interview published Monday that he might have been too hard on his cousin, former President George W. Bush, during his time in office.
During… [+3182 chars]",fox-news,Fox News
,Country music hitmaker Brett James' final radio transmission before fatal plane crash revealed in new report,"New details have emerged surrounding the tragic plane crash that killed country music hitmaker Brett James, the man behind Carrie Underwood's iconic ""Jesus, Take the Wheel.""",https://www.foxnews.com/entertainment/country-music-hitmaker-brett-james-final-radio-transmission-before-fatal-plane-crash-revealed-new-report,https://static.foxnews.com/foxnews.com/content/uploads/2025/10/brett-james.jpg,2025-10-20T14:49:28Z,"New details have emerged surrounding the tragic plane crash that killed country music songwriter Brett James, the man behind Carrie Underwood's hit ""Jesus, Take the Wheel.""
According to a new report… [+2556 chars]",fox-news,Fox News
,Battle for governor in closely watched election may be headed for a photo finish,Republican Jack Ciattarelli narrows gap with Democratic Rep. Mikie Sherrill in New Jersey governor race as new polls show tightening contest ahead of Election Day.,https://www.foxnews.com/politics/battle-governor-closely-watched-election-may-headed-photo-finish,https://static.foxnews.com/foxnews.com/content/uploads/2025/10/jack-ciattarelli-diner-stop-saddle-brook-new-jersey-oct.-15-2025.jpg,2025-10-20T14:19:16Z,"With the November election just 15 days out, the Republican nominee in one of the nation's only two races for governor this year is feeling confident.
""The energy across the state is electric. The r… [+8018 chars]",fox-news,Fox News
Allison Strasius,"FOX BUSINESS NETWORK NAMES DARREN BOTELHO WASHINGTON, D.C. CORRESPONDENT","NEW YORK – October 20, 2025 — Darren Botelho has joined FOX Business Network (FBN) as a Washington-based correspondent. He begins his new role at FBN today. Prior to joining FBN, Botelho was a weekend evening anchor and reporter at NBC Boston (NBC10) in Needh…",https://press.foxnews.com/2025/10/fox-business-network-names-darren-botelho-washington-d-c-correspondent,,2025-10-20T14:02:02Z,"NEW YORK October 20, 2025 Darren Botelho has joined FOX Business Network (FBN) as a Washington-based correspondent. He begins his new role at FBN today.
Prior to joining FBN, Botelho was a weekend e… [+1303 chars]",fox-news,Fox News
,Social media erupts over 'deranged' teacher mocking Charlie Kirk's death in 'No Kings' viral video,Conservatives on social media erupted over the weekend in response to a video showing a woman at a Chicago anti-Trump protest appearing to mock Charlie Kirk's death.,https://www.foxnews.com/politics/social-media-erupts-over-deranged-teacher-mocking-charlie-kirks-death-in-no-kings-viral-video,https://static.foxnews.com/foxnews.com/content/uploads/2025/10/no-kings-protest-chicago.jpg,2025-10-20T17:53:29Z,"A video of a woman that users on social media say shows a school teacher in Chicago mocking the death of Charlie Kirk at a protest went viral over the weekend, with many calling for the woman to lose… [+3714 chars]",fox-news,Fox News
,GOP bill targets United Nations' global carbon 'tax scheme',A new House Republican bill would prohibit U.S. funding to United Nations agencies that attempt to levy taxes amid the debate over the International Maritime Organization.,https://www.foxnews.com/politics/gop-bill-targets-united-nations-global-carbon-tax-scheme,https://static.foxnews.com/foxnews.com/content/uploads/2025/10/pfluger-united-nations.jpg,2025-10-20T17:50:25Z,"FIRST ON FOX: A new House GOP bill would block the United Nations (UN) from forcing the U.S. to take up any new tax that was not explicitly levied by American taxpayers' own government.
It's expecte… [+2275 chars]",fox-news,Fox News
,Sharks apologize for pro-ICE message appearing on video board,The San Jose Sharks were forced to apologize on Saturday after displaying a pro-U.S. Immigration and Customs Enforcement message on its video board.,https://www.foxnews.com/sports/sharks-apologize-pro-ice-message-appearing-video-board,https://static.foxnews.com/foxnews.com/content/uploads/2025/10/ice-agent-october-2025-arrests.jpg,2025-10-20T17:40:59Z,The San Jose Sharks apologized on Saturday after a pro-U.S. Immigration and Customs Enforcement (ICE) appeared on the video board of the SAP Center as the organization celebrated Hispanic heritage ni… [+1785 chars],fox-news,Fox News
,Keri Russell refuses plastic surgery trend sweeping Hollywood as she stays natural,"Keri Russell says she hasn’t had plastic surgery and feels “unique"" for staying natural in Hollywood as she discusses the cosmetic trend in a new interview.",https://www.foxnews.com/entertainment/keri-russell-refuses-plastic-surgery-trend-sweeping-hollywood-stays-natural,https://static.foxnews.com/foxnews.com/content/uploads/2025/10/keri-russell-nyc.jpg,2025-10-20T17:33:39Z,"Keri Russell is proud to stay natural.
The 49-year-old actress hasn't given in to the plastic surgery trend taking over Hollywood. Russell said staying all natural makes her feel ""unique"" in an inte… [+2050 chars]",fox-news,Fox News
,Trump goes all-out against Colombia’s Petro after claims drug strike killed fisherman: What we know,"President Donald Trump threatens Colombia with tariffs after President Petro challenges U.S. Caribbean strikes targeting alleged narco-terrorists, escalating tensions.",https://www.foxnews.com/politics/trump-goes-all-out-against-colombias-petro-after-claims-drug-strike-killed-fisherman-what-we-know,https://static.foxnews.com/foxnews.com/content/uploads/2025/10/drug-strike-colombia-petro.jpg,2025-10-20T17:29:33Z,Colombias government says a fisherman killed in a recent U.S. strike near Venezuelan waters was not a drug trafficker directly challenging Washingtons claim that its growing Caribbean campaign is hit… [+4868 chars],fox-news,Fox News
,"Karoline Leavitt goes scorched earth on HuffPost reporter, says stop texting 'bulls---' questions","The youngest press secretary in history, Karoline Leavitt, sparked controversy with her response to HuffPost reporter S.V. Dáte's questions about Trump.",https://www.foxnews.com/media/karoline-leavitt-goes-scorched-earth-huffpost-reporter-says-stop-texting-bulls-questions,https://static.foxnews.com/foxnews.com/content/uploads/2025/10/white-house-democrats-shutdown.jpg,2025-10-20T17:25:42Z,"Tensions escalated between Karoline Leavitt and Huffington Post journalist S.V. Dáte as the White House press secretary called the correspondent a ""left-wing hack"" on Monday following his article pok… [+2694 chars]",fox-news,Fox News
,"Colombia recalls US ambassador after Trump calls its leader 'illegal drug leader,' threatens military action",Foreign Minister Rosa Yolanda Villavicencio Mapy announced Colombia's ambassador recall amid rising tensions following Trump's accusations against President Gustavo Petro Urrego.,https://www.foxnews.com/politics/colombia-recalls-us-ambassador-after-trump-calls-leader-illegal-drug-leader-threatens-military-action,https://static.foxnews.com/foxnews.com/content/uploads/2025/10/trump-colombia-prez.png,2025-10-20T17:15:21Z,"Colombia has recalled its ambassador to the United States amid rising tensions between the two nations and comments by President Donald Trump about the South American countrys leader.
Colombian Fore… [+2288 chars]",fox-news,Fox News
,AI girlfriend apps leak millions of private chats,"Chattee Chat and GiMe Chat exposed intimate conversations and photos, revealing users spent up to $18,000 on AI companions before the breach.",https://www.foxnews.com/tech/ai-girlfriend-apps-leak-millions-private-chats,https://static.foxnews.com/foxnews.com/content/uploads/2025/02/gettyimages-2151295139.jpg,2025-10-20T17:10:23Z,"Millions of private messages meant to stay secret are now public. Two AI companion apps, Chattee Chat and GiMe Chat, have exposed more than 43 million intimate messages and over 600,000 images and vi… [+7189 chars]",fox-news,Fox News
,US to expedite nuclear-powered subs to Australia that will sit near China’s doorstep,President Donald Trump said he wants to accelerate nuclear submarine deliveries to Australia under the AUKUS agreement during White House meeting.,https://www.foxnews.com/politics/us-expedite-nuclear-powered-subs-australia-sit-near-chinas-doorstep,https://static.foxnews.com/foxnews.com/content/uploads/2025/10/trump-greets-albanese.jpg,2025-10-20T16:53:46Z,"The U.S. wants to fast-track outfitting Australia with nuclear submarines under the trilateral agreement between the U.S., Australia and the U.K. to beef up Australias submarine force aimed at counte… [+1338 chars]",fox-news,Fox News
,"Source of 'UFO' panic, drone mystery claims responsibility for frenzy: report",An unnamed company reportedly revealed at an Army summit that their 20-foot aircraft was behind the New Jersey UFO scare that sparked fear among residents last year.,https://www.foxnews.com/us/source-ufo-panic-drone-mystery-claims-responsibility-frenzy-report,https://static.foxnews.com/foxnews.com/content/uploads/2025/10/drones-aerial-uas-tech_03.jpg,2025-10-20T16:52:38Z,"A private aerial contractor has reportedly taken responsibility for the swarms of mystery drones that wreaked havoc over New Jerseys skies last year. 
Speaking at the Armys UAS and Launched Effects … [+2909 chars]",fox-news,Fox News
,"DOJ seeks removal of Comey's defense lawyer, citing conflict of interest",Prosecutors signaled they might seek the dismissal of James Comey's lead defense attorney — though he is just one of several big names defending the former FBI director.,https://www.foxnews.com/politics/doj-seeks-removal-comeys-defense-lawyer-citing-conflict-interest,https://static.foxnews.com/foxnews.com/content/uploads/2025/10/former-fbi-director-james-comey-congress.jpg,2025-10-20T16:52:35Z,"Federal prosecutors signaled that they might seek the removal of the lead defense attorney in James Comey's criminal case on Sunday, citing his possible role in the disclosures Comey made in 2017, sh… [+4495 chars]",fox-news,Fox News
,Chip Roy says Democratic Party taking its 'dying breaths',"House Republicans blamed Democrats for the government shutdown as Rep. Chip Roy attacked party's participation in the weekend's ""No Kings"" protest rallies across the U.S.",https://www.foxnews.com/politics/chip-roy-says-democratic-party-taking-its-dying-breaths,https://static.foxnews.com/foxnews.com/content/uploads/2025/10/chip-roy-01.jpg,2025-10-20T16:38:31Z,"Rep. Chip Roy, R-Texas, tore into the Democratic Party during House GOP leaders' press conference on Day 20 of the government shutdown after anti-Trump protests swept the country over the weekend.
H… [+2584 chars]",fox-news,Fox News
,"Alabama pilot, 2 daughters killed in plane crash in Montana wilderness","Alabama pilot Mark Anderson, 62, and daughters Lainey, 22, and Ellie, 17, were killed when their twin-engine plane crashed in remote Montana wilderness.",https://www.foxnews.com/us/experienced-alabama-pilot-2-daughters-killed-plane-crash-montana-wilderness,https://static.foxnews.com/foxnews.com/content/uploads/2025/10/pilot-and-daughters-killed-1.jpg,2025-10-20T16:34:28Z,"A pilot from Alabama and his two daughters died after the plane they were riding in crashed in Montana.
Powell County Sheriff's Office (PCSO) was alerted of ""a possible downed aircraft"" on Friday af… [+1634 chars]",fox-news,Fox News
,Charlamagne tha God says Democrats are losing the shutdown messaging battle,Radio host Charlamagne tha God said Democratic lawmakers were losing the government shutdown messaging fight on Monday during MSNBC host Nicolle Wallace's podcast.,https://www.foxnews.com/media/charlamagne-tha-god-says-democrats-losing-shutdown-messaging-battle,https://static.foxnews.com/foxnews.com/content/uploads/2025/10/charlamagne-tha-god-wallace.jpg,2025-10-20T16:33:20Z,"Radio host Charlamagne tha God said during an interview on Monday that Democrats are losing the shutdown-messaging battle. 
""I read a poll this morning that said, you know, a lot of Americans are st… [+2894 chars]",fox-news,Fox News
,Cowboys' Brandon Aubrey makes NFL history after booming 61-yard field goal,Dallas Cowboys kicker Brandon Aubrey made NFL history on Sunday as he nailed a 61-yard field goal in a win over the Washington Commanders.,https://www.foxnews.com/sports/cowboys-brandon-aubrey-makes-nfl-history-after-booming-61-yard-field-goal,https://static.foxnews.com/foxnews.com/content/uploads/2025/10/nfl-cowboys-brandon-aubrey-102025-3.jpg,2025-10-20T16:28:08Z,"Finding a consistent kicker in the NFL is a luxury just ask the New York Giants.
The Dallas Cowboys found a gem in Brandon Aubrey and the third-year NFL player made history in the teams win against … [+1652 chars]",fox-news,Fox News
,You can use your HSA to shop these surprising Amazon products,"Amazon has plenty of HSA and FSA-eligible products, including ones that might surprise you, like therapy masks, massage guns, shower chairs and fitness trackers.",https://www.foxnews.com/deals/amazon-hsa-fsa-eligible-products,https://static.foxnews.com/foxnews.com/content/uploads/2025/10/theragun.jpg,2025-10-20T16:13:13Z,"If youve got money sitting in your Health Savings Account (HSA) or Flexible Spending Account (FSA), Amazon is filled with eligible products to spend it on. We found some practical (and unexpected) pi… [+6272 chars]",fox-news,Fox News
,NYC billionaire Catsimatidis calls on Curtis Sliwa to drop NYC mayoral campaign,Red Apple Media CEO John Catsimatidis urged Curtis Sliwa to withdraw from the NYC mayoral race to consolidate support behind a viable alternative.,https://www.foxnews.com/politics/nyc-billionaire-catsimatidis-calls-curtis-sliwa-drop-nyc-mayoral-campaign,https://static.foxnews.com/foxnews.com/content/uploads/2025/10/curtis-sliwa.png,2025-10-20T16:05:02Z,"Billionaire John Castimatidis, WABC Radio and Red Apple Media CEO, publicly urged Republican New York City mayoral candidate Curtis Sliwa to drop out of the race.
Catsimatidis, a Republican who laun… [+668 chars]",fox-news,Fox News
,Jane Goodall’s cause of death revealed weeks after beloved primatologist dies at 91,"The cause of conservationist Jane Goodall's death has been revealed as cardiopulmonary arrest, with the 91-year-old also having epilepsy listed on her certificate.",https://www.foxnews.com/health/jane-goodalls-cause-death-revealed-weeks-after-beloved-primatologist-dies-91,https://static.foxnews.com/foxnews.com/content/uploads/2025/10/jane-goodall-cause-of-death.jpg,2025-10-20T19:53:52Z,"Jane Goodalls cause of death has been revealed.
Weeks after the primatologists death at 91, reports have emerged that she died of  ""cardiopulmonary arrest,"" or cardiac arrest, according to TMZ
, wh… [+3440 chars]",fox-news,Fox News
,University fires Turning Point USA table flipper from teaching assistant role after campus outburst,Illinois State University graduate teaching assistant Derek Lopez was arrested and faces disorderly conduct charges for disrupting conservative group tables.,https://www.foxnews.com/us/university-fires-turning-point-usa-table-flipper-from-teaching-assistant-role-after-campus-outburst,https://static.foxnews.com/foxnews.com/content/uploads/2025/10/turning-point-derek-lopez.jpg,2025-10-20T19:51:44Z,"An Illinois State University teaching assistant has been fired after he was captured on video flipping a Turning Point USA table and tearing up the group's flyers. 
""While Illinois State University … [+1926 chars]",fox-news,Fox News
,9th Circuit court rules on Trump's National Guard deployment in Portland,"The 9th Circuit weighed Trump’s plan to send Oregon National Guard troops to Portland, a test of presidential power likely headed to the Supreme Court.",https://www.foxnews.com/politics/9th-circuit-court-rules-trumps-national-guard-deployment-portland,https://static.foxnews.com/foxnews.com/content/uploads/2025/10/trump-portland-ice-protest.jpg,2025-10-20T19:51:25Z,"The 9th U.S. Circuit Court of Appeals on Monday ruled that President Donald Trump can deploy Oregon National Guard troops into the city of Portland, delivering a significant victory to the Trump admi… [+5789 chars]",fox-news,Fox News
,"Illegal immigrant allegedly causes fatal semi-truck crash on highway, killing driver: officials","An illegal immigrant was arrested in Indiana after he allegedly caused a fatal crash with his semi-truck on Wednesday, according to the Portage Police Department.",https://www.foxnews.com/us/illegal-immigrant-allegedly-causes-fatal-semi-truck-crash-highway-killing-driver-officials,https://static.foxnews.com/foxnews.com/content/uploads/2025/10/broko-stankovic-3.jpg,2025-10-20T19:46:27Z,"An illegal immigrant in Indiana was arrested after he allegedly caused a fatal semi-truck crash, according to officials.
The Portage Police Department said Broko Stankovic was driving on U.S. Highwa… [+1343 chars]",fox-news,Fox News
,Newly uncovered Ted Bundy footage exposes the multi-state effort to capture the infamous serial killer,Crime scene photos and audio tapes reveal new details about Ted Bundy's killing spree in a three-part Fox Nation series featuring law enforcement experts and investigators.,https://www.foxnews.com/media/newly-uncovered-ted-bundy-footage-exposes-multi-state-effort-capture-infamous-serial-killer,https://static.foxnews.com/foxnews.com/content/uploads/2025/10/265b00ee-bundy-court.jpg,2025-10-20T19:44:34Z,The harrowing story of serial killer Ted Bundy leaves behind a somber legacy on the West Coast of the United States and recently uncovered crime scene photos and audio tapes continue to unravel the t… [+2855 chars],fox-news,Fox News
