author,title,description,url,urlToImage,publishedAt,content,source.id,source.name
,Connecticut Democratic senator under fire over 'shameful' anti-Trump protest photo,"Connecticut Democratic State Sen. Saud Anwar came under fire Saturday after posting an image of himself next to a controversial sign at a “No Kings"" protest.",https://www.foxnews.com/media/connecticut-democratic-senator-under-fire-over-shameful-anti-trump-protest-photo,https://static.foxnews.com/foxnews.com/content/uploads/2025/10/no-kings-protest.jpg,2025-10-20T23:00:51Z,"Connecticut Democratic state Sen. Saud Anwar faced widespread condemnation over an image of himself at a ""No Kings"" protest that many called inflammatory.
On Saturday, Anwar posted several photos of… [+3957 chars]",fox-news,Fox News
,"Hobbyist finds 4,270-year-old human skull on Indiana riverbank, stumping authorities","A hobbyist found an ancient human skull on the West Fork of the Whitewater River in Indiana that testing revealed to be over 4,000 years old.",https://www.foxnews.com/travel/hobbyist-finds-4270-year-old-human-skull-indiana-riverbank-stumping-authorities,https://static.foxnews.com/foxnews.com/content/uploads/2025/10/indiana-ancient-skull-found-native-american-history-archaeology-1.jpg,2025-10-20T22:53:22Z,"A hobbyist's keen eye led authorities to a human skull on the bank of an Indiana river a find that turned out to be over 4,000 years old.
The Fayette County Coroner's Office announced the discovery … [+2710 chars]",fox-news,Fox News
,Teens who assaulted former DOGE staffer slapped with federal charges: 'Need for accountability',"Two teenagers linked to the beating of former DOGE staffer Edward Coristine in Washington, D.C., are now facing federal charges for a series of assaults and attempted carjacking.",https://www.foxnews.com/politics/teens-who-assaulted-former-doge-staffer-slapped-federal-charges-need-for-accountability,https://static.foxnews.com/foxnews.com/content/uploads/2025/08/1-1.png,2025-10-20T22:51:23Z,"Two teenagers, Lawrence Cotton Powell, 19, and Anthony Taylor, 18, who are linked to the beating of former DOGE staffer Edward Coristine in Washington, D.C., are now facing federal charges for a seri… [+3631 chars]",fox-news,Fox News
,Trump breaks ground on massive White House ballroom project with private funding from 'patriots',President Trump said construction has begun on the new White House Ballroom that is privately funded by patriots and companies. The historic $200M project modernizes the East Wing.,https://www.foxnews.com/politics/trump-breaks-ground-massive-white-house-ballroom-project-private-funding-from-patriots,https://static.foxnews.com/foxnews.com/content/uploads/2025/10/white-house-ballroom-addition.jpg,2025-10-20T22:32:56Z,"President Donald Trump announced on Monday that construction has begun on a new, privately funded White House Ballroom a long-envisioned addition designed to host state visits and large gatherings as… [+2662 chars]",fox-news,Fox News
,New video purportedly shows Louvre thieves in action during brazen daytime heist,French broadcaster BFMTV releases footage which purports to show the Louvre art heist in the Apollo Gallery,https://www.foxnews.com/world/new-video-purportedly-shows-louvre-thieves-action-brazen-daytime-heist,https://static.foxnews.com/foxnews.com/content/uploads/2025/10/louvre-video-heist-002.jpg,2025-10-20T22:30:11Z,"A new video has emerged showing what could be the Louvre thieves in action as they carried out Sundays daylight robbery at Pariss world-famous museum.
The footage, obtained by French broadcaster BFM… [+2407 chars]",fox-news,Fox News
,Senate Dems emboldened by weekend rallies block GOP plan to end shutdown for 11th time,"The fight is the same: Senate Democrats want an extension to expiring Obamacare subsidies, but Republicans won't budge until the government is reopened.",https://www.foxnews.com/politics/senate-dems-emboldened-weekend-rallies-block-gop-plan-end-shutdown-11th-time,https://static.foxnews.com/foxnews.com/content/uploads/2025/10/senate-minority-leader-chuck-schumer-chart.jpg,2025-10-20T22:23:44Z,"Senate Democrats, fresh off a weekend of anti-Trump rallies, again blocked the Republicans' plan to reopen the government for an 11th time as the shutdown nears its fourth week.
Senate Republicans h… [+4615 chars]",fox-news,Fox News
,Soros-backed blue city DA under fire after freeing suspect tied to Miss USA hopeful’s death,Philadelphia District Attorney Larry Krasner faces backlash after repeat offender Keon King was charged in the disappearance of Penn State graduate Kada Scott.,https://www.foxnews.com/us/soros-backed-blue-city-da-under-fire-after-freeing-suspect-tied-miss-usa-hopefuls-death,https://static.foxnews.com/foxnews.com/content/uploads/2025/10/beauty-queen-murder.png,2025-10-20T22:23:08Z,Philadelphias George Soros-backed District Attorney Larry Krasner is facing mounting backlash after a repeat offender previously released on low bail and freed when Krasners office dropped kidnapping… [+5560 chars],fox-news,Fox News
,Georgia man arrested for allegedly shooting at North Carolina home after tearing down Trump banner,"Benjamin Michael Campbell faces multiple charges, including assault with a deadly weapon after shooting at Mark Thomas's home in Nantahala Gorge, N.C.",https://www.foxnews.com/us/georgia-man-arrested-allegedly-shooting-north-carolina-home-tearing-trump-banner,https://static.foxnews.com/foxnews.com/content/uploads/2025/10/georgia-man-shooting-north-carolina.jpg,2025-10-20T22:01:18Z,"A Georgia man accused of ripping down a Trump 2024 banner and opening fire on a North Carolina home has been arrested, authorities said.
Benjamin Michael Campbell, 37, was taken into custody on Sept… [+2018 chars]",fox-news,Fox News
,Elizabeth Hurley shares her best bikini photo tips with Instagram followers in new post,"Elizabeth Hurley shares her secret for flattering bikini photos on Instagram, revealing that stretching with arms up or lying down creates better pictures.",https://www.foxnews.com/entertainment/elizabeth-hurley-shares-her-best-bikini-photo-tips-instagram-followers-new-post,https://static.foxnews.com/foxnews.com/content/uploads/2019/11/Elizabeth-Hurley.jpg,2025-10-20T22:00:49Z,"Elizabeth Hurley is flaunting her bikini body while sharing her secret on how to take flattering pictures.
Over the weekend, Hurley took to Instagram and shared a picture in a mint green bikini with… [+2005 chars]",fox-news,Fox News
,Columbia professors rally behind Rutgers 'Dr Antifa' professor Mark Bray,Rutgers professor Mark Bray and his family left the United States for Europe after receiving death threats following criticism from Turning Point USA students.,https://www.foxnews.com/media/columbia-professors-rally-behind-antifa-aligned-rutgers-professor-mark-bray,https://static.foxnews.com/foxnews.com/content/uploads/2025/10/mark-bray.jpg,2025-10-20T22:00:20Z,"Faculty members at Columbia University and Barnard College have come out in support of Antifa-aligned Rutgers professor Mark Bray, publishing a joint op-ed defending him after he fled the United Stat… [+4243 chars]",fox-news,Fox News
