author,title,description,url,urlToImage,publishedAt,content,source.id,source.name
Stephen Sorace,"New Zealand orders 1,290 square feet of skin for volcano victims, doctor says hospital ‘like a war zone’","New Zealand has ordered 1,290 square feet of skin from the U.S. to treat the dozens of victims suffering severe burns after Monday’s volcanic eruption on White Island as surgeons continue to work around the clock in what has been described as “a war zone.”",https://www.foxnews.com/world/new-zealand-volcano-burn-victims-skin-order,https://static.foxnews.com/foxnews.com/content/uploads/2019/12/nz4.jpg,2019-12-11T17:20:45Z,"New Zealand has ordered 1,290 square feet of skin from the U.S. to treat the dozens of victims suffering severe burns after Monday’s volcaniceruption on White Island as surgeons continue to work around the clock in what has been described as “a war zone.”
Bu… [+3833 chars]",fox-news,Fox News
Ryan Gaydos,"Latest Patriots controversy could be huge if team found lying about intentions, Steelers veteran says",Pittsburgh Steelers offensive lineman Ramon Foster gave his own opinion on the latest controversy surrounding the New England Patriots on Tuesday.,https://www.foxnews.com/sports/patriots-controversy-filming-sideline-steelers-veteran,https://static.foxnews.com/foxnews.com/content/uploads/2019/12/Ramon-Foster-GettyImages-1178687335.jpg,2019-12-11T17:20:08Z,"Pittsburgh Steelers offensive lineman Ramon Foster gave his own opinion on the latest controversy surrounding the New England Patriots on Tuesday.
The Patriots admitted that their film crew recorded the Cincinnati Bengals’ sideline for an episode of “Do Your… [+2277 chars]",fox-news,Fox News
Michael Goodwin,Michael Goodwin: Pelosi's Trump impeachment quest – THIS is an essential part of the dutiful con job,"House Democrats made it official this week — they will vote on two impeachment articles. But as history-making events go, the announcement was extra weird.",https://www.foxnews.com/opinion/pelosi-trump-impeachment-michael-goodwin,https://media2.foxnews.com/BrightCove/694940094001/2019/12/07/694940094001_6113947537001_6113941356001-vs.jpg,2019-12-11T17:19:49Z,"House Democrats made it official this week — they will vote on two impeachment articles. But as history-making events go, the announcement was extra weird.
The decision was expected, yet the way it unfolded was strange. Speaker Nancy Pelosi obviously put out… [+1443 chars]",fox-news,Fox News
Julia Musto,Ted Cruz: It's a 'sad day' for Justice Department after 'stunning' IG report,"Ahead of Justice Department Inspector General Michael Horowitz's testimony before the Senate Judiciary Committee on Wednesday, Sen. Ted Cruz, R-Texas, said that this marks a sad day for the department and that he disagrees with the report's conclusions.",https://www.foxnews.com/media/ted-cruz-sad-day-justice-department-michael-horowitz-report-fisa,https://static.foxnews.com/foxnews.com/content/uploads/2019/12/cruz-horowitz-FOX-AP.jpg,2019-12-11T17:11:50Z,"Ahead of Justice Department Inspector General Michael Horowitz'stestimony before the Senate Judiciary Committee on Wednesday, Sen. Ted Cruz, R-Texas, said that this marks a sad day for the department and that he disagrees with the watchdog report's conclusion… [+2939 chars]",fox-news,Fox News
Chris Ciaccia,"Feathered dinosaurs were eaten by lice-like insects, study says","Paleontologists have discovered that feathered dinosaurs were eaten alive by lice, according to a new study.",https://www.foxnews.com/science/feathered-dinosaurs-were-eaten-by-lice-study-says,https://static.foxnews.com/foxnews.com/content/uploads/2019/12/Mesophthirus-engeli-1.jpg,2019-12-11T17:07:30Z,"Paleontologists have discovered that feathered dinosaurs were eaten alive by lice-like insects, according to a new study.
The researchers looked at pieces of amber, roughly 99 million years old, and found that the feathers are covered with lice-like insects … [+2062 chars]",fox-news,Fox News
Michael Hollan,"Instagram model confronts robber while naked, refutes claims it was staged",An Instagram model is fighting back against claims she staged a terrifying robbery.,https://www.foxnews.com/lifestyle/instagram-model-robber-naked,https://static.foxnews.com/foxnews.com/content/uploads/2019/12/f28fcddf-Robber.jpg,2019-12-11T17:03:12Z,"An Instagram model is fighting back against claims she staged a terrifying robbery.
Shocking footage captured by security cameras caught the moment that the model, Danii Banks, came upon an unidentified man with a gun while she was naked in her apartment. Th… [+1741 chars]",fox-news,Fox News
Andy Sahadeo,Savannah Guthrie undergoes eye surgery after son threw toy train at her,“Today” show anchor Savannah Guthrie is undergoing eye surgery following an accident with her son’s toy train.,https://www.foxnews.com/entertainment/savannah-guthrie-eye-surgery,https://static.foxnews.com/foxnews.com/content/uploads/2019/01/savannah-guthrie-getty.jpg,2019-12-11T17:01:15Z,"“Today” show anchor Savannah Guthrie is undergoing eye surgery after finding herself on the receiving end of her son’s toy train.
Guthrie, 47, missed Wednesday’s “Today” show to undergo retinal detachment surgery after son Charley, 3, threw a toy train that … [+1733 chars]",fox-news,Fox News
Tucker Carlson,Tucker Carlson: Democrats' Trump impeachment focus sends voters clear message: We don't care what you think,"It's possible that instead of securing victory in 2020, these impeachment efforts could be leading the Democrats into a catastrophe.",https://www.foxnews.com/us/tucker-carlson-democrats-trump-impeachment-voters,https://media2.foxnews.com/BrightCove/694940094001/2019/12/11/694940094001_6114733660001_6114735032001-vs.jpg,2019-12-11T17:00:37Z,"At 11:59 a.m. on January 20th, 2017, Donald Trump took the oath of office and became the president of the United States. By 12:05 that same day, Democrats were calling for his impeachment. 
And that's barely an exaggeration, if at all.
Literally, for years,… [+11069 chars]",fox-news,Fox News
Gerren Keith Gaynor,"Angry groom loses it during wedding cake cutting ceremony, leaving guests and bride horrified","A Facebook video shows a man completely losing it during a botched cake cutting ceremony at his and wife’s wedding reception, leaving guests and his new bride horrified.",https://www.foxnews.com/lifestyle/angry-groom-loses-it-wedding-cake-cutting-ceremony,https://static.foxnews.com/foxnews.com/content/uploads/2019/12/iStock-Wedding-Cake.jpg,2019-12-11T16:57:52Z,"A wedding day is usually considered to be the happiest day in a couple's life, but for one hot-headed groom, that was definitely not the case.
A shocking Facebook video shows a man completely losing it during a botched cake cutting ceremony at his wedding re… [+2064 chars]",fox-news,Fox News
Brian Flood,CNN skips Lindsey Graham’s opening statement before Senate Judiciary Committee,"CNN declined to televise Senate Judiciary chairman Lindsey Graham, R-S.C., deliver his opening statement on Wednesday prior to Justice Department Inspector General Michael Horowitz testifying.",https://www.foxnews.com/media/cnn-skips-lindsey-grahams-opening-statement,https://media2.foxnews.com/BrightCove/694940094001/2019/12/11/694940094001_6114954045001_6114952783001-vs.jpg,2019-12-11T16:57:40Z,"CNN was alone among the three major cable news networks in deciding not to televise Senate Judiciary Chairman Lindsey Graham, R-S.C., deliver his opening statement on Wednesday prior to Justice Department Inspector General Michael Horowitz's hotly-anticipated… [+3105 chars]",fox-news,Fox News
Ryan Gaydos,Atlanta Hawks' Trae Young declares game over before Miami Heat's furious comeback win,Trae Young and the Atlanta Hawks thought they had the win in the bag Tuesday night.,https://www.foxnews.com/sports/hawks-trae-young-game-over-heat-comeback,https://static.foxnews.com/foxnews.com/content/uploads/2019/12/Trae-Young.jpg,2019-12-11T16:54:58Z,"Trae Young and the Atlanta Hawks thought they had the win in the bag Tuesday night, but then the Heat got hot.
Young went as far as declaring the game over when his team was up six with about one minute left in the game against the Miami Heat. But the second… [+1062 chars]",fox-news,Fox News
Alexandra Deabler,"North Carolina Bojangles' ceiling collapses in dining room, Twitter video shows",Have a little plaster with your biscuit.,https://www.foxnews.com/food-drink/bojangles-ceiling-collapses-twitter,https://static.foxnews.com/foxnews.com/content/uploads/2018/09/Bojanglesedit.jpg,2019-12-11T16:53:59Z,"Have a little plaster with your biscuit.
The ceiling at a Bojangles’ Famous Chicken 'n Biscuits in North Carolina collapsed onto tables and chairs in the restaurant’s dining area last week, as seen in Twitter footage that has been widely shared on social med… [+1663 chars]",fox-news,Fox News
The Sun,Reality TV star Lucie Donlan shows off incredible weight loss,"""Love Island""s Lucie Donlan looks totally different after losing weight by spending her spare time surfing, skiing and hitting the gym.",https://www.foxnews.com/entertainment/lucie-donlan-weight-loss-love-island,https://static.foxnews.com/foxnews.com/content/uploads/2019/12/luciedonlan.jpg,2019-12-11T16:53:21Z,"""Love Island""s Lucie Donlan looks totally different after losing weight by spending her spare time surfing, skiing and hitting the gym.
The 22-year-old reality star showed off her incredible figure in sexy snaps while holidaying in Bali this week.
Despite a… [+1610 chars]",fox-news,Fox News
Talia Kaplan,George Papadopoulos on FBI misconduct: 'Makes Watergate look like small potatoes',Former Trump campaign foreign policy adviser George Papadopoulos said the FBI misconduct during the 2016 presidential campaign “was essentially an electronic government-supported break-in of the Trump campaign and it makes Watergate look like small potatoes.”,https://www.foxnews.com/media/george-papadopoulos-on-fbi-misconduct-makes-watergate-look-like-small-potatoes,https://static.foxnews.com/foxnews.com/content/uploads/2019/12/Papadopoulos-1.jpg,2019-12-11T16:49:29Z,Former Trump campaign foreign policy adviser George Papadopoulos told Fox News' Martha MacCallum that the FBI misconduct during the 2016 presidential campaign “was essentially an electronic government-supported break-in of the Trump campaign and it makes Wate… [+3012 chars],fox-news,Fox News
"Harry Pettit, Senior Digital Technology and Science Reporter",Bizarre 100-year cover-up of ‘penguin prostitution’ in Antarctica revealed by book,"A century-long cover up of the ""depraved"" sex acts of penguins has been uncovered in a new book.",https://www.foxnews.com/science/bizarre-100-year-cover-up-of-penguin-prostitution-in-antarctica-revealed-by-book,https://static.foxnews.com/foxnews.com/content/uploads/2019/03/288f209e-AP19081688184336.jpg,2019-12-11T16:48:52Z,"A century-long cover-up of the ""depraved"" sex acts of penguins has been uncovered in a new book.
British scientist Dr. George Murray Levick observed frisky Antarctic penguins engaging in gang rapes and even ""prostitution"" during the early 20th Century.
He w… [+2344 chars]",fox-news,Fox News
Janine Puhak,Meghan Markle's designer pal ordered to stop advertising with royal's photos: report,"The duchesss' “Markle sparkle” is not for sale, Buckingham Palace says.",https://www.foxnews.com/lifestyle/meghan-markle-pal-designer-reprot,https://static.foxnews.com/foxnews.com/content/uploads/2019/09/meghan-markle-africa-tour-image.jpg,2019-12-11T16:46:57Z,"Buckingham Palace has made it clear that the Duchess of Sussex’s influential “Markle sparkle” is not for sale, after reportedly ordering designer Jennifer Meyer to remove photos of the duchess from her eponymous jewelry brand’s online presence.
On Tuesday, a… [+2590 chars]",fox-news,Fox News
Yael Halon,Sean Hannity: 'My faith has gotten stronger as I've gotten older',"Sean Hannity opened up about his faith in a holiday edition of ""Ainsley's Bible Study"" on Fox Nation, revealing the ups and downs of his religious journey and how his faith has changed over the years.",https://www.foxnews.com/media/sean-hannity-faith-stronger-christian-ainsley-earhardt,https://static.foxnews.com/foxnews.com/content/uploads/2018/11/SEAN_HANNITY_058-1.jpg,2019-12-11T16:45:28Z,"Sean Hannityopened up about his faith in a holiday edition of ""Ainsley's Bible Study"" on Fox Nation, revealing the ups and downs of his religious journey and how his faith has changed over the years.
""My faith actually has gotten stronger as I've gotten olde… [+6953 chars]",fox-news,Fox News
Ryan Gaydos,Philip Rivers' trash-talking clip against Jacksonville Jaguars delights social media,Los Angeles Chargers quarterback Philip Rivers delighted social media Tuesday when sound from his game against the Jacksonville Jaguars revealed his epic trash-talking.,https://www.foxnews.com/sports/philip-rivers-trash-talking-clip-chargers-jaguars,https://static.foxnews.com/foxnews.com/content/uploads/2019/12/Philip-Rivers2.jpg,2019-12-11T16:41:36Z,"Los Angeles Chargers quarterback Philip Rivers delighted social media Tuesday when sound from his game against the Jacksonville Jaguars revealed his epic trash-talking.
Rivers, who is known for being one of the cleanest trash talkers in football, gave Jaguar… [+1039 chars]",fox-news,Fox News
Ryan Gaydos,Patrick Reed defends himself in cheating controversy ahead of Presidents Cup,American golfer Patrick Reed defended himself from cheating accusations Tuesday after he was penalized for improving the lie of the ball at an event in the Bahamas last week.,https://www.foxnews.com/sports/patrick-reed-defends-cheating-controversy-presidents-cup,https://static.foxnews.com/foxnews.com/content/uploads/2019/12/Patrick-Reed.jpg,2019-12-11T16:37:04Z,"American golfer Patrick Reed defended himself from cheating accusations Tuesday after he was penalized for improving the lie of the ball at an event in the Bahamas last week.
Reed, who is set to be on the U.S. team for the Presidents Cup in Melbourne this we… [+1506 chars]",fox-news,Fox News
Marisa Schultz,Graham alleges ‘massive criminal conspiracy’ in FBI’s Russia probe in blistering hearing statement,"Republican Sen. Lindsey Graham accused the FBI officials who investigated the Trump campaign’s ties to Russia of a “massive criminal conspiracy,” in a fiery opening statement Wednesday for a hearing where the Justice Department's top watchdog testified.",https://www.foxnews.com/politics/graham-alleges-massive-criminal-conspiracy-in-fbis-russia-probe-in-blistering-hearing-statement,https://media2.foxnews.com/BrightCove/694940094001/2019/12/11/694940094001_6114943988001_6114951376001-vs.jpg,2019-12-11T16:32:28Z,"Republican Sen. Lindsey Graham accused the FBI officials who investigated the Trump campaign’s ties to Russia of a “massive criminal conspiracy” in a fiery opening statement Wednesday for a hearing where the Justice Department's top watchdog testified.
In a … [+2847 chars]",fox-news,Fox News
Associated Press,SAG Awards 2020: The complete list of nominees announced,"A list of the nominees for the 26th annual Screen Actors Guild Awards, announced Wednesday in West Hollywood, California:",https://www.foxnews.com/entertainment/sag-awards-2020-nominees,https://static.foxnews.com/foxnews.com/content/uploads/2019/12/sagwards.jpg,2019-12-11T16:31:47Z,"A list of the nominees for the 26th annual Screen Actors Guild Awards, announced Wednesday in West Hollywood, California:
MOVIES
Actor: Christian Bale, “Ford v Ferrari”; Leonardo DiCaprio, “Once Upon a Time ... in Hollywood”; Adam Driver, “Marriage Story”; … [+2524 chars]",fox-news,Fox News
Nicole Darrah,"Ex-NYPD chief Kerik pays tribute to slain New Jersey cop, says his own son is 'doing OK': 'I'm proud of him'","The son of former New York City Police Commissioner Bernard Kerik was among the law enforcement officials who responded to a ""targeted"" shooting in Jersey City, N.J., Tuesday that left four people — including a police officer — dead.",https://www.foxnews.com/us/bernard-kerik-slain-new-jersey-cop-son-proud,https://media2.foxnews.com/BrightCove/694940094001/2019/12/11/694940094001_6114874320001_6114873019001-vs.jpg,2019-12-11T16:30:43Z,"The son of former New York City Police Commissioner Bernard Kerik was among the law enforcement officials who responded to a ""targeted"" shooting in Jersey City, N.J., that left four people – including a police officer – dead.
Joseph Kerik, a detective in New… [+2221 chars]",fox-news,Fox News
Melissa Roberto,Sex cult convict Keith Raniere's former neighbors 'terrified' after documentary claims he poisoned women in NY home,"Chilling evidence in a new documentary indicates that NXIVM sex cult leader Keith Raniere may have poisoned women within his former upstate New York home. Now, Fox News has exclusively learned that residents still living in the neighborhood where the alleged …",https://www.foxnews.com/us/nxivm-sex-cult-convict-keith-raniere-neighbors-terrified-new-documentary-poisoned-women,https://static.foxnews.com/foxnews.com/content/uploads/2019/12/NXM_FRANKPARLOTO_Keith-Raniere-Photo-03.jpg,2019-12-11T16:26:54Z,"Chilling evidence in a new documentary indicates that NXIVM sex cult leader Keith Raniere may have poisoned women within his former upstate New York home.
Now, Fox News has exclusively learned that residents still living in the neighborhood where the alleged… [+4230 chars]",fox-news,Fox News
Alexandra Deabler,"Man, 18, arrested for 'disturbing video' showing him riding trapped mule deer",An 18-year-old Oregon man has been arrested on wildlife harassment and animal abuse charges.,https://www.foxnews.com/great-outdoors/18-arrested-video-riding-back-mule-deer,https://static.foxnews.com/foxnews.com/content/uploads/2019/12/Deer-Rider-OSP.jpg,2019-12-11T16:25:29Z,"An 18-year-old Oregon man has been arrested on wildlife harassment and animal abuse charges after a teen — believed to be the young man — was filmed riding on the back of a trapped mule deer buck and pulling on its antlers while it made distressed noises, off… [+1593 chars]",fox-news,Fox News
Joshua Nelson,"Billionaire launches $25 million campaign against anti-Semitism, praises new action by President Trump","Ronald Lauder, the billionaire heir to Estee Lauder Companies and president of the World Jewish Congress, said on Wednesday that President Trump’s effort to crack down on anti-Semitism by making it a federal crime is a “great step.”",https://www.foxnews.com/media/billionaire-lauder-anti-semitism-praises-trump,https://static.foxnews.com/foxnews.com/content/uploads/2019/12/Screen-Shot-2019-12-11-at-10.42.59-AM.png,2019-12-11T16:21:43Z,"Ronald Lauder, the billionaire heir to Estee Lauder Companies and president of the World Jewish Congress, said on Wednesday that President Trump’s effort to crack down on anti-Semitism by making it a federal crime is a “great step.”
Trump is expected to issu… [+1957 chars]",fox-news,Fox News
Madeline Farber,Woman conscious during surgery after anesthesia mishap: ‘The nightmares have been horrendous’,A British woman says she wakes from “horrendous” nightmares multiple times a week and suffers from post-traumatic stress disorder after undergoing a surgical procedure while conscious.,https://www.foxnews.com/health/woman-conscious-surgery-wrong-anesthesia-uk,https://static.foxnews.com/foxnews.com/content/uploads/2019/12/operating-room-.jpg,2019-12-11T16:19:59Z,A British woman claims she wakes from “horrendous” nightmares multiple times a week and suffers from post-traumatic stress disorder after undergoing a surgical procedure while conscious. She’s now seeking legal action against the hospital which has reportedly… [+2689 chars],fox-news,Fox News
James Rogers,Thousands of strange holes discovered off California coast,"Scientists have discovered thousands of mysterious holes in the seabed off Big Sur, Calif.",https://www.foxnews.com/science/thousands-strange-holes-discovered-off-california-coast,https://static.foxnews.com/foxnews.com/content/uploads/2019/12/CaliforniaSeaFloorMBARI3.jpg,2019-12-11T16:15:52Z,"Scientists have discovered thousands of mysterious holes in the seabed off Big Sur, Calif.
Researchers from the Monterey Bay Aquarium Research Institute (MBARI) were surveying the deep seafloor off Big Sur when they discovered the strange holes.
The larger … [+2316 chars]",fox-news,Fox News
Barnini Chakraborty,"California city considers ban on feeding homeless on public streets, sidewalks, parking lots","A California city is considering a controversial measure that would limit the places where the homeless could get food. If passed, handing out food in Lancaster would be banned on public streets, sidewalks, parking lots and other city-owned property.",https://www.foxnews.com/us/california-city-considers-ban-on-feeding-homeless-on-public-streets-sidewalks-parking-lots,https://static.foxnews.com/foxnews.com/content/uploads/2019/12/homeless-Lancaster-Getty.jpg,2019-12-11T16:14:14Z,"A California city is considering a controversial measure that would limit the places where the homeless can get food.
If passed, handing out food in Lancaster would be banned on public streets, sidewalks, parking lots and other city-owned property.
Supporte… [+2235 chars]",fox-news,Fox News
Melissa Roberto,"Teri Hatcher, 55, flaunts muscles in 'liberating' bikini pic","Teri Hatcher feels comfortable in her skin at 55 - and she wants her thousands of Instagram followers to know it. The ""Desperate Housewives"" star took to Instagram on Tuesday to showcase her trim figure in a two-piece bikini.",https://www.foxnews.com/entertainment/teri-hatcher-bikini-instagram-age-55,https://static.foxnews.com/foxnews.com/content/uploads/2019/10/teri-hatcher-2018-getty.jpg,2019-12-11T16:03:15Z,"Teri Hatcher feels comfortable in her skin at 55--and she wants her thousands of Instagram followers to know it.
The ""Desperate Housewives"" star took to Instagram on Tuesday to showcase her trim body in a two-piece bikini. She credited her muscular figure to… [+1860 chars]",fox-news,Fox News
Alexandria Hein,"Boy, 1, nearly dies after choking on peanut, report says",The child was rushed to the emergency room where a scan revealed a peanut was blocking his airway.,https://www.foxnews.com/health/boy-nearly-dies-choking-peanut-report,https://static.foxnews.com/foxnews.com/content/uploads/2018/09/PeanutsFDA.jpg,2019-12-11T16:03:12Z,"A 1-year-old boy eating peanuts for a snack nearly died after a piece wound up in his windpipe and he fainted. The boy, whose name was not released, was rushed to Shenzhen Children’s Hospital in south China by his mother, where he was placed in the intensive … [+1391 chars]",fox-news,Fox News
Andy Sahadeo,A$AP Rocky returning to Sweden to perform months after conviction,A$AP Rocky is set to perform in Sweden months after a street fight that led to his assault conviction in August. The rapper previously expressed interest in returning to the country to perform for inmates.,https://www.foxnews.com/entertainment/asap-rocky-sweden-return-perform-after-conviction,https://static.foxnews.com/foxnews.com/content/uploads/2019/11/asap-rocky-ap.jpg,2019-12-11T16:02:44Z,"A$AP Rocky is set to perform in Sweden months after a street fight that led to his assault conviction in August. The rapper previously expressed interest in returning to the country to perform for inmates.
The artist, whose real name is Rakim Mayers, will ap… [+979 chars]",fox-news,Fox News
Paulina Dedaj,"Naval air station shooter may have been radicalized as early as 2015, report says","The Saudi national who killed three U.S. sailors after opening fire inside a classroom at a Navy air station in Florida last week could have been radicalized as early as 2015, a new report revealed.",https://www.foxnews.com/us/naval-air-station-shooter-may-have-been-radicalized-as-early-as-2015-report-reveals,https://static.foxnews.com/foxnews.com/content/uploads/2019/12/Mohammed-Alshamrani-FBI.jpg,2019-12-11T16:00:32Z,"The Saudi national who opened fire and killed three U.S. sailors inside a classroom at a Navy air station in Florida last week could have been radicalized as early as 2015, a new report revealed.
Hours before Mohammed Saeed Alshamrani, 21, went on a shooting… [+2817 chars]",fox-news,Fox News
Nate Day,"Keanu Reeves' 'John Wick 4' and 'Matrix 4' to be released same day, Internet dubs it 'Keanu Reeves Day'","This year was a big one for Keanu Reeves and it's beginning to look like 2021 will be, too -- or at least one weekend will be.",https://www.foxnews.com/entertainment/keanu-reeves-john-wick-4-matrix-4-released-same-day,https://static.foxnews.com/foxnews.com/content/uploads/2019/06/keanu-reeves-toy-story2.jpg,2019-12-11T23:57:43Z,"This year was a big one for Keanu Reeves, and it's beginning to look like 2021 will be, too -- or at least one weekend will be.
Warner Bros. has announced that ""Matrix 4,"" starring the 55-year-old actor, will be released on May 21, 2021, according to The Hol… [+1124 chars]",fox-news,Fox News
