author,title,description,url,urlToImage,publishedAt,content,source.id,source.name
Charles Creitz,"Rep. Doug Collins: Adam Schiff 'can't spell truth, much less tell it'","House Judiciary Committee ranking member Doug Collins, R-Ga., blasted House Intelligence Committee Chairman Adam Schiff, D-Calif., as a chronic liar who is hurting his own party with his mission to impeach President Trump.",https://www.foxnews.com/media/doug-collins-adam-schiff-trump-impeachment-truth,https://static.foxnews.com/foxnews.com/content/uploads/2019/12/eb311e0a-ENC3_132205051652430000-1.jpg,2019-12-11T03:44:31Z,"House Judiciary Committee ranking member Doug Collins, R-Ga., blasted House Intelligence Committee Chairman Adam Schiff, D-Calif., as a chronic liar who is hurting his own party with his mission to impeachPresident Trump.
On Tuesday's ""Hannity,"" host Sean Ha… [+1984 chars]",fox-news,Fox News
Frank Miles,Pentagon to evaluate legality of putting troops at US-Mexico border,The Pentagon's independent investigations office announced Tuesday that the legality of the Trump administration’s use of the military at the U.S. border with Mexico will be evaluated.,https://www.foxnews.com/politics/pentagon-evaluate-legality-troops-us-mexico-border,https://media2.foxnews.com/BrightCove/694940094001/2019/12/09/694940094001_6114141497001_6114138772001-vs.jpg,2019-12-11T03:23:29Z,"The Pentagon's independent investigations office announced Tuesday that it will evaluate the legality of the Trump administration’s use of the military at the U.S. border with Mexico.
Glenn Fine, the acting inspector general (IG) of the Defense Department wh… [+1749 chars]",fox-news,Fox News
Nate Day,Julianne Hough on revealing she's 'not straight': 'I’ve never been a fan of labels',"Julianne Hough made headlines in August when she revealed to Women's Health that she's ""not straight.""",https://www.foxnews.com/entertainment/julianne-hough-on-revealing-not-straight,https://static.foxnews.com/foxnews.com/content/uploads/2018/09/4b92e0c9-julianne-hough-reuters.jpg,2019-12-11T03:22:46Z,"Julianne Hough made headlines in August when she revealed to Women's Health that she's ""not straight.""
The 31-year-old dancer-singer-actress didn't offer a label for her sexuality, and it turns out there's a reason.
“It was all about de-layering and that’s … [+2334 chars]",fox-news,Fox News
Victor Garcia,Sean Hannity to James Comey: 'You hurt the premier law enforcement agency of the world',Sean Hannity defended his reporting Tuesday on the FBI's Russia investigation and blasted former FBI director James Comey over Department of Justice Inspector General Michael Horowitz's report.,https://www.foxnews.com/media/sean-hannity-to-james-comey-you-hurt-the-premier-law-enforcement-agency-of-the-world,https://static.foxnews.com/foxnews.com/content/uploads/2019/07/Hannity-Comey_Fox-Getty.jpg,2019-12-11T03:20:21Z,"Sean Hannity defended his reporting Tuesday on the FBI's Russia investigation and blasted former FBI director James Comey over Department of Justice Inspector General Michael Horowitz's report.
""For two and a half years, our ensemble cast. We got the crap be… [+1660 chars]",fox-news,Fox News
Joseph Wulfsohn,Democrat Karen Bass says she's open to impeach Trump again if he gets reelected in 2020,"Rep. Karen Bass, D-Calif., said Tuesday she's willing to impeach President Trump again if he wins reelection in 2020.",https://www.foxnews.com/media/karen-bass-impeach-trump-2020,https://static.foxnews.com/foxnews.com/content/uploads/2019/06/Karen-Bass-Donald-Trump-Getty-AP.jpg,2019-12-11T03:16:38Z,"Rep. Karen Bass, D-Calif., said Tuesday she's willing to impeach President Trump again if he wins reelection in 2020.
TMZ founder Harvey Levin presented Bass with a scenario in which Trump wins a second term but Democrats take over the Senate from the Republ… [+1587 chars]",fox-news,Fox News
Gerren Keith Gaynor,"Redditor calls out wrong name during sex with boyfriend, asks: 'Is my relationship done?'","A Reddit user has shared that she mistakenly called out the wrong name during intercourse with her boyfriend, and it may just have cost her relationship.",https://www.foxnews.com/lifestyle/redditor-calls-wrong-name-sex-boyfriend,https://static.foxnews.com/foxnews.com/content/uploads/2019/12/Couple.jpg,2019-12-11T03:14:14Z,"A Reddit user has shared that she mistakenly called out the wrong name during intercourse with her boyfriend, and it may just have left her single -- or at the very least, she'll have to change her relationship status to ""it's complicated.""
The 25-year-old a… [+2678 chars]",fox-news,Fox News
Nick Givas,"Russia's Sergey Lavrov meets with Trump, Pompeo, dismisses election-interference worries","After meeting with President Trump at the White House in the Oval Office on Tuesday, Russia's foreign minister Sergey Lavrov said there was no talk of election interference and brushed off the notion that it was a topic of importance.",https://www.foxnews.com/politics/trump-lavrov-russia-election-interference-meeting-ukraine,https://static.foxnews.com/foxnews.com/content/uploads/2019/12/Lavrov-Trump-Dec-10.jpg,2019-12-11T03:01:25Z,"After meeting with President Trump at the White House in the Oval Office on Tuesday, Russia's foreign minister Sergey Lavrov said there was no talk of election interference and brushed off the notion that it was a topic of importance.
Lavrov did, however, ac… [+1636 chars]",fox-news,Fox News
Julius Young,Kevin Hart reflects on 2019: 'My appreciation for life is the highest that it’s ever been',Kevin Hart is reflecting on what has been a whirlwind 2019 for the beloved funnyman.,https://www.foxnews.com/entertainment/kevin-hart-2019-appreciation-for-life,https://static.foxnews.com/foxnews.com/content/uploads/2019/01/ContentBroker_contentid-46f6dc37768243398469afa7a4f70ea1.png,2019-12-11T02:51:11Z,"Kevin Hart is reflecting on what has been a whirlwind 2019 for the beloved funnyman.
The “Jumanji: The Next Level” star was honored with a Hand and Footprint Ceremony at the famed TCL Chinese Theatre in Hollywood on Tuesday, and took to Instagram after the f… [+3199 chars]",fox-news,Fox News
,Rep. Collins: Schiff is taking the Democratic Party over the cliff with his lies,Rep. Schiff's 2018 FISA memo exposed as lies; House Judiciary Committee ranking member Doug Collins speaks out.,http://video.foxnews.com/v/6114749490001/,https://a57.foxnews.com/media2.foxnews.com/BrightCove/694940094001/2019/12/11/640/360/694940094001_6114741591001_6114749490001-vs.jpg,2019-12-11T02:49:49Z,,fox-news,Fox News
Morgan Phillips,Boris Johnson smashes through 'gridlock' wall in push to 'get Brexit done',UK Prime Minister Boris Johnson symbolically ended Brexit gridlock Tuesday by driving a bulldozer through a wall of foam bricks.,https://www.foxnews.com/world/boris-johnson-gridlock-wall-brexit-push,https://media2.foxnews.com/BrightCove/694940094001/2019/12/10/694940094001_6114585239001_6114589318001-vs.jpg,2019-12-11T02:48:07Z,"U.K. Prime Minister Boris Johnson symbolically ended Brexit gridlock Tuesday by driving a bulldozer through a wall of foam bricks.
Johnson was recorded driving a bulldozer labeled “Get Brexit Done” through a wall depicting the word “Gridlock” at a constructi… [+1801 chars]",fox-news,Fox News
Louis Casiano,Michael Avenatti looking to hide luxury expenses from Nike extortion trial jury,"Michael Avenatti doesn’t want jurors to know he was struggling to pay off a Ferrari, a Porsche and an airplane around the same time he allegedly tried to extort Nike out of more than $20 million.",https://www.foxnews.com/us/michael-avenatti-nike-extortion-trial-jury-luxury-expenses,https://static.foxnews.com/foxnews.com/content/uploads/2019/12/Michael-Avenatti.jpg,2019-12-11T02:48:04Z,"Michael Avenatti doesn’t want jurors to know he was struggling to pay off a Ferrari, a Porsche and an airplane around the same time he allegedly tried to extort Nike out of more than $20 million.
Lawyers for the firebrand attorney revealed the luxury purchas… [+862 chars]",fox-news,Fox News
,Hannity: Tools of intelligence were weaponized against a private citizen and a presidential campaign,Attorney General Barr doubles down on claims the FBI spied on Trump campaign.,http://video.foxnews.com/v/6114737838001/,https://a57.foxnews.com/media2.foxnews.com/BrightCove/694940094001/2019/12/11/640/360/694940094001_6114741588001_6114737838001-vs.jpg,2019-12-11T02:45:32Z,,fox-news,Fox News
Louis Casiano,"Ronny Jackson, former White House doctor and VA nominee, running for Congress in Texas",A former chief White House physician and one-time troubled nominee to lead the Department of Veterans Affairs is running for a congressional seat in Texas.,https://www.foxnews.com/politics/white-house-doctor-va-nominee-texas-congressional-seat,https://static.foxnews.com/foxnews.com/content/uploads/2019/12/AP19343829355892.jpg,2019-12-11T02:41:48Z,"A former chief White House physician and one-time troubled nominee to lead the Department of Veterans Affairs (VA) is running for a congressional seat in Texas.
Retired Navy Rear Adm. Ronny Jackson filed candidate paperwork in Austin to replace outgoing Rep.… [+1717 chars]",fox-news,Fox News
Victor Garcia,Brit Hume: Democrats using USMCA trade agreement as 'fig leaf' for Trump impeachment,Fox News senior political analyst Brit Hume said Tuesday that impeachment is not helping Democrats and that they are using the USMCA trade agreement to show Americans that they've done more than just try to impeach President Trump.,https://www.foxnews.com/media/brit-hume-democrats-using-usmca-tree-agreement-as-fig-leaf-for-trump-impeachment,https://static.foxnews.com/foxnews.com/content/uploads/2019/12/Carlson-Hume.jpg,2019-12-11T02:37:27Z,"Fox News senior political analyst Brit Hume said Tuesday that impeachment is not helping Democrats and that they are using the USMCA trade agreement to show Americans that they've done more than just try to impeach President Trump.
""That is something that th… [+1792 chars]",fox-news,Fox News
Betsy McCaughey,Betsy McCaughey: Impeachment is a vicious crime against voters who elected Trump president – He broke no laws,House Democrats are redefining “impeachable offense” to mean whatever President Trump does.,https://www.foxnews.com/opinion/betsy-mccaughey-impeachment-is-a-vicious-crime-against-voters-who-elected-trump-president-he-broke-no-laws,https://media2.foxnews.com/BrightCove/694940094001/2019/12/10/694940094001_6114703101001_6114707107001-vs.jpg,2019-12-11T02:32:38Z,House Democrats are redefining “impeachable offense” to mean whatever President Trump does. Democratic leaders announced two articles of impeachment against the president Tuesday that marked a radical departure from all of American history. For the first time… [+6246 chars],fox-news,Fox News
Charles Creitz,"Tucker Carlson: Democrats claim 'no one is above the law,' but act like they are",Tucker Carlson reacted Tuesday to House Democrats announcing articles of impeachment against President Trump by claiming that his accusers are guilty of the high crimes and misdemeanors they accuse him of committing.,https://www.foxnews.com/media/tucker-carlson-democrats-trump-impeachment-above-the-law,https://static.foxnews.com/foxnews.com/content/uploads/2019/12/ENC3_132204999938100000.jpg,2019-12-11T02:29:50Z,"Tucker Carlson reacted Tuesday to House Democrats announcing articles of impeachment against President Trump by claiming that his accusers are guilty of the high crimes and misdemeanors they accuse him of committing
Carlson played a montage of Democrats -- i… [+3501 chars]",fox-news,Fox News
Nate Day,Bette Midler calls out Justin Timberlake: 'When is Janet Jackson’s boob gonna get an apology?',Bette Midler isn't satisfied with Justin Timberlake's recent public apology to his wife Jessica Biel.,https://www.foxnews.com/entertainment/bette-midler-calls-out-justin-timberlake-janet-jackson-jessica-biel,https://static.foxnews.com/foxnews.com/content/uploads/2019/12/Bette-Midler-Justin-Timberlake.jpg,2019-12-11T02:24:31Z,"Bette Midler isn't satisfied with Justin Timberlake's recent public apology to his wife Jessica Biel.
After being spotted holding hands with actress Alisha Wainwright late last month, Timberlake, 38, addressed the incident on social media, calling it a ""stro… [+2252 chars]",fox-news,Fox News
Joseph Wulfsohn,"As Jersey City shooting unfolded, Katie Couric pushed again for gun control","Former broadcast news anchor Katie Couric pushed for gun control on Tuesday as the shooting in Jersey City, New Jersey was unfolding.",https://www.foxnews.com/media/jersey-city-shooting-katie-couric-gun-control,https://static.foxnews.com/foxnews.com/content/uploads/2019/12/Couric-Jersey-Shooting.jpg,2019-12-11T02:11:50Z,"Former broadcast news anchor Katie Couric pushed for gun control on Tuesday as the shooting in Jersey City, New Jersey, was unfolding.
Couric, best known as the co-anchor of NBC News' ""Today"" from 1991-2006, shared a tweet from a gun-control activist that co… [+1529 chars]",fox-news,Fox News
Bradford Betz,Jersey City detective killed in shooting is remembered for helping get many guns off the streets,"A cop who was among six people killed in a shootout that brought the streets of Jersey City to a standstill Tuesday had been credited with having led the department in the number of illegal guns removed from the streets in recent years, according to his super…",https://www.foxnews.com/us/hero-cop-killed-jersey-city-shootout-led-department-illegal-gun-seizures,https://static.foxnews.com/foxnews.com/content/uploads/2019/12/Joseph-Seals-Hawthorne-PBA.jpg,2019-12-11T01:58:12Z,"A New Jersey police officer who was among six people killed in a shootout that brought the streets of Jersey City to a standstill Tuesday had been credited with having led the department in the number of illegal guns removed from the streets in recent years, … [+1393 chars]",fox-news,Fox News
Frank Miles,"Michigan man who ran over, killed deputy sentenced to life without parole","A man, 24, was sentenced to life in prison without parole for running over and killing a sheriff's deputy in southeastern Michigan, according to reports.",https://www.foxnews.com/us/michigan-man-ran-over-killed-deputy-sentenced-life-without-parole,https://static.foxnews.com/foxnews.com/content/uploads/2019/12/Dep-Erick-Overall-Berak.jpg,2019-12-11T01:50:02Z,"A 24-year-old man was sentenced Tuesday to life in prison without parole for running over and killing a sheriff's deputy in southeastern Michigan in 2017, according to a report.
Christopher Berak was convicted last month for first-degree murder and the murde… [+1741 chars]",fox-news,Fox News
Associated Press,"Barrie Keeffe, 'The Long Good Friday' writer, dead at 74","Barrie Keeffe, screenwriter of classic British gangster movie “The Long Good Friday,” has died. He was 74.",https://www.foxnews.com/entertainment/barrie-keeffe-long-good-friday-writer-dead,https://static.foxnews.com/foxnews.com/content/uploads/2019/12/Barrie-Keeffe-Nigel-Sutton.jpg,2019-12-11T01:43:18Z,"Barrie Keeffe, screenwriter of classic British gangster movie “The Long Good Friday,” has died. He was 74.
Keeffe’s agent, Stephen Durbridge, said Keeffe died Tuesday in London after a short illness.
PHILIP MCKEON, 'ALICE' CHILD STAR, DEAD AT 55
London-bor… [+1121 chars]",fox-news,Fox News
Nate Day,Michelle Obama defends Ellen DeGeneres over George W. Bush friendship,Former First Lady Michelle Obama is speaking out about Ellen DeGeneres' heavily criticized friendship with former President George W. Bush.,https://www.foxnews.com/entertainment/michelle-obama-defends-ellen-degeneres-george-bush-friendship,https://static.foxnews.com/foxnews.com/content/uploads/2019/12/Michelle-obama-ellen-degeneres-george-w-bush.jpg,2019-12-11T01:41:49Z,"Former First Lady Michelle Obama is speaking out about Ellen DeGeneres' heavily criticized friendship with former President George W. Bush.
In October, DeGeneres, 61, received backlash after beeing seen laughing with Bush, 73, at a Dallas Cowboys game. Fans … [+1895 chars]",fox-news,Fox News
Gerren Keith Gaynor,Florida woman hilariously shares 'embarrassing' moment while spreading 'Christmas magic' at WaWa gas station,A Florida woman's video attempting to recount an “embarrassing” encounter at a Wawa gas station while trying to spread some Christmas cheer has gone viral -- because she could barely get through it without laughing.,https://www.foxnews.com/lifestyle/woman-christmas-magic-wawa-gas-station-video,https://static.foxnews.com/foxnews.com/content/uploads/2019/12/Wawa-iStock.jpg,2019-12-11T01:38:25Z,"A Florida woman's video attempting to recount an “embarrassing” encounter at a Wawa gas station while trying to spread some Christmas cheer has gone viral -- because she could barely get through it without laughing.
Mary Katherine Backstrom of Fort Myers too… [+2869 chars]",fox-news,Fox News
Nick Givas,McConnell bashed by Dems for delaying USMCA vote until after impeachment trial,"Senate Majority Leader Mitch McConnell, R-Ky., took fire from House Democrats on Tuesday after saying he will wait until after President Trump's impeachment trial is over before bringing the U.S.-Mexico-Canada Agreement (USMCA) to the Senate floor for a vote.",https://www.foxnews.com/politics/mcconnell-usmca-trump-democrats-impeachment-trial,https://static.foxnews.com/foxnews.com/content/uploads/2019/11/AP19310674993097.jpg,2019-12-11T01:34:06Z,"Senate Majority Leader Mitch McConnell, R-Ky., took fire from House Democrats on Tuesday after saying he will wait until after President Trump's impeachment trial is over before bringing the U.S.-Mexico-Canada Agreement (USMCA) to the Senate floor for a vote.… [+2837 chars]",fox-news,Fox News
Associated Press,Netflix says more than 26 million watched 'The Irishman' in 7 days,Netflix says that 26.4 million households worldwide watched “The Irishman” in its first week of streaming.,https://www.foxnews.com/entertainment/netflix-irishman-26-million-7-days,https://static.foxnews.com/foxnews.com/content/uploads/2019/12/AP19338805597453.jpg,2019-12-11T01:32:32Z,"Netflix says that 26.4 million households worldwide watched “The Irishman” in its first week of streaming.
That figure includes those who watched at least 70% of Martin Scorsese's 3 1/2 hour crime epic. Netflix selectively announces viewership for its films … [+1168 chars]",fox-news,Fox News
Louis Casiano,Federal judge blocks Trump plan to spend millions in military funds on border wall construction,A federal judge in Texas has blocked the Trump administration from using $3.6 billion earmarked for the military to fund border wall construction.,https://www.foxnews.com/politics/federal-judge-blocks-trump-plan-millions-military-funds-border-wall-construction,https://static.foxnews.com/foxnews.com/content/uploads/2019/12/Border-Wall-iStock.jpg,2019-12-11T01:22:19Z,"A federal judge in Texas has blocked the Trump administration from using $3.6 billion earmarked for the military to fund border wall construction.
District Court Judge David Briones, a Bill Clinton appointee, ruled in an El Paso court Tuesday that the money … [+1541 chars]",fox-news,Fox News
Joseph Wulfsohn,"Ahead of 'Richard Jewell' release, controversy swirls over Atlanta newspaper at center of Clint Eastwood film","A local newspaper at the center of the new Clint Eastwood film ""Richard Jewell"" is sparking a national debate over the movie's portrayal of one of its journalists.",https://www.foxnews.com/media/richard-jewell-clint-eastwood-atlanta-journal-constitution-controversy,https://static.foxnews.com/foxnews.com/content/uploads/2019/12/Rochard-Jewell-Olivia-Wilde-Warner-Bros-Picutres.jpg,2019-12-11T01:20:02Z,"A local newspaper at the center of the new Clint Eastwood film ""Richard Jewell"" is sparking a national debate over the movie's portrayal of one of its journalists.
The film, set for release Friday, was inspired by the real-life events surrounding Richard Jew… [+3684 chars]",fox-news,Fox News
Morgan Phillips,Buttigieg releases list of clients from 2007-2010 consulting work,"Pete Buttigieg on Tuesday released a list of the corporations he worked for while employed as a management consultant at McKinsey & Company, amid a growing demand for transparency.",https://www.foxnews.com/politics/buttigieg-releases-client-list-consulting-work,https://media2.foxnews.com/BrightCove/694940094001/2019/12/06/694940094001_6113691398001_6113685838001-vs.jpg,2019-12-11T01:15:51Z,"Pete Buttigieg on Tuesday released a list of the corporations he worked for while employed as a management consultant at McKinsey &amp; Company, amid a growing demand for transparency.
For the first two and a half years after his education, Buttigieg took a … [+3586 chars]",fox-news,Fox News
Charles Watson,Mississippi residents put makeshift Christmas tree into pothole in hopes of getting street fixed,"People living in McComb, Mississippi, have added street work to their Christmas lists after they said the city left them with a gaping pothole, and now they’re using holiday cheer to bring some attention to it.",https://www.foxnews.com/us/mississippi-pothole-makeshift-christmas-tree,https://static.foxnews.com/foxnews.com/content/uploads/2019/12/IMG_1791-2.jpg,2019-12-11T01:14:39Z,"MCCOMB, Miss. — People living in McComb, Mississippi, have added street work to their Christmas lists after they said the city left them with a gaping pothole, and now they’re using holiday cheer to bring some attention to it.
At the corner of North James Av… [+3339 chars]",fox-news,Fox News
Bradford Betz,Jersey City shooting: Bernard Kerik’s son among officers hospitalized,The son of former New York City Police Commissioner Bernard Kerik was one of the law enforcement officers who fatally shot the armed suspects who opened fire on police and civilians in Jersey City Tuesday.,https://www.foxnews.com/us/jersey-city-shooting-bernard-kerik-son-among-officers-hospitalized,https://static.foxnews.com/foxnews.com/content/uploads/2019/12/Bernard-Kerik.jpg,2019-12-11T01:09:24Z,"The son of former New York City Police Commissioner Bernard Kerik was one of the law enforcement officers who fatally shot armed suspects who opened fire on police and civilians in Jersey City, N.J., on Tuesday. 
Joseph Kerik, a police officer from Newark, N… [+1642 chars]",fox-news,Fox News
Gary Gastelu,"The 2021 Chevrolet Tahoe and Suburban debut with more room, new tech and a diesel",Chevrolet's new flagships are ready for battle.,https://www.foxnews.com/auto/chevrolet-tahoe-suburban-debut-2021-diesel,https://static.foxnews.com/foxnews.com/content/uploads/2019/12/ts1.jpg,2019-12-11T01:04:15Z,"Chevrolet’s new flagships are ready for battle.
(Chevrolet)
The automaker unveiled the 2021 Tahoe and Suburban on Tuesday night, marking their first redesigns in five years. The all-new SUVs are based on GM’s latest full-size truck platform and larger than … [+3039 chars]",fox-news,Fox News
Nate Day,Quentin Tarantino on 'Kill Bill 3': It's 'definitely in the cards',"""Kill Bill"" fans rejoice: director Quentin Tarantino has offered good news about a possible addition to the franchise.",https://www.foxnews.com/entertainment/quentin-tarantino-kill-bill-3,https://static.foxnews.com/foxnews.com/content/uploads/2019/10/Michael-Tran_FilmMagic_Getty-1.jpg,2019-12-11T00:56:56Z,"""Kill Bill"" fans rejoice: director Quentin Tarantino has offered good news about a possible addition to the franchise.
In a discussion with Andy Cohen, the 56-year old director revealed that a third movie may eventually follow ""Kill Bill: Vol. 1"" and ""Kill B… [+1658 chars]",fox-news,Fox News
Nate Day,"Megan Fox, Brian Austin Green make rare joint red carpet appearance",Megan Fox and husband Brian Austin Green made a rare joint red carpet appearance for a charity event on Monday night.,https://www.foxnews.com/entertainment/megan-fox-brian-austin-green-red-carpet-five-years,https://static.foxnews.com/foxnews.com/content/uploads/2019/12/Megan-Fox-Brian-Austin-Green.jpg,2019-12-11T00:53:20Z,"Megan Fox and husband Brian Austin Green made a rare joint red carpet appearance for a charity event on Monday night.
The duo attended PUBG Mobile's #Fight4TheAmazon event in Hollywood. The evening marked the couple's first red carpet outing together in five… [+1848 chars]",fox-news,Fox News
Gary Gastelu,Gordon Murray's $2.6 million T.50 supercar sucks... air,A blast (of air) from the past,https://www.foxnews.com/auto/gordon-murrays-t-50-supercar,https://static.foxnews.com/foxnews.com/content/uploads/2019/12/gma1.jpg,2019-12-11T00:40:01Z,"It’s a blast (of air) from the past.
(Gordon Murray Automotive)
The T.50 supercar was created to be the ultimate ‘analog’ supercar before everything goes completely electric and computer-controlled. The $2.6 million coupe is the brainchild of McLaren F1 des… [+1940 chars]",fox-news,Fox News
,"Nativity scene depicts Jesus, Mary and Joseph in cages starts public debate","The Nativity scene showing Jesus, Mary and Joseph as refugees separated in cages at a California church creates controversy; Jonathan Hunt reports.",http://video.foxnews.com/v/6114723480001/,https://a57.foxnews.com/media2.foxnews.com/BrightCove/694940094001/2019/12/11/640/360/694940094001_6114721880001_6114723480001-vs.jpg,2019-12-11T00:38:30Z,,fox-news,Fox News
