author,title,description,url,urlToImage,publishedAt,content,source.id,source.name
Associated Press,Thompson-Herah breaks Flo Jo’s Olympic record in women’s 100,"Streaking down the track, with only six steps to go until she reached the finish line, Elaine Thompson-Herah stuck out her left arm and started pointing at the clock. She knew she had the win.",https://www.foxnews.com/sports/thompson-herah-flo-jos-olympic-record,https://static.foxnews.com/foxnews.com/content/uploads/2021/07/AP21212466862182.jpg,2021-07-31T17:37:04Z,"Streaking down the track, with only six steps to go until she reached the finish line, Elaine Thompson-Herah stuck out her left arm and started pointing at the clock.
She knew she had the win.
It w… [+6853 chars]",fox-news,Fox News
Julius Young,‘Flip or Flop’ resumes production after Tarek El Moussa’s alleged blow up at ex Christina Haack,"The reality stars are said to have filmed their latest episode on Thursday, according to People magazine and Haack, 38, shared photos to her Instagram Story of herself on set of the “Spanish style flip.”",https://www.foxnews.com/entertainment/flip-or-flop-resumes-after-tarek-el-moussas-alleged-blow-up-christina-haack,https://static.foxnews.com/foxnews.com/content/uploads/2019/09/heather-rae-young-tarek-el-moussa-christina-anstead.jpg,2021-07-31T17:27:05Z,"A little over a week after Tarek El Moussaallegedly blew up at his ex-wife and ""Flip or Flop"" co-host Christina Haack, production has reportedly resumed following the schism.
The reality stars are s… [+3038 chars]",fox-news,Fox News
Peter Aitken,US Marine quick reaction force deployed twice in last 30 days to defend embassies,The U.S. Marine Security Augmentation Unit has deployed twice in the past 30 days to support and protect embassies in Africa and the Caribbean.,https://www.foxnews.com/world/us-marine-force-deployed-twice-defend-embassies,https://static.foxnews.com/foxnews.com/content/uploads/2021/07/MSAU-1.jpg,2021-07-31T17:19:01Z,"The U.S. MarineSecurity Augmentation Unit has deployed twice in the past 30 days to support and protect embassies in Africa and the Caribbean. 
The quick reaction force consists of 145 Marines who c… [+3643 chars]",fox-news,Fox News
Julia Musto,How to travel safely and avoid injury during wildfire season,"As wildfires continue to ravage the western U.S., smoke and drought conditions have complicated the lives of Americans far beyond the reach of the flames.",https://www.foxnews.com/us/how-to-travel-safely-during-wildfire-season,https://static.foxnews.com/foxnews.com/content/uploads/2021/07/Wildfires-Silver-Lake-Burnt-Sign.gif,2021-07-31T17:15:52Z,"As wildfires continue to ravage the westernU.S., smoke and drought conditions have complicated the lives of Americans far beyond the reach of the flames. 
According to the National Interagency Fire … [+2855 chars]",fox-news,Fox News
Emma Colton,"Bill Maher slams CDC's ‘confusing’ new mask guidance: 'It's called science, people!'","“Real Time” host Bill Maher mocked the Centers for Disease Control and Prevention’s updated mask guidance, calling it “confusing.”",https://www.foxnews.com/entertainment/bill-maher-cdc-mask-update-mocks,https://static.foxnews.com/foxnews.com/content/uploads/2020/11/GettyImages-1229316596.jpg,2021-07-31T17:14:46Z,"""Real Time"" host Bill Maher mocked the Centers for Disease Control and Preventions updated mask
 guidance, calling it ""confusing.""
""The CDC put out new mask guidelines now, which, its all just so f… [+2099 chars]",fox-news,Fox News
Marisa Schultz,Border crisis: Legislation aims to help ranchers reeling from illegal immigrant property damage,"FIRST ON FOX: Brent Smith sees first-hand how illegal immigrants have wrecked havoc on ranchers and farmers located along the U.S.-Mexico border, from regular property damage to constant fears of going outside at night.",https://www.foxnews.com/politics/border-crisis-legislation-ranchers-illegal-immigrant-property-damage,https://static.foxnews.com/foxnews.com/content/uploads/2021/06/August-migrants-2-copy.jpg,2021-07-31T16:53:29Z,"FIRST ON FOX: Brent Smith sees first-hand how illegal immigrants have wrecked havoc on ranchers and farmers located along the U.S.-Mexico border, from regular property damage to constant fears of goi… [+4222 chars]",fox-news,Fox News
Emma Colton,Trooper escorts woman in labor to hospital after pulling her over for speeding,A Kentucky state trooper escorted a woman in labor to the hospital after he pulled her over for speeding.,https://www.foxnews.com/us/kentucky-trooper-woman-labor-escort-hospital-speeding,https://static.foxnews.com/foxnews.com/content/uploads/2021/07/Kentucky-State-Trooper-e1627748346410.jpg,2021-07-31T16:29:58Z,"A Kentucky
 state trooper
 escorted a woman in labor to the hospital after he pulled her over for speeding. 
""I went from, you know, thinking that I was in a vehicle pursuit to how am I going to g… [+1711 chars]",fox-news,Fox News
Associated Press,'So alone': Niyonsaba criticizes own team after Olympics DQ,"Olympic silver medalist Francine Niyonsaba criticized her own team officials and said Saturday she felt “so alone” after she was disqualified for lane infringement and denied a place in the 5,000-meter final at the Tokyo Olympics.",https://www.foxnews.com/sports/so-alone-niyonsaba-criticizes-own-team-after-olympics-dq,https://static.foxnews.com/foxnews.com/content/uploads/2021/07/AP21211408541120.jpg,2021-07-31T16:10:57Z,"Olympic silver medalist Francine Niyonsaba criticized her own team officials and said Saturday she felt ""so alone"" after she was disqualified for lane infringement and denied a place in the 5,000-met… [+2394 chars]",fox-news,Fox News
Lauryn Overhultz,Sofia Vergara shows off bikini bod in hot pink swimsuit,"Sofia Vergara showed off her bikini body Friday on social media. The ""Modern Family"" actress posed for a mirror selfie wearing a hot pink swimsuit.",https://www.foxnews.com/entertainment/sofia-vergara-bikini-body-hot-pink-swimsuit-instagram,https://static.foxnews.com/foxnews.com/content/uploads/2021/07/Sofia_Vergara_Getty_Images.jpg,2021-07-31T19:51:35Z,"Sofia Vergara showed off her toned bikini body Friday on Instagram. 
The 49-year-old actress modeled a hot pink bikini in a mirror selfie. 
""Ready pal weeekend!!"" Vergara captioned the photo along … [+1084 chars]",fox-news,Fox News
Julia Musto,Scientists find a 'real life' Patrick and Spongebob in ocean expedition,"Scientists have discovered what some are calling the ""real life"" SpongeBob and Patrick: from the timeless and beloved Nickelodeon cartoon ""SpongeBob SquarePants.""",https://www.foxnews.com/science/scientists-find-real-life-patrick-spongebob-ocean-expedition,https://static.foxnews.com/foxnews.com/content/uploads/2021/07/Spongebob-Patrick.jpg,2021-07-31T19:31:09Z,"Scientists have discovered what some are calling the ""real life"" SpongeBob and Patrick: from the timeless and beloved Nickelodeon cartoon ""SpongeBob SquarePants.""
The characters, a yellow sea sponge… [+2725 chars]",fox-news,Fox News
Paulina Dedaj,US fencer accused of sexual misconduct confronts teammates after pink mask protest on Olympic stage,"U.S. fencer Alen Hadzic, who was previously suspended following allegations of sexual misconduct, says he confronted his teammates after they deliberately wore pink masks ahead of the men’s épée event on Friday in an apparent protest of his place on the Olymp…",https://www.foxnews.com/sports/us-fencer-sexual-misconduct-confronts-teammates-pink-mask-olympics,https://static.foxnews.com/foxnews.com/content/uploads/2021/07/Fencing-Pink-Mask-GETTY.jpg,2021-07-31T19:16:49Z,"U.S. fencer Alen Hadzic, who was previously suspended following allegations of sexual misconduct, says he confronted his teammates after they deliberately wore pink masks ahead of the mens épée event… [+2233 chars]",fox-news,Fox News
OutKick,Both B1G Michigan schools mandating vaccinations,University of Michigan and Michigan State University announced on Friday that both schools will require confirmed vaccination status ahead of their Fall academic season. University staff and students present for in-person instruction must provide proof of vac…,https://www.foxnews.com/sports/both-b1g-michigan-schools-mandating-vaccinations,https://static.foxnews.com/foxnews.com/content/uploads/2021/07/Michigan-State-Helmet-GETTY.jpg,2021-07-31T19:10:58Z,University of Michigan and Michigan State University announced on Friday that both schools will require confirmed vaccination status ahead of their Fall academic season. University staff and students… [+1461 chars],fox-news,Fox News
New York Post,Harvard lecturer takes heat for defending existence of biological sex on 'Fox & Friends',Harvard lecturer Carole Hooven took heat from her own colleague after an appearance on Fox News this week in which she asserted that biological sex is real and defended the continued use of terms like ‘pregnant women’ and “male and female.”,https://www.foxnews.com/us/harvard-lecturer-blasted-by-colleague-for-defending-existence-of-biological-sex,https://static.foxnews.com/foxnews.com/content/uploads/2018/09/0606-harvard.jpg,2021-07-31T19:10:51Z,Harvard lecturer Carole Hooven took heat from her own colleague after an appearance on Fox News this week in which she asserted that biological sex is real and defended the continued use of terms lik… [+1417 chars],fox-news,Fox News
Marisa Schultz,"White House touts uptick in COVID vaccinations amid renewed mandates, Delta spread","The Biden administration is touting a recent increase in COVID-19 vaccinations in the United States, amid new concerns about the highly contagious Delta variant and fresh coronavirus restrictions.",https://www.foxnews.com/politics/white-house-touts-uptick-coronavirus-vaccinations-delta-spread,https://static.foxnews.com/foxnews.com/content/uploads/2021/06/AP21166471478931.jpg,2021-07-31T19:09:11Z,"The Biden administration is touting a recent increase in COVID-19 vaccinations in the United States, amid new concerns about the highly contagious Delta variant and fresh coronavirus restrictions. 
… [+2413 chars]",fox-news,Fox News
OutKick,Former UFC champion thinks Simone Biles needs some 'tough love',The sun didn’t suddenly set in Tokyo. That’s just another world-class athlete throwing shade at Olympian Simone Biles. Former UFC bantamweight and flyweight champion Henry Cejudo is the latest to criticize the gymnast. Having previously won gold himself (2008…,https://www.foxnews.com/sports/former-ufc-champion-thinks-simone-biles-needs-some-tough-love,https://static.foxnews.com/foxnews.com/content/uploads/2018/09/399cadd4-wrestling-dream-act-crop.jpg,2021-07-31T18:54:11Z,The sun didnt suddenly set in Tokyo. Thats just another world-class athlete throwing shade at Olympian Simone Biles. Former UFC bantamweight and flyweight champion Henry Cejudo is the latest to criti… [+1771 chars],fox-news,Fox News
Adam Shaw,"Border Patrol union official warns COVID-positive migrants being released into US ‘day in, day out’","A top Border Patrol union official is warning that agents are having to release COVID-positive migrants into the U.S. ""day in, day out"" -- amid the ongoing crisis at the border, which also has Border Patrol agents worried about their own health.",https://www.foxnews.com/politics/border-patrol-official-covid-migrants-released-day-in-day-out,https://static.foxnews.com/foxnews.com/content/uploads/2021/07/migrants-border-patrol-rio-grande-valley.jpg,2021-07-31T18:15:31Z,"A top Border Patrol union official is warning that agents are having to release COVID-positive migrants into the U.S. ""day in, day out"" -- amid the ongoing crisis at the border, which also has Border… [+2565 chars]",fox-news,Fox News
Audrey Conklin,Experts project record low poverty in 2021 resulting from COVID relief,"Researchers are projecting a record-low U.S. poverty rate in 2021, and they're pointing to federal COVID-19 relief as the driving factor behind the shift.",https://www.foxnews.com/politics/record-low-poverty-2021-covid-relief,https://static.foxnews.com/foxnews.com/content/uploads/2021/03/Stimulus-package.jpg,2021-07-31T18:07:05Z,"Researchers are projecting a record-low U.S.
 poverty rate in 2021, and they're pointing to federal COVID-19 relief as the driving factor behind the shift.
The Census Bureau
 last September report… [+3238 chars]",fox-news,Fox News
Paul Best,"California TikTok star, 19, dies after 'Purge' theater shooting","Anthony Barajas, a 19-year-old TikTok star who was shot during a screening of “The Forever Purge” at a Southern California movie theater on Monday, passed away on Saturday morning, police announced.",https://www.foxnews.com/us/california-movie-theater-shooting-second-victim-19-year-old-tiktok-star-anthony-barajas-passes-away,https://static.foxnews.com/foxnews.com/content/uploads/2021/07/itsanthonymichael-2.jpg,2021-07-31T21:35:28Z,"Anthony Barajas, a 19-year-old TikTok star who was shot during a screening of ""The Forever Purge"" at a Southern California movie theater on Monday, died on Saturday morning, police announced. 
Rylee… [+1691 chars]",fox-news,Fox News
Lauryn Overhultz,Billie Eilish addresses internet trolls: 'They would never say that to you in real life',"Billie Eilish claimed that internet trolls are the kind of people who would never say the ""crazy stuff"" to you in real life.",https://www.foxnews.com/entertainment/billie-eilish-internet-trolls-bbc-interview-happier-than-ever,https://static.foxnews.com/foxnews.com/content/uploads/2021/07/Billie_Eilish_Getty_Images.jpg,2021-07-31T21:03:27Z,"Billie Eilish opened up about her experience with internet trolls for an upcoming BBC special.
The 19-year-old musician will appear in ""Billie Eilish: Up Close"" on Saturday.
""The people that even s… [+1299 chars]",fox-news,Fox News
Kate Pearce,Never Judge A Gifted Horse In The Mouth,Tyrus and Kat discuss plans for the future multi-marketing pyramid scheme that is the TNT podcast.,https://radio.foxnews.com/2021/07/31/never-judge-a-gifted-horse-in-the-mouth/,https://radio.foxnews.com/wp-content/uploads/2018/11/Tyrus-and-Timpf-Featured-Image-600x450.jpg,2021-07-31T21:00:23Z,"Tyrus and Kat discuss plans for the future multi-marketing pyramid scheme that is the TNT podcast.
Kat tells listeners about the time she was a cane and a half away from a permanent swagger.
Tyrus … [+259 chars]",fox-news,Fox News
Adam Shaw,"Grand jury indicts 9 MS-13 members on charges including murder, kidnapping","A federal grand jury has indicted nine MS-13 gang members on a 60-count indictment with charges including murder, kidnapping and assault -- after a federal investigation led to their arrests, government officials announced this week.",https://www.foxnews.com/politics/grand-jury-9-ms-13-members-charges-murder-kidnapping,https://static.foxnews.com/foxnews.com/content/uploads/2020/10/ICE-Agent-ICE.jpg,2021-07-31T20:56:37Z,"A federal grand jury has indicted nine MS-13 gang members on a 60-count indictment with charges including murder, kidnapping and assault -- after a federal investigation led to their arrests, governm… [+3070 chars]",fox-news,Fox News
Julius Young,"‘Selling Sunset’s Jason Oppenheim, Chrishell Stause pack on PDA in Rome after she confirms romance with broker",Photographers snapped the long-rumored couple engaged in a passionate kiss while out on a lunch date during a vacation to the Italian capital near the city’s famous Spanish Steps before they ultimately left and headed to the famed Trevi fountain where they to…,https://www.foxnews.com/entertainment/selling-sunsets-jason-oppenheim-chrishell-stause-pda-rome-confirms-romance-broker,https://static.foxnews.com/foxnews.com/content/uploads/2021/07/Jason-Oppenheim-Chrishell-Stause-in-Rome_Mega_1280.jpg,2021-07-31T20:55:20Z,"Just hours after ""Selling Sunset"" stars Jason Oppenheim and Chrishell Stause confirmed their workplace romance, the pair were spotted locking lips in romance-laden Rome.
Photographers snapped the lo… [+3471 chars]",fox-news,Fox News
Andrew Miller,Bill Maher shreds cancel culture: 'It belongs in Stalin's Russia',Comedian Bill Maher slammed “cancel culture” on his HBO program Friday night and said that the practice belongs in “Stalin’s Russia.”,https://www.foxnews.com/entertainment/bill-maher-shreds-cancel-culture-it-belongs-in-stalins-russia,https://static.foxnews.com/foxnews.com/content/uploads/2020/11/GettyImages-1229316596.jpg,2021-07-31T20:40:15Z,"Comedian Bill Maher slammed ""cancel culture"" on his HBO program Friday night and said that the practice belongs in ""Stalins Russia.""
Maher was discussing multiple examples of Olympic officials being… [+1362 chars]",fox-news,Fox News
Julia Musto,Recently-discovered underwater volcano named for this popular franchise,"A group of researchers in Australia has uncovered the remnants of an ancient underwater volcano in the Indian Ocean that resembles J.R.R. Tolkien's ""The Lord of the Rings"" trilogy's ""Eye of Sauron.""",https://www.foxnews.com/science/ecently-discovered-underwater-volcano-named-for-this-popular-franchise,https://static.foxnews.com/foxnews.com/content/uploads/2021/07/Volcano-Australia.jpg,2021-07-31T20:17:22Z,"A group of researchers in Australia has uncovered the remnants of an ancient underwater volcano in the Indian Ocean that resembles J.R.R. Tolkien's ""The Lord of the Rings"" trilogy's ""Eye of Sauron.""… [+3463 chars]",fox-news,Fox News
Fox News,"Lake Mead, Hoover Dam face historically low water levels amid drought","Lake Mead, one of the National Park Service’s most visited vacation spots, rests in the shadow of the Hoover Dam. But there’s a problem: The lake is getting real low.",https://www.foxnews.com/us/lake-mead-hoover-dam-face-low-water-levels-drought,https://cf-images.us-east-1.prod.boltdns.net/v1/static/694940094001/2ce9182c-4857-47e1-a048-81fb90e88ea3/b7c132a3-d600-4f71-8489-c66c4b289acf/1280x720/match/image.jpg,2021-07-31T20:16:18Z,"BOULDER CITY, NEVADA Lake Mead, one of the National Park Services most visited vacation spots, rests in the shadow of the Hoover Dam.
But theres a problem: The lake is getting real low.
As of June,… [+2677 chars]",fox-news,Fox News
Michael Ruiz,"UNC emails show long debate over tenure for Nikole Hannah-Jones, who took job at Howard University instead",The University of North Carolina Chapel Hill has released hundreds of pages of emails in connection with the controversy of its attempt to bring in the 1619 Project founder Nikole Hannah-Jones as a professor.,https://www.foxnews.com/us/unc-emails-show-long-debate-over-tenure-for-nikole-hannah-jones-who-took-job-at-howard-university-instead,https://static.foxnews.com/foxnews.com/content/uploads/2021/07/Nikole-Hannah-Jones-1619-project.jpg,2021-07-31T23:47:15Z,The University of North Carolina Chapel Hill has released hundreds of pages of emails in connection with the controversy of its attempt to bring in 1619 Project writer Nikole Hannah-Jones as a tenure… [+6551 chars],fox-news,Fox News
Paul Best,"Indianapolis funeral home shooting leaves multiple injured, including 4-year-old in critical condition: report","A shooting outside of a funeral home in Indianapolis on Saturday afternoon left five people injured, including a 4-year-old girl in critical condition, FOX59 reports.",https://www.foxnews.com/us/indianapolis-funeral-home-shooting-leaves-5-injured-including-4-year-old-critical-condition-report,https://static.foxnews.com/foxnews.com/content/uploads/2020/05/Indianapolis-MPD.jpg,2021-07-31T23:19:15Z,"A shooting outside of a funeral home in Indianapolis on Saturday afternoon left five people injured, including a 4-year-old girl in critical condition, FOX 59 reported. 
Police were called around 4:… [+1259 chars]",fox-news,Fox News
Julius Young,"Jennifer Lopez, Ben Affleck caught kissing again during Italian lovefest","Lopez, who just ushered in her 52nd birthday days ago, took it upon themselves to share a kiss while cozied up as their boat was docked in Naples, Italy.",https://www.foxnews.com/entertainment/jennifer-lopez-ben-affleck-caught-kissing-again-during-italian-lovefest,https://static.foxnews.com/foxnews.com/content/uploads/2021/06/Bennifer-2.jpg,2021-07-31T22:26:37Z,Jennifer Lopez and Ben Affleck gave the world another shot in the arm of their worldwide lovefest when the parading pair were spotted lovey-dovey aboard another boat this time along the Mediterranean… [+1974 chars],fox-news,Fox News
Associated Press,CDC's mask guidance angers parents heading into new school year: 'Stop the insanity',"With U.S. health officials recommending that children mask up in school this fall, parents and policy makers across the nation have been plunged anew into a debate over whether face coverings should be optional or a mandate.",https://www.foxnews.com/us/cdc-mask-guidance-angers-parents-heading-into-new-school-year-stop-the-insanity,https://static.foxnews.com/foxnews.com/content/uploads/2021/07/Parents-Mask-Florida-AP.jpg,2021-07-31T22:12:45Z,"With U.S. health officials recommending that children mask up in school this fall, parents and policy makers across the nation have been plunged anew into a debate over whether face coverings should … [+6884 chars]",fox-news,Fox News
