author,title,description,url,urlToImage,publishedAt,content,source.id,source.name
Brian Flood,"Fox News boasts best primetime ratings ever, finishes on top of basic cable for 4th straight year","Fox News Channel finished 2019 as the most-watched basic cable network for the fourth consecutive year, averaging 1.4 million viewers while no other network cracked the one-million total day viewer plateau.",https://www.foxnews.com/media/fox-news-ratings-top-primetime,https://media2.foxnews.com/BrightCove/694940094001/2019/12/11/694940094001_6114741588001_6114737838001-vs.jpg,2019-12-11T19:07:10Z,"Fox News Channel enjoyed the best primetime ratings in the network’s 23-year history as “Hannity” topped cable news for the third straight year.
FNC also finished 2019 as the most-watched basic cable network for the fourth consecutive year, averaging 1.4 mil… [+2096 chars]",fox-news,Fox News
Emily DeCiccio,Trump administration’s new food stamp policy stirs debate over work requirements,The Trump administration's proposal to tighten work requirements for food stamp recipients has ignited a debate over food access for low-income people and cuts to government spending.,https://www.foxnews.com/politics/trump-administration-new-food-stamp-policy,https://static.foxnews.com/foxnews.com/content/uploads/2019/12/SNAP.jpg,2019-12-11T19:04:15Z,"The Trump administration's proposal to tighten work requirements for food stamp recipients has ignited a debate over benefits for low-income people and cuts to government spending.
Last week, the administration proposed a new rule targeting the Supplemental … [+3322 chars]",fox-news,Fox News
Nicole Darrah,Texas man jumps to the rescue after dog gets leash stuck in elevator,A quick-thinking Texas man saved a dog from a possibly horrific hanging injury earlier this week when its owner got onto an elevator while holding the dog's leash — without realizing the dog hadn't gotten inside with her.,https://www.foxnews.com/us/texas-dog-stuck-elevator-video,https://static.foxnews.com/foxnews.com/content/uploads/2019/12/dog-elevator-3-Johnny-Mathis.jpg,2019-12-11T18:59:23Z,"A quick-thinking Texas man saved a dog from a horrible fate when its owner got onto an elevator while holding the dog's leash — without realizing the pooch had failed to follow her inside.
Johnny Mathis, of Houston, tweeted of the wild incident Monday, writi… [+1567 chars]",fox-news,Fox News
Talia Kaplan,Ken Starr stunned by IG report's findings: 'Extraordinary' condemnation of FBI conduct,Former Independent Counsel Ken Starr reacted to the release of Justice Department Inspector General Michael E. Horowitz’ report concerning the origins of the Russia investigation and the issuance of Foreign Intelligence Surveillance Act (FISA) warrants for a …,https://www.foxnews.com/media/ken-starr-stunned-ig-horowitz-report-fbi,https://static.foxnews.com/foxnews.com/content/uploads/2019/12/starr2.jpg,2019-12-11T18:57:50Z,Former Independent Counsel Ken Starr reacted to the release of Justice Department Inspector General Michael E. Horowitz’ report concerning the origins of the Russia investigation and the issuance of Foreign Intelligence Surveillance Act (FISA) warrants for a … [+3324 chars],fox-news,Fox News
Joshua Nelson,Virginia sheriff: We'll deputize law-abiding citizens to counter state Dems' gun control 'overreach',"While the Virginia state Democratic lawmakers are making an effort to pass strict gun control legislation, a sheriff is taking matters into his own hands.",https://www.foxnews.com/us/virginia-sheriff-deputize-democrats-gun-control,https://static.foxnews.com/foxnews.com/content/uploads/2019/12/Screen-Shot-2019-12-11-at-12.39.20-PM.png,2019-12-11T18:56:47Z,"A Virginia sheriff is vowing to take matters into his own hands and deputize residents if the state's Democratic lawmakers pass strict gun control legislation.
“They will be properly vetted through a normal process. Everything from normal background checks t… [+1788 chars]",fox-news,Fox News
Greg Norman,"Atlanta mother arrested after abandoning special needs son, 14, at hospital, police say","An Atlanta mother who was arrested Wednesday after her special needs teenager was found abandoned at a downtown hospital last week told investigators that she had been “overwhelmed caring for her son,” police say.",https://www.foxnews.com/us/atlanta-mother-arrested-abandoning-son-hospital,https://static.foxnews.com/foxnews.com/content/uploads/2019/12/diana-elliott.jpg,2019-12-11T18:52:24Z,"An Atlanta mother who was arrested Wednesday after her special needs teenager was found abandoned at a downtown hospital last week told investigators that she had been “overwhelmed caring for her son,” police say.
Diana Elliott, 37, was taken into custody at… [+2596 chars]",fox-news,Fox News
Caleb Parke,"Trump targets anti-Semitism, boycotts against Israel on college campuses",President Trump is threatening to cut federal funds to college campuses that don't curb anti-Semitism against Jewish students..,https://www.foxnews.com/politics/trump-anti-semitism-jew-israel-boycott-college-campus-executive-order,https://media2.foxnews.com/BrightCove/694940094001/2019/12/08/694940094001_6114021966001_6114025386001-vs.jpg,2019-12-11T18:50:40Z,"President Trump is threatening to cut federal funds to college campuses that don't curb anti-Semitism against Jewish students, with an executive order set to be signed later Wednesday, according to a senior administration official.
Trump's new order will hit… [+3677 chars]",fox-news,Fox News
Peter Caterina,Admiral James Stavridis (Ret) On Why We Should Not Rush To Arm All Soldiers At Military Bases,"Admiral James Stavridis (Ret), former Supreme Allied Commander at NATO, member of the Carlyle Group, and author of the new book ""Sailing True North: Ten Admirals and the Voyage of Character"", spoke with Brian Kilmeade about the shooting at Naval Air Station i…",https://radio.foxnews.com/2019/12/11/admiral-james-stavridis-ret-on-why-we-should-not-rush-to-arm-all-soldiers-at-military-bases/,https://radio.foxnews.com/wp-content/uploads/2019/10/Stavridis-Kilmeade-3.jpg,2019-12-11T18:48:27Z,"Admiral James Stavridis (Ret), former Supreme Allied Commander at NATO, member of the Carlyle Group, and author of the new book ""Sailing True North: Ten Admirals and the Voyage of Character"", spoke with Brian Kilmeade about the shooting at Naval Air Station i… [+593 chars]",fox-news,Fox News
Melissa Roberto,Beyonce's dad claims singer and Kelly Rowland were 'harassed' as teens by Jagged Edge band members,"Beyonce's dad has claimed the singer and her former ""Destiny's Child"" counterpart Kelly Rowland were treated inappropriately by male musicians when they were teens.",https://www.foxnews.com/entertainment/beyonces-dad-claims-singer-and-kelly-rowland-were-harassed-as-teens-by-jagged-edge-band-members,https://static.foxnews.com/foxnews.com/content/uploads/2019/12/beyonce-and-kelly-getty.jpg,2019-12-11T18:45:45Z,"Beyonce's dad has claimed the singer and her former ""Destiny's Child"" counterpart Kelly Rowland were treated inappropriately by male musicians when they were teens.
Mathew Knowles, 67, claimed in a new interview with VLAD TV that two bandmates of R&amp;B gro… [+2052 chars]",fox-news,Fox News
Kris Osborn,Navy prepares its new Ford-class carriers for F-35C stealth attack,"The Navy is preparing its first two new Ford-class aircraft carriers to launch air attacks with the first-of-its-kind carrier-launched F-35C stealth fighter, a move expected to further transform maritime air attack and bring new mission options to commanders.",https://www.foxnews.com/tech/navy-prepares-its-new-ford-class-carriers-for-f-35c-stealth-attack,https://static.foxnews.com/foxnews.com/content/uploads/2018/12/F35C.jpg,2019-12-11T18:39:38Z,"The Navy is preparing its first two new Ford-class aircraft carriers to launch air attacks with the first-of-its-kind carrier-launched F-35C stealth fighter, a move expected to further transform maritime air attack and bring new mission options to commanders.… [+6699 chars]",fox-news,Fox News
Gary Gastelu,Electric Porsche Taycan Turbo hit with disappointing 201-mile range rating,You won't be taking any long rides in the Taycan.,https://www.foxnews.com/auto/electric-porsche-taycan-turbo-201-mile-range,https://static.foxnews.com/foxnews.com/content/uploads/2019/12/16189af1-tay4.jpg,2019-12-11T18:37:12Z,"It looks like you won’t be taking a very long ride in the Porsche Taycan Turbo.
(Porsche)
The electric sports sedan has received a range rating of just 201 miles per charge from the Environmental Protection Agency. That compares to 348 miles for a Tesla Mod… [+1317 chars]",fox-news,Fox News
Ryan Gaydos,Tommy 'Two Gloves' Gainey' arrested in Florida prostitution sting,A professional golfer was arrested in a Florida prostitution and sex-trafficking sting operation Sunday dubbed “Operation Santa’s Naughty List.”,https://www.foxnews.com/sports/tommy-two-gloves-gainey-arrested-prostitution-sting,https://static.foxnews.com/foxnews.com/content/uploads/2019/12/RT-Tommy-Gainey.jpg,2019-12-11T18:33:11Z,"A professional golfer was arrested in a Florida prostitution and sex-trafficking sting operation Sunday dubbed “Operation Santa’s Naughty List.”
Tommy “Two Gloves” Gainey, 44, was among the 124 arrested as part of the investigation, according to the Polk Cou… [+1142 chars]",fox-news,Fox News
Andy Sahadeo,Kelly Ripa reveals she had plastic surgery: 'They tore all the way through',Kelly Ripa revealed that she’s had plastic surgery on a body part that fans would not expect.,https://www.foxnews.com/entertainment/kelly-ripa-plastic-surgery-earlobes,https://static.foxnews.com/foxnews.com/content/uploads/2018/11/Kelly-Ripa-Getty.jpg,2019-12-11T18:32:34Z,"Kelly Ripa revealed that she’s had plastic surgery on a body part that fans would not expect.
On Friday, the popular TV personality took to Instagram to show off her wardrobe and revealed that she had plastic surgery done on her earlobes.
KELLY RIPA TEASES … [+1274 chars]",fox-news,Fox News
Julia Musto,Lindsey Graham rips into media coverage of IG report: 'How do you get a headline like that?',Republican Sen. Lindsey Graham of South Carolina railed against the media's involvement in Justice Department Inspector General Michael Horowitz's recently released FISA report.,https://www.foxnews.com/media/sen-lindsey-graham-media-ig-michael-horowitz-report,https://static.foxnews.com/foxnews.com/content/uploads/2019/12/GRAHAM.jpg,2019-12-11T18:31:07Z,"Republican Sen. Lindsey Graham of South Carolina, chairman of the Senate Judiciary Committee, railed against the media's takeaways from Justice Department Inspector General Michael Horowitz's recently released Foreign Intelligence Surveillance Act (FISA) repo… [+2130 chars]",fox-news,Fox News
Alexandra Deabler,Parents swear by viral 'four gift' Christmas rule: 'It made shopping a whole lot easier',"Instead of singing about the “12 Days of Christmas,” parents are singing the praises of the “Four Gifts” of Christmas.",https://www.foxnews.com/lifestyle/parents-viral-four-gift-christmas-rule,https://static.foxnews.com/foxnews.com/content/uploads/2019/12/presents.jpg,2019-12-11T18:29:59Z,"Instead of singing about the “12 Days of Christmas,” some parents are singing the praises of the “Four Gifts” of Christmas.
Moms and dads on the parenting website Kidspot are raving about a money- and time-saving hack they implement during the holidays calle… [+1592 chars]",fox-news,Fox News
Paulina Dedaj,"Florida officer 'physically assaulted' in high school brawl, 10 students, one adult arrested, police say",Police in Florida have arrested 10 students and one adult after a violent brawl erupted at a Melbourne high school in which at least one officer was attacked.,https://www.foxnews.com/us/florida-officer-physically-assaulted-in-high-school-brawl-10-students-and-one-adult-arrested-police-say,https://static.foxnews.com/foxnews.com/content/uploads/2019/12/bay.jpg,2019-12-11T18:26:47Z,"Police in Florida have arrested 10 students and one adult after a violent brawl erupted at a Melbourne high school in which at least one officer was attacked.
Officers with the Melbourne Police Department were dispatched to Palm Bay Magnet High School, 70 mi… [+1445 chars]",fox-news,Fox News
William Sanchez,"IG Hearing Sharply Partisan, CNN Blows Off Opening","Howie on Inspector General Michael Horowitz testifying about his findings on the FBI and Russia probe, Democrats announcing articles of impeachment and USMCA deal all in one day and Joe Biden reportedly will only serve one term if elected in 2020. Follow Howi…",https://radio.foxnews.com/2019/12/11/ig-hearing-sharply-partisan-cnn-blows-off-opening/,https://radio.foxnews.com/wp-content/uploads/2018/07/social_buzzmeter_featured.png,2019-12-11T18:25:02Z,"Howie on Inspector General Michael Horowitz testifying about his findings on the FBI and Russia probe, Democrats announcing articles of impeachment and USMCA deal all in one day and Joe Biden reportedly will only serve one term if elected in 2020.
Follow How… [+58 chars]",fox-news,Fox News
Chris Ciaccia,Amazing picture shows the moment a horse looks like it's hysterically laughing,"A photographer in England has captured the remarkable moment when a horse looks like it is laughing hysterically, news agency SWNS reports.",https://www.foxnews.com/science/amazing-picture-shows-moment-horse-laughing,https://static.foxnews.com/foxnews.com/content/uploads/2019/12/laughing-horse.jpg,2019-12-11T18:23:19Z,"This is a laughing matter.
A photographer in England has captured the remarkable moment when a horse looks like it is laughing hysterically, news agency SWNS reports.
Paul Williams, who took the pictures in a field in Cumbria, managed to snap the picture at… [+1042 chars]",fox-news,Fox News
James Rogers,"Grisly ancient skeletons may be dismembered prisoners of war, experts reveal",The bones of about 20 people discovered in an ancient Mexican well in 2013 are revealing their gruesome secrets.,https://www.foxnews.com/science/grisly-ancient-skeletons-may-be-dismembered-prisoners-of-war,https://static.foxnews.com/foxnews.com/content/uploads/2019/12/MayaPOW.jpg,2019-12-11T18:21:09Z,"The bones of about 20 people discovered in an ancient Mexican well in 2013 are revealing their gruesome secrets.
The remains, which were found by archaeologists from Germany’s University of Bonn at the former Maya city of Uxul, belong to people who were kill… [+3637 chars]",fox-news,Fox News
Chris Stirewalt,"Biden rebound continues, Warren falls to third","Head-to-heads show Dems with steady, decisive advantage.",https://www.foxnews.com/politics/biden-rebound-continues-warren-falls-to-third,https://media2.foxnews.com/BrightCove/694940094001/2019/11/27/694940094001_6109612742001_6109608931001-vs.jpg,2019-12-11T18:19:31Z,"**Want FOX News Halftime Report in your inbox every day? Sign up here.**
On the roster: Biden rebound continues, Warren falls to third - Inspector general scathes FBI - Audible: Slam what now? - Axe yourself why
BIDEN REBOUND CONTINUES, WARREN FALLS TO THIR… [+14709 chars]",fox-news,Fox News
Stephen Sorace,"East Coast winter blast brings light snow, freezing wind chill","A day after parts of the East Coast warmed up to the low 60s, a drastic swing in temperature Wednesday left much of the region facing rain, snow and bitterly cold wind chills.",https://www.foxnews.com/us/east-coast-winter-weather-snow-wind-chill,https://static.foxnews.com/foxnews.com/content/uploads/2019/12/NWS-geocolor-map.jpg,2019-12-11T18:14:21Z,"A day after parts of the East Coast warmed up to the low 60s, a drastic swing in temperature Wednesday left much of the region facing rain, snow and bitterly cold wind chills.
Overnight rain turned to snow as temperatures dipped below freezing in parts of Ne… [+1763 chars]",fox-news,Fox News
Ryan Gaydos,"Antonio Brown's latest tirade targets 'racist' NFL, 'loser' Ben Roethlisberger",Former NFL wide receiver Antonio Brown has failed in his efforts to latch onto an NFL team as the 2019 season winds down — and he apparently takes his frustrations out on the world through tweets.,https://www.foxnews.com/sports/antonio-brown-tirade-racist-nfl-loser-ben-roethlisberger,https://static.foxnews.com/foxnews.com/content/uploads/2019/09/NFL-Antonio-Brown17.jpg,2019-12-11T18:08:52Z,"Former NFL wide receiver Antonio Brown has failed in his efforts to latch onto an NFL team as the 2019 season winds down — and he apparently takes his frustrations out on the world through tweets.
Brown went on a tirade Wednesday in a series of tweets, calli… [+2715 chars]",fox-news,Fox News
Sam Dorman,"Ben Shapiro, conservatives blast new YouTube policy on 'hate speech': 'Insanely vague'","Conservative media figures are deriding a new YouTube policy on hate speech, arguing it censors free speech and will have a disproportionate impact on right-leaning commentators.",https://www.foxnews.com/media/ben-shapiro-conservatives-youtube-policy-hate,https://static.foxnews.com/foxnews.com/content/uploads/2019/06/BenShapiroGetty2018.jpg,2019-12-11T18:03:43Z,"Conservative media figures are deriding a new YouTube policy on hate speech, arguing it censors free speech and could have a disproportionate impact on right-leaning commentators.
Announced on Wednesday, the policy seemed to come in reaction to a months-long… [+5585 chars]",fox-news,Fox News
Ronn Blitzer,IG calls for ‘accountability’ over FBI failures in Russia probe,Justice Department Inspector General Michael Horowitz found in his long-awaited report on the FBI's Russia investigation that there was no evidence of political bias in the probe's launch -- but he made clear during testimony before the Senate Judiciary Commi…,https://www.foxnews.com/politics/ig-calls-for-accountability-over-fbi-failures-in-russia-probe,https://media2.foxnews.com/BrightCove/694940094001/2019/12/11/694940094001_6114975346001_6114975848001-vs.jpg,2019-12-11T17:56:45Z,Justice Department Inspector General Michael Horowitz concluded in his long-awaited report on the FBI's Russia investigation that there was no evidence of political bias in the probe's launch — but he made clear during testimony before the Senate Judiciary Co… [+2063 chars],fox-news,Fox News
Gary Gastelu,Test drive: The 2020 Subaru Ascent is a big success,"It's a hit, but you might not know it.",https://www.foxnews.com/auto/test-drive-the-2020-subaru-ascent,https://static.foxnews.com/foxnews.com/content/uploads/2019/12/ascent-5.jpg,2019-12-11T17:45:22Z,"Subaru has a certified hit on its hands with the strong-selling three-row Ascent SUV, but might not know it.
(Subaru)
Have you seen one? Probably, but the Ascent is such a generically styled Subaru that it’s easy to walk by one and think it’s a Forester or … [+3008 chars]",fox-news,Fox News
Gerren Keith Gaynor,Texas wedding bouquet toss ends with elderly woman being pushed to the ground,A video posted on Instagram shows an elderly woman being shoved by a group of women during the bouquet toss ceremony at a Texas wedding reception.,https://www.foxnews.com/lifestyle/texas-wedding-bouquet-toss-elderly-woman-pushed,https://static.foxnews.com/foxnews.com/content/uploads/2019/12/iStock-Bride.jpg,2019-12-11T17:41:30Z,"No person is safe when it comes time to catch the bouquet – not even the elderly. 
A video posted on Instagram shows an elderly woman being shoved by a group of women during the bouquet toss ceremony at a Texas wedding reception. 
BRIDE UPSET FRIEND SKIPPED… [+1088 chars]",fox-news,Fox News
Alexandria Hein,"Ohio college student suffers fatal allergic reaction after unknowingly consuming milk ingredient, mom says",She said her son's roommate found him still holding his EpiPen but it was too late to save him.,https://www.foxnews.com/health/ohio-college-student-fatal-allergic-reaction-milk,https://static.foxnews.com/foxnews.com/content/uploads/2019/12/Logan-Lewis-Jamie-Baker-Facebook.jpg,2019-12-11T17:40:54Z,"An Ohio college student died last week after he unknowingly consumed a beverage containing a milk ingredient, which triggered a fatal allergic reaction, his mother said. He was 20 years old.
Logan Lewis, a student at Hocking College, “did not get his Epipen … [+2013 chars]",fox-news,Fox News
Michael Bartiromo,"Best man found guilty of assaulting bride, bride's family, after she tried to get groom to go to bed","The judge said the best man's actions tainted the ceremony with ""thoughts and bad memories of what should have been a happy event.""",https://www.foxnews.com/lifestyle/best-man-guilty-assaulting-bride-brides-family-after-groom-sent-to-bed,https://static.foxnews.com/foxnews.com/content/uploads/2019/12/four-weddings-u-451496.jpg,2019-12-11T17:40:47Z,"The best man at a wedding in Wales has been found guilty of assaulting the bride and several members of her family after she tried to convince the groom it was time for bed.
Tomos Rhydian Wilson, the 29-year-old brother of the groom, was sentenced to perform… [+1611 chars]",fox-news,Fox News
Madeline Farber,Man with 'penile gangrene' has part of genitals removed,A patient in South Australia lost part of his manhood after a rare disease led him to develop penile gangrene.,https://www.foxnews.com/health/man-penile-gangrene-part-genitals-removed,https://static.foxnews.com/foxnews.com/content/uploads/2019/12/iStock-prostate.jpg,2019-12-11T17:35:23Z,"A patient in South Australia lost part of his genitals after a rare disease led him to develop penile gangrene.
The patient, who was not identified in a case report published in BMJ Journals, developed calciphylaxis of the penis. Calciphylaxis, as per the Ma… [+1578 chars]",fox-news,Fox News
Ryan Gaydos,Tristan Thompson defends Cavaliers coach John Beilein from detractors: 'I'll pull up on 'em right now',Tristan Thompson is ready to defend coach John Beilein from all detractors even if it’s coming from his Cleveland Cavaliers teammates.,https://www.foxnews.com/sports/tristan-thompson-defends-ohn-beilein-detractors-cavaliers,https://static.foxnews.com/foxnews.com/content/uploads/2019/12/Tristan-Thompson.jpg,2019-12-11T17:32:49Z,"Tristan Thompson is ready to defend coach John Beilein from all detractors even if it’s coming from his Cleveland Cavaliers teammates.
Thompson was asked Friday about a report that anonymous Cavaliers players were questioning Beilein’s coaching methods and c… [+1514 chars]",fox-news,Fox News
admin,FOX NEWS CHANNEL NOTCHES HIGHEST-RATED PRIMETIME IN NETWORK HISTORY,"FNC Finishes 2019 as Most-Watched Basic Cable Network for Fourth Consecutive Year Hannity Reigns Cable News for Third Year in a Row FNC Ranks as a Top Five Network in Primetime in All of Television NEW YORK – December 11, 2019 – FOX News Channel (FNC) notched…",http://press.foxnews.com/2019/12/fox-news-channel-notches-highest-rated-primetime-in-network-history/,,2019-12-11T17:30:27Z,"FNC Finishes 2019 as Most-Watched Basic Cable Network for Fourth Consecutive Year
Hannity Reigns Cable News for Third Year in a Row
FNC Ranks as a Top Five Network in Primetime in All of Television 
NEW YORK December 11, 2019 FOX News Channel (FNC) notched… [+6086 chars]",fox-news,Fox News
Paul Steinhauser,Impeachment needle not moving as majority of voters oppose removing Trump: polls,"As the House of Representatives begins drafting articles of impeachment against President Trump, two new national polls indicate a slight majority of Americans still oppose impeaching and removing the Republican president from office.",https://www.foxnews.com/politics/impeachment-needle-not-moving-as-majority-still-oppose-removing-trump-polls,https://media2.foxnews.com/BrightCove/694940094001/2019/12/11/694940094001_6114748470001_6114745865001-vs.jpg,2019-12-11T17:29:49Z,"As the House of Representatives begins drafting articles of impeachment against President Trump, two new national polls indicate a slight majority of Americans still oppose impeaching and removing the Republican president from office.
“American voters signal… [+3977 chars]",fox-news,Fox News
Ryan Gaydos,Deontay Wilder slams Anthony Joshua's approach in heavyweight title win over Andy Ruiz Jr.,Deontay Wilder didn’t think Anthony Joshua did a good enough job in defeating Andy Ruiz Jr. over the weekend and warned the British fighter he would demolish him if they ever stepped into the same ring.,https://www.foxnews.com/sports/deontay-wilder-slams-anthony-joshuas-approach-andy-ruiz-jr,https://static.foxnews.com/foxnews.com/content/uploads/2019/12/Wilder-Joshua-Getty.jpg,2019-12-11T17:25:56Z,"Deontay Wilder didn’t think Anthony Joshua did a good enough job in defeating Andy Ruiz Jr. over the weekend and warned the British fighter he would demolish him if they ever stepped into the same ring.
Wilder said Joshua was “scared” being in the ring with … [+1333 chars]",fox-news,Fox News
Melissa Roberto,Garth Brooks shares big news about his future in music,Garth Brooks just shared some big news that directly impacts his fans.,https://www.foxnews.com/entertainment/garth-brooks-news-future-music,https://media2.foxnews.com/BrightCove/694940094001/2019/12/02/694940094001_6111131007001_6111134679001-vs.jpg,2019-12-11T17:24:48Z,"Garth Brooks just shared some big news that directly impacts his fans.
The country singer, 57, announced on Monday that he will extend his ""Dive Bar Tour"" into the new year.
GARTH BROOKS' EX-WIFE STUNS SINGER WITH REVELATIONS IN NEW TV DOCUMENTARY
The musi… [+2071 chars]",fox-news,Fox News
