author,title,description,url,urlToImage,publishedAt,content,source.id,source.name
James Leggate,Hundreds of bar customers prepay for food and drinks to keep tapas joint open amid coronavirus pandemic,"Fans of a bar and tapas restaurant in Madrid, Spain, have advanced the eatery the equivalent of thousands of dollars amid its struggles to stay in business during the COVID-19 pandemic.",https://www.foxnews.com/food-drink/bar-customers-prepay-fooddrinks-keep-tapas-joint-open-covid-19-pandemic,https://static.foxnews.com/foxnews.com/content/uploads/2020/12/AP20337701596650.jpg,2020-12-04T16:11:02Z,"Fans of a bar and tapas restaurant in Madrid, Spain, have advanced the eatery the equivalent of thousands of dollars amid its struggles to stay in business during the COVID-19 pandemic.
El Minibar o… [+2506 chars]",fox-news,Fox News
Alexandria Hein,CDC urges universal mask use while indoors amid coronavirus surge,"The Centers for Disease Control and Prevention (CDC) is urging Americans to wear masks indoors when they are not home amid a surge of coronavirus cases, hospitalizations and deaths.",https://www.foxnews.com/health/cdc-universal-mask-use-indoors-coronavirus-surge,https://static.foxnews.com/foxnews.com/content/uploads/2020/11/iStock-1216315312-7.jpg,2020-12-04T19:58:49Z,"The Centers for Disease Control and Prevention (CDC) is urging Americans to wear masks indoors when they are not home amid a surge of coronavirus cases, hospitalizations and deaths. In a Morbidity an… [+2637 chars]",fox-news,Fox News
Audrey Conklin,New project to give oral history of Hillary Clinton's career,A new project will document a complete oral history of former presidential candidate Hillary Clinton's career accomplishments.,https://www.foxnews.com/politics/oral-histroy-hillary-clinton-uva,https://static.foxnews.com/foxnews.com/content/uploads/2020/03/Hillary-Clinton-Laugh-REUTERS-1.jpg,2020-12-04T19:50:22Z,"A new project aims to give an oral history of former presidential candidate Hillary Clinton's career, focusing initially on her tenure as secretary of state during President Barack Obama's first term… [+1800 chars]",fox-news,Fox News
Alexandria Hein,"Kansas man's coronavirus death was 'lonelier than necessary,' obituary says","A great-grandfather in Kansas who was born just before the start of World War II died from coronavirus earlier this month in a “room not his own, being cared for by people dressed in confusing and frightening ways,” his obituary stated.",https://www.foxnews.com/health/kansas-mans-coronavirus-death-lonelier-than-necessary-obituary-says,https://static.foxnews.com/foxnews.com/content/uploads/2020/12/coronavirus_patient_istock.jpg,2020-12-04T19:39:45Z,"A great-grandfather in Kansas who was born just before the start of World War II died from coronavirus earlier this month in a “room not his own, being cared for by people dressed in confusing and fr… [+1841 chars]",fox-news,Fox News
Teny Sahakian,China is collecting the world’s DNA and the reason is sinister: Gordon Chang,"The Peoples Republic of China (PRC) has been collecting people’s DNA for years, and according to Gordon Chang, author of ‘The Coming Collapse of China,’ the country’s sinister motivations should be of great concern to the United States.",https://www.foxnews.com/world/china-collecting-worlds-dna-sinister,https://static.foxnews.com/foxnews.com/content/uploads/2020/12/gordon_chang-5fc991efeb4c1672336a0537_1_Dec_04_2020_15_44_35_poster.jpg,2020-12-04T19:37:56Z,"The Peoples Republic of China (PRC) has been collecting people’s DNA for years, and according to Gordon Chang, author of ‘The Coming Collapse of China,’ the country’s sinister motivations should be o… [+3981 chars]",fox-news,Fox News
Julia Musto,Republicans raise $804M on WinRed in 2 months,Republicans' WinRed online fundraising site has raised $804 million in the first two months of the fourth quarter ahead of January's Senate runoffs.,https://www.foxnews.com/politics/republicans-raise-804m-on-winred-in-first-two-months-of-fourth-quarter,https://static.foxnews.com/foxnews.com/content/uploads/2020/11/ab19723b-1000-1.jpeg,2020-12-04T19:26:52Z,"Republicans' WinRed online fundraising site has raised $804 million in the first two months of the fourth quarter ahead of January's Senaterunoffs.
Developed in an effort to counter Democrats with G… [+2127 chars]",fox-news,Fox News
"Content provided by Fox Bet. Fox Bet was developed by a division of Flutter Entertainment in partnership with Fox Sports, a unit of Fox Corporation. Fox Bet is solely responsible for this content and the products and services it provides.",Big questions to be answered on penultimate weekend of college football season,Texas Tech-Oklahoma State gets a five-game slate underway on FOX Networks.,https://www.foxnews.com/sports/college-football-season-penultimate-weekend-big-questions,https://static.foxnews.com/foxnews.com/content/uploads/2020/12/AP20332636894101.jpg,2020-12-04T19:14:52Z,"For some, this weekend marks the final weekend of regular season play in college football. With two weekends remaining before the conference title contests on Dec. 19, there’s a lot of things to get … [+5431 chars]",fox-news,Fox News
Peter Aitken,"Italy bans midnight Mass at Christmas, bishops support stricter measures","Italy has managed to fight off the fall resurgence, but health officials worry that ""Christmas as usual"" will lead to a third wave of cases.",https://www.foxnews.com/world/italy-cancels-midnight-mass-christmas-urges-small-celebrations,https://static.foxnews.com/foxnews.com/content/uploads/2020/12/AP20338536737556.jpg,2020-12-04T19:06:31Z,"Italians will not be able to attend midnight Mass on Christmas Eve, with top health officials cracking down on any conditions that could lead to a potential resurgence in coronavirus cases -- a step … [+3993 chars]",fox-news,Fox News
Ryan Gaydos,Texas high school football team removed from playoffs after star player's referee attack,A Texas school district removed a high school football team from the playoffs after one player’s attack vicious attack on a referee during a game.,https://www.foxnews.com/sports/texas-high-school-football-team-playoffs-referee-attack,https://static.foxnews.com/foxnews.com/content/uploads/2019/10/football-itock.jpg,2020-12-04T19:06:11Z,"A Texas school district removed a high school football team from the playoffs after one player’s vicious attack on a referee during a game.
The Edinburg Consolidated Independent School District said… [+2034 chars]",fox-news,Fox News
Ryan Gaydos,Michigan state lawmakers urge Lions to hire 49ers defensive coordinator Robert Saleh as next head coach,Michigan state lawmakers are reportedly going to bat for Detroit Lions fans and hoping to bring in a native to become the team’s next head coach.,https://www.foxnews.com/sports/michigan-state-lawmakers-lions-49ers-defensive-coordinator-robert-saleh-head-coach,https://static.foxnews.com/foxnews.com/content/uploads/2019/12/RT-Robert-Saleh.jpg,2020-12-04T19:06:07Z,"Michigan state lawmakers are going to bat for Detroit Lions fans and hoping to bring in a native to become the team’s next head coach.
The group sent a letter to Lions ownership asking for the organ… [+1900 chars]",fox-news,Fox News
Brooke Singman,Pence says US 'a week and a half away' from 'likely approval' of first coronavirus vaccine,Vice President Mike Pence said Friday that the U.S. is “maybe just a week and a half away” from the “likely approval” of the first vaccine to protect against the novel coronavirus.,https://www.foxnews.com/politics/pence-week-and-a-half-away-likely-approval-first-coronavirus-vaccine,https://cf-images.us-east-1.prod.boltdns.net/v1/static/694940094001/96e98f03-c2fd-48d6-aa73-11f712c58981/c67de997-b0f1-403a-b1de-10aa684847b1/1280x720/match/image.jpg,2020-12-04T19:01:44Z,"Vice President Mike Pence said Friday that the U.S. is “maybe just a week and a half away” from the “likely approval” of the first vaccine to protect against the novel coronavirus.
During an event a… [+3810 chars]",fox-news,Fox News
"Content provided by Fox Bet. Fox Bet was developed by a division of Flutter Entertainment in partnership with Fox Sports, a unit of Fox Corporation. Fox Bet is solely responsible for this content and the products and services it provides.",Win with Super 6 on Spence Jr.-Garcia fight,The biggest Pay-Per-View fight of the year is on Fox PPV on Saturday night.,https://www.foxnews.com/sports/spence-jr-garcia-fight-super-six-win,https://static.foxnews.com/foxnews.com/content/uploads/2020/12/Errol-Spence-Jr-Danny-Garcia-GETTY.jpg,2020-12-04T18:54:02Z,"There’s nothing like a great fight card on a Saturday night to make the blood percolate inside a sports fan.
When the gloves touch and two elite boxers stand in the center of the ring with one anoth… [+4017 chars]",fox-news,Fox News
James Leggate,Ohio adds Ohio to its travel advisory list due to high coronavirus positivity rate,Ohio residents should reconsider traveling to the state of Ohio.,https://www.foxnews.com/travel/ohio-adds-ohio-travel-advisory-list-high-covid-19-positivity-rate,https://static.foxnews.com/foxnews.com/content/uploads/2020/12/iStock-517524426.jpg,2020-12-04T18:47:40Z,"Ohio residents should reconsider traveling to the state of Ohio.
The Ohio Department of Health’s list of states with a travel advisory — because of high COVID-19 testing positivity rates — now inclu… [+2403 chars]",fox-news,Fox News
Morgan Phillips,House passes legislation to decriminalize marijuana at federal level,"The House of Representatives voted 228-164 to pass the Marijuana Opportunity Reinvestment and Expungement Act Friday morning, the first time either chamber of Congress has ever voted to decriminalize marijuana.",https://www.foxnews.com/politics/house-passes-legislation-decriminalize-marijuana-federal-level,https://static.foxnews.com/foxnews.com/content/uploads/2020/11/AP20319815989481.jpg,2020-12-04T18:37:13Z,"The House of Representatives voted 228-164 to pass the Marijuana Opportunity Reinvestment and Expungement Act on Friday, the first time either chamber of Congress has ever voted to decriminalize mari… [+1713 chars]",fox-news,Fox News
Julia Musto,"Stunt artists take responsibility for mystery monoliths, sell them for $45G",A New Mexico artist collective is taking responsibility for the stainless steel monoliths mysteriously cropping up around the world.,https://www.foxnews.com/science/stunt-artists-take-responsibility-for-monolith-sell-them-for-45000,https://static.foxnews.com/foxnews.com/content/uploads/2020/12/AP20337015533113.jpg,2020-12-04T18:23:53Z,"A New Mexico artist collective is taking responsibility for the stainless steel monoliths mysteriously cropping up around the world. 
The Most Famous Artist ""global creative community,"" based in San… [+2241 chars]",fox-news,Fox News
Audrey Conklin,"Georgia recertifies election results, rejecting fraud claims tied to viral video",Georgia on Friday recertified its election results as State Secretary Brad Raffensperger's office debunked a recently surfaced video that some pundits have said shows evidence of ballot fraud.,https://www.foxnews.com/politics/georgia-recertifies-election-results-fulton-county-video,https://static.foxnews.com/foxnews.com/content/uploads/2020/12/AP20330597412236-e1606836180589.jpg,2020-12-04T18:20:51Z,Georgia recertified its election results on Friday as Secretary of State Brad Raffensperger's office debunked a recently surfaced video that appeared to show illegal ballot-counting without superviso… [+2597 chars],fox-news,Fox News
Morgan Phillips,When are the Georgia Senate debates?,"The Loeffler-Warnock debate will kick off at 7 p.m. on Dec. 6, after Jon Ossoff takes the stage at 5 p.m. by himself.",https://www.foxnews.com/politics/when-are-the-georgia-senate-debates,https://static.foxnews.com/foxnews.com/content/uploads/2020/12/Georgia-Candidates-thumb.jpg,2020-12-04T18:17:21Z,"Sen. Kelly Loeffler, R-Ga., will face off against Democrat Rev. Raphael Warnock in a debate Sunday night for the closely watched battle for Senate control. 
The Loeffler-Warnock debate will kick off… [+2774 chars]",fox-news,Fox News
Joshua Nelson,'Hillbilly Elegy' author on politicians defying COVID-19 rules as businesses suffer: 'Fundamental unfairness',Venture capitalist and author J.D. Vance criticized politicians who were failing to follow their own coronavirus restrictions while business owners were struggling.,https://www.foxnews.com/politics/jd-vance-hillbilly-elegy-politicians-covid-lockdowns-harming-businesses,https://static.foxnews.com/foxnews.com/content/uploads/2020/12/Screen-Shot-2020-12-04-at-11.19.32-AM.png,2020-12-04T18:15:44Z,"Venture capitalist and author J.D. Vance criticized politicians who were failing to follow their own coronavirus restrictions while business owners were struggling.
“First is just the fundamental un… [+3129 chars]",fox-news,Fox News
Associated Press,Ben Simmons all in on 76ers’ new buzzword: accountability,The idea of Ben Simmons and Joel Embiid as a modern-day odd couple bunking together in a Center City condominium trash-talking during games of “FIFA 21” after playing taxing real NBA games momentarily got a rise out of 76ers fans.,https://www.foxnews.com/sports/ben-simmons-all-in-on-76ers-new-buzzword-accountability,https://static.foxnews.com/foxnews.com/content/uploads/2020/12/Ben-Simmons.jpg,2020-12-04T18:13:57Z,The idea of Ben Simmons and Joel Embiid as a modern-day odd couple bunking together in a Center City condominium trash-talking during games of “FIFA 21” after playing taxing real NBA games momentaril… [+4301 chars],fox-news,Fox News
Jessica Napoli,'Selena' series stars on why they hope Selena Quintanilla is proud of new Netflix show,Part 1 of the series depicts the artist's rise to fame with the family band.,https://www.foxnews.com/entertainment/selena-quintanilla-proud-netflix-show,https://static.foxnews.com/foxnews.com/content/uploads/2020/12/Selena_103-Sc21_00057_R.jpg,2020-12-04T18:08:42Z,"""Selena: The Series"" on Netflix is all about family.
The show not only explores the late singer's rise to fame from performing at small local gigs to becoming one of the most successful female Latin… [+2851 chars]",fox-news,Fox News
Associated Press,"Coaching can wait: Rondo plots future, but stays in present",Rajon Rondo is planning for a future in coaching.,https://www.foxnews.com/sports/coaching-can-wait-rondo-plots-future-but-stays-in-present,https://static.foxnews.com/foxnews.com/content/uploads/2020/12/Rajon-Rondo.jpg,2020-12-04T18:08:17Z,"Rajon Rondo is planning for a future in coaching.
Maybe he'll get a shot as as a general manager.
Not that he's ready to get started on those career goals just yet.
CLICK HERE FOR MORE SPORTS COVE… [+4387 chars]",fox-news,Fox News
Paul Steinhauser,"Videos, virtual events and planned trips: Biden, Obama, Pence, Trump weigh in on Georgia runoffs - Fox News","<ol><li>Videos, virtual events and planned trips: Biden, Obama, Pence, Trump weigh in on Georgia runoffs  Fox News
</li><li>David Perdue appears to tacitly acknowledge Biden’s victory in video call with Republican group  The Washington Post
</li><li>Trump T…",https://www.foxnews.com/politics/biden-obama-pence-trump-georgia-runoffs,https://cf-images.us-east-1.prod.boltdns.net/v1/static/694940094001/6a0e5f48-470b-4623-af9b-51c235d84f90/421d1693-9dd4-490e-b562-b1c040b6bd4a/1280x720/match/image.jpg,2020-12-04T18:06:55Z,"President Trump, his predecessor and soon-to-be successor in the White House, as well as Vice President Mike Pence, are all weighing in on Georgia’s two Jan. 5 Senate runoff elections, where the Repu… [+4350 chars]",fox-news,Fox News
Associated Press,Sergiño Dest says 'it is my time' at Barcelona,"Amid the turmoil at Barcelona, United States defender Sergiño Dest has found his patch to flourish.",https://www.foxnews.com/sports/sergino-dest-says-it-is-my-time-at-barcelona,https://static.foxnews.com/foxnews.com/content/uploads/2020/12/Sergino-Dest.jpg,2020-12-04T18:05:36Z,"Amid the turmoil at Barcelona, United States defender Sergiño Dest has found his patch to flourish.
The former Ajax player arrived in the aftermath of Barcelona’s devastating 8-2 loss to Bayern Muni… [+4435 chars]",fox-news,Fox News
John Toldi,"Biden Taps Fauci, Some Some GOP Senators Are Privately Congratulating Him","Howie Kurtz on Joe Biden and Kamala Harris conducting their first joint interview since the election, Dr. Fauci accepting offer to be Chief Medical Adviser for the Biden team and Trump's Department of Justice liaison is banned from the building. Follow Howie …",https://radio.foxnews.com/2020/12/04/biden-taps-fauci-some-some-gop-senators-are-privately-congratulating-him/,https://radio.foxnews.com/wp-content/uploads/2020/06/FEATURED_IMAGE_Media_Buzz_Meter.png,2020-12-04T18:02:23Z,,fox-news,Fox News
Chris Massaro,France struggles with systemic racism and new security law as protests rock country,"France has been roiled for days, with mass protests and collective outrage, over a proposed security law that would criminalize recording or photographing police behavior with “obvious intention to harm their physical and psychological integrity” in the publi…",https://www.foxnews.com/world/france-struggles-systemic-racism-new-security-law-protests-rock-country,https://static.foxnews.com/foxnews.com/content/uploads/2020/12/AP20336607313268.jpg,2020-12-04T21:54:32Z,"France has been roiled for days, with mass protests and collective outrage, over a proposed security law that would criminalize recording or photographing police behavior with “obvious intention to h… [+8801 chars]",fox-news,Fox News
Caitlin McFall,Democratic NJ governor tells Matt Gaetz he's 'not welcome' in state,"Democratic New Jersey Gov. Phil Murphy condemned Rep. Matt Gaetz, R-Fla., during a Friday news conference and then again on twitter after the GOP congressman attended a crowded party in the Garden State for the Young Republicans, breaking the state’s COVID-19…",https://www.foxnews.com/politics/democratic-nj-governor-tells-matt-gaetz-hes-not-welcome-in-state,https://static.foxnews.com/foxnews.com/content/uploads/2020/12/Phil-murphy-Matt-Gaetz-2.jpg,2020-12-04T21:53:22Z,"Democratic New Jersey Gov. Phil Murphy condemned Rep. Matt Gaetz, R-Fla., during a Friday news conference and then again on twitter after the GOP congressman attended a crowded party in the Garden St… [+3274 chars]",fox-news,Fox News
Peter Aitken,San Joaquin deputies investigate death of 11-year-old who fatally shot himself during online class,California deputies are investigating the death of an 11-year-old who fatally shot himself during an online class.,https://www.foxnews.com/us/san-joaquin-deputies-investigate-death-of-11-year-old-who-fatally-shot-himself-during-online-class,https://static.foxnews.com/foxnews.com/content/uploads/2020/12/1290-LILAC-STREET-LODI-CA-95242.png,2020-12-04T21:47:52Z,"Californiadeputies are investigating the death of an 11-year-old who fatally shot himself during an online class, according to reports. 
Initial reports indicated Adan Manuel Llanos of San Joaquin s… [+2425 chars]",fox-news,Fox News
Michael Bartiromo,"Fishermen rescue sea turtle from jaws of tiger shark, wild video shows",That’s one lucky turtle.,https://www.foxnews.com/great-outdoors/fishermen-rescue-sea-turtle-tiger-shark-video-shows,https://static.foxnews.com/foxnews.com/content/uploads/2020/12/SeaTurtleTigerShark.jpg,2020-12-04T21:41:32Z,"That’s one lucky turtle.
A couple of fishermen off the coast of the Bahamas managed to rescue a sea turtle from the jaws of a tiger shark last week — and now footage of their once-in-a-lifetime catc… [+1776 chars]",fox-news,Fox News
Larry Elder,Larry Elder: Trump won his other campaign -- to destroy mainstream media's credibility,"For four years, major media, along with their Democratic comrades, banded together to bring down Trump.",https://www.foxnews.com/opinion/trump-won-other-campaign-mainstream-media-larry-elder,https://cf-images.us-east-1.prod.boltdns.net/v1/static/694940094001/20a8f365-c822-4605-87c4-8c1f518299a1/8da00492-471d-4f37-a67c-05f95682c4fb/1280x720/match/image.jpg,2020-12-04T21:40:56Z,"Convinced that President Donald Trump lost his bid for reelection, the media suddenly became less hysterical. Just like that, the media, at least to some degree, rediscovered concepts such as fairnes… [+4955 chars]",fox-news,Fox News
Kayla Rivas,"Coronavirus tracking apps having ‘modest’ impact amid pandemic, expert says","While Apple and Google released technology in May to help notify people of COVID-19 exposure, experts say low adoption has so far led to a modest impact on the pandemic.",https://www.foxnews.com/health/coronavirus-exposure-notification-modest-impact-amid-pandemic,https://static.foxnews.com/foxnews.com/content/uploads/2020/12/iStock-1187582529-2.jpg,2020-12-04T21:37:02Z,"While Apple and Google released technology in May to help notify people of COVID-19 exposure, experts say low adoption has so far led to a modest impact on the pandemic.
The “Exposure Notifications”… [+5924 chars]",fox-news,Fox News
Michael Ruiz,"GOP candidate rebounds from Senate loss with new super PAC, will aid in Georgia runoffs","Fresh off a Senate campaign that fell short to an established Democratic incumbent, retired Lt. Col. Daniel Gade is rebounding with a new PAC aimed at promoting veterans’ issues and conservative candidates – with an immediate eye on the Georgia runoff races.",https://www.foxnews.com/politics/georgia-runoffs-daniel-gade-new-mission-pac,https://static.foxnews.com/foxnews.com/content/uploads/2020/12/Gerogia-Runoff-Candidates-THUMB.jpg,2020-12-04T21:36:31Z,"Fresh off a Senate campaign that fell short to an established Democratic incumbent, retired Lt. Col. Daniel Gade is rebounding with a new PAC aimed at promoting veterans’ issues and conservative cand… [+2995 chars]",fox-news,Fox News
Robert Gearty,"FBI joins manhunt for suspect in Chicago-area double slaying, baby snatching",The manhunt for the suspect in a week-old Chicago-area double homicide and child abduction has been extended to two other states and now involves the FBI.,https://www.foxnews.com/us/fbi-manhunt-suspect-chicago-double-slaying-baby-snatching,https://static.foxnews.com/foxnews.com/content/uploads/2020/11/Amber-Alert-RIVERDALE-POLICE-DEPT-1.jpg,2020-12-04T21:26:09Z,"The manhunt for the suspect in a week-old, Chicago-area double homicide and child abduction has been extended to two other states and now involves the FBI.
The Chicago FBI said Friday it joined the … [+1218 chars]",fox-news,Fox News
"Sam Dorman, Marisa Schultz",Pelosi on reason for shift to supporting smaller coronavirus relief: 'New president',"House Speaker Nancy Pelosi, D-Calif., said on Friday that she was willing to move forward with a smaller coronavirus relief package with President-elect Biden headed to the White House and a vaccine on the way.",https://www.foxnews.com/politics/pelosi-coronavirus-relief-new-president,https://static.foxnews.com/foxnews.com/content/uploads/2020/11/pelosi-today.jpg,2020-12-04T21:24:06Z,"House Speaker Nancy Pelosi, D-Calif., said on Friday that she was willing to move forward with a smaller coronavirus relief package with President-elect Biden headed to the White House and a vaccine … [+3039 chars]",fox-news,Fox News
Ben Evansky,UN accused by Israeli group of flouting international law by funding construction in Israeli-controlled areas,The United Nations is being accused of funding illegal infrastructure projects for Palestinians in an area where Israel exercises exclusive functional control as envisioned by current peace agreements.,https://www.foxnews.com/world/un-accused-israeli-group-flouting-international-law-funding-construction-israeli-controlled-areas,https://static.foxnews.com/foxnews.com/content/uploads/2020/12/bestory2.jpg,2020-12-04T21:18:01Z,The United Nations is being accused of funding illegal infrastructure projects for Palestinians in an area where Israel exercises exclusive functional control as envisioned by current peace agreement… [+6316 chars],fox-news,Fox News
Sam Dorman,Michelle Fischbach vows to counter Democrats as historic number of anti-abortion women elected to House,"When congresswoman-elect Michelle Fischbach, R-Minn., is sworn in next month, she will be one of a historic number of anti-abortion women elected to the House.",https://www.foxnews.com/politics/michelle-fischbach-anti-abortion-women-congress,https://static.foxnews.com/foxnews.com/content/uploads/2020/12/Michelle-Fischbach-GETTY.jpg,2020-12-04T21:09:21Z,"When congresswoman-elect Michelle Fischbach, R-Minn., is sworn in next month, she will be one of a historic number of anti-abortion women elected to the House.
""I think it's a wonderful bonus for th… [+4516 chars]",fox-news,Fox News
Jonathan Garber,FEC complaint filed against Democratic candidate Rita Hart in contested Iowa congressional race,EXCLUSIVE: A Federal Election Commission complaint has been filed accusing Democratic Iowa 2nd District House candidate Rita Hart of pretending to use volunteer labor to exceed campaign contribution limits.,https://www.foxnews.com/politics/fec-complaint-democratic-iowa-congressional-candidate-rita-hart,https://static.foxnews.com/foxnews.com/content/uploads/2020/12/Rita-Hart-GETTY.jpg,2020-12-04T21:07:32Z,EXCLUSIVE: A Federal Election Commission complaint has been filed accusing Democratic Iowa 2nd District House candidate Rita Hart of pretending to use volunteer labor to exceed campaign contribution … [+2606 chars],fox-news,Fox News
