author,title,description,url,urlToImage,publishedAt,content,source.id,source.name
Jonah Blocker,Top 5 Holiday Traditions Emily Compagno,"This week, Fox News Contributor Emily Compagno comes on to share her top 5 favorite holiday traditions.",https://radio.foxnews.com/2020/12/16/top-5-holiday-traditions-emily-compagno/,https://radio.foxnews.com/wp-content/uploads/2020/04/FOX_TOP5_SLATE.png,2020-12-16T10:00:00Z,"The FOX Top 5 podcast. From greatest Presidential quotes, to favorite family traditions, to guilty pleasures... Join your favorite FOX News anchors, reporters and personalities every week, as they pa… [+220 chars]",fox-news,Fox News
Associated Press,Boston Red Sox legend Manny Ramirez is back in baseball Down Under,"Manny Ramirez — yes, that Manny Ramirez — is back in baseball Down Under.",https://www.foxnews.com/sports/boston-red-sox-legend-manny-ramirez-is-back-in-baseball-down-under,https://static.foxnews.com/foxnews.com/content/uploads/2020/12/AP20351196255413.jpg,2020-12-16T13:59:09Z,"Manny Ramirez — yes, that Manny Ramirez — is back in baseball Down Under.
The now 48-year-old former Boston Red Sox legend and 12-time Major League Baseball all-star is scheduled to begin the season… [+1678 chars]",fox-news,Fox News
Associated Press,NFC East stages late-season turnaround,The NFC East is no longer the laughingstock division in the NFL.,https://www.foxnews.com/sports/nfc-east-late-season-turnaround,https://static.foxnews.com/foxnews.com/content/uploads/2020/12/AP20348839176015.jpg,2020-12-16T13:51:53Z,"The NFC East is no longer the laughingstock division in the NFL.
After combining to win just two of their first 21 non-division games this season, the teams from the NFC East have been knocking off … [+4252 chars]",fox-news,Fox News
Jessica Napoli,'The Voice' crowns Season 19 winner,The winner was from Gwen Stefani's team.,https://www.foxnews.com/entertainment/the-voice-winner-season-19,https://static.foxnews.com/foxnews.com/content/uploads/2020/12/voicekeyart.jpg,2020-12-16T13:46:12Z,"""The Voice"" has a new champion.
On Tuesday night, Carter Rubin took home the title for Season 19. The 15-year-old from Shoreham, N.Y., was part of Gwen Stefani's team. 
Rubin is the singing competi… [+1853 chars]",fox-news,Fox News
Julius Young,Lifetime's 'steamy' Mario Lopez as Colonel Sanders mini-movie slammed by chicken heiress,Kaila Methven isn’t at all pleased after Kentucky Fried Chicken and Lifetime produced a soap opera-style film as part of a branded content collaboration.,https://www.foxnews.com/entertainment/lifetime-kfc-mario-lopez-colonel-sanders-movie-chicken-heiress,https://static.foxnews.com/foxnews.com/content/uploads/2020/12/KFC_Heiress_Kaila_Methven_Carpet_Getty.jpg,2020-12-16T13:42:02Z,"EXCLUSIVE: Kaila Methven isn’t at all pleased after Kentucky Fried Chicken and Lifetime produced a soap opera-style film as part of a branded content collaboration.
Methven, a 29-year-old entreprene… [+6296 chars]",fox-news,Fox News
Julius Young,Lifetime's 'steamy' Mario Lopez as Colonel Sanders mini-movie slammed by chicken heiress,Kaila Methven isn’t at all pleased after Kentucky Fried Chicken and Lifetime produced a soap opera-style film as part of a branded content collaboration.,https://www.foxnews.com/entertainment/lifetime-kfc-mario-lopez-colonel-sanders-movie-cheicken-heiress,https://static.foxnews.com/foxnews.com/content/uploads/2020/12/KFC_Heiress_Kaila_Methven_Carpet_Getty.jpg,2020-12-16T13:42:02Z,"EXCLUSIVE: Kaila Methven isn’t at all pleased after Kentucky Fried Chicken and Lifetime produced a soap opera-style film as part of a branded content collaboration.
Methven, a 29-year-old entreprene… [+6296 chars]",fox-news,Fox News
Tyler Olson,Trump asking about potential special counsel to investigate Hunter Biden after Barr resignation,"President Trump is talking to advisers about asking for a special counsel to be appointed to continue investigations into the ""tax affairs"" of Hunter Biden, the son of President-elect Biden, according to a report.",https://www.foxnews.com/politics/trump-potential-special-counsel-hunter-biden-barr-resignation,https://static.foxnews.com/foxnews.com/content/uploads/2020/12/TrumpHunterSplit.jpg,2020-12-16T13:37:11Z,"President Trump is talking to advisers about asking for a special counsel to be appointed to continue investigating Hunter Biden, the son of President-elect Joe Biden, according to a report.
The new… [+5973 chars]",fox-news,Fox News
Kayla Rivas,"Amid coronavirus surge, California calls for 5,000 body bags, dozens of refrigerated storage units","California has sent orders for 5,000 additional body bags, with 60 refrigerated storage units on standby as the state battles historic highs in daily cases and positivity rates.",https://www.foxnews.com/health/california-body-bags-refrigerated-storage-coronavirus,https://static.foxnews.com/foxnews.com/content/uploads/2020/12/9f329c08-AP20346732302268.jpg,2020-12-16T13:18:54Z,"California has sent orders for 5,000 additional body bags, with 60 refrigerated storage units on standby as the state battles historic highs in daily virus cases and positivity rates.
“We’re going t… [+1077 chars]",fox-news,Fox News
Stephanie Pagones,"Ex-Houston police captain investigating voter fraud scheme runs man off road, holds him at gunpoint: cops","A former captain with the Houston Police Department was charged with assault after running a man off the road and holding him at gunpoint in an effort to prove what authorities called “unfounded” allegations of a voter fraud scheme, officials recently announc…",https://www.foxnews.com/us/houston-police-captain-voter-fraud-scheme-assault-police,https://static.foxnews.com/foxnews.com/content/uploads/2020/12/AP20350858520111-e1608120080308.jpg,2020-12-16T13:14:22Z,A former captain with the Houston Police Department was charged with assault after running a man off the road and holding him at gunpoint in an effort to prove what authorities called “unfounded” all… [+2901 chars],fox-news,Fox News
Tyler McCarthy,"'Wheel of Fortune' contestant shocks Pat Sajak, viewers with her huge enthusiasm and impressive gameplay",“Wheel of Fortune” viewers were inspired by the relentless positivity of recent contestant and winner Diana Hawkins.,https://www.foxnews.com/entertainment/wheel-of-fortune-contestant-shocks-pat-sajak-viewers-enthusiasm-gameplay,https://static.foxnews.com/foxnews.com/content/uploads/2020/11/Wheel-of-Fortune2.jpg,2020-12-16T13:13:03Z,"“Wheel of Fortune” viewers were inspired by the relentless positivity of recent contestant and winner Diana Hawkins.
The data analyst and mother of four appeared on Tuesday night’s episode of the po… [+2481 chars]",fox-news,Fox News
Alexandra Deabler,"Taco Bell bringing back Nacho Fries on Christmas Eve, for (yet another) limited time","What Taco Bell giveth, it taketh away…and then returns with something else entirely.",https://www.foxnews.com/food-drink/taco-bell-bringing-back-nacho-fries-christmas-eve,https://static.foxnews.com/foxnews.com/content/uploads/2020/12/Taco-Bell-Nacho-Fries.jpg,2020-12-16T13:00:16Z,"After months of slashing fan favorites, Taco Bell is here to wish its faithful customers a Merry Christmas by bringing back an item that they brought back around this time last year… and the year bef… [+2038 chars]",fox-news,Fox News
Janice Dean,Major nor’easter set to bring up to 2 feet of snow in parts of East Coast,A major nor’easter is set to pack a punch and bring big snow to the Mid-Atlantic and Northeast on Wednesday afternoon and into Thursday morning.,https://www.foxnews.com/us/major-noreaster-set-to-bring-heavy-snow,https://static.foxnews.com/foxnews.com/content/uploads/2020/12/Forecast-12-15-c.png,2020-12-16T12:56:46Z,"A major nor’easter is set to pack a punch and bring big snow to the Mid-Atlantic and Northeast on Wednesday afternoon and into Thursday morning.
A classic coastal low will set up just off the Northe… [+1551 chars]",fox-news,Fox News
Chris Ciaccia,Mysterious Planet Nine discovery may be forthcoming after bizarre exoplanet found in deep space,"Although scientists have yet to find the elusive Planet 9, a recently discovered exoplanet in deep space may provide further evidence the mysterious celestial object indeed exists.",https://www.foxnews.com/science/planet-nine-discovery-forthcoming-bizarre-exoplanet-found,https://static.foxnews.com/foxnews.com/content/uploads/2020/12/heic2021a.jpg,2020-12-16T12:45:24Z,"Although scientists have yet to find the elusive Planet 9, a recently discovered exoplanet in deep space may provide further evidence the mysterious celestial object indeed exists.
The exoplanet HD … [+4534 chars]",fox-news,Fox News
Jim Daly,"Jim Daly: This Christmas, your children need your presence far more than presents",I hope you’ll give to your children this year what nobody else can give them.,https://www.foxnews.com/opinion/christmas-children-presents-jim-daly,https://static.foxnews.com/foxnews.com/content/uploads/2020/12/Christmas-Morning-iStock-1.jpg,2020-12-16T12:30:48Z,"According to the National Retail Federation, Americans will spend, on average, almost $1,000 this year on Christmas.
Gift-giving accounts for the lion’s share of that seasonal expenditure, but befor… [+3894 chars]",fox-news,Fox News
Cortney Moore,"Cheaters want COVID-19 vaccine so they can have 'responsible' affairs, survey says","Some cheaters are looking forward to the coronavirus vaccine. That’s what a new survey from the affair arrangement dating site Ashley Madison is suggesting, which says 4 out of 10 cheaters would like to receive a COVID-19 vaccine so they can “responsibly cont…",https://www.foxnews.com/lifestyle/cheaters-want-coronavirus-vaccine-responsible-affairs,https://static.foxnews.com/foxnews.com/content/uploads/2020/12/iStock-1237976141.jpg,2020-12-16T12:23:24Z,"Some cheaters are looking forward to the coronavirus vaccine.
That’s what a new survey from the affair-arrangement dating site Ashley Madison is suggesting, which says four out of 10 cheaters would … [+2392 chars]",fox-news,Fox News
Tyler Olson,"Trump Jr. to stump for Perdue after Pence rallies Thursday, as Trump team answers Biden event","Donald Trump Jr. will hold his first in-person events of the Georgia Senate runoffs this week for Sen. David Perdue, adding himself to the long list of boldface political names to descend on the Peach State for the critical Jan. 5 races.",https://www.foxnews.com/politics/trump-jr-stump-perdue-this-weekend-pence-rallies-thursday-trump-team-answers-biden-event,https://static.foxnews.com/foxnews.com/content/uploads/2020/11/Trump-Jr-GETTY.jpg,2020-12-16T12:00:50Z,"Donald Trump Jr. will hold his first in-person events of the Georgia Senate runoffs this week for Sen. David Perdue, adding himself to the long list of boldface political names to descend on the Peac… [+4647 chars]",fox-news,Fox News
Bob Woodson,Bob Woodson: Defund the police? My experience tells me this is how to tackle 2020's urban violence spike,America’s cities have experienced near-record levels of crime and violence in 2020.,https://www.foxnews.com/opinion/bob-woodson-defund-police-2020-urban-violence-spike,https://cf-images.us-east-1.prod.boltdns.net/v1/static/694940094001/bd26170e-952c-4cb2-a7f8-e37d98bf1ba7/62a0fc04-8440-44cb-92d3-0d646bc9535b/1280x720/match/image.jpg,2020-12-16T12:00:15Z,"This year, America’s cities have experienced near-record levels of crime and violence. Philadelphia homicides are nearing an all-time high. Atlanta’s and Houston’s homicide rates are the cities’ high… [+4959 chars]",fox-news,Fox News
Danielle Wallace,LAPD cops who fatally shot Trader Joe’s manager during gun battle with armed suspect will not be charged,The Los Angeles County District Attorney’s Office on Tuesday made the decision not to criminally charge two LAPD officers who accidentally fatally shot a Trader Joe’s store manager two years ago while trying to prevent an armed suspect from taking customers a…,https://www.foxnews.com/us/lapd-officers-fatally-shot-trader-joes-manager-not-charged-hostage-situation-gun-battle-armed-suspect,https://static.foxnews.com/foxnews.com/content/uploads/2020/12/AP20351016841659.jpg,2020-12-16T15:59:26Z,The Los Angeles County District Attorney’s Office on Tuesday made the decision not to criminally charge two LAPD officers who accidentally fatally shot a Trader Joe’s store manager two years ago whil… [+4709 chars],fox-news,Fox News
Stephanie Nolasco,‘A Christmas Story’ star Peter Billingsley says he was given chewing tobacco on set: ‘They totally screwed up’,Peter Billingsley is dishing on a little-known secret from the set of “A Christmas Story.”,https://www.foxnews.com/entertainment/a-christmas-story-star-peter-billingsley-chewing-tobacco-claim-holiday-classic,https://static.foxnews.com/foxnews.com/content/uploads/2020/12/GettyImages-159821509.jpg,2020-12-16T15:45:08Z,"Peter Billingsley is dishing on a little-known secret from the set of “A Christmas Story.”
The 49-year-old recently made an appearance in the podcast“That Scene With Dan Patrick,” where he discussed… [+3333 chars]",fox-news,Fox News
Associated Press,Secretary of State Pompeo quarantines after coronavirus exposure,The State Department said Wednesday that Secretary of State Mike Pompeo had come into contact with a person who tested positive for COVID-19 and was quarantining.,https://www.foxnews.com/politics/secretary-of-state-pompeo-quarantines-coronavirus-exposure,https://static.foxnews.com/foxnews.com/content/uploads/2020/11/AP20329557617892.jpg,2020-12-16T15:39:25Z,"WASHINGTON (AP) The State Department said Wednesday that Secretary of State Mike Pompeo had come into contact with a person who tested positive for COVID-19 and was quarantining.
The department said… [+1049 chars]",fox-news,Fox News
Paul Steinhauser,Trump fires back after McConnell recognizes Biden's victory: 'Too soon to give up',"It took more than 14 hours, but President Trump finally publicly responded to a speech by Senate Majority Leader Mitch McConnell in which the Trump ally and fellow Republican congratulated President-elect Joe Biden on his White House victory.",https://www.foxnews.com/politics/trump-responds-mcconnell-biden-victory,https://static.foxnews.com/foxnews.com/content/uploads/2020/04/Trump-McConnell-AP.jpg,2020-12-16T15:33:11Z,"It took more than 14 hours, but President Trump finally publicly responded to a speech by Senate Majority Leader Mitch McConnell in which the Trump ally and fellow Republican congratulated President-… [+2394 chars]",fox-news,Fox News
Jessica Napoli,Cardi B and Offset caught partying without masks,The couple was celebrating the Migos rapper's 29th birthday.,https://www.foxnews.com/entertainment/cardi-b-and-offset-partying-without-masks,https://static.foxnews.com/foxnews.com/content/uploads/2020/10/cardi-b-offset-getty.jpg,2020-12-16T15:32:10Z,"Cardi B and Offset partied the night away this week for the Migos rapper's 29th birthday.
Not only did the ""Bodak Yellow"" star gift him a Lamborghini, but she also threw a massive party at a packed … [+2121 chars]",fox-news,Fox News
Joshua Nelson,150 Minnesota businesses vow to defy COVID-19 restrictions: 'An illegal and unlawful order',Gov. Tim Walz is expected to give an update on his decision for the expiring COVID-19 restrictions this Wednesday.,https://www.foxnews.com/us/minnesota-bars-and-restaurants-to-defy-covid-restrictions-this-is-an-illegal-and-unlawful-order,https://static.foxnews.com/foxnews.com/content/uploads/2020/12/iStock-1264166886.jpg,2020-12-16T15:23:08Z,"A group of restaurant owners in Minnesota are not backing down as the state may adopt new coronavirus restrictions.
“When they did our first shutdown, it didn’t feel right in my gut that they were d… [+2383 chars]",fox-news,Fox News
"Bill Mears, Shannon Bream",Supreme Court agrees to hear cases on NCAA athlete compensation,The U.S. Supreme Court has agreed to hear two cases regarding whether the NCAA violated antitrust law by limiting the amount of education-related benefits that athletes could procure.,https://www.foxnews.com/politics/supreme-court-ncaa-athlete-compensation,https://static.foxnews.com/foxnews.com/content/uploads/2020/12/AP20347680075316-1.jpg,2020-12-16T15:22:25Z,"The U.S. Supreme Court has agreed to hear two cases regarding whether the NCAA violated antitrust law by limiting the amount of education-related benefits that athletes could procure.
In a Wednesday… [+1416 chars]",fox-news,Fox News
Kayla Rivas,"Pfizer COVID-19 vaccine shipments under close watch amid upcoming snowy weather, Azar says","Despite a fast-approaching nor'easter across the Northeast, Secretary of Health and Human Services Alex Azar said FedEx and UPS are prepared and federal officials are keeping a close watch on shipments of doses.",https://www.foxnews.com/health/pfizer-covid-19-vaccine-snow-storm-azar,https://static.foxnews.com/foxnews.com/content/uploads/2020/12/vaccine-deliverie6.jpg,2020-12-16T15:20:40Z,"Despite a fast-approaching nor'easter across the Northeast, Secretary of Health and Human Services Alex Azar said FedEx and UPS are prepared and federal officials are keeping a close watch on shipmen… [+3568 chars]",fox-news,Fox News
admin,FOX NEWS MEDIA SIGNS LAURA INGRAHAM TO NEW MULTI-YEAR DEAL,"NEW YORK – December 16, 2020 – FOX News Media has signed Laura Ingraham to a new multi-year deal where she will continue as the host of The Ingraham Angle (weekdays, 10-11 PM/ET) on FOX News Channel (FNC), announced Suzanne Scott, CEO of FOX News Media. In ma…",http://press.foxnews.com/2020/12/fox-news-media-signs-laura-ingraham-to-new-multi-year-deal/,,2020-12-16T15:15:26Z,"NEW YORK  December 16, 2020  FOX News Media has signed Laura Ingraham to a new multi-year deal where she will continue as the host of The Ingraham Angle (weekdays, 10-11 PM/ET) on FOX News Channel (F… [+3776 chars]",fox-news,Fox News
Associated Press,Radford helps Virginia Tech beat No. 24 Clemson 66-60,"Just three weeks into the season, Virginia Tech has established itself as a surprise team.",https://www.foxnews.com/sports/radford-helps-virginia-tech-beat-no-24-clemson-66-60,https://static.foxnews.com/foxnews.com/content/uploads/2020/12/AP20351076528274.jpg,2020-12-16T15:12:10Z,"Just three weeks into the season, Virginia Tech has established itself as a surprise team.
Tyrece Radford scored 15 points and the Hokies beat No. 24 Clemson 66-60 on Tuesday.
CLICK HERE TO GET MOR… [+4354 chars]",fox-news,Fox News
Michael Bartiromo,"Florida woman finds raccoon in Christmas tree, films ensuing chaos after it climbs onto chandelier","A woman in Florida recently filmed her encounter with a raccoon that managed to climb inside her tree, along with the ensuing chaos that unfolded after the animal fled into her dining room and began swinging from her chandelier.",https://www.foxnews.com/lifestyle/florida-woman-raccoon-christmas-tree-chaos-chandelier,https://static.foxnews.com/foxnews.com/content/uploads/2020/12/RaccoonJazzHandsiStock.jpg,2020-12-16T15:08:15Z,"Finding a raccoon inside your Christmas tree isn’t quite as ridiculous as finding an owl or koala bear, but we can all agree it’s still pretty terrifying nonetheless.
A woman in Florida recently fil… [+2697 chars]",fox-news,Fox News
Michael Hollan,"Man threatens McDonald's workers with chainsaw, steals food, chases manager: cops","A bizarre scene unfolded at a McDonald’s in Maine when a male robbery suspect allegedly used a chainsaw to intimidate workers. While no money was stolen, the suspect used the power tool to make off with a free drink and some food, police say.",https://www.foxnews.com/lifestyle/mcdonalds-chainsaw-robbery-maine-arrested,https://static.foxnews.com/foxnews.com/content/uploads/2020/12/alice-sweet-mugshot.jpg,2020-12-16T15:03:14Z,"Chainsaws and fast food don’t make a good combination.
A bizarre scene unfolded at a McDonald’s in Maine when a male robbery suspect allegedly used a chainsaw to intimidate workers. While no money w… [+1673 chars]",fox-news,Fox News
Audrey Conklin,Biden aide calls GOP 'a bunch of fu-----' while praising his call for unity,"President-elect Joe Biden’s deputy chief of staff, Jen O'Malley Dillon, called Republicans ""a bunch of f---ers"" while praising Biden's call for unity in an interview with Glamour magazine.",https://www.foxnews.com/politics/biden-deputy-chief-gop-bunch-of-f-ers,https://static.foxnews.com/foxnews.com/content/uploads/2020/12/biden-apJen-O-Malley-Dillon-getty.jpg,2020-12-16T15:00:50Z,"President-elect Joe Biden’s deputy chief of staff, Jen O'Malley Dillon, called Republicans ""a bunch of f---ers"" while praising Biden's call for unity in an interview with Glamour magazine.
O'Malley … [+2184 chars]",fox-news,Fox News
Gary Gastelu,Nevada police using 'ghosted' patrol cars in DUI blitz,"The Nevada Highway Patrol is using ""ghosted"" patrol cars with low profile logos and lights to catch DUI offenders in and around Las Vegas. The cars are harder to pick out at night than the department's regular vehicles.",https://www.foxnews.com/auto/nevada-police-ghosted-patrol-cars-dui,https://static.foxnews.com/foxnews.com/content/uploads/2020/12/ghost-.jpg,2020-12-16T14:56:06Z,"The Nevada Highway Patrol has launched a holiday DUI blitz in the Las Vegas area using “ghosted” cop cars.
(NHP)
The Ford Interceptor Utilities aren’t quite undercover, but feature darker badging t… [+1139 chars]",fox-news,Fox News
Greg Norman,"Russia tests anti-satellite missile in pursuit to make space a ‘warfighting domain,’ US officials say","Russia has test-fired an anti-satellite missile in its pursuit to turn space into a “warfighting domain,” the U.S. Space Command announced Wednesday.",https://www.foxnews.com/world/us-space-command-russia-tests-anti-satellite-missile,https://static.foxnews.com/foxnews.com/content/uploads/2020/10/putin-latest.jpg,2020-12-16T14:49:54Z,"Russia test-fired an anti-satellite missile in its pursuit to turn space into a “warfighting domain,” the U.S. Space Command announced Wednesday. 
The direct-ascent, anti-satellite missile test took… [+1366 chars]",fox-news,Fox News
Associated Press,Cockburn scores 33 as No. 13 Illinois routs Minnesota 92-65,Kofi Cockburn scored a career-high 33 points and grabbed 13 rebounds in only 25 minutes to lead No. 13 Illinois past Minnesota 92-65 in the Big Ten opener for both teams Tuesday night.,https://www.foxnews.com/sports/cockburn-scores-33-as-no-13-illinois-routs-minnesota-92-65,https://static.foxnews.com/foxnews.com/content/uploads/2020/12/Minnesota_Illinois.jpg,2020-12-16T14:49:30Z,"Kofi Cockburn scored a career-high 33 points and grabbed 13 rebounds in only 25 minutes to lead No. 13 Illinois past Minnesota 92-65 in the Big Ten opener for both teams Tuesday night.
Freshman guar… [+2921 chars]",fox-news,Fox News
Janine Puhak,"Maryland waitresses shocked with $2,020 tip before indoor dining closes in county","2020 will end on a bit of a better note for two waitresses in Maryland who received a $2,020 tip before indoor dining shuts down in the area.",https://www.foxnews.com/food-drink/maryland-waitress-shocked-with-2020-tip,https://static.foxnews.com/foxnews.com/content/uploads/2020/12/be08ab6c-restaurant-receipt-istock.jpg,2020-12-16T14:40:44Z,"This year will end on a bit of a better note for two waitresses in Maryland who received a $2,020 tip before indoor dining shuts down in the area.
Lauren Jewel and Jennifer Zoller work at Evelyn’s i… [+2249 chars]",fox-news,Fox News
Associated Press,No. 12 Wisconsin knocks off Loyola of Chicago 77-63,Wisconsin is at its best when hitting 3-pointers. That meant Loyola of Chicago picked the wrong night to play the Badgers.,https://www.foxnews.com/sports/no-12-wisconsin-knocks-off-loyola-of-chicago-77-63,https://static.foxnews.com/foxnews.com/content/uploads/2020/12/Wisconsin_Badgers.jpg,2020-12-16T14:40:32Z,"Wisconsin is at its best when hitting 3-pointers. That meant Loyola of Chicago picked the wrong night to play the Badgers.
Brad Davison and D’Mitrik Trice each scored 17 points as No. 12 Wisconsin c… [+3836 chars]",fox-news,Fox News
Associated Press,Gordon leads young K-State to 74-65 win in Big 12 opener,"DaJuan Gordon scored 15 points, making all 11 free throws, Kansas State made seven of eight from the line in the last 41 seconds, turning aside a late Iowa State surge 74-65 Tuesday night in a Big 12 Conference opener.",https://www.foxnews.com/sports/gordon-leads-young-k-state-to-74-65-win-in-big-12-opener,https://static.foxnews.com/foxnews.com/content/uploads/2020/12/Kansas_State.jpg,2020-12-16T14:31:44Z,"DaJuan Gordon scored 15 points, making all 11 free throws, Kansas State made seven of eight from the line in the last 41 seconds, turning aside a late Iowa State surge 74-65 Tuesday night in a Big 12… [+1505 chars]",fox-news,Fox News
Tyler McCarthy,Whitney Houston biopic 'I Wanna Dance With Somebody' finds its star in actress Naomi Ackie,The Whitney Houston biopic has found its lead in “Star Wars: The Rise of Skywalker” actress Naomi Ackie.,https://www.foxnews.com/entertainment/whitney-houston-biopic-star-actress-naomi-ackie,https://static.foxnews.com/foxnews.com/content/uploads/2020/12/Naomi-Ackie-Getty.jpg,2020-12-16T14:28:35Z,"The Whitney Houston biopic has found its lead in “Star Wars: The Rise of Skywalker” actress Naomi Ackie. 
Ackie will be the star of the upcoming film “I Wanna Dance With Somebody,” which is titled a… [+2841 chars]",fox-news,Fox News
