author,title,description,url,urlToImage,publishedAt,content,source.id,source.name
Fox News,Trump says Dems approved USMCA deal because they're 'embarrassed' by impeachment 'witch hunt',,https://www.foxnews.com/us/trump-democrats-usmca-impeachment,https://static.foxnews.com/foxnews.com/content/uploads/2019/12/TrumpPaRally121119.jpg,2019-12-11T09:39:59Z,"Good morning and welcome to Fox News First. Here's what you need to know as you start your Wednesday ...
Trump, at Pennsylvania rally, says 'stupid' impeachment indirectly led to USMCA dealPresident Trump told supporters at a rally in the key swing state of … [+4605 chars]",fox-news,Fox News
Fox News,This Day in History: Dec. 11,,https://www.foxnews.com/us/this-day-in-history-dec-11,https://media2.foxnews.com/BrightCove/694940094001/2019/04/08/694940094001_6023684898001_6023681934001-vs.jpg,2019-12-11T09:38:22Z,"On this day, Dec. 11…
1991: A jury in West Palm Beach, Fla., acquits William Kennedy Smith of sexual assault and battery, rejecting the allegations of Patricia Bowman, a woman Smith had met at a bar.
Also on this day:
<ul><li>1792: Frances King Louis XVI g… [+2552 chars]",fox-news,Fox News
Dom Calicchio,Family of New Orleans Saints fans hopes to recover deceased loved one’s lost jersey,"For every New Orleans Saints game her family has attended this year, Jennifer Harper has brought along her late son Bobby’s No. 9 Saints jersey and draped it over what was his seat inside the Mercedes-Benz Superdome. But last Sunday the jersey went missing.",https://www.foxnews.com/sports/family-of-new-orleans-saints-fans-hopes-to-recover-deceased-loved-ones-lost-jersey,https://static.foxnews.com/foxnews.com/content/uploads/2019/07/barry-superdome.jpg,2019-12-11T09:34:58Z,"For every New Orleans Saints game her family has attended this year, Jennifer Harper has brought along her late son Bobby’s No. 9 Saints jersey and draped it over what was his seat inside the Mercedes-Benz Superdome.
That’s because Bobby, who would have turn… [+2392 chars]",fox-news,Fox News
Leslie Marshall,Leslie Marshall: Democrats want to impeach Trump because they are patriots – not for political reasons,President Trump and his defenders claim the decision by House Democratic leaders Tuesday to propose two articles of impeachment against him is all about politics. They say the misconduct he is accused of is a hoax and that he is the victim of a witch hunt. Do…,https://www.foxnews.com/opinion/leslie-marshall-republicans-ignore-trumps-impeachable-conduct-acting-is-if-king-donald-is-above-the-law,https://media2.foxnews.com/BrightCove/694940094001/2019/12/10/694940094001_6114703096001_6114707086001-vs.jpg,2019-12-11T09:00:01Z,President Trump and his defenders claim the decision by House Democratic leaders Tuesday to propose two articles of impeachment against him is all about politics. They say the misconduct he is accused of is a hoax and that he is the victim of a witch hunt. Do… [+7784 chars],fox-news,Fox News
Danielle Wallace,CNN's Don Lemon blasts Trump-Thanos edit as 'juvenile meme game',"CNN host Don Lemon blasted the Trump campaign Tuesday for playing what he described as a “stupid, juvenile meme game” and effectively undermining the “seriousness of what is happening” after House Democrats announced they would file two articles of impeachmen…",https://www.foxnews.com/politics/trump-thanos-cnn-don-lemon-juvenile-meme-game-impeachment-articles,https://static.foxnews.com/foxnews.com/content/uploads/2019/12/don-lemon-trump-thanos.jpg,2019-12-11T08:44:00Z,"CNN host Don Lemon blasted the Trump campaign Tuesday for playing what he described as a “stupid, juvenile meme game” and effectively undermining the “seriousness of what is happening” after House Democrats announced they're filing two articles of impeachment… [+2711 chars]",fox-news,Fox News
Brie Stimson,"Jersey City mayor says kosher market shooting was 'targeted,' some frustrated with few details","Residents and the Jewish community in Jersey City are asking for clarification after the city's mayor tweeted late Tuesday that two gunmen ""targeted"" the kosher market where they killed three people earlier in the afternoon but did not elaborate.",https://www.foxnews.com/us/community-demands-elaboration-after-mayor-says-kosher-market-shooting-was-targeted-but-doesnt-say-if-it-was-hate-crime,https://static.foxnews.com/foxnews.com/content/uploads/2019/12/7ee11e63-AP19344838517401.jpg,2019-12-11T08:02:11Z,"Residents and the Jewish community in Jersey City are asking for clarification after the city's mayor tweeted late Tuesday that two gunmen ""targeted"" the kosher market where they killed three people earlier in the afternoon but did not elaborate.
A New Jerse… [+2670 chars]",fox-news,Fox News
Ryan Gaydos,French Olympic figure skater accused of sending penis photos to young girl: report,French Olympic figure skater Morgan Cipres is reportedly being investigated for alleged sexual abuse of a 13-year-old American female figure skater in 2017.,https://www.foxnews.com/sports/french-olympic-figure-skater-penis-photos-young-girl-report,https://static.foxnews.com/foxnews.com/content/uploads/2019/12/Morgan-Cipres-Reuters.jpg,2019-12-11T15:56:51Z,"French Olympic figure skater Morgan Cipres is reportedly being investigated for the alleged sexual abuse of a 13-year-old American female figure skater in 2017.
Cipres is accused of sending two photos of his penis to the girl who he met at an ice rink near T… [+2764 chars]",fox-news,Fox News
Andy Sahadeo,January Jones heats up Instagram with sultry pics,January Jones is taking Instagram by storm with a series of new steamy snaps.,https://www.foxnews.com/entertainment/january-jones-instagram-sultry-photos,https://static.foxnews.com/foxnews.com/content/uploads/2018/10/GettyImages-972975116.jpg,2019-12-11T15:53:21Z,"January Jones is taking Instagram by storm with a series of new steamy snaps.
The former “Last Man on Earth” actress, 41, uploaded several sultry shots ahead of the holidays. The seductive snaps depict Jones rocking a plunging, thin-strapped, red lace dress.… [+1330 chars]",fox-news,Fox News
Associated Press,"Harvey Weinstein's bail increased to $5 million, facing jail over allegedly mishandling ankle monitor",Harvey Weinstein’s bail was increased from $1 million to $5 million on Wednesday over allegations he violated bail conditions by mishandling his electronic ankle monitor.,https://www.foxnews.com/entertainment/harvey-weinsteins-bail-increased-facing-jail,https://media2.foxnews.com/BrightCove/694940094001/2019/05/24/694940094001_6040822580001_6040821964001-vs.jpg,2019-12-11T15:53:14Z,"Harvey Weinstein’s bail was increased from $1 million to $5 million on Wednesday over allegations he violated bail conditions by mishandling his electronic ankle monitor.
But Judge James Burke rejected prosecution calls to put the disgraced movie mogul in ja… [+3017 chars]",fox-news,Fox News
Paul Steinhauser,"Warren slips as Buttigieg, Biden, Sanders battle for lead in latest New Hampshire poll","A new poll in New Hampshire -- the state that holds the first primary in the race for the White House -- indicates an airtight contest among South Bend Mayor Pete Buttigieg, former Vice President Joe Biden, and Sen. Bernie Sanders of Vermont.",https://www.foxnews.com/politics/warren-buttigieg-biden-sanders-nh-poll,https://media2.foxnews.com/BrightCove/694940094001/2019/12/02/694940094001_6111046113001_6111047755001-vs.jpg,2019-12-11T15:51:01Z,"MANCHESTER, N.H. – A new poll in New Hampshire -- the state that holds the first primary in the race for the White House -- indicates an airtight contest among South Bend Mayor Pete Buttigieg, former Vice President Joe Biden, and Sen. Bernie Sanders of Vermon… [+4099 chars]",fox-news,Fox News
Julia Musto,Rick Perry makes bold prediction on forthcoming evidence of Ukraine election meddling,"Former Secretary of Energy Rick Perry said Wednesday that Senator Ted Cruz's, R-Texas, claims Ukraine meddled in the 2016 election would soon be corroborated.",https://www.foxnews.com/media/rick-perry-ted-cruz-ukraine-meddling-2016-election-prediction,https://static.foxnews.com/foxnews.com/content/uploads/2019/12/RICK-PERRY.jpg,2019-12-11T15:48:48Z,"Former Secretary of EnergyRick Perry said Wednesday that Senator Ted Cruz's, R-Texas, claims that Ukraine meddled in the 2016 election would soon be corroborated.
Appearing on ""Fox &amp; Friends"" with host Brian Kilmeade, Perry said that ""before all of this … [+2392 chars]",fox-news,Fox News
Melissa Roberto,Thanos creator says he feels 'violated' after Trump campaign releases 'Avengers' ad: 'These are sad and strange times',"The man behind the creation of ""Avengers: Endgame"" villain, Thanos, wants no one to mess with his catastrophic character --especially the president of the United States of America.",https://www.foxnews.com/entertainment/trump-campaign-avengers-video-thanos-creator-violated,https://static.foxnews.com/foxnews.com/content/uploads/2019/11/TrumpNavy112519.jpg,2019-12-11T15:48:04Z,"The man behind the creation of ""Avengers: Endgame"" villain Thanos wants no one to mess with his catastrophic character -- especially the president of the United States of America.
Jim Starlin created Thanos in the 1970s. On Tuesday, the comic book writer bla… [+1816 chars]",fox-news,Fox News
Greg Norman,"Manhunt underway for Texas cop killer after officer struck at traffic stop, police say",Police in Texas are on the hunt Wednesday for a suspect who allegedly struck and killed an officer with his vehicle while fleeing a traffic stop Tuesday night.,https://www.foxnews.com/us/texas-police-officer-hit-at-traffic-stop,https://static.foxnews.com/foxnews.com/content/uploads/2019/12/kaila-sullivan.jpg,2019-12-11T15:41:10Z,"Police in Texas are on the hunt Wednesday for a suspect who struck and killed an officer with his vehicle while fleeing a traffic stop Tuesday night.
The man, who police say likely still has one handcuff attached to his wrist, is accused of driving into 43-y… [+1458 chars]",fox-news,Fox News
Ryan Gaydos,"Stephen Strasburg playing mediator between Anthony Rendon, Nationals: report",Anthony Rendon is set to be the next big free agent to sign with a team.,https://www.foxnews.com/sports/stephen-strasburg-mediator-anthony-rendon-nationals-report,https://static.foxnews.com/foxnews.com/content/uploads/2018/09/092115-MLB-Washington-Nationals-Ant-8a23fa4634eef410VgnVCM100000d7c1a8c0____.jpg,2019-12-11T15:35:17Z,"Anthony Rendon is set to be the next big free agent to sign with a team.
Stephen Strasburg and Gerrit Cole both locked up deals this week, and now it will be the slugging third baseman's turn to figure out where he is going to play baseball in 2020 and beyon… [+2289 chars]",fox-news,Fox News
Janine Puhak,"Iowa hunting party shoots house, fellow hunter during opening weekend excursion",Talk about a poor shot.,https://www.foxnews.com/great-outdoors/iowa-hunter-party-shoots,https://static.foxnews.com/foxnews.com/content/uploads/2019/12/iStock-Hunting.jpg,2019-12-11T15:29:22Z,"Talk about a poor shot.
One ill-fated hunting excursion in Iowa ended in property damage and a trip to the hospital after one member of the hunting party was shot in the leg.
SEE IT: MISSOURI HUNTER BAGS RARE ALBINO DEER: 'ALL GLORY GOES TO GOD IN THIS'
On… [+1484 chars]",fox-news,Fox News
Michael Bartiromo,Alaska Airlines celebrating 'National Ugly Sweater Day' with priority boarding for anyone in festive top,"The airline is offering the perk to anyone who shows up in ""any kind of holiday sweater.""",https://www.foxnews.com/travel/alaska-airlines-national-ugly-sweater-day-priority-boarding,https://static.foxnews.com/foxnews.com/content/uploads/2019/12/UglySweatersIstock.jpg,2019-12-11T15:29:11Z,"Finally, an honest-to-goodness reason to wear one of your many ugly Christmas sweaters.
Alaska Airlines announced Tuesday the return of its “National Ugly Sweater Day” promotion, which awards any travelers wearing “ugly” holiday sweaters with free priority b… [+1895 chars]",fox-news,Fox News
Chris Ciaccia,"Mysterious, 4000-year-old stone-carved objects that 'look remarkably like' humans found","Researchers have discovered nine stone-carved objects off the coast of Scotland that are believed to be around 4,000-years-old. Some of them ""look remarkably like stylized representations of the human form,"" puzzling the experts.",https://www.foxnews.com/science/mysterious-4000-year-old-stone-carved-objects-that-look-remarkably-like-humans-found,https://static.foxnews.com/foxnews.com/content/uploads/2019/12/orkney-figurine-1.jpg,2019-12-11T15:26:39Z,"Researchers have discovered nine stone-carved objects off the coast of Scotland that are believed to be around 4,000-years-old. Some of them ""look remarkably like stylized representations of the human form,"" puzzling the experts.
The objects were found on th… [+2418 chars]",fox-news,Fox News
Gary Gastelu,Leaked photos of 2021 Cadillac Escalade hit the Internet,New look for the big SUV.,https://www.foxnews.com/auto/leak-2021-cadillac-escalade,https://static.foxnews.com/foxnews.com/content/uploads/2019/12/cadillac-leak.jpg,2019-12-11T15:26:28Z,"The 2021 ChevroletTahoe and Suburban were just revealed on Tuesday night, but leaked photos of the all-new Cadillac Escalade they will spawn in a few weeks have already hit the Internet.
The grainy images posted to the @allcarnews Instagram on Wednesday appe… [+1463 chars]",fox-news,Fox News
Andrew McCarthy,"Andrew McCarthy: The FBI, the IG Report, and Attorney General Barr – Separating fact from fiction",There are many things to be said about the 476-page FISA abuse report filed by Justice Department Inspector General Michael Horowitz – too many to say in a single column. So we’ll try to take them in small bites.,https://www.foxnews.com/opinion/fbi-ig-report-attorney-general-barr-andrew-mccarthy,https://media2.foxnews.com/BrightCove/694940094001/2019/12/11/694940094001_6114905426001_6114904926001-vs.jpg,2019-12-11T15:24:43Z,There are many things to be said about the 476-page FISA abuse report filed by Justice Department Inspector General Michael Horowitz – too many to say in a single column. So we’ll try to take them in small bites. Let’s start with an IG’s finding that the FBI’… [+4600 chars],fox-news,Fox News
Ryan Gaydos,"Didi Gregorius, Philadelphia Phillies agree to one-year deal: reports",Didi Gregorius and the Philadelphia Phillies agreed to a one-year deal Tuesday.,https://www.foxnews.com/sports/didi-gregorius-phillies-deal-reports,https://static.foxnews.com/foxnews.com/content/uploads/2019/12/Didi-Gregorius.jpg,2019-12-11T15:22:11Z,"Didi Gregorius and the Philadelphia Phillies agreed to a one-year deal Tuesday.
The deal between the free-agent shortstop and the Phillies was worth $14 million, according to multiple reports. The New York Post first reported the two sides were in agreement … [+1494 chars]",fox-news,Fox News
Michael Hollan,Former Papa John's CEO criticized by Shaq: 'Sometimes people don’t know when to keep their mouths shut',"He might not be great with free-throws, but Shaq still knows a good pizza when he eats one.",https://www.foxnews.com/food-drink/papa-johns-pizza-shaq-response-claims,https://static.foxnews.com/foxnews.com/content/uploads/2019/12/Shaq-Schnatter-split.jpg,2019-12-11T15:18:14Z,"He might not be great with free-throws, but Shaq still knows a good pizza when he eats one.
The basketball-star-turned-entrepreneur (and current Papa John's board member) recently responded to claims that the company had changed its pizza recipe. Last month,… [+1986 chars]",fox-news,Fox News
Alexandria Hein,Woman with dementia stuns with rendition of Sinatra's 'My Way',The touching memory was captured on camera by the woman's daughter.,https://www.foxnews.com/health/woman-dementia-sinatra-my-way,https://static.foxnews.com/foxnews.com/content/uploads/2019/12/add-memory-lane-451601-1.jpg,2019-12-11T15:14:21Z,"A woman with dementia who has been at an assisted living facility in Scotland since last year stunned staff and her family members when she got up and sang along to Frank Sinatra’s “My Way” during a Christmas party.
EXPERIMENTAL ALZHEIMER'S DRUG LEAVES SCIEN… [+1573 chars]",fox-news,Fox News
Matt London,James Comey will go down as most corrupt FBI director ever: Expert panel on FISA report,Fox News legal and political analyst Gregg Jarrett asked a panel of defense lawyers and former federal prosecutors how ex-FBI Director James Comey will be remembered by history in the wake of the Justice Department Inspector General's report on the FBI invest…,https://www.foxnews.com/media/james-comey-corrupt-fbi-director-horowitz-fisa,https://static.foxnews.com/foxnews.com/content/uploads/2019/08/james-Comey.jpg,2019-12-11T15:08:26Z,"CELEBRATING ONE YEAR OF FOX NATION -- FOR A LIMITED TIME, SIGN UP AND GET 35% OFF WITH PROMO CODE: CELEBRATE
Fox News legal and political analyst GreggJarrett asked a panel of defense lawyers and former federal prosecutors how ex-FBI Director James Comey wil… [+3975 chars]",fox-news,Fox News
Fox News,READ: DOJ IG Horowitz statement to Senate Judiciary Committee on Russia probe report,DOJ IG Michael Horowitz's prepared opening statement to the Senate Judiciary Committee.,https://www.foxnews.com/politics/read-doj-ig-horowitz-statement-to-senate-judiciary-committee-on-russia-probe-report,https://media2.foxnews.com/BrightCove/694940094001/2019/12/11/694940094001_6114757438001_6114759401001-vs.jpg,2019-12-11T15:05:15Z,"This material may not be published, broadcast, rewritten,
 or redistributed. ©2019 FOX News Network, LLC. All rights reserved.
 All market data delayed 20 minutes.",fox-news,Fox News
Brooke Singman,IG Horowitz rips 'failure' of entire 'chain of command' in FBI's Trump-Russia probe,"Justice Department Inspector General Michael Horowitz on Wednesday decried what he called “failure” by the entire “chain of command” involved in the FBI’s initial Trump-Russia investigation, saying in prepared testimony that they made “so many basic and funda…",https://www.foxnews.com/politics/horowitz-testifies,https://media2.foxnews.com/BrightCove/694940094001/2019/12/11/694940094001_6114757438001_6114759401001-vs.jpg,2019-12-11T14:51:59Z,"Justice Department Inspector General Michael Horowitz on Wednesday decried what he called “failure” by the entire “chain of command” involved in the FBI’s initial Trump-Russia investigation, saying in prepared testimony that they made “so many basic and funda… [+4960 chars]",fox-news,Fox News
Alexandria Hein,Toddlers with unexplained bruising had 'pork tapeworm' larvae in body,"The pair developed bruising in early October, but it wasn't until the girl developed a cough that her mother suspected something might be wrong.",https://www.foxnews.com/health/toddlers-unexplained-bruising-pork-tapeworm-larvae-body,https://static.foxnews.com/foxnews.com/content/uploads/2019/12/9484ff8a-parasite-infection1.jpg,2019-12-11T14:45:08Z,"Doctors discovered that two toddlers in China with unexplained bruising on their limbs were actually suffering from a parasite infection typically caused by consuming undercooked pork.
The 3-year-old boy and his 1-year-old sister, who reportedly first showed… [+1695 chars]",fox-news,Fox News
Joshua Nelson,Campus-Duffy scorches California Democrat for bringing up a second impeachment if Trump wins in 2020,"Fox Nation host Rachel Campos-Duffy scorched House Democrats on Wednesday after Rep. Karen Bass, D-Calif., said that she was open to impeaching President Trump again if he wins the re-election in 2020.",https://www.foxnews.com/media/rachel-campus-duffy-scorches-rep-karen-bass-for-being-open-to-impeachment-again-if-president-trump-wins-re-election,https://static.foxnews.com/foxnews.com/content/uploads/2019/12/Screen-Shot-2019-12-11-at-9.15.32-AM.png,2019-12-11T14:43:21Z,"Fox Nation host Rachel Campos-Duffy scorched House Democrats on Wednesday after Rep. Karen Bass, D-Calif., said that she was open to impeaching President Trump again if he wins the re-election in 2020.
“It just underscores what we have always known, that the… [+2149 chars]",fox-news,Fox News
Nicole Darrah,"Jersey City shooting suspect published anti-Semitic posts online, report claims; officials say kosher market 'targeted'","The shooting that unfolded at a kosher market in Jersey City, N.J., was a ""targeted"" attack, according to officials who say at least one of the suspects had published anti-Semitic and anti-police posts online before opening fire Tuesday.",https://www.foxnews.com/us/jersey-city-shooting-targeted-attack,https://media2.foxnews.com/BrightCove/694940094001/2019/12/11/694940094001_6114918446001_6114921024001-vs.jpg,2019-12-11T14:43:04Z,"The shooting that unfolded at a kosher market in Jersey City, N.J., was a ""targeted"" attack, according to officials who say at least one of the suspects had published anti-Semitic and anti-police posts online before opening fire Tuesday.
Mayor Steven Fulop w… [+956 chars]",fox-news,Fox News
Madeline Farber,"UK sees first bird flu outbreak since 2017; 27,000 chickens to be culled: officials","The bird flu has been detected at a commercial chicken farm in the United Kingdom, officials announced this week. The outbreak is the first in the country since 2017.",https://www.foxnews.com/health/uk-bird-flu-outbreak-2019,https://static.foxnews.com/foxnews.com/content/uploads/2019/12/chickens-iStock.jpg,2019-12-11T14:40:59Z,"The bird flu has been detected at a commercial chicken farm in the United Kingdom, officials announced this week. The outbreak is the first in the country since 2017.
In a Tuesday statement, the Department for Environment, Food &amp; Rural Affairs said that … [+1280 chars]",fox-news,Fox News
Michael Bartiromo,"Frontier Airlines pilots, flight attendants allege discrimination against pregnant or lactating employees",Frontier Airlines employees claimed they “found themselves faced with mounting obstacles once they became pregnant that forced them to make impossible choices between their families and their livelihood.”,https://www.foxnews.com/travel/frontier-airlines-pilots-flight-attendants-discrimination-against-pregnant-or-lactating-employees,https://static.foxnews.com/foxnews.com/content/uploads/2019/12/FrontierIstock.jpg,2019-12-11T14:38:14Z,"Frontier Airlines is denying allegations that the company has made it difficult for pregnant or breastfeeding employees to continue working, as well as allegations that the airline offered inadequate leave for staffers following childbirth.
The company’s sta… [+2717 chars]",fox-news,Fox News
Talia Kaplan,Charles Hurt: Moderate Dems pushing censure instead of impeachment will get 'squashed like a bug',Fox News contributor Charles Hurt said Wednesday that he suspects that the moderate Democrats who are pushing the idea of censuring President Trump instead of impeachment will get “squashed line a bug.”,https://www.foxnews.com/media/charles-hurt-moderate-dems-push-censure-instead-of-impeachment,https://static.foxnews.com/foxnews.com/content/uploads/2019/12/Charles-Hurt.jpg,2019-12-11T14:38:00Z,"Fox News contributor Charles Hurt said Wednesday that he suspects that the moderate Democrats who are pushing the idea of censure for President Trump instead of impeachment will get “squashed like a bug.” 
Hurt, the opinion editor of The Washington Times, ma… [+2101 chars]",fox-news,Fox News
Melissa Roberto,Aaron Carter accused of racism after imitating Chinese accent while ordering food,Aaron Carter is being accused of racism after posting a video where he spoke in a Chinese accent weeks after declaring he was taking a social media break.,https://www.foxnews.com/entertainment/aaron-carter-accused-racism-imitating-chinese-accent,https://static.foxnews.com/foxnews.com/content/uploads/2019/02/aaron-carter.jpg,2019-12-11T14:36:24Z,"Aaron Carter is being accused of racism after posting a video where he spoke in a Chinese accent weeks after declaring he was taking a social media break.
The singer, 32, posted a video to his Instagram account this week claiming to show his ""cultural status… [+2102 chars]",fox-news,Fox News
Caleb Parke,"Pastors, worship leaders pray for Trump in Oval Office amid impeachment fight","Prominent Christian pastors and worship leaders prayed over President Trump in the Oval Office last week, as he told them he needs prayer now more than ever amid the intensifying impeachment probe on Capitol Hill.",https://www.foxnews.com/politics/pastors-worship-leaders-pray-for-trump-in-oval-office-amid-impeachment-fight,https://static.foxnews.com/foxnews.com/content/uploads/2019/12/Trumpworshipleaderscloseup.jpg,2019-12-11T14:34:24Z,"Prominent Christian pastors and worship leaders prayed over President Trump in the Oval Office last week, as he told them he needs prayer now more than ever amid the intensifying impeachment probe on Capitol Hill.
About 50 worship leaders from across America… [+4283 chars]",fox-news,Fox News
Andy Sahadeo,'Friends' creator said show almost had different ending for main character,"Phoebe’s romantic fate was unclear for a long time, “Friends” co-creator David Crane revealed.",https://www.foxnews.com/entertainment/friends-creator-different-ending-main-character,https://static.foxnews.com/foxnews.com/content/uploads/2018/12/friends-cast-getty.jpg,2019-12-11T14:32:40Z,"Phoebe’s romantic fate was unclear for a long time, “Friends” co-creator David Crane revealed.
In the popular sitcom, David, played by Hank Azaria, initially falls in love with Phoebe, portrayed by Lisa Kudrow. Eventually, Azaria’s character was written out … [+1659 chars]",fox-news,Fox News
