author,title,description,url,urlToImage,publishedAt,content,source.id,source.name
Associated Press,New Jersey proposes bald eagle's removal from endangered species list following big rebound,"New Jersey officials on Monday proposed removing the bald eagle from the state's endangered species list, citing successful, decades-long conservation efforts.",https://www.foxnews.com/us/new-jersey-proposes-bald-eagles-removal-endangered-species-list-big-rebound,https://static.foxnews.com/foxnews.com/content/uploads/2022/09/GettyImages-1385022815.jpg,2024-06-03T19:35:57Z,"New Jersey proposed Monday removing the bald eagle from its endangered species list, citing a rebound since more than four decades ago, when a single nesting pair in a remote county were the only of … [+1990 chars]",fox-news,Fox News
Tracy Wright,Hallmark actress 'opened her eyes' after surviving 5-story hospital balcony fall: ‘Body has been shattered’,"Mamie Laverock, 19, allegedly fell from a balcony at a Vancouver hospital and was on life support after initially suffering a medical emergency in May.",https://www.foxnews.com/entertainment/hallmark-actress-opened-eyes-surviving-5-story-hospital-balcony-fall-body-shattered,https://static.foxnews.com/foxnews.com/content/uploads/2024/05/mamie-laverock-actress.jpg,2024-06-03T19:28:35Z,"Join Fox News for access to this content
Plus special access to select articles and other premium content with your account - free of charge.
By entering your email and pushing continue, you are ag… [+4179 chars]",fox-news,Fox News
Associated Press,"Fraud trial juror claims she received $120K payment, was promised more if she voted to acquit","A Minnesota juror was dismissed Monday after reporting $120,000 was left at her home with a promise of further payment if she voted to acquit seven suspects in a massive fraud case.",https://www.foxnews.com/us/fraud-trial-juror-claims-received-120k-payment-promised-more-voted-acquit,https://static.foxnews.com/foxnews.com/content/uploads/2022/06/ALL_CUSTOM_FS_LOCAL_NEWS_MN_CRIME.png,2024-06-03T19:27:43Z,"A juror was dismissed Monday after reporting that a woman dropped a bag of $120,000 in cash at her home and offered her more money if she would vote to acquit seven people charged with stealing more … [+2080 chars]",fox-news,Fox News
Associated Press,2 brothers charged in Atlanta-area strip club shooting,"Trayvis Thurman, 23, is being charged alongside his 21-year-old brother, Trayquan, in a Sunday shooting at the Pin Ups strip club in Decatur, Georgia.",https://www.foxnews.com/us/2-brothers-charged-atlanta-area-strip-club-shooting,https://static.foxnews.com/foxnews.com/content/uploads/2022/06/ALL_CUSTOM_FS_LOCAL_NEWS_GA_CRIME.png,2024-06-03T19:21:37Z,"Two men face charges in a weekend shooting that left multiple people injured at a strip club in Georgia's DeKalb County.
The shooting happened early Sunday at Pin Ups in Decatur. Police told WAGA-TV… [+1165 chars]",fox-news,Fox News
Ryan Gaydos,Giants' Darren Waller drops some bars as team reportedly expects him to retire,New York Giants tight end Darren Waller released a new rap as a report surfaced indicating the team was expecting him to retire from the league.,https://www.foxnews.com/sports/giants-darren-waller-drops-some-bars-team-reportedly-expects-him-retire,https://static.foxnews.com/foxnews.com/content/uploads/2024/06/Darren-Waller2.jpg,2024-06-03T19:16:42Z,"New York Giants tight end Darren Waller decided to drop a few bars after a report said Monday he will be telling the team soon he will retire from the NFL
Waller, who recently released a music video… [+1527 chars]",fox-news,Fox News
Pilar Arias,Prosecutors drop charges against Minnesota trooper in deadly shooting of motorist Ricky Cobb,Nearly one year after the shooting death of Black motorist Ricky Cobb II the Hennepin County Attorney held a press conference to discuss why a criminal case was being dropped.,https://www.foxnews.com/us/prosecutors-drop-charges-minnesota-trooper-show-deadly-shooting-motorist-ricky-cobb,https://static.foxnews.com/foxnews.com/content/uploads/2024/06/Trooper-Ryan-Londregan.jpg,2024-06-03T19:02:59Z,"A Minnesota county attorney has decided to drop a case against a state trooper accused in the fatal shooting of Black motorist Ricky Cobb II.
Hennepin County Attorney Mary Moriarty announced the dec… [+3138 chars]",fox-news,Fox News
Elizabeth Heckman,Biden admin criticized over reports of 'amnesty' for asylum-seekers: 'They know exactly what they're doing',Former acting ICE Director Tom Homan and former Arizona Border Patrol agent Chris Clem reacted to Biden's plan to announce an executive order on the border crisis.,https://www.foxnews.com/media/biden-admin-criticized-reports-amnesty-asylum-seekers-know-exactly-theyre-doing,https://static.foxnews.com/foxnews.com/content/uploads/2024/03/Border-breach-El-Paso-Texas_04.jpg,2024-06-03T19:00:30Z,Former officials warned Monday the Biden administration is making the border crisis worse after reports that hundreds of thousands of migrants will be allowed to remain in the U.S. with what amounts … [+4173 chars],fox-news,Fox News
Brooke Singman,Rep Jordan urges Congress to 'defund lawfare activities' of Trump prosecutors,"EXCLUSIVE: House Judiciary Committee Chairman Jim Jordan is proposing an appropriations package that would “defund the lawfare activities"" of state and federal prosecutors leading “politically sensitive investigations.""",https://www.foxnews.com/politics/rep-jordan-urges-congress-defund-lawfare-activities-trump-prosecutors,https://static.foxnews.com/foxnews.com/content/uploads/2023/10/AP23286052379973-e1697476535254.jpg,2024-06-03T18:56:46Z,"EXCLUSIVE: House Judiciary Committee Chairman Jim Jordan told Fox News Digital he is proposing an appropriations package that would ""defund the lawfare activities"" of state and federal prosecutors le… [+6340 chars]",fox-news,Fox News
Emily Trainham,Nina Dobrev says 'life looks a lil different' since being hospitalized after bike accident,Actress Nina Dobrev provided an update on her health after revealing that she'd been in a bike accident last month.,https://www.foxnews.com/entertainment/nina-dobrev-says-life-looks-lil-different-since-being-hospitalized-after-bike-accident,https://static.foxnews.com/foxnews.com/content/uploads/2024/06/nina-dobrev.jpg,2024-06-03T18:45:59Z,"Nina Dobrev is going through a difficult time.
The actress revealed last month that she'd been in a bicycle accident, one that injured her leg, and now she's sharing photos documenting it all, showi… [+3233 chars]",fox-news,Fox News
Ashlyn Messier,California and Texas top list of most dog attacks on US mail carriers in 2023,"In 2023, there were over 5,800 cases of dog biting incidents regarding Postal Service workers. California and Texas were the states where most incidents occurred.",https://www.foxnews.com/lifestyle/california-texas-top-list-most-dog-attacks-us-mail-carriers-2023,https://static.foxnews.com/foxnews.com/content/uploads/2024/06/postal-carrier-beware-dog-sign.jpg,2024-06-03T18:36:47Z,"In honor of the U.S. Postal Service (USPS) 2024 National Dog Bite Awareness Campaign, the organization released yearly numbers regarding dogs attacking postal workers. 
In 2023, there were over 5,80… [+2668 chars]",fox-news,Fox News
Greg Norman,"Former Brexit leader Nigel Farage is running in UK election, wants to ‘make Britain great again’","Former Brexit Party leader Nigel Farage is running in the upcoming July U.K. general election, saying that immigration is the ""major issue of our times.""",https://www.foxnews.com/world/former-brexit-leader-nigel-farage-running-uk-election-wants-make-britain-great-again,https://static.foxnews.com/foxnews.com/content/uploads/2024/06/Nigel-Farage.jpg,2024-06-03T18:34:07Z,"Former Brexit Party leader Nigel Farage announced Monday that he is running in this years upcoming United Kingdom general election, vowing to ""make Britain great again."" 
The decision from Farage co… [+2062 chars]",fox-news,Fox News
Adam Shaw,First on Fox: How the migrant crisis overwhelmed DC public schools,New emails are revealing the extent to the strain placed on schools by the ongoing migrant crisis at the southern border after more migrants headed to the nation's capital.,https://www.foxnews.com/politics/very-challenging-strain-migrant-crisis-dc-public-schools-revealed-new-emails,https://static.foxnews.com/foxnews.com/content/uploads/2024/06/migrants-dc.jpg,2024-06-03T18:26:33Z,"Join Fox News for access to this content
Plus special access to select articles and other premium content with your account - free of charge.
By entering your email and pushing continue, you are ag… [+5157 chars]",fox-news,Fox News
Michael Ruiz,"Lyle Menendez, who shotgunned parents to death with brother, plans for life after prison amid new appeal",Convicted killer Lyle Menendez reveals his plans for freedom in jailhouse call to packed auditorium despite a life sentence for the murder of his parents.,https://www.foxnews.com/us/lyle-menendez-who-shotgunned-parents-death-brother-plans-life-after-prison-amid-new-appeal,https://static.foxnews.com/foxnews.com/content/uploads/2024/06/GettyImages-539886710-scaled-e1717434182742.jpg,2024-06-03T18:25:21Z,"Join Fox News for access to this content
Plus special access to select articles and other premium content with your account - free of charge.
By entering your email and pushing continue, you are ag… [+4302 chars]",fox-news,Fox News
Jeffrey Clark,"Journalists, commentators respond as Trump joins TikTok, rapidly gains 10x more followers than Biden","Journalists and commentators responded to former President Trump's surprise decision to create a TikTok account, which quickly eclipsed President Biden's presence on the platform.",https://www.foxnews.com/media/journalists-commentators-respond-trump-joins-tiktok-rapidly-gains-10x-more-followers-biden,https://static.foxnews.com/foxnews.com/content/uploads/2024/06/Trump_TikTok_Biden-new.png,2024-06-03T18:23:58Z,"Journalists and commentators responded to former President Trump's surprise decision to create a TikTok account, quickly eclipsing President Biden's presence on the platform. 
""Donald Trump joining … [+2010 chars]",fox-news,Fox News
Ryan Gaydos,Outgoing Coastal Carolina baseball coach rips NIL system: 'Professional sports would go in the toilet',Coastal Carolina baseball head coach Gary Gilmore ripped the NIL system in college athletics and said if pro sports adopted the same rules they would be destroyed.,https://www.foxnews.com/sports/outgoing-coastal-carolina-baseball-coach-rips-nil-system-professional-sports-would-go-toilet,https://static.foxnews.com/foxnews.com/content/uploads/2024/06/Gary-Gilmore.jpg,2024-06-03T18:18:26Z,"The Coastal Carolina Chanticleers baseball season came to an end on Sunday with a 6-5 loss to the High Point Panthers in the Clemson Regional of the NCAA Tournament. 
It also marked the end of a leg… [+2919 chars]",fox-news,Fox News
Hanna Panreck,ABC's Stephanopoulos issues another election warning after Trump verdict: 'Ultimate stress test',ABC's George Stephanopoulos issued another warning about the 2024 election on Sunday after presumptive GOP nominee Donald Trump was handed a guilty verdict in Manhattan.,https://www.foxnews.com/media/abcs-stephanopoulos-issues-another-election-warning-after-trump-verdict-ultimate-stress-test,https://static.foxnews.com/foxnews.com/content/uploads/2024/06/GEORGE-STEPHANOPOULOS-TRUMP-VERDICT-ELECTION.jpg,2024-06-03T18:11:32Z,"ABC News host George Stephanopoulos issued another warning on Sunday about the 2024 presidential election and asked his viewers if they really wanted to be led by a convicted felon, former President … [+3160 chars]",fox-news,Fox News
Brandon Gillespie,"RFK, Jr.’s past support for higher gas prices & electric cars surfaces, old interviews show","Robert F. Kennedy, Jr. previously expressed support on a number of occasions for consumers to pay higher gas prices in order to force a market shift toward electric vehicles.",https://www.foxnews.com/politics/rfk-jr-past-support-higher-gas-prices-consumers-boost-electric-cars-resurfaces,https://static.foxnews.com/foxnews.com/content/uploads/2024/06/Kennedy-gas.jpg,2024-06-03T21:51:06Z,"Join Fox News for access to this content
Plus special access to select articles and other premium content with your account - free of charge.
By entering your email and pushing continue, you are ag… [+5121 chars]",fox-news,Fox News
Gabriele Regalbuto,Viral TikTok video of red-spotted dog has fans flipping out over what her colorful spots mean,"Rosie, a border collie mix from Pennsylvania, went viral on TikTok for her adorable red spots. Fans are hopeful she isn't sick and that she is just adorably spotted with dog-safe ink.",https://www.foxnews.com/lifestyle/viral-tiktok-video-red-spotted-dog-has-fans-flipping-out-over-what-her-colorful-spots-mean,https://static.foxnews.com/foxnews.com/content/uploads/2024/06/rosie.jpg,2024-06-03T21:34:00Z,"An adorable video of a black and white border collie mix with red spots recently went viral on TikTok, and fans of the pup are acutely concerned over the reason for her colorful specks.
Though the v… [+3277 chars]",fox-news,Fox News
Paul Steinhauser,Trump verdict fires up the donor class leading to massive May fundraising haul,"Former President Donald Trump announces his May fundraising, following a massive post-criminal trial verdict haul, as he battles President Biden in their 2024 election rematch",https://www.foxnews.com/politics/trump-announces-may-fundraising-following-massive-post-verdict-haul,https://static.foxnews.com/foxnews.com/content/uploads/2024/05/Donald-Trump-Guilty_07.jpg,2024-06-03T21:33:33Z,"Join Fox News for access to this content
You have reached your maximum number of articles. Log in or create an account FREE of charge to continue reading.
By entering your email and pushing continu… [+3335 chars]",fox-news,Fox News
Lauryn Overhultz,Shania Twain laughs off on-stage blunder,Shania Twain laughed at herself after she seemingly forgot which hand her microphone was in during her Las Vegas residency. The musician shared video of the moment on social media.,https://www.foxnews.com/entertainment/shania-twain-laughs-off-on-stage-blunder,https://static.foxnews.com/foxnews.com/content/uploads/2024/06/Shania_Twain_laughs.jpg,2024-06-03T21:26:06Z,"Shania Twain laughed off a simple mistake made on-stage during her Las Vegas residency.
The 58-year-old country music star seemingly forgot which hand she was holding her microphone in while singing… [+1701 chars]",fox-news,Fox News
Sydney Borchers,Rare snake-like fish that breathes air caught in Missouri for fourth time: 'Aggressive predators',"A rare, snake-like fish that is able to breathe air and slither across the ground has been caught in Missouri. Officials advise calling authorities if you come across this species.",https://www.foxnews.com/lifestyle/rare-snake-like-fish-breathes-air-caught-missouri-fourth-time-aggressive-predators,https://static.foxnews.com/foxnews.com/content/uploads/2024/06/northern-snakehead-fish-in-missouri-split.jpg,2024-06-03T21:14:11Z,"Is it a fish? Is it a snake? No, it's a snakehead fish.
For only the fourth time in the state of Missouri, an angler caught a northern snakehead fish that is not native to the U.S.
Fisheries biolog… [+2722 chars]",fox-news,Fox News
Andrea Vacchiano,"Tourist defaces Ancient Roman wall on vacation, angering Italian authorities",A 27-year-old man from the Netherlands got into hot water with Italian authorities after he allegedly wrote his graffiti signature on an ancient wall in Herculaneum.,https://www.foxnews.com/world/tourist-defaces-ancient-roman-wall-vacation-angering-italian-authorities,https://static.foxnews.com/foxnews.com/content/uploads/2024/06/ITALY-VANDAL-1.png,2024-06-03T21:07:20Z,"A young man from the Netherlands was reprimanded by Italian police after he allegedly vandalized a historic Roman wall while on holiday.
The incident took place in Herculaneum, an Ancient Roman town… [+1940 chars]",fox-news,Fox News
Janelle Ash,'Star Trek' actor Zachary Quinto blasted for being rude to restaurant staff: 'Made our host cry',"Toronto restaurant Manita on Ossington Ave took to social media on Sunday to slam ""Star Trek"" actor Zachary Quinto for acting like ""an entitled child"" while dining in their establishment.",https://www.foxnews.com/entertainment/star-trek-actor-zachary-quinto-blasted-being-rude-restaurant-staff-made-host-cry,https://static.foxnews.com/foxnews.com/content/uploads/2024/06/zachary-quinto.jpg,2024-06-03T20:50:48Z,"""Star Trek"" actor Zachary Quinto was called out for his behavior at a Toronto restaurant over the weekend.
Manita on Ossington Ave took to Instagram on Sunday to call the star an ""entitled child"" wh… [+1992 chars]",fox-news,Fox News
Scott Thompson,"Stephen A Smith, Monica McNutt get into heated argument about media's WNBA coverage on ESPN's 'First Take'","Stephen A. Smith and Monica McNutt got into it on ESPN's ""First Take"" on Monday morning, as the latter called out the former's coverage of the WNBA.",https://www.foxnews.com/sports/stephen-smith-monica-mcnutt-get-heated-argument-about-medias-wnba-coverage-espns-first-take,https://static.foxnews.com/foxnews.com/content/uploads/2024/06/Stephen-A-Smith-Monica-McNutt.png,2024-06-03T20:48:47Z,"The WNBA was top of mind for many sports shows on Monday morning after a wild weekend for Caitlin Clark and the Indiana Fever, and things got pretty testy on ESPNs ""First Take"" because of it. 
Steph… [+3896 chars]",fox-news,Fox News
Louis Casiano,"Underwater explorer diving on 'newly found shipwreck' discovered dead in Lake Erie, authorities say","An Ohio man suffered a fatal diving accident while diving on a ""newly found shipwreck"" in Lake Erie. David VanZandt's body was recovered by authorities on Saturday.",https://www.foxnews.com/us/underwater-explorer-diving-newly-found-shipwreck-discovered-dead-lake-erie-authorities-say,https://static.foxnews.com/foxnews.com/content/uploads/2024/06/cleveland_lake_erie_2.jpg,2024-06-03T20:34:26Z,"The 70-year-old founder of an underwater explorer nonprofit that documents shipwrecks in Lake Erie and the other Great Lakes died over the weekend while making a trip below the surface.
The Cuyahoga… [+1315 chars]",fox-news,Fox News
Bradford Betz,IDF confirms deaths of 4 Israeli hostages in Hamas captivity,"Four Israeli hostages have died while in Hamas captivity, the Israel Defense Forces (IDF) confirmed Monday after obtaining new intelligence.",https://www.foxnews.com/world/idf-confirms-deaths-4-israeli-hostages-hamas-captivity,https://static.foxnews.com/foxnews.com/content/uploads/2024/06/israelhostages-1.jpg,2024-06-03T20:32:27Z,"Four Israeli hostages have died while in Hamas captivity, the Israel Defense Forces (IDF) confirmed Monday after obtaining new intelligence. 
The kibbutz Nir Oz said earlier Monday that three of the… [+3422 chars]",fox-news,Fox News
Lauryn Overhultz,"Brad Pitt, Angelina Jolie's daughter hired own lawyer to drop actor's last name: source","Brad Pitt and Angelina Jolie's daughter hired a lawyer on her own to remove Pitt from her legal last name. Shiloh Jolie-Pitt is paying for it herself, a source told Fox News Digital.",https://www.foxnews.com/entertainment/brad-pitt-angelina-jolies-daughter-hired-own-lawyer-drop-actors-last-name-source,https://static.foxnews.com/foxnews.com/content/uploads/2024/06/Shiloh_Angelina_Jolie_Brad_Pitt.jpg,2024-06-03T20:28:46Z,"Join Fox News for access to this content
Plus special access to select articles and other premium content with your account - free of charge.
By entering your email and pushing continue, you are ag… [+4144 chars]",fox-news,Fox News
Hanna Panreck,'The View' co-host explodes on Marco Rubio over Trump trial comparison to Cuba: 'How dare you!',"Ana Navarro slammed Sen. Marco Rubio, R-Fla., on Monday during ""The View"" after he compared Donald Trump's trial to the show trials in Cuba after Fidel Castro took over.",https://www.foxnews.com/media/the-view-co-host-explodes-sen-marco-rubio-over-trump-trial-comparison-cuba-how-dare-you,https://static.foxnews.com/foxnews.com/content/uploads/2024/06/ANA-NAVARRO-MARCO-RUBIO-THE-VIEW.jpg,2024-06-03T20:09:34Z,"Join Fox News for access to this content
Plus special access to select articles and other premium content with your account - free of charge.
By entering your email and pushing continue, you are ag… [+2844 chars]",fox-news,Fox News
Melissa Rudy,"Mediterranean diet could help women live longer, Harvard study finds","In a long-running Harvard study published in JAMA Network Open, women who adhered to the Mediterranean diet were found to have a 23% lower risk of death from any cause.",https://www.foxnews.com/health/mediterranean-diet-could-help-women-live-longer-harvard-study-finds,https://static.foxnews.com/foxnews.com/content/uploads/2024/06/woman-eating-seafood.jpg,2024-06-03T20:05:16Z,"The Mediterranean diet
 has long been linked to a bevy of health benefits, including reduced risk of heart disease, cancer, obesity and more and now a new study has revealed a very specific new adva… [+5695 chars]",fox-news,Fox News
Associated Press,Makeshift memorial to Baltimore bridge collapse victims vandalized,An elaborate memorial to the six victims of the Francis Scott Key Bridge collapse in Baltimore was reportedly vandalized over the weekend.,https://www.foxnews.com/us/makeshift-memorial-baltimore-bridge-collapse-victims-vandalized,https://static.foxnews.com/foxnews.com/content/uploads/2024/06/key_bridge_memorial_vandalized.jpg,2024-06-03T23:57:07Z,"A memorial for the six victims of the Francis Scott Key Bridge collapse in Baltimore was vandalized over the weekend.
The elaborate display near the south end of the bridge has grown to include deco… [+1958 chars]",fox-news,Fox News
Lori Bashian,"Kevin Costner 'never' thought he’d make it in Hollywood, had to see 'everything that somebody had turned down'",Kevin Costner was wondering if his acting career would ever take off while working as a stage manager at Raleigh Station when he was in his 20s.,https://www.foxnews.com/entertainment/kevin-costner-never-thought-hed-make-hollywood-had-see-everything-somebody-had-turned-down,https://static.foxnews.com/foxnews.com/content/uploads/2024/06/Kevin-Costner.jpg,2024-06-03T23:49:27Z,"Join Fox News for access to this content
You have reached your maximum number of articles. Log in or create an account FREE of charge to continue reading.
By entering your email and pushing continu… [+4716 chars]",fox-news,Fox News
Louis Casiano,Blue city leader to stop sharing crime alerts with constituents because they create bad 'perception',"An ultra-woke Chicago alderwoman will stop issuing crime alerts because of her commitment to ""values of empowerment, antiracism, and community,"" she said.",https://www.foxnews.com/us/blue-city-leader-stop-sharing-crime-alerts-constituents-because-create-bad-perception,https://static.foxnews.com/foxnews.com/content/uploads/2024/06/HoppenworthChicago-1.jpg,2024-06-03T23:25:17Z,"A Chicago alderwoman will no longer post crime alerts on social media or send alerts to her constituents unless they specifically opt in for the notifications, saying the over-reporting of crime lead… [+1275 chars]",fox-news,Fox News
Janelle Ash,Miley Cyrus relates to Dolly Parton's stance on never having children,Miley Cyrus revealed where she stands about starting a family. The 31-year-old singer told W Magazine that she's still uncertain about whether or not she wants to have children.,https://www.foxnews.com/entertainment/miley-cyrus-relates-dolly-partons-stance-never-having-children,https://static.foxnews.com/foxnews.com/content/uploads/2024/06/dolly-parton-miley-cyrus.jpg,2024-06-03T23:08:58Z,"Miley Cyrus and her godmother, Dolly Parton, have a similar mindset regarding welcoming children into the world.
During an interview with W Magazine, Cyrus, 31, revealed that she's still uncertain i… [+2348 chars]",fox-news,Fox News
Greg Wehner,Embattled Sen. Bob Menendez files to run for reelection as Independent candidate,"Sen. Bob Menendez of New Jersey filed a petition with nearly 2,500 signatures to run as an Independent in his quest for reelection to the U.S. Senate.",https://www.foxnews.com/politics/embattled-sen-bob-menendez-files-run-reelection-independent-candidate,https://static.foxnews.com/foxnews.com/content/uploads/2024/05/AP24131714185938.jpg,2024-06-03T23:08:03Z,"Sen. Bob Menendez, D-N.J., has filed a petition with nearly 2,500 signatures, to run for reelection as an Independent, despite being on trial for federal bribery charges.
The New Jersey Division of … [+3286 chars]",fox-news,Fox News
Joseph Wulfsohn,Some former 'Never Trump' voters now say they're backing GOP nominee after his conviction,Several voters spoke with The Free Press about how the recent conviction of former President Trump is motivating them to support him in the upcoming election.,https://www.foxnews.com/media/former-never-trump-voters-say-backing-gop-nominee-conviction,https://static.foxnews.com/foxnews.com/content/uploads/2024/05/TRUMP-BIDEN-DEBATE.jpg,2024-06-03T23:02:09Z,"Join Fox News for access to this content
Plus special access to select articles and other premium content with your account - free of charge.
By entering your email and pushing continue, you are ag… [+5800 chars]",fox-news,Fox News
