author,title,description,url,urlToImage,publishedAt,content,source.id,source.name
Fox News Staff,California AG candidate on NASCAR star Bobby East's killing: Crime surge sparking 'spiral of lawlessness',California attorney general candidate Nathan Hochman warned California crime has become 'tragic but inevitable' following the murder of NASCAR's Bobby East,https://www.foxnews.com/media/california-ag-candidate-nascar-star-bobby-easts-killing-crime-surge-sparking-spiral-lawlessness,https://cf-images.us-east-1.prod.boltdns.net/v1/static/694940094001/ef6cde8b-ba55-4caf-9220-021caa1b4453/8bd878a6-7af2-4b2b-b4cd-6e9d6f9f8fa5/1280x720/match/image.jpg,2022-07-18T13:22:50Z,"California attorney general candidate Nathan Hochman warned California is enduring a ""spiral of lawlessness"" after police unveiled the suspect accused of killing former NASCAR driver Bobby East had a… [+830 chars]",fox-news,Fox News
Elizabeth Heckman,Former college athletes take stand against Lia Thomas' nomination for 'Woman of the Year' award,"Co-founders of the Independent Council of Women's Sports, Kim Jones and Marshi Smith, called out UPenn after Lia Thomas was nominated for a 'Woman of the Year' award",https://www.foxnews.com/media/former-college-athletes-take-stand-lia-thomas-nomination-woman-year-award,https://cf-images.us-east-1.prod.boltdns.net/v1/static/694940094001/f121b6cc-c849-4ba8-ad56-74ac6457d009/c19963f6-495e-4a5e-b866-2f6be76f47c4/1280x720/match/image.jpg,2022-07-18T13:15:57Z,"The mother of an Ivy League swimmer said Monday she's outraged over the recent move by the University of Pennsylvania
 to nominate transgender athlete Lia Thomas for the NCAA ""Woman of the year"" awa… [+1949 chars]",fox-news,Fox News
Ashley Papa,Uvalde mom who rescued sons from school shooting reacts to police response: ‘Turn in your badge’,"A Uvalde, Texas, mom who was handcuffed before rescuing her sons during the Robb Elementary School shooting reacted to new footage of the controversial police response.",https://www.foxnews.com/us/uvalde-mom-rescued-sons-school-shooting-reacts-police-response-turn-your-badge,https://static.foxnews.com/foxnews.com/content/uploads/2022/06/GettyImages-1403513877.jpg,2022-07-18T12:51:35Z,"The mother who saved her children during the Uvalde, Texas, elementary school shooting has a message to police officers who she blames for their inaction and for holding back parents: ""Turn in your b… [+7649 chars]",fox-news,Fox News
Ryan Gaydos,Alexander Bublik gives 'honest' speech after losing Hall of Fame Open: 'Put your whole prize money on red',Alexander Bublik of Kazakhstan did not appear too happy to lose in three sets to Maxime Cressy on Sunday.,https://www.foxnews.com/sports/alexander-bublik-honest-speech-losing-hall-fame-open,https://static.foxnews.com/foxnews.com/content/uploads/2022/07/Alexander-Bublik.jpg,2022-07-18T12:37:33Z,"American tennis player Maxime Cressy picked up his first career ATP title with a 2-6, 6-3, 7-6 (3) win over Alexander Bublik of Kazakhstan at the International Tennis Hall of Fame in Newport, Rhode I… [+2055 chars]",fox-news,Fox News
Ann Schmidt,Florida woman shocked to find iguana in her toilet: report,"Michelle Reynolds of Hollywood, Florida, found a Mexican spiny tail iguana in her toilet on July 9. She had it taken away by Harold Rondon of Iguana Lifestyles, a wildlife removal service.",https://www.foxnews.com/lifestyle/florida-woman-finds-iguana-toilet-report,https://static.foxnews.com/foxnews.com/content/uploads/2022/07/iguana-iStock.jpg,2022-07-18T12:21:25Z,"A woman in Florida was in for quite a surprise when she went to the bathroom earlier this month. 
Michelle Reynolds, of Hollywood, Florida, found an iguana in her toilet on July 9. 
That night, Rey… [+1605 chars]",fox-news,Fox News
Jessica Chasmar,"Republicans push pro-family, pro-mother policies in wake of Dobbs ruling",New messaging signals Republicans are trying to win over suburban women and moderate voters after endorsing the Supreme Court’s overturning of Roe v. Wade.,https://www.foxnews.com/politics/republicans-push-pro-family-pro-mother-policies-dobbs-ruling,https://static.foxnews.com/foxnews.com/content/uploads/2021/10/U.S.-Senator-Bill-Cassidy.jpg,2022-07-18T12:08:39Z,"Republicans have pivoted to proposing a range of measures to provide a social safety net for women and families after endorsing the Supreme Courts overturning of Roe v. Wade, which ended the national… [+6716 chars]",fox-news,Fox News
Brittany Kasko,Quiz: Name that bird! Can you match these beautiful birds with their correct names?,"How well do you know your birds? Check out this fun and interactive lifestyle quiz and test your knowledge of 15 birds — some common, some rare, all unique!",https://www.foxnews.com/lifestyle/quiz-name-bird-match-beautiful-birds,https://static.foxnews.com/foxnews.com/content/uploads/2022/07/bird-split.jpg,2022-07-18T12:00:00Z,"Mobile app users
: Please click here for the quiz!
For more quizzes from Fox News Digital, click on this link!
(Photo credits: Getty Images)
Brittany Kasko is a lifestyle production assistant wit… [+18 chars]",fox-news,Fox News
Stephanie Pagones,California: Kristin Smart trial for Paul Flores and dad begins 25+ years after college student's disappearance,Monday marks the first day of a long-awaited trial for the father and son accused in the disappearance and presumed death of California college student Kristin Smart.,https://www.foxnews.com/us/california-kristin-smart-trial-paul-flores-dad-begins-25-years-college-students-disappearance,https://static.foxnews.com/foxnews.com/content/uploads/2021/04/kristin-smart-paul-flores-split.jpg,2022-07-18T15:54:43Z,"Opening statements are set to begin Monday in the California trial for the man accused of killing college freshman Kristin Smart more than 25 years ago and his father, who allegedly helped his son hi… [+6272 chars]",fox-news,Fox News
Cortney Moore,"Kentucky woman wins $146K lottery, offers gift cards to others: 'Paying it forward'",Kentucky Lottery winner Crystal Dunn won a six-figure Bank Buster Jackpot in July 2022 — and she paid it forward to strangers by handing out free gift cards.,https://www.foxnews.com/lifestyle/kentucky-woman-wins-146k-lottery-gift-cards-paying-forward,https://static.foxnews.com/foxnews.com/content/uploads/2022/07/Crystal-Dunn-Photo-Courtesyy-Kentucky-Lottery-Cropped.jpg,2022-07-18T15:52:06Z,"A lottery winner in Kentucky won a six-figure jackpot and celebrated her win by giving away gift cards at a local store.
Crystal Dunn of Louisville put $20 into the Kentucky Lotterys online game, Ba… [+2209 chars]",fox-news,Fox News
Fox News,USPS issuing American pony car stamp series,The United States Postal Service is issuing a limited edition run of forever stamps featuring American pony cars like the Mustang and Camaro.,https://www.foxnews.com/auto/usps-american-pony-car-stamp-series,https://static.foxnews.com/foxnews.com/content/uploads/2022/07/mustang-stamp.jpg,2022-07-18T15:43:07Z,"It's the return of the pony express.
The United States Postal Service is issuing a new series of Forever stamps celebrating the American pony car era.
The Ford Mustang kicked off the new segment of… [+1704 chars]",fox-news,Fox News
Ronn Blitzer,Video shows NYC firefighter get trapped under SUV during rescue before bystanders save him,A New York City firefighter suffered a leg injury after a BMW SUV fell on him as he was rescuing a passenger from the wreckage of a car accident on Sunday.,https://www.foxnews.com/us/video-shows-nyc-firefighter-trapped-under-suv-during-rescue-before-bystanders-save-him,https://cf-images.us-east-1.prod.boltdns.net/v1/static/694940094001/7ea2d45c-5d45-4c0c-96ab-7c833bc01458/6eaef3da-0fc0-486f-a36b-45c5334d8623/1280x720/match/image.jpg,2022-07-18T15:41:28Z,"A car crash that left a responding firefighter with a broken leg could have been far worse if not for the fireman's heroics and those of several onlookers.
First responders arrived on the scene of t… [+2122 chars]",fox-news,Fox News
Associated Press,Charlotte comedy club empties before man fires gun prior to a Craig Robinson show,Craig Robinson was set to perform at The Comedy Zone when a man told everyone to evacuate and than fired his gun. There were no injuries and the suspect was taken into custody.,https://www.foxnews.com/us/charlotte-comedy-club-empties-before-man-fires-gun-prior-craig-robinson-show,https://static.foxnews.com/foxnews.com/content/uploads/2022/07/AP22198594954832.jpg,2022-07-18T15:35:10Z,"A man fired a gun inside a comedy club in North Carolina on Saturday night shortly after it was evacuated and before actor and comedian Craig Robinson was set to perform, police said.
The shot was f… [+1933 chars]",fox-news,Fox News
Phillip Nieto,Impeaching a president: Here's how it works,"The United States Congress has the full power to impeach and remove a federal civil officer, vice president, and president from office.",https://www.foxnews.com/politics/impeaching-president-heres-how-works,https://static.foxnews.com/foxnews.com/content/uploads/2018/09/7b3d25a8-rts1cvlk.jpg,2022-07-18T15:28:03Z,"The United States Constitution grants Congress the power to impeach the president, vice president, and any federal civil officer and remove them from office. The presidential impeachment process is o… [+2722 chars]",fox-news,Fox News
Associated Press,North Dakota man wanted for attempted murder in Bismarck arrested,North Dakota authorities have caught a man who was on the run since Tuesday. The man is accused of firing a gun at a vehicle and evading police.,https://www.foxnews.com/us/north-dakota-man-wanted-attempted-murder-bismarck-arrested,https://static.foxnews.com/foxnews.com/content/uploads/2022/06/ALL_CUSTOM_FS_LOCAL_NEWS_ND_GENERAL.png,2022-07-18T15:26:48Z,"Authorities say they have caught up with a man wanted for attempted murder and terrorizing in Bismarck.
The 38-year-old man has been on the run since last Tuesday when police say he fired a gun at a… [+758 chars]",fox-news,Fox News
Brian Flood,"Kick Joe Manchin out of the Democratic Party, ex-Labor Secretary Robert Reich says: 'Already lost control'","Democrats should kick moderate West Virginia Sen. Joe Manchin out of their party, Clinton administration Labor Secretary Robert Reich argued on Monday.",https://www.foxnews.com/media/kick-joe-manchin-democratic-party-labor-secretary-robert-reich-already-lost-control,https://static.foxnews.com/foxnews.com/content/uploads/2021/10/AP21292636154658.jpg,2022-07-18T15:25:34Z,"Former Democratic Labor Secretary Robert Reich believes it may be time for Democrats to kick  Sen. Joe Manchin, D-W.Va., out of the party because they ""already lost control over the Senate"" and cant … [+5182 chars]",fox-news,Fox News
Fox News Staff,Clay Travis slams Lia Thomas 'Woman of the Year' nomination: The left told us this would never happen,"Clay Travis, founder of OutKick, weighed in after the University of Pennsylvania nominated Lia Thomas, a transgender swimmer, for 'Woman of the Year' in the NCAA.",https://www.foxnews.com/media/clay-travis-slams-lia-thomas-woman-year-nomination-left-told-never-happen,https://cf-images.us-east-1.prod.boltdns.net/v1/static/694940094001/29df6eb3-0c0d-45ef-82c3-4363b2c58994/d7ab4d33-2329-43d8-8c49-577ff0dd4780/1280x720/match/image.jpg,2022-07-18T15:24:40Z,"OutKick founder Clay Travis argued transgender swimmer Lia Thomas is an example of what the left said would ""never happen"" in women's sports after her nomination for the NCAA's ""Woman of the Year"" aw… [+1117 chars]",fox-news,Fox News
Rebekah Koffler,Biden's 5 failures in Ukraine that only embolden Russia,"Biden's failures in Russia-Ukraine conflict could have devastating long-term consequences for Ukrainians, and us.",https://www.foxnews.com/opinion/biden-failures-ukraine-embolden-russia,https://static.foxnews.com/foxnews.com/content/uploads/2022/07/GettyImages-1409221783.jpg,2022-07-18T15:21:43Z,"President Joe Bidens Russia-Ukraine policy has been a monumental disaster. Russias forces are in the fifth month of laying devastation to Ukraine as Biden continues to write checks to Zelenskyy, with… [+6492 chars]",fox-news,Fox News
Joe Schoffstall,"Cori Bush nears $400,000 in campaign cash to private security while refusing to rein in calls to defund police","Cori Bush, one of Congress' biggest advocates for defunding the police, has spent nearly $400,000 in campaign cash into private security detail, FEC files show.",https://www.foxnews.com/politics/cori-bush-400000-campaign-cash-private-security-refusing-rein-calls-defund-police,https://static.foxnews.com/foxnews.com/content/uploads/2021/07/Cori-Bush-Thumb.png,2022-07-18T15:18:21Z,"FIRST ON FOX: Rep. Cori Bush has injected nearly $400,000 of campaign funds into private security services while refusing to tone down calls to defund police, federal filings show.
The Missouri Demo… [+3135 chars]",fox-news,Fox News
Ryan Gaydos,MLB Home Run Derby 2022: Pete Alonso looks to win third consecutive title,Pete Alonso will look to defend his MLB Home Run Derby trophy and win the competition for the third time.,https://www.foxnews.com/sports/mlb-home-run-derby-2022-pete-alonso-third-title,https://static.foxnews.com/foxnews.com/content/uploads/2022/07/Pete-Alonso2.jpg,2022-07-18T15:13:55Z,"The MLB Home Run Derby is set for Monday night at Dodger Stadium in Los Angeles in what is usually a fun lead-up to the All-Star Game.
There will be seven challengers looking to take the crown from … [+3117 chars]",fox-news,Fox News
"Tyler Olson, Jason Donner",Senate poised for vote on semiconductor bill after Manchin again shrinks Dems' reconciliation package,Republicans appear poised to support a bill to fund the U.S. semiconductor industry after Sen. Joe Manchin pared back Democrats' reconciliation bill.,https://www.foxnews.com/politics/senate-poised-vote-semiconductor-bill-manchin-shrinks-dems-reconciliation-package,https://static.foxnews.com/foxnews.com/content/uploads/2022/01/aaManchintalking.jpg,2022-07-18T15:11:42Z,"The Senate appears poised to pass a bill funding the U.S. semiconductor industry after Texas Sen. John Cornyn said the GOP will lift a blockade on it, citing Sen. Joe Manchin's move to shrink Democra… [+4793 chars]",fox-news,Fox News
Associated Press,Mariners win 14th consecutive game in victory over Rangers powered by Julio Rodríguez's big hit,Mariners beat the Rangers to win their 14th consecutive game. Julio Rodríguez and Ty France are going to Los Angeles to play in All-Star Game on Tuesday.,https://www.foxnews.com/sports/seattle-wins-14th-consecutive-game-rangers-julio-rodriguezs,https://static.foxnews.com/foxnews.com/content/uploads/2022/07/Mariners-celebrate-copy.jpg,2022-07-18T15:01:01Z,"Julio Rodríguez and Ty France are headed to the All-Star Game, so they won't be among the Seattle Mariners getting the break their manager says they need.
Yeah, Scott Servais knows that time off thi… [+6063 chars]",fox-news,Fox News
Bailee Hill,Former LA deputy DA attacked by same suspect in Kim Glass assault: 'The writing was on the wall',"Former LA Deputy DA Irene Lee, who was attacked by the same man who allegedly attacked Olympian Kim Glass, pushed for victim advocacy on 'America's Newsroom'",https://www.foxnews.com/media/former-la-deputy-da-attacked-same-suspect-kim-glass-assault-writing-wall,https://cf-images.us-east-1.prod.boltdns.net/v1/static/694940094001/a6d08394-6a0e-458b-8fdc-4cff953db30c/ca51ba3e-2361-44e4-bcd5-8770ef9a4667/1280x720/match/image.jpg,2022-07-18T14:59:46Z,"A former deputy district attorney in Los Angeles, who was attacked by the same man who allegedly assaulted Olympian Kim Glass, warned the ""writing was on the wall"" since the suspect is a repeat offen… [+2550 chars]",fox-news,Fox News
Associated Press,"White Sox demolish Twins, Dylan Cease finishes off first half with masterful start","The White Sox beat the Twins 11-0 to pull within three games of the Twins in the AL Central heading into the All-Star break, the Guardians are two games back.",https://www.foxnews.com/sports/white-sox-demolish-twins-dylan-cease-masterful-start,https://static.foxnews.com/foxnews.com/content/uploads/2022/07/Dylan-Cease-smiles-copy.jpg,2022-07-18T14:59:05Z,"As Dylan Cease unwound in the clubhouse after his latest masterful start, the soft-spoken right-hander downplayed any lingering disappointment about being left off the All-Star team.
The jovial Chic… [+5466 chars]",fox-news,Fox News
Paul Steinhauser,Pence endorses rival to Trump-backed candidate in Arizona GOP gubernatorial primary,"Former Vice President Mike Pence is once again at odds with former President Donald Trump, as Pence endorses a rival to the Trump-backed candidate in Arizona's GOP gubernatorial primary",https://www.foxnews.com/politics/pence-endorses-rival-trump-backed-candidate-arizona-gop-gubernatorial-primary,https://static.foxnews.com/foxnews.com/content/uploads/2020/12/trump-pence.jpg,2022-07-18T14:57:27Z,"Former Vice President Pence is once again at odds with his one-time boss, former President Trump.
Pence on Monday endorsed real estate developer and Arizona Board of Regents member Karrin Taylor Rob… [+4666 chars]",fox-news,Fox News
Associated Press,"Yankees blowout Red Sox in second straight game behind strong performances from Gerrit Cole, Matt Carpenter",The Yankees win the series against the Red Sox and outscoring them by a score of 27-3. Gerrit Cole shined in seven strong innings only giving up two runs.,https://www.foxnews.com/sports/yankees-blowout-red-sox-second-straight-game-cole-carpenter,https://static.foxnews.com/foxnews.com/content/uploads/2022/07/Gerrit-Cole-throws-pitch-copy.jpg,2022-07-18T14:56:02Z,"Gerrit Cole hardly believes he's solved pitching to Rafael Devers. At least he doesn't have to worry about quieting teammate Matt Carpenter's bat.
The rest of the Yankees are satisfied with concludi… [+6204 chars]",fox-news,Fox News
Associated Press,Juan Soto continues on-base streak with home run as Nationals beat Braves,The Nationals snap their nine game losing streak as Juan Soto hits a home run to beat the Braves as they go into the All-Star break on a win.,https://www.foxnews.com/sports/nationals-snap-losing-streak-braves-juan-soto-home-run,https://static.foxnews.com/foxnews.com/content/uploads/2022/07/Juan-Soto-and-Davey-Martinez-copy.jpg,2022-07-18T14:52:11Z,"Juan Soto and Victor Robles homered, and the Washington Nationals beat the Atlanta Braves 7-3 Sunday to snap a nine-game losing streak.
Soto, Washingtons lone All-Star who could be traded by the end… [+4539 chars]",fox-news,Fox News
Brian Flood,MSNBC’s Katy Tur wonders if she’s doing ‘more harm than good’ as a journalist: ‘People don’t trust us’,"MSNBC's Katy Tur said bluntly that ""people don't trust us"" in reaction to a survey that showed record-low public confidence in newspapers and TV news.",https://www.foxnews.com/media/msnbc-katy-tur-wonders-doing-more-harm-good-journalist-people-dont-trust-us,https://static.foxnews.com/foxnews.com/content/uploads/2022/06/katy-tur-comedy-central.png,2022-07-18T14:40:00Z,"MSNBC host Katy Tur wonders if shes doing ""more harm than good"" as a journalist as trust in the media has dwindled in recent years.  
""People dont trust us,"" Tur said last week.
In an interview pro… [+3563 chars]",fox-news,Fox News
Kylie Michael,Joe Fist Bumps Saudi Prince,"Joe Biden greets the Crown Prince of Saudi Arabia with a fist bump as the two countries embark on an “energy security” discussion. Hey Joe, perhaps you should visit South Dakota and the Keystone XL pipeline you cancelled! I’m Tomi Lahren, more next. When Joe …",https://radio.foxnews.com/2022/07/18/joe-fist-bumps-saudi-prince/,https://radio.foxnews.com/wp-content/uploads/2022/05/FEATURED_IMAGE_TL_FOX_NEWS_COMMENTARY.jpg,2022-07-18T14:22:23Z,"Joe Biden greets the Crown Prince of Saudi Arabia with a fist bump as the two countries embark on an “energy security” discussion.
Hey Joe, perhaps you should visit South Dakota and the Keystone XL … [+924 chars]",fox-news,Fox News
Danielle Wallace,Fauci to retire by the end of Biden's term: report,"Dr. Anthony Fauci, who served under seven different presidential administrations, is to retire by the end of President Biden's term, a report says.",https://www.foxnews.com/politics/fauci-retire-end-bidens-term-report,https://static.foxnews.com/foxnews.com/content/uploads/2021/09/FAUCI.jpg,2022-07-18T14:10:40Z,"Dr. Anthony Fauci, Chief Medical Officer to the President of the United States, said he will retire by the end of President Bidens term, according to a new report published Monday. 
Politico reporte… [+4697 chars]",fox-news,Fox News
Kylie Michael,LeBron Calls Boston Fans “Racist”,"LeBron is at it again, anyone who doesn’t bow to the “King” is labeled a “racist?” That’s not how it works, LeBron! I’m Tomi Lahren, more next. LeBron James had quite the week, first he stuck his large foot in his large mouth when he suggested if he were the …",https://radio.foxnews.com/2022/07/18/lebron-calls-boston-fans-racist/,https://radio.foxnews.com/wp-content/uploads/2022/05/FEATURED_IMAGE_TL_FOX_NEWS_COMMENTARY.jpg,2022-07-18T14:06:46Z,"LeBron is at it again, anyone who doesn’t bow to the “King” is labeled a “racist?”
That’s not how it works, LeBron!
I’m Tomi Lahren, more next. 
LeBron James had quite the week, first he stuck his… [+885 chars]",fox-news,Fox News
Stephanie Pagones,Parkland school shooting trial: Nikolas Cruz’s defense team delays its opening statements as testimony begins,"The penalty trial for admitted Florida school shooter Nikolas Cruz, who killed 17 people in Parkland in 2018, began on Monday with opening statements and testimony.",https://www.foxnews.com/us/parkland-school-shooting-trial-nikolas-cruzs-defense-team-delays-opening-statements-testimony-begins,https://static.foxnews.com/foxnews.com/content/uploads/2022/04/nikolas-cruz-2.jpg,2022-07-18T17:44:40Z,"The opening statements portion of the penalty trial for confessed Parkland, Florida, school shooter Nikolas Cruz is complete for the time being after defense attorneys on Monday opted to delay their … [+4439 chars]",fox-news,Fox News
Stephanie Nolasco,Prince Harry calls Meghan Markle his ‘soulmate’ during Nelson Mandela Day speech at United Nations,"Prince Harry described a photo he was given of his mother, Princess Diana, meeting Nelson Mandela. She died five months after the snapshot was taken in 1997.",https://www.foxnews.com/entertainment/prince-harry-meghan-markle-soulmate-nelson-mandela-day,https://static.foxnews.com/foxnews.com/content/uploads/2022/07/Getty_PrinceHarry_MeghanMarkle.jpg,2022-07-18T17:34:12Z,"Prince Harry delivered a keynote speech on Nelson Mandela International Day, in which he referred to his wife Meghan Markle as his ""soulmate.""
On Monday, the Duke and Duchess of Sussex arrived in Ne… [+4635 chars]",fox-news,Fox News
Michael Ruiz,Buffalo shooting suspect Payton Gendron pleads not guilty to federal hate crime charges,"Payton Gendron pleaded not guilty to federal hate crime charges Monday, three months after allegedly opening fire at the Tops grocery store in Buffalo, N.Y.",https://www.foxnews.com/us/buffalo-shooting-suspect-payton-gendron-pleads-not-guilty-federal-hate-crime-charges,https://static.foxnews.com/foxnews.com/content/uploads/2022/05/GettyImages-1398122405.jpg,2022-07-18T17:19:07Z,"A New York man accused of opening fire at a Buffalo grocery store and killing 10 people in May pleaded not guilty to federal hate crime charges Monday.
Payton Gendron, appearing in an orange prison … [+3960 chars]",fox-news,Fox News
Ronn Blitzer,"Wild monkeys steal infant, throw child off roof in tragic attack","A gang of monkeys killed a newborn baby in India on Friday, when the they snatched him from his parents and threw him off a roof terrace as family members looked on in horror.",https://www.foxnews.com/world/wild-monkeys-steal-infant-throw-child-roof-tragic-attack,https://static.foxnews.com/foxnews.com/content/uploads/2021/07/GettyImages-1232123691.jpg,2022-07-18T17:08:20Z,"A newborn baby boy died tragically on Friday, when a pack of monkeys stole him from his parents and threw him off a roof.
According to multiple reports, Nirdesh Upadhyay of Bareilly, India, was stan… [+1187 chars]",fox-news,Fox News
Michael Lee,Gun control advocates stunned man who allegedly shot Indiana mall shooter labeled 'Good Samaritan',Critics took to Twitter to express frustration that a man with a concealed pistol permit who put a stop to a mass shooting in an Indiana mall was being hailed a hero.,https://www.foxnews.com/us/gun-control-advocates-stunned-man-allegedly-shot-indiana-mall-shooter-labeled-good-samaritan,https://static.foxnews.com/foxnews.com/content/uploads/2022/07/Indianapolos-Crime-Scene.jpg,2022-07-18T17:04:14Z,"Critics are lashing out after a man carrying a pistol stopped a mass shooting at an Indiana shopping mall, arguing the man should not be called a ""Good Samaritan.""
""The term, Good Samaritan came fro… [+2673 chars]",fox-news,Fox News
