author,title,description,url,urlToImage,publishedAt,content,source.id,source.name
Pilar Arias,"Shark attack off California coast leaves 46-year-man hospitalized, beaches closed","Beaches in Del Mar, Calf., about one mile in each direction from where a shark attack over the weekend occurred have been closed and should reopen on Tuesday.",https://www.foxnews.com/us/shark-attack-california-coast-leaves-46-year-old-man-hospitalized-beaches-closed,https://static.foxnews.com/foxnews.com/content/uploads/2024/06/del-mar-shark-sign.jpg,2024-06-03T11:30:16Z,"Lifeguards in Del Mar, California, which is north of San Diego, have closed beaches to swimming and surfing after a Sunday morning shark attack.
A 46-year-old man was bitten by a shark on his torso,… [+1653 chars]",fox-news,Fox News
Associated Press,Georgia signs controversial 'foreign influence' bill into law,"The speaker of Georgia's parliament signed the controversial ""foreign agents"" bill into law after the legislature dismissed the veto of President Salome Zourabichvili.",https://www.foxnews.com/world/georgia-signs-controversial-foreign-influence-bill-law,https://static.foxnews.com/foxnews.com/content/uploads/2024/06/Georgia-Divisive-Law-signed.jpg,2024-06-03T11:15:55Z,"<ul><li>The speaker of Georgia's parliament, Shalva Papuashvili, signed the divisive ""foreign agents"" bill into law after the legislature dismissed the veto of President Salome Zourabichvili.</li><li… [+5400 chars]",fox-news,Fox News
Ryan Gaydos,LPGA Tour star Charley Hull reveals fan's flirtatious overture after smoking clip goes viral,English LPGA Tour golfer Charley Hull talked about going viral before the U.S. Women's Open and how one male fan tried to pick her up at the tournament.,https://www.foxnews.com/sports/lpga-tour-star-charley-hull-reveals-fans-flirtatious-overture-after-smoking-clip-goes-viral,https://static.foxnews.com/foxnews.com/content/uploads/2024/06/Charley-Hull3.jpg,2024-06-03T11:12:42Z,"Join Fox News for access to this content
Plus special access to select articles and other premium content with your account - free of charge.
By entering your email and pushing continue, you are ag… [+1941 chars]",fox-news,Fox News
Danielle Wallace,House Minority Leader Hakeem Jeffries defends Biden's comment that Hunter did 'nothing wrong': 'Loving father',"House Minority Leader Hakeem Jeffries said ""no one is above the law"" after former President Trump's guilty verdict but defended President Biden's remark that Hunter ""did nothing wrong.""",https://www.foxnews.com/politics/house-minority-leader-hakeem-jeffries-defends-bidens-comment-hunter-did-nothing-wrong-loving-father,https://static.foxnews.com/foxnews.com/content/uploads/2024/06/GettyImages-2150288481.jpg,2024-06-03T11:09:39Z,"Join Fox News for access to this content
You have reached your maximum number of articles. Log in or create an account FREE of charge to continue reading.
By entering your email and pushing continu… [+3167 chars]",fox-news,Fox News
Erica Lamberg,Ask a doctor: 'Why are my hands swelling and what should I do about it?',"Some patients wonder why their hands are swelling — and what to do about it. In this installment of ""Ask a Doctor,"" two health experts advise when to seek medical attention for swelling or edema.",https://www.foxnews.com/health/ask-doctor-why-hands-swelling-what-should-do,https://static.foxnews.com/foxnews.com/content/uploads/2024/02/woman-hand-pain.jpg,2024-06-03T11:00:37Z,"Join Fox News for access to this content
Plus special access to select articles and other premium content with your account - free of charge.
By entering your email and pushing continue, you are ag… [+5607 chars]",fox-news,Fox News
Associated Press,Zelenskyy accuses China and Russia of undermining peace summit during visit to Manila,"Ukrainian President Volodymyr Zelenskyy, during a trip to Asia, accused China of aiding Russia in efforts to undermine a Swiss-organized global peace summit.",https://www.foxnews.com/world/zelenskyy-accuses-china-russia-undermining-peace-summit-visit-manila,https://static.foxnews.com/foxnews.com/content/uploads/2024/06/Zelenskyy-4.png,2024-06-03T10:55:40Z,<ul><li>Ukrainian President Zelenskyy met with Philippine President Marcos Jr. to urge regional leaders to attend a Swiss peace summit on the Ukraine war.</li><li>Zelenskyy accused China of helping R… [+5258 chars],fox-news,Fox News
Scott Thompson,"PGA Tour golfer needs 4 different caddies, including a fan, to finish final round at RBC Canadian Open","C.T. Pan saw his caddie suffer an injury that did not allow him to finish the final round at the RBC Canadian Open, leading to a fan and others jumping in to carry his bag.",https://www.foxnews.com/sports/pga-tour-golfer-needs-4-different-caddies-including-fan-finish-final-round-rbc-canadian-open,https://static.foxnews.com/foxnews.com/content/uploads/2024/06/C.T.-Pan-1.jpg,2024-06-03T10:42:14Z,"Join Fox News for access to this content
Plus special access to select articles and other premium content with your account - free of charge.
By entering your email and pushing continue, you are ag… [+2329 chars]",fox-news,Fox News
Stephen Sorace,"Illegal immigrant from Venezuela shoots 2 NYC police officers during foot chase in Queens, authorities say","Bernardo Raul Castro Matta, identified as a 19-year-old illegal immigrant from Venezuela, is accused of shooting two NYPD officers in Queens early Monday.",https://www.foxnews.com/us/illegal-immigrant-venezuela-shoots-2-nyc-police-officers-during-foot-chase-queens,https://cf-images.us-east-1.prod.boltdns.net/v1/static/694940094001/6f3a3d33-ca84-4d5d-aaa5-8322df08b3f0/bdc49e8b-b436-4bdf-9673-f100505b8388/1280x720/match/image.jpg,2024-06-03T10:30:11Z,"Two New York City police officers were shot early Monday while chasing a suspect, who authorities say is an illegal immigrant from Venezuela, while investigating a pattern of robberies involving susp… [+1644 chars]",fox-news,Fox News
Alba Cuebas-Fantauzzi,Presidential historian warns second Trump term would lead to ‘dictatorship and anarchy’,"Michael Bescheloss said he believes that a second term under the Trump administration would put the United States under “dictatorship and anarchy.""",https://www.foxnews.com/media/presidential-historian-warns-second-trump-term-would-lead-dictatorship-anarchy,https://static.foxnews.com/foxnews.com/content/uploads/2024/05/Donald-Trump-NYC-Trial-Jury-Deliberations_08.jpg,2024-06-03T10:30:10Z,"An MSNBC presidential historian warned on Saturday if former President Trump were to win back the White House that the United States would devolve into ""dictatorship and anarchy.""
""He is saying, I w… [+2252 chars]",fox-news,Fox News
Fox News,Hunter Biden's federal gun trial begins with jury selection and more top headlines,Get all the stories you need-to-know from the most powerful name in news delivered first thing every morning to your inbox.,https://www.foxnews.com/us/hunter-bidens-federal-gun-trial-begins-jury-selection-more-top-headlines,https://static.foxnews.com/foxnews.com/content/uploads/2024/06/hunter-biden-split.jpg,2024-06-03T10:27:22Z,"Good morning and welcome to Fox News morning newsletter, Fox News First. Subscribe now to get Fox News First in your email. And here's what you need to know to start your day ... 
SON OF A GUN Hunte… [+3364 chars]",fox-news,Fox News
Greg Norman,Claudia Sheinbaum elected as Mexico's first female president,"Former Mexico City Mayor Claudia Sheinbaum is projected to win Mexico's presidential election, becoming the country's first woman president.",https://www.foxnews.com/world/claudia-sheinbaum-elected-mexicos-first-female-president,https://static.foxnews.com/foxnews.com/content/uploads/2024/06/Claudia-Sheinbaum.jpg,2024-06-03T10:15:28Z,"Join Fox News for access to this content
You have reached your maximum number of articles. Log in or create an account FREE of charge to continue reading.
By entering your email and pushing continu… [+2799 chars]",fox-news,Fox News
Landon Mion,One arrested as anti-Israel protesters set up new encampment at University of Pittsburgh,"Pro-Palestinian demonstrators set up a new encampment at the University of Pittsburgh on Sunday, erecting wooden barricades and fencing with tents inside.",https://www.foxnews.com/us/one-arrested-anti-israel-protesters-set-up-new-encampment-university-pittsburgh,https://static.foxnews.com/foxnews.com/content/uploads/2024/05/Palestine-flag.jpg,2024-06-03T10:13:41Z,"Anti-Israel demonstrators at the University of Pittsburgh set up a new encampment on Sunday, erecting a fence around the encampment and tents within it.
The protesters established the encampment out… [+3162 chars]",fox-news,Fox News
Anders Hagstrom,Jury selected as Day 1 of Hunter Biden gun trial wraps,"Hunter Biden's gun crime trial in Delaware kicks off with jury selection on Monday. Hunter is charged with making a false statement during the purchase of a firearm, and his addiction to drugs at the time is key to the case. Hunter faces a maximum of 25 years…",https://www.foxnews.com/live-news/june-3-hunter-biden-gun-trial-jury-selection,https://livenews.foxnews.com/images/2024/06/d3b27d0f1f621943e8e176bb9df678d6.jpg,2024-06-03T10:13:15Z,"Hunter Bidens criminal trial will begin with jury selection Monday morning in Delaware. The trial stems from federal gun charges brought against him by special counsel David Weiss. 
Hunter Biden ple… [+1427 chars]",fox-news,Fox News
"Kurt Knutsson, CyberGuy Report","5 ways your iPhone can make international travel easier, safer","Tech expert Kurt “CyberGuy"" Knutsson reveals five iPhone features to help simplify your global travel.",https://www.foxnews.com/tech/5-ways-your-iphone-can-make-international-travel-easier-safer,https://static.foxnews.com/foxnews.com/content/uploads/2024/06/1-5-ways-your-iPhone-can-make-international-travel-a-breeze-2.jpg,2024-06-03T10:00:30Z,"Exploring the world is an incredible experience, but let's be honest, international travel can sometimes be a bit of a headache. From navigating new cities to communicating in different languages, th… [+7849 chars]",fox-news,Fox News
Associated Press,Communities abroad commemorate Tiananmen Square victims after Hong Kong crackdown quashes ceremonies,Hong Kong's decades-old annual vigil to commemorate those who died in the 1989 the Tiananmen Square crackdown has vanished after enactment of a China-imposed security law.,https://www.foxnews.com/world/communities-abroad-commemorate-tiananmen-square-after-hong-kong-crackdown-quashes-ceremonies,https://static.foxnews.com/foxnews.com/content/uploads/2024/06/Hong-Kong-Tiananmen-Anniversary.jpg,2024-06-03T13:46:41Z,"<ul><li>China has quelled large-scale commemorations of the Tiananmen Square crackdown within its borders, so commemorations outside of China have become crucial for preserving it in history. Tuesday… [+7352 chars]",fox-news,Fox News
Taylor Penley,Kathy Griffin says infamous severed Trump head photo made her lose one-third of fanbase,Comedian Kathy Griffin said she is still experiencing fallout from her May 2017 controversy over a photo of her holding a bloodied fake head made to resemble former President Trump.,https://www.foxnews.com/media/kathy-griffin-infamous-severed-trump-head-photo-lose-one-third-fanbase,https://static.foxnews.com/foxnews.com/content/uploads/2024/06/Kathy-Griffin-scaled.jpg,2024-06-03T13:32:47Z,"Comedian Kathy Griffin says she's ""permanently"" lost one-third of her fanbase over the infamous ""beheaded Trump"" photo that took the media by storm in 2017, according to The Hill.
""One thing that br… [+3108 chars]",fox-news,Fox News
Nora Colomer,10 Father's Day gifts for dads who are into fitness,We've selected 10 great Father's Day gifts for dads who love to exercise and go to the gym as well as those who are are just getting started on their fitness journey.,https://www.foxnews.com/lifestyle/fathers-day-gifts-workout-fitness,https://static.foxnews.com/foxnews.com/content/uploads/2024/05/Commerce-fitness-iStock-1486149329.png,2024-06-03T13:23:40Z,Father's Day is the perfect opportunity to get Dad interested in a new workout routine or help him elevate his existing one. The first place to start for the gym junkie is to gauge any goals he is lo… [+4722 chars],fox-news,Fox News
Associated Press,Syrian national arrested after allegedly attacking Romania's Israeli embassy with Molotov cocktail,"A foreign citizen was arrested in Romania’s capital after allegedly attacking the entrance of the Israeli Embassy with a Molotov cocktail, authorities say.",https://www.foxnews.com/world/syrian-national-arrested-allegedly-attacking-romanias-israeli-embassy-molotov-cocktail,https://static.foxnews.com/foxnews.com/content/uploads/2024/06/Romania.png,2024-06-03T13:17:43Z,<ul><li>A Syrian national was detained in Romanias capital for allegedly attacking the entrance of the Israeli Embassy with a Molotov cocktail.</li><li>The attack caused a small fire but no casualtie… [+1362 chars],fox-news,Fox News
John Yoo,"Democrats, progressives cheering Trump verdict should be mourning this loss instead",The decisions made by D.A. Bragg to prosecute Trump on flimsy charges will come at a steep price for our country. Democrats think they have scored a big win but they are mistaken.,https://www.foxnews.com/opinion/democrats-progressives-cheering-trump-verdict-should-mourning-loss-instead,https://static.foxnews.com/foxnews.com/content/uploads/2024/06/Donald-Trump-Joe-Biden.jpg,2024-06-03T13:00:00Z,"Join Fox News for access to this content
Plus special access to select articles and other premium content with your account - free of charge.
By entering your email and pushing continue, you are ag… [+6639 chars]",fox-news,Fox News
Associated Press,German police officer who was stabbed by Afghan immigrant has died,A 29-year-old German police officer has died after being stabbed multiple times in the head and neck by a 25-year-old immigrant from Afghanistan in Mannheim.,https://www.foxnews.com/world/german-police-officer-who-stabbed-afghan-immigrant-died,https://static.foxnews.com/foxnews.com/content/uploads/2024/06/Germany-5.png,2024-06-03T12:56:34Z,"<ul><li>A 29-year-old German police officer died from injuries sustained in a knife attack on Mannheim's central square, where five others were also injured.</li><li>The officer was stabbed multiple … [+1879 chars]",fox-news,Fox News
"Matteo Cina, Adam Shaw","Texas GOP leaders react to new chair, sweeping policy proposals for Lone Star State",Fox News Digital spoke with Texas leaders about the sweeping policy proposals and new state Republican chair elected in the recent party convention.,https://www.foxnews.com/politics/texas-gop-leaders-react-new-chair-sweeping-policy-proposals-lone-star-state,https://static.foxnews.com/foxnews.com/content/uploads/2024/05/8d921137-4-Insets.jpg,2024-06-03T12:50:05Z,"Join Fox News for access to this content
Plus special access to select articles and other premium content with your account - free of charge.
By entering your email and pushing continue, you are ag… [+6887 chars]",fox-news,Fox News
Ryan Gaydos,"Oilers' Connor McDavid, Zach Hyman help team advance to Stanley Cup Final",The Edmonton Oilers' two first-period goals was enough to get past the Dallas Stars and win the Western Conference on Sunday. They will play the Florida Panthers for the Stanley Cup.,https://www.foxnews.com/sports/oilers-connor-mcdavid-zach-hyman-help-team-advance-stanley-cup-final,https://static.foxnews.com/foxnews.com/content/uploads/2024/06/Oilers-players-celebrate.jpg,2024-06-03T12:13:44Z,"The last time the Edmonton Oilers won the Stanley Cup, Glenn Anderson and Mark Messier were scoring goals and Connor McDavid was not even a glimmer in his parents eyes.
Twenty-four years later, the … [+1976 chars]",fox-news,Fox News
Associated Press,"Body found near Greek beach with 22-pound barbell attached to leg, coast guard says",The coast guard says the body of an unidentified man has been recovered off a beach northeast of the Greek capital with a 22-pound barbell attached to his leg with a rope.,https://www.foxnews.com/world/body-found-greek-beach-22-pound-barbell-attached-leg-coast-guard-says,https://static.foxnews.com/foxnews.com/content/uploads/2024/06/Rafina.png,2024-06-03T12:12:30Z,"<ul><li>The body of an unidentified man was found off Schinias Beach near Marathon, northeast of the Greek capital.</li><li>The body had a 22-pound barbell attached with a rope.</li><li>Authorities i… [+897 chars]",fox-news,Fox News
Lauryn Overhultz,"Selena Gomez admits 'girls are mean,' surrounds herself with 'levelheaded people'","Selena Gomez admitted she is not sure if she belongs in the ""cool girl"" crowd of Hollywood. The musician said she has surrounded herself with ""levelheaded"" people.",https://www.foxnews.com/entertainment/selena-gomez-admits-girls-mean-surrounds-herself-levelheaded-people,https://static.foxnews.com/foxnews.com/content/uploads/2024/06/Selena_Gomez.jpg,2024-06-03T15:54:54Z,"Selena Gomez admitted girls can be ""mean"" while sharing the kind of people she tries to surround herself with.
The 31-year-old opened up about her friendships in an interview with Time, revealing so… [+2719 chars]",fox-news,Fox News
Ryan Gaydos,"ESPN's Stephen A Smith says some WNBA players jealous of Caitlin Clark, suggests race is component","ESPN's Stephen A. Smith on Monday said on ""First Take"" there were some WNBA players who were jealous of Caitlin Clark and suggested her race may play a part.",https://www.foxnews.com/sports/espns-stephen-smith-says-some-wnba-players-jealous-caitlin-clark-suggests-race-component,https://static.foxnews.com/foxnews.com/content/uploads/2024/06/Caitlin-Clark10.jpg,2024-06-03T15:52:32Z,"Join Fox News for access to this content
Plus special access to select articles and other premium content with your account - free of charge.
By entering your email and pushing continue, you are ag… [+3317 chars]",fox-news,Fox News
Audrey Conklin,Missing North Carolina girl’s stepfather convicted of failing to report child’s disappearance,"Christopher Palmiter, stepfather of missing North Carolina girl Madalina Cojocari, was found guilty on May 31 of failing to report the disappearance of a child.",https://www.foxnews.com/us/missing-north-carolina-girls-stepfather-convicted-failing-report-childs-disappearance,https://static.foxnews.com/foxnews.com/content/uploads/2023/11/Christopher-Palmiter-and-Diana-Cojocari-602.jpg,2024-06-03T15:40:23Z,"Join Fox News for access to this content
Plus special access to select articles and other premium content with your account - free of charge.
By entering your email and pushing continue, you are ag… [+3892 chars]",fox-news,Fox News
Associated Press,Armed man fatally shot by New Hampshire police outside home improvement store,"An armed man was was fatally shot by police officers on Sunday outside a Lowe's store in New Hampshire. The incident is under investigation, authorities say.",https://www.foxnews.com/world/armed-man-fatally-shot-new-hampshire-police-home-improvement-store,https://static.foxnews.com/foxnews.com/content/uploads/2022/06/ALL_CUSTOM_FS_LOCAL_NEWS_NH_CRIME.png,2024-06-03T15:32:48Z,"<ul><li>On Sunday night, Nashua police responded to a report from Pelham police about a man leaving his home with a gun.</li><li>The man was confronted by police officers outside a Lowe's home improv… [+795 chars]",fox-news,Fox News
Ashlyn Messier,Boat day playlist: 50 songs to keep the energy high while out on the water,"If you're going to be spending a day on the boat, you need a playlist full of hit songs from artists like Jimmy Buffett and Morgan Wallen that will have everyone singing along.",https://www.foxnews.com/entertainment/boat-day-playlist,https://static.foxnews.com/foxnews.com/content/uploads/2024/05/woman-tubing.jpg,2024-06-03T15:29:11Z,"Summer days spent on the lake are almost here. 
Many spend the long, warm days of summer soaking up the sun on a boat ride. Some take the opportunity of a boat day as one of pure relaxation, with a … [+3282 chars]",fox-news,Fox News
Ashlyn Messier,"Grover Cleveland, Frances Folsom's wedding: The only U.S. president to marry inside the White House","Grover Cleveland, the 22nd and 24th president of the United States, wed the young Frances Folsom June 2, 1886, in the White House.",https://www.foxnews.com/politics/anniversary-grover-cleveland-frances-folsom-wedding,https://static.foxnews.com/foxnews.com/content/uploads/2024/05/grover-clevleand-frances-folsom-wedding.jpg,2024-06-03T15:27:41Z,"Grover Cleveland and Frances Folsom made history when they wed on June 2, 1886. 
Cleveland is the only president in history to be married inside the White House. They were married in the Blue Room, … [+2822 chars]",fox-news,Fox News
Jeffrey Clark,Rep. Maxine Waters says Trump supporters should be investigated: 'Are they preparing a civil war?',"Rep. Maxine Waters claimed on MSNBC that former President Trump was instigating violence and suggested his supporters were “domestic terrorists"" who should be investigated.",https://www.foxnews.com/media/rep-maxine-waters-trump-supporters-investigated-preparing-civil-war,https://static.foxnews.com/foxnews.com/content/uploads/2024/06/file-11.png,2024-06-03T15:17:31Z,"Join Fox News for access to this content
Plus special access to select articles and other premium content with your account - free of charge.
By entering your email and pushing continue, you are ag… [+3593 chars]",fox-news,Fox News
Danielle Wallace,Fauci denies seeking to suppress COVID-19 lab leak origin theory,"Dr. Anthony Fauci, former Director of the National Institute of Allergy and Infectious Diseases, delivered a prepared opening statement before the House select subcommittee hearing.",https://www.foxnews.com/politics/fauci-denies-seeking-suppress-covid-19-lab-leak-origin-theory,https://static.foxnews.com/foxnews.com/content/uploads/2024/06/GettyImages-2155872432.jpg,2024-06-03T15:04:41Z,"Dr. Anthony Fauci, former Director of the National Institute of Allergy and Infectious Diseases, on Monday denied attempting to suppress the theory that the COVID-19 pandemic began as a result of a l… [+3068 chars]",fox-news,Fox News
"Adam Shaw, Lucas Tomlinson","‘Too little, too late’: Why Biden’s border plan doesn’t impress critics","President Biden is expected to announce executive actions on the southern border as soon as Tuesday, officials tell Fox News, as officials scramble to tackle the crisis.",https://www.foxnews.com/politics/too-little-too-late-why-bidens-border-plan-doesnt-impress-critics,https://static.foxnews.com/foxnews.com/content/uploads/2023/01/Biden-Border.jpg,2024-06-03T15:03:26Z,"President Biden is expected to announce executive actions related to the ongoing crisis at the southern border by Tuesday as the issue threatens to become a major issue in the 2024 presidential race,… [+4794 chars]",fox-news,Fox News
Greg Norman,Maldives bans Israelis from entering country during war in Gaza,"The Maldives, an Indian Ocean island nation, is banning Israelis from entering the country and has announced a solidarity campaign with Palestinians.",https://www.foxnews.com/world/maldives-bans-israelis-from-entering-country-during-war-gaza,https://static.foxnews.com/foxnews.com/content/uploads/2024/06/Israel-Maldives-split.png,2024-06-03T14:53:34Z,"The Indian Ocean tourist destination Maldives is now banning Israelis from entering its territory in an apparent retaliatory move over the war in Gaza. 
The government of the predominantly Muslim is… [+2730 chars]",fox-news,Fox News
Associated Press,"Actor Michael Douglas visits Israel in solidarity, meets president","Actor Michael Douglas visited an Israeli kibbutz that was hit hard in the Oct. 7 Hamas attack that sparked the current Israel-Hamas war, and met with Israeli president Isaac Herzog.",https://www.foxnews.com/entertainment/actor-michael-douglas-visits-israel-solidarity-meets-president,https://static.foxnews.com/foxnews.com/content/uploads/2024/06/Israel-People-Michael-Douglas.jpg,2024-06-03T14:46:25Z,"<ul><li>Actor Michael Douglas visited the Israeli Kibbutz Beeri, which was hit hard in the Oct. 7 Hamas attack that sparked the current Israel-Hamas war.</li><li>Roughly 100 people were killed and 30… [+1637 chars]",fox-news,Fox News
Ryan Gaydos,Sports stars who died in 2024: PHOTOS,"A gallery of athletes, coaches and other sports figures lost in 2024.",https://www.foxnews.com/sports/sports-stars-who-died-2024-photos,https://static.foxnews.com/foxnews.com/content/uploads/2024/06/Bill-Walton.jpg,2024-06-03T14:46:18Z,"A gallery of athletes, coaches and other sports figures lost in 2024.",fox-news,Fox News
Associated Press,Police hunt for suspects after war shrine is defaced with graffiti in Tokyo,"In Tokyo, Japan, police are searching for suspects who spray-painted the word ""toilet"" on a stone pillar at Yasukuni Shrine, a site honoring Japan's war dead.",https://www.foxnews.com/world/police-hunt-suspects-war-shrine-defaced-graffiti-tokyo,https://static.foxnews.com/foxnews.com/content/uploads/2024/06/Japan-3.png,2024-06-03T14:42:55Z,"<ul><li>Japanese police are searching for suspects who spray-painted the word ""toilet"" on a Tokyo shrine commemorating the country's war dead.</li><li>The graffiti, discovered on a stone pillar at Ya… [+2479 chars]",fox-news,Fox News
