author,title,description,url,urlToImage,publishedAt,content,source.id,source.name
Angelica Stabile,100-year-old WWII veteran throws first pitch at Long Island Ducks ballpark,"WWII veteran Henry Levy, who is 100 years old, threw the first pitch at a Men's Senior League Baseball game at Fairfield Properties Ballpark in Central Islip, N.Y.",https://www.foxnews.com/lifestyle/100-wwii-veteran-first-pitch-long-island-ducks-ballpark,https://static.foxnews.com/foxnews.com/content/uploads/2022/07/henry-levy-ducks-ballpark.jpg,2022-07-18T21:53:48Z,"Henry Levy got to take his love of baseball to the next level.
The 100-year-old baseball fan and World War II veteran threw out the ceremonial first pitch at a Mens Senior Baseball League (MSBL) gam… [+2554 chars]",fox-news,Fox News
Louis Casiano,Houston would-be robber shot and killed by victim: report,"A potential robbery victim turned the tables on his attacker and shot and killed him during the encounter after leaving a Houston ATM, according to reports.",https://www.foxnews.com/us/houston-robber-shot-killed-victim-report,https://static.foxnews.com/foxnews.com/content/uploads/2022/07/699aa9b9-Houston-robbery.jpg,2022-07-18T21:51:13Z,"A suspected robber was shot and killed over the weekend by his intended victim who had his own weapon, Houston police said. 
The robbery occurred around 10:30 p.m. when a man was leaving an ATM. Ano… [+942 chars]",fox-news,Fox News
Louis Casiano,Pennsylvania man charged in 1975 cold case killing of teenage girl,"The suspected killer of a teenage Pennsylvania girl in 1975 was arrested this week, decades after she was found stabbed multiple times in her apartment unit.",https://www.foxnews.com/us/pennsylvania-man-charged-cold-case-killing,https://static.foxnews.com/foxnews.com/content/uploads/2022/07/cold-case-PA.jpg,2022-07-18T21:41:06Z,"DNA evidence found on a discarded coffee cup led police to charge a Pennsylvania man with the decades-old murder of a woman who was found dead in her apartment in 1975, officials said Monday. 
David… [+2274 chars]",fox-news,Fox News
Kerry Byrne,Broadway unmasked! 10 fascinating facts about America’s most famous street,"Broadway in New York City has roared back to life in recent weeks, with onerous mask mandates at theaters finally set aside and Times Square again swarming with pedestrians.",https://www.foxnews.com/lifestyle/broadway-unmasked-10-facts-america-famous-street,https://static.foxnews.com/foxnews.com/content/uploads/2022/07/Times-Square-July-16-2022-kjb-photo.png,2022-07-18T21:39:19Z,"New York City The Great White Way is glowing again. 
Broadways 41 theaters finally dropped mandatory mask mandates here in July, after they were among the very last holdouts in America of the contro… [+9902 chars]",fox-news,Fox News
Stephanie Nolasco,"Hayley Hasselhoff, model and David Hasselhoff’s daughter, celebrates her curves on runway for Miami Swim Week","Hayley Hasselhoff, a curve model who previously landed a European Playboy cover, walked the runway for Cupshe x Tabria Majors during Miami Swim Week.",https://www.foxnews.com/entertainment/hayley-hasselhoff-david-hasselhoff-daughter-miami-swim-week,https://static.foxnews.com/foxnews.com/content/uploads/2022/07/Getty_HayleyHasselhoff_Main.jpg,2022-07-18T21:36:10Z,"Hayley Hasselhoff proudly showcased her curves while strutting down the catwalk.
On Sunday, the model and daughter David Hasselhoff walked the runway for Cupshe x Tabria Majors during Miami Swim Wee… [+4745 chars]",fox-news,Fox News
Lori Bashian,Sylvester Stallone calls out ‘Rocky’ producer over his lack of ownership rights,"Sylvester Stallone is unhappy with his lack of ownership rights over the Rocky franchise, calling out the franchise's producer Irwin Winkler on Instagram.",https://www.foxnews.com/entertainment/sylvester-stallone-rocky-ownership-rights,https://static.foxnews.com/foxnews.com/content/uploads/2022/07/Sylvestor-Stallone.jpg,2022-07-18T21:29:57Z,"Sylvester Stallone is unhappy with his lack of ownership rights over ""Rocky,"" the movie that launched his career.
Over the weekend, Stallone voiced his anger on Instagram, calling out Irwin Winkler,… [+3212 chars]",fox-news,Fox News
Associated Press,"Pitch clocks, shift limits, larger bases and more coming to MLB in future years",Major League Baseball is testing out new rule changes in the minor leagues that are soon to be coming to the big league level within the next few years.,https://www.foxnews.com/sports/mlb-pitch-clocks-shift-limits-larger-bases,https://static.foxnews.com/foxnews.com/content/uploads/2022/07/pitch-clock-3-copy.jpg,2022-07-18T21:26:41Z,"Justin Verlander, Gerrit Cole and the rest of major league pitchers are likely to be looking over their shoulders next season at a pitch clock.
Clocks have cut the length of minor league games by ab… [+10935 chars]",fox-news,Fox News
Associated Press,Robert Lewandowski joins Barcelona in Miami for the US Tour,"Lewandowski is joining Barcelona as they prepare to play Real Madrid in Las Vegas, Juventus in Dallas, and the New York Red Bulls in New Jersey",https://www.foxnews.com/sports/barcelona-joined-by-robert-lewandowski-in-miami,https://static.foxnews.com/foxnews.com/content/uploads/2022/07/Robert-Lewandowski-copy-1.jpg,2022-07-18T21:23:55Z,"Already wearing Barcelona's colors, Robert Lewandowski joined the squad in Miami on Sunday ahead of his medical and the signing of his contract with the Catalan club.
CLICK HERE FOR MORE SPORTS COVE… [+1763 chars]",fox-news,Fox News
Associated Press,NBA Summer League: Trail Blazers beat Knicks to win the championship,The Trail Blazers win their second NBA Summer League championship since 2017 and beat the Knicks behind Brandon Williams strong performance.,https://www.foxnews.com/sports/trail-blazers-beat-knicks-win-nba-summer-league-championship,https://static.foxnews.com/foxnews.com/content/uploads/2022/07/Trail-Blazers-celebrate-copy.jpg,2022-07-18T21:22:26Z,"Brandon Williams scored 22 points to lead the Portland Trail Blazers to an 85-77 victory over the New York Knicks in the NBA Summer League championship game on Sunday.
It was the third time Portland… [+5417 chars]",fox-news,Fox News
Haris Alic,White House denies double standard as officials take victory lap on sinking gasoline prices,"The White House is denying the use of a double standard when it comes to gas prices, having previously dodged responsibility for their rise and now taking full credit for their drop.",https://www.foxnews.com/politics/white-house-denies-double-standard-officials-take-victory-lap-sinking-gasoline-prices,https://static.foxnews.com/foxnews.com/content/uploads/2022/06/Joe-Biden-Gas-Prices.jpg,2022-07-18T21:21:22Z,"The White House denied on Monday that it was deploying a double standard when it comes to gasoline prices. 
Jared Bernstein, a senior economic adviser, was asked during the White House press confere… [+2072 chars]",fox-news,Fox News
Bradford Betz,"North Las Vegas police officer kills daughter, self following domestic disturbance, police say","An off-duty North Las Vegas police officer fatally shot his daughter before killing himself after a fight with his wife and their teenage son, police said.",https://www.foxnews.com/us/north-las-vegas-police-officer-murder-suicide,https://static.foxnews.com/foxnews.com/content/uploads/2022/07/North-Las-Vegas-Police-Department.jpg,2022-07-18T21:07:47Z,"An off-duty North Las Vegas police officer shot and killed his daughter before turning the gun on himself following a violent altercation with his wife and teenage son, according to police. 
Patrol … [+1422 chars]",fox-news,Fox News
James Laverty,Tom Rinaldi & Baseball’s Most Prolific Forgotten Tragedy,"On this episode, Ben sits down with the winner of 16 Sports Emmy Awards and seven Edward R. Murrow Awards, FOX Sports journalist Tom Rinaldi to discuss his brand new podcast, Wesely, the story of the life and tragic death of former Major League Baseball playe…",https://radio.foxnews.com/2022/07/18/tom-rinaldi-baseballs-most-prolific-forgotten-tragedy/,https://radio.foxnews.com/wp-content/uploads/2021/03/FEATURED_IMAGE_THE_BEN_DOMENECH_PODCAST.png,2022-07-18T21:00:46Z,"On this episode, Ben sits down with the winner of 16 Sports Emmy Awards and seven Edward R. Murrow Awards, FOX Sports journalist Tom Rinaldi to discuss his brand new podcast, Wesley, the story of the… [+780 chars]",fox-news,Fox News
Yael Halon,James Madison's perspective on slavery is a far more 'nuanced' historical subject than many understand: Turley,"Jonathan Turley denounced the woke overhaul of Montpelier, James Madison’s estate in Virginia, saying it should be 'alarming to all Americans' on 'America Reports.'",https://www.foxnews.com/media/james-madison-perspective-slavery-nuanced-turley,https://cf-images.us-east-1.prod.boltdns.net/v1/static/694940094001/18094e2a-dad6-477a-8126-ad81daf2c05d/86bc3eb9-ab33-444f-aa21-afe3715c0d97/1280x720/match/image.jpg,2022-07-18T21:00:27Z,"James Madison's history with slavery is far more ""nuanced"" than the public understands, Fox News contributor Jonathan Turley said Monday, crediting the Founding Father for transforming political theo… [+2514 chars]",fox-news,Fox News
Associated Press,Massachusetts to open 11 monkeypox vaccination sites,"Massachusetts will have 11 monkeypox vaccination sites. There have been 1,800 cases of monkeypox in the country; 51 in MA. NY, CA, and IL have the most cases in the country.",https://www.foxnews.com/us/massachusetts-open-11-monkeypox-vaccination-sites,https://static.foxnews.com/foxnews.com/content/uploads/2022/07/Monkeypox-2-1.jpg,2022-07-18T20:59:08Z,"The monkeypox vaccine is now available at 11 sites around Massachusetts, state public health officials said Monday.
There had been more than 1,800 cases of monkeypox reported in the U.S. as of Frida… [+1435 chars]",fox-news,Fox News
Fox News Staff,Harold Ford Jr. on Biden's trip to Saudi Arabia: The president was 'right to travel there',"Fox News host Bret Baier spoke with former Democratic congressman Harold Ford Jr. about the implications of President Biden's trip to Saudi Arabia on ""Special Report.""",https://www.foxnews.com/media/harold-ford-jr-bidens-trip-saudi-arabia,https://cf-images.us-east-1.prod.boltdns.net/v1/static/694940094001/7c8e70cd-ba53-4cb0-98a0-6ff2f3f8dc9a/3e60a777-4bb2-4861-a9d3-3a7f41edf0bf/1280x720/match/image.jpg,2022-07-18T23:57:06Z,"Fox News' Harold Ford Jr. explained Monday on ""Special Report"" why he believes President Biden was ""right"" to travel to Saudi Arabia and mend the relationship between the two countries. 
HAROLD FORD… [+875 chars]",fox-news,Fox News
Charles Creitz,Jill Biden critiqued for fretting about Joe's tenure; left forced to 'put their silliness on hold',"First Lady Jill Biden was criticized for comments about her husband Joe Biden's presidency, wherein she lamented the difficult circumstances of his tenure.",https://www.foxnews.com/media/jill-biden-critiqued-fretting-joe-tenure-left-forced-silliness-hold,https://static.foxnews.com/foxnews.com/content/uploads/2022/04/GettyImages-1297460281_1280x.jpg,2022-07-18T23:53:34Z,"First Lady Jill Biden recently fretted about her husband's unpopular presidency and unrealized goals, which some critics said is a symptom of a Democrat having to handle a real crisis versus being ab… [+2945 chars]",fox-news,Fox News
Louis Casiano,"Georgia bank robbery suspect dressed as elderly lady to disguise himself, police say","The male bank robber, donning a floral dress and white wig to disguise himself, allegedly told a Georgia bank teller he had a gun and passed a note to demand cash.",https://www.foxnews.com/us/georgia-bank-robbery-suspect-dresses-elderly-lady,https://static.foxnews.com/foxnews.com/content/uploads/2022/07/Georgia-bank-robbery.jpg,2022-07-18T23:43:38Z,"Police in Georgia are searching for a bank robbery suspect who tried to thwart authorities by dressing up as an elderly woman during a heist. 
The McDonough Police Department said the suspect hit a … [+531 chars]",fox-news,Fox News
Ryan Gaydos,South Carolina's Dawn Staley chides ESPN for not inviting Aliyah Boston to ESPYs,South Carolina women's basketball coach Dawn Staley chided ESPN for failing to include Aliyah Boston in their awards show despite her achievements this season.,https://www.foxnews.com/sports/south-carolinas-dawn-staley-chides-espn-aliyah-boston-espys,https://static.foxnews.com/foxnews.com/content/uploads/2022/07/Dawn-Staley3.jpg,2022-07-18T23:42:39Z,"Dawn Staley, basketball legend and the head coach of South Carolina womens basketball, called out ESPN for failing to invite Aliyah Boston to its ESPY Awards this week.
Staley chided ESPN for not ex… [+2684 chars]",fox-news,Fox News
Fox News Staff,Judge Jeanine: All this social justice is 'nonsense',"Fox News' Judge Jeanine Pirro spoke out Monday on ""The Five"" about spiking crime in California and questioned why progressive prosecutors care more about criminals.",https://www.foxnews.com/media/judge-jeanine-all-this-ssocial-justice-nonsense,https://cf-images.us-east-1.prod.boltdns.net/v1/static/694940094001/2a4a6f66-b520-4c58-9c4d-5458e4853a20/f0dda375-7b76-4fa5-beea-081af285b8a2/1280x720/match/image.jpg,2022-07-18T23:40:30Z,"Fox News co-host Judge Jeanine blasted the increasing push for social justice reform nationwide on ""The Five"" Monday after several attacks by recent offenders occurred in California.  
JUDGE JEANINE… [+1081 chars]",fox-news,Fox News
Tracy Wright,Matthew McConaughey and Woody Harrelson enjoy shirtless paddleboard ride on family vacation in Croatia,"Matthew McConaughey and Woody Harrelson bond while enjoying shirtless paddleboard ride together on their annual family vacation in Dubrovnik, Croatia.",https://www.foxnews.com/entertainment/matthew-mcconaughey-woody-harrelson-enjoy-shirtless-paddleboard-ride-family-vacation-croatia,https://static.foxnews.com/foxnews.com/content/uploads/2022/07/Matt.jpg,2022-07-18T23:22:36Z,"Matthew McConaughey and his ""True Detective"" co-star, Woody Harrelson, bonded over their shared love of the open water while on a paddleboard during a group vacation in Dubrovnik, Croatia.
McConaugh… [+2992 chars]",fox-news,Fox News
Ryan Gaydos,76ers' Joel Embiid really enjoys himself at California wedding,"Joel Embiid appeared to be having the time of his life, dancing the hora at a friend's wedding over the weekend.",https://www.foxnews.com/sports/76ers-joel-embiid-really-enjoys-himself-wedding,https://static.foxnews.com/foxnews.com/content/uploads/2022/07/Joel-Embiid3.jpg,2022-07-18T23:19:39Z,"Philadelphia 76ers star Joel Embiid was at a wedding over the weekend and looked like he was having a great time dancing the hora.
Embiid appeared to be on hand for the wedding of Michael Ratner, wh… [+2159 chars]",fox-news,Fox News
Joe Silverstein,"WSJ editorial board slams the West's climate change policies for ‘empowering dictators,’ ‘driving up prices’",The WSJ editorial board published an op-ed Sunday that criticized President Biden and other Western leaders for empowering Putin by enacting their climate change agenda.,https://www.foxnews.com/media/wsj-editorial-board-slams-wests-climate-change-policies-empowering-dictators-driving-prices,https://static.foxnews.com/foxnews.com/content/uploads/2022/06/Biden-g7-summit.jpg,2022-07-18T23:18:58Z,The Wall Street Journal editorial board published a piece Sunday that criticized President Biden and leaders of other Western nations for enacting climate policies that have left their nations vulner… [+4454 chars],fox-news,Fox News
Wyatt Dobrovich-Fago,Jason Rantz Praises Minneapolis Mom Who Confronted BLM Protesters After Apartment Shooting: ‘She’s The Voice That Needs To Be Heard’,"Listen To The Full Interview Below: Jason Rantz, Host of the Jason Rantz Show on KTTH 770AM/94.5 FM in Seattle-Tacoma joined the Guy Benson Show to discuss the police-involved shooting death of a Minneapolis man after he allegedly shot into a neighboring apar…",https://radio.foxnews.com/2022/07/18/jason-rantz-praises-minneapolis-mom-who-confronted-blm-protesters-after-apartment-shooting-shes-the-voice-that-needs-to-be-heard/,https://radio.foxnews.com/wp-content/uploads/2022/06/Jason-Rantzs.jpg,2022-07-18T23:14:53Z,"Listen To The Full Interview Below:
Jason Rantz, Host of the Jason Rantz Show on KTTH 770AM/94.5 FM in Seattle-Tacoma joined the Guy Benson Show to discuss the police-involved shooting death of a Mi… [+309 chars]",fox-news,Fox News
Wyatt Dobrovich-Fago,KT McFarland Blasts Biden’s Trip To Saudi Arabia To ‘Beg’ For Oil: ‘He Debased Himself And Got Nothing For It’,"Listen To The Full Interview Below: KT McFarland, Fmr Trump Deputy National Security Advisor and Author of Revolution: Trump, Washington and “We The People” joined the Guy Benson Show to react to President Biden’s middle east trip to Saudi Arabia that drew sc…",https://radio.foxnews.com/2022/07/18/kt-mcfarland-blasts-bidens-trip-to-saudi-arabia-to-beg-for-oil-he-debased-himself-and-got-nothing-for-it/,https://radio.foxnews.com/wp-content/uploads/2021/08/KT-McFarland.jpg,2022-07-18T23:13:26Z,"KT McFarland, Fmr Trump Deputy National Security Advisor and Author of Revolution: Trump, Washington and “We The People” joined the Guy Benson Show to react to President Biden’s middle east trip to S… [+572 chars]",fox-news,Fox News
Bradford Betz,"Texas law enforcement make multiple drug busts, seize cocaine, meth worth more than $4 million","Texas law enforcement agencies have made multiple drug busts in the past week, seizing more than $4 million worth of cocaine and methamphetamine.",https://www.foxnews.com/us/texas-law-enforcement-drug-busts-seize-cocaine-meth,https://static.foxnews.com/foxnews.com/content/uploads/2022/07/Drug-4.jpg,2022-07-18T23:07:33Z,"Texas law enforcement agencies have made multiple drug busts in the past week, seizing a combined total of roughly $4.4 million worth of cocaine and methamphetamine. 
On Sunday, U.S. Customs and Bor… [+1176 chars]",fox-news,Fox News
Lori Bashian,Emilia Clarke reveals she is 'missing' parts of her brain after suffering two aneurysms,"Emilia Clarke reveals she has parts of her brain missing after suffering two aneurysms in 2011 and 2013, which she opened up about in a New York Times essay in 2019.",https://www.foxnews.com/entertainment/emilia-clarke-missing-parts-brain-aneurysms,https://static.foxnews.com/foxnews.com/content/uploads/2022/07/11238874-Emilia-Clarke.jpg,2022-07-18T22:58:17Z,"Emilia Clarke revealed parts of her brain are missing after suffering two aneurysms while filming ""Game of Thrones"" in 2011 and in 2013. 
During a recent appearance on ""BBC Ones Sunday Morning,"" Cla… [+3182 chars]",fox-news,Fox News
"Madison Scarpino, Mills Hayes","As new suicide hotline number launches, mental health advocates are hopeful",A new 988 hotline launched July 16; people can call it amid a mental health crisis. Some who lost loved ones to suicide wonder if things would have been different if this 988 hotline had existed.,https://www.foxnews.com/health/new-suicide-hotline-number-mental-health-advocates-hopeful,https://static.foxnews.com/foxnews.com/content/uploads/2022/07/Screen-Shot-2022-07-18-at-12.35.24-PM.png,2022-07-18T22:49:22Z,"Minneapolis, MN Americans can now call 988 if theyre having a suicidal or mental health crisis.
The new hotline, which launched this past Saturday, is a part of the National Suicide Prevention Lifel… [+3696 chars]",fox-news,Fox News
Ryan Gaydos,76ers' James Harden explains strategic decision to take less money on new deal - Fox News,"<ol><li>76ers' James Harden explains strategic decision to take less money on new deal  Fox News
</li><li>James Harden says he'll take 'whatever is left over' from Philadelphia 76ers in next contract  ESPN
</li><li>Exclusive: James Harden tells Sixers 'sign…",https://www.foxnews.com/sports/76ers-james-harden-strategic-decision-less-money,https://static.foxnews.com/foxnews.com/content/uploads/2022/07/James-Harden4.jpg,2022-07-18T22:41:24Z,"James Harden is focused on winning a championship, which is why he elected to opt-out of his contract and take less money to come back to the Philadelphia 76ers.
Harden told The Associated Press in … [+2550 chars]",fox-news,Fox News
"Lindsay Kornick, Chad Pergram",Charges dropped against Stephen Colbert staffers arrested after hours in House office building,The Capitol Police dropped charges against Stephen Colbert staffers where were arrested after hours in a House office building on June 17.,https://www.foxnews.com/media/charges-dropped-against-stephen-colbert-staffers-arrested-after-hours-house-office-building,https://static.foxnews.com/foxnews.com/content/uploads/2021/08/COLBERT-2-.jpg,2022-07-18T22:33:58Z,"The ""Colbert 9"" were cleared of ""unlawful entry"" charges Monday after staffers for ""The Late Show with Stephen Colbert"" were caught recording comedy skits inside a House Office Building after hours w… [+4682 chars]",fox-news,Fox News
Tracy Wright,Jennifer Lopez and Ben Affleck reportedly planning 'bigger party' after surprise Las Vegas wedding,"Jennifer Lopez and Ben Affleck are planning to celebrate their marriage with a ""bigger party"" for friends and family after a surprise wedding in Las Vegas.",https://www.foxnews.com/entertainment/jennifer-lopez-ben-affleck-reportedly-planning-bigger-party-surprise-las-vegas-wedding,https://static.foxnews.com/foxnews.com/content/uploads/2022/07/Wedding.jpg,2022-07-18T22:33:20Z,"Jennifer Lopez and husband Ben Affleck have plans to host a ""bigger party"" to celebrate their surprise marriage with friends and family after saying ""I do"" in an early morning wedding in Las Vegas on… [+6446 chars]",fox-news,Fox News
Bradford Betz,Texas National Guard soldier supporting Operation Lone Star dies in ‘non-mission related incident’,"A Texas National Guard soldier supporting Gov. Greg Abbott's Operation Lone Star died in a ""non-mission related ""incident,"" the guard has confirmed.",https://www.foxnews.com/us/texas-national-guard-soldier-operation-lone-star-dies,https://static.foxnews.com/foxnews.com/content/uploads/2022/07/US-Mexico-Border.jpg,2022-07-18T22:22:55Z,"A Texas National Guard soldier supporting Operation Lone Star died last week in a ""non-mission-related incident,"" according to the National Guard. 
Sgt. Alex Rios Rodriguez, 52, of San Antonio, Texa… [+1155 chars]",fox-news,Fox News
Matteo Cina,Wisconsin man sets garage on fire by siphoning gas with a vacuum,"The Janesville, Wisconsin, Fire Department helped to put out a house fire on Sunday. The cause of the fire was siphoning gas from a vehicle with a vacuum.",https://www.foxnews.com/us/wisconsin-man-sets-garage-fire-siphoning-gas-vacuum,https://static.foxnews.com/foxnews.com/content/uploads/2022/07/293983343_4035215126800018_2304854093200393902_n.jpg,2022-07-18T22:14:40Z,"On Sunday Morning the Janesville, Wisconsin, Fire Department responded to reports of a garage fire at 11:00 am. Firemen were able to arrive before the fire spread to the home and were able to save th… [+1782 chars]",fox-news,Fox News
Ryan Gaydos,"UFC star Frankie Edgar hopes for one last fight, eyes Dominick Cruz",Former UFC champion Frankie Edgar is hoping to get one last shot in the Octagon before calling it a career.,https://www.foxnews.com/sports/ufc-frankie-edgar-hopes-one-last-fight-dominick-cruz,https://static.foxnews.com/foxnews.com/content/uploads/2022/07/Frankie-Edgar.jpg,2022-07-18T22:14:38Z,"Frankie Edgar wants one last UFC fight, and he has the perfect opponent and perfect way to sail off into the sunset.
Edgar is looking to compete one final time at UFC 281, which will take place at M… [+2770 chars]",fox-news,Fox News
Joshua Nelson,Betsy DeVos calls for the Department of Education to be abolished,"Former education secretary Betsy DeVos said that the Department of Education should be abolished during the Moms for Liberty conference in Tampa, Florida.",https://www.foxnews.com/media/betsy-devos-calls-department-education-abolished,https://static.foxnews.com/foxnews.com/content/uploads/2021/12/2020-08-12T203727Z_1516379283_RC2JCI9T4L9G_RTRMADP_3_HEALTH-CORONAVIRUS-USA.jpg,2022-07-18T22:12:46Z,"Former education Secretary Betsy DeVos said the former department she led should be abolished.
Speaking at a ""Moms For Liberty"" summit in Tampa, Florida, DeVos said on Saturday that the Department o… [+3474 chars]",fox-news,Fox News
