author,title,description,url,urlToImage,publishedAt,content,source.id,source.name
,Jerry Jones claims he's Taylor Swift's biggest fan ahead of Cowboys-Chiefs Thanksgiving game,"Dallas Cowboys owner Jerry Jones claimed that he is Taylor Swift's biggest fan that he would have an ""elaborate seat"" for her if she attends the Kansas City Chiefs-Cowboys game.",https://www.foxnews.com/sports/jerry-jones-claims-hes-taylor-swifts-biggest-fan-ahead-cowboys-chiefs-thanksgiving-game,https://static.foxnews.com/foxnews.com/content/uploads/2025/10/jerry-jones-taylor-swift-split.jpg,2025-10-03T21:24:15Z,"Taylor Swift has not only a massive, but also a rabid fan base, yet Dallas Cowboys owner Jerry Jones claims that he is her biggest fan. 
The Kansas City Chiefs and Dallas Cowboys will play on Thanks… [+1889 chars]",fox-news,Fox News
,"Panthers-focused podcast signs off with team mired in on-field issues, playoff drought",A podcast that gained popularity among Carolina Panthers fans will cease operations amid the team's latest slow start. The Panthers enter Week 5 with just one win.,https://www.foxnews.com/sports/panthers-focused-podcast-signs-off-team-mired-on-field-issues-playoff-drought,https://static.foxnews.com/foxnews.com/content/uploads/2024/08/panthers-stadium.jpg,2025-10-03T21:20:55Z,"The Carolina Panthers showed promise in Week 3, soundly defeating the Atlanta Falcons. A week after Carolinas 30-0 victory, the New England Patriots dominated the Panthers.
Carolina has not advanced… [+2401 chars]",fox-news,Fox News
,Justice Kavanaugh's attempted assassin sentenced to 8 years in prison,A federal judge sentenced Nicholas Roske to prison for attempting to murder Justice Brett Kavanaugh in the weeks leading up to the Supreme Court’s landmark Dobbs decision.,https://www.foxnews.com/politics/justice-kavanaughs-attempted-assassin-sentenced-8-years-prison,https://static.foxnews.com/foxnews.com/content/uploads/2025/10/justice-brett-kavanaugh-hearing.jpg,2025-10-03T21:05:37Z,"A federal judge sentenced Nicholas Roske, who now goes by Sophie, to eight years in prison on Friday for attempting to murder Justice Brett Kavanaugh in the weeks leading up to the Supreme Courts lan… [+3614 chars]",fox-news,Fox News
,"Virginia AG candidate once referenced putting ‘two bullets to the head’ of GOP leader, texts show",Text messages show Virginia attorney general candidate Jay Jones made violent remarks about former House Speaker Todd Gilbert in 2022 conversation with lawmaker.,https://www.foxnews.com/politics/virginia-ag-candidate-once-referenced-putting-two-bullets-head-gop-leader-texts-show,https://static.foxnews.com/foxnews.com/content/uploads/2025/10/jay-jones-and-todd-gilbert-from-virginia-1.jpg,2025-10-03T21:01:04Z,Virginia Democratic attorney general candidate Jay Jones once remarked on shooting the then-Virginia House Speaker in texts with another lawmaker: the latest example of charged political rhetoric som… [+4935 chars],fox-news,Fox News
,Convicted killer of 6-year-old boy walks free after serving less than half his 20-year sentence,A Kentucky man who broke into a home and fatally stabbed 6-year-old Logan Tipton in 2015 was released on parole Tuesday after serving seven years in prison.,https://www.foxnews.com/us/convicted-killer-6-year-old-boy-walks-free-after-serving-less-than-half-his-20-year-sentence,https://static.foxnews.com/foxnews.com/content/uploads/2025/10/ronald-exantus.jpg,2025-10-03T20:40:39Z,"A 42-year-old man convicted in the killing of a 6-year-old boy in Kentucky after he broke into the child's home in 2015 has been released on parole. 
Ronald Exantus, 42, was sentenced to 20 years af… [+1180 chars]",fox-news,Fox News
,Johnson sends critical signal to Schumer as Dems dig in on government shutdown chaos,House Speaker Mike Johnson is raising stakes against Senate Minority Leader Chuck Schumer over government funding as Democrats demand Obamacare subsidies.,https://www.foxnews.com/politics/johnson-sends-critical-signal-schumer-dems-dig-government-shutdown-chaos,https://static.foxnews.com/foxnews.com/content/uploads/2025/09/schumer-johnson-shutdown.jpg,2025-10-03T20:36:45Z,"Speaker Mike Johnson, R-La., is sending a pointed signal to Senate Minority Leader Chuck Schumer, D-N.Y., as the 2025 government shutdown is poised to enter a second week.
The leader of the House of… [+3791 chars]",fox-news,Fox News
,Robert Griffin III 'thankful to God' after family gets into 'worst car accident of our lives',"Former NFL quarterback Robert Griffin III and his family were involved in a serious car accident in Fort Worth, Texas, that he said was the ""worst"" he's ever experienced.",https://www.foxnews.com/sports/robert-griffin-iii-thankful-god-after-family-gets-worst-car-accident-our-lives,https://static.foxnews.com/foxnews.com/content/uploads/2025/10/robert-griffin-on-field-10325.jpg,2025-10-03T20:32:27Z,"Robert Griffin III said he was involved in a ""scary crash"" in Fort Worth, Texas, on Friday.
From photos posted on social media by the former NFL quarterback, a white vehicle received the brunt of th… [+1539 chars]",fox-news,Fox News
,Thousands of protestors prompt world-famous landmark to close its doors on tourists,"France's iconic Eiffel Tower shut down Thursday due to strikes, as nearly 200,000 protesters rallied in over 200 towns and cities against government spending cuts.",https://www.foxnews.com/travel/thousands-protestors-prompt-world-famous-landmark-close-its-doors-tourists,https://static.foxnews.com/foxnews.com/content/uploads/2025/10/paris-protest-crowds-busy.jpg,2025-10-03T20:31:32Z,"The world-renowned Eiffel Tower in Paris shut its doors on locals and international tourists on Thursday amid a nationwide strike.
As crowds of protesters marched from Place dItalie toward the Eiffe… [+2361 chars]",fox-news,Fox News
,Blue state gubernatorial nominees trade barbs over crucial issue weeks ahead of Election Day,"New Jersey voters prioritize taxes in the gubernatorial election between Rep. Mikie Sherrill and Jack Ciattarelli, with Sherrill leading by 7 points in Fox News polling.",https://www.foxnews.com/politics/blue-state-gubernatorial-nominees-trade-barbs-over-crucial-issue-weeks-ahead-election-day,https://static.foxnews.com/foxnews.com/content/uploads/2025/09/jack-ciattarelli-and-mikie-sherrill.png,2025-10-03T20:29:02Z,"The Democratic and Republican nominees in a crucial election for governor in New Jersey are trading fire over taxes in one of the most heavily taxed states in the nation.
Rep. Mikie Sherrill, the 20… [+4170 chars]",fox-news,Fox News
,UK police accidentally shot victim while rushing to stop synagogue attacker,"Adrian Daulby, 53, and Melvin Cravitz, 66, died in a synagogue attack on Yom Kippur after Jihad Al Shamie drove into pedestrians and stabbed victims in Manchester.",https://www.foxnews.com/world/uk-police-accidentally-shot-victim-while-rushing-stop-synagogue-attacker,https://static.foxnews.com/foxnews.com/content/uploads/2025/10/woman-crying-synagogue-attack.jpg,2025-10-03T20:20:50Z,"One of the two victims who died in the terrorist attack on a U.K. synagogue on Yom Kippur was accidentally shot by Manchester police as they rushed to subdue the attacker, British officials confirmed… [+2971 chars]",fox-news,Fox News
,Chelsea Clinton launches podcast aimed at debunking health misinformation,"Chelsea Clinton debuted a new podcast addressing vaccine debates, fluoride concerns and raw milk discussions with medical professionals.",https://www.foxnews.com/media/chelsea-clinton-launches-podcast-aimed-debunking-health-misinformation,https://static.foxnews.com/foxnews.com/content/uploads/2025/10/clinton-podcast-health.jpg,2025-10-03T20:20:04Z,"Chelsea Clinton has launched a new podcast she says is based on debunking health misinformation.
In an X post Wednesday, Clinton shared the link to ""That Cant Be True with Chelsea Clinton,"" along wi… [+2697 chars]",fox-news,Fox News
,Hamas agrees to release all Israeli hostages outlined in Trump Gaza peace deal: report,President Donald Trump's Gaza proposal prompts Hamas to agree to hostage release following his warning that leaders face death if hostages aren't freed by Sunday.,https://www.foxnews.com/politics/hamas-agrees-release-israeli-hostages-outlined-trump-gaza-peace-deal,https://static.foxnews.com/foxnews.com/content/uploads/2025/05/edan-alexander.jpg,2025-10-03T20:14:01Z,"Hamas on Friday announced it agreed to release all Israeli hostages, dead or alive, as part of President Donald Trump's Gaza proposal, Reuters reported.
Leaders also indicated they were prepared to … [+345 chars]",fox-news,Fox News
,Heidi Klum goes nearly nude in sheer gown at Paris Fashion Week,Heidi Klum left little to the imagination when she wore a completely sheer gown to the Vetements womenswear show during Paris Fashion Week.,https://www.foxnews.com/entertainment/heidi-klum-goes-nearly-nude-sheer-gown-paris-fashion-week,https://static.foxnews.com/foxnews.com/content/uploads/2025/10/heidi-klum-black-plunging-dress.jpg,2025-10-03T20:10:46Z,"Heidi Klum is leaving little to the imagination with her latest look at Paris Fashion Week.
The 52-year-old former Victoria's Secret model posed for photos at the Vetements womenswear fashion show i… [+2458 chars]",fox-news,Fox News
,Super Bowl–winning coach questions why third-string QB Shedeur Sanders is getting interviews after viral clip,Super Bowl-winning head coach Bruce Arians questioned why Cleveland Browns third-string quarterback Shedeur Sanders is getting interviews after his viral clip.,https://www.foxnews.com/sports/super-bowl-winning-coach-questions-why-third-string-qb-shedeur-sanders-getting-interviews-after-viral-clip,https://static.foxnews.com/foxnews.com/content/uploads/2025/10/shedeur-sanders-looks-on-browns-lions.jpg,2025-10-03T20:05:09Z,"Cleveland Browns rookie quarterback Shedeur Sanders went viral for pantomiming during a recent interview, reportedly in response to comments made by former head coach Rex Ryan. 
Super Bowl-winning h… [+2705 chars]",fox-news,Fox News
,Families claim teen murder suspect was 'plotting' deadly hit-and-run for months before killing two girls,"A 17-year-old charged with murdering two girls in New Jersey was allegedly ""plotting"" the attacks for months, according to a statement from the victims' families.",https://www.foxnews.com/us/families-claim-teen-murder-suspect-plotting-deadly-hit-and-run-months-before-killing-two-girls,https://static.foxnews.com/foxnews.com/content/uploads/2025/10/nj-murder-split-5.jpg,2025-10-03T20:01:43Z,"The families of two girls who died after authorities said a 17-year-old boy killed them in a hit-and-run incident claim the suspect has been ""plotting"" it for months.
Maria Niotis and Isabella Salas… [+2675 chars]",fox-news,Fox News
,Morgan Wallen was target of Paramore's Hayley Williams' 'racist country singer' lyric,"Paramore singer Hayley Williams confirms her ""racist country singer"" lyric on new album targets Morgan Wallen.",https://www.foxnews.com/entertainment/morgan-wallen-target-of-paramores-hayley-williams-racist-country-singer-lyric,https://static.foxnews.com/foxnews.com/content/uploads/2025/10/hayley-williams-morgan-wallen.jpg,2025-10-03T23:58:24Z,"Paramore singer Hayley Williams confirmed that her ""racist country singer"" lyric on her new album is about Morgan Wallen.
On the New York Times podcast, Williams discussed her album, ""Ego Death at a… [+2884 chars]",fox-news,Fox News
,"Ravens mourn loss of former defensive lineman, Super Bowl champion Arthur Jones","Former Baltimore Ravens star and Super Bowl winner Arthur Jones died, the team announced. He was the brother of retired UFC fighter Jon Jones and former NFL star Chandler Jones.",https://www.foxnews.com/sports/ravens-mourn-loss-former-defensive-lineman-super-bowl-champion-arthur-jones,https://static.foxnews.com/foxnews.com/content/uploads/2025/10/arthur-jones-baltimore-ravens-100325.jpg,2025-10-03T23:56:48Z,"Arthur Jones, a key defensive lineman during the Baltimore Ravens run to the Super Bowl XLVII title, has died, his former team announced Friday. He was 39.
""We are terribly saddened to learn of Arth… [+1561 chars]",fox-news,Fox News
,Arizona girl’s death ruled homicide after being kept in cage at grandmother’s home: report,"The death of 13-year-old Melony Granados, who had epilepsy, has reportedly been ruled a homicide after authorities said she was kept in a makeshift cage at her grandmother’s home.",https://www.foxnews.com/us/arizona-girls-death-ruled-homicide-kept-cage-grandmothers-home-report,https://static.foxnews.com/foxnews.com/content/uploads/2025/10/virginia-lujan-and-home.jpg,2025-10-03T23:39:02Z,"The death of a 13-year-old girl with epilepsy has reportedly been ruled a homicide, after authorities said she had been kept in a ""makeshift cage"" inside her grandmother's Arizona home.
Melony Grana… [+2860 chars]",fox-news,Fox News
,Virginia governor’s race ad stirs ‘Willie Horton’ echoes as early voting hits record pace,A seven figure APP ad tied Abigail Spanberger to a Virginia sex offender case echoing the Willie Horton playbook as early voting reaches record highs.,https://www.foxnews.com/politics/virginia-governors-race-ad-stirs-willie-horton-echoes-early-voting-hits-record-pace,https://static.foxnews.com/foxnews.com/content/uploads/2025/10/new-campaign-ad-targets-spanberger-on-transgender-policies-sex-offenders-around-children.jpg,2025-10-03T23:09:08Z,"FIRST ON FOX: A new seven-figure ad in Virginias governors race is drawing comparisons to the infamous Willie Horton spot of 1988 amid record early voting in the Old Dominion State.
The ad, produced… [+4913 chars]",fox-news,Fox News
,Video captures Charlie Kirk assassination suspect Tyler Robinson during police manhunt in Utah,"Surveillance video shows Tyler Robinson, Charlie Kirk's alleged assassin, at a Utah gas station one day after the conservative influencer was shot at Utah Valley University.",https://www.foxnews.com/us/video-captures-charlie-kirk-assassination-suspect-tyler-robinson-during-police-manhunt-utah,https://static.foxnews.com/foxnews.com/content/uploads/2025/10/tyler-robinson-charlie-kirk-surveillance-footage-utah_02.jpg,2025-10-03T23:03:48Z,"PROVO, Utah Newly released surveillance video obtained by Fox News Digital shows Charlie Kirks alleged assassin at a Utah gas station one day after the conservative influencer was gunned down while s… [+2303 chars]",fox-news,Fox News
,TCU denies anti-Christian discrimination claim leveled by Chloe Cole after dust-up over Turning Point event,"Texas Christian University disputed claims over a canceled Chloe Cole event, saying the Oct. 7 Turning Point USA gathering was never officially booked.",https://www.foxnews.com/media/tcu-denies-anti-christian-discrimination-claim-leveled-chloe-cole-after-dust-up-over-turning-point-event,https://static.foxnews.com/foxnews.com/content/uploads/2025/10/chloe-cole-tcu.jpg,2025-10-03T23:00:58Z,"Chloe Cole, a detransitioner who talks about transgender issues, accused Texas Christian University of viewpoint discrimination, claiming the institution made the process difficult for Turning Point … [+3053 chars]",fox-news,Fox News
,Virginia school board member compares Turning Point USA to KKK over transgender event,Albemarle County school board representative Allison Spillman faced sharp criticism for comparing a local Turning Point USA chapter to the KKK.,https://www.foxnews.com/media/virginia-school-board-member-under-fire-after-comparing-tpusa-kkk,https://static.foxnews.com/foxnews.com/content/uploads/2022/07/GettyImages-1242060086.jpg,2025-10-03T23:00:07Z,"A Virginia school board member is under fire for comparing Turning Point USA to the KKK, a local outlet reported.
The TPUSA chapter at Western Albemarle High School scheduled an event titled ""Two Ge… [+4219 chars]",fox-news,Fox News
,Michigan church shooting bodycam video shows police confront gunman,"Michigan police released body camera video of the officers responding to the shooting in Grand Blanc, Michigan, at a Church of Jesus Christ of Latter-day Saints.",https://www.foxnews.com/us/michigan-church-shooting-bodycam-video-shows-police-confront-gunman,https://static.foxnews.com/foxnews.com/content/uploads/2025/10/mi-bodycam-1.jpg,2025-10-03T22:12:31Z,"Police in Michigan released body camera video from officers who responded to the shooting at the Church of Jesus Christ of Latter-day Saints, eventually killing the gunman.
Thomas Jacob Sanford is a… [+2323 chars]",fox-news,Fox News
,"Kristi Noem torches NFL as 'weak,' vows ICE will show up at Super Bowl amid Bad Bunny scandal",Secretary Kristi Noem promises immigration enforcement at Super Bowl 60 in Santa Clara while condemning the NFL's decision to feature Bad Bunny at halftime.,https://www.foxnews.com/politics/kristi-noem-torches-nfl-weak-vows-ice-show-super-bowl-bad-bunny-scandal,https://static.foxnews.com/foxnews.com/content/uploads/2025/07/noem-ice.png,2025-10-03T22:07:26Z,"Homeland Security Secretary Kristi Noem said immigration authorities will enforce the law at Super Bowl 60 at Levi's Stadium in Santa Clara, California, before criticizing the NFL, which she said was… [+2127 chars]",fox-news,Fox News
,Netflix executive's pro-transgender social media posts surface during kid's content controversy,"A Netflix executive’s past social media posts about transgender people have come to light as conservatives have grown furious at the streaming giant pushing “gender ideology"" on kids.",https://www.foxnews.com/media/netflix-executives-pro-transgender-social-media-posts-surface-during-kids-content-controversy,https://static.foxnews.com/foxnews.com/content/uploads/2025/10/wade-davis-netflix.jpeg,2025-10-03T22:00:26Z,"A Netflix executives past social media posts about transgender people, including children, have come to light as some conservatives have grown furious at the streaming giant pushing ""woke Democrat ge… [+4090 chars]",fox-news,Fox News
