author,title,description,url,urlToImage,publishedAt,content,source.id,source.name
Julius Young,Billie Eilish leaves fans upset after star announces tour refunds instead of being able to use passes later,Fans of Billie Eilish are saddened after the pop star announced on Thursday that those who bought tickets to her tour will not be able to use them at a later date and instead will be refunded their money.,https://www.foxnews.com/entertainment/billie-eilish-fans-ticket-refunds-tour-coronavirus,https://static.foxnews.com/foxnews.com/content/uploads/2020/11/2b0c7e0d-Billie-Eilish-oscars.jpg,2020-12-04T08:35:12Z,Billie Eilish recently announced to her fans that any tickets they’re currently holding onto for her 2020 “Where Do We Go?” world tour will be refunded since she is unable to perform due to the ongoi… [+4203 chars],fox-news,Fox News
Howard Kurtz,Virus surge turns deadlier as Democratic bigwigs break the rules,"After nine months of blaming the pandemic on President Trump, some Democrats are turning out to be utter hypocrites.",https://www.foxnews.com/media/virus-surge-turns-deadlier-as-democratic-bigwigs-break-the-rules,https://cf-images.us-east-1.prod.boltdns.net/v1/static/694940094001/49153cea-fbf2-46dc-8cd3-67b7224cb895/aa7460c0-3889-4aa4-a014-b2b5cd22499d/1280x720/match/image.jpg,2020-12-04T08:25:28Z,"After nine months of blaming the pandemic on President Trump, some Democrats are turning out to be utter hypocrites.
They preach about masks and social distancing and blunting the devastation from t… [+4589 chars]",fox-news,Fox News
Dom Calicchio,"Maxine Waters’ campaign paid her daughter $240G over 2019-20 election cycle, FEC records show","The reelection of U.S. Rep. Maxine Waters to another term in Congress last month proved to be something of a financial windfall for Karen Waters, the California Democrat's daughter, federal election data suggest.",https://www.foxnews.com/politics/maxine-waters-campaign-paid-her-daughter-240g-over-2019-20-election-cycle-fec-records-show,https://media2.foxnews.com/BrightCove/694940094001/2019/10/03/694940094001_6091899381001_6091900574001-vs.jpg,2020-12-04T08:22:49Z,"The reelection of U.S. Rep. Maxine Waters to another term in Congress last month proved to be something of a financial windfall for Karen Waters, the California Democrat's daughter, federal election … [+3437 chars]",fox-news,Fox News
Associated Press,Texas high school football player attacks referee,"A Texas high school football player charged onto the field and bowled over a referee Thursday night, angered after being ejected from the game.",https://www.foxnews.com/sports/texas-prep-football-player-attacks-referee,https://static.foxnews.com/foxnews.com/content/uploads/2020/12/Football-iStock-2.jpg,2020-12-04T08:14:09Z,"A Texas high school football player charged onto the field and bowled over a referee Thursday night, angered after being ejected from the game.
Senior defensive lineman Emmanuel Duron of Edinburg Hi… [+715 chars]",fox-news,Fox News
Stephanie Pagones,US Marshals hurt in New York City shootout: reports,"A handful of agents from the U.S. Marshals Service were hurt Friday morning while exchanging gunfire with at least two suspects in New York City, according to reports.",https://www.foxnews.com/us/us-marshals-hurt-new-york-city-shootout-report,https://static.foxnews.com/foxnews.com/content/uploads/2020/09/Crime-Scene-iStock.jpg,2020-12-04T11:30:35Z,"A handful of agents from the U.S. Marshals Service were hurt Friday morning while exchanging gunfire with at least two suspects in New York City, according to reports.
It was not clear how many agen… [+524 chars]",fox-news,Fox News
Associated Press,Tokyo Olympics delay costs may reach $2.8 billion,"The cost of the postponement for the Tokyo Olympics could reach about $2.8 billion, according to figures released Friday by the Tokyo organizing committee, the Tokyo city government and Japan’s national government.",https://www.foxnews.com/sports/tokyo-olympics-delay-costs-may-reach-2-8-billion,https://static.foxnews.com/foxnews.com/content/uploads/2020/04/Olympic-rings2.jpg,2020-12-04T11:26:42Z,"The cost of the postponement for the Tokyo Olympics could reach about $2.8 billion, according to figures released Friday by the Tokyo organizing committee, the Tokyo city government and Japan’s natio… [+1559 chars]",fox-news,Fox News
Associated Press,No. 25 Arizona State holds off Cal 70-62 in Pac-12 opener,Remy Martin and his supporting cast delivered down the stretch each time California threatened.,https://www.foxnews.com/sports/no-25-arizona-state-holds-off-cal-70-62-in-pac-12-opener,https://static.foxnews.com/foxnews.com/content/uploads/2020/12/Josh-Christopher.jpg,2020-12-04T11:23:24Z,"Remy Martin and his supporting cast delivered down the stretch each time California threatened.
Martin produced another impressive performance on Cal's home floor, finishing with 22 points, five ass… [+3682 chars]",fox-news,Fox News
Associated Press,"Garza, Nunge lead No. 3 Iowa past Western Illinois, 99-58","Luka Garza and Jack Nunge came to Iowa in the same recruiting class. It’s a connection that Garza, the Big Ten player of the year last season, appreciates.",https://www.foxnews.com/sports/garza-nunge-lead-no-3-iowa-past-western-illinois-99-58,https://static.foxnews.com/foxnews.com/content/uploads/2020/12/Luka-Garza.jpg,2020-12-04T11:19:30Z,"Luka Garza and Jack Nunge came to Iowa in the same recruiting class. It’s a connection that Garza, the Big Ten player of the year last season, appreciates.
And with Nunge now back with the Hawkeyes,… [+3426 chars]",fox-news,Fox News
Associated Press,"Twins, closer Rogers agree to $6 million contract","The Minnesota Twins and closer Taylor Rogers agreed to terms Thursday on a $6 million, one-year contract, according to a person with knowledge of the deal.",https://www.foxnews.com/sports/twins-closer-rogers-agree-to-6-million-contract,https://static.foxnews.com/foxnews.com/content/uploads/2020/12/Taylor-Rogers.jpg,2020-12-04T11:13:56Z,"The Minnesota Twins and closer Taylor Rogers agreed to terms Thursday on a $6 million, one-year contract, according to a person with knowledge of the deal.
The person spoke to The Associated Press o… [+1311 chars]",fox-news,Fox News
Associated Press,No. 8 North Carolina State women beat No. 1 South Carolina,North Carolina State coach Wes Moore channeled two-time Super Bowl-winning coach Bill Parcells after the Wolfpack's landmark victory over No. 1 South Carolina.,https://www.foxnews.com/sports/no-8-north-carolina-state-women-beat-no-1-south-carolina,https://static.foxnews.com/foxnews.com/content/uploads/2020/12/NC-State-women-bball.jpg,2020-12-04T11:10:13Z,"North Carolina State coach Wes Moore channeled two-time Super Bowl-winning coach Bill Parcells after the Wolfpack's landmark victory over No. 1 South Carolina.
Raina Perez hit a go-ahead 3-pointer w… [+3880 chars]",fox-news,Fox News
Associated Press,No. 14 Maryland women make Big Ten record 21 3-pointers,"Diamond Miller scored a career-high 28 points, Katie Benzan added 21, and the duo combined for 11 of Maryland's Big Ten record 21 3-pointers as the No. 14 Terrapins beat Towson 112-78 on Thursday night.",https://www.foxnews.com/sports/no-14-maryland-women-make-big-ten-record-21-3-pointers,https://static.foxnews.com/foxnews.com/content/uploads/2020/12/Mimi-Collins.jpg,2020-12-04T11:05:24Z,"Diamond Miller scored a career-high 28 points, Katie Benzan added 21, and the duo combined for 11 of Maryland's Big Ten record 21 3-pointers as the No. 14 Terrapins beat Towson 112-78 on Thursday nig… [+1141 chars]",fox-news,Fox News
Art Acevedo,Houston Police Chief Art Acevedo: Alejandro Mayorkas is good choice by Biden to head Homeland Security,President-elect Joe Biden’s nomination of Alejandro Mayorkas to head the Department of Homeland Security (DHS) is welcome news for America’s law enforcement community.,https://www.foxnews.com/opinion/alejandro-mayorkas-homeland-security-art-acevedo,https://static.foxnews.com/foxnews.com/content/uploads/2020/11/Alejandro-Mayorkas.jpg,2020-12-04T11:00:06Z,President-elect Joe Biden’s nomination of Alejandro Mayorkas to head the Department of Homeland Security (DHS) is welcome news for America’s law enforcement community. Mayorkas — who served as deputy… [+3893 chars],fox-news,Fox News
Dom Calicchio,"Florida man poured gasoline on woman, set her on fire, authorities say","A Florida woman was in critical condition Thursday in a Miami hospital, being treated for second- and third-degree burns, three days after a man allegedly poured gasoline on her and use a cigarette lighter to set her on fire, according to a report.",https://www.foxnews.com/us/florida-man-poured-gasoline-on-woman-set-her-on-fire-authorities-say,https://static.foxnews.com/foxnews.com/content/uploads/2020/12/6ff31ab3-loo2.jpg,2020-12-04T10:47:59Z,"A Florida woman was in critical condition Thursday in a Miami hospital, being treated for second- and third-degree burns, three days after a man allegedly poured gasoline on her and use a cigarette l… [+1276 chars]",fox-news,Fox News
Brie Stimson,UK health official says mask wearing in nation may persist for 'many years',British Prime Minister Boris Johnson openly disagreed Wednesday with the country’s deputy chief medical officer Jonathan Van-Tam in a coronavirus news briefing after he said Britons might have to wear masks “for years.”,https://www.foxnews.com/world/boris-johnson-top-health-expert-clash-on-wearing-masks-for-years-during-coronavirus-briefing,https://static.foxnews.com/foxnews.com/content/uploads/2020/12/AP20337734638842.jpg,2020-12-04T10:45:13Z,British Prime Minister Boris Johnson openly disagreed Wednesday with the country’s deputy chief medical officer Jonathan Van-Tam in a coronavirus news briefing after he said Britons might wear masks … [+1120 chars],fox-news,Fox News
Associated Press,Fauci apologizes for suggesting UK authorities rushed their authorization of a COVID-19 vaccine,"America’s top infectious disease expert has apologized for suggesting U.K. authorities rushed their authorization of a COVID-19 vaccine, saying he has “great faith” in the country’s regulators.",https://www.foxnews.com/us/fauci-apologizes-for-suggesting-uk-authorities-rushed-their-authorization-of-a-covid-19-vaccine,https://static.foxnews.com/foxnews.com/content/uploads/2020/11/GettyImages-1209567364.jpg,2020-12-04T10:15:13Z,"LONDON — America’s top infectious disease expert has apologized for suggesting U.K. authorities rushed their authorization of a COVID-19 vaccine, saying he has “great faith” in the country’s regulato… [+2186 chars]",fox-news,Fox News
Jack Durschlag,"Trump camp points to Nevada, claims evidence of 'double votes,' dead people's names on ballots",,https://www.foxnews.com/us/trump-camp-points-to-nevada-claims-evidence-of-double-votes-dead-peoples-names-on-ballots,https://static.foxnews.com/foxnews.com/content/uploads/2020/11/AP20308557453445.jpg,2020-12-04T10:00:51Z,"Good morning and welcome to Fox News First. Here's what you need to know as you start your day ...
Trump camp points to Nevada, claims evidence of 'double votes,' dead people's names on ballotsThe T… [+7048 chars]",fox-news,Fox News
Stephanie Nolasco,"Marlene Dietrich, icon of Hollywood’s golden era, was a proud patriot, grandson shares",Marlene Dietrich earned the Presidential Medal of Freedom in 1945.,https://www.foxnews.com/entertainment/marlene-dietrich-wwii-proud-patriot,https://static.foxnews.com/foxnews.com/content/uploads/2020/12/GettyImages-180962862.jpg,2020-12-04T10:00:39Z,"Marlene Dietrich is celebrated as one of Hollywood’s most glamorous movie stars, but the Berlin-born actress preferred being on the front lines with troops fighting during World War II.
“She was hap… [+4878 chars]",fox-news,Fox News
Stephanie Nolasco,"Emilie Morris, the former student who died after accusing her coach of abuse, becomes focus of true-crime doc",Emilie Morris was due to appear in court shortly before her 2014 death.,https://www.foxnews.com/entertainment/emilie-morris-true-crime-doc,https://static.foxnews.com/foxnews.com/content/uploads/2020/12/AQ_0186_Em_Blacknwhite_pic.jpg,2020-12-04T10:00:24Z,"Emilie Morris was due to appear in court regarding charges made against her former high school coach when she was found dead in 2014 at her apartment.
An autopsy ruled that the 35-year-old mother of… [+8195 chars]",fox-news,Fox News
Rick Scott,Sen. Rick Scott: Trump’s Florida election victory has important lesson for Republicans nationwide,"Republicans have built a multi-ethnic, working-class coalition of Florida voters who don’t like big government, don’t like socialism and just want the opportunity to live their lives in freedom and peace.",https://www.foxnews.com/opinion/sen-rick-scott-trumps-florida-election-victory-has-important-lessons-for-republicans-nationwide,https://media.foxbusiness.com/BrightCove/854081161001/202011/3924/854081161001_6209458413001_6209458911001-vs.jpg,2020-12-04T10:00:22Z,President Trump’s decisive election victory in my home state of Florida offers an important lesson for Republicans nationwide: If we show voters that Republicans are the party of working-class Americ… [+4647 chars],fox-news,Fox News
Jonah Blocker,Solving The Big Fat Drug Problem,"This week, Kennedy discusses how a change in perspective could help solve the problem with drugs in the United States. She discusses the problem with the United States focusing on the supply of drugs rather than the demand, how Oregon has chosen to follow the…",https://radio.foxnews.com/2020/12/04/solving-the-big-fat-drug-problem/,https://radio.foxnews.com/wp-content/uploads/2020/10/FEATURED_IMAGE_Kennedy_Saves_The_World-1.png,2020-12-04T10:00:19Z,"This week, Kennedy discusses how a change in perspective could help solve the problem with drugs in the United States.
She discusses the problem with the United States focusing on the supply of drug… [+224 chars]",fox-news,Fox News
Stephanie Nolasco,"‘Moonshiners’ stars Mark Ramsey, Digger Manes reveal why sales are booming during pandemic: ‘It’s a win-win’","The distillers of backwoods Appalachia revealed the American hooch has been in greater demand during tough times, increasing demand for new recipes.",https://www.foxnews.com/entertainment/moonshiners-mark-ramsey-digger-manes-pandemic-sales-booming,https://static.foxnews.com/foxnews.com/content/uploads/2020/12/release_2.jpg,2020-12-04T10:00:06Z,"EXCLUSIVE: The ongoing coronavirus pandemic has crippled thousands of businesses across the country, but for modern moonshiners, they say sales have been booming.
The distillers of backwoods Appalac… [+5068 chars]",fox-news,Fox News
William Sanchez,President Trump is Not Going Down Without a Fight… or Several Fights,"We're now a month and a day since the Presidential election and President Trump is insisting that if only legal voters were counted, he would be re-elected. The courts have not agreed so far, but that is not stopping the President. Chris Wallace, host of Fox …",https://radio.foxnews.com/2020/12/04/the-fox-news-rundown-12-4-2020/,https://radio.foxnews.com/wp-content/uploads/2020/05/Rundown-Featured-Image-NEW.png,2020-12-04T10:00:03Z,"We're now a month and a day since the Presidential election and President Trump is insisting that if only legal voters were counted, he would be re-elected. The courts have not agreed so far, but tha… [+1170 chars]",fox-news,Fox News
Gary Gastelu,Ford's 'super-secret' Megazilla V8 will be a monster motor,Ford is working on a powerful new engine it calls the Megazilla that will be even more potent than its current Godzilla V8. The crate motor will be sold for racing and custom car applications.,https://www.foxnews.com/auto/fords-super-secret-megazilla-v8,https://static.foxnews.com/foxnews.com/content/uploads/2020/12/godzilla.jpg,2020-12-04T13:54:48Z,"In the spirit of monster movies, Ford is working on a sequel to its “Godzilla” engine.
The appropriately nicknamed 7.3-liter V8 debuted on the 2020 F-Series Super Duty pickup but is also available f… [+1239 chars]",fox-news,Fox News
Melissa Roberto,'Wheel of Fortune' viewers concerned over Pat Sajak's recent 'feisty' behavior: He 'clearly hates his job',"""Wheel of Fortune"" viewers are questioning if Pat Sajak is ""OK"" after the game show host had yet another awkward encounter with a contestant on Thursday night.",https://www.foxnews.com/entertainment/wheel-of-fortune-fans-concerned-pat-sajak-feisty-behavior-hates-job,https://static.foxnews.com/foxnews.com/content/uploads/2018/10/PatSajak.jpg,2020-12-04T13:53:37Z,"Pat Sajak left dozens of  “Wheel of Fortune” fans mystified on Thursday night after the longtime host clapped back at a contestant for the third time in less than 10 days.
The episode that aired on … [+5092 chars]",fox-news,Fox News
Jessica Napoli,'Black Panther' star Letitia Wright criticized for controversial anti-vaxxer tweet,Fans were angry at her for using her social media platform to spread misinformation on vaccines.,https://www.foxnews.com/entertainment/letitia-wright-criticized-anti-vaxxer-tweet,https://static.foxnews.com/foxnews.com/content/uploads/2018/12/LetitiaWright1.jpg,2020-12-04T13:44:11Z,"“Black Panther” star Letitia Wright is under fire for some of her recent tweets.
The 27-year-old actress, who plays tech genius Shuri and sister to T'Challa in the Marvel movie, retweeted a video on… [+2421 chars]",fox-news,Fox News
Fox News,LIVE UPDATES: LA County sheriff says deputies won't enforce governor's stay-at-home order - Fox News,"<ol><li>LIVE UPDATES: LA County sheriff says deputies won't enforce governor's stay-at-home order  Fox News
</li><li>California issues regional stay-at-home order to battle record Covid-19 surge  CNN
</li><li>Newsom Issues California's Strongest Coronavirus…",https://www.foxnews.com/health/live-updates-coronavirus-cases-vaccine-12-4-2020,https://static.foxnews.com/foxnews.com/content/uploads/2020/12/19c4f95e-covid-positive-.jpg,2020-12-04T13:16:21Z,"Los Angeles County Sheriff Alex Villanueva said his deputies won't enforce a new statewide stay-at-home order announced by Gov. Gavin Newsom Thursday.
The order came as cases have surged across the … [+894 chars]",fox-news,Fox News
Brooke Crothers,5 safe shopping tips for the holidays from experts,Scammers and cybercriminals love the holidays because it gives them more opportunities to steal your data and your money.,https://www.foxnews.com/tech/5-safe-shopping-tips-for-the-holidays,https://static.foxnews.com/foxnews.com/content/uploads/2018/09/komando2.jpg,2020-12-04T13:07:30Z,"Scammers and cybercriminals love the holidays because it gives them more opportunities to steal your data and your money.
In an effort to stay safe, Fox News has compiled a list of five tips to look… [+3072 chars]",fox-news,Fox News
Brooke Singman,Dr. Fauci says he 'absolutely' accepted offer to be Biden's chief medical adviser,"President-elect Joe Biden asked Dr. Anthony Fauci to serve as his chief medical adviser, a role the director of the National Institute of Allergy and Infectious Diseases (NIAID) said he “absolutely” accepted.",https://www.foxnews.com/politics/dr-fauci-accepted-offer-biden-chief-medical-adviser,https://cf-images.us-east-1.prod.boltdns.net/v1/static/694940094001/44ec5c54-5fac-46f6-b307-5b43cd4dc46c/d578bef7-c259-44b3-846c-7d0be3c01dcc/1280x720/match/image.jpg,2020-12-04T13:04:12Z,"President-elect Joe Biden asked Dr. Anthony Fauci to serve as his chief medical adviser, a role the director of the National Institute of Allergy and Infectious Diseases (NIAID) said he “absolutely” … [+2878 chars]",fox-news,Fox News
Ryan Gaydos,NFL Week 13 preview: Several teams could clinch playoff spots with victories,"The 2020 NFL season is entering its 13th week, and with a little less chaos so far than Week 12.",https://www.foxnews.com/sports/nfl-week-13-preview-2020,https://static.foxnews.com/foxnews.com/content/uploads/2020/12/Eagles-opener.jpg,2020-12-04T12:55:31Z,"The 2020 NFL season is entering its 13th week, and with a little less chaos so far than Week 12.
The only games the league has had to move around are the games involving the Baltimore Ravens and Pit… [+9583 chars]",fox-news,Fox News
Kayla Rivas,"CDC director OKs coronavirus vaccine plan for health care workers, long-term care residents","Dr. Robert Redfield, director of the Centers for Disease Control and Prevention (CDC), has upheld a vote by a panel of independent experts that health care workers and residents of long-term care facilities should be the first to receive the long-awaited coro…",https://www.foxnews.com/health/redfield-oks-coronavirus-vaccine-plan-cdc,https://static.foxnews.com/foxnews.com/content/uploads/2020/08/gettyimages-Robert-Redfield-.jpg,2020-12-04T12:50:54Z,"Dr. Robert Redfield, director of the Centers for Disease Control and Prevention (CDC), has upheld a vote by a panel of independent experts that health care workers and residents of long-term care fac… [+2054 chars]",fox-news,Fox News
Brian Flood,Critics call out media's 'overtly flattering' approach to covering Biden appointments,"President-elect Joe Biden has received “overtly flattering” treatment from the mainstream media, especially when he selects staffers, but critics worry that liberal journalists are going overboard when sucking up to Amtrak Joe.",https://www.foxnews.com/media/critics-media-overtly-flattering-approach-joe-biden-coverage,https://static.foxnews.com/foxnews.com/content/uploads/2020/11/AP20321761004454.jpg,2020-12-04T12:30:41Z,"President-elect Joe Biden has received “overtly flattering” treatment from the mainstream media, especially on his selection of Cabinet members, but critics worry that liberal journalists are going o… [+6136 chars]",fox-news,Fox News
Sally Pipes,Sally Pipes: Officials ignore their own stay-at-home COVID-19 restrictions — it’s infuriating,"Any successful plan for ending the pandemic will require Americans to trust their government officials. For that to happen, officials need to start practicing what they preach.",https://www.foxnews.com/opinion/covid-restrictions-officials-ignore-sally-pipes,https://cf-images.us-east-1.prod.boltdns.net/v1/static/694940094001/563fc36e-2961-40c0-a948-5afcc781f91a/16031a4f-1f67-4519-9325-9107c295906e/1280x720/match/image.jpg,2020-12-04T12:00:09Z,Many elected officials have told Americans for months to stay home and forego everything from religious gatherings and team sports to holiday dinners and even funerals to stem the spread of the coron… [+3730 chars],fox-news,Fox News
Gary Gastelu,Washington cops catch driver using flashlights as headlights,Washington police ticketed a driver for replacing their damaged car's headlights with flashlights. The scofflaw was also operating the vehicle with a suspended license.,https://www.foxnews.com/auto/washington-cops-flashlights-headlights,https://static.foxnews.com/foxnews.com/content/uploads/2020/12/head1.jpg,2020-12-04T15:37:08Z,"This may have not been the brightest idea.
(WSP)
The Washington State Patrol ticketed a driver this week for using flashlights as headlights on their damaged Chevrolet Impala.
(WSP)
Public Inform… [+597 chars]",fox-news,Fox News
Michael Bartiromo,Hanging lights on the Christmas tree: Should you try stringing them vertically this year?,"If you haven’t decorated your tree yet, you might want to consider an idea that’s gaining traction on social media -- hanging your Christmas lights vertically, instead of wrapping them around the branches horizontally.",https://www.foxnews.com/lifestyle/hanging-lights-christmas-tree-try-vertical-stringing-this-year,https://static.foxnews.com/foxnews.com/content/uploads/2020/12/ChristmasLightsiStock.jpg,2020-12-04T15:33:01Z,"Every year, you put your best Christmas ornaments on the “show” side of the tree, and leave your lesser-favored baubles — like that papier-mâché Santa your nephew made in pre-school — for the back. (… [+2300 chars]",fox-news,Fox News
Chris Ciaccia,"Leaked reports from Pentagon UFO task force discuss 'non-human technology,' mysterious objects","Two classified reports from the Pentagon's task force used to ""detect, analyze and catalog"" UFOs have been leaked, one of which includes a photo of an unidentified silver “cube-shaped” object.",https://www.foxnews.com/science/leaked-pentagon-ufo-task-force-reports-non-human-technology-silver-cube,https://static.foxnews.com/foxnews.com/content/uploads/2020/04/UFO-iStock.jpg,2020-12-04T15:32:09Z,"Two classified reports from the Pentagon's task force used to ""detect, analyze and catalog"" UFOs have been leaked, both of which include photos of unidentified objects.
Defense news website TheDebri… [+5153 chars]",fox-news,Fox News
Ryan Gaydos,Jake Paul 'dedicating his life' to beating this UFC star after knocking out Nate Robinson,Jake Paul had an impressive performance in his bout against ex-NBA guard Nate Robinson over the weekend in one of the fights before Mike Tyson battled Roy Jones Jr.,https://www.foxnews.com/sports/jake-paul-dedicating-his-life-beating-ufc-star,https://static.foxnews.com/foxnews.com/content/uploads/2020/12/Jake-Paul.jpg,2020-12-04T15:31:14Z,"Jake Paul had an impressive performance in his bout against ex-NBA guard Nate Robinson over the weekend in one of the fights before Mike Tyson battled Roy Jones Jr.
Paul, a 23-year-old YouTube star,… [+1427 chars]",fox-news,Fox News
