author,title,description,url,urlToImage,publishedAt,content,source.id,source.name
Laura Sargeant,Laura Sargeant: Celebrating July 4th as a military spouse living overseas,"Looking back, I had no idea how significant the Fourth of July would be to our family. It represents the origin of our love story, the origin of our country and the beginning of our lives of service.",https://www.foxnews.com/opinion/military-spouse-living-overseas-july-4th-laura-sargeant,https://static.foxnews.com/foxnews.com/content/uploads/2020/07/2020_6_SAF_JULY4TH_1.jpg,2020-07-04T13:00:11Z,"If you had asked me a few years ago, ‘what holiday represents love to you,’ like most people, my automatic answer would’ve been Valentine’s Day. For most Americans, that is exactly how they feel. Cho… [+4355 chars]",fox-news,Fox News
Vandana Rambaran,2 women struck by car on Seattle highway closed amid protests,"A vehicle plowed through a protest-related closure on a Seattle's Interstate-5 striking multiple protesters, including two women who both sustained serious injuries, police said Saturday.",https://www.foxnews.com/us/2-women-hit-by-car-on-seattle-highway-closed-amid-protests,https://static.foxnews.com/foxnews.com/content/uploads/2020/07/Car-Washington-State-Patrol-District-2-PIO.jpg,2020-07-04T12:56:40Z,"A vehicle plowed through a protest-related closure on a Seattle freeway, striking multiple protesters, including two women who suffered serious injuries, police said Saturday.
SEATTLE POLICE ARREST … [+1387 chars]",fox-news,Fox News
Julia Musto,Our Community Salutes recognizes future service members this July 4th with virtual ceremony,"Celebrities and public figures have teamed up for a new virtual program on the Fourth of July to recognize the 150,000 recent high school graduates who enlisted in the U.S. military.",https://www.foxnews.com/media/our-community-salutes-recognizes-future-service-members-july-4th,https://static.foxnews.com/foxnews.com/content/uploads/2018/09/a51563b7-June-2006.jpg,2020-07-04T12:56:32Z,"Celebrities and public figures have teamed up for a new virtual program on the Fourth of July to recognize the 150,000 recent high school graduates who enlisted in the U.S. military.
In a Saturday i… [+2367 chars]",fox-news,Fox News
Julia Musto,"Dr. Janette Nesheiwat's July 4th dos and don'ts: Precautions will help keep friends, family safe","As Americans gather for Independence Day celebrations amidst the coronavirus pandemic, there are some key health and safety precautions to take that could mean the difference between spreading the virus and a fun weekend amongst friends and family.",https://www.foxnews.com/media/dr-janette-nesheiwat-covid-19-july-fourth-dos-and-donts,https://static.foxnews.com/foxnews.com/content/uploads/2019/06/Summer-fireworks.jpg,2020-07-04T12:40:01Z,"As we celebrate Independence Day with friends and family, there are simple precautions all of us should take to keep coronavirus at bay.
Dr. Janette Nesheiwat offered some ""dos and don'ts"" Saturday … [+2468 chars]",fox-news,Fox News
Alveda King,Alveda King: Independence Day aspirations — the challenge to strive for that more perfect union,"On the Fourth of July we celebrate the birth of our nation, a nascent state determined to be something different.",https://www.foxnews.com/opinion/independence-day-aspirations-more-perfect-union-alveda-king,https://static.foxnews.com/foxnews.com/content/uploads/2018/09/7acf3bcb-072516_independence-hall_at-dusk_dnc_philadelphia_pa_day-1-.jpg,2020-07-04T12:00:31Z,"On Independence Day we celebrate the birth of our nation, a nascent state determined to be something different, something better than the nations left behind by those early settlers who first made th… [+3959 chars]",fox-news,Fox News
Adam Shaw,"Hillary Clinton, citing ‘dark times,’ urges Americans to register to vote in Independence Day message","Former 2016 presidential candidate Hillary Clinton on Saturday, cited “dark times” in an Independence Day message, and urged Americans to march and register to vote.",https://www.foxnews.com/politics/hillary-clinton-dark-times-independence-day,https://cf-images.us-east-1.prod.boltdns.net/v1/static/694940094001/09004343-3ec4-486f-a21a-88b9d2da4416/928ff0b7-6fe0-4268-8bab-9a52d270fac9/1280x720/match/image.jpg,2020-07-04T15:45:29Z,"Former 2016 presidential candidate Hillary Clinton on Saturday, cited “dark times” in an Independence Day message, and urged Americans to march and register to vote.
“In dark times, it's important t… [+1268 chars]",fox-news,Fox News
Melissa Roberto,Nick Cordero's wife says she doesn't know if he will 'ever be able to work again',Nick Cordero's wife shared a somber update about his health as he remains in the ICU battling complications related to the coronavirus.,https://www.foxnews.com/entertainment/nick-cordero-wife-doesnt-know-if-he-will-ever-work-again-coronavirus,https://static.foxnews.com/foxnews.com/content/uploads/2020/07/Nick-Cordero-Amanda-Kloots_Getty.jpg,2020-07-04T15:42:44Z,"Nick Cordero's wife shared a somber update about his health as he remains in the ICU battling complications related to the coronavirus.
Amanda Kloots took to her Instagram Story on Friday to communi… [+2885 chars]",fox-news,Fox News
Vandana Rambaran,Record number of people buying fireworks this Fourth of July amid coronavirus restrictions,"Fourth of July festivities around the country have been pared down in many states due to the continuing threat of coronavirus, and officials from the National Fireworks Association say people are buying fireworks ""more than ever before"" this year for personal…",https://www.foxnews.com/us/people-are-buying-fireworks-more-than-ever-for-this-years-fourth-of-july-amidst-coronavirus-restrictions,https://static.foxnews.com/foxnews.com/content/uploads/2020/07/AP20184820332020.jpg,2020-07-04T15:20:51Z,"Fourth of July festivities have been pared down in many states due to the continuing threat of coronavirus, but the National Fireworks Association says a record number of people are buying fireworks … [+2824 chars]",fox-news,Fox News
Julia Musto,Peter Navarro: 'Chinese Communist Party needs to come clean about coronavirus’,"The Chinese Communist Party needs to be held accountable for its role in eroding democracy in both the U.S. and Hong Kong, White House Trade Advisor Peter Navarro asserted Saturday.",https://www.foxnews.com/media/peter-navarro-china-come-clean-coronavirus,https://static.foxnews.com/foxnews.com/content/uploads/2020/07/2c1f0203-image.jpg,2020-07-04T15:13:08Z,"The Chinese Communist Party needs to be held accountable for its role in eroding democracy in both the U.S. and Hong Kong, White House Trade Advisor Peter Navarro asserted Saturday.
In an interview … [+3825 chars]",fox-news,Fox News
Robert Gearty,NC trooper injured after being hit by vehicle on Charlotte interstate,"A North Carolina trooper suffered serious injuries Saturday morning after being struck by a motorist on I-485 in Charlotte, according to reports.",https://www.foxnews.com/us/nc-trooper-injured-hit-vehicle-charlotte-interstate,https://static.foxnews.com/foxnews.com/content/uploads/2020/07/Long-Creek-Fire-Department.jpg,2020-07-04T15:06:17Z,"A North Carolina trooper suffered serious injuries Saturday morning after being struck by a motorist on I-485 in Charlotte, according to reports.
“A very serious incident has I-485 Outer Loop shut d… [+1117 chars]",fox-news,Fox News
Nicole Rabon,A Toy Expert Shares What To Do With Your Kids In Lieu of Summer Camp,"""We're Momming Today"" with The Toy Association's trend expert Adrienne Appell, about how to entertain our kids this summer when summer camp and normal outdoor activities might not be an option due to the coronavirus. We've learned from weeks and weeks of COVI…",https://radio.foxnews.com/2020/07/04/a-toy-expert-shares-what-to-do-with-your-kids-in-lieu-of-summer-camp/,https://radio.foxnews.com/wp-content/uploads/2020/07/adrienneappell-1.jpg,2020-07-04T15:00:35Z,"""We're Momming Today"" with The Toy Association's trend expert Adrienne Appell, about how to entertain our kids this summer when summer camp and normal outdoor activities might not be an option due to… [+221 chars]",fox-news,Fox News
Paulina Dedaj,Former Phillies pitcher Tyson Brummett killed in plane crash,"Former Philadelphia Phillies pitcher Tyson Brummett died Friday morning in a plane crash that killed three other people, police say.",https://www.foxnews.com/sports/former-phillies-pitcher-tyson-brummett-killed-plane-crash,https://static.foxnews.com/foxnews.com/content/uploads/2020/07/Tyson-Brummett-Getty-2.jpg,2020-07-04T14:59:35Z,"Former Philadelphia Phillies pitcher Tyson Brummett died Friday morning in a plane crash that killed three other people, police say.
Brummett, 35, was piloting a small plane out of South Valley Regi… [+1267 chars]",fox-news,Fox News
Melissa Roberto,"Rose McGowan calls for arrests of Prince Andrew, Bill Clinton following Ghislaine Maxwell's FBI capture",Rose McGowan is calling for Prince Andrew and Bill Clinton to be arrested next for their alleged ties to the Jeffrey Epstein investigation following the apprehension of his accused recruiter Ghislaine Maxwell.,https://www.foxnews.com/entertainment/rose-mcgowan-calls-for-arrests-prince-andrew-bill-clinton-following-ghislaine-maxwell-fbi-capture,https://static.foxnews.com/foxnews.com/content/uploads/2020/07/Prince-Andrew-Rose-Mcgowan-Bill-Clinton-AP-Getty-AP.jpg,2020-07-04T14:39:41Z,Rose McGowan is calling for Prince Andrew and Bill Clinton to be arrested next for their alleged ties to the late Jeffrey Epstein following the arrest of his alleged sex abuse accomplice Ghislaine Ma… [+3219 chars],fox-news,Fox News
Peter Aitken,"Boy, 14, charged with murder of woman, 'shocking' string of shootings",The incidents occurred over a 24-hour period on Canada Day.,https://www.foxnews.com/world/boy-charged-shocking-shootings,https://static.foxnews.com/foxnews.com/content/uploads/2020/07/Danielle-Cote.jpg,2020-07-04T14:39:06Z,"Canadianpolice arrested a 14-year-old boy in connection with five possible shootings, charging him with first degree murder and a number of other charges.
Danielle Dawn Cote, 27, was walking with an… [+2501 chars]",fox-news,Fox News
Melissa Roberto,Kacey Musgraves and husband Ruston Kelly announce divorce after nearly 3 years of marriage,"Kacey Musgraves and her husband of nearly three years, Ruston Kelly, are calling it quits on their marriage.",https://www.foxnews.com/entertainment/kacey-musgraves-husband-ruston-kelly-announce-divorce,https://static.foxnews.com/foxnews.com/content/uploads/2020/07/1f8e245f-musgraves-kelly-getty.jpg,2020-07-04T14:29:30Z,"Kacey Musgraves and her husband of nearly three years, Ruston Kelly, are calling it quits on their marriage.
Representatives for both singers confirmed the divorce news Friday. In a joint statement,… [+2862 chars]",fox-news,Fox News
Julia Musto,Rep. Dusty Johnson on need to preserve US history: Dems forget how lucky they are to be in America,"Democrats seem to be so enamored with talking about America's imperfections they forget the importance of its history and how unbelievably lucky they are to be here, Rep. Dusty Johnson asserted Saturday.",https://www.foxnews.com/media/rep-dusty-johnson-dems-forget-america-history-greatness-independence-day,https://static.foxnews.com/foxnews.com/content/uploads/2020/07/DUSTY.jpg,2020-07-04T14:24:45Z,"Democrats and activists are so obsessed with America's ""imperfections,"" they seem to forget how lucky they are to be here, Rep. Dusty Johnson, R-SD, said Saturday.
Johnson, appearing on ""Fox &amp; F… [+2940 chars]",fox-news,Fox News
,PHOTOS: President Trump's Mount Rushmore speech kicks off 4th of July celebrations,"President Donald Trump holds an event at Mount Rushmore in Keystone, SD.",https://www.foxnews.com/us/photos-president-trump-mount-rushmore,https://static.foxnews.com/foxnews.com/content/uploads/2020/07/Trump-Mt-Rushmore-Slideshow-04.jpg,2020-07-04T14:21:01Z,"This material may not be published, broadcast, rewritten,
 or redistributed. ©2020 FOX News Network, LLC. All rights reserved.
 All market data delayed 20 minutes.",fox-news,Fox News
Robert Gearty,"Alabama mall shooting kills boy, 8, wounds 3 others","A man fired shot during an altercation at an Alabama shopping mall, killing an 8-year-old boy and wounding three others, including a young girl.",https://www.foxnews.com/us/alabama-mall-shooting-kills-boy-8-wounds-3-others,https://static.foxnews.com/foxnews.com/content/uploads/2020/07/Shooting-Alabama-Mall-AP.jpg,2020-07-04T14:06:56Z,"A man fired shots during an altercation at an Alabama shopping mall, killing an 8-year-old boy and wounding three others, including a young girl.
It happened Friday in the middle of the afternoon at… [+2020 chars]",fox-news,Fox News
Melissa Roberto,Lea Michele returns to social media following 'Glee' scandal to show off baby bump,"Lea Michele has returned to social media one month following the ""Glee"" scandal in which she was dubbed a terror to work with by many of her co-stars on the former television show.",https://www.foxnews.com/entertainment/lea-michele-social-media-following-glee-scandal-baby-bump,https://static.foxnews.com/foxnews.com/content/uploads/2018/09/Lea-Michele-Bronde-Hair.jpg,2020-07-04T14:02:13Z,"Lea Michele has returned to social media one month following the ""Glee"" scandal in which she was dubbed a terror to work with by many of her former co-stars.
The future mother-to-be returned to Inst… [+3747 chars]",fox-news,Fox News
Helen Raleigh,"Helen Raleigh: As an immigrant, I celebrate America this July 4th and goodness of the American people",I am proud to say tI am an American by choice and I love this country.,https://www.foxnews.com/opinion/immigration-july-4th-helen-raleigh,https://cf-images.us-east-1.prod.boltdns.net/v1/static/694940094001/a9341ffd-c95a-4921-b3a8-b6f1411d167b/b19150b4-4771-449b-8ca5-7164a5632c9d/1280x720/match/image.jpg,2020-07-04T14:00:10Z,"Patriotism seems to be out of fashion for many Americans this Fourth of July. From toppling statues to banning the national anthem, it’s hard to miss all the denunciations of America's founders, foun… [+7072 chars]",fox-news,Fox News
Sam Dorman,Former Walmart CEO: June job gains show 'the consumer is still very strong' despite pandemic,"Former Walmart CEO Bill Simon was optimistic about the nation's economic recovery on Saturday, telling Fox News host Neil Cavuto that the American consumer was ""strong.""",https://www.foxnews.com/media/walmart-ceo-simon-june-jobs-coronavirus,https://static.foxnews.com/foxnews.com/content/uploads/2020/07/Bill-Simon-Getty.jpg,2020-07-04T17:27:55Z,"Former Walmart CEO Bill Simon was optimistic Saturday about the nation's economic recovery, telling Fox News host Neil Cavuto that the American consumer is ""strong.""
Simon's comments came after the … [+1765 chars]",fox-news,Fox News
Julia Musto,Rep. Eric Swalwell calls for a nationwide mask mandate: 'You're protecting others',Democratic California Congressman Eric Swalwell said Saturday that he agrees there should likely be a nationwide mask mandate amidst the coronavirus pandemic.,https://www.foxnews.com/media/rep-eric-swalwell-nationwide-mask-mandate,https://static.foxnews.com/foxnews.com/content/uploads/2020/07/a0cbcdf7-image.jpg,2020-07-04T17:20:57Z,"DemocraticCalifornia Congressman Eric Swalwell said Saturday that he agrees there should likely be a nationwide mask mandate amidst the coronavirus pandemic.
In an interview on ""Cavuto LIVE"" with ho… [+2724 chars]",fox-news,Fox News
Paulina Dedaj,MLS postpones opening match of tournament after several FC Dallas players test positive for COVID-19,Major League Soccer announced Saturday that it would be postponing the first match of the MLS is Back Tournament scheduled for Wednesday after several FC Dallas members tested positive for COVID-19 after arriving in Florida.,https://www.foxnews.com/sports/mls-postpones-opening-match-fc-dallas-positive-covid-19,https://static.foxnews.com/foxnews.com/content/uploads/2020/07/FC-Dallas-Getty-Images.jpg,2020-07-04T17:01:47Z,Major League Soccer announced Saturday that it would be postponing the first match of the MLS is Back Tournament scheduled for Thursday after several FC Dallas members tested positive for COVID-19 af… [+1708 chars],fox-news,Fox News
Melissa Roberto,Maren Morris dubbed 'great mom' by husband after fans slam her for pic of son on float without life jacket,"Maren Morris was defended by her husband, Ryan Hurd, after she received flack online for posting a photo of her baby boy on a float without a life jacket.",https://www.foxnews.com/entertainment/maren-morris-great-mom-husband-son-life-jacket,https://static.foxnews.com/foxnews.com/content/uploads/2019/11/Maren-Morris.jpg,2020-07-04T16:54:49Z,"Maren Morris was defended by her husband, Ryan Hurd, after she received criticism online for posting a photo of her baby boy on a float without a life jacket.
The country singer, 30, gave birth to h… [+2077 chars]",fox-news,Fox News
Peter Aitken,"English pubs opened at 6 a.m., coronavirus restrictions ease, as police brace for 'chaos'","Some believe that the push by the government will lead to ""New Years""-style wild behavior.",https://www.foxnews.com/world/english-pubs-open-chaos,https://static.foxnews.com/foxnews.com/content/uploads/2020/07/Britain-Reopens-REUTERS-3.jpg,2020-07-04T16:50:32Z,"English residents rushed to pubs and hairdressers on “Super Saturday” as coronavirus restrictions eased, with authorities urging caution. 
Pubs opened at 6 a.m. and some hair salons reportedly welco… [+3173 chars]",fox-news,Fox News
Julia Musto,"Rep. Devin Nunes reacts to brief on Russian bounties: Vladimir Putin is 'dangerous,' intel community has 'real problem'","There is a ""real problem"" in the U.S. intelligence community if the leakers are going to have to investigate themselves, Rep. Devin Nunes, R-Calif., pointed out Saturday.",https://www.foxnews.com/media/rep-devin-nunes-reacts-white-house-brief-russian-bounties,https://static.foxnews.com/foxnews.com/content/uploads/2020/07/c206635e-image.jpg,2020-07-04T16:43:12Z,"There is a ""real problem"" in the U.S. intelligence community if the leakers are going to have to investigate themselves, Rep. Devin Nunes, R-Calif., pointed out Saturday.
In an interview on ""Fox &am… [+3079 chars]",fox-news,Fox News
Melissa Roberto,Dina Manzo's ex ordered to stay away from her following racketeering arrest: report,"Dina Manzo 's ex-husband has been ordered not to go near the former ""Real Housewives"" star and her current husband, Dave Cantin, after he was arrested earlier this week.",https://www.foxnews.com/entertainment/dina-manzo-ex-ordered-to-stay-away-racketeering-arrest-report,https://static.foxnews.com/foxnews.com/content/uploads/2019/07/ContentBroker_contentid-84aefc24061d4096b8a2f0fc1deea11c.png,2020-07-04T16:23:56Z,"Dina Manzo's ex-husband has been ordered not to go near the former ""Real Housewives"" star and her current husband after his arrest earlier this week.
Thomas Manzo was arrested Tuesday in New Jersey … [+2422 chars]",fox-news,Fox News
Sam Dorman,Ken Cuccinelli vows federal government will 'bring consequences' to those destroying statues,"Acting Deputy Homeland Security Secretary Ken Cuccinelli warned on Saturday that the federal government would not take recent vandalism ""lying down.""",https://www.foxnews.com/media/ken-cuccinelli-consequences-statues-monuments,https://static.foxnews.com/foxnews.com/content/uploads/2019/10/Ken-Cuccinelli-AP.jpg,2020-07-04T16:21:08Z,"Acting Deputy Homeland Security Secretary Ken Cuccinelli warned on Saturday that the federal government would not take recent vandalism ""lying down.""
Fox News host Neil Cavuto had asked Cuccinelli a… [+3201 chars]",fox-news,Fox News
Paulina Dedaj,NFL players union votes for recommendation to cancel entire preseason: report,"The NFL may be moving to cancel the entire preseason after the players union voted this week to raise the issue, reports say.",https://www.foxnews.com/sports/nfl-players-union-votes-cancel-preseason,https://static.foxnews.com/foxnews.com/content/uploads/2018/09/goodell.jpg,2020-07-04T16:09:07Z,"The NFL may be moving to cancel the entire preseason after the players union voted this week to raise the issue, reports say.
The union’s board of player representatives voted on Thursday to ask the… [+1115 chars]",fox-news,Fox News
Adriana Cohen,Adriana Cohen: 2020 presidential election poses clear choice: jobs or mobs,"The stark reality is that Democrats today would rather appease anarchists, looters and violent criminals than uphold law and order.",https://www.foxnews.com/opinion/2020-presidential-election-choice-jobs-mobs-adriana-cohen,https://static.foxnews.com/foxnews.com/content/uploads/2020/04/Trump-Biden_AP-Getty.jpg,2020-07-04T19:58:03Z,"Voters have a clear choice this November.
If you want mobs vandalizing stores, destroying public property and setting churches on fire, then vote for Democratic candidate Joe Biden, who has spent th… [+3840 chars]",fox-news,Fox News
Marisa Schultz,Military flyovers scheduled over four cities for Independence Day salute,"Military planes will fly over four big cities Saturday afternoon to celebrate Independence Day in a lead up to the Fourth of July air show in Washington, D.C.",https://www.foxnews.com/politics/military-flyovers-independence-day-salute,https://static.foxnews.com/foxnews.com/content/uploads/2020/06/AP20156702577841.jpg,2020-07-04T19:48:58Z,"Military planes will fly over four big cities Saturday afternoon to celebrate Independence Day in a lead up to the Fourth of July air show in Washington, D.C.
Defense Secretary Mark Esper approved t… [+2611 chars]",fox-news,Fox News
Melissa Roberto,"Lisa Rinna, Sofia Vergara, Paris Hilton and more don patriotic swimsuits, short shorts for the Fourth of July",Hollywood stars across the country are in full Americana mode in honor of the Fourth of July.,https://www.foxnews.com/entertainment/lisa-rinna-sofia-vergara-paris-hilton-patriotic-swimsuits-fourth-of-july,https://static.foxnews.com/foxnews.com/content/uploads/2020/07/Lisa-Rinna-Sofia-Vergara-and-Paris-Hilton.jpg,2020-07-04T19:43:58Z,"Hollywood stars across the country are in full Americana mode in honor of the Fourth of July.
Actors, musicians and models alike took to their respective social media accounts on Saturday in honor o… [+3201 chars]",fox-news,Fox News
,Should President Trump have been briefed on Russian bounty reports?,Lawmakers demand more answers from the administration about who knew what and when; Fox News senior strategic analyst Gen. Jack Keane reacts.,http://video.foxnews.com/v/6169347845001/,https://cf-images.us-east-1.prod.boltdns.net/v1/static/694940094001/5732ef82-b004-42c9-b2f9-fd84ace6edbe/57a3c7dd-9440-4b10-8ccf-fe72339ee307/1280x720/match/image.jpg,2020-07-04T19:37:30Z,,fox-news,Fox News
,Karl Rove: Trump campaign needs to hit the 'reset' button,The 2020 presidential campaign enters the summer stretch; Wall Street Journal columnist Karl Rove has an update.,http://video.foxnews.com/v/6169347762001/,https://cf-images.us-east-1.prod.boltdns.net/v1/static/694940094001/d8a2cb66-4c42-4f2a-8552-16fddd99b2d4/fa4d089a-4ca3-4806-8049-9fed662c980d/1280x720/match/image.jpg,2020-07-04T19:29:21Z,,fox-news,Fox News
Gary Gastelu,Fox News Virtual Auto Show: YOUR American cars,We'll salute them all.,https://www.foxnews.com/auto/fox-news-virtual-auto-show-your-american-cars,https://static.foxnews.com/foxnews.com/content/uploads/2020/07/american-jeep.jpg,2020-07-04T19:28:41Z,"Not everyone can get together these days, so Fox News is holding a series of virtual car shows where you can share and discuss your cool cars, trucks and motorcycles with the rest of the Fox News Aut… [+416 chars]",fox-news,Fox News
Paul Batura,"Paul Batura: This July 4th we hold America’s future in our hands, as Trump points out dangers we face","We celebrate our 244th birthday amidst tensions threatening to topple our great and enduring traditions.,",https://www.foxnews.com/opinion/trump-mount-rushmore-paul-batura,https://static.foxnews.com/foxnews.com/content/uploads/2020/07/Trump-Mt-Rushmore-Slideshow-05.jpg,2020-07-04T19:12:27Z,"Against a dramatic backdrop of fluttering flags and fireworks over Mount Rushmore in South Dakota, President Trump lashed out Friday night against those determined to attack not only our country’s ce… [+5330 chars]",fox-news,Fox News
Julia Musto,Interior Secretary David Bernhardt on controversial DC fireworks show: 'Personal responsibility' is key,"A key component of a safe Independence Day amidst the coronavirus pandemic is ""personal responsibility,"" Interior Secretary David Bernhardt stated Saturday.",https://www.foxnews.com/media/interior-sec-david-berhardt-on-july-4th,https://static.foxnews.com/foxnews.com/content/uploads/2020/07/image-1.jpg,2020-07-04T18:53:16Z,"Interior Secretary David Bernhardt urged people planning to attend the ""Salute to America"" celebration Saturday evening in Washington to assume ""personal responsibility"" in not spreading coronavirus.… [+2568 chars]",fox-news,Fox News
