author,title,description,url,urlToImage,publishedAt,content,source.id,source.name
Nick Givas,CNN slights Mount Rushmore as 'monument of two politicianowners' after extolling its 'majesty' in 2016,"A CNN reporter on Friday described Mount Rushmore ""a monument of two politicianowners"" situated on stolen land ahead of President Trump's visit to the national monument.",https://www.foxnews.com/media/cnn-mount-rushmore-monument-two-politician-owners,https://static.foxnews.com/foxnews.com/content/uploads/2018/12/mount-rushmore-UNDERCANVAS0818.jpg,2020-07-04T01:48:29Z,"A CNN reporter on Friday described Mount Rushmore ""a monument of two politicianowners"" situated on stolen land ahead of President Trump's visit to the national monument.
Grabien founder and editor Tom El… [+1458 chars]",fox-news,Fox News
Nick Givas,"CNN slights Mount Rushmore as 'politician owners' in 2020, but called it 'monument to 4 great presidents' in 2016","CNN on Friday depicted Mount Rushmore as ""politician owners"" situated on stolen land, after praising the monument for its cultural significance back in 2016, during a segment with then-presidential candidate Bernie Sanders.",https://www.foxnews.com/media/cnn-mount-rushmore-politician-owners-2020-great-presidents-2016,https://static.foxnews.com/foxnews.com/content/uploads/2018/12/mount-rushmore-UNDERCANVAS0818.jpg,2020-07-04T01:48:29Z,"CNN on Friday depicted Mount Rushmore as ""politician owners"" situated on stolen land, after praising the monument for its cultural significance back in 2016, during a segment with then-presidential candid… [+1457 chars]",fox-news,Fox News
,Rep. Andy Biggs says Trump's critics are trying to sow division with complaints over Mount Rushmore event,"President Trump set to kick off a historic July Fourth celebration at Mount Rushmore; reaction from civil rights attorney Leo Terrell, Arizona Rep. Andy Biggs and Jenna Ellis, senior legal adviser to Trump 2020 campaign.",http://video.foxnews.com/v/6169244654001/,https://cf-images.us-east-1.prod.boltdns.net/v1/static/694940094001/5ec1a3c0-9cd8-46e3-bf40-54b8cd1e1a0b/eccd2d3b-75fb-4d7d-baca-1b9f555ac147/1280x720/match/image.jpg,2020-07-04T01:39:59Z,,fox-news,Fox News
Caitlin McFall,Head of Hispanic group urges Latinas not to join military after Vanessa Guillen's death,"The League of United Latin American Citizens (LULAC) has called for a third party investigation into the disappearance of Army soldier Vanessa Guillen, and is urging women not to join the military.",https://www.foxnews.com/us/hispanic-group-latinas-not-enlist-military-vanessa-guillen-death,https://static.foxnews.com/foxnews.com/content/uploads/2020/04/Vanessa-Guillen.jpg,2020-07-04T01:22:23Z,"The League of United Latin American Citizens (LULAC) has called for a third-party investigation into the disappearance of Army soldier Vanessa Guillen and urged women not to join the military.
""We a… [+2501 chars]",fox-news,Fox News
Victor Garcia,Dr. Nesheiwat says Fourth of July 'potential perfect storm' for coronavirus spread,"Fox News medical contributor Dr. Janette Nesheiwat warned on ""Special Report"" Friday that the Fourth of July holiday weekend has the potential to be a coronavirus ""perfect storm"" and people should take precautions.",https://www.foxnews.com/media/dr-nesheiwat-fourth-of-july-coronavirus-spread,https://static.foxnews.com/foxnews.com/content/uploads/2020/03/2b5b9568-image-1.jpg,2020-07-04T00:45:54Z,"Fox News medical contributor Dr. Janette Nesheiwat warned on ""Special Report"" Friday that the Fourth of July holiday weekend has the potential to be a coronavirus ""perfect storm"" and people should ta… [+2539 chars]",fox-news,Fox News
Victor Garcia,Dr. Nesheiwat says Fourth of July 'potential perfect storm' for COVID-19 spread,"Fox News medical contributor Dr. Janette Nesheiwat appeared on ""The Story"" Friday, where she warned that the Fourth of July has the potential to be a coronavirus ""perfect storm,"" warning people to take precautions.",https://www.foxnews.com/media/dr-nesheiwat-fourth-of-july-coronavirus,https://cf-images.us-east-1.prod.boltdns.net/v1/static/694940094001/2b3a9d6d-6bff-4f9e-9c89-4da0d045c966/ad657fd0-1325-4a15-a1fb-65980128ad40/1280x720/match/image.jpg,2020-07-04T00:45:54Z,"Fox News medical contributor Dr. Janette Nesheiwat appeared on ""Special Report"" Friday, where she warned that the Fourth of July has the potential to be a coronavirus ""perfect storm,"" warning people … [+2497 chars]",fox-news,Fox News
Caitlin McFall,Protesters block road leading to Mount Rushmore ahead of Trump event,"Protesters blocked an access road to Mount Rushmore Friday, hours before President Trump was set to give a speech to kick off Independence Day weekend.",https://www.foxnews.com/politics/protesters-block-mount-rushmore-road-trump-event,https://static.foxnews.com/foxnews.com/content/uploads/2020/07/f0800fe1-EcCoFWUXgAUnf16.jpeg,2020-07-04T00:37:55Z,"Protesters blocked an access road to Mount Rushmore Friday, hours before President Trump was set to give a speech to kick off Independence Day weekend.
According to the Associated Press, the protest… [+2276 chars]",fox-news,Fox News
Louis Casiano,'Defund the Police' mural changed to 'Defend the Police' outside Milwaukee City Hall,"A ""Defund the Police"" mural outside Milwaukee's City Hall that was painted over by an anonymous group in an effort to show support for law enforcement, was changed back to its original message Friday, according to media reports.",https://www.foxnews.com/us/defend-the-police-mural-changed-to-defend-the-police-outside-milwaukee-city-hall,https://static.foxnews.com/foxnews.com/content/uploads/2020/07/AP20177557334500.jpg,2020-07-04T00:33:12Z,"A ""Defund the Police"" mural outside Milwaukee's City Hall was painted over by an anonymous group in an effort to show support for law enforcement but changed back to its original message Friday, acco… [+1431 chars]",fox-news,Fox News
Caitlin McFall,Thousands of Americans remain stranded in Yemen amid growing humanitarian crisis,"Thousands of Americans remain stranded in the war torn nation of Yemen after coronavirus restrictions closed the borders in mid-March, activist are now calling attention to the severity of the problem.",https://www.foxnews.com/world/americans-stranded-yemen-humanitarian-crisis,https://static.foxnews.com/foxnews.com/content/uploads/2019/05/ContentBroker_contentid-3d725d5e49994a70adf21b6f78f43271.png,2020-07-04T00:12:25Z,"Thousands of Americans remain stranded in the war-torn nation of Yemen after coronavirus restrictions closed the borders in mid-March, activist are now calling attention to the severity of the proble… [+4393 chars]",fox-news,Fox News
Charles Creitz,Alex Berenson: Rise in coronavirus cases 'means very little' if hundreds of thousands are unknowingly infected,"Former New York Times reporter Alex Berenson told ""The Story"" Friday that the ongoing rise in coronavirus hospitalizations in parts of the country suggests that either doctors are treating the virus more effectively -- or more people are being hospitalized ""w…",https://www.foxnews.com/media/alex-berenson-coronavirus-case-rise-means-little,https://static.foxnews.com/foxnews.com/content/uploads/2020/07/3a9d786b-image-23.jpg,2020-07-04T03:52:47Z,"Former New York Times reporter Alex Berenson told ""The Story"" Friday that the ongoing rise in coronavirus hospitalizations in parts of the country suggests that either doctors are treating the virus … [+1538 chars]",fox-news,Fox News
Gregg Re,"Trump, in fiery Mount Rushmore address, decries rise of 'far-left fascism,' calls on Americans to rise upTrump, in fiery Mount Rushmore address, decries rise of 'far-left fascism,' calls on Americans to rise up","Speaking after the legendary U.S. Navy Blue Angels roared overhead, President Trump ushered in the July 4th weekend Friday night at Mount Rushmore in South Dakota with a full-throated condemnation of ""far-left fascism"" and a defense of ""Judeo-Christian princi…",https://www.foxnews.com/politics/trump-in-fiery-mount-rushmore-address-decries-rise-of-far-left-fascism-calls-on-americans-to-rise-up,https://static.foxnews.com/foxnews.com/content/uploads/2020/07/AP20186108352477.jpg,2020-07-04T03:39:07Z,"Speaking after the legendary U.S. Navy Blue Angels roared overhead, President Trump ushered in the July 4th weekend Friday night at Mount Rushmore in South Dakota with a full-throated condemnation of… [+5673 chars]",fox-news,Fox News
Charles Creitz,"Tom Fitton explains street-painting lawsuit against DC mayor, says she's 'denying access to a public forum'","Judicial Watch President Tom Fitton told Fox News' ""The Story"" Friday that his organization filed a federal lawsuit against Washington D.C. Mayor Muriel Bowser after their request to paint an ""apolitical"" slogan on a Capitol Hill street was given ""the run-aro…",https://www.foxnews.com/media/tom-fitton-street-painting-lawsuit-washington-mayor,https://static.foxnews.com/foxnews.com/content/uploads/2020/07/c695fe8e-image-22.jpg,2020-07-04T03:32:27Z,"Judicial Watch President Tom Fitton told Fox News' ""The Story"" Friday that his organization filed a federal lawsuit against Washington D.C. Mayor Muriel Bowser after their request to paint an ""apolit… [+2959 chars]",fox-news,Fox News
Robert Gearty,Retired Jacksonville detective arrested in cold case murder that took place when he was on the force,A Florida man has been accused of killing a convenience store owner 21 years ago in a home invasion robbery when he was working as a detective for the Jacksonville Sheriff’s Office and knew the vicitim because he had been surveilling him in a drug investigati…,https://www.foxnews.com/us/retired-jacksonville-detective-arrested-cold-case-murder,https://static.foxnews.com/foxnews.com/content/uploads/2020/07/William-Baer-Jax-Sheriffs-Office-2.jpg,2020-07-04T02:24:29Z,A Florida man has been accused of killing a convenience store owner 21 years ago in a home invasion robbery when he was working as a detective for the Jacksonville Sheriff’s Office and knew the victi… [+2147 chars],fox-news,Fox News
Robert Gearty,Retired Jacksonville detective arrested in cold case murder that took place while he was on force,A Florida man has been accused of killing a convenience store owner 21 years ago in a home invasion robbery that took place when the suspect was working as a detective for the Jacksonville Sheriff’s Office and knew the victim from surveilling him for a drug i…,https://www.foxnews.com/us/jacksonville-detective-william-baer-arrested-1999-murder,https://static.foxnews.com/foxnews.com/content/uploads/2020/07/William-Baer-Jax-Sheriffs-Office-2.jpg,2020-07-04T02:24:29Z,A Florida man has been accused of killing a convenience store owner 21 years ago in a home invasion robbery that took place when the suspect was working as a detective for the Jacksonville Sheriff’s … [+2173 chars],fox-news,Fox News
Caitlin Mcfall,"Trump speaks at Mount Rushmore, will condemn 'merciless campaign to wipe out our history'","President Trump will emphasize America's history as a ""great and virtuous country"" in remarks he plans to give at South Dakota's Mount Rushmore Friday to mark the beginning of Independence Day weekend, a person familiar with his remarks told Fox News.",https://www.foxnews.com/us/president-trump-mount-rushmore-speech-excerpts,https://static.foxnews.com/foxnews.com/content/uploads/2020/07/AP20186092227694.jpg,2020-07-04T02:09:15Z,"President Trump took the stage in the shadow of Mount Rushmore on Friday night to condemn what he described as a ""merciless campaign to wipe out our history, defame our heroes, erase our values, and … [+5230 chars]",fox-news,Fox News
,Epstein confidant Ghislaine Maxwell will reportedly give names,Ghislaine Maxwell faces decades behind bars following her arrest by the FBI; reaction from Fox News contributor Tammy Bruce and Fox News legal analyst Gregg Jarrett.,http://video.foxnews.com/v/6169248015001/,https://cf-images.us-east-1.prod.boltdns.net/v1/static/694940094001/dc7da43a-0e6e-4764-ab34-0983ea568fb3/3d597d2a-696d-4a3d-a26f-b3d7112f11a3/1280x720/match/image.jpg,2020-07-04T02:08:46Z,,fox-news,Fox News
Associated Press,Jimmie Johnson 1st NASCAR driver to test positive for virus,Seven-time NASCAR champion Jimmie Johnson has tested positive for the coronavirus and will miss this weekend’s race at Indianapolis Motor Speedway.,https://www.foxnews.com/auto/jimmie-johnson-nascar-driver-coronavirus-positive,https://static.foxnews.com/foxnews.com/content/uploads/2020/07/AP20185583805101.jpg,2020-07-04T02:05:06Z,"INDIANAPOLIS — Seven-time NASCAR champion Jimmie Johnson has tested positive for the coronavirus and will miss this weekend’s race at Indianapolis Motor Speedway.
The 44-year-old Johnson is the firs… [+6173 chars]",fox-news,Fox News
Charles Creitz,Leo Terrell slams DNC tweet tying Mount Rushmore to 'white supremacy' as 'the race card at its highest level',"Civil rights attorney Leo Tyrrell told ""Hannity"" Friday that a now-deleted tweet from the Democratic National Committee that tried to link Mount Rushmore with ""white supremacy"" made him ""embarrassed to be a Democrat.""",https://www.foxnews.com/media/leo-terrell-dnc-mount-rushmore-white-supremacy,https://static.foxnews.com/foxnews.com/content/uploads/2020/07/Video-2020-07-03T213842.033.jpg,2020-07-04T05:09:56Z,"Civil rights attorney Leo Tyrrell told ""Hannity"" Friday that a now-deleted tweet from the Democratic National Committee that tried to link Mount Rushmore with ""white supremacy"" made him ""embarrassed … [+1404 chars]",fox-news,Fox News
Charles Creitz,Victor Davis Hanson says Trump must evoke Abraham Lincoln's July 4 address in 1861 amid current unrest,"Hoover Institution senior fellow and author Victor Davis Hanson told the ""Ingraham Angle"" Friday that President Trump must respond to America's current unrest with a firm statement along the lines of Abraham Lincoln's message to Congress on July 4, 1861.",https://www.foxnews.com/media/victor-davis-hanson-trump-lincoln-july-4,https://static.foxnews.com/foxnews.com/content/uploads/2020/07/AP20186108352477.jpg,2020-07-04T04:45:56Z,"Hoover Institution senior fellow and author Victor Davis Hanson told the ""Ingraham Angle"" Friday that President Trump must respond to America's current unrest with a firm statement along the lines of… [+1990 chars]",fox-news,Fox News
"Dom Calicchio, Matt Leach","Kim Guilfoyle tests positive, Don Jr. negative, for coronavirus, Trump campaign confirms","Kimberly Guilfoyle, a senior adviser to the Trump 2020 campaign, has tested positive for the coronavirus, the campaign confirmed Friday night.",https://www.foxnews.com/politics/kim-guilfoyle-tests-positive-don-jr-negative-for-coronavirus-trump-campaign-confirms,https://static.foxnews.com/foxnews.com/content/uploads/2019/11/Trump-Jr-Guilfoyle-Getty.jpg,2020-07-04T04:45:05Z,"Kimberly Guilfoyle, a senior adviser to the Trump 2020 Campaign and girlfriend of Donald Trump Jr., has tested positive for the coronavirus, the campaign confirmed Friday night.
“After testing posit… [+2091 chars]",fox-news,Fox News
Victor Garcia,Tammy Bruce calls Ghislaine Maxwell case a 'very important' reminder women are as capable of evil as men,"Fox News contributor Tammy Bruce addressed the issue of ""gender stereotypes"" Friday while reacting to the story of a woman who claims Ghislaine Maxwell raped her between 20 and 30 times, beginning when the alleged victim was just 14 years old in 1991.",https://www.foxnews.com/media/tammy-bruce-ghislaine-maxwell-women-capable-evil,https://static.foxnews.com/foxnews.com/content/uploads/2019/08/Ghislaine-Maxwell-2-Getty.jpg,2020-07-04T04:26:37Z,"Fox News contributor Tammy Bruce addressed the issue of ""gender stereotypes"" Friday while reacting to the story of a woman who claims Ghislaine Maxwell raped her between 20 and 30 times, beginning wh… [+1688 chars]",fox-news,Fox News
Dom Calicchio,3 Colorado police officers linked to photos at Elijah McClain memorial are fired: reports,"Three Aurora, Colo., police officers linked to controversial photos snapped at the site of a memorial for slain black man Elijah McClain were fired Friday, according to reports.",https://www.foxnews.com/us/3-colorado-police-officers-linked-to-photos-at-elijah-mcclain-memorial-are-fired-reports,https://static.foxnews.com/foxnews.com/content/uploads/2020/07/AP20185799621597.jpg,2020-07-04T06:42:29Z,"Three Aurora, Colo., police officers linked to controversial photos snapped at the site of a memorial for Elijah McClain were fired Friday, according to reports.
The firings came after a fourth offi… [+4977 chars]",fox-news,Fox News
Brie Stimson,Oregon governor meets with state troopers caught flouting mask mandate in coffee shop,Oregon Gov. Kate Brown met Friday with three Oregon State Police troopers who were seen on video earlier this week defying a mandated statewide mask order while visiting a Corvallis coffee shop.,https://www.foxnews.com/politics/oregon-governor-meets-with-state-troopers-caught-flouting-mask-mandate-in-coffee-shop,https://static.foxnews.com/foxnews.com/content/uploads/2020/07/brown.png,2020-07-04T09:06:41Z,"Oregon Gov. Kate Brown met Friday with three Oregon State Police troopers who were seen on video earlier this week defying a mandated statewide mask order while visiting a Corvallis coffee shop.
The… [+2067 chars]",fox-news,Fox News
Stephanie Nolasco,"Bob Ross' time in the Air Force influenced him in 'The Joy of Painting,' pal says","Before Bob Ross introduced the world to “The Joy of Painting,” he served in the Air Force where he discovered happy trees and almighty mountains.",https://www.foxnews.com/entertainment/bob-ross-air-force-joy-of-painting,https://cf-images.us-east-1.prod.boltdns.net/v1/static/694940094001/ba9120d7-d8c1-4d60-817d-0889f83ff4d8/fe893f23-d893-4f77-aaf0-9755e6cd9c16/1280x720/match/image.jpg,2020-07-04T09:00:35Z,"Before Bob Ross introduced the world to “The Joy of Painting,” he served in the Air Force where he discovered happy trees and almighty mountains.
The beloved artist and TV icon previously spent two … [+7084 chars]",fox-news,Fox News
Janine Puhak,Fourth of July: Why do we celebrate with fireworks?,Do you know why it’s popular to celebrate July 4 with a bang?,https://www.foxnews.com/lifestyle/fourth-of-july-celebrate-fireworks-why,https://static.foxnews.com/foxnews.com/content/uploads/2020/06/GettyImages-1153793054.jpg,2020-07-04T09:00:24Z,"Fireworks are a quintessential part of Independence Day festivities in America – but do you know why it’s popular to celebrate July 4 with a bang?
The vision for the tradition dates all the way back… [+2667 chars]",fox-news,Fox News
William Sanchez,Fox News Rundown Extra: A Candid Conversation With Dr. Fauci,"Coronavirus cases spiked across the country this week, worrying both health experts and local leaders. Many states have even decided to back off some of their reopening plans. To discuss these growing concerns, host Jessica Rosenthal spoke to director of the …",https://radio.foxnews.com/2020/07/04/the-fox-news-rundown-7-4-2020-2/,https://radio.foxnews.com/wp-content/uploads/2020/05/Rundown-Featured-Image-NEW.png,2020-07-04T09:00:04Z,"Coronavirus cases spiked across the country this week, worrying both health experts and local leaders.
Many states have even decided to back off some of their reopening plans.
To discuss these grow… [+887 chars]",fox-news,Fox News
Katherine Tague,An Overlooked Onion,"This week, Tyrus and Kat hear from a fire truck stealer, a fish tank swimmer, and one man who leaves his girlfriend for not wearing makeup.",https://radio.foxnews.com/2020/07/04/an-overlooked-onion/,https://radio.foxnews.com/wp-content/uploads/2018/11/Tyrus-and-Timpf-Featured-Image-600x450.jpg,2020-07-04T09:00:00Z,"Tyrus reenacts what kind of kids he and Kat were in third grade.
Kat wonders if fire engines in Alaska have stained glass windows.
And Tyrus sounds off about the fish in Louisiana who need therapy.… [+153 chars]",fox-news,Fox News
Dom Calicchio,Toledo police officer fatally shot outside Home Depot store: reports,"A police officer was fatally shot outside a Home Depot store just after midnight Saturday in Toledo, Ohio, according to reports.",https://www.foxnews.com/us/toledo-police-officer-fatally-shot-outside-home-depot-store-reports,https://static.foxnews.com/foxnews.com/content/uploads/2020/04/Police-Tape-Line-iStock.jpg,2020-07-04T08:46:23Z,"A police officer was fatally shot outside a Home Depot store just after midnight Saturday in Toledo, Ohio, according to reports.
The officer was identified as Anthony Dia.
“It is with deep regret t… [+984 chars]",fox-news,Fox News
Dom Calicchio,MLB’s Cleveland Indians say they’re open to possible name change,Cleveland’s MLB team hasn’t always been called the Indians -- and the team indicated Friday it might soon be willing to change its name again.,https://www.foxnews.com/sports/mlbs-cleveland-indians-say-theyre-open-to-possible-name-change,https://static.foxnews.com/foxnews.com/content/uploads/2020/04/Progressive-Field.jpg,2020-07-04T08:05:38Z,"Cleveland’s MLB team hasn’t always been called the Indians -- and the team indicated Friday it might soon be willing to change its name again.
The Indians – previously known as the Forest Citys, Spi… [+2153 chars]",fox-news,Fox News
Kim Komando,Spouse cheating? 10 tech clues to find evidence,"Years of marriage will hone a spouse’s instincts, and we often know when something seems funny. Smartphones, tablets, computers, and smart tech absorb adulterous evidence like a sponge. Once suspicions are aroused, a digital trail could contain many clues abo…",https://www.foxnews.com/tech/spouse-cheating-10-tech-clues-to-find-evidence,https://static.foxnews.com/foxnews.com/content/uploads/2020/07/couple-in-bed.jpg,2020-07-04T08:00:19Z,"Years of marriage will hone a spouse’s instincts, and we often know when something seems funny. Smartphones, tablets, computers, and smart tech absorb adulterous evidence like a sponge. Once suspicio… [+8925 chars]",fox-news,Fox News
Associated Press,Denmark's Little Mermaid statue vandalized with 'racist fish' grafitti,The statue was created in tribute to the Danish storyteller Hans Christian Andersen.,https://www.foxnews.com/world/denmark-little-mermaid-statue-vandalized-racist-fish-grafitti,https://static.foxnews.com/foxnews.com/content/uploads/2020/07/AP20185261261549.jpg,2020-07-04T11:48:34Z,"The famed statue of Hans Christian Andersen’s Little Mermaid, one of Copenhagen’s biggest tourist draws, has been vandalized with the text “racist fish.”
The words were tagged on the stone on which … [+1435 chars]",fox-news,Fox News
David Asman,"David Asman: On July 4th, remember why US is a magnet for immigrants – like my wife, now a proud citizen",It's important on this July Fourth to spend a moment seeing the United States of America through the eyes of new citizens.,https://www.foxnews.com/opinion/fourth-july-immigrants-david-asman,https://static.foxnews.com/foxnews.com/content/uploads/2020/07/David-Asman-.jpg,2020-07-04T11:00:23Z,"Vice President Mike Pence paid tribute to 16 new Americans from 12 different nations Thursday at a naturalization ceremony in Washington. Ken Cuccinelli, acting director of U.S. Citizenship and Immig… [+3192 chars]",fox-news,Fox News
Dom Calicchio,Neil Young upset Trump event used his song: ‘This is NOT ok with me’,Neil Young made clear once again Friday that he doesn’t like it when one of his songs is used during a public appearance by President Trump.,https://www.foxnews.com/entertainment/neil-young-upset-trump-event-used-his-song-this-is-not-ok-with-me,https://static.foxnews.com/foxnews.com/content/uploads/2020/02/Neil-Young-Trump-AP.jpg,2020-07-04T10:28:55Z,"Neil Young made clear once again Friday that he doesn’t like it when one of his songs is used during a public appearance by President Trump.
On Friday night, Young’s 1989 song, “Rockin’ in the Free … [+2600 chars]",fox-news,Fox News
Fred Fleitz,"Fred Fleitz: At Mount Rushmore, Trump right to highlight danger leftist radicals pose to America",President Trump celebrated America’s independence and our nation’s 244th birthday Friday night with stirring speech at Mount Rushmore in South Dakota calling attention to serious threats America faces here at home from radical lawbreakers.,https://www.foxnews.com/opinion/trump-mount-rushmore-fred-fleitz,https://static.foxnews.com/foxnews.com/content/uploads/2020/07/AP20186092227694.jpg,2020-07-04T10:00:00Z,President Trump celebrated America’s independence and our nation’s 244th birthday Friday night with stirring speech at Mount Rushmore in South Dakota calling attention to serious threats America face… [+5659 chars],fox-news,Fox News
Adam Shaw,"Antonin Scalia, Jackie Robinson among those picked for Trump’s ‘National Garden’ of heroes",President Trump on Friday announced the creation of a National Garden of American heroes to pay tribute to historically significant Americans -- a garden that will include former Supreme Court Justice Antonin Scalia and baseball star Jackie Robinson among pas…,https://www.foxnews.com/politics/antonin-scalia-trump-national-garden-heroes-statues,https://cf-images.us-east-1.prod.boltdns.net/v1/static/694940094001/886fd345-403a-4a27-9f1f-2db70fbbc3d4/fed39aff-0dfb-45c5-855b-fa81d2d40632/1280x720/match/image.jpg,2020-07-04T13:50:17Z,President Trump on Friday announced the creation of a National Garden of American Heroes to pay tribute to historically significant Americans -- a garden that will include former Supreme Court Justic… [+4648 chars],fox-news,Fox News
