author,title,description,url,urlToImage,publishedAt,content,source.id,source.name
Vandana Rambaran,Special ed teacher who coughed on 1-year-old in yogurt shop fired from school district,A California special education teacher was fired from her school district after a video went viral of her allegedly intentionally coughing on a 1-year-old at a yogurt shop.,https://www.foxnews.com/us/special-ed-teacher-coughed-toddler-yogurt-shop-fired,https://static.foxnews.com/foxnews.com/content/uploads/2020/07/Teacher-Coughs-Baby-SAN-JOSE-POLICE-1.jpg,2020-07-04T18:35:59Z,"A California special education teacher was fired from her school district after a video went viral of her allegedly intentionally coughing on a 1-year-old at a yogurt shop.
FLORIDA REPORTS 14 PERCEN… [+1371 chars]",fox-news,Fox News
Robert Gearty,"California girls, 11 and 12, fatally shot at birthday pool party; 3 others wounded","Two young girls were attending a birthday pool party in California when they were shot and killed and three others were wounded, according to reports.",https://www.foxnews.com/us/california-girl-12-and-younger-friend-fatally-shot-at-birthday-pool-party-3-others-wounded,https://static.foxnews.com/foxnews.com/content/uploads/2020/07/Public-Advisory-DELANO-POLICE.jpg,2020-07-04T18:32:10Z,"Two girls attending a birthday pool party in California were fatally shot and three others were wounded, according to reports.
The girls, Elayna Saidee, 12, and Makeliah Osorno, 11, were the innocen… [+1473 chars]",fox-news,Fox News
Marisa Schultz,Biden calls for America to tackle 'systemic racism' in 4th of July message,Joe Biden's Fourth of July message focused on America's long history of racial injustice -- from politicianry to George Floyd's death -- as he called for Americans to strive to achieve the country's founding ideal of equality.,https://www.foxnews.com/politics/biden-america-tackle-systemic-racism-4th-of-july-message,https://static.foxnews.com/foxnews.com/content/uploads/2020/06/Joe-Biden-Speech-1-AP.jpg,2020-07-04T18:28:36Z,Joe Biden's Fourth of July message focused on America's long history of racial injustice -- from politicianry to George Floyd's death -- as he called for Americans to strive to achieve the country's found… [+2894 chars],fox-news,Fox News
Adam Shaw,"Trump gives optimistic Independence Day message, says US is ‘coming back’ after ‘terrible plague from China","President Trump on Saturday gave an optimistic Independence Day message to the nation, declaring that the U.S. is “coming back” and will be “greater than ever before” after it emerges from the coronavirus pandemic -- which he described as a “terrible plague f…",https://www.foxnews.com/politics/trump-independence-day-message-plague-china,https://cf-images.us-east-1.prod.boltdns.net/v1/static/694940094001/ce27f785-4f25-4d8a-8698-4cc69bb6779b/9e23034c-5c02-4507-b0f4-ef5f0587b254/1280x720/match/image.jpg,2020-07-04T18:22:45Z,"President Trump on Saturday gave an optimistic Independence Day message to the nation, declaring that the U.S. is “coming back” and will be “greater than ever before” after it emerges from the corona… [+1832 chars]",fox-news,Fox News
Fox News,103-year-old man qualifies for world record: oldest tandem skydiver,He took the jump with his grandsons to celebrate their graduation.,https://www.foxnews.com/us/103-record-oldest-skydiver,https://static.foxnews.com/foxnews.com/content/uploads/2020/07/Tandem-Skydive-iStock.jpg,2020-07-04T18:19:02Z,"A 103-year-old man from central Texas has qualified for the Guinness Book of World Records as the oldest tandem skydiver. 
Al Blaschke took the 14,000-foot plunge to celebrate his two grandsons grad… [+1413 chars]",fox-news,Fox News
Associated Press,Braves' Freddie Freeman 3 others test positive for coronavirus,"Atlanta Braves four-time All-Star Freddie Freeman, premier reliever Will Smith and two teammates have tested positive for the coronavirus, a jarring hit to the NL East champions less than three weeks before the start of the pandemic-delayed season.",https://www.foxnews.com/sports/braves-freddie-freeman-3-others-test-positive-for-coronavirus,https://static.foxnews.com/foxnews.com/content/uploads/2020/07/100615-HELP-WANTED-PI-CH.vresize.94-cab4f8cc0fb30510VgnVCM200000d6c1a8c0____.jpg,2020-07-04T18:14:04Z,"Atlanta Braves four-time All-Star Freddie Freeman, premier reliever Will Smith and two teammates have tested positive for the coronavirus, a jarring hit to the NL East champions less than three weeks… [+3366 chars]",fox-news,Fox News
Paulina Dedaj,"Miki Sudo, Joey Chestnut dominate annual Nathan's Hot Dog Eating Contest despite unusual atmosphere amid pandemic",The Nathan’s Famous Fourth of July International Hot Dog-Eating Contest did not disappoint this year despite the unusual format of the event in the wake of the coronavirus pandemic.,https://www.foxnews.com/sports/miki-sudo-joey-chestnut-nathans-hot-dog-eating-contest-pandemic,https://static.foxnews.com/foxnews.com/content/uploads/2020/07/Joey-Chestnut-Miki-Sudo-Nathans-AP.jpg,2020-07-04T18:09:58Z,"Nathan’s Famous Fourth of July International Hot Dog-Eating Contest did not disappoint this year despite the unusual format of the event in the wake of the coronavirus pandemic.
Seven-time winner Mi… [+1641 chars]",fox-news,Fox News
Vandana Rambaran,"Florida reports 14 percent coronavirus positivity rate, Miami-Dade and Broward County reach record high level of cases","Florida health officials recorded another record-breaking day, as cases of coronavirus spiked to its highest numbers yet in both Miami-Dade and Broward County.",https://www.foxnews.com/us/florida-14-percent-coronavirus-positivity-rate,https://static.foxnews.com/foxnews.com/content/uploads/2020/07/AP20186583091983.jpg,2020-07-04T18:00:24Z,"Florida health officials recorded another record-breaking day, as cases of coronavirus spiked to their highest numbers yet in both Miami-Dade and Broward County on Saturday.
HOW FOURTH OF JULY IN 20… [+3221 chars]",fox-news,Fox News
Associated Press,"31 MLB players, 7 staff test positive for COVID-19, or 1.2%","Thirty-one Major League Baseball players and seven staff members tested positive for COVID-19 during intake for the resumption of training, a rate of 1.2%.",https://www.foxnews.com/sports/31-mlb-players-7-staff-test-positive-for-covid-19-or-1-2,https://static.foxnews.com/foxnews.com/content/uploads/2020/06/Citi-Field.jpg,2020-07-04T18:00:12Z,"Thirty-one Major League Baseball players and seven staff members tested positive for COVID-19 during intake for the resumption of training, a rate of 1.2%.
MLB and the players' association announced… [+2026 chars]",fox-news,Fox News
Marisa Schultz,Trump wants to give Americans 'a worthy show' for Independence Day in 'Salute to America',"President Trump, who has railed against the ""cancel culture,"" refused to let the coronavirus pandemic close down a grand Fourth of July celebration in Washington, despite objections from local officials over rising infection rates.",https://www.foxnews.com/politics/trump-salute-to-america-white-house-event-july-fourth-independence-day,https://static.foxnews.com/foxnews.com/content/uploads/2020/07/Trump-Mt-Rushmore-Slideshow-07.jpg,2020-07-04T21:52:17Z,"President Trump, who has railed against the ""cancel culture,"" refused to let the coronavirus pandemic close down a grand Fourth of July celebration in Washington, despite objections from local offici… [+5606 chars]",fox-news,Fox News
Peter Aitken,"Spain puts 200,000 people in Catalonia back into lockdown after coronavirus spike","Spain has put approximately 200,000 people back under lockdown, but not confined to their homes, following a spike in coronavirus cases in the country, according to reports.",https://www.foxnews.com/world/spain-200000-people-lockdown-catalonia-coronavirus,https://static.foxnews.com/foxnews.com/content/uploads/2020/04/spain-children-lockdown2.jpg,2020-07-04T21:42:13Z,"Spain has put approximately 200,000 people back under lockdown, but not confined to their homes, following a spike in coronavirus cases in the country, according to reports. 
The spike in cases was … [+1887 chars]",fox-news,Fox News
Peter Aitken,"Massachusetts students inspire school bus driver to return to college, finish degree","A Massachusetts school bus driver returned to the classroom and earned his college degree, thanks to encouragement from the students he drove every day.",https://www.foxnews.com/us/massachusetts-students-school-bus-driver-return-college-finish-degree,https://static.foxnews.com/foxnews.com/content/uploads/2020/07/Clayton-Ward-Massbay-Community-College.jpg,2020-07-04T21:25:51Z,"A Massachusetts school bus driver returned to the classroom and earned his college degree, thanks to encouragement from the students he drove every day. 
Clayton Ward attended college in Virginia bu… [+2098 chars]",fox-news,Fox News
Allen West,Former Rep. Allen West: July 4th has special meaning for me as a black man who overcame discrimination,"It seems many Americans are embarrassed to celebrate our history. In fact, there are some who are actively trying to rewrite and even erase it.",https://www.foxnews.com/opinion/fourth-of-july-racial-discrimination-allen-west,https://cf-images.us-east-1.prod.boltdns.net/v1/static/694940094001/9bba318f-d34b-4776-8ad1-595ebccc7e23/954262a9-eb3f-4005-bd25-8c09e94e0dbc/1280x720/match/image.jpg,2020-07-04T21:07:31Z,"Having served 22 years in the U.S. Army and rising to the rank of lieutenant colonel, it always fills me with great pride to celebrate our nation’s Independence Day.
The extraordinary tale of how 13… [+4994 chars]",fox-news,Fox News
Nick Givas,Astronaut Doug Hurley tweets pic of American flag from International Space Station,"Astronaut Doug Hurley tweeted a picture of the American flag as seen from the International Space Station on Saturday, to celebrate the nation's independence and Fourth of July holiday.",https://www.foxnews.com/us/astronaut-doug-hurley-tweets-american-flag-international-space-station,https://static.foxnews.com/foxnews.com/content/uploads/2020/03/FS_American_Flag.png,2020-07-04T21:04:21Z,"Astronaut Doug Hurley tweeted a picture of the American flag as seen from the International Space Station (ISS) on Saturday, to celebrate the nation's independence and Fourth of July holiday.
""Wishi… [+834 chars]",fox-news,Fox News
Robert Gearty,"Illinois police chief, former Secret Service agent who took a bullet for Reagan announces retirement",An Illinois police chief is retiring 39 years after he stopped an assassin’s bullet intended for former President Ronald Reagan with his chest.,https://www.foxnews.com/us/illinois-police-chief-secret-service-bullet-reagan-retirement,https://static.foxnews.com/foxnews.com/content/uploads/2020/07/Tim-McCarthy-OFFICIAL-POLICE-CHIEF-PHOTO.jpg,2020-07-04T20:59:49Z,"An Illinois police chief is retiring 39 years after he stopped an assassin’s bullet intended for former President Ronald Reagan with his chest.
Tim McCarthy was part of Reagan’s Secret Service detai… [+2454 chars]",fox-news,Fox News
Sam Dorman,State Department official tells US companies to 'be aware' of Chinese brands using politician labor,Under Secretary of State Keith Krach warned on Saturday about the potential for international commerce to support brands benefiting from politician labor in China.,https://www.foxnews.com/media/keith-krach-china-forced-labor,https://static.foxnews.com/foxnews.com/content/uploads/2020/07/Keith-Krach-REUTERS.jpg,2020-07-04T20:49:11Z,"Under Secretary of State Keith Krach warned on Saturday about the potential for international commerce to support brands benefiting from politician labor in China.
He told ""Cavuto Live"" that he wanted bu… [+3314 chars]",fox-news,Fox News
Adam Shaw,"At UN Human Rights Council, 53 countries back China's draconian Hong Kong crackdown","Fifty-three countries at the U.N. Human Rights Council, led by Cuba, came out in support of China’s national security law this week -- a law that has formed the basis of the communist regime’s latest crackdown on the people of Hong Kong.",https://www.foxnews.com/politics/at-un-human-rights-council-53-back-chinas-hong-kong-crackdown,https://cf-images.us-east-1.prod.boltdns.net/v1/static/694940094001/d55cc3ce-229b-4c65-9b77-c20a2101d5ea/2108c5f5-187a-4004-a34b-bad75eb44f5c/1280x720/match/image.jpg,2020-07-04T20:45:04Z,"Fifty-three countries at the U.N. Human Rights Council, led by Cuba, came out in support of China’s national security law this week -- a law that has formed the basis of the communist regime’s latest… [+2320 chars]",fox-news,Fox News
Melissa Roberto,"Charlie Sheen celebrates 1 year of not smoking cigarettes, says he wishes he 'never started'",Charlie Sheen has a reason to celebrate Independence Day that has nothing to do with America.,https://www.foxnews.com/entertainment/charlie-sheen-celebrates-1-year-not-smoking-cigarettes,https://static.foxnews.com/foxnews.com/content/uploads/2018/09/8b133b87-CharlieSheen2.jpg,2020-07-04T20:38:10Z,"Charlie Sheen has a reason to celebrate Independence Day that has nothing to do with America.
The ""Two and a Half Men"" actor, 54, announced on Twitter that he's celebrating one year of quitting his … [+1681 chars]",fox-news,Fox News
Caitlin McFall,Justice Kavanaugh denies emergency request from Illinois GOP groups seeking to hold large rallies,Supreme Court Justice Brett Kavanaugh on Saturday denied an emergency appeal submitted by GOP lawmakers from Illinois that had argued against the governor’s restrictions on meeting in groups larger than 10 amid the coronavirus pandemic.,https://www.foxnews.com/politics/kavanaugh-denies-emergency-request-illinois-gop-groups-hold-large-rallies,https://static.foxnews.com/foxnews.com/content/uploads/2019/09/Kavanaugh.jpg,2020-07-04T20:26:40Z,Supreme Court Justice Brett Kavanaugh on Saturday denied an emergency appeal submitted by GOP lawmakers from Illinois that had argued against the governor’s restrictions on meeting in groups larger t… [+2442 chars],fox-news,Fox News
,Hits & Misses: 7/4/20,The 'Journal Editorial Report' panel calls out the week's best and worst.,http://video.foxnews.com/v/6169349444001/,https://cf-images.us-east-1.prod.boltdns.net/v1/static/694940094001/60bae20e-f200-40ab-8551-f8928df091e3/64a4f6c5-b8d4-480a-a8f9-05b8e506bcdf/1280x720/match/image.jpg,2020-07-04T20:02:09Z,,fox-news,Fox News
Nick Givas,Texas sees highest number of coronavirus cases recorded since start of pandemic,"Texas on Saturday reported its largest daily rise in confirmed coronavirus cases since the start of the pandemic -- 8,258 -- following a facial mask mandate from Gov. Greg Abbott in an effort to slow the uptick in cases.",https://www.foxnews.com/us/texas-highest-number-coronavirus-cases-recorded-since-pandemic,https://static.foxnews.com/foxnews.com/content/uploads/2020/07/AP20180641703603.jpg,2020-07-04T23:13:59Z,"Texas on Saturday reported its largest daily rise in confirmed coronavirus cases since the start of the pandemic -- 8,258 -- following a facial mask mandate from Gov. Greg Abbott in an effort to slow… [+1376 chars]",fox-news,Fox News
,Texas sees highest number of coronavirus cases recorded since start of pandemic - MSN Money,"<ol><li>Texas sees highest number of coronavirus cases recorded since start of pandemic  MSN Money
</li><li>Gov. Abbott, DSHS distribute additional cases of antiviral drug to 5 East Texas hospitals  KLTV
</li><li>Texas reports record number of new COVID-19 …",https://www.foxnews.com/us/texas-highest-number-coronavirus-cases-recorded-since-pandemic?cmpid=prn_msn,https://img-s-msn-com.akamaized.net/tenant/amp/entityid/BB16lbZL.img?h=630&w=1200&m=6&q=60&o=t&l=f&f=jpg,2020-07-04T23:13:00Z,"Texas on Saturday reported its largest daily rise in confirmed coronavirus cases since the start of the pandemic -- 8,258 -- following a facial mask mandate from Gov. Greg Abbott in an effort to slow… [+1562 chars]",fox-news,Fox News
