author,title,description,url,urlToImage,publishedAt,content,source.id,source.name
,Federal judge to sentence Justice Brett Kavanaugh's attempted assassin,"A defendant faces sentencing Friday for attempting to assassinate Supreme Court Justice Brett Kavanaugh, with prosecutors seeking 30 years in prison.",https://www.foxnews.com/politics/federal-judge-sentence-justice-brett-kavanaughs-attempted-assassin,https://static.foxnews.com/foxnews.com/content/uploads/2025/08/brett-kavanaugh.jpg,2025-10-03T10:00:50Z,"A judge is set to sentence Nicholas Roske on Friday for attempting to assassinate Supreme Court Justice Brett Kavanaugh in the weeks leading up to the high court's landmark Dobbs decision.
The Depar… [+3346 chars]",fox-news,Fox News
,"Fox News Digital's News Quiz: October 3, 2025",Weekly Fox News quiz tests current events knowledge featuring Republican senator voting against party funding bill and California woman's bathroom policy demonstration.,https://www.foxnews.com/lifestyle/fox-news-digitals-news-quiz-october-3-2025,https://static.foxnews.com/foxnews.com/content/uploads/2025/10/fox-news-quiz-photo-1.jpg,2025-10-03T10:00:33Z,"Test your news knowledge with this week's Fox News Digital News Quiz.
Looking for more of a challenge?
Disturbing flyers appeared on a university campus in last week's News Quiz.
Test yourself on … [+339 chars]",fox-news,Fox News
,Utah students refuse to stay silent after Charlie Kirk assassination despite safety concerns,"Fox News Digital spoke to students during TPUSA's visit to Utah State, to discuss their safety concerns when it comes to speaking out about their beliefs.",https://www.foxnews.com/media/utah-students-refuse-stay-silent-after-charlie-kirk-assassination-despite-safety-concerns,https://static.foxnews.com/foxnews.com/content/uploads/2025/10/utah-turning-point-students-gif.gif,2025-10-03T10:00:28Z,"Following the assassination of Charlie Kirk, safety was a top priority as Turning Point USA returned to Utah State on Tuesday. Fox News Digital asked attendees whether they fear for their physical sa… [+2914 chars]",fox-news,Fox News
,Treasure trove of priceless Celtic gold and silver coins unearthed at 'secret' European site,"Archaeologists found rare Celtic coins and artifacts at an Iron Age site in western Bohemia, including previously unknown coin types that could reshape historical understanding.",https://www.foxnews.com/travel/treasure-trove-priceless-celtic-gold-silver-coins-unearthed-secret-european-site,https://static.foxnews.com/foxnews.com/content/uploads/2025/10/czech-republic-ancient-coin-hoard-found-gold-silver-archaeology-3.jpg,2025-10-03T10:00:15Z,"Hundreds of priceless gold and silver coins were uncovered at a ""secret"" site in a picturesque region of the Czech Republic.
The discovery was announced by the Museum and Gallery of Northern Pilsen … [+3107 chars]",fox-news,Fox News
,Chipper Jones respond to claim pitting Brian Snitker against legendary Braves manager Bobby Cox,"Chipper Jones clashed with critics of former Braves manager Bobby Cox, whose achievements were compared to those of Brian Snitker, who retired after 10 seasons.",https://www.foxnews.com/sports/chipper-jones-respond-claim-pitting-brian-snitker-against-legendary-braves-manager-bobby-cox,https://static.foxnews.com/foxnews.com/content/uploads/2025/10/chipper-jones-atlanta-braves-mlb-all-star-game.jpg,2025-10-03T13:52:51Z,"The Atlanta Braves won 76 games, falling well short of the playoffs.
Shortly after the Braves defeated the Pittsburgh Pirates in the regular-season finale, longtime manager Brian Snitker announced h… [+2198 chars]",fox-news,Fox News
,49ers' Mac Jones explains motivation behind wearing suits on game day: 'I'm going to work',"San Francisco 49ers quarterback Mac Jones likes dressing for success, and the 2021 first-round pick has seen a lot of that in his first season with the Niners.",https://www.foxnews.com/sports/49ers-mac-jones-explains-motivation-behind-wearing-suits-game-day-im-going-work,https://static.foxnews.com/foxnews.com/content/uploads/2025/10/mac-jones-49ers-001.jpg,2025-10-03T13:35:29Z,"San Francisco 49ers
 quarterback Mac Jones appreciates showing up for work well-dressed.
Jones, who is 3-0 as the Niners starter, was asked about the inspiration behind his two-tone suit during his… [+1756 chars]",fox-news,Fox News
,Government shutdown sparks GOP plan to penalize lawmakers with new salary tax,"Lawmakers, unlike federal workers, are constitutionally required to receive a paycheck during a government shutdown.",https://www.foxnews.com/politics/government-shutdown-sparks-gop-plan-penalize-lawmakers-new-salary-tax,https://static.foxnews.com/foxnews.com/content/uploads/2025/10/bernie-moreno-speaks-to-reporters.jpg,2025-10-03T13:11:00Z,"FIRST ON FOX: A Senate Republican wants to ensure that lawmakers feel the pain in their wallets as the federal government shutdown drags on.
Members of Congress, unlike other federal employees, are … [+2617 chars]",fox-news,Fox News
,Windows 10 support ends: Upgrade to Windows 11 safely,"Step-by-step instructions help users migrate to Windows 11 while preserving emails, contacts, documents, and software licenses during the transition.",https://www.foxnews.com/tech/windows-10-support-ends-upgrade-windows-11-safely,https://static.foxnews.com/foxnews.com/content/uploads/2025/10/windows-11-update.jpg,2025-10-03T12:31:58Z,"With Microsoft ending support for Windows 10 this October, many people are racing to upgrade. Catherine, a longtime HP desktop user, shared her concerns with us: ""I need to purchase a new/updated com… [+10919 chars]",fox-news,Fox News
,"Harris admits campaign planned champagne, cupcakes, chief of staff for 2024 victory that never came","Former Vice President Kamala Harris' new book, ""107 Days,"" revealed she chose Denis McDonough to lead her White House team had she won the 2024 presidential election.",https://www.foxnews.com/politics/harris-admits-campaign-planned-champagne-cupcakes-chief-staff-2024-victory-never-came,https://static.foxnews.com/foxnews.com/content/uploads/2025/01/harris-speech.jpg,2025-10-03T12:30:23Z,"Former Vice President Kamala Harris revealed in her new book, ""107 Days,"" that she had quietly tapped Denis McDonough as her choice for chief of staff in the event she won the 2024 presidential elect… [+3036 chars]",fox-news,Fox News
,Who is the British citizen of Syrian descent accused of synagogue terror attack?,"The Manchester synagogue terror suspect has been identified by police as Jihad Al-Shamie, a 35-year-old British citizen of Syrian descent.",https://www.foxnews.com/world/who-british-citizen-syrian-descent-accused-synagogue-terror-attack,https://static.foxnews.com/foxnews.com/content/uploads/2025/10/synagogue-attack.jpg,2025-10-03T12:23:28Z,"The suspect behind the deadly car and knife terror attack outside a synagogue in Manchester in the United Kingdom on Thursday has been identified by police as Jihad Al-Shamie, a 35-year-old British c… [+3237 chars]",fox-news,Fox News
,Lori Loughlin splits from fashion designer husband five years after college admissions scandal,"Lori Loughlin separates from fashion designer husband Mossimo Giannulli, five years after their college admissions scandal convictions and prison sentences.",https://www.foxnews.com/entertainment/lori-loughlin-splits-from-fashion-designer-husband-five-years-after-college-admissions-scandal,https://static.foxnews.com/foxnews.com/content/uploads/2025/10/lori-loughlin-mossimo-giannulli.jpg,2025-10-03T12:20:21Z,"Lori Loughlin and her husband Mossimo Giannulli have separated, Fox News has learned. 
The ""Full House"" alum and her fashion designer husband have been married for nearly 28 years their anniversary … [+2082 chars]",fox-news,Fox News
,"Chappelle says it's easier to speak freely at Saudi Arabian comedy fest than in USA, brings up Charlie Kirk",Dave Chappelle and other comedians faced scrutiny after agreeing to perform at a Saudi Arabian comedy festival despite the kingdom's persecution of writers and activists.,https://www.foxnews.com/media/chappelle-says-its-easier-talk-freely-saudi-arabian-comedy-fest-than-usa-brings-up-charlie-kirk,https://static.foxnews.com/foxnews.com/content/uploads/2021/10/dave-chappelle.jpg,2025-10-03T12:06:59Z,"Comedians like Dave Chappelle poked fun at an alleged chilling effect on free speech in the U.S. after they signed contracts to do government-approved comedy acts at a festival in Saudi Arabia.
In t… [+3010 chars]",fox-news,Fox News
,Democrats blame GOP for Obamacare woes tied to pandemic-era subsidies,"Democrats say GOP policies could push Americans off their health coverage, but some critics argue Obamacare's enhanced tax credits don't address the root cause of high healthcare costs.",https://www.foxnews.com/politics/democrats-blame-gop-obamacare-woes-tied-pandemic-era-subsidies,https://static.foxnews.com/foxnews.com/content/uploads/2025/10/government-shutdown-obamacare-subsidies-democrats-affordable-care-act-republicans.jpg,2025-10-03T12:00:52Z,"Amid the ongoing government shutdown fight, the Democratic Party's message has largely focused on blaming Republicans for stripping ""millions"" of their health insurance because they won't approve exp… [+5449 chars]",fox-news,Fox News
,OnlyFans surge on college campuses sparks new safety fears as experts warn of hidden dangers,"Safety concerns mount as college students join OnlyFans for quick cash, with documented cases of stalkers breaking into creators' homes and living in attics.",https://www.foxnews.com/us/onlyfans-surge-college-campuses-sparks-new-safety-fears-experts-warn-hidden-dangers,https://static.foxnews.com/foxnews.com/content/uploads/2025/10/onlyfans-college-students-safety_05.jpg,2025-10-03T12:00:36Z,"A startling trend sweeping college campuses across the country is causing concern as students turn to untraditional ways to turn quick cash while in school. 
Shayna Loren, 21, is in her senior year … [+6508 chars]",fox-news,Fox News
,Maggie Baugh: What to know about Keith Urban's guitar player,"Keith Urban's guitarist Maggie Baugh has been thrust into the spotlight, while whispers continue to swirl about the country star's failed marriage to Nicole Kidman.",https://www.foxnews.com/entertainment/maggie-baugh-what-know-about-keith-urbans-guitar-player,https://static.foxnews.com/foxnews.com/content/uploads/2025/10/maggie-baugh-keith-urban-nicole-kidman.jpg,2025-10-03T12:00:30Z,"Keith Urban
's guitarist Maggie Baugh has been thrust into the spotlight, while whispers continue to swirl about the country star's failed marriage to Nicole Kidman.
Days before Kidman filed for di… [+5290 chars]",fox-news,Fox News
,Gen Z drinkers leave bartenders frustrated with shrinking tips as 'terrible' trend emerges,"Young Americans are tipping less at bars and restaurants, though some Generation Z college graduates still prioritize leaving 20% gratuity for service workers.",https://www.foxnews.com/food-drink/gen-z-drinkers-leave-bartenders-frustrated-shrinking-tips-terrible-trend-emerges,https://static.foxnews.com/foxnews.com/content/uploads/2025/09/bartender-pouring-mixed-drink.jpg,2025-10-03T12:00:26Z,"Fewer young Americans are tipping at restaurants and bars these days.
A Bankrate survey released this summer revealed that members of Generation Z those born in the late 1990s and early 2000s are th… [+3114 chars]",fox-news,Fox News
,"ICE chief fires back at Chicago-area mayor, cites ‘violent rioters’ after weeks of Broadview unrest","ICE leader Todd Lyons shot back at a progressive mayor and ""violent rioters"" who he said have been ""laying siege"" to immigration enforcement operations in the Chicago area.",https://www.foxnews.com/politics/ice-shoots-back-against-violent-rioters-progressive-mayor-after-weeks-protests-chicago-suburb,https://static.foxnews.com/foxnews.com/content/uploads/2025/10/chicago-anti-ice-activist.jpg,2025-10-03T12:00:15Z,"Acting ICE Director Todd Lyons fired back at a progressive mayor who accused the agency of waging a war on her community and slammed ""violent rioters"" who he said have been ""laying siege"" to immigrat… [+3079 chars]",fox-news,Fox News
,"Taylor Swift shares inside look at Travis Kelce’s romantic proposal, talks wedding planning in rare interview","Taylor Swift opens up about her engagement to NFL superstar Travis Kelce, describing his fairytale proposal with a custom-built garden during her first TV appearance since the milestone day.",https://www.foxnews.com/entertainment/taylor-swift-inside-look-travis-kelces-romantic-proposal-wedding-planning,https://static.foxnews.com/foxnews.com/content/uploads/2024/04/travis-kelce-taylor-swift.jpg,2025-10-03T15:38:12Z,"Taylor Swift
 is finally sharing details behind her engagement to NFL superstar Travis Kelce and according to her, the Kansas City Chiefs tight end did not fumble the proposal.
Swift, who released … [+3412 chars]",fox-news,Fox News
,"Prosecutors seek 97 years for teen who shot dead sister-in-law, 2 young nephews",Prosecutors in New Hampshire will tell a judge Friday that a teen who admitted killing his sister-in-law and her two sons should spend 97 years in jail.,https://www.foxnews.com/us/prosecutors-seek-97-years-teen-who-shot-dead-sister-in-law-2-young-nephews,https://static.foxnews.com/foxnews.com/content/uploads/2025/10/eric-sweeney-court.png,2025-10-03T15:38:08Z,"Prosecutors in New Hampshire will tell a judge Friday that a teenager who admitted to killing his sister-in-law and her two sons in 2022 should spend nearly a century behind bars.
Eric Sweeney, who … [+4098 chars]",fox-news,Fox News
Allison Strasius,FOX NATION SECURES EXCLUSIVE U.S. RIGHTS TO DOCUSERIES “ELIZABETH TAYLOR: REBEL SUPERSTAR”,"The Three-Part Documentary Executive Produced by Kim Kardashian Premieres Monday Only on FOX Nation   NEW YORK — October 6, 2025 — FOX Nation today announced it has acquired exclusive U.S. rights to Elizabeth Taylor: Rebel Superstar, the three-part docuseries…",https://press.foxnews.com/2025/10/fox-nation-secures-exclusive-u-s-rights-to-docuseries-elizabeth-taylor-rebel-superstar,,2025-10-03T15:31:42Z,"The Three-Part Documentary Executive Produced by Kim Kardashian Premieres Monday Only on FOX Nation  
NEW YORK October 3, 2025 FOX Nation today announced it has acquired exclusive U.S. rights to Eli… [+2788 chars]",fox-news,Fox News
,"Atlantic article likens Charlie Kirk to George Floyd, sparking online fury","Atlantic writer Thomas Chatterton Williams faced backlash on social media after drawing parallels between Charlie Kirk and George Floyd, whose death in 2020 sparked violent riots.",https://www.foxnews.com/media/atlantic-article-likens-charlie-kirk-george-floyd-sparking-online-fury,https://static.foxnews.com/foxnews.com/content/uploads/2025/09/charlie-kirk-memorial-funeral-020.jpg,2025-10-03T15:19:41Z,"An opinion piece in The Atlantic on Thursday claimed that ""MAGA has found its George Floyd"" after Turning Point USA founder Charlie Kirk was assassinated last month sparking outrage from conservative… [+3123 chars]",fox-news,Fox News
,"UNC professor reinstated after ‘threat assessment’ of ‘political violence’ concerns, ties to far-left gun club",UNC Chapel Hill professor Dwayne Dixon reinstated following investigation into his involvement with Redneck Revolt anti-fascist organization.,https://www.foxnews.com/us/unc-professor-reinstated-after-threat-assessment-political-violence-concerns-ties-far-left-gun-club,https://static.foxnews.com/foxnews.com/content/uploads/2025/10/unc-dwayne-dixon-professor_02.jpg,2025-10-03T15:02:48Z,FIRST ON FOX: The University of North Carolina at Chapel Hill professor with ties to an anti-fascist gun group has been reinstated after being placed on administrative leave earlier this week over co… [+5948 chars],fox-news,Fox News
,Meta account suspension scam hides FileFix malware,New FileFix attack tricks Facebook and Instagram users into running malicious PowerShell commands disguised as Meta account maintenance to deploy StealC infostealer.,https://www.foxnews.com/tech/meta-account-suspension-scam-hides-filefix-malware,https://static.foxnews.com/foxnews.com/content/uploads/2023/04/3-FACEBOOK-ON-LAPTOP.jpg,2025-10-03T14:56:27Z,"Cybercriminals continue to find new ways to target social media users, and Meta accounts remain one of the most common lures. Losing access to Facebook or Instagram can have real consequences for bot… [+8041 chars]",fox-news,Fox News
,'Squad' Dem launches comeback House bid after anti-Israel views torpedoed campaign: 'We need a fighter',"Progressive ""Squad"" member former Rep. Cori Bush, D-Mo., launches new campaign for Congress more than a year after primary defeat to pro-Israel candidate in Missouri.",https://www.foxnews.com/politics/squad-dem-launches-comeback-bid-after-anti-israel-views-torpedoed-campaign-we-need-fighter,https://static.foxnews.com/foxnews.com/content/uploads/2024/08/cori-bush-primary-loss.jpg,2025-10-03T14:55:56Z,"Former Rep. Cori Bush, D-Mo., announced on Friday that she is mounting a comeback congressional bid more than a year after losing her Democratic primary to a more moderate challenger.
""St. Louis des… [+3513 chars]",fox-news,Fox News
,Padres players held back after confronting umpires following controversial season-ending loss to Cubs,The San Diego Padres’ season ended in a 3-1 loss to the Chicago Cubs after Xander Bogaerts’ strikeout led to a heated confrontation with umpires.,https://www.foxnews.com/sports/padres-players-held-back-after-confronting-umpires-following-controversial-season-ending-loss-cubs,https://static.foxnews.com/foxnews.com/content/uploads/2025/10/xander-bogaerts-10325.jpg,2025-10-03T14:54:48Z,"The San Diego Padres' season ended on Thursday night, but they did not head home before letting the umpires hear a mouthful.
The Padres fell to the Chicago Cubs, 3-1, in a decisive Game 3 of the Nat… [+2226 chars]",fox-news,Fox News
,Trump puts Hamas on notice with deadline to accept Gaza peace deal,"President Donald Trump warns Hamas fighters will be killed unless hostage agreement reached by Sunday evening, vowing Middle East peace one way or another.",https://www.foxnews.com/politics/trump-puts-hamas-on-notice-deadline-accept-gaza-peace-deal,https://static.foxnews.com/foxnews.com/content/uploads/2025/08/donald-trump-oval-office-speaking.jpg,2025-10-03T14:43:48Z,"President Donald Trump issued a blistering public warning to Hamas on Friday, saying the ""ruthless"" terrorist group will be ""hunted down, and killed"" unless they release the remaing Israeli hostages … [+791 chars]",fox-news,Fox News
,Obama-nominated federal judge married to House Dem recuses himself from Oregon National Guard case,"Judge Michael Simon, who is married to U.S. Rep. Suzanne Bonamici, has recused himself from a case pertaining to the president's move to call the Oregon National Guard into federal service.",https://www.foxnews.com/politics/obama-nominated-federal-judge-married-house-dem-recuses-himself-from-oregon-national-guard-case,https://static.foxnews.com/foxnews.com/content/uploads/2025/10/suzanne-bonamici.jpg,2025-10-03T14:41:52Z,"Federal Judge Michael H. Simon, the husband of Democratic Rep. Suzanne Bonamici of Oregon, has recused himself from a case involving a legal challenge against the Trump administration's move to call … [+2540 chars]",fox-news,Fox News
,Blame Game: Republicans claim Schumer forced shutdown 'because he’s terrified' of AOC primary challenge,"Vice President JD Vance accused Senate Minority Leader Sen. Chuck Schumer, D-N.Y., of causing the federal shutdown to avoid a potential Rep. Alexandria Ocasio-Cortez, D-N.Y., primary.",https://www.foxnews.com/politics/blame-game-republicans-claim-schumer-forced-shutdown-because-hes-terrified-aoc-primary-challenge,https://static.foxnews.com/foxnews.com/content/uploads/2025/10/rep.-alexandria-ocasio-cortez-and-sen.-chuck-schumer.jpg,2025-10-03T14:20:56Z,"In the intensifying blame-game battle over the federal government shutdown, Republicans are relentless in who they see as the culprit and his motive.
Top Republicans charge that Senate Minority Lead… [+6111 chars]",fox-news,Fox News
,Diddy sentencing begins as rapper faces up to 20 years behind bars,"The disgraced music mogul Sean ""Diddy"" Combs faces sentencing on federal prostitution charges with prosecutors recommending 135 months behind bars.",https://www.foxnews.com/entertainment/diddy-sentencing-federal-charges,https://static.foxnews.com/foxnews.com/content/uploads/2025/06/sean-diddy-combs-trial-day-26-001.jpg,2025-10-03T14:12:57Z,"Sean ""Diddy"" Combs appeared in court Friday, months after he was convicted on federal prostitution charges.
Diddy is expected to speak in open court before his sentence is handed down. Judge Arun Su… [+3333 chars]",fox-news,Fox News
,Supreme Court takes Second Amendment case challenging Hawaii gun law,"The Supreme Court said Friday that it will review a challenge to Hawaii's handgun restrictions, as the Trump administration defends the Second Amendment,",https://www.foxnews.com/politics/supreme-court-takes-second-amendment-case-challenging-hawaii-gun-law,https://static.foxnews.com/foxnews.com/content/uploads/2025/09/supreme-court-building.jpg,2025-10-03T14:04:53Z,"The Supreme Court will review a case regarding Hawaii's laws restricting where people are able to carry firearms.
Hawaii's law bans guns on private property unless the owner has specifically allowed… [+510 chars]",fox-news,Fox News
,Furloughed SBA staffers unleash on Democrats for shutdown in searing auto-replies,"Furloughed SBA employees use out-of-office messages to blame Democrats for blocking federal funding bill, citing impact on 320 businesses and $170 million in loans.",https://www.foxnews.com/politics/furloughed-sba-staffers-unleash-democrats-shutdown-searing-auto-replies,https://static.foxnews.com/foxnews.com/content/uploads/2025/10/kelly-loeffler-oval-office.jpg,2025-10-03T14:01:30Z,"Staffers with the Small Business Administration who were placed on furlough set up automatic response emails pinning blame on Democrats for the shutdown, which they said already has affected hundreds… [+3370 chars]",fox-news,Fox News
,"Ernst demands $2T in federal cuts, urges Trump team to 'make DC squeal' amid shutdown fight",Office of Management and Budget Director Russ Vought plans to withhold $30 billion in funding for blue states and cities to inflict maximum pain on congressional Democrats.,https://www.foxnews.com/politics/ernst-demands-2t-federal-cuts-urges-trump-team-make-dc-squeal-amid-shutdown-fight,https://static.foxnews.com/foxnews.com/content/uploads/2025/09/joni-ernst-shutdown-1.jpg,2025-10-03T17:51:34Z,"FIRST ON FOX: A Senate Republican has a list of more than a ""trillion dollars worth of ideas ripe for a trim"" as the federal government shutdown continues. 
Office of Management and Budget Director … [+2993 chars]",fox-news,Fox News
,Pennsylvanians weigh in on Eagles' controversial 'tush push' as team remains undefeated through Week 4,"According to a Quinnipiac University poll, 72% of Pennsylvania football fans support keeping the Philadelphia Eagles’ debated “tush push"" play legal in the NFL.",https://www.foxnews.com/sports/pennsylvanians-weigh-eagles-controversial-tush-push-team-remains-undefeated-through-week-4,https://static.foxnews.com/foxnews.com/content/uploads/2025/09/nfl-eagles-tush-push-091525-1.jpg,2025-10-03T17:47:52Z,"Several NFL teams tried desperately to outlaw the ""tush push"" this offseason, which has become notorious for being a staple of the Philadelphia Eagles' success.
The Eagles have converted a first dow… [+2089 chars]",fox-news,Fox News
,Rising climbing star plunges to death from Yosemite's El Capitan mid-livestream,"Alaskan climber Balin Miller, 23, died in a tragic fall from El Capitan at Yosemite National Park during a livestreamed climbing accident on Wednesday.",https://www.foxnews.com/us/rising-climbing-star-plunges-death-from-yosemites-el-capitan-mid-livestream,https://static.foxnews.com/foxnews.com/content/uploads/2025/10/balin-miller.jpg,2025-10-03T17:45:33Z,"Tragedy struck Yosemite National Park Wednesday when popular Alaskan climber Balin Miller, 23, fell to his death from the iconic El Capitan an accident reportedly captured during a livestream. 
""It … [+2513 chars]",fox-news,Fox News
,Pirates fan who fell over 20 feet onto PNC Park field during game charged with prowling: report,"Kavan Markwood, the Pirates fan who suffered a terrifying fall at a game in April, was charged after reportedly trying to enter the home of an ex-girlfriend.",https://www.foxnews.com/sports/pirates-fan-who-fell-over-20-feet-onto-pnc-park-field-during-game-charged-prowling-report,https://static.foxnews.com/foxnews.com/content/uploads/2025/10/pirates-kavan-markwood-001.jpg,2025-10-03T17:37:36Z,"The Pittsburgh Pirates
 fan who fell from the stands of PNC Park in April and was later invited by the team to throw out the first pitch at a game is now facing legal trouble after being accused of … [+1849 chars]",fox-news,Fox News
,Tennessee governor praises federal government's crackdown on crime in Memphis,"Tennessee Gov. Bill Lee praised the federal crackdown on crime in Memphis during an interview with ""Fox & Friends"" on Friday, calling the operation a ""generational opportunity.""",https://www.foxnews.com/media/tennessee-governor-praises-federal-crackdown-memphis-crime,https://static.foxnews.com/foxnews.com/content/uploads/2025/10/bill-lee-fox-interview.jpg,2025-10-03T17:33:34Z,"Tennessee Gov. Bill Lee appeared on ""Fox &amp; Friends"" Friday, praising the Trump administration's federal crackdown on crime in Memphis.
In the Trump administration's latest move to combat crime i… [+2394 chars]",fox-news,Fox News
