author,title,description,url,urlToImage,publishedAt,content,source.id,source.name
Fox News Staff,Fox News AI Newsletter: AI bad actors 'not very Christian',Stay up to date on the latest AI technology advancements and learn about the challenges and opportunities AI presents now and for the future.,https://www.foxnews.com/tech/ai-newsletter-ai-bad-actors-not-very-christian,https://static.foxnews.com/foxnews.com/content/uploads/2024/09/erik.jpg,2024-09-28T12:30:35Z,"Welcome to Fox News Artificial Intelligence newsletter with the latest AI technology advancements.
IN TODAYS NEWSLETTER:
- 'CHiPs' star Erik Estrada says certain people using AI are not 'very Chris… [+1470 chars]",fox-news,Fox News
Michael Dorgan,"2 Georgia police officers shot responding to gun store burglary, suspect dead","Two Georgia police officers were injured during while responding to a burglary at the “actual largest gun store in the world"" just after midnight Saturday.",https://www.foxnews.com/us/2-georgia-police-officers-shot-responding-gun-store-burglary-suspect-dead,https://static.foxnews.com/foxnews.com/content/uploads/2024/09/Georgia-shooting.jpg,2024-09-28T12:17:10Z,"Two Georgia police officers were injured during a shootout with a suspected gun store burglar just after midnight Saturday morning.
Smyrna and Cobb County police responded to a 911 call at 12:16 a.m… [+2110 chars]",fox-news,Fox News
Andrew Miller,FLASHBACK: Arizona Dem Senate candidate called Trump voters 'dumb': 'Worst people in the world',"Arizona Democratic Senate candidate Ruben Gallego said in 2016 that then-President-elect Donald Trump's campaign drew out the ""worst people in the world"" who he will never ""appeal to.""",https://www.foxnews.com/politics/flashback-arizona-dem-senate-candidate-called-trump-voters-dumb-worst-people-world,https://static.foxnews.com/foxnews.com/content/uploads/2024/09/file-17.png,2024-09-28T12:00:17Z,"A House Democrat running for Senate in a key swing state bashed voters who supported then-President-elect Donald Trump in a resurfaced interview.
""I think Donald Trump ran a xenophobic campaign that… [+2412 chars]",fox-news,Fox News
Gabriel Hays,"Network evening newscasts barely mention new ICE report on 425,000 criminal migrants free in U.S.",All but one of the major U.S. news networks failed to acknowledge new ICE data revealing that hundreds of thousands illegal immigrants convicted of other crimes are in the U.S.,https://www.foxnews.com/media/network-evening-newscasts-barely-mention-new-ice-report-425000-criminal-migrants-free-u-s,https://static.foxnews.com/foxnews.com/content/uploads/2024/03/LesterHolt.jpg,2024-09-28T15:31:34Z,"""NBC Nightly News"" was the only prime time network news program on Friday night to report on bombshell new Immigration and Customs Enforcement (ICE) data revealing that over 400,000 illegals immigran… [+3292 chars]",fox-news,Fox News
Paulina Dedaj,Swiss cyclist dead at 18 after sustaining fatal head injuries in crash at Road World Championships,"Muriel Furrer, 18, died Friday after sustaining a fatal head injury in a crash at the Road and Para-cycling Road World Championships in Zurich, the International Cycling Union (UCI) announced.",https://www.foxnews.com/sports/swiss-cyclist-dead-18-after-sustaining-fatal-head-injuries-crash-road-world-championships,https://static.foxnews.com/foxnews.com/content/uploads/2024/09/Muriel-Furrer-2.jpg,2024-09-28T15:07:11Z,"The cycling community is mourning the tragic death of 18-year-old Swiss cyclist
 Muriel Furrer after she died Friday from a serious head injury following a crash at the Road and Para-cycling Road Wo… [+1781 chars]",fox-news,Fox News
Christina Dugan Ramirez,Barry Williams says 'Brady Bunch' costars 'all hooked up with each other',"In a new interview, Barry Williams opened up about the past relationships and hook-ups shared between his “Brady Bunch"" costars.",https://www.foxnews.com/entertainment/barry-williams-says-brady-bunch-costars-all-hooked-up-each-other,https://static.foxnews.com/foxnews.com/content/uploads/2024/09/barry-williams.jpg,2024-09-28T14:56:38Z,"Join Fox News for access to this content
You have reached your maximum number of articles. Log in or create an account FREE of charge to continue reading.
By entering your email and pushing continu… [+2618 chars]",fox-news,Fox News
Christine Rousselle,"Monosodium glutamate, or MSG, gets a fresh look from experts","Monosodium glutamate, better known as ""MSG,"" is a staple ingredient in Asian cuisine, but it has faced controversy in the United States. Experts shared the latest perspectives.",https://www.foxnews.com/food-drink/monosodium-glutamate-msg-gets-fresh-look-experts,https://static.foxnews.com/foxnews.com/content/uploads/2024/09/iStock-1391826762.jpg,2024-09-28T14:49:01Z,"Monosodium glutamate, or MSG a food additive that is often found in Asian cuisine has had something of a negative reputation over the last 60 years. Some food experts insist that's unfair. 
""To talk… [+4784 chars]",fox-news,Fox News
Joseph Wulfsohn,Maher rips rapper's profanity-laced tired against USA: ‘Sure it was a big hit with the Queers for Gaza crowd',"HBO's Bill Maher took Macklemore to task after the Grammy-winning rapper went viral this week when he declared ""f--- America"" at an anti-Israel concert in Seattle.",https://www.foxnews.com/media/maher-rips-rappers-profanity-laced-tired-against-usa-sure-big-hit-queers-gaza-crowd,https://static.foxnews.com/foxnews.com/content/uploads/2024/09/MaherMacklemore.jpg,2024-09-28T14:21:14Z,"Join Fox News for access to this content
Plus special access to select articles and other premium content with your account - free of charge.
By entering your email and pushing continue, you are ag… [+5161 chars]",fox-news,Fox News
Ashlyn Messier,"‘American Gothic’, famous piece by artist Grant Wood, is displayed to visitors at the Art Institute of Chicago","Iowa-born Grant Wood completed ""American Gothic"" in 1930. It became a famous piece that generated speculation from viewers about its subjects.",https://www.foxnews.com/world/american-gothic-famous-piece-artist-grant-wood,https://static.foxnews.com/foxnews.com/content/uploads/2024/09/grant-wood-american-gothic.jpg,2024-09-28T14:17:07Z,"""American Gothic"" is a famous piece of artwork by Iowa-born Grant Wood.
The painting by Wood depicts a man and a woman standing in front of a house. 
The man, a farmer, wears overalls, with a pitch… [+2103 chars]",fox-news,Fox News
"Kurt Knutsson, CyberGuy Report",Beware of the new sneaky parking QR code scam,"While you may feel pretty sharp at spotting online fraud, there's a sneaky new scam involving QR codes and parking meters across the country affecting even the most cautious people.",https://www.foxnews.com/tech/beware-new-sneaky-parking-qr-code-scam,https://static.foxnews.com/foxnews.com/content/uploads/2024/09/4-Beware-of-the-new-sneaky-parking-QR-code-scam-1.jpg,2024-09-28T14:00:53Z,"Ever scanned a QR code to pay for parking and thought, ""Wow, that was easy?"" 
Well, hold onto your smartphones because we're about to tell you about a sneaky new scam that's giving parkers everywher… [+7240 chars]",fox-news,Fox News
Jamie Joseph,'It is abusive': Iowa AG rips leading pediatric group for not 'following the science' for trans youth,"Iowa AG, Brenna Bird, joined a letter signed by 20 state AGs demanding the American Academy of Pediatrics update its recommendations to reflect accurate warnings about the risk of puberty blockers and other hormone treatments for trans youth.",https://www.foxnews.com/politics/iowa-ag-rips-leading-pediatric-group-not-following-science-trans-youth,https://static.foxnews.com/foxnews.com/content/uploads/2024/09/BrennaBird.jpg,2024-09-28T14:00:09Z,EXCLUSIVE: Iowa Attorney General Brenna Bird is doubling down on her calls for the country's leading pediatric association to update its guidelines for transgender youth to include warnings about the… [+3692 chars],fox-news,Fox News
Michael Dorgan,Alleged sex worker and john exit NYC brothel 24 hours after police raid it: video,"A long commercial strip in Queens, New York City, has become such a hotbed for open air prostitution that when police raided a brothel there last week, the same cathouse was open for business again within 24 hours, an astonishing Fox News Digital video shows.",https://www.foxnews.com/us/alleged-sex-worker-john-exit-nyc-brothel-24-hours-after-police-raid-it-video,https://static.foxnews.com/foxnews.com/content/uploads/2024/09/sex-worker-prostitute-fearture.jpg,2024-09-28T17:56:32Z,"Join Fox News for access to this content
You have reached your maximum number of articles. Log in or create an account FREE of charge to continue reading.
By entering your email and pushing continu… [+4648 chars]",fox-news,Fox News
Ryan Canfield,Virginia Tech player blasts ACC after reversed walk-off Hail Mary: 'I wanna see consequences',Virginia Tech wide receiver Stephen Gosnell expressed his frustrations with the ACC after the Hokies' walk-off Hail Mary touchdown was overturned.,https://www.foxnews.com/sports/virginia-tech-player-blasts-acc-reversed-walk-off-hail-mary-i-wanna-see-consequences,https://static.foxnews.com/foxnews.com/content/uploads/2024/09/Miami-Hurricanes-2.jpg,2024-09-28T17:36:15Z,"Virginia Tech had done it. They had pulled off a major upset over the No. 7 ranked Miami Hurricanes on a walk-off Hail Mary on the road at least they thought they had.
With three seconds left, down … [+1909 chars]",fox-news,Fox News
Paulina Dedaj,Idaho gov praises Boise State’s decision to forfeit women’s volleyball match against team with trans player,Idaho governor Brad Little praised Boise State for forfeiting its match against San Jose State University amid controversy surrounding a trans member of the Spartan's team.,https://www.foxnews.com/sports/idaho-gov-praises-boise-states-decision-forfeit-womens-volleyball-match-against-team-trans-player,https://static.foxnews.com/foxnews.com/content/uploads/2024/09/brad-little.jpg,2024-09-28T16:56:14Z,"Join Fox News for access to this content
Plus special access to select articles and other premium content with your account - free of charge.
By entering your email and pushing continue, you are ag… [+3496 chars]",fox-news,Fox News
Christine Rousselle,"Wife's refusal to learn to cook, says Reddit user, is harming the marriage: 'Loses patience'",A Reddit user sought advice after getting into an argument with her spouse about the partner's continued refusal to learn how to have any sort of basic cooking skills. An expert weighed in.,https://www.foxnews.com/food-drink/wifes-refusal-learn-cook-reddit-user-harming-marriage-patience,https://static.foxnews.com/foxnews.com/content/uploads/2024/09/iStock-1639832295.jpg,2024-09-28T16:53:27Z,"A Reddit user who was upset a spouse was refusing to learn to cook or even embrace basic food preparation skills was not wrong for bringing up the issue, said a family therapist as well as other user… [+5299 chars]",fox-news,Fox News
Christina Dugan Ramirez,Kristin Cavallari and Mark Estes breakup after 7 months of dating: 'It's so fresh',"Seven months after debuting her relationship with Mark Estes, Kristin Cavallari reportedly confirmed she's single during an appearance at Alex Cooper’s “Unwell"" tour live show.",https://www.foxnews.com/entertainment/kristin-cavallari-mark-estes-breakup-after-7-months-dating-its-so-fresh,https://static.foxnews.com/foxnews.com/content/uploads/2024/09/kristina-cavallari.jpg,2024-09-28T16:27:39Z,"Kristin Cavallari and Mark Estes have called it quits after seven months of dating, according to multiple reports. 
During an appearance at Alex Coopers ""Unwell"" tour live show in Austin, Texas on F… [+2540 chars]",fox-news,Fox News
Kasra Aarabi,Iran's options dwindle as it prepares retaliation for death of Nasrallah,"Experts from United Against Nuclear Iran weigh Iran's options in the wake of Israel's stunning move to eliminate the leader of Hezbollah, Iran's key anti-Israel proxy. Tehran's choices are all fraught with peril.",https://www.foxnews.com/opinion/irans-options-dwindle-prepares-retaliation-death-nasrallah,https://static.foxnews.com/foxnews.com/content/uploads/2024/08/da610309-GettyImages-2160445712.jpg,2024-09-28T16:13:32Z,"As the death of Hezbollah secretary-general Hassan Nasrallah is confirmed, the immediate question is not whether Iran will respond, but how.    
Hezbollah is a creation of the Islamic Republic, buil… [+4775 chars]",fox-news,Fox News
Joseph Wulfsohn,Bill Maher suggests Eric Adams is getting rough treatment: 'They're coming down on him a little hard',"HBO's Bill Maher appeared sympathetic towards New York City Mayor Eric Adams, suggesting the indictment against him is a ""little hard"" based on criminal accusations.",https://www.foxnews.com/media/bill-maher-suggests-eric-adams-getting-rough-treatment-theyre-coming-down-him-little-hard,https://static.foxnews.com/foxnews.com/content/uploads/2024/09/MaherAdams.jpg,2024-09-28T16:13:08Z,"Join Fox News for access to this content
Plus special access to select articles and other premium content with your account - free of charge.
By entering your email and pushing continue, you are ag… [+2834 chars]",fox-news,Fox News
Adam Shaw,Venezuelan illegal immigrant charged with slew of violent crimes was released multiple times by Va officials,"An illegal immigrant from Venezuela was released multiple times by authorities despite being charged with a number of serious crimes, authorities said.",https://www.foxnews.com/politics/venezuelan-illegal-immigrant-charged-violent-crimes-released-multiple-times-va-officials,https://static.foxnews.com/foxnews.com/content/uploads/2024/09/GettyImages-945291440.jpg,2024-09-28T16:00:28Z,A Venezuelan illegal immigrant charged with a slew of crimes was released multiple times by authorities in Virginia despite Immigration and Customs Enforcement (ICE) pleas to transfer him into their … [+3292 chars],fox-news,Fox News
Ryan Morik,Minnesota falls to No. 12 Michigan to go under .500 with Gov Tim Walz in attendance,"Minnesota governor Tim Walz almost saw an incredible comeback in Ann Arbor, but the Golden Gophers came up just short against No. 12 Michigan.",https://www.foxnews.com/sports/minnesota-falls-no-12-michigan-go-under-500-gov-tim-walz-attendance,https://static.foxnews.com/foxnews.com/content/uploads/2024/09/mich-minn.jpg,2024-09-28T19:51:15Z,"The pregame went much better for Tim Walz than his state's college football program.
The University of Minnesota headed to Ann Arbor for a Big Ten matchup with No. 12 Michigan, and the reigning cham… [+1910 chars]",fox-news,Fox News
Associated Press,A far-right party is looking for a historic election win in Austria,"Austria's far-right Freedom Party could win its first national election when the country votes on Sunday, but polls point to a close race in the parliamentary election.",https://www.foxnews.com/world/far-right-party-looking-historic-election-win-austria,https://static.foxnews.com/foxnews.com/content/uploads/2024/09/Austria-Election.jpg,2024-09-28T19:36:05Z,"Austria's far-right Freedom Party could win a national election for the first time when Austria votes on Sunday, tapping into voters' anxieties about immigration, inflation, Ukraine and other concern… [+5368 chars]",fox-news,Fox News
Associated Press,Pope gets an earful from Belgian king and abuse victims over scandals and failures to respond,The king of Belgium and its prime minister ripped into the institution Pope Francis heads for covering up abuse and for the Catholic Church's views on women and the LGBTQ+ community.,https://www.foxnews.com/world/pope-earful-belgian-king-abuse-victims-scandals-failures-respond,https://static.foxnews.com/foxnews.com/content/uploads/2024/09/Belgium-Pope.jpg,2024-09-28T19:33:20Z,"On a brutal day for Pope Francis, the king of Belgium, its prime minister and the rector of the Catholic university that invited him here all ripped into the institution he heads for a spectrum of si… [+7070 chars]",fox-news,Fox News
Ryan Morik,"Livvy Dunne celebrates Paul Skenes striking out Aaron Judge, Juan Soto in last start of historic rookie season","Paul Skenes dazzled in his final start of his historic rookie season, striking out Aaron Judge and Juan Soto, much to the delight of his girlfriend, Livvy Dunne.",https://www.foxnews.com/sports/livvy-dunne-celebrates-paul-skenes-striking-out-aaron-judge-juan-soto-last-start-historic-rookie-season,https://static.foxnews.com/foxnews.com/content/uploads/2024/09/paul-skenes.jpg,2024-09-28T18:58:04Z,"The best is yet to come for Paul Skenes. On Saturday, he looked like a longtime ace.
The Pittsburgh Pirates selected the right-handed pitcher with the first overall pick last year, and he dominated … [+1826 chars]",fox-news,Fox News
Paulina Dedaj,LeBron James likens start of NBA career to Caitlin Clark amid scrutiny: ‘In support of her since day one’,LeBron James likens start of NBA career to Caitlin Clark amid scrutiny: ‘In support of her since day one’,https://www.foxnews.com/sports/lebron-james-likens-start-nba-career-caitlin-clark-scrutiny-support-her-since-day-one,https://static.foxnews.com/foxnews.com/content/uploads/2024/09/james-clark.jpg,2024-09-28T18:52:47Z,"NBA great LeBron James
 recently opened up about his ""respect"" for Indiana Fever rookie Caitlin Clark, adding that he can relate to the pressure the young WNBA star has faced in her first year in th… [+2891 chars]",fox-news,Fox News
Gabriel Hays,Liberal journalist ripped for complaining about flight attendant wishing her a ‘blessed’ night: 'Grow up',"Social media users ripped Mother Jones editor-in-chief Clara Jeffery for complaining about a flight attendant wished her a ""blessed night"" as she disembarked from a recent flight.",https://www.foxnews.com/media/liberal-journalist-ripped-complaining-about-flight-attendant-wishing-her-blessed-night-grow-up,https://static.foxnews.com/foxnews.com/content/uploads/2024/09/Alaska-Airlines-flight-hits-brakes-on-takeoff-due-to-potential-traffic-conflict-at-BNA-.png,2024-09-28T18:31:20Z,"Social media users mocked Mother Jones editor-in-chief Clara Jeffery after she publicly complained about a flight attendant wishing her and other passengers a ""blessed"" night at the end of a recent f… [+3269 chars]",fox-news,Fox News
Brie Stimson,SpaceX launches mission to space station that will bring back stranded NASA astronauts next year,An astronaut and a cosmonaut launched with two empty seats for the International Space Station on Saturday in a capsule expected to bring back two stranded astronauts.,https://www.foxnews.com/us/spacex-launches-mission-space-station-bring-back-stranded-nasa-astronauts-next-year,https://static.foxnews.com/foxnews.com/content/uploads/2024/09/SpaceXLaunch4.jpg,2024-09-28T21:19:37Z,"SpaceX on Saturday launched a Falcon rocket from Cape Canaveral, Florida, on Saturday with two crew members on board to deliver the Dragon capsule to the International Space Station that will bring b… [+2784 chars]",fox-news,Fox News
Yael Halon,'Negative impact': Fetterman introduces Stop the Scroll Act to target social media harms,"Sens. John Fetterman and Katie Britt spoke about the Stop the Scroll Act that creates a mental health warning label requirement for social media platforms on ""Special Report.""",https://www.foxnews.com/media/fetterman-introduces-stop-the-scroll-act-target-social-media-harms,https://static.foxnews.com/foxnews.com/content/uploads/2024/06/GettyImages-2155440874.jpg,2024-09-28T21:00:31Z,"Sen. John Fetterman, D-Pa., spoke on bipartisan legislation he introduced Tuesday to warn parents about the harmful effects of social media, saying his efforts are ""common sense.""
Fetterman and Sen.… [+3840 chars]",fox-news,Fox News
Paulina Dedaj,Augusta National assesses damage to course after ‘catastrophic and historic impact’ of Hurricane Helene,Augusta National Golf Club chairman Fred Ridley put out a statement Saturday that the historic course and the home of the Masters was assessing damage following Hurricane Helene.,https://www.foxnews.com/sports/augusta-national-assesses-damage-course-after-catastrophic-historic-impact-hurricane-helene,https://static.foxnews.com/foxnews.com/content/uploads/2024/09/augusta.jpg,2024-09-28T20:59:53Z,"Augusta National
 is assessing the damage to the historic golf course that hosts the first major of the year, after Hurricane Helene swept through the region, killing at least 52 people in its path … [+1818 chars]",fox-news,Fox News
Ryan Canfield,Unranked Kentucky upsets No. 6 Ole Miss after kicker misses potential game-tying field goal,The Kentucky Wildcats went on the road and upset No. 6 Ole Miss after Rebels' kicker Caden Davis missed a potential game-tying field goal.,https://www.foxnews.com/sports/unranked-kentucky-upsets-no-6-ole-miss-after-kicker-misses-potential-game-tying-field-goal,https://static.foxnews.com/foxnews.com/content/uploads/2024/09/Kentucky-Football-1.jpg,2024-09-28T20:59:12Z,"The Kentucky Wildcats almost shocked the world, nearly upsetting top-ranked Georgia two weeks ago. On Saturday, they officially shocked the world.
The Wildcats went on the road and upset sixth-ranke… [+2268 chars]",fox-news,Fox News
Ryan Morik,Panthers owner donates $3 million to Hurricane Helene relief efforts; Bucs also give seven figures,"After Hurricane Helene ravaged the southeast, owners of the Carolina Panthers and Tampa Bay Buccaneers combined to give $4 million in relief efforts.",https://www.foxnews.com/sports/panthers-owner-donates-3-million-hurricane-helene-relief-efforts-bucs-also-give-seven-figures,https://static.foxnews.com/foxnews.com/content/uploads/2024/09/tepper.jpg,2024-09-28T20:41:46Z,"Owners of two NFL franchises have combined to give $4 million to help with Hurricane Helene recovery efforts.
David and Nicole Tepper, the owners of the Carolina Panthers, announced a $3 million com… [+1870 chars]",fox-news,Fox News
Lori Bashian,"Heidi Klum, Eva Longoria show off curves in body-baring gowns: PHOTOS","Heidi Klum, actress Eva Longoria and other Hollywood stars left their mark on Paris Fashion Week when they appeared in body-baring dresses.",https://www.foxnews.com/entertainment/heidi-klum-eva-longoria-show-curves-body-baring-gowns-photos,https://static.foxnews.com/foxnews.com/content/uploads/2024/09/heidi-klum-eva-longoria.jpg,2024-09-28T20:16:57Z,"Heidi Klum
Heidi Klum returned to the runway as one of the models at the ""Le Défilé L'Oréal Paris Walk Your Worth"" show. The 51-year-old former supermodel wore a figure-hugging floor-length black la… [+5131 chars]",fox-news,Fox News
Chantz Martin,"49ers' Kyle Shanahan, Brandon Aiyuk appear to have animated discussion over receiver's practice shorts",Tempers flared during a recent 49ers practice session after head coach Kyle Shanahan made it clear that the star wide receiver's shorts were not the right color.,https://www.foxnews.com/sports/49ers-kyle-shanahan-brandon-aiyuk-appear-have-animated-discussion-over-receivers-practice-shorts,https://static.foxnews.com/foxnews.com/content/uploads/2024/09/Brandon-Aiyuk-Kyle-Shanahan.jpg,2024-09-28T20:16:14Z,"The San Francisco 49ers have already dealt with their fair share of issues this season. 
The defending NFC champions have seen multiple key players miss time due to injury, with even more uncertaint… [+2373 chars]",fox-news,Fox News
Christina Dugan Ramirez,Tom Cruise surprises crowd at 'Top Gun: Maverick' live orchestral screening in London: 'dream come true',"During a live orchestral concert and viewing of ""Top Gun: Maverick"" at London's Royal Albert Hall on Friday, Tom Cruise surprised and thanked the crowd prior to the film's start.",https://www.foxnews.com/entertainment/tom-cruise-surprises-crowd-top-gun-maverick-live-orchestral-screening-london,https://static.foxnews.com/foxnews.com/content/uploads/2024/09/tom-cruise.jpg,2024-09-28T20:13:31Z,"Tom Cruise sure knows how to make a grand entrance.
During a live orchestral concert and viewing of ""Top Gun: Maverick"" at London's Royal Albert Hall on Friday, the 62-year-old actor surprised the c… [+2531 chars]",fox-news,Fox News
Melissa Rudy,"'For better sleep, how can I reduce nighttime bathroom trips?': Ask a doctor","Nighttime bathroom trips can wreak havoc on your sleep, but there are some practical ways to manage them. A doctor provides six tips to improve your rest.",https://www.foxnews.com/health/better-sleep-how-can-reduce-nighttime-bathroom-trips-ask-doctor,https://static.foxnews.com/foxnews.com/content/uploads/2024/09/man-awake.jpg,2024-09-28T20:04:27Z,"One in three Americans over 30 wake up at least twice each night to use the restroom, studies show.
These frequent interruptions can wreak havoc on your sleep, but there are some practical ways to m… [+3282 chars]",fox-news,Fox News
Paulina Dedaj,Harris campaign to troll Trump during Georgia-Alabama game with flyover banner: report,The Harris campaign is reportedly planning to fly a banner over Bryant-Denny Stadium trolling former President Trump when he attends the Georgia-Alabama game Saturday.,https://www.foxnews.com/sports/harris-campaign-troll-trump-during-georgia-alabama-game-flyover-banner-report,https://static.foxnews.com/foxnews.com/content/uploads/2024/09/trump-mint-hill3.jpg,2024-09-28T20:01:24Z,"Vice President Kamala Harris has reportedly arranged for a banner trolling former President Trump to fly over Bryant-Denny Stadium, where he is expected to make an appearance during Saturdays SEC sho… [+1913 chars]",fox-news,Fox News
