author,title,description,url,urlToImage,publishedAt,content,source.id,source.name
Chantz Martin,Justin Fields offers candid response when asked to compare Steelers' coaching to Bears': 'It's not close',"Justin Fields and the Bears have turned the page, but the star quarterback took a moment to reflect on his experience with the coaching staff during his time in the Windy City.",https://www.foxnews.com/sports/justin-fields-offers-candid-response-when-asked-compare-steelers-coaching-bears-its-not-close,https://static.foxnews.com/foxnews.com/content/uploads/2024/09/Justin-Fields-Steelers.jpg,2024-09-28T01:50:01Z,"Quarterback Justin Fields experienced his share of ups and downs throughout his 40-game tenure with the Chicago Bears
, but he seems to have found his footing in Pittsburgh with the Steelers.
The B… [+2440 chars]",fox-news,Fox News
Andrew Miller,"VP Harris outlines ‘orderly and secure’ immigration plan, rips Trump in first border stop since nomination",VP Harris spoke near the southern border in Arizona on Friday evening and outlined plans she has to combat the crisis while ripping the policies of former President Trump.,https://www.foxnews.com/politics/vp-harris-outlines-orderly-secure-immigration-plan-rips-trump-first-border-stop-since-nomination,https://static.foxnews.com/foxnews.com/content/uploads/2024/09/file-6.jpg,2024-09-28T01:37:50Z,"DOUGLAS, Ariz. Vice President Harris made her first appearance Friday at the southern border since becoming the Democratic nominee for president, and delivered a speech pledging to crack down on ille… [+6448 chars]",fox-news,Fox News
Ryan Morik,"Brittney Griner blasts 'new fans' who hurled 'racial slurs' at her, other WNBA players","WNBA veteran Brittney Griner supported fellow players in the league Thursday, saying they ""don't deserve"" the ""racial slurs"" from ""new fans.""",https://www.foxnews.com/sports/brittney-griner-blasts-new-fans-who-hurled-racial-slurs-her-other-wnba-players,https://static.foxnews.com/foxnews.com/content/uploads/2023/06/Brittney-Griner.jpg,2024-09-28T01:33:32Z,"Ten-time All-Star Brittney Griner says the WNBA's ""new fans"" crossed the line this year.
The Phoenix Mercury star opened up about the ""racial slurs"" she and other players heard from ""new fans"" throu… [+1553 chars]",fox-news,Fox News
Sarah Rumpf-Whitten,"Virginia FAA contractor allegedly spied for Iran, shared private info on US airports, energy industry: DOJ","A former Federal Aviation Administration contractor was indicted for acting as an illegal agent for the Iranian government, Department of Justice officials allege.",https://www.foxnews.com/world/virginia-faa-contractor-allegedly-spied-iran-shared-private-info-us-airports-energy-industry-doj,https://static.foxnews.com/foxnews.com/content/uploads/2024/09/suspect-2.jpg,2024-09-28T01:14:44Z,"A former Federal Aviation Administration (FAA) contractor was indicted Friday for acting as an illegal agent for the Iranian government, the Department of Justice said.
According to a DOJ release, f… [+2404 chars]",fox-news,Fox News
Jackson Thompson,Deion Sanders' Colorado program deletes post with player underwater for UCF game after Hurricane Helene deaths,The Colorado Football account on X posted an image that depicted safety Cam'Ron Silmon-Craig standing in knee-high water ahead of his team's game against UCF.,https://www.foxnews.com/sports/deion-sanders-colorado-program-deletes-post-player-underwater-ucf-game-after-hurricane-helene-deaths,https://static.foxnews.com/foxnews.com/content/uploads/2024/09/47626f4e-Deion-Sanders-1.jpg,2024-09-28T01:13:50Z,"The University of Colorado's football team, led by head coach Deion Sanders, will play the University of Central Florida Saturday in Orange County, Florida. Hurricane Helene has wreaked havoc in rece… [+3011 chars]",fox-news,Fox News
David Marcus,DAVID MARCUS: Kamala Harris finally visits the border. Was George Orwell her travel agent?,"Columnist David Marcus writes that Vice President Kamala Harris'; trip to the border amid surging migrant crime is rich. She helped create the mess and hasn't done a thing despite being Biden's ""Border Czar,"" Marcus writes.",https://www.foxnews.com/opinion/david-marcus-kamala-harris-finally-visits-border-george-orwell-her-travel-agent,https://static.foxnews.com/foxnews.com/content/uploads/2024/09/AP24271578989647-copy.jpg,2024-09-28T01:11:37Z,"It was George Orwell, in his seminal book ""1984,"" which turned out to be about 40 years off, who wrote that eventually the state would make us believe that 2 + 2 = 5. Vice President Kamala Harris inc… [+3175 chars]",fox-news,Fox News
Ryan Morik,"White Sox lose 121st game of the season, setting new MLB record","The Chicago White Sox have set the record nobody want to make - they lost their 121st game of the season, the most ever in a single MLB season.",https://www.foxnews.com/sports/white-sox-lose-121st-game-season-setting-new-mlb-record,https://static.foxnews.com/foxnews.com/content/uploads/2024/09/white-sox-pitcher.jpg,2024-09-28T00:59:28Z,"The 1962 New York Mets are no longer the most lovable losers.
The Chicago White Sox lost their 121st game of the season on Friday night, surpassing that Mets team for the most losses in an MLB seaso… [+2135 chars]",fox-news,Fox News
Ryan Canfield,Billie Jean King makes history as the first individual female athlete to be awarded Congressional Gold Medal,Tennis legend Billie Jean King will become the first individual female athlete to be awarded the Congressional Gold Medal in United States history.,https://www.foxnews.com/sports/billie-kean-king-makes-history-becoming-first-individual-female-athlete-awarded-congressional-gold-medal,https://static.foxnews.com/foxnews.com/content/uploads/2024/09/Billie-Jean-King-1.jpg,2024-09-28T00:53:23Z,"Billie Jean King keeps making history. 
The 80-year-old will become the first individual female athlete to be awarded the Congressional Gold Medal. 
King had already been awarded the Presidential M… [+1840 chars]",fox-news,Fox News
Louis Casiano,California man accused of throwing bomb in courthouse said government took his firearms away: DOJ,"A California man who allegedly threw a bomb into a courthouse this week was upset over an issue with his firearm, federal prosecutors said Friday.",https://www.foxnews.com/us/california-man-accused-throwing-bomb-courthouse-government-took-firearm-doj,https://static.foxnews.com/foxnews.com/content/uploads/2024/09/arrest.jpg,2024-09-28T00:42:23Z,"The man who allegedly threw a bomb inside a California courthouse this week, injuring five people, said he was upset about his firearms being taken away, authorities said. 
Nathaniel James McGuire, … [+2197 chars]",fox-news,Fox News
Ryan Canfield,"Raiders' Maxx Crosby, Davante Adams sidelined with injuries for Week 4 matchup against Browns",The Las Vegas Raiders will be without two of their best players when they take on the Cleveland Browns Sunday. Maxx Crosby and Davante Adams will both miss the game due to injury.,https://www.foxnews.com/sports/raiders-maxx-crosby-davante-adams-sidelined-injuries-week-4-matchup-against-browns,https://static.foxnews.com/foxnews.com/content/uploads/2024/09/Crosby-Adams-2.jpg,2024-09-28T00:27:39Z,"The Las Vegas Raiders are going to be without some of their top players when they take on the Cleveland Browns Sunday.
Elite pass rusher Maxx Crosby will miss the game due to a high ankle sprain, an… [+1904 chars]",fox-news,Fox News
Janelle Ash,'Harry Potter' star Maggie Smith receives tributes from Hollywood: 'We will never see another',"Tributes quickly began to pour in after the death of ""Downton Abbey"" and ""Harry Potter"" actress Maggie Smith. Smith died ""peacefully"" in her sleep Friday.",https://www.foxnews.com/entertainment/harry-potter-star-maggie-smith-receives-tributes-from-hollywood-we-never-see-another,https://static.foxnews.com/foxnews.com/content/uploads/2024/09/Maggie_Smith.jpg,2024-09-28T00:17:30Z,"Actress Maggie Smith died ""peacefully"" Sept. 27, and Hollywood did not hesitate with tributes.
Daniel Radcliffe, Smith's ""Harry Potter"" co-star, issued a statement honoring the star, who portrayed P… [+5717 chars]",fox-news,Fox News
Adam Shaw,White House mum amid outrage over data showing how many illegal immigrant criminals are free in US,The White House did not immediately comment on data showing the number of noncitizen convicted criminals who are not detained in ICE custody.,https://www.foxnews.com/politics/white-house-mum-amid-outrage-data-showing-many-illegal-immigrant-criminals-free-us,https://static.foxnews.com/foxnews.com/content/uploads/2024/09/biden-harris-border.jpg,2024-09-28T00:16:42Z,The White House has yet to comment on new data released to lawmakers showing the number of illegal immigrants with convictions for sex offenses and homicide convictions and who are not in Immigration… [+5806 chars],fox-news,Fox News
Chantz Martin,Nick Saban 'really impressed' by successor Kalen DeBoer so far this season,Former Washington coach Kalen DeBoer faced the unenviable task of filling the shoes of legendary college football coach Nick Saban at Alabama.,https://www.foxnews.com/sports/nick-saban-really-impressed-his-successor-kalen-deboer-so-far-season,https://static.foxnews.com/foxnews.com/content/uploads/2024/09/Nick-Saban.jpg,2024-09-28T00:01:02Z,"In January, Nick Saban announced he would retire from coaching. The surprising move led to Kalen DeBoer's hiring. 
From the moment DeBoer was formally introduced as the next head coach of the Alabam… [+1933 chars]",fox-news,Fox News
Lorraine Taylor,NC gubernatorial candidate Mark Robinson hospitalized following 'incident' at campaign event,"North Carolina gubernatorial candidate Mark Robinson was hospitalized and being treated for burns after an ""incident"" at a campaign event in Mt. Airy on Friday evening.",https://www.foxnews.com/politics/nc-gubernatorial-candidate-mark-robinson-hospitalized-following-incident-campaign-event,https://static.foxnews.com/foxnews.com/content/uploads/2024/09/GettyImages-2166169035-scaled.jpg,2024-09-28T03:47:25Z,"North Carolina gubernatorial candidate Mark Robinson was hospitalized following an ""incident"" at a campaign event on Friday evening, Fox News Digital has confirmed. 
""Lt. Gov. Mark Robinson is curre… [+2952 chars]",fox-news,Fox News
Ryan Morik,"Knicks, Timberwolves close to exchanging All-Stars in potential blockbuster trade: reports",The New York Knicks and Minnesota Timberwolves are reportedly close to exchanging Julius Randle and Karl-Anthony Towns in a potential blockbuster trade.,https://www.foxnews.com/sports/knicks-timberwolves-close-exchanging-all-stars-potential-blockbuster-trade-reports,https://static.foxnews.com/foxnews.com/content/uploads/2024/09/randle-towns-1.jpg,2024-09-28T03:14:34Z,"The New York Knicks are making one more big move before the season starts to capitalize on their championship window.
According to multiple reports, the Knicks are on the verge of acquiring Karl-Ant… [+2374 chars]",fox-news,Fox News
Landon Mion,"Arkansas couple allegedly tried to sell baby for $1K, beer because caring for baby, 3 dogs 'was not working'","An Arkansas couple is facing felony charges after allegedly attempting to sell their 2-month-old baby to a man for $1,000 and a six-pack of beer.",https://www.foxnews.com/us/arkansas-couple-allegedly-tried-sell-baby-1k-beer-because-caring-baby-3-dogs-was-not-working,https://static.foxnews.com/foxnews.com/content/uploads/2024/09/arkansascouple.png,2024-09-28T04:43:02Z,"An Arkansas couple was arrested after allegedly attempting to sell their two-month-old baby to a man at a campground for $1,000 and a six-pack of beer.
Darien Urban, 21, and Shalene Ehlers, 20, face… [+4476 chars]",fox-news,Fox News
Ryan Morik,Virginia Tech’s walk-off Hail Mary touchdown reversed after review; No. 7 Miami avoids upset,"Virginia Tech thought they pulled off a huge upset on the road against No. 7 Miami with a walk-off Hail Mary touchdown, but it was reversed, giving the Canes a win.",https://www.foxnews.com/sports/virginia-tech-walk-off-hail-mary-touchdown-reversed-review-miami-avoids-upset,https://static.foxnews.com/foxnews.com/content/uploads/2024/09/hurricanes.jpg,2024-09-28T04:24:48Z,"Virginia Tech thought they upset No. 7 Miami on the road, but victory was, almost quite literally, snatched from their hands.
With three seconds left and down four points, Hokies quarterback Kyron D… [+2046 chars]",fox-news,Fox News
Sarah Rumpf-Whitten,"Fate of Hezbollah chief unknown after he was targeted in Israeli strike, 2 Hezbollah leaders killed","The fate of Hezbollah leader Hassan Nasrallah is still unknown hours after the Israel Defense Forces unleashed a ""targeted attack"" against the central headquarters of Hezbollah.",https://www.foxnews.com/world/fate-hezbollah-chief-unknown-after-he-targeted-israeli-strike-2-hezbollah-leaders-killed,https://static.foxnews.com/foxnews.com/content/uploads/2024/01/hezbollah-chief-sayyed-hassan-nasrallah-televised-address.jpg,2024-09-28T04:18:06Z,"The fate of Hezbollah's leader Hassan Nasrallah is unknown following the Israeli Defense Forces' ""targeted attack"" against the central headquarters of Hezbollah in Beirut, Lebanon.
 
Fox News has l… [+2237 chars]",fox-news,Fox News
Landon Mion,Israeli forces say head of Hamas in southern Syria killed in strike,The Israeli Defense Forces said Saturday morning that it has eliminated the head of the Hamas terrorist network in southern Syria amid the ongoing war between Israel and Hamas.,https://www.foxnews.com/world/israeli-forces-say-head-hamas-southern-syria-killed-strike,https://static.foxnews.com/foxnews.com/content/uploads/2024/09/idfactivity.png,2024-09-28T07:38:27Z,"The Israeli Defense Forces (IDF) announced Saturday morning that it eliminated the head of the Hamas terrorist network in southern Syria.
The Israeli Air Force struck Ahmad Muhammad Fahd following i… [+738 chars]",fox-news,Fox News
"Jackson Thompson, Lorraine Taylor",College football team stranded in buses on flooded interstate amid Hurricane Helene destruction,A college football team was stranded on buses in the middle of a flooded interstate in North Carolina on Friday night because of Hurricane Helene.,https://www.foxnews.com/sports/college-football-team-stranded-buses-flooded-interstate-amid-hurricane-helene-destruction,https://static.foxnews.com/foxnews.com/content/uploads/2024/09/strandedfootballteam.png,2024-09-28T07:15:52Z,"A college football team was stranded on buses in the middle of a flooded interstate in North Carolina on Friday night, as Hurricane Helene continued to bring flash flooding across multiple southeaste… [+3304 chars]",fox-news,Fox News
Landon Mion,Israeli forces take out head of Hamas in southern Syria,The Israeli Defense Forces said Saturday morning that it has eliminated the head of the Hamas terrorist network in southern Syria amid the ongoing war between Israel and Hamas.,https://www.foxnews.com/world/israeli-forces-take-out-head-hamas-southern-syria,https://static.foxnews.com/foxnews.com/content/uploads/2024/09/idfactivity.png,2024-09-28T07:06:19Z,"The Israeli Defense Forces (IDF) announced Saturday morning that it eliminated the head of the Hamas terrorist network in southern Syria.
The Israeli Air Force struck Ahmad Muhammad Fahd following i… [+738 chars]",fox-news,Fox News
Landon Mion,Woman caught smuggling more than 700 pounds of bologna at southern border: CBP,A woman was caught smuggling more than 700 pounds of Mexican bologna and more than 280 boxes of undeclared prescription medications through the U.S.-Mexico border.,https://www.foxnews.com/us/woman-caught-smuggling-more-than-700-pounds-bologna-southern-border-cbp,https://static.foxnews.com/foxnews.com/content/uploads/2024/09/bologna.png,2024-09-28T09:18:33Z,"A woman was busted in Presidio, Texas, for smuggling more than 700 pounds of prohibited Mexican bologna and more than 280 boxes of undeclared prescription medications through the Southern Border.
Th… [+2063 chars]",fox-news,Fox News
Melissa Rudy,"Drinking alcohol is linked to six types of cancer, experts say: ‘It’s toxic’","More than 5% of all cancer cases are caused by drinking alcohol, according to a new report from the American Association for Cancer Research. An addition specialist discusses the risk.",https://www.foxnews.com/health/drinking-alcohol-linked-six-types-cancer-experts-say-toxic,https://static.foxnews.com/foxnews.com/content/uploads/2024/09/drinking-alcohol-split.jpg,2024-09-28T08:30:58Z,"Join Fox News for access to this content
Plus special access to select articles and other premium content with your account - free of charge.
By entering your email and pushing continue, you are ag… [+4593 chars]",fox-news,Fox News
"Peter Aitken, Lorraine Taylor",Israeli military says Hezbollah leader Hassan Nasrallah killed in Beirut strike,The Israeli Defense Forces (IDF) confirmed the leader of the Hezbollah terrorist organization Hassan Nasrallah died in its strike Friday against the group’s headquarters in Lebanon.,https://www.foxnews.com/world/israeli-military-says-hezbollah-leader-hassan-nasrallah-killed-beirut-strike,https://static.foxnews.com/foxnews.com/content/uploads/2024/09/Hezbollah-Attacks.jpeg,2024-09-28T08:23:14Z,"The Israeli Defense Forces (IDF) confirmed the leader of the Hezbollah terrorist organization
 Hassan Nasrallah died in its strike Friday against the groups headquarters in Lebanon.
""This is not th… [+2578 chars]",fox-news,Fox News
Ashley DiMella,Abandoned luxury hotel in Florida will reopen after 17 years,"A hotel in Palm Beach, Florida, that has been abandoned for 17 years will be opening its doors in November while staying true the the coastal vibe of the popular island.",https://www.foxnews.com/travel/abandoned-luxury-hotel-florida-set-reopen-17-years,https://static.foxnews.com/foxnews.com/content/uploads/2024/09/pb-house.png,2024-09-28T08:00:48Z,"A highly anticipated luxury hotel is finally reopening in the heart of Palm Beach, Florida, after closing in 2007.
L+R Iconic Luxury Hotels purchased the property, which is situated in a prime locat… [+2615 chars]",fox-news,Fox News
Christina Dugan Ramirez,Olivia Newton-John’s daughter says ‘dark side’ of fame led to certain lifelong struggles,"In an exclusive interview, Chloe Lattanzi opened up about healing after the loss of her mom, Olivia Newton-John, and explained how she's found herself amid the ""dark side"" of fame.",https://www.foxnews.com/entertainment/olivia-newton-john-daughter-says-dark-side-fame-led-lifelong-struggles-self-identity,https://static.foxnews.com/foxnews.com/content/uploads/2024/09/chloe-lattanzi.jpg,2024-09-28T08:00:48Z,"Join Fox News for access to this content
Plus special access to select articles and other premium content with your account - free of charge.
By entering your email and pushing continue, you are ag… [+6409 chars]",fox-news,Fox News
Charles Creitz,'Not American': Rural and urban voters in crucial battleground state alarmed by violent political rhetoric,"Voters in both urban and rural parts of Pennsylvania spoke out about electoral fairness, the issues driving their vote and whether they think the political rhetoric has gone too far.",https://www.foxnews.com/politics/rural-urban-voters-crucial-battleground-state-violent-political-rhetoric,https://static.foxnews.com/foxnews.com/content/uploads/2024/09/kamala-harris-donald-trump-split.jpg,2024-09-28T08:00:37Z,"During a swing through Central Pennsylvania, Fox News Digital spoke with several voters in urban and rural areas, and got their take on the effects of charged political rhetoric among other topics.
… [+7589 chars]",fox-news,Fox News
Paul Steinhauser,Harris-Trump cash dash: Former president looks to flip script with fundraising swing in oil country,Why does Vice President Kamala Harris enjoy a substantial fundraising advantage over former President Trump in their 2024 election showdown?,https://www.foxnews.com/politics/harris-trump-cash-dash-former-president-flip-script-fundraising-swing-oil-country,https://static.foxnews.com/foxnews.com/content/uploads/2024/09/trump-harris-recent-split.jpg,2024-09-28T08:00:21Z,"Trailing Vice President Kamala Harris in the 2024 cash dash, former President Trump heads next week to Texas, a state that's long served as an ATM for Republican White House candidates.
Aiming to na… [+5527 chars]",fox-news,Fox News
Christina Dugan Ramirez,"Diddy sex trafficking probe brings unwanted scrutiny to stars: 'Silence is the best option,' expert says","After Sean ""Diddy"" Combs' arrest in New York City last week, some of Hollywood's elite are gaining unwanted attention and scrutiny due to their past ties to the music mogul.",https://www.foxnews.com/entertainment/diddy-sex-trafficking-probe-brings-unwanted-scrutiny-stars-silence-best-option-expert-says,https://static.foxnews.com/foxnews.com/content/uploads/2024/09/661edba1-diddy-indictment-arrest.jpg,2024-09-28T08:00:10Z,"Join Fox News for access to this content
Plus special access to select articles and other premium content with your account - free of charge.
By entering your email and pushing continue, you are ag… [+13627 chars]",fox-news,Fox News
Timothy Nerozzi,North Korea expands list of crimes punishable by death: report,"The North Korean government has reportedly expanded the list of crimes punishable by death under Kim Jong Un's regime, according to recent reports.",https://www.foxnews.com/world/north-korea-expands-list-crimes-punishable-death-report,https://static.foxnews.com/foxnews.com/content/uploads/2024/07/kim_jong-un.jpg,2024-09-28T11:41:00Z,"North Korea is expanding its list of crimes punishable by death, according to reports.
Supreme leader Kim Jong Un's
 regime expanded the list of offenses warranting the death penalty from 11 to 16 … [+2151 chars]",fox-news,Fox News
Kerry Byrne,"Chicory an all-natural alternative to chemically decaffeinated coffee, says homesteader","New Hampshire homesteader, author and influencer Michelle Visser touts a chicory tea as the ""perfect, all natural"" alternative to decaffeinated coffee, which is chemically processed.",https://www.foxnews.com/food-drink/chicory-all-natural-alternative-chemically-decaffeinated-coffee-says-homesteader,https://static.foxnews.com/foxnews.com/content/uploads/2024/09/Visser-chicory-2split1-9-24.jpg,2024-09-28T11:28:06Z,"Join Fox News for access to this content
Plus special access to select articles and other premium content with your account - free of charge.
By entering your email and pushing continue, you are ag… [+3470 chars]",fox-news,Fox News
,"Chicory makes robust, homegrown, 'all-natural' decaf coffee | Fox News Video","Michelle Visser, a New Hampshire homesteader, author and social-media influencer, champions homegrown chicory as the ideal alternative to decaffeinated coffee.",https://www.foxnews.com/video/6362566590112,https://a57.foxnews.com/cf-images.us-east-1.prod.boltdns.net/v1/static/694940094001/cf529117-fc9a-4369-930c-2fe00afa0110/1cc163fe-d2af-4bfb-9243-96d179863286/1280x720/match/1024/512/image.jpg?ve=1&tl=1,2024-09-28T11:22:28Z,"©2024 FOX News Network, LLC. All rights reserved. This material may not be published, broadcast, rewritten, or redistributed. All market data delayed 20 minutes.",fox-news,Fox News
Kristine Parks,Four celebrities who have rejected conservative fans: 'I have no respect for you',"Some celebrities have been outspoken in their anger towards conservatives, telling fans to not watch or listen to them if they hold right-leaning viewpoints.",https://www.foxnews.com/media/four-celebrities-have-rejected-conservative-fans-i-have-no-respect-you,https://static.foxnews.com/foxnews.com/content/uploads/2024/09/splitcelebs.png,2024-09-28T10:00:21Z,"The November presidential election is less than 40 days away and liberal celebrities are increasingly speaking out. Howard Stern drew controversy recently after he attacked Donald Trump voters as ""st… [+5364 chars]",fox-news,Fox News
"Kurt Knutsson, CyberGuy Report",Lionsgate's bold move into AI is about to change filmmaking forever,Lionsgate's revolutionary move to partner with tech company Runaway to integrate AI into its production process is going to take the film industry by storm.,https://www.foxnews.com/tech/lionsgates-bold-move-ai-about-change-filmmaking-forever,https://static.foxnews.com/foxnews.com/content/uploads/2024/09/2-Lionsgates-bold-move-into-AI-is-about-to-change-filmmaking-forever-dp-holding-camera.jpg,2024-09-28T10:00:12Z,"Though the buzz in Hollywood over artificial intelligence is old news, Lionsgates revolutionary move into AI is about to take the industry by storm. With AI being the cornerstone issue of both the wr… [+4830 chars]",fox-news,Fox News
Timothy Nerozzi,RFK Jr mocks Kamala Harris' favorite phrase with audience call-and-response at Michigan rally,"Former independent presidential candidate Robert F. Kennedy Jr. mocked Vice President Kamala Harris during a Michigan rally this week, encouraging the audience to chant ""I was born in the middle class!""",https://www.foxnews.com/politics/rfk-jr-mocks-kamala-harris-favorite-phrase-audience-call-and-response-michigan-rally,https://static.foxnews.com/foxnews.com/content/uploads/2024/09/GettyImages-2175048937-scaled-e1727526096502.jpg,2024-09-28T12:48:18Z,"Robert F. Kennedy Jr. involved a rally audience in a call-and-response joke at his Michigan rally this week.
Kennedy spoke at the Falk Productions manufacturing facility in Walker, Michigan on Frida… [+2086 chars]",fox-news,Fox News
