author,title,description,url,urlToImage,publishedAt,content,source.id,source.name
,"US military shot down party balloon near El Paso after suspecting drone, official says","A U.S. official says the military shot down a party balloon near El Paso, Texas, after initially suspecting it was a foreign drone, prompting a temporary airspace closure.",https://www.foxnews.com/politics/us-military-shot-down-party-balloon-near-el-paso-after-suspecting-drone-official-says,https://static.foxnews.com/foxnews.com/content/uploads/2026/02/military-drone.jpg,2026-02-11T18:00:26Z,"A U.S. official confirmed to Fox News that the U.S. military earlier this week shot down what was later determined to be a party balloon near El Paso, Texas, after initially assessing it as a possibl… [+2950 chars]",fox-news,Fox News
,Iranian brutality: Nobel laureate fighting for life after barbaric assault at notorious prison,"The Nobel Committee is demanding Iran stop alleged brutal abuse of peace laureate Narges Mohammadi, who has been imprisoned since December after attending a funeral.",https://www.foxnews.com/world/iranian-brutality-nobel-laureate-fighting-life-barbaric-assault-notorious-prison,https://static.foxnews.com/foxnews.com/content/uploads/2026/02/iran-women-mohammadi-norway.jpg,2026-02-11T21:55:57Z,"The Norwegian Nobel Committee is calling on Iran to stop its physical abuse and life-threatening treatment of Nobel peace laureate Narges Mohammadi, who has been imprisoned since December. 
The comm… [+1919 chars]",fox-news,Fox News
,Scott Bessent says Iran understands 'brute force' as Trump weighs options amid nuclear standoff,Treasury Secretary Scott Bessent reveals President Donald Trump ordered maximum pressure sanctions against Iran as nuclear program negotiations stall.,https://www.foxnews.com/media/scott-bessent-says-iran-understands-brute-force-trump-weighs-options-amid-nuclear-standoff,https://static.foxnews.com/foxnews.com/content/uploads/2025/12/scott-bessent.jpg,2026-02-11T21:53:50Z,"Treasury Secretary Scott Bessent discussed whether President Donald Trump may need to pull another ""Operation Midnight Hammer"" against Iran as its leadership refuses to negotiate over its nuclear pro… [+3465 chars]",fox-news,Fox News
,James Van Der Beek's co-stars flood social media with heartbreaking tributes following his death at 48,"Hollywood stars honor ""Dawson's Creek"" actor James Van Der Beek after cancer death. Sarah Michelle Gellar, Chad Michael Murray share heartfelt tributes.",https://www.foxnews.com/entertainment/james-van-der-beeks-co-stars-flood-social-media-heartbreaking-tributes-following-his-death-48,https://static.foxnews.com/foxnews.com/content/uploads/2025/11/james-van-der-beek-dawsons-creek.jpg,2026-02-11T21:51:54Z,"Tributes are pouring in for ""Dawson's Creek"" star James Van Der Beek following his death on Wednesday, Feb. 11 after a long battle with stage 3 colorectal cancer. He was 48.
Many stars took to the c… [+7274 chars]",fox-news,Fox News
,Patriots star Drake Maye's wife thanks God for 'incredible season' after crushing Super Bowl loss,"Ann Michael Maye thanked God for an ""incredible season"" despite the New England Patriots' crushing 29-13 Super Bowl loss to the Seattle Seahawks.",https://www.foxnews.com/sports/patriots-stardrake-mayes-wife-thanks-god-incredible-season-after-crushing-super-bowl-loss,https://static.foxnews.com/foxnews.com/content/uploads/2026/02/drake-maye-ann-michael-maye.jpg,2026-02-11T21:44:27Z,"New England Patriots star quarterback Drake Mayes wife, Ann Michael Maye, thanked God for the teams incredible season after its crushing Super Bowl LX loss.
The Patriots lost to the Seattle Seahawks… [+1664 chars]",fox-news,Fox News
,"Fox News Sports Huddle Newsletter: Team USA captures gold at Milan Cortina, Seahawks crowned Super Bowl champs",Receive your weekly recap of all the happenings around the world of sports.,https://www.foxnews.com/sports/fox-news-sports-huddle-newsletter-team-usa-captures-gold-glory-milan-cortina-olympics-seahawks-win,https://static.foxnews.com/foxnews.com/content/uploads/2026/02/olympics-rings-020126-1.jpg,2026-02-11T21:39:16Z,"SLOPES GLORY Americans stole the show in the freestyle skiing womens moguls at the 2026 Winter Olympics on Wednesday. Elizabeth Lemley, in her Olympic debut, took home the gold medal. Her teammate Ja… [+3040 chars]",fox-news,Fox News
,Top 5 moments as Bondi clashes with Democrats in fiery House hearing,"Democrats grilled Bondi over DOJ's handling of the Epstein files in a tense, politically charged hearing.",https://www.foxnews.com/politics/top-5-moments-bondi-clashes-democrats-fiery-house-hearing,https://static.foxnews.com/foxnews.com/content/uploads/2025/10/pam-bondi-accuses-blumenthal-.jpg,2026-02-11T21:37:00Z,"Attorney General Pam Bondi
 sparred with members of the House Judiciary Committee during a tense hearing Wednesday, as she sought to defend the Justice Department's handling of the Jeffrey Epstein f… [+5023 chars]",fox-news,Fox News
,Kentucky governor takes heat for citing Bible to defend transgender treatments for children,"Kentucky Gov. Andy Beshear accused of twisting Scripture after using Bible to defend transgender youth policies, sparking criticism from Albert Mohler.",https://www.foxnews.com/media/kentucky-governor-takes-heat-citing-bible-defend-transgender-treatments-children,https://static.foxnews.com/foxnews.com/content/uploads/2026/02/andy-beshear-hand-up.png,2026-02-11T21:30:26Z,Potential 2028 contender Kentucky Gov. Andy Beshear was accused of twisting Scripture on Monday after he used the Bible to defend his veto of legislation banning gender transition medical treatments … [+4251 chars],fox-news,Fox News
,Virginia Democrats retreat on VMI funding threat after Trump administration warns of 'extraordinary measures',"Virginia Democrats retreat from controversial VMI legislation after facing fierce opposition from Trump administration, cadets, and members of Congress.",https://www.foxnews.com/us/virginia-democrats-retreat-vmi-funding-threat-after-trump-administration-warns-extraordinary-measures,https://static.foxnews.com/foxnews.com/content/uploads/2026/01/virginia-military-institute-cadets.jpg,2026-02-11T21:25:25Z,"Virginia Democrats backed down from legislation that could have potentially revoked state funding for the Virginia Military Institute amid criticism from the Trump administration, VMI cadets and lawm… [+5212 chars]",fox-news,Fox News
,"ICE shutdown fight might restrict FEMA, Coast Guard to ‘life-threatening’ emergencies","DHS faces shutdown by Saturday over Democrats' demands for Immigration and Customs Enforcement reforms, including warrant requirements and racial profiling bans.",https://www.foxnews.com/politics/ice-shutdown-fight-might-restrict-fema-coast-guard-life-threatening-emergencies,https://static.foxnews.com/foxnews.com/content/uploads/2026/02/capitol-hill-and-ice.jpg,2026-02-11T21:23:39Z,Agency heads that operate under the Department of Homeland Security (DHS) warned a shutdown could cripple U.S. readiness across half a dozen areas as the agency looks poised to enter a funding lapse … [+5660 chars],fox-news,Fox News
,Prosecutor who left Minnesota office amid anti-ICE unrest joins Don Lemon defense team,"The ex-US prosecutor resigned after 17 years at the Justice Department, and will appear in court Friday on Lemon's behalf",https://www.foxnews.com/politics/prosecutor-who-left-minnesota-office-amid-anti-ice-unrest-joins-don-lemon-defense-team,https://static.foxnews.com/foxnews.com/content/uploads/2026/02/don-lemon.jpg,2026-02-11T21:19:20Z,A longtime federal prosecutor who left the U.S. attorneys office in Minnesota last month amid a wave of resignations linked to concerns over the Trump administration's handling of anti-ICE agitators … [+4807 chars],fox-news,Fox News
,WNBA player 'willing to testify' against ex-boyfriend James Pearce Jr after alleged domestic dispute,"WNBA player Rickea Jackson said she is prepared to testify against Atlanta Falcons linebacker James Pearce Jr., who faces felony charges after an alleged domestic dispute.",https://www.foxnews.com/sports/wnba-player-willing-testify-against-ex-boyfriend-james-pearce-jr-after-alleged-domestic-dispute,https://static.foxnews.com/foxnews.com/content/uploads/2026/02/rickea-jackson-james-pearce-21126.jpg,2026-02-11T21:14:42Z,"Rickea Jackson, the WNBA player listed as the alleged victim of a domestic violence incident involving Atlanta Falcons player James Pearce Jr., said she is ""willing to testify"" if need be.
Pearce, a… [+2833 chars]",fox-news,Fox News
,"People with a certain BMI are more prone to deadly infections, study reveals","Obesity contributes to more than 10% of infection-related deaths and up to 11% could be prevented by addressing obesity, according to a study of 550,000 adults in Finland and the U.K.",https://www.foxnews.com/health/people-certain-bmi-more-prone-deadly-infections-study-reveals,https://static.foxnews.com/foxnews.com/content/uploads/2026/02/obese-hospital.jpg,2026-02-11T21:05:05Z,"Obesity may be a contributing factor in more than 10% of infection-related deaths, a new study reveals.
The researchers analyzed medical data from nearly 550,000 adults in Finland and the U.K. over … [+3949 chars]",fox-news,Fox News
,Exclusive: FBI captures longtime fugitive in Honduras in connection with 2000 killing of Philadelphia girl,FBI Most Wanted fugitive accused of kidnapping and murdering 5-year-old Philadelphia girl has been arrested in Honduras after nearly 25 years on the run.,https://www.foxnews.com/us/exclusive-fbi-captures-longtime-fugitive-honduras-connection-killing-philadelphia-girl,https://static.foxnews.com/foxnews.com/content/uploads/2026/02/fbi-capture-wanted-fugitive.jpg,2026-02-11T21:04:08Z,"EXCLUSIVE: A fugitive previously on the FBI's Most Wanted list for the kidnapping and murder of a 5-year-old Philadelphia girl has been arrested in Honduras. 
Alexis Flores was taken into custody on… [+2224 chars]",fox-news,Fox News
,"Billionaire JB Pritzker says he's had to overcome his wealth, which would be 'obstacle' in 2028","Gov. JB Pritzker appeared to complain his billionaire status was a challenge in the 2018 gubernatorial Democratic primary, citing Bernie Sanders' anti-wealth message.",https://www.foxnews.com/media/billionaire-jp-pritzker-says-hes-had-overcome-his-wealth-would-obstacle-2028,https://static.foxnews.com/foxnews.com/content/uploads/2026/02/jb-pritzker-campaign-donation-illinois.jpg,2026-02-11T21:00:53Z,"Billionaire Illinois Gov. JB Pritzker told a reporter that his wealth was something he had to overcome while running for governor and would be an obstacle to a future presidential run, according to a… [+2870 chars]",fox-news,Fox News
,SEE THE PHOTOS: Armed Man at Nancy's Guthrie's Home,"FBI-released footage of a masked gunman at Nancy Guthrie's front door the morning of her disappearance in Tuscon, Arizona, Sunday, February 1, 2026.",https://www.foxnews.com/true-crime/see-photos-armed-man-nancys-guthries-home,https://static.foxnews.com/foxnews.com/content/uploads/2026/02/nancy-guthrie-mouth-light_fox-news-001.jpg,2026-02-11T21:00:02Z,"FBI-released footage of a masked gunman at Nancy Guthrie's front door the morning of her disappearance in Tuscon, Arizona, Sunday, February 1, 2026.",fox-news,Fox News
,"US soccer legend Abby Wambach dumps agency, calls for CEO's resignation over emails with Ghislaine Maxwell",Soccer legend Abby Wambach announced she's leaving Wasserman Agency after CEO Casey Wasserman's flirtatious emails with Ghislaine Maxwell surfaced in the Epstein files.,https://www.foxnews.com/sports/us-soccer-legend-abby-wambach-dumps-agency-calls-ceos-resignation-over-emails-ghislaine-maxwell,https://static.foxnews.com/foxnews.com/content/uploads/2026/02/abby-wambach-wasserman-1.jpg,2026-02-11T20:54:29Z,"United States womens national soccer team legend Abby Wambach announced she is leaving the Wasserman Agency due to its founder being in the Epstein files.
Casey Wasserman, the founder and CEO of Was… [+2873 chars]",fox-news,Fox News
,Retail records could unmask potential subject in Nancy Guthrie case as experts reveal ‘clothing is evidence’,"FBI releases new surveillance footage showing armed suspect in Nancy Guthrie's apparent abduction from Tucson home, as experts reveal clothing clues.",https://www.foxnews.com/us/retail-records-could-unmask-potential-subject-nancy-guthrie-case-experts-reveal-clothing-evidence,https://static.foxnews.com/foxnews.com/content/uploads/2026/02/nancy-ring-video.gif,2026-02-11T20:52:09Z,The FBIs release of new surveillance images and footage of a subject believed to be connected to Nancy Guthries apparent abduction could open up a trove of information investigators can use to potent… [+4666 chars],fox-news,Fox News
,"FBI investigates stolen military explosives found in The Villages, Florida home",FBI takes over case after stolen military explosives discovered at The Villages residence. Residents were evacuated as bomb squad cleared the scene.,https://www.foxnews.com/us/fbi-investigates-stolen-military-explosives-found-villages-florida-home,https://static.foxnews.com/foxnews.com/content/uploads/2026/02/the-villages-stolen-explosives.jpg,2026-02-11T20:50:45Z,"The FBI is on the scene of The Villages in Florida after stolen military explosives were discovered, prompting authorities to evacuate residents. No injuries have been reported.
The Sumter County Sh… [+1392 chars]",fox-news,Fox News
,Watchdog group sues Illinois city's reparations program over giving money based on race,"Judicial Watch challenged Evanston, Illinois for its $10 million reparations program in federal court, representing five plaintiffs denied $25,000 payments due to race.",https://www.foxnews.com/media/watchdog-group-sues-illinois-citys-reparations-program-over-giving-money-based-race,https://static.foxnews.com/foxnews.com/content/uploads/2026/02/watchdog-group-sues-illinois-city-for-reparations-alleging-discrimination.jpg,2026-02-11T20:49:10Z,"Judicial Watch, a conservative watchdog group, told Fox News Digital on Tuesday it filed a lawsuit against Evanston, Illinois, to stop the city from paying Black residents reparations.
""There's a ri… [+3960 chars]",fox-news,Fox News
,"Ancient humans were hunting and eating sharks 7,000 years ago, burial site discovery shows","Ancient people in southern Arabia hunted and ate sharks as a main food and nutrition source, new archaeological research from Oman reveals. Here are details.",https://www.foxnews.com/food-drink/ancient-humans-were-hunting-eating-sharks-7000-years-ago-burial-site-discovery-shows,https://static.foxnews.com/foxnews.com/content/uploads/2026/02/ancient-people-ate-sharks-oman-arabia-archaeology-history-discovery-food-drink-2.jpg,2026-02-11T20:48:07Z,"New research has revealed that ancient people in southern Arabia dined on an apex predator sharks.
The study, recently published in the journal Antiquity, centers on a tomb in Wadi Nafn, an archaeol… [+2520 chars]",fox-news,Fox News
,Sam Darnold's fiancée delivers emotional tribute after Seahawks' Super Bowl win,"Sam Darnold's fiancée, Katie Hoofnagle, shared a touching tribute after the Seattle Seahawks' Super Bowl LX victory, praising his perseverance through challenges.",https://www.foxnews.com/sports/sam-darnolds-fiance-delivers-emotional-tribute-seahawks-super-bowl-win,https://static.foxnews.com/foxnews.com/content/uploads/2026/02/sam-darnold-katie-hoofnagle-embrace-postgame.jpg,2026-02-11T20:40:02Z,"Sam Darnolds fiancée, Katie Hoofnagle, took to social media to post a heartfelt message about the quarterback after the Seattle Seahawks' Super Bowl LX victory.
The couple went official with their r… [+2550 chars]",fox-news,Fox News
,Mike Tyson in the 'fight of my life' as he partners with Trump admin in health initiative to tackle obesity,"Mike Tyson joins HHS Secretary Robert F. Kennedy Jr. to fight obesity after losing his sister when she was 25 to a heart attack. The boxer said he wants to be a ""hero.""",https://www.foxnews.com/politics/mike-tyson-fight-my-life-he-partners-trump-admin-health-initiative-tackle-obesity,https://static.foxnews.com/foxnews.com/content/uploads/2026/02/mike-tyson-robert-f-kennedy-feb-11-2026.jpg,2026-02-11T20:38:48Z,"Legendary boxer Mike Tyson found himself in a new arena on Wednesday as he stood with Health and Human Services (HHS) Secretary Robert F. Kennedy Jr. and Agriculture Secretary Brooke Rollins, partner… [+3467 chars]",fox-news,Fox News
,Republican lawmakers' early retirement rumors send shockwaves through House GOP,"House Republican Rep. Neal Dunn of Florida has announced his plan to retire at the end of this congressional term, but rumors of an early departure are swirling.",https://www.foxnews.com/politics/republican-lawmakers-early-retirement-rumors-send-shockwaves-through-house-gop,https://static.foxnews.com/foxnews.com/content/uploads/2026/01/neal-dunn-florida-retirement-congress.jpg,2026-02-11T20:37:37Z,"Rumors of one House GOP lawmaker's potential early retirement are sending shockwaves through Republicans' razor-thin majority in Congress.
Fox News Digital was told on Wednesday that lawmakers belie… [+2369 chars]",fox-news,Fox News
,"Trump makes good on troop pullout promise, vows return if Democrat city crime worsens","Thousands of National Guard troops were withdrawn from Los Angeles, Chicago and Portland after Trump's administration deployed them under Title 10 authority in June 2025.",https://www.foxnews.com/politics/trump-makes-good-troop-pullout-promise-vows-return-democrat-city-crime-worsens,https://static.foxnews.com/foxnews.com/content/uploads/2026/02/national-guard-2.jpg,2026-02-11T20:32:53Z,"The Trump administration withdrew all federalized National Guard troops from U.S. cities as of earlier in 2026, following through on President Donald Trump's announcement in December 2025 that warned… [+4908 chars]",fox-news,Fox News
,2026 Valentine's romance scams and how to avoid them,Valentine's Day romance scams in 2026 use AI personas and automated scripts to target divorced and widowed individuals through data broker profiles.,https://www.foxnews.com/tech/2026-valentines-romance-scams-how-avoid-them,https://static.foxnews.com/foxnews.com/content/uploads/2026/02/crypto-crime-scam-photo-1.jpg,2026-02-11T20:30:09Z,"Valentine's Day should be about connection. However, every February also becomes the busiest season of the year for romance scammers. In 2026, that risk is higher than ever.
These scams are no longe… [+9085 chars]",fox-news,Fox News
,"Minnesota police say vehicle believed to be pursued by federal agents crashed downtown, protests ensue","One person was injured when a vehicle believed to have been pursued by federal agents crashed in St. Paul, Minnesota, drawing protests.",https://www.foxnews.com/us/minnesota-police-say-vehicle-believed-pursued-federal-agents-crashed-downtown-protests-ensue,https://static.foxnews.com/foxnews.com/content/uploads/2026/02/mn-ice-car-crash-2.jpg,2026-02-11T20:23:34Z,"A vehicle that was reportedly being pursued by federal agents crashed in St. Paul, Minnesota, on Wednesday, leaving one person with non-life-threatening injuries.
St. Paul Police said on Wednesday t… [+2041 chars]",fox-news,Fox News
,"Trump meets Netanyahu, says he wants Iran deal but reminds Tehran of ‘Midnight Hammer’ operation","President Donald Trump and Israeli prime minister signal uncertainty on Iran diplomacy after White House talks, with Trump pushing negotiations while keeping other options open.",https://www.foxnews.com/world/trump-meets-netanyahu-says-he-wants-iran-deal-reminds-tehran-midnight-hammer-operation,https://static.foxnews.com/foxnews.com/content/uploads/2025/12/trump-bibi-mar-a-lago-florida.jpg,2026-02-11T20:21:48Z,"Iran dominated the agenda in Wednesdays White House meeting between President Donald Trump and Israeli Prime Minister Benjamin Netanyahu, with both leaders signaling that diplomacy with Tehran remain… [+4037 chars]",fox-news,Fox News
,Trump Religious Liberty Commission boots member after contentious antisemitism hearing,President Donald Trump's Religious Liberty Commission removed Catholic activist after controversial antisemitism hearing.,https://www.foxnews.com/politics/trump-religious-liberty-commission-boots-member-after-contentious-antisemitism-hearing,https://static.foxnews.com/foxnews.com/content/uploads/2018/09/Carrie-Prejean-Front.jpg,2026-02-11T20:13:04Z,"President Donald Trump's White House Religious Liberty Commission ousted Catholic activist Carrie Prejean Boller from its membership on Wednesday, after her controversial performance at a hearing on … [+2864 chars]",fox-news,Fox News
,Hardline conservatives double down to save the SAVE Act,"The SAVE America Act would mandate identification for voting, in-person citizenship proof for registration and removal of non-citizens from voter rolls.",https://www.foxnews.com/politics/senate-republicans-double-down-save-save-act,https://static.foxnews.com/foxnews.com/content/uploads/2025/12/senator-mike-lee-antitrust.jpg,2026-02-11T20:05:31Z,"Senate Republicans face long odds in advancing voter ID legislation, but theyre not backing down.
Huddled behind closed doors on Tuesday, GOP lawmakers attempted to chart a path forward on the Safeg… [+3232 chars]",fox-news,Fox News
