author,title,description,url,urlToImage,publishedAt,content,source.id,source.name
,Vance warns Iran that 'another option on the table' if nuclear deal not reached,"Vice President JD Vance warned Iran that there is ""another option on the table"" if nuclear deal talks fail, citing President Donald Trump's threats.",https://www.foxnews.com/politics/vance-warns-iran-another-option-table-nuclear-deal-not-reached,https://static.foxnews.com/foxnews.com/content/uploads/2026/02/jd-vance-gaggle.jpg,2026-02-11T13:06:31Z,"Vice President JD Vance warned Iran that there is ""another option on the table"" if the regime does not make a nuclear deal with the U.S.
Vance made the statement while speaking to reporters before b… [+2686 chars]",fox-news,Fox News
,"Dementia risk may rise with a common afternoon snack mistake, experts warn","Afternoon sugar cravings may do more than sap energy, as experts warn blood sugar crashes during this window can impair brain function and raise long-term risks.",https://www.foxnews.com/food-drink/dementia-risk-may-rise-common-afternoon-snack-mistake-experts-warn,https://static.foxnews.com/foxnews.com/content/uploads/2026/02/woman-snacking-afternoon-coffee-computer.jpg,2026-02-11T13:00:48Z,"Grabbing something sugary in the mid-afternoon can feel like an easy fix for low energy, but the timing could have an impact on brain health, experts say.
For many Americans, the most vulnerable eat… [+2789 chars]",fox-news,Fox News
,American Olympian Ryan Cochran-Siegle picks up silver in men's super-G,American Olympian Ryan Cochran-Siegle won the silver medal at the 2026 Milan Cortina Games in the alpine skiing men's super-G on Wednesday.,https://www.foxnews.com/sports/american-olympian-ryan-cochran-siegle-picks-up-silver-mens-super-g,https://static.foxnews.com/foxnews.com/content/uploads/2026/02/olympics-ryan-cochran-siegle-021126-2.jpg,2026-02-11T12:54:14Z,"Olympic skier Ryan Cochran-Siegle picked up Team USAs latest medal on Wednesday, capturing a silver in the alpine skiing mens super-G.
Cochran-Siegle put together a time of 1:25.45 and finished 0.13… [+1671 chars]",fox-news,Fox News
,Pritzker joins chorus of Dem governors boycotting White House dinner after snub ignites 'chaos',"Democratic governors blasted President Trump over disinviting two of their colleagues to a traditionally bipartisan event, leading to a growing chorus of them vowing not to attend",https://www.foxnews.com/politics/pritzker-joins-chorus-dem-governors-boycotting-white-house-dinner-after-snub-ignites-chaos,https://static.foxnews.com/foxnews.com/content/uploads/2025/09/jb-pritzker-trump-comparison.jpg,2026-02-11T12:30:00Z,"A chorus of Democratic governors are rallying behind their fellow Democratic Governors Jared Polis, from Colorado, and Wes Moore, from Maryland, after they did not receive invites for a traditionally… [+4109 chars]",fox-news,Fox News
,WWE legend reveals harrowing health battle: 'It’s been a fight',"Former pro wrestling star Fred Ottman, known as Typhoon and other monikers, said his gallbladder ""exploded"" leading to a lengthy hospital stay in Florida.",https://www.foxnews.com/sports/wwe-legend-reveals-harrowing-health-battle-its-been-fight,https://static.foxnews.com/foxnews.com/content/uploads/2026/02/wwe-typhoon-021126-3.jpg,2026-02-11T12:16:45Z,"WWE legend Fred Ottman, known in the ring as Typhoon, opened up on Sunday about a health scare that caused him a lengthy hospital stay last month.
The former pro wrestler said he had been in the hos… [+1917 chars]",fox-news,Fox News
,Person questioned in Nancy Guthrie disappearance released after Arizona stop,"Person detained in connection with Nancy Guthrie disappearance released after questioning. FBI conducted search in Rio Rico, Arizona near Mexico border.",https://www.foxnews.com/us/person-questioned-nancy-guthrie-disappearance-released-after-arizona-stop,https://static.foxnews.com/foxnews.com/content/uploads/2026/02/traffic-stop-nancy-guthrie-investigation.jpg,2026-02-11T12:06:16Z,"A person who was briefly detained for questioning Tuesday evening in Rio Rico, Arizona, in connection with the disappearance of Nancy Guthrie has been released, authorities said.
The Pima County She… [+3244 chars]",fox-news,Fox News
,"Hamas kidnapped us together, held us apart for over a year — and now we’re starting over","Ahead of Valentine’s Day, former Hamas hostages Arbel Yehoud and Ariel Cunio recount their Oct. 7 kidnapping, months in captivity, and how hope — and each other — kept them unbroken.",https://www.foxnews.com/opinion/hamas-kidnapped-us-together-held-us-apart-over-year-now-were-starting-over,https://static.foxnews.com/foxnews.com/content/uploads/2026/02/arbel-ariel-couple-copy.jpg,2026-02-11T12:00:50Z,"My name is Arbel Yehoud. I am 30, and I was born and raised in Kibbutz Nir Oz. 
My name is Ariel Cunio. I am 28, and I was also born and raised in Kibbutz Nir Oz. 
We grew up just a few steps apart… [+4167 chars]",fox-news,Fox News
,CNN ratings down bigly from 2017 'Trump bump' through 2025 amid changing media landscape,"CNN embraced anti-Trump programming and experiences ratings success during President Trump’s first administration, but the network has failed to replicate the success the second time around.",https://www.foxnews.com/media/cnn-down-bigly-from-2017-trump-bump-2025,https://static.foxnews.com/foxnews.com/content/uploads/2025/07/trump-cnn.jpg,2026-02-11T12:00:36Z,"CNN benefited from the ""Trump bump"" during President Donald Trumps first administration, but ratings are down bigly the second time around as both the media landscape and the network have changed dra… [+6140 chars]",fox-news,Fox News
,JONATHAN TURLEY: NY Times columnist sinks to sick new low mocking JD Vance's mom,"New York Times columnist Jamelle Bouie mocked Vice President J.D. Vance's mother's addiction on Bluesky, saying she should have sold her son for drugs.",https://www.foxnews.com/opinion/jonathan-turley-ny-times-columnist-sinks-sick-new-low-mocking-jd-vances-mom,https://static.foxnews.com/foxnews.com/content/uploads/2026/02/jd-vance-beverly-aikins.jpg,2026-02-11T12:00:20Z,"In an age of rage, it is often difficult to stand out from the mob, as so many pander to the perpetually irate. However, New York Times columnist Jamelle Bouie has found a way to win the race to the … [+4108 chars]",fox-news,Fox News
,Far-left podcaster Jennifer Welch known for profane attacks emerges as destination for Democrats,"Jennifer Welch transforms from Bravo reality star to Democratic influencer through her ""I've Had It"" podcast that regularly features extreme rhetoric.",https://www.foxnews.com/media/far-left-podcaster-jennifer-welch-known-profane-attacks-emerges-destination-democrats,https://static.foxnews.com/foxnews.com/content/uploads/2025/11/jennifer-welch-npr.jpg,2026-02-11T12:00:18Z,"Far-left podcast star Jennifer Welch has emerged as a darling of the liberal media after her often-extreme, regularly viral rhetoric put her in a position to influence the Democratic Party.
Welch, c… [+7254 chars]",fox-news,Fox News
,Big mistake to legalize marijuana? Health experts warn of ‘worse outcomes',"In a new op-ed, The New York Times admits legalization may have gone too far, citing addiction, mental health risks and rising THC levels. Doctors weigh in on the issue.",https://www.foxnews.com/health/big-mistake-legalize-marijuana-health-experts-warn-worse-outcomes,https://static.foxnews.com/foxnews.com/content/uploads/2026/02/woman-holding-cannabis-joint.png,2026-02-11T12:00:09Z,"After years of backing the legalization of marijuana in the U.S., The New York Times changed course in an editorial published Tuesday.
In the piece, entitled ""Its Time for America to Admit That It H… [+7847 chars]",fox-news,Fox News
,Pelosi endorses JFK's grandson in Democratic House primary,"Former House Speaker Nancy Pelosi endorsed the grandson of the late President John F. Kennedy, Jack Schlossberg, who is running for a House seat.",https://www.foxnews.com/politics/pelosi-endorses-jfks-grandson-democratic-house-primary,https://static.foxnews.com/foxnews.com/content/uploads/2026/02/nancy-pelosi-may-2025.jpg,2026-02-11T15:59:04Z,"Former House Speaker Nancy Pelosi, D-Calif., endorsed Jack Schlossberg the grandson of the late President John F. Kennedy who is running for Congress in New York's 12th Congressional District.
""This… [+1833 chars]",fox-news,Fox News
,"Mexican cartel drones breach US airspace, are disabled by War Department, Duffy says","The U.S. military disabled Mexican cartel drones breached American airspace near El Paso, Texas, federal aviation officials announced Wednesday.",https://www.foxnews.com/politics/mexican-cartel-drones-breach-us-airspace-disabled-war-department-duffy-says,https://static.foxnews.com/foxnews.com/content/uploads/2025/10/sean-duffy-atc-shutdown-fox-news.jpg,2026-02-11T15:31:49Z,"Drones operated by Mexican drug cartels breached American airspace and were soon disabled by the U.S. military, the Trump administration announced Wednesday.
The breach took place near El Paso Inter… [+2521 chars]",fox-news,Fox News
,American Olympian Chloe Kim eyes historic gold medal despite shoulder injury,American Olympian Chloe Kim had a terrific run in qualifying for the women's snowboard halfpipe event and is in contention for an historic gold medal.,https://www.foxnews.com/sports/american-olympian-chloe-kim-eyes-historic-gold-medal-despite-shoulder-injury,https://static.foxnews.com/foxnews.com/content/uploads/2026/02/olympics-chloe-kim-021126-1.jpg,2026-02-11T15:26:06Z,"American snowboarding star Chloe Kim came into the 2026 Winter Olympics dealing with a brutal shoulder injury, but it hasnt deterred her one bit.
Kim finished on top of the leaderboard in the qualif… [+1954 chars]",fox-news,Fox News
,"Amazon’s Presidents' Day deals arrive early with sales on Apple, Carhartt, Sealy and more","Save on must-have tech, popular clothing brands, discount tools and more during Amazon's Presidents' Day sale",https://www.foxnews.com/deals/amazon-presidents-day,https://static.foxnews.com/foxnews.com/content/uploads/2026/02/fox_news_deals_generic_amazon_presidents_day_sale-1.png,2026-02-11T15:23:52Z,"Amazons Presidents Day sale runs Feb. 11-18 with early deals already live, cutting prices on tech, tools, mattresses, cookware and clothing. Shoppers can save $100 on the Apple Watch Series 11, nearl… [+7214 chars]",fox-news,Fox News
Fox News,WATCH LIVE: Attorney General Pam Bondi testifies before House committee | Fox News Video,WATCH LIVE: Attorney General Pam Bondi testifies before House committee | Fox News Videofoxnews.com,https://www.foxnews.com/video/6389074622112,https://a57.foxnews.com/cf-images.us-east-1.prod.boltdns.net/v1/static/694940094001/e75a84bd-cb73-491b-ae02-9b43c1853859/0e738a88-92e8-4df1-bcc2-ffada5dfdff8/1280x720/match/1024/512/image.jpg?ve=1&tl=1,2026-02-11T15:18:59Z,"©2026 FOX News Network, LLC. All rights reserved. This material may not be published, broadcast, rewritten, or redistributed. All market data delayed 20 minutes.",fox-news,Fox News
,American Olympians take top medals in women's moguls at Winter Games,Americans Elizabeth Lemley and Jaelin Kauf were at the top of the podium on Wednesday in the freestyle skiing women's moguls at the Winter Olympics.,https://www.foxnews.com/sports/american-olympians-take-top-medals-womens-moguls-winter-games,https://static.foxnews.com/foxnews.com/content/uploads/2026/02/olympics-americans-moguls-021126-1.jpg,2026-02-11T15:17:05Z,"Americans stole the show in the freestyle skiing womens moguls at the 2026 Winter Olympics on Wednesday.
Elizabeth Lemley, in her Olympic debut, took home the gold medal with a score of 82.30. Her t… [+1515 chars]",fox-news,Fox News
,America’s most welcoming travel destinations revealed — the No. 1 spot may surprise you,"Booking.com reveals America's most welcoming destinations. From Texas to Hawaii, the towns were hailed for their hospitality. Find out who ranked number 1.",https://www.foxnews.com/travel/america-most-welcoming-travel-destinations-revealed-no-1-spot-surprise-you,https://static.foxnews.com/foxnews.com/content/uploads/2026/02/bikers-cape-may-new-jersey.jpg,2026-02-11T15:12:18Z,"Big cities may hold great allure, but smaller destinations are still the most welcoming, according to new rankings from Booking.com. 
The online travel booking platform recently released its annual … [+3346 chars]",fox-news,Fox News
,Pelosi lambasted for endorsement of JFK's inexperienced grandson for congressional seat,"Jonathan Chait warned that JFK descendent Jack Schlossberg would be a poor choice to be a Democratic Party leader, taking issue with former speaker Nancy Pelosi's endorsement.",https://www.foxnews.com/media/pelosi-lambasted-endorsement-jfks-inexperienced-grandson-congressional-seat,https://static.foxnews.com/foxnews.com/content/uploads/2025/11/jack-schlossberg-speaking-dnc-2024.jpg,2026-02-11T15:01:38Z,Atlantic writer Jonathan Chait implored in a new article that the Democratic Party should not rally around another member of the Kennedy family after former House Speaker Nancy Pelosi endorsed John F… [+3521 chars],fox-news,Fox News
,"Hillsdale launches ‘Learn Like Charlie’ campaign to urge Americans to study the Bible, Constitution","Hillsdale College launched a ""Learn Like Charlie"" campaign honoring Charlie Kirk's journey through free online courses in Constitution and Bible studies.",https://www.foxnews.com/media/hillsdale-launches-learn-like-charlie-campaign-urge-americans-study-bible-constitution,https://static.foxnews.com/foxnews.com/content/uploads/2025/09/charlie-kirk-shot-dead_031.jpg,2026-02-11T14:58:08Z,"During Turning Point USAs (TPUSA) All-American Halftime Show, Hillsdale College announced the launch of its ""Learn Like Charlie"" campaign, urging Americans to take the same free Hillsdale College onl… [+2434 chars]",fox-news,Fox News
,"Bondi to face grilling in House Judiciary Committee over Epstein files, weaponization allegations","Attorney General Pam Bondi testifies Wednesday before the House Judiciary Committee, where lawmakers are expected to confront her over the DOJ's handling of Jeffrey Epstein’s sex trafficking case files.",https://www.foxnews.com/politics/bondi-face-grilling-house-judiciary-committee-over-epstein-files-weaponization-allegations,https://static.foxnews.com/foxnews.com/content/uploads/2025/10/pam-bondi-hearing.jpg,2026-02-11T14:42:02Z,"Attorney General Pam Bondi is set to testify Wednesday before the House Judiciary Committee, where lawmakers are expected to confront her over the Department of Justices handling of Jeffrey Epsteins … [+1991 chars]",fox-news,Fox News
Fox News,WATCH LIVE: Alex Murdaugh appeal heads to South Carolina Supreme Court | Fox News Video,The South Carolina Supreme Court is hearing oral arguments in Alex Murdaugh's appeal of his 2023 murder conviction. (Courtesy: WACH),https://www.foxnews.com/video/6389073639112,https://a57.foxnews.com/cf-images.us-east-1.prod.boltdns.net/v1/static/694940094001/d80ca207-c0d6-46f8-9a97-97932d8aab5d/2be42cbc-fe60-4708-a353-3e112e657067/1280x720/match/1024/512/image.jpg?ve=1&tl=1,2026-02-11T14:22:42Z,"©2026 FOX News Network, LLC. All rights reserved. This material may not be published, broadcast, rewritten, or redistributed. All market data delayed 20 minutes.",fox-news,Fox News
,Cameron Mathison says noticing subtle body changes ‘saved my life’ after cancer diagnosis,Cameron Mathison celebrates six years cancer free and shares how paying attention to his body saved his life after kidney cancer diagnosis in 2019.,https://www.foxnews.com/entertainment/cameron-mathison-says-noticing-subtle-body-changes-saved-my-life-after-cancer-diagnosis,https://static.foxnews.com/foxnews.com/content/uploads/2026/02/cameron-mathison-blue-suit.jpg,2026-02-11T14:00:58Z,"Cameron Mathison is opening up about his health journey, and what ""saved"" him.
During an interview with Fox News Digital at the 33rd Annual Movieguide Awards, the 56-year-old actor encouraged others… [+3254 chars]",fox-news,Fox News
,"We're Democrats. From food to housing, costs keep rising — here’s a serious fix","Affordability agenda from New Democrat Coalition targets rising costs in healthcare, housing, groceries and energy with plan to build four million homes.",https://www.foxnews.com/opinion/were-democrats-from-food-housing-costs-keep-rising-heres-serious-fix,https://static.foxnews.com/foxnews.com/content/uploads/2025/07/man-holding-face.jpg,2026-02-11T14:00:44Z,"For millions of Americans, affordability is not an abstract policy debate. It is the daily stress of choosing between groceries and prescriptions, rent and child care, gas and electricity. Families f… [+5459 chars]",fox-news,Fox News
,"Coast Guard veteran, wife and two children found dead inside Florida home","A Coast Guard veteran, his wife and their two young children were found dead during a welfare check at their Florida home.",https://www.foxnews.com/us/coast-guard-veteran-wife-two-children-found-dead-inside-florida-home,https://static.foxnews.com/foxnews.com/content/uploads/2026/02/fl-marion-county-carbon-monoxide-deaths.jpg,2026-02-11T17:59:17Z,"A Coast Guard veteran, his wife and two children were found dead inside a Florida home in what investigators believe may have been a case of carbon monoxide poisoning.
Deputies with the Marion Count… [+1799 chars]",fox-news,Fox News
,"Schumer, Dems choose partial shutdown as negotiations hit impasse","Political standoff intensifies as Senate Democrats refuse compromise on immigration funding measures, while Senate Republicans scramble to avoid a partial shutdown on Friday.",https://www.foxnews.com/politics/schumer-dems-choose-partial-shutdown-negotiations-hit-impasse,https://static.foxnews.com/foxnews.com/content/uploads/2026/02/senate-minority-leader-chuck-schumer-shutdown-dhs.jpg,2026-02-11T17:53:37Z,"Senate Democrats arent budging on their Homeland Security demands, and appear ready to again thrust the government into a partial shutdown as Republicans scramble to keep the lights on.
Senate Minor… [+2775 chars]",fox-news,Fox News
,"California's girls' sports culture war amps up with massive protest, outrage over recent track and field title","California transgender sports controversy intensifies as dozens of female athletes protest at state meeting, while Governor Gavin Newsom calls male participation ""deeply unfair.""",https://www.foxnews.com/sports/california-trans-athlete-culture-war-ramps-up-massive-protest-outrage-over-recent-track-field-title,https://static.foxnews.com/foxnews.com/content/uploads/2026/02/save-girls-sports.jpeg,2026-02-11T17:52:03Z,The conflict over biological males in girls' sports in California re-entered the national spotlight over the weekend. The debate's flames were fanned by a large-scale protest at a state high school s… [+9264 chars],fox-news,Fox News
,Australian Olympic snowboarder airlifted after suffering broken neck in Milan Cortina training accident,Olympic snowboarder Cam Bolton walked away from a crash not knowing he broke his neck. The four-time Olympian was later airlifted to Milan for treatment.,https://www.foxnews.com/sports/australian-olympic-snowboarder-airlifted-broken-neck-milan-cortina-training-accident,https://static.foxnews.com/foxnews.com/content/uploads/2026/02/olympics-cam-bolton-crash-002.jpg,2026-02-11T17:47:16Z,"Four-time Olympic snowboarder Cam Bolton was airlifted to a hospital in Milan after he suffered a broken neck while training for the snowboard cross event on Thursday. 
Bolton, 35, crashed Monday bu… [+1656 chars]",fox-news,Fox News
,"Notre Dame bishop blasts abortion-rights advocate named institute director, calls it ‘scandal to the faithful’","Catholic bishop calls Notre Dame's appointment of abortion-rights advocate Susan Ostermann as Liu Institute director a ""scandal to the faithful.""",https://www.foxnews.com/media/notre-dame-bishop-blasts-abortion-rights-advocate-named-institute-director-scandal-faithful,https://static.foxnews.com/foxnews.com/content/uploads/2026/02/notre-dame-campus-scene.jpg,2026-02-11T17:46:06Z,"A Catholic bishop in the Diocese of Fort Wayne-South Bend is criticizing the appointment of an abortion-rights advocate to lead the University of Notre Dames Liu Institute for Asia and Asian Studies,… [+6506 chars]",fox-news,Fox News
,Idaho families sue over federal immigration enforcement at horse racing track,A lawsuit has been brought on behalf of U.S. citizens and lawful permanent residents who were detained by authorities during an episode in Idaho last year.,https://www.foxnews.com/politics/idaho-families-sue-over-federal-immigration-enforcement-horse-racing-track,https://static.foxnews.com/foxnews.com/content/uploads/2026/02/authorities-la-catedral-idaho.jpg,2026-02-11T17:45:48Z,"A lawsuit has been lodged on behalf of Latino U.S. citizens and lawful permanent residents who were detained during an October law enforcement action in Idaho that involved federal, state and local a… [+3228 chars]",fox-news,Fox News
,‘People are sick of the same old thing’: Maxine Waters faces primary from Democrat 34 years her junior,"Myla Rahman, who is 34 years younger than Rep. Maxine Waters, has launched a primary challenge against her, highlighting a generational change in California's 43rd District.",https://www.foxnews.com/politics/people-sick-same-old-thing-maxine-waters-faces-primary-from-democrat-34-years-her-junior,https://static.foxnews.com/foxnews.com/content/uploads/2026/01/maxine-waters-june-2025.jpg,2026-02-11T17:45:11Z,"Myla Rahman is aiming to use Rep. Maxine Waters' 35 years in Congress as political ammunition as she challenges the longtime Democratic congresswoman.
The nonprofit executive, Los Angeles native, an… [+3436 chars]",fox-news,Fox News
,"Meta, Google face massive liability as ‘addicted kids’ trial continues in LA",The landmark trial is the first case that seeks to hold tech giants in the U.S. financially liable for harm suffered by its users.,https://www.foxnews.com/politics/landmark-trial-accuses-meta-google-addicting-children-what-know,https://static.foxnews.com/foxnews.com/content/uploads/2024/12/zuckerberg.jpg,2026-02-11T17:35:56Z,Meta and Google returned to Los Angeles Superior Court on Tuesday for the second day of a landmark trial over claims their platforms were designed to addict young users a closely watched case that co… [+4306 chars],fox-news,Fox News
,Tori Spelling living in a 'borderline hoarder' home as living conditions worsen,"Tori Spelling reveals her chaotic living conditions potentially caused an eight-week illness, leaving her unable to work and sparking widespread fan concern.",https://www.foxnews.com/entertainment/tori-spelling-living-borderline-hoarder-home-living-conditions-worsen,https://static.foxnews.com/foxnews.com/content/uploads/2026/02/tori-spelling.jpg,2026-02-11T17:35:45Z,"Tori Spelling's living conditions seem to be getting worse. 
During Friday's episode of her ""misSPELLING"" podcast, the ""Beverly Hills, 90210"" alum, 52, and her co-host Amy Sugarman openly discussed … [+3489 chars]",fox-news,Fox News
,Reporter's Notebook: Clintons call for open Epstein files hearing after months of defying subpoenas,"Bill and Hillary Clinton agree to testify about Epstein files after defying subpoenas, but now demand public hearings that could set a precedent for Trump.",https://www.foxnews.com/politics/reporters-notebook-clintons-want-epstein-testimony-political-super-bowl-spectacle-public-viewing,https://static.foxnews.com/foxnews.com/content/uploads/2026/02/the-clintons.jpg,2026-02-11T17:18:10Z,"Since there was such a tempest over Bad Bunnys Super Bowl halftime show, perhaps theres a solution at hand. This compromise would satisfy both red and blue America. And the exhibition would transfix … [+8596 chars]",fox-news,Fox News
,Vance shares advice for American Olympians speaking out against Trump policies,Vice President JD Vance said on Wednesday he hoped that American Olympic athletes will choose to bring the country together rather than divide it further.,https://www.foxnews.com/sports/vance-shares-advice-american-olympians-speaking-out-against-trump-policies,https://static.foxnews.com/foxnews.com/content/uploads/2026/02/olympics-jd-vance-021126-1.jpg,2026-02-11T17:11:41Z,"Vice President JD Vance shared advice he had for American Olympic athletes who have been outspoken about the Trump administrations policies while at the Milan Cortina Games.
Vance, who acknowledged … [+1967 chars]",fox-news,Fox News
,ICE director refuses to resign under pressure from Eric Swalwell not to 'side with killers',"Acting ICE Director Todd Lyons refuses to resign after Rep. Eric Swalwell's ultimatum to quit or ""side with the killers"" during heated House committee hearing.",https://www.foxnews.com/politics/ice-director-refuses-resign-under-pressure-from-eric-swalwell-not-side-killers,https://static.foxnews.com/foxnews.com/content/uploads/2026/01/eric-swalwell.jpg,2026-02-11T17:04:15Z,"Acting ICE Director Todd Lyons refused to resign under pressure from Rep. Eric Swalwell, D-Calif., who offered him the ultimatum to do so, or ""side with the killers.""
The heated exchange during Tues… [+3225 chars]",fox-news,Fox News
