author,title,description,url,urlToImage,publishedAt,content,source.id,source.name
,"US strikes another alleged drug-trafficking boat near Venezuela, killing 4","President Donald Trump ordered a U.S. military strike on a narco-trafficking vessel linked to terrorist groups off Venezuela's coast, killing four aboard.",https://www.foxnews.com/politics/us-strikes-another-alleged-drug-trafficking-boat-near-venezuela-killing-4,https://static.foxnews.com/foxnews.com/content/uploads/2025/10/strike.png,2025-10-03T17:16:25Z,Secretary of War Pete Hegseth announced on Friday the U.S. military conducted a lethal kinetic strike on a narco-trafficking vessel affiliated with Designated Terrorist Organizations traveling off th… [+759 chars],fox-news,Fox News
,Chili's menu changes spark online outrage as diners 'confused' by decision,"Chili's is axing Kids Pepperoni Pizza, Kids Cheese Quesadillas and Mini Molten from its menu, while also replacing skillet quesos with a new Southwestern Queso offering.",https://www.foxnews.com/food-drink/chilis-menu-changes-spark-online-outrage-diners-confused-decision,https://static.foxnews.com/foxnews.com/content/uploads/2025/10/chilis-menu-change-new-queso-kids-quesadilla-mini-moltens-3.jpg,2025-10-03T17:11:31Z,"Chili's is axing some popular items from its kids' and dessert menus while also rolling out a new offering aimed at keeping customers satisfied.
In late September, customers in the Reddit community … [+2581 chars]",fox-news,Fox News
,Longtime Trump ally Lewandowski flirts with primary challenge against GOP governor,Former Trump campaign manager Corey Lewandowski explores primary challenge to Governor Kelly Ayotte as redistricting tensions rise in New Hampshire politics.,https://www.foxnews.com/politics/longtime-trump-ally-lewandowski-flirts-primary-challenge-against-gop-governor,https://static.foxnews.com/foxnews.com/content/uploads/2025/10/donald-trump-corey-lewandowski.jpg,2025-10-03T17:09:04Z,"President Donald Trump's first campaign manager and longtime ally, Corey Lewandowski, is weighing a primary challenge next year against Republican Gov. Kelly Ayotte of New Hampshire.
""Everyone says … [+5730 chars]",fox-news,Fox News
,Israel claims no aid was found aboard Gaza-bound flotilla,"Israeli authorities claimed the Global Sumud Flotilla did not have aid, while the organizers asserted that it was carrying humanitarian supplies for Gaza.",https://www.foxnews.com/world/israel-claims-no-aid-found-aboard-gaza-flotilla,https://static.foxnews.com/foxnews.com/content/uploads/2025/10/gaza-global-sumud-flotilla-activists.jpg,2025-10-03T17:03:37Z,"Israel said the Global Sumud Flotilla (GSF) was carrying plenty of activists, but no aid. 
The flotilla, which consisted of 40 vessels, was intercepted on Thursday during Yom Kippur, the holiest day… [+4694 chars]",fox-news,Fox News
,Sex offender called ‘poster boy’ for GOP’s transgender ideology concerns faces court hearing,Virginia Republicans cite Richard Kenneth Cox's case in debates over transgender policies as the convicted sex offender faces new criminal charges in court.,https://www.foxnews.com/politics/sex-offender-called-poster-boy-gops-transgender-ideology-concerns-faces-court-hearing,https://static.foxnews.com/foxnews.com/content/uploads/2025/10/arlington-skyline-scene.png,2025-10-03T16:57:51Z,"Serial sex offender Richard Kenneth Cox appeared in Arlington, Virginia circuit court Friday facing several prurient charges, with a vulgar rap sheet going back to the George H.W. Bush administration… [+5169 chars]",fox-news,Fox News
,Actor Richard Gere believes Trump has ‘almost destroyed the country’ in just six months,"Actor Richard Gere criticized President Donald Trump and Israeli Prime Minister Benjamin Netanyahu, saying both leaders need to go during an interview at a Spanish charity event.",https://www.foxnews.com/media/actor-richard-gere-believes-trump-almost-destroyed-country-just-six-months,https://static.foxnews.com/foxnews.com/content/uploads/2025/10/gere-trump-spain.jpg,2025-10-03T16:32:54Z,"""Pretty Woman"" actor Richard Gere criticized President Donald Trumps record during his second term in an interview Monday.
While attending a charity dinner for Open Arms, a Spanish non-governmental … [+2744 chars]",fox-news,Fox News
,Caitlin Clark opens up about injury-riddled season that limited Fever star to 13 games: 'Some hard days',Indiana Fever star Caitlin Clark opened up about the severity of the injury that limited her to just 13 games in her second WNBA season.,https://www.foxnews.com/sports/caitlin-clark-opens-up-about-injury-riddled-season-limited-fever-star-13-games-some-hard-days,https://static.foxnews.com/foxnews.com/content/uploads/2025/10/caitlin-clark-walks-off-court.jpg,2025-10-03T16:21:40Z,"Caitlin Clark opened up during her exit interview Thursday about the litany of lower-body injuries that limited the Indiana Fever star to just 13 games in her sophomore campaign.
Clark, 23, spoke to… [+2509 chars]",fox-news,Fox News
,University of Delaware condemns student comedy show's offensive Charlie Kirk reference,"University of Delaware condemned a student television show that aired a joke about Charlie Kirk's death, prompting criticism from Delaware Republican Party officials.",https://www.foxnews.com/media/university-delaware-under-fire-student-produced-comedy-show-crediting-charlie-kirks-kiler,https://static.foxnews.com/foxnews.com/content/uploads/2025/09/charlie-kirk-rnc-2020.png,2025-10-03T16:00:37Z,"The Delaware Republican Party criticized the University of Delaware over a student-produced comedy show that included jokes about assassinated Turning Point USA (TPUSA) founder Charlie Kirk.
Delawar… [+3729 chars]",fox-news,Fox News
,"DHS reveals extensive criminal history of former Des Moines superintendent who was arrested, in US illegally",Former Des Moines Public Schools superintendent Ian Roberts lived in U.S. illegally and has decades-long record of drug and weapons crimes.,https://www.foxnews.com/us/dhs-reveals-extensive-criminal-history-former-des-moines-superintendent-arrested-us-illegally,https://static.foxnews.com/foxnews.com/content/uploads/2025/09/des-moines-school-chief-arrested.jpg,2025-10-03T19:55:41Z,"The former superintendent of Iowa's largest school district, who was living and working in the United States illegally, has an extensive criminal history, including drug and weapons possession, the D… [+2821 chars]",fox-news,Fox News
,Keith Urban’s guitarist Maggie Baugh misses concert as he shows Nicole Kidman photo during emotional slideshow,"Keith Urban performed his first concert since Nicole Kidman filed for divorce in Hershey, Pennsylvania, on Oct. 2, with guitarist Maggie Baugh absent.",https://www.foxnews.com/entertainment/keith-urbans-guitarist-maggie-baugh-misses-concert-he-shows-nicole-kidman-photo-during-emotional-slideshow,https://static.foxnews.com/foxnews.com/content/uploads/2025/10/keith-urban-performs-cma.jpg,2025-10-03T19:45:00Z,"Keith Urban stepped back into the spotlight just days after the curtain dropped on his 19-year marriage to Nicole Kidman.
In his first concert since Kidman filed for divorce, the country superstar t… [+3001 chars]",fox-news,Fox News
,Keith Urban’s guitarist Maggie Baugh misses concert as he shows Nicole Kidman photo during emotional slideshow,"Keith Urban performed his first concert since Nicole Kidman filed for divorce in Hershey, Pennsylvania, on Oct. 2, with guitarist Maggie Baugh absent.",https://www.foxnews.com/entertainment/keith-urban-performs-first-concert-nicole-kidman-files-divorce-changes,https://static.foxnews.com/foxnews.com/content/uploads/2025/10/29db282d-keith-urban.jpg,2025-10-03T19:45:00Z,"Keith Urban stepped back into the spotlight just days after the curtain dropped on his 19-year marriage to Nicole Kidman.
In his first concert since Kidman filed for divorce, the country superstar t… [+3001 chars]",fox-news,Fox News
,FBI cuts ties with leftist group that put Turning Point USA on its 'hate map' before Kirk assassination,"FBI Director Kash Patel announces the agency has terminated all ties with the Southern Poverty Law Center, calling the nonprofit a 'partisan smear machine.'",https://www.foxnews.com/politics/fbi-cuts-ties-leftist-group-put-turning-point-usa-its-hate-map-before-kirk-assassination,https://static.foxnews.com/foxnews.com/content/uploads/2025/09/kash-patel-sunglasses.jpg,2025-10-03T19:44:22Z,"FBI Director Kash Patel announced on Friday the agency has ""terminated"" all ties with the Southern Poverty Law Center (SPLC) a left-leaning nonprofit organization known for its ""Hate Map"" and designa… [+4263 chars]",fox-news,Fox News
,"Iran expands it ‘shadow empire’ across Middle East as Trump pulls troops from Iraq, Syria","Iran has built parallel military infrastructure across Syria and Iraq over decades, creating a shadow empire that security analysts fear will grow stronger as U.S. withdraws.",https://www.foxnews.com/world/iran-expands-shadow-empire-across-middle-east-trump-pulls-troops-from-iraq-syria,https://static.foxnews.com/foxnews.com/content/uploads/2025/10/iran-back-militas-in-iraq.jpg,2025-10-03T19:31:00Z,"Just six months after the Trump administration said it would begin drawing down U.S. forces in Syria, the U.S. confirmed this week it will also begin reducing the number of U.S. forces in Iraq under … [+6459 chars]",fox-news,Fox News
,Minnesota teen softball player opens up on trans pitcher playoff game as Trump admin vows Title IX enforcement,Minnesota faces a federal Title IX enforcement after trans pitcher Marissa Rothenberger ended Kendall Kotzmacher's championship hopes in the state softball semifinals.,https://www.foxnews.com/sports/minnesota-teen-softball-player-speaks-out-about-facing-trans-pitcher-trump-admin-enforces-title-ix,https://static.foxnews.com/foxnews.com/content/uploads/2025/10/tim-walz-kendall-kotzmacher-donald-trump1.jpg,2025-10-03T19:14:00Z,"Kendall Kotzmacher will never forget the day she stepped into the batter's box against Marissa Rothenberger. 
It was a Minnesota state tournament semifinal. Kotzmacher and her White Bear Lake High S… [+7057 chars]",fox-news,Fox News
,"Trump extends US security guarantee to Qatar, elevating Gulf ally to near-NATO status",President Donald Trump issued a security guarantee for Qatar after Prime Minister Benjamin Netanyahu apologized for an Israeli strike and announced Gaza ceasefire plans.,https://www.foxnews.com/politics/trump-extends-us-security-guarantee-qatar-elevating-gulf-ally-near-nato-status,https://static.foxnews.com/foxnews.com/content/uploads/2025/05/gettyimages-2214408304-scaled.jpg,2025-10-03T19:12:14Z,"President Donald Trump
 signed an order Monday offering a U.S. guarantee for Qatars security, a significant commitment for the rising non-NATO Arab ally.
""The United States shall regard any armed a… [+2987 chars]",fox-news,Fox News
,Seattle mayor rejects locking up repeat criminals during tense debate: 'Maybe they're hungry',"Seattle Democratic Mayor Bruce Harrell is facing criticism over a debate response where he explained why he has ""no desire"" to put repeat offenders in jail.",https://www.foxnews.com/politics/seattle-mayor-rejects-locking-up-repeat-criminals-during-tense-debate-maybe-theyre-hungry,https://static.foxnews.com/foxnews.com/content/uploads/2023/10/bruce-harrell-seattle-mayor-2022.jpg,2025-10-03T19:09:50Z,"Seattles Democratic Mayor Bruce Harrell said during a mayoral debate Thursday night that he has ""no desire"" to put repeat criminal defenders in jail and said he doesn't know how to answer the questio… [+4796 chars]",fox-news,Fox News
,Government shutdown drags into weekend as Senate Democrats block GOP plan,Government shutdown to roll into weekend as Senate Minority Leader Chuck Schumer demands bipartisan negotiations on continuing resolution and healthcare credits.,https://www.foxnews.com/politics/government-shutdown-drags-weekend-senate-democrats-block-gop-plan,https://static.foxnews.com/foxnews.com/content/uploads/2025/10/senate-minority-leader-chuck-schumer-1.jpg,2025-10-03T19:04:19Z,"Senate Democrats blocked Republicans attempt to reopen the government again, all but guaranteeing that the government shutdown rolls through the weekend.
After a day off to observe Yom Kippur, lawma… [+4936 chars]",fox-news,Fox News
,Spanberger defends abortion ad criticizing Sears after Bernie warns against highlighting issue,"Sen. Bernie Sanders warned Vice President Harris to focus on working class issues over abortion, but Virginia's Spanberger continues targeting Earle-Sears on reproductive rights.",https://www.foxnews.com/politics/spanberger-defends-abortion-ad-criticizing-sears-after-bernie-warns-against-highlighting-issue,https://static.foxnews.com/foxnews.com/content/uploads/2025/08/abigail-spanberger-falg.jpg,2025-10-03T19:02:06Z,"Virginia Democratic gubernatorial nominee Abigail Spanberger on Friday defended her new ad targeting Lt. Gov. Winsome Earle-Sears opposition to abortion, despite Sen. Bernie Sanders recently warning … [+3538 chars]",fox-news,Fox News
,"Trump in talks to do first '60 Minutes’ interview after CBS settlement, according to report","New reports have said President Donald Trump may appear on CBS' ""60 Minutes"" months after reaching a $16 million settlement with the network over edited interview practices.",https://www.foxnews.com/media/trump-talks-first-60-minutes-interview-cbs-settlement-according-report,https://static.foxnews.com/foxnews.com/content/uploads/2025/10/trump-60-minutes.jpg,2025-10-03T18:57:30Z,"President Donald Trump is in talks to appear in a CBS ""60 Minutes"" interview soon, according to a report from Semafor.
The news outlet spoke to four people with knowledge of the discussions, who sai… [+2863 chars]",fox-news,Fox News
,Over a dozen arrested at anti-ICE protests in Chicago suburb,Anti-ICE protesters at the Broadview facility outside of Chicago were arrested on Friday as tensions between demonstrators and law enforcement escalate.,https://www.foxnews.com/us/over-dozen-arrested-anti-ice-protests-chicago-suburb,https://static.foxnews.com/foxnews.com/content/uploads/2025/10/ice-protest-arrest-broadview-oct-3.jpg,2025-10-03T18:52:55Z,"More than a dozen people were arrested on Friday during protests at a U.S. Immigration and Customs Enforcement processing facility in Broadview, Ill., a suburb of Chicago.
Just before 8 a.m. ET, app… [+3452 chars]",fox-news,Fox News
,"Yankees' Cam Schlittler trolls Red Sox after historic outing, explains why it was 'personal' for him","New York Yankees’ Cam Schlittler said his dominant American League Wild Card Series outing against the Boston Red Sox, who he grew up rooting for, turned ""personal.""",https://www.foxnews.com/sports/yankees-cam-schlittler-trolls-red-sox-after-historic-outing-explains-why-personal-him,https://static.foxnews.com/foxnews.com/content/uploads/2025/10/cam-schlittler-wild-card.jpg,2025-10-03T18:51:59Z,"Cam Schlittler grew up a Boston Red Sox fan, but spent Thursday night breaking their hearts.
Now the New York Yankees' most recent postseason hero, Schlittler became the first player in MLB history … [+2011 chars]",fox-news,Fox News
,"Trump, Johnson appear at odds in government shutdown messaging","As Democrats refuse to back a GOP funding plan without healthcare subsidies, President Trump and Speaker Johnson strike different tones on the shutdown’s impact.",https://www.foxnews.com/politics/trump-johnson-appear-odds-government-shutdown-messaging,https://static.foxnews.com/foxnews.com/content/uploads/2025/10/johnson-trump-shutdown.jpg,2025-10-03T18:46:15Z,"Top Republican officials appear to be at odds with each other over how to portray the fallout from the ongoing government shutdown.
Senate Democrats are still refusing to budge from their demands fo… [+5316 chars]",fox-news,Fox News
,How Wikipedia made Trump an 'authoritarian',"Wikipedia editors have coordinated to label Donald Trump as authoritarian across multiple articles, using identical language and questionable sources to build a narrative.",https://www.foxnews.com/media/how-wikipedia-made-trump-authoritarian,https://static.foxnews.com/foxnews.com/content/uploads/2025/09/donald-trump-military-leaders-remarks-quantico.jpg,2025-10-03T18:44:31Z,"Is President Donald Trump an authoritarian? Over the past year, a handful of partisan Wikipedia editors have built a narrative making precisely this claim.
Adversarial editors have seeded this highl… [+6375 chars]",fox-news,Fox News
,How Wikipedia made Trump an 'authoritarian',"Wikipedia editors have coordinated to label Donald Trump as authoritarian across multiple articles, using identical language and questionable sources to build a narrative.",https://www.foxnews.com/opinion/how-wikipedia-made-trump-authoritarian,https://static.foxnews.com/foxnews.com/content/uploads/2025/09/donald-trump-military-leaders-remarks-quantico.jpg,2025-10-03T18:44:31Z,"Is President Donald Trump an authoritarian? Over the past year, a handful of partisan Wikipedia editors have built a narrative making precisely this claim.
Adversarial editors have seeded this highl… [+6375 chars]",fox-news,Fox News
,White House pressed about Trump seemingly changing his tune on Project 2025,"Press secretary Karoline Leavitt says Cabinet secretaries will decide government cuts when asked if Project 2025 is the ""the blueprint for shrinking the government.""",https://www.foxnews.com/politics/white-house-pressed-about-trump-seemingly-changing-his-tune-project-2025-2,https://static.foxnews.com/foxnews.com/content/uploads/2025/10/project-2025-press-briefing.jpg,2025-10-03T18:39:33Z,"White House press secretary Karoline Leavitt was pressed about President Donald Trump seemingly changing his campaign position on Project 2025 amid the government shutdown Friday.
""During the campai… [+3105 chars]",fox-news,Fox News
,White House pressed about Trump seemingly changing his tune on Project 2025,"Press secretary Karoline Leavitt says Cabinet secretaries will decide government cuts when asked if Project 2025 is the ""the blueprint for shrinking the government.""",https://www.foxnews.com/politics/white-house-pressed-about-trump-seemingly-changing-his-tune-project-2025,https://static.foxnews.com/foxnews.com/content/uploads/2025/10/project-2025-press-briefing.jpg,2025-10-03T18:39:33Z,"White House press secretary Karoline Leavitt was pressed about President Donald Trump seemingly changing his campaign position on Project 2025 amid the government shutdown Friday.
""During the campai… [+3071 chars]",fox-news,Fox News
,White House pressed about Trump seemingly changing his tune on Project 2025,"Press secretary Karoline Leavitt says Cabinet secretaries will decide government cuts when asked if Project 2025 is the ""the blueprint for shrinking the government.""",https://www.foxnews.com/politics/n,https://static.foxnews.com/foxnews.com/content/uploads/2025/10/project-2025-press-briefing.jpg,2025-10-03T18:39:33Z,"White House press secretary Karoline Leavitt was pressed about President Donald Trump seemingly changing his campaign position on Project 2025 amid the government shutdown Friday.
""During the campai… [+3105 chars]",fox-news,Fox News
,"Trump administration reviewing Portland federal funding amid anti-ICE clashes, journalist's detention","The White House says the Trump administration will review aid to Portland, Oregon, after violent anti-ICE clashes and a journalist's controversial arrest.",https://www.foxnews.com/politics/trump-admin-reviewing-portland-federal-funding-amid-anti-ice-clashes-journalists-detention,https://static.foxnews.com/foxnews.com/content/uploads/2025/10/portland-oregon-ice-protest-4.jpg,2025-10-03T18:32:06Z,"The Trump administration announced a review Friday of federal funding to Portland, Oregon, following violent anti-U.S. Immigration and Customs Enforcement (ICE) clashes there, with White House press … [+3782 chars]",fox-news,Fox News
,"ICE officers in Illinois targeted by illegal immigrants who used 'vehicles as weapons,' officials say","ICE officers in Illinois were targeted by two illegal immigrants who tried to use their vehicles as weapons in ""deliberate attempts"" to hurt them, DHS says.",https://www.foxnews.com/us/ice-officers-illinois-targeted-illegal-immigrants-who-used-vehicles-weapons-officials-say,https://static.foxnews.com/foxnews.com/content/uploads/2025/10/miguel-escareno-de-loera-arrest-1.jpg,2025-10-03T18:18:27Z,"Two illegal immigrants were arrested in Illinois for allegedly weaponizing their vehicles in ""deliberate attempts to ram and injure"" U.S. Immigration and Customs Enforcement (ICE) officers, the Depar… [+2565 chars]",fox-news,Fox News
,Mamdani torched over 'destructive' plan to axe NYC gifted program for kindergartners,Former Gov. Andrew Cuomo and Curtis Sliwa criticized Zohran Mamdani's education policy as the New York City mayoral race heats up following Mayor Eric Adams dropping out.,https://www.foxnews.com/politics/mamdani-torched-over-destructive-plan-axe-nyc-gifted-program-kindergartners,https://static.foxnews.com/foxnews.com/content/uploads/2025/10/zohran-mamdani-september-2025.png,2025-10-03T18:17:49Z,"Zohran Mamdani's New York City mayoral opponents ridiculed his plan to phase out the city's gifted program for public school kindergartners.
Mamdani, the New York City Democratic mayoral nominee, wo… [+4664 chars]",fox-news,Fox News
,Texas megachurch founder to spend 6 months in jail for sexually abusing girl,Texas megachurch founder Robert Preston Morris accepted a plea deal for sexual abuse charges dating back to the 1980s and will serve six months in jail.,https://www.foxnews.com/us/texas-megachurch-founder-spend-6-months-jail-sexually-abusing-girl,https://static.foxnews.com/foxnews.com/content/uploads/2025/10/robert-morris-texas-megachurch-sex-crimes_01.jpg,2025-10-03T18:16:09Z,"The founder of a Texas megachurch who previously resigned following allegations of sexual abuse dating back to the 1980s has pleaded guilty to five counts of lewd and indecent acts with a child, acco… [+3225 chars]",fox-news,Fox News
,"Yankees' Ryan McMahon flips over railing to preserve rookie Cam Schlittler's historic gem, knock out Red Sox","New York Yankees rookie Cam Schlittler etched postseason history, while Ryan McMahon made a spectacular catch flipping into the dugout in a win-or-go-home clash.",https://www.foxnews.com/sports/yankees-ryan-mcmahon-flips-over-railing-preserve-rookie-cam-schlittlers-historic-gem-knock-out-red-sox,https://static.foxnews.com/foxnews.com/content/uploads/2025/10/ryan-mcmahon-feet-10325.jpg,2025-10-03T18:10:03Z,"Cam Schlittler became the first player in MLB history to pitch eight scoreless innings and strike out 12 without allowing a walk in the postseason on Thursday night, but even he needed some help from… [+2119 chars]",fox-news,Fox News
,Michelle Obama cites 'quite the journey' with Barack Obama in anniversary message,Former President Barack Obama and Michelle Obama celebrated their anniversary with matching social media posts praising each other's strength and love.,https://www.foxnews.com/politics/united-front-michelle-obama-cites-quite-journey-barack-obama-anniversary-message,https://static.foxnews.com/foxnews.com/content/uploads/2025/10/michelle-obama-barack-anniversary.jpg,2025-10-03T18:09:02Z,"Former President Barack Obama and Michelle Obama both shared anniversary messages Friday to celebrate 33 years of wedded bliss.
Both shared the same image of the couple together on X within a minute… [+1740 chars]",fox-news,Fox News
,"DHS rips ‘dishonest, desperate’ Gen Z candidate who raged against Kristi Noem’s 'crimes’ at anti-ICE protest","Illinois congressional candidate Kat Abughazaleh led a protest rejecting U.S. Immigration and Customs Enforcement operations, demanding transparency from the Broadview ICE facility.",https://www.foxnews.com/politics/dhs-rips-dishonest-desperate-gen-z-candidate-who-raged-against-kristi-noems-crimes-anti-ice-protest,https://static.foxnews.com/foxnews.com/content/uploads/2025/10/kat-abughazaleh-broadview.png,2025-10-03T21:40:30Z,"Progressive candidate for Illinois' 9th Congressional District Kat Abughazaleh, during a protest outside a U.S. Immigration and Customs Enforcement facility on Friday, accused Department of Homeland … [+4195 chars]",fox-news,Fox News
,"DHS Secretary Noem 'blocked' from bathroom at Illinois government building, as Pritzker feud heats up",Kristi Noem says she was denied entry to an Illinois government building for a bathroom break while federal agents arrested protesters at a nearby immigration facility.,https://www.foxnews.com/us/dhs-secretary-noem-blocked-bathroom-illinois-government-building-pritzker-feud-heats,https://static.foxnews.com/foxnews.com/content/uploads/2025/10/kristi-noem-broadview-illinois.jpg,2025-10-03T21:32:27Z,"Department of Homeland Security (DHS) Secretary Kristi Noem said Friday that she and her staff were denied entry to a government building in a Chicago suburb where they attempted to stop for a ""bathr… [+4085 chars]",fox-news,Fox News
,Angel Reese speaks out against fans critical of her looks: 'I'm really not sorry',Angel Reese addressed double standards facing WNBA players who are criticized for being both too feminine and too masculine in their appearances.,https://www.foxnews.com/sports/angel-reese-speaks-out-against-fans-critical-her-looks-im-really-not-sorry,https://static.foxnews.com/foxnews.com/content/uploads/2025/09/angel-reese-dribbling-9425.jpg,2025-10-03T21:27:55Z,"WNBA star Angel Reese addressed fans who have suggested that, because of her looks, she doesn't ""take basketball seriously."" 
Reese, who has garnered a reputation for an emphasis on flashy makeup an… [+2810 chars]",fox-news,Fox News
