author,title,description,url,urlToImage,publishedAt,content,source.id,source.name
,Texas Tech scraps tortilla tradition ahead of upcoming home football game,"The Texas Tech Red Raiders will no longer encourage or permit fans to throw tortillas during their college football games, the athletic director said Monday.",https://www.foxnews.com/sports/texas-tech-scraps-tortilla-tradition-ahead-upcoming-home-football-game,https://static.foxnews.com/foxnews.com/content/uploads/2025/10/texas-tech-tortillas-102025-2.jpg,2025-10-20T19:34:43Z,"Texas Tech University put its foot down when it came to fans throwing tortillas.
Red Raiders athletic director Kirby Hocutt and head football coach Joey McGuire said Monday at a news conference that… [+1923 chars]",fox-news,Fox News
,Prince Andrew accuser Virginia Giuffre feared she would 'die a sex slave' in Jeffrey Epstein trafficking ring,"After years of being sexually ""lent"" out, Prince Andrew's accuser, Virginia Giuffre, feared she may ""die a sex slave"" at the hands of Jeffrey Epstein and Ghislaine Maxwell.",https://www.foxnews.com/entertainment/prince-andrew-accuser-virginia-giuffre-feared-she-would-die-sex-slave-jeffrey-epstein-trafficking-ring,https://static.foxnews.com/foxnews.com/content/uploads/2025/10/virginia-giuffre.jpg,2025-10-20T19:20:28Z,"After years of being sexually ""lent"" out to powerful people, Prince Andrew's accuser, Virginia Giuffre, feared she may have died a sex slave at the hands of Jeffrey Epstein and Ghislaine Maxwell. 
I… [+6119 chars]",fox-news,Fox News
,All-American jeans that look great and are worth the extra money,These American-made denim lines are tougher than anything off the rack.,https://www.foxnews.com/deals/american-made-denim-lines,https://static.foxnews.com/foxnews.com/content/uploads/2025/10/american-denim.jpg,2025-10-20T19:10:47Z,"When looking for a reliable pair of jeans, American-made brings you options from small-batch selvage (aka, woven the old-school way) to everyday classics. The denim brands featured here cut, sew and … [+5611 chars]",fox-news,Fox News
,Cuomo warns there will be 'nobody left' in New York City if Mamdani becomes mayor,"Independent New York mayoral candidate Andrew Cuomo criticized Democratic rival Zohran Mamdani's socialist policies, including higher taxes and free public transportation.",https://www.foxnews.com/media/cuomo-warns-nobody-left-new-york-city-mamdani-becomes-mayor,https://static.foxnews.com/foxnews.com/content/uploads/2025/10/mamdani-cuomo-nyc.jpg,2025-10-20T19:02:42Z,"Independent New York City mayoral candidate Andrew Cuomo told Fox News on Monday that droves of city residents will leave if Democratic candidate Zohran Mamdani is elected mayor in November.
Cuomo s… [+2638 chars]",fox-news,Fox News
,'No Kings' agitator vowed to ‘fight ICE’ with firebombs at blue city's protest: report,"David Cox, 54, from Newark Valley, was arrested in Brooklyn after allegedly threatening to attack ICE agents with firebombs on the same day as nationwide protests.",https://www.foxnews.com/us/no-kings-agitator-vowed-fight-ice-firebombs-blue-citys-protest-report,https://static.foxnews.com/foxnews.com/content/uploads/2025/10/nyc-no-kings-day-protests_03.jpg,2025-10-20T18:34:14Z,An upstate New York man was arrested in the Big Apple after allegedly claiming he was traveling to attack federal agents on the same day thousands of people took to the streets to participate in the … [+2037 chars],fox-news,Fox News
,"Fire chief's dog escapes unharmed after chewing on lithium-ion battery, sparking house fire","A Chapel Hill fire chief's dog, named Colton, sparked a small house fire after chewing on a lithium-ion battery while his owners were away from home.",https://www.foxnews.com/us/fire-chiefs-dog-escapes-unharmed-after-chewing-lithium-ion-battery-sparking-house-fire,https://static.foxnews.com/foxnews.com/content/uploads/2025/10/dog-battery-fire-gif-.gif,2025-10-20T18:30:39Z,"A recently released video captured the moment a dog belonging to a North Carolina fire chief ironically sparked a small house fire in Chapel Hill by chewing on a lithium-ion battery. 
The Chapel Hil… [+1603 chars]",fox-news,Fox News
,NYC mayoral rivals unite against billionaire ‘election interference’ as campaign enters final stretch,"Republican Curtis Sliwa refuses to withdraw from the New York City mayoral race despite billionaire calls, creating an unlikely alliance with Democratic opponent Zohran Mamdani.",https://www.foxnews.com/politics/nyc-mayoral-rivals-unite-against-billionaire-election-interference-campaign-enters-final-stretch,https://static.foxnews.com/foxnews.com/content/uploads/2025/10/sliwa-and-mamdani-nyc-debate.png,2025-10-20T18:26:52Z,"With two weeks until Election Day, Democratic nominee Zohran Mamdani and Republican nominee Curtis Sliwa have landed on unlikely common ground: rejecting billionaire influence in the New York City ma… [+4400 chars]",fox-news,Fox News
,New vitamin compound shows promise for reversing Alzheimer's damage to the brain,"A new vitamin K-based treatment could help replenish lost neurons in Alzheimer's patients, offering hope for slowing neurodegenerative disease progression.",https://www.foxnews.com/health/new-vitamin-compound-shows-promise-reversing-alzheimers-damage-brain,https://static.foxnews.com/foxnews.com/content/uploads/2025/10/elderly-man-taking-vitamins.jpg,2025-10-20T18:14:46Z,"An enhanced version of vitamin K could help reverse brain damage from Alzheimers disease, a study has found.
Alzheimers and many other neurodegenerative diseases are marked by a loss of brain neuron… [+2724 chars]",fox-news,Fox News
,"Hamas releases coffin of dead hostage to Red Cross, IDF confirms",Hamas transfers a deceased hostage's coffin to the Red Cross for handover to Israel Defense Forces troops in Gaza as part of ongoing ceasefire agreement.,https://www.foxnews.com/world/hamas-releases-coffin-dead-hostage-red-cross-idf-confirms,https://static.foxnews.com/foxnews.com/content/uploads/2025/10/hostage-coffin-ceasefire.jpg,2025-10-20T18:09:31Z,"A coffin of a deceased hostage has been transferred from Hamas to the Red Cross, the Israel Defense Forces (IDF) said on Monday.
The coffin is being transferred into Red Cross' custody and is on the… [+745 chars]",fox-news,Fox News
,Michigan woman wins $100K Powerball jackpot using ChatGPT to pick numbers,"A 45-year-old Wyandotte woman used artificial intelligence to pick winning Powerball numbers, earning her a $100,000 prize from the Michigan Lottery.",https://www.foxnews.com/lifestyle/michigan-woman-wins-100k-powerball-jackpot-using-chatgpt-pick-numbers,https://static.foxnews.com/foxnews.com/content/uploads/2025/10/michigan-lottery-winning.jpg,2025-10-20T18:03:24Z,"A Michigan womans decision to let artificial intelligence (AI) pick her lottery numbers has paid off in a big way.
Tammy Carvey, 45, of Wyandotte, won a massive Powerball jackpot of $100,000 and say… [+2293 chars]",fox-news,Fox News
,Ex-NFL referee believes Christian McCaffrey's game-sealing touchdown against Falcons shouldn't have counted,Former NFL referee Terry McAulay says Christian McCaffrey's game-sealing touchdown against the Atlanta Falcons should not have counted due to teammates pulling him.,https://www.foxnews.com/sports/ex-nfl-referee-believes-christian-mccaffreys-game-sealing-touchdown-against-falcons-shouldnt-have-counted,https://static.foxnews.com/foxnews.com/content/uploads/2025/10/christian-mccaffrey-touchdown-49ers-falcons-1.jpg,2025-10-20T21:55:41Z,"San Francisco 49ers star running back Christian McCaffrey shouldered the teams offensive output in the win over the Atlanta Falcons on Sunday night. 
But the game-sealing touchdown late in the game … [+2259 chars]",fox-news,Fox News
,LSU baseball coach praises Trump during celebration: 'Nobody works harder for America than you',LSU Tigers baseball head coach Jay Johnson offered high praise for President Donald Trump on Monday as the school celebrated a national title at the White House.,https://www.foxnews.com/sports/lsu-baseball-coach-praises-trump-during-celebration-nobody-works-harder-america-than-you,https://static.foxnews.com/foxnews.com/content/uploads/2025/10/trump-lsu-celebration-102025-3.jpg,2025-10-20T21:51:54Z,"LSU Tigers baseball head coach Jay Johnson praised President Donald Trump as his team visited the White House on Monday to celebrate their national championship.
LSU Shreveport joined the Tigers for… [+1584 chars]",fox-news,Fox News
,Trump admin agencies coordinating to expose Biden admin’s ‘prolific and dangerous’ weaponization of government,"EXCLUSIVE: U.S. agencies have been coordinating to expose the Biden administration’s ""prolific and dangerous weaponization of government,"" Fox News Digital has learned.",https://www.foxnews.com/politics/trump-admin-agencies-coordinating-expose-biden-admins-prolific-dangerous-weaponization-government,https://static.foxnews.com/foxnews.com/content/uploads/2025/07/tulsi-gabbard-speaks.png,2025-10-20T21:32:48Z,"EXCLUSIVE: Trump administration agencies are working to expose the Biden administrations ""prolific and dangerous weaponization of government,"" Fox News Digital has learned.
The Interagency Weaponiza… [+4798 chars]",fox-news,Fox News
,'No Kings' protesters filmed having children bash Trump piñata,"Saturday's ""No Kings"" protest near the Broadview, Illinois, Immigration and Customs Enforcement facility saw a Trump piñata get bashed.",https://www.foxnews.com/politics/no-kings-protesters-filmed-having-children-stab-trump-pinata,https://static.foxnews.com/foxnews.com/content/uploads/2025/10/trump-pinata-broadview-ice.jpg,2025-10-20T21:31:45Z,"Protesters at a ""No Kings"" demonstration in Chicago were filmed bashing a pinata resembling President Donald Trump Saturday.
The protesters were gathered outside an Immigration and Customs Enforceme… [+2015 chars]",fox-news,Fox News
,"Hillary Clinton leads brigade of left-wing mockery, bewilderment over Trump's viral 'No Kings' protest video","Democrats denounce President Donald Trump's AI-generated video depicting himself dropping brown sludge on crowds of ""No Kings"" protesters.",https://www.foxnews.com/politics/hillary-clinton-leads-brigade-left-wing-mockery-shock-over-trumps-viral-no-kings-protest-video,https://static.foxnews.com/foxnews.com/content/uploads/2025/10/hillary-clinton-speaks-dnc.jpg,2025-10-20T21:20:46Z,Former Secretary of State Hillary Clinton was among Democrats and Trump administration critics who took to social media this weekend to slam a satirical AI video President Donald Trump posted showing… [+4180 chars],fox-news,Fox News
,"Newborn found with umbilical cord attached in Penn Station, police hunt for parents","Infant discovered at 34th Street Penn Station prompts NYPD investigation, with Safe Haven Law allowing legal surrender at designated locations.",https://www.foxnews.com/us/newborn-found-umbilical-cord-attached-penn-station-police-hunt-parents,https://static.foxnews.com/foxnews.com/content/uploads/2025/10/baby-penn-station-001.jpg,2025-10-20T21:17:16Z,"The New York Police Department (NYPD) is searching for the parents of a baby girl found abandoned and alive at Penn Station in Manhattan Monday morning.
""The baby is in a stable condition and remain… [+1829 chars]",fox-news,Fox News
,New York Post editorial board calls for Curtis Sliwa to quit mayoral race to stop Zohran Mamdani,The New York Post Editorial Board on Monday called for Republican Curtis Sliwa to drop out of the city's mayoral race in hopes of stopping socialist Assemblyman Zohran Mamdani.,https://www.foxnews.com/opinion/swallow-bitter-pill-curtis-sliwa-quit-race-stop-zohran-mamdani,https://static.foxnews.com/foxnews.com/content/uploads/2025/10/sliwa-mamdani.jpg,2025-10-20T21:08:06Z,"It burns to write this, but: Its time for Curtis Sliwa to face reality, and admit that the citys best hope to avoid the disaster of a Zohran Mamdani mayoralty is for him to drop out of the race. 
Sl… [+1760 chars]",fox-news,Fox News
,Pacers rookie Kam Jones arrested after brief police chase in Indiana,"Kam Jones, a rookie guard for the Indiana Pacers, faces charges after allegedly leading police on a brief chase while driving 90 mph on Interstate 65.",https://www.foxnews.com/sports/pacers-rookie-kam-jones-arrested-after-brief-police-chase-indiana,https://static.foxnews.com/foxnews.com/content/uploads/2025/10/kameron-jones-arrest.jpg,2025-10-20T21:05:19Z,"Indiana Pacers rookie Kam Jones was arrested on Monday after a police chase in Indianapolis. 
Jones, who was selected by the San Antonio Spurs 38th overall before being traded to the Pacers, was boo… [+2002 chars]",fox-news,Fox News
,"Trump’s impending San Francisco crackdown sparks backlash from Newsom, mayor","Gov. Gavin Newsom, D-Calif., opposed the White House plan to send the National Guard to San Francisco, saying deployment will ruin one of America's greatest cities.",https://www.foxnews.com/politics/trumps-impending-san-francisco-crackdown-sparks-backlash-from-newsom-mayor,https://static.foxnews.com/foxnews.com/content/uploads/2025/09/trump-newsom-shake-hands.png,2025-10-20T21:04:43Z,"The White House is urging California Democrats to welcome the National Guard to ""clean up"" San Francisco, but Gov. Gavin Newsom, D-Calif., said the deployment will ""ruin one of America's greatest cit… [+4211 chars]",fox-news,Fox News
,'Tragedy averted' at Atlanta Airport as police arrest man with AR-15 allegedly threatening to 'shoot it up',"Family alerts police after man livestreams threat to ""shoot up"" Atlanta airport, leading to arrest before he could enter terminal with loaded AR-15 weapon.",https://www.foxnews.com/us/tragedy-averted-atlanta-airport-police-arrest-man-ar-15-allegedly-threatening-shoot-up,https://static.foxnews.com/foxnews.com/content/uploads/2025/10/atlanta-airport-ar15-threat-arrest-fox-news-003.jpg,2025-10-20T21:02:03Z,"A Georgia man was arrested Monday morning at Hartsfield-Jackson Atlanta International Airport after allegedly threatening to open fire at one of the nations busiest travel hubs.
Atlanta police said … [+2572 chars]",fox-news,Fox News
,"WATCH: 'No Kings' protester steps up to mic and calls for ICE agents to be 'shot,' 'wiped out'","Social media users are calling for a federal investigation after a man believed to work for a community college called for ICE agents to be shot at a ""No Kings"" rally.",https://www.foxnews.com/politics/watch-no-kings-protester-steps-up-mic-calls-ice-agents-shot-wiped-out,https://static.foxnews.com/foxnews.com/content/uploads/2025/10/protester-ice-no-kings.jpg,2025-10-20T20:57:31Z,"A man was captured on video calling for federal immigration agents to be shot while he spoke at a ""No Kings"" rally in Chicago
 in a message that quickly went viral on social media, resulting in call… [+1960 chars]",fox-news,Fox News
,Treasure hunter's persistence pays off with rare Spanish coin discovery on Nantucket beach,"Metal detectorist Travis Nichols discovered a rare 1782 silver Spanish one-reale coin on a Nantucket beach, adding to his collection of over 300 historic coins.",https://www.foxnews.com/travel/treasure-hunters-persistence-pays-off-rare-spanish-coin-discovery-nantucket-beach,https://static.foxnews.com/foxnews.com/content/uploads/2025/10/ma-nantucket-metal-detectorist-finds-coin-archaeology-history-1.jpg,2025-10-20T20:48:09Z,"A mysterious 18th-century coin recently resurfaced on a beach in Nantucket, thanks to one determined metal detectorist.
Hobbyist Travis Nichols found the coin a 1782 silver Spanish one-reale at a be… [+2124 chars]",fox-news,Fox News
,AI helps 'Predator Poachers' expose elementary school music teacher accused of 'sexting' teen,Elementary school teacher Mark Verity was arrested after confronted by predator catchers who used AI tools to trace him and gather evidence of alleged inappropriate behavior.,https://www.foxnews.com/us/ai-helps-predator-poachers-expose-elementary-school-music-teacher-accused-sexting-teen,https://static.foxnews.com/foxnews.com/content/uploads/2025/10/mark-verity-suffolk-county.jpg,2025-10-20T20:44:39Z,"A watchdog group in Long Island, New York, used Artificial Intelligence (AI) to bust an elementary school music teacher who allegedly sent sexually explicit messages to someone whom he believed was a… [+2970 chars]",fox-news,Fox News
,Supreme Court will consider case on Second Amendment rights of drug users,Supreme Court agrees to hear Ali Danial Hemani's case after appeals court ruled federal ban on gun ownership for marijuana users violates Second Amendment rights.,https://www.foxnews.com/politics/supreme-court-consider-case-second-amendment-rights-drug-users,https://static.foxnews.com/foxnews.com/content/uploads/2025/08/supreme-court-getty.png,2025-10-20T20:41:57Z,"The Supreme Court on Monday said it will consider a case that could allow people who regularly smoke marijuana to legally own guns.
The Trump administration has asked the high court to look at a cas… [+1861 chars]",fox-news,Fox News
,"James Comey seeks to dismiss his criminal case, citing 'vindictive' prosecution","Comey's lawyers asked the judge overseeing his case to dismiss his case for vindictive, selective prosecution — and to invalidate the head prosecutor who brought the case against him.",https://www.foxnews.com/politics/james-comey-seeks-dismiss-his-criminal-case-citing-vindictive-prosecution,https://static.foxnews.com/foxnews.com/content/uploads/2025/09/james.comey_.jpg,2025-10-20T20:31:19Z,"Lawyers for former FBI director James Comey
 asked a federal judge Monday to dismiss his criminal case on the grounds of ""vindictive and selective"" prosecution, citing what they argued in a new fili… [+3230 chars]",fox-news,Fox News
,Fox News Politics Newsletter: Trump blasts Colombia’s Petro after alleged drug strike death,"Welcome to the Fox News Politics newsletter, with the latest updates on the Trump administration, Capitol Hill and more Fox News politics content.",https://www.foxnews.com/politics/fox-news-politics-newsletter-trump-blasts-colombias-petro-after-alleged-drug-strike-death,https://static.foxnews.com/foxnews.com/content/uploads/2025/10/columbian-president-gustavo-petro.jpg,2025-10-20T20:18:07Z,"Welcome to the Fox News Politics newsletter, with the latest updates on the Trump administration, Capitol Hill and more Fox News politics content. Here's what's happening
-NYC billionaire Catsimatid… [+3018 chars]",fox-news,Fox News
,Trump threatens Hamas if Gaza ceasefire collapses as JD Vance to visit Israel,"President Donald Trump warns Hamas the U.S.-brokered Gaza truce must hold, vowing serious consequences if violence resumes, as Vice President JD Vance to visit Israel.",https://www.foxnews.com/world/trump-threatens-hamas-if-gaza-ceasefire-collapses-jd-vance-visit-israel,https://static.foxnews.com/foxnews.com/content/uploads/2025/10/trump-signing-peace-deal.png,2025-10-20T20:17:15Z,"As it was announced that Vice President JD Vance would visit Israel, President Donald Trump once again warned Hamas, saying the U.S.-brokered Gaza truce must hold, and issued another blunt warning to… [+3959 chars]",fox-news,Fox News
,Denise Richards' ex Aaron Phypers charged with multiple felonies days after courtroom arrest,"Days after being arrested and handcuffed in a Los Angeles courtroom, Denise Richards' ex Aaron Phypers has been charged with four felonies.",https://www.foxnews.com/entertainment/denise-richards-ex-aaron-phypers-charged-multiple-felonies-days-after-courtroom-arrest,https://static.foxnews.com/foxnews.com/content/uploads/2025/10/aaron-phypers.jpg,2025-10-20T20:16:53Z,"Days after being arrested in a Los Angeles courtroom, Denise Richards' estranged husband, Aaron Phypers, has been charged with four felonies. 
According to documents obtained by Fox News Digital, Ph… [+4101 chars]",fox-news,Fox News
,Matthew McConaughey clarifies long-standing rumor that his accent cost him millions in Hollywood,"Matthew McConaughey debunks rumors that he turned down the ""Titanic"" role due to his accent, revealing he simply didn't get the job as Jack Dawson.",https://www.foxnews.com/entertainment/matthew-mcconaughey-clarifies-long-standing-rumor-his-accent-cost-him-millions-hollywood,https://static.foxnews.com/foxnews.com/content/uploads/2025/10/matthew-mcconaughey-leonardo-dicaprio-titanic.jpg,2025-10-20T20:16:15Z,"Matthew McConaughey is setting the record straight about why he did not get the lead role of Jack Dawson in the 1997 blockbuster movie ""Titanic."" 
During an appearance on Hello Sunshine's ""The Brigh… [+4638 chars]",fox-news,Fox News
,Bernie Sanders says Democrats need to make 'fundamental decision' about what they stand for,"Sen. Bernie Sanders said Monday that the Democratic Party must make a ""fundamental decision"" about what they stand for during an appearance on ""The View.""",https://www.foxnews.com/media/bernie-sanders-says-democrats-need-make-fundamental-decision-about-what-stand,https://static.foxnews.com/foxnews.com/content/uploads/2025/10/bernie-sanders-the-view.jpg,2025-10-20T20:00:56Z,"Sen. Bernie Sanders, I-VT., said during ""The View"" on Monday that the Democratic Party needed to make a ""fundamental decision"" about what they stand for. 
Co-host Alyssa Farah Griffin pressed Sander… [+2104 chars]",fox-news,Fox News
,"Tim Tebow should be Florida's target for next head coach, ex-NFL star says",Heisman Trophy winner and former NFL star Robert Griffin III suggested the Florida Gators should make a splashy move at head coach this offseason.,https://www.foxnews.com/sports/tim-tebow-should-floridas-target-next-head-coach-ex-nfl-star-says,https://static.foxnews.com/foxnews.com/content/uploads/2025/10/florida-tim-tebow-102025-2.jpg,2025-10-20T23:58:23Z,"Florida Gators football is in search of a new head coach after the school fired Billy Napier on Sunday following an error-filled victory over the Mississippi State Bulldogs.
Heisman Trophy winner Ro… [+1544 chars]",fox-news,Fox News
,"Truck hits parked van in Midtown Manhattan, pushing vehicle onto sidewalk and injuring 9","Nine people were hospitalized with non-life-threatening injuries after a truck hit a parked van in Manhattan, causing it to strike pedestrians on the sidewalk.",https://www.foxnews.com/us/truck-hits-parked-van-midtown-manhattan-pushing-vehicle-onto-sidewalk-injuring-9,https://static.foxnews.com/foxnews.com/content/uploads/2025/10/crash-nyc_02.jpg,2025-10-20T23:46:32Z,"A truck hit a parked van in New York City on Monday, pushing it onto the sidewalk where it injured at least 9 people.
The New York City Fire Department (FDNY) confirmed the incident to Fox News Digi… [+1293 chars]",fox-news,Fox News
,"‘It’s a joke’: White House dismisses 'No Kings' protests, while Nancy Pelosi rips crown in defiance","President Donald Trump denied being a 'king' after weekend protests, calling demonstrators ""whacked out"" while Democrats like Chuck Schumer defended the rallies.",https://www.foxnews.com/politics/its-joke-white-house-dismisses-no-kings-protests-while-nancy-pelosi-rips-crown-defiance,https://static.foxnews.com/foxnews.com/content/uploads/2025/10/no-kings-protest.jpg,2025-10-20T23:37:06Z,"While President Donald Trump and his administration brushed off the ""No Kings"" nationwide protests rebuking the president over the weekend, Democrats lauded the protesters for standing up for democra… [+3868 chars]",fox-news,Fox News
,Stephen A Smith shares how he feels about NBA superstar LeBron James: 'I don’t like his a--',"Stephen A. Smith reveals he doesn't like LeBron James and feels their courtside confrontation was orchestrated, stemming from criticism of Bronny James.",https://www.foxnews.com/sports/stephen-smith-shares-feeling-nba-superstar-lebron-james-i-dont-like-his-a,https://static.foxnews.com/foxnews.com/content/uploads/2025/10/stephen-a-smith-lebron-james-1.jpg,2025-10-20T23:20:23Z,"Stephen A. Smith still thinks about the LeBron James courtside confrontation, and he told one former NBA star why he felt he was ""set up"" by the leagues all-time scoring leader in that moment. 
Smit… [+2906 chars]",fox-news,Fox News
,Jeffries hints at imminent decision on Mamdani endorsement after dodging questions for weeks,"House Minority Leader Hakeem Jeffries says he will weigh in on the New York City mayoral race, where Democratic Socialist Zohran Mamdani is running, before early voting begins Saturday.",https://www.foxnews.com/politics/jeffries-hints-imminent-decision-mamdani-endorsement-after-dodging-questions-weeks,https://static.foxnews.com/foxnews.com/content/uploads/2025/07/jeffries-mamdani.jpg,2025-10-20T23:16:51Z,"House Minority Leader Hakeem Jeffries, D-N.Y., is expected to imminently weigh in on the New York City mayoral race after dodging the question for weeks.
The top House Democrat, who represents part … [+4012 chars]",fox-news,Fox News
,"Broncos' Dre Greenlaw suspended for threatening ref after win over Giants, NFL says","Denver Broncos linebacker Dre Greenlaw was suspended for one game after he verbally threatened a referee after a win over the New York Giants, the NFL said.",https://www.foxnews.com/sports/broncos-dre-greenlaw-suspended-threatening-ref-after-win-over-giants-nfl-says,https://static.foxnews.com/foxnews.com/content/uploads/2025/10/nfl-broncos-dre-greenlaw-102025-3.jpg,2025-10-20T23:11:28Z,"The NFL on Monday suspended Denver Broncos linebacker Dre Greenlaw for unsportsmanlike conduct toward an official during the teams 33-32 win over the New York Giants.
Greenlaw chased after referee B… [+1400 chars]",fox-news,Fox News
