author,title,description,url,urlToImage,publishedAt,content,source.id,source.name
,'The View' fans brace themselves for return of guest conservative host Elisabeth Hasselbeck,"""The View"" co-host Joy Behar addresseed backlash and reaction from fans about Elisabeth Hasselbeck returning to ""The View"" as a guest host, and said she was a ""good kid.""",https://www.foxnews.com/media/the-view-fans-brace-themselves-return-guest-conservative-host-elisabeth-hasselbeck,https://static.foxnews.com/foxnews.com/content/uploads/2026/02/hasselbeck-behar-podcast.jpg,2026-02-11T16:52:51Z,"""The View"" co-host Joy Behar and show producer Brian Teta addressed the fan backlash and reaction on Tuesday to former host Elisabeth Hasselbeck's return to the show with Alyssa Farah Griffin on mate… [+3873 chars]",fox-news,Fox News
,Woman had argued with father in Texas over Trump before deadly shooting: UK investigation,"Lucy Harrison, 23, was allegedly shot dead by father in Texas after President Donald Trump argument. Grand jury declined to indict, but the U.K. inquest is ongoing.",https://www.foxnews.com/us/woman-had-argued-father-texas-over-trump-before-deadly-shooting-uk-investigation,https://static.foxnews.com/foxnews.com/content/uploads/2026/02/lucy-harrison-split.jpg,2026-02-11T16:40:53Z,"A British woman who was fatally shot while visiting her fathers home in Texas had argued with him about President Donald Trump earlier that day, the BBC reported.
Lucy Harrison, 23, from Warrington,… [+4567 chars]",fox-news,Fox News
,"Don Lemon hires surprising attorney, an ex-Trump appointee prosecutor who exposed massive Minnesota fraud case","Joe Thompson, who was the lead prosecutor that helped uncover the massive $250 million fraud case tied to the state's Somali community, joins Don Lemon’s legal team.",https://www.foxnews.com/media/don-lemon-hires-surprising-attorney-ex-trump-appointee-prosecutor-who-exposed-massive-minnesota-fraud-case,https://static.foxnews.com/foxnews.com/content/uploads/2026/02/don-lemon.jpg,2026-02-11T16:39:09Z,"Former CNN host Don Lemon has added an unlikely attorney to his legal team as he faces charges over his role in a January protest by anti-immigration enforcement agitators at a Minnesota church.
Joe… [+3666 chars]",fox-news,Fox News
,"Russian attack on Kharkiv wipes out young family, leaving pregnant mother as sole survivor","Russian drone strike kills father and three young children in Ukraine's Kharkiv region, leaving pregnant mother as sole survivor of Tuesday night attack.",https://www.foxnews.com/world/russian-attack-kharkiv-wipes-out-young-family-leaving-pregnant-mother-sole-survivor,https://static.foxnews.com/foxnews.com/content/uploads/2026/02/bohodukhiv-ukraine-drone-strike.jpg,2026-02-11T16:34:55Z,"A Russian drone strike Tuesday night in Ukraines Kharkiv region wiped out a young family, killing a father and his three small children, leaving a pregnant mother as the sole survivor.
Oleg Synegubo… [+2252 chars]",fox-news,Fox News
,Ex-FBI official flags possible scam as third alleged Nancy Guthrie letter emerges,Nancy Guthrie disappearance prompts third alleged letter demanding one Bitcoin in exchange for information about any suspected abductors of the 84-year-old Tucson woman.,https://www.foxnews.com/us/ex-fbi-official-flags-possible-scam-third-alleged-nancy-guthrie-letter-emerges,https://static.foxnews.com/foxnews.com/content/uploads/2026/02/nancy-guthrie-search-split.jpg,2026-02-11T16:33:32Z,"Former FBI assistant director Chris Swecker told Fox News ""The Faulkner Focus"" he is ""highly skeptical"" regarding a third letter being sent to TMZ and suggests it may be bad actors looking to capital… [+4023 chars]",fox-news,Fox News
,"Seattle schools staying open despite Seahawks Super Bowl parade, absences unexcused",Seattle Public Schools announced that classes would remain in session during the Seahawks’ Super Bowl parade and confirmed that attending the event would be an unexcused absence.,https://www.foxnews.com/sports/seattle-schools-staying-open-despite-seahawks-super-bowl-parade-absences-unexcused,https://static.foxnews.com/foxnews.com/content/uploads/2026/02/lombardi-trophy-21126.jpg,2026-02-11T16:32:13Z,"Seattle Seahawks fans will undoubtedly come out in droves for Wednesdays Super Bowl celebration, but for students partying, it will hurt their attendance records.
Seattle Public Schools announced ea… [+2118 chars]",fox-news,Fox News
,Kid Rock fires back at 'haters and fake news' over lip-sync claims from Turning Point halftime performance,"Kid Rock addresses production glitch that made his performance appear out of sync at Turning Point USA event, calling out ""fake news"" spreading online.",https://www.foxnews.com/entertainment/kid-rock-fires-back-haters-fake-news-over-lip-sync-claims-from-turning-point-halftime-performance,https://static.foxnews.com/foxnews.com/content/uploads/2026/02/kid-rock-1.jpg,2026-02-11T16:21:57Z,"Kid Rock is firing back at critics who accused him of lip-syncing during Turning Point USAs halftime show.
After social media lit up with claims that his performance of ""Bawitdaba"" didnt match the v… [+3893 chars]",fox-news,Fox News
,Tillis rips 'political lawfare' and praises grand jury after Dems avoid charges in ‘illegal orders’ case,"Sen. Thom Tillis, R-N.C., again broke with the Trump administration and praised a grand jury's decision against indicting six congressional Democrats.",https://www.foxnews.com/politics/tillis-rips-political-lawfare-praises-grand-jury-after-dems-avoid-charges-illegal-orders-case,https://static.foxnews.com/foxnews.com/content/uploads/2026/02/senator-thom-tillis-grand-jury.jpg,2026-02-11T16:21:23Z,A Senate Republican known for breaking with the Trump administration praised a grand jurys decision not to indict several congressional Democrats who urged service members to refuse what they describ… [+2796 chars],fox-news,Fox News
,Patriots' Will Campbell explains why he stiffed media after poor Super Bowl performance: 'I know myself',"After struggling in the Super Bowl and allowing 14 pressures, New England Patriots lineman Will Campbell took accountability, addressing his mistakes and promising growth.",https://www.foxnews.com/sports/patriots-campbell-explains-why-he-stiffed-media-after-poor-super-bowl-performance-i-know-myself,https://static.foxnews.com/foxnews.com/content/uploads/2026/02/will-campbell-21126.jpg,2026-02-11T16:20:05Z,"Nobody on the New England Patriots offense looked otherworldly during Super Bowl LX, but Will Campbell took the brunt of the blame.
The offensive tackle was the fourth selection of last year's NFL D… [+2420 chars]",fox-news,Fox News
,Who is Ilia Malinin? 'Quad God' might already be one of the greatest figure skaters of all time,"Ilia Malinin, known as the “Quad God,"" has captivated the skating world with record-breaking performances and now sets his sights on more Olympic glory in Milan.",https://www.foxnews.com/sports/who-ilia-malinin-quad-god-might-already-one-greatest-figure-skaters-all-time,https://static.foxnews.com/foxnews.com/content/uploads/2026/02/olympics-ilia-malinin-020826-1.jpg,2026-02-11T16:13:34Z,"Ilia Malinin was given his ""Quad God"" nickname when he was just a child, and he has lived up to the billing.
The 21-year-old earned his first Olympic gold medal on Sunday as part of the mixed team e… [+2246 chars]",fox-news,Fox News
,NPR host compares masked Guthrie suspect to 'federal immigration agent',NPR host Steve Inskeep compared the attire of the masked suspect in the video at Nancy Guthrie's home to the attire of a federal immigration agent on Wednesday.,https://www.foxnews.com/media/npr-host-compares-masked-guthrie-suspect-federal-immigration-agent,https://static.foxnews.com/foxnews.com/content/uploads/2026/02/ice-agent-minnesota-2026.jpg,2026-02-11T19:59:53Z,"NPR ""Morning Edition"" co-host Steve Inskeep said during an episode of the podcast on Wednesday that the suspect on video at Nancy Guthrie's house was wearing clothing similar to that of a federal imm… [+4103 chars]",fox-news,Fox News
,"Trump to host ‘Clean Beautiful Coal’ event, calls it America’s most reliable energy","President Trump is hosting an event at the White House Wednesday to tout how “Clean Beautiful Coal"" is America’s most reliable and affordable energy source.",https://www.foxnews.com/politics/trump-host-clean-beautiful-coal-event-calls-americas-most-reliable-energy,https://static.foxnews.com/foxnews.com/content/uploads/2025/06/poca-wv-coal.png,2026-02-11T19:48:39Z,"President Donald Trump is hosting an event at the White House Wednesday to tout how ""Clean Beautiful Coal,"" he says, is Americas most reliable and affordable energy source.
The president will be joi… [+4314 chars]",fox-news,Fox News
,Ohio man faces federal charges in case of teen found dismembered,"A 39-year-old Columbus man previously arrested in the death of 17-year-old Hailey Buzbee now faces federal charges, including sexual exploitation of a minor and interstate travel for illicit sexual conduct.",https://www.foxnews.com/us/ohio-man-faces-federal-charges-case-teen-found-dismembered,https://static.foxnews.com/foxnews.com/content/uploads/2026/02/tyler-thomas-hailey-buzbee.jpg,2026-02-11T19:48:11Z,A 39-year-old Columbus man previously arrested in the death of a missing teenage girl now faces federal charges alleging sexual exploitation of a minor and interstate travel for illicit sexual conduc… [+2479 chars],fox-news,Fox News
,Nadler mocked after appearing to doze off during Bondi hearing opening statements,"Rep. Jerry Nadler appeared to sleep during House Judiciary hearing with Attorney General Pam Bondi, prompting Republican criticism and social media mockery.",https://www.foxnews.com/politics/nadler-mocked-after-appearing-doze-off-during-bondi-hearing-opening-statements,https://static.foxnews.com/foxnews.com/content/uploads/2026/02/jerry-nalder.jpg,2026-02-11T19:46:37Z,"Rep. Jerry Nadler, D-N.Y., was seen with his eyes closed during portions of a key House Judiciary Committee hearing featuring Pam Bondi, leading observers to pan him for sleeping as the attorney gene… [+1926 chars]",fox-news,Fox News
,"James Van Der Beek, ‘Dawson’s Creek’ and ‘Varsity Blues’ star, dead at 48","James Van Der Beek, beloved ""Dawson's Creek"" and ""Varsity Blues"" star, has died at 48 after battling stage 3 colorectal cancer.",https://www.foxnews.com/entertainment/james-van-der-beek-dawsons-creek-varsity-blues-star-dead-48,https://static.foxnews.com/foxnews.com/content/uploads/2026/02/james-van-der-beek.jpg,2026-02-11T19:43:37Z,"James Van Der Beek, best known for his starring roles in ""Dawson's Creek"" and ""Varsity Blues,"" has died after a courageous battle with stage 3 colorectal cancer. He was 48.
""Our beloved James David … [+476 chars]",fox-news,Fox News
,Roblox child safety warning after Nebraska kidnapping case,A Nebraska man allegedly used Roblox and Snapchat to groom two sisters before kidnapping them. What parents need to know about online predators.,https://www.foxnews.com/tech/roblox-child-safety-warning-after-nebraska-kidnapping-case,https://static.foxnews.com/foxnews.com/content/uploads/2026/01/children-use-smartphones.jpg,2026-02-11T19:25:50Z,"What starts as a game can quietly turn into something much more serious. Parents across the country are paying closer attention after a Nebraska man was charged with kidnapping two sisters, ages 12 a… [+10285 chars]",fox-news,Fox News
,UN chief blasted as ‘abjectly tone-deaf’ over message to Iran marking revolution anniversary,U.N. chief's congratulations to Iran on Islamic revolution anniversary sparks outrage from human rights advocates amid ongoing crackdown investigations.,https://www.foxnews.com/world/un-chief-blasted-abjectly-tone-deaf-over-message-iran-marking-revolution-anniversary,https://static.foxnews.com/foxnews.com/content/uploads/2026/02/antonio-guterres-shoes.jpg,2026-02-11T19:21:52Z,"UNITED NATIONS: U.N. Secretary-General António Guterres sent a congratulatory message to Iran marking the anniversary of the 1979 Islamic Revolution, a move that drew sharp criticism from anti-regime… [+3912 chars]",fox-news,Fox News
,Lindsey Vonn reveals she had third surgery on broken leg,Olympic skiing star Lindsey Vonn revealed on Wednesday she underwent a third surgery on the broken leg she suffered during an event over the weekend.,https://www.foxnews.com/sports/lindsey-vonn-reveals-she-had-third-surgery-broken-leg,https://static.foxnews.com/foxnews.com/content/uploads/2026/02/olympics-lindsey-vonn-021126-1.jpg,2026-02-11T19:08:35Z,"Olympic legend Lindsey Vonn revealed on Wednesday she underwent a third surgery on her broken leg following a crash at the 2026 Milan Cortina Games.
Vonn called the operation ""successful"" in a post … [+2732 chars]",fox-news,Fox News
,"American Olympian Jordan Stolz sets Olympic record, captures gold in 1,000-meter race","American speedskater Jordan Stolz set an Olympic record on his way to a gold medal win in the 1,000 meters at the 2026 Milan Cortina Games.",https://www.foxnews.com/sports/american-olympian-jordan-stolz-sets-olympic-record-captures-gold-1000-meter-race,https://static.foxnews.com/foxnews.com/content/uploads/2026/02/olympics-jordan-stolz-021126-1.jpg,2026-02-11T19:07:45Z,"American speedskater Jordan Stolz set an Olympic record on his way to a gold medal in the mens 1,000-meter race on Wednesday at the 2026 Winter Games.
Stolz went head-to-head with Dutch star Jenning… [+1421 chars]",fox-news,Fox News
,Texas border officers arrest 3 fugitives wanted for child sex crimes,"Three Americans accused of child sex crimes were arrested at Texas border crossings during Super Bowl weekend, highlighting CBP's protective role.",https://www.foxnews.com/us/texas-border-officers-arrest-3-fugitives-wanted-child-sex-crimes,https://static.foxnews.com/foxnews.com/content/uploads/2026/02/jose-magana-texas-bridge.jpg,2026-02-11T18:58:11Z,"Border authorities in Texas arrested three American citizens over the weekend at three separate border crossings for child sex crimes, authorities said. 
The arrests happened at ports of entry in La… [+1672 chars]",fox-news,Fox News
,Western Hemisphere defense chiefs convene after border drone scare prompts airspace closure,Top U.S. military leaders host over 30 nations in Washington to strengthen Western Hemisphere security cooperation and address growing regional threats.,https://www.foxnews.com/politics/western-hemisphere-defense-chiefs-convene-after-border-drone-scare-prompts-airspace-closure,https://static.foxnews.com/foxnews.com/content/uploads/2026/02/dan-caine-meeting.jpg,2026-02-11T18:49:08Z,"Top U.S. military leaders are hosting more than 30 nations in Washington as the Trump administration moves to deepen security cooperation across the Western Hemisphere, prioritizing border control
,… [+3642 chars]",fox-news,Fox News
,Alex Murdaugh attorney argues state Supreme Court should overturn guilty verdict,Alex Murdaugh's defense team argues alleged jury tampering by court clerk Rebecca Hill should overturn his murder conviction at state Supreme Court hearing.,https://www.foxnews.com/us/alex-murdaugh-attorney-argues-state-supreme-court-should-overturn-guilty-verdict,https://static.foxnews.com/foxnews.com/content/uploads/2026/02/alex-murdaugh-dick-harpootlian-2023.jpg,2026-02-11T18:46:36Z,"Alex Murdaughs defense attorney argued on Wednesday that the South Carolina Supreme Court should overturn his guilty verdict in the June 2021 murders of his wife, Maggie, and youngest son, Paul.
Dic… [+4922 chars]",fox-news,Fox News
,"DAVID MARCUS: Yes, even White, Irish illegal immigrants must be deported",Trump administration's ICE deportation policies face scrutiny as Irish immigrant case challenges claims of racial bias in immigration enforcement efforts.,https://www.foxnews.com/opinion/david-marcus-yes-even-white-irish-illegal-immigrants-must-deported,https://static.foxnews.com/foxnews.com/content/uploads/2026/02/ice-protesters.jpg,2026-02-11T18:43:35Z,"Seamus Culleton, an illegal immigrant from Ireland was arrested last September by ICE, pursuant to a deportation order after he overstayed his 90-day visa by nearly two decades. Now, for the most cyn… [+5119 chars]",fox-news,Fox News
,Kelsea Ballerini fuels cheating rumors with cryptic Instagram comment after Chase Stokes breakup,"Kelsea Ballerini sparks cheating rumors with cryptic Instagram comment on Ashley Cooke's song about ""wandering eyes"" after her breakup with Chase Stokes.",https://www.foxnews.com/entertainment/kelsea-ballerini-fuels-cheating-rumors-cryptic-instagram-comment-after-chase-stokes-breakup,https://static.foxnews.com/foxnews.com/content/uploads/2026/02/kelsea-ballerini-chase-stokes.jpg,2026-02-11T18:41:57Z,"Kelsea Ballerini fueled cheating rumors swirling around the news of her recent breakup with Chase Stokes with a simple Instagram comment.
Fans found Ballerini in the comments of fellow country singe… [+2456 chars]",fox-news,Fox News
,CDC issues urgent travel alert as virus outbreak hits exclusive sunny islands destination,CDC issues urgent travel alert for Seychelles islands due to Chikungunya virus outbreak. Travelers advised to get vaccinated and prevent mosquito bites.,https://www.foxnews.com/travel/cdc-issues-urgent-travel-alert-virus-outbreak-hits-exclusive-sunny-islands-destination,https://static.foxnews.com/foxnews.com/content/uploads/2026/02/virus-outbreak-travel-warning-cdc-fox-news.jpg,2026-02-11T18:37:26Z,"A group of exclusive sunny islands are on alert as the U.S. Centers for Disease Control and Prevention (CDC) has issued an urgent warning of a virus outbreak.
The Seychelles, a group of islands in t… [+1739 chars]",fox-news,Fox News
,Pennsylvania Sen McCormick 'not satisfied' with answers on Trump assassination attempt,"Sen. David McCormick appeared on ""Pod Force One"" on Wednesday, where he said he's ""not satisfied"" with the answers given about President Donald Trump's Butler assassination attempt.",https://www.foxnews.com/media/pennsylvania-sen-mccormick-not-satisfied-answers-trump-assassination-attempt,https://static.foxnews.com/foxnews.com/content/uploads/2025/07/trump-butler.jpg,2026-02-11T18:30:47Z,"Sen. David McCormick, R-Pa., says he's ""not satisfied"" with the answers that have been provided regarding the 2024 assassination attempt against President Donald Trump at a campaign rally in Butler, … [+2875 chars]",fox-news,Fox News
,Russia agrees to abide by expired New START nuclear arms limits — as long as the US does the same,"Russia has agreed to abide by the expired New START Treaty, which puts limits on Moscow and Washington's nuclear arms, as long as the U.S. does the same.",https://www.foxnews.com/world/russia-agrees-abide-new-start-nuclear-arms-limits-long-us-does-same,https://static.foxnews.com/foxnews.com/content/uploads/2026/02/putin-trump-shake-hands-1.jpg,2026-02-11T18:29:45Z,"Russia has reportedly agreed to abide by the limits of a nuclear arms pact it reached with the U.S. years ago after the agreement expired last week as long as Washington does the same.
The New START… [+3089 chars]",fox-news,Fox News
,Nancy Guthrie case: All of the properties searched by authorities since disappearance,"Investigation into missing Nancy Guthrie intensifies with searches of Rio Rico home, family properties. FBI releases video of masked individual at scene.",https://www.foxnews.com/us/nancy-guthrie-case-all-properties-searched-authorities-since-disappearance,https://static.foxnews.com/foxnews.com/content/uploads/2026/02/police-tape-nancy-guthrie-home-arizona-002.jpg,2026-02-11T18:27:59Z,"TUCSON, Ariz. Friday night's dramatic search of a home in Rio Rico, Arizona, just north of the border with Mexico, marked the first in the investigation for the missing Nancy Guthrie outside a proper… [+2432 chars]",fox-news,Fox News
,Nancy Guthrie case: All of the known properties searched by authorities since disappearance,"Investigation into missing Nancy Guthrie intensifies with searches of Rio Rico home, family properties. FBI releases video of masked individual at scene.",https://www.foxnews.com/us/nancy-guthrie-case-all-of-the-known-properties-searched-by-authorities-since-disappearance,https://static.foxnews.com/foxnews.com/content/uploads/2026/02/police-tape-nancy-guthrie-home-arizona-002.jpg,2026-02-11T18:27:59Z,"TUCSON, Ariz. Friday night's dramatic search of a home in Rio Rico, Arizona, just north of the border with Mexico, marked the first in the investigation for the missing Nancy Guthrie outside a proper… [+2431 chars]",fox-news,Fox News
,Former lingerie mogul faces lawmaker questioning after FBI internal memo calls him Epstein co-conspirator,Bipartisan lawmakers will question Les Wexner next Wednesday over Jeffrey Epstein connections after DOJ files allegedly revealed authorities considered him an accessory to his crimes.,https://www.foxnews.com/politics/former-lingerie-mogul-faces-lawmaker-questioning-after-fbi-internal-memo-calls-him-epstein-co-conspirator,https://static.foxnews.com/foxnews.com/content/uploads/2026/02/victorias-secret-models-and-jeffrey-espetin.jpg,2026-02-11T18:27:56Z,"Lawmakers on the House Oversight Committee will question billionaire businessman Les Wexner Feb. 18 at 10 a.m. over his connections to Jeffrey Epstein, a source familiar with the committees work conf… [+2862 chars]",fox-news,Fox News
,Israel joins Board of Peace ahead of Netanyahu-Trump meeting,Israeli Prime Minister Benjamin Netanyahu signed on to join the Board of Peace before meeting with President Donald Trump at the White House.,https://www.foxnews.com/politics/israel-joins-board-peace-ahead-netanyahu-trump-meeting,https://static.foxnews.com/foxnews.com/content/uploads/2026/02/netanyahu-board-of-peace-trump.jpg,2026-02-11T18:22:45Z,"Israel formally joined the Board of Peace on Wednesday ahead of Prime Minister Benjamin Netanyahus meeting with President Donald Trump at the White House.
Netanyahu signed the document in the presen… [+2087 chars]",fox-news,Fox News
,"American-owned brands on sale for Presidents' Day: L.L.Bean, Lodge, Craftsman and more","American-owned brands like Craftsman, HexClad, Lodge and Red Wing are on sale in time for Presidents’ Day.",https://www.foxnews.com/deals/american-owned-brands-presidents-day-sales,https://static.foxnews.com/foxnews.com/content/uploads/2026/02/picture2-1.jpg,2026-02-11T18:16:49Z,"With Presidents Day almost here, weve highlighted American-owned brands running sales on cookware, clothing, grills and more. Save up to 20% on a new Weber grill and womens L.L.Bean boots, score 33% … [+7376 chars]",fox-news,Fox News
,Bondi confirms DOJ has received criminal referral alleging Brennan perjury over Steele dossier,Former CIA Director John Brennan faces DOJ investigation after Attorney General Pam Bondi confirms criminal referral over alleged false testimony about Russia interference assessment.,https://www.foxnews.com/politics/bondi-confirms-doj-has-received-criminal-referral-alleging-brennan-perjury-over-steele-dossier,https://static.foxnews.com/foxnews.com/content/uploads/2025/07/former-cia-director-john-brennan.jpg,2026-02-11T18:11:02Z,"Attorney General Pam Bondi said she received a criminal referral from the House Judiciary Committee alleging former CIA Director John Brennan lied to Congress, confirming the receipt during a hearing… [+2517 chars]",fox-news,Fox News
,"San Francisco teachers union strike leaves 50,000 children out of school","San Francisco teachers strike leaves 50,000 students out of class as educators demand better wages and health benefits amid the city's high living costs.",https://www.foxnews.com/us/san-francisco-teachers-union-strike-leaves-50000-children-out-school,https://static.foxnews.com/foxnews.com/content/uploads/2026/02/san-franscisco-educators-strike-february-2026-1.jpg,2026-02-11T18:06:47Z,"Teachers in San Francisco are striking for health benefits and better wages, leaving nearly 50,000 students out of the classroom.
The San Francisco Unified School Districts 120 schools were set to r… [+4041 chars]",fox-news,Fox News
,Mamdani takes heat over skipping decades-long tradition of attending Catholic archbishop installation ceremony,"New York City Mayor Zohran Mamdani faced criticism for skipping Catholic Archbishop Ronald Hicks' installation ceremony on Friday, the first mayor in nearly 100 years to miss the event.",https://www.foxnews.com/media/mamdani-takes-heat-over-skipping-decades-long-tradition-attending-catholic-archbishop-installation-ceremony,https://static.foxnews.com/foxnews.com/content/uploads/2026/02/mamdani-hicks.jpg,2026-02-11T18:02:40Z,"New York City Mayor Zohran Mamdani is facing backlash after he decided to skip Friday's investiture of the new Catholic archbishop of the city, Ronald Hicks, at St. Patrick's Cathedral.
In a Friday … [+4479 chars]",fox-news,Fox News
,Bondi hearing devolves into chaos of shouts as AG accuses top Democrats of 'theatrics',Attorney General Pam Bondi's confirmation hearing erupted as Democrats made demands and engaged in shouting matches over the Epstein files.,https://www.foxnews.com/politics/bondi-hearing-devolves-chaos-shouts-ag-accuses-top-democrats-theatrics,https://static.foxnews.com/foxnews.com/content/uploads/2026/02/bondi-nadler-jayapal.jpg,2026-02-11T18:00:49Z,"Attorney General Pam Bondi's hearing before the House Judiciary Committee Wednesday devolved into a chaos of shouts and interruptions as she clashed with several Democratic committee members.
Severa… [+3744 chars]",fox-news,Fox News
