author,title,description,url,urlToImage,publishedAt,content,source.id,source.name
Peter Aitken,"Two American travelers to Canada fined $25,000 each for fake vaccination documents","Canadian officials have charged two American travelers and fined them 20,000 Canadian dollars each - around $25,000 USD - for providing fake COVID-19 vaccination documents.",https://www.foxnews.com/world/american-travelers-canada-fined-fake-documents,https://static.foxnews.com/foxnews.com/content/uploads/2019/05/iStock-1080971410.jpg,2021-07-31T11:58:16Z,"Canadian officials have charged two American travelers and fined them 20,000 Canadian dollars each - around $25,000 USD - for providing fake COVID-19vaccination documents. 
The unnamed travelers arr… [+1711 chars]",fox-news,Fox News
Emma Colton,Houston cops ID suspect in teenaged Astros fan's road-rage death,Houston police identified the suspect in a road rage shooting incident that left a teenager dead more than three weeks ago after a Houston Astros game.,https://www.foxnews.com/us/houston-police-suspect-astros-shooting-teenager-death,https://static.foxnews.com/foxnews.com/content/uploads/2021/07/Houston-Police--e1627729180246.jpg,2021-07-31T11:35:00Z,"Houston police
 identified the suspect in a road rage shooting incident that left a teenager dead more than three weeks ago after a Houston
 Astros game. 
""Thats the face of the man who right now … [+1997 chars]",fox-news,Fox News
Nate Day,Dusty Hill: A look back at the ZZ Top bassist's life,"ZZ Top bassist Joseph Michael ""Dusty"" Hill left a lasting impression on rock and roll not just because of his long, iconic beard, but also because of his musical talent.",https://www.foxnews.com/entertainment/dusty-hill-look-back-zz-top-bassist-life,https://static.foxnews.com/foxnews.com/content/uploads/2021/07/Dusty_Hill_ZZ_Top_Getty_Images.jpg,2021-07-31T11:30:09Z,"Joseph Michael ""Dusty"" Hill left a lasting impression on rock and roll not just because of his long, iconic beard, but also because of his musical talent.
The ZZ Top bassist died recently at the age… [+2995 chars]",fox-news,Fox News
Julius Young,"'Duck Dynasty' star Willie Robertson gives update on 'household' after dog bite scare, new addition to family","On Thursday, Willie Robertson provided an update to Fox News on his mom Kay's health after she was bitten by the family dog, and his daughter Sadie, who gave birth to her first child in May.",https://www.foxnews.com/entertainment/duck-dynasty-willie-robertson-miss-kay-sadie-robertson-dog-bite-pregnancy,https://static.foxnews.com/foxnews.com/content/uploads/2021/04/Willie-Robertson-.jpg,2021-07-31T11:23:45Z,"EXCLUSIVE: Last month, ""Duck Dynasty"" star Kay Robertson was bitten by the family's dog, Bobo, in an attack that left a piece of her lip missing and forced her into the hospital.
The 73-year-old mat… [+3071 chars]",fox-news,Fox News
Tyler Olson,Family farm banned from city farmers market over refusal to host gay weddings awaits ruling in legal battle,Following a bench trial this week a federal court in Michigan is set to rule in the case of a farm that was banned from a city-run market in East Lansing over its owners' refusal to allow same-sex couples to hold weddings on their property.,https://www.foxnews.com/politics/michigan-farm-east-lansing-trial-religious-objection-gay-marraige,https://static.foxnews.com/foxnews.com/content/uploads/2021/07/CountryMillFarmsFamily.png,2021-07-31T11:11:21Z,Following a bench trial this week a federal court in Michigan is set to rule in the case of a farm that was banned from a city-run market in East Lansing over its owners' refusal to allow same-sex co… [+6372 chars],fox-news,Fox News
Paulina Dedaj,Caeleb Dressel wins gold for Team USA with new world record; Katie Ledecky earns three-peat in 800M freestyle,Team USA has topped the leaderboards in swimming events at Tokyo this year after Americans Caeleb Dressel and Katie Ledecky took home two more gold medals on Day 8 of the Olympics.,https://www.foxnews.com/sports/caeleb-dressel-gold-world-record-katie-ledecky-three-peat-800m-freestyle,https://static.foxnews.com/foxnews.com/content/uploads/2021/07/AP21212149989720.jpg,2021-07-31T11:09:56Z,"Team USA has topped the leaderboards in swimming events at Tokyo this year after Americans Caeleb Dressel and Katie Ledecky took home two more gold medals on Day 8 of the Olympics
. 
Ledecky, 24, l… [+1560 chars]",fox-news,Fox News
"Conrad Black, William Bennett, Victor Davis Hanson","Black, Bennett, Hanson: Biden, China and Taiwan – how will president respond if ally is attacked?","As China steadily raises the pressure on Taiwan, curiosity intensifies about the likely U.S. reaction in the event of an outright military invasion of Taiwan by the People's Republic.",https://www.foxnews.com/opinion/biden-china-taiwan-defend-ally-conrad-black-william-bennett-victor-davis-hanson,https://cf-images.us-east-1.prod.boltdns.net/v1/static/694940094001/37630348-4422-412a-96e9-d44f64d91ed7/a255e4c0-8fa8-4897-8f03-4662931f86b5/1280x720/match/image.jpg,2021-07-31T11:00:24Z,"As China steadily raises the pressure on Taiwan, curiosity intensifies throughout the world about the likely U.S. reaction in the event of an outright military invasion of Taiwan by the People's Repu… [+5898 chars]",fox-news,Fox News
Lindsay Kornick,Cheney and Kinzinger: The latest turncoat Republicans the media suddenly loves,The press find a new found respect for formerly despised Republicans like Liz Cheney and Adam Kinzinger who defy party lines.,https://www.foxnews.com/media/media-finds-sudden-respect-for-turncoat-republicans,https://static.foxnews.com/foxnews.com/content/uploads/2021/07/Liz-Cheney-Adam-Kinzinger-1.jpg,2021-07-31T11:00:00Z,"Republicans have long faced uphill battles against mainstream media pundits, especially since many are so sympathetic to Democrats.
""The media are enforcers for the Democrats. If Democrats step out … [+7867 chars]",fox-news,Fox News
Brie Stimson,"Boston trains collide, leaving at least 25 hurt, authorities say","A collision between two Boston passenger trains Friday evening left at least 25 people with non-life-threatening injuries, authorities said.",https://www.foxnews.com/us/boston-trains-collide-passengers-hurt-authorities-say,https://static.foxnews.com/foxnews.com/content/uploads/2021/07/boston-collision.jpg,2021-07-31T10:21:53Z,"A collision between two Boston passenger trains Friday evening left at least 25 people with non-life-threatening injuries, authorities said. 
The Green Line trains crashed near Babcock Street around… [+2200 chars]",fox-news,Fox News
"Ryan Gaydos, Paulina Dedaj",Tokyo Olympics 2020: Americans who have won gold medals at the Games,The United States has racked up a bunch of gold medals through the first week of the 2020 Tokyo Olympics.,https://www.foxnews.com/sports/tokyo-olympics-2020-americans-gold-medals,https://static.foxnews.com/foxnews.com/content/uploads/2021/07/AP21207136494044.jpg,2021-07-31T10:12:03Z,"The United States has racked up a bunch of gold medals through the first week of the 2020 Tokyo Olympics.
There have been some triumphs, some upsets and some shocks in Tokyo as the Olympics march on… [+5860 chars]",fox-news,Fox News
Ronna McDaniel,RNC Chairwoman McDaniel: COVID and Biden – latest mask move undermines vital vaccine message,,https://www.foxnews.com/opinion/covid-biden-mask-vaccine-message-rnc-chairwoman-mcdaniel,https://cf-images.us-east-1.prod.boltdns.net/v1/static/694940094001/3223a9fa-ff10-4a18-8abd-06a4226c87a6/9fae27df-7da9-4816-82c2-ecf5aefd911e/1280x720/match/image.jpg,2021-07-31T10:00:27Z,"This week, the Biden administration yet again reversed its previous guidance on wearing masks. Democrats are predictably applauding. The Biden administration is now mandating that vaccinated American… [+4366 chars]",fox-news,Fox News
The Kim Komando Show,TV picture quality: 6 quick steps for better images no matter the price of your TV,Your settings might be all wrong.,https://www.foxnews.com/tech/tv-picture-quality-6-quick-steps-for-better-images-no-matter-the-price-of-your-tv,https://static.foxnews.com/foxnews.com/content/uploads/2021/07/iStock-1209272433.jpg,2021-07-31T13:34:45Z,"How much time have you spent over the years customizing your gadgets to work just how you want them? From icons to background images to ringtones, you can endlessly fiddle.
Before the iPhones iOS 14… [+7364 chars]",fox-news,Fox News
The Kim Komando Show,5 buried Google settings other than privacy to save time now,Here's a handful of hidden settings every Google user should know.,https://www.foxnews.com/tech/google-settings-other-than-privacy-save-time-now,https://static.foxnews.com/foxnews.com/content/uploads/2020/11/google.jpg,2021-07-31T13:32:58Z,"Back in the day, autocorrect created more issues in our texts and emails than it fixed.
Today, you can open up an email draft, and Gmail will finish your sentences and even suggest a subject line al… [+6593 chars]",fox-news,Fox News
Ann Schmidt,7-year-old girl helps raise money for homeless veterans: ‘Help home first’,"Jade Britt, 7, from Marietta, Georgia, raised $700 to make care packages for veterans who are homeless in her community.",https://www.foxnews.com/lifestyle/jade-britt-helps-homeless-veterans-georgia,https://static.foxnews.com/foxnews.com/content/uploads/2021/07/Jade-Britt-FOX5.jpg,2021-07-31T13:30:38Z,"This 7-year-old girl is helping veterans in her community. 
Jade Britt, 7, from Marietta, Georgia, has raised $700 to help homeless veterans in her area, according to FOX 5 Atlanta. 
The station re… [+931 chars]",fox-news,Fox News
Peter Aitken,"Unemployed Tennessee residents sue state, governor to reinstate unemployment benefits",Seven Tennessee residents have filed a lawsuit against Gov. Bill Lee for stopping federal unemployment benefits earlier this year.,https://www.foxnews.com/us/unemployed-tennessee-residents-sue-state-governor-benefits,https://static.foxnews.com/foxnews.com/content/uploads/2020/12/AP20355053082027-1.jpg,2021-07-31T13:26:33Z,"Seven Tennessee residents have filed a lawsuit against Gov. Bill Lee for stopping federal unemployment benefits earlier this year. 
Lee pulled out of the benefits program at the start of July more t… [+2956 chars]",fox-news,Fox News
"Priya Mammen, J. Corey Feist","Dr. Mammen, Feist: Simone Biles' courageous actions will have lasting effect on medical profession, more",Simone Biles’ courageous decision this week to withdraw from the Tokyo Olympics has brought the mental health of athletes to the world’s center stage.,https://www.foxnews.com/opinion/simone-biles-actions-medical-profession-mammen-feist,https://cf-images.us-east-1.prod.boltdns.net/v1/static/694940094001/f707228d-891f-4344-9b33-955b40d5434d/5d7c189d-c048-47a8-aa13-4b1d7861393c/1280x720/match/image.jpg,2021-07-31T13:00:00Z,It sometimes takes a professional athlete to bring attention to a lesser-known cause and make it relevant to the nation. Simone Biles courageous decision this week to withdraw from the Tokyo Olympics… [+7030 chars],fox-news,Fox News
Paulina Dedaj,Novak Djokovic leaves Olympics empty-handed after bronze medal match meltdown,"Novak Djokovic came to Tokyo in pursuit of a Golden Slam but after Saturday’s bronze medal match against Spain’s Pablo Carreño Busta, he’ll be leaving empty-handed.",https://www.foxnews.com/sports/novak-djokovic-olympics-bronze-medal-meltdown,https://static.foxnews.com/foxnews.com/content/uploads/2021/07/AP21212310605288.jpg,2021-07-31T12:40:49Z,"Novak Djokovic came to Tokyo
 in pursuit of a Golden Slam but after Saturdays bronze medal match against Spains Pablo Carreño Busta, hell be leaving empty-handed. 
Djokovics frustrations boiled ove… [+2020 chars]",fox-news,Fox News
Ann Schmidt,'Hawaiian BBQ Quesadillas with Pineapple-Mango Guacamole' perfectly combines sweet and spicy: Try the recipe,"It’s National Avocado Day and if you want to make a home-cooked meal to celebrate, the “Hawaiian BBQ Quesadillas with Pineapple-Mango Guacamole” recipe from Half-Baked Harvest is the perfect dish to try.",https://www.foxnews.com/food-drink/hawaiian-bbq-quesadillas-pineapple-mango-guac,https://static.foxnews.com/foxnews.com/content/uploads/2021/07/Crop-2-Hawaiian-BBQ-Quesadillas-with-Pineapple-Mango-Guacamole-11-Courtesy-of-Half-Baked-Harvest.jpg,2021-07-31T12:33:23Z,"Saturday is National Avocado Day, and though there are plenty of deals on offer, you might want to celebrate the food holiday with a home-cooked dish. 
""Hawaiian BBQ Quesadillas with Pineapple-Mango… [+4163 chars]",fox-news,Fox News
Emma Colton,NYC mayoral candidate Eric Adams says America is not a 'socialist' country: 'let's be clear on that',"New York City mayoral candidate Eric Adams criticized the far-left during an appearance on Bill Maher’s HBO show, saying America “is not a socialist country.”",https://www.foxnews.com/politics/nyc-mayoral-candidate-eric-adams-socialism,https://static.foxnews.com/foxnews.com/content/uploads/2021/07/AP21188540342910.jpg,2021-07-31T12:17:18Z,"New York City
 mayoral candidate Eric Adams criticized the far-left during an appearance on Bill Mahers HBO show, saying America ""is not a socialist country.""
""This is not a socialist country, lets… [+1841 chars]",fox-news,Fox News
Audrey Conklin,Florida Gov. DeSantis signs executive order making masks optional in schools,Florida Gov. Ron DeSantis on Friday signed an executive order making mask-wearing optional in the state's public schools.,https://www.foxnews.com/us/desantis-executive-masks-optional-schools,https://static.foxnews.com/foxnews.com/content/uploads/2020/05/Ron-Desantis-AP.jpg,2021-07-31T12:03:09Z,"Florida
 Gov. Ron DeSantis on Friday signed an executive order making mask-wearing optional in the state's public schools.
The announcement came after the Centers for Disease Control and Prevention… [+3160 chars]",fox-news,Fox News
Melissa Roberto,All of the things Meghan Markle's relatives have said since her and Prince Harry's Oprah Winfrey interview,Meghan Markle's estranged family members have had a lot to say about her actions since her and Prince Harry's sit-down with Oprah Winfrey in March.,https://www.foxnews.com/entertainment/all-things-meghan-markle-relatives-said-prince-harry-oprah-winfrey-interview,https://static.foxnews.com/foxnews.com/content/uploads/2021/03/markle3.jpg,2021-07-31T12:02:20Z,"Meghan Markle
 and Prince Harry
's openness about their personal and professional lives has dominated headlines in recent months, and their words have been met with an immense amount of pushback fr… [+7699 chars]",fox-news,Fox News
Andrea Laurent-Simpson,Andrea Laurent-Simpson: 'Dog Mom' and more – we're living in multispecies families now. Here's what it means,The evidence of new families – multispecies families – blended with people and pets arrived long before we considered what to call them.,https://www.foxnews.com/opinion/dog-mom-multispecies-families-andrea-laurent-simpson,https://static.foxnews.com/foxnews.com/content/uploads/2021/07/thumbnail_ALShillsman.jpg,2021-07-31T12:00:43Z,"The evidence of new families blended with people and pets arrived long before we considered what to call them.  
""Multispecies families"" captures the scientific essence, but the lifestyle and charac… [+6206 chars]",fox-news,Fox News
Associated Press,Schauffele clings to lead as 3 medals up for grabs in golf,"Just over three weeks ago, Hideki Matsuyama was in isolation for COVID-19 and desperate to record a negative test to have any chance of competing in his home Olympics.",https://www.foxnews.com/sports/schauffele-clings-to-lead-as-3-medals-up-for-grabs-in-golf,https://static.foxnews.com/foxnews.com/content/uploads/2021/07/AP21212148979050.jpg,2021-07-31T15:57:44Z,"Just over three weeks ago, Hideki Matsuyama was in isolation for COVID-19 and desperate to record a negative test to have any chance of competing in his home Olympics.
Even when he cleared that hurd… [+4661 chars]",fox-news,Fox News
Associated Press,Australia beats Germany 89-76 to sweep basketball pool,The wait needs to end now. Australia views this as its time to finally be standing on the medal podium when the Olympics are over.,https://www.foxnews.com/sports/australia-beats-germany-89-76-to-sweep-basketball-pool,https://static.foxnews.com/foxnews.com/content/uploads/2021/07/AP21212337939146.jpg,2021-07-31T15:49:49Z,"The wait needs to end now. Australia views this as its time to finally be standing on the medal podium when the Olympics are over.
""The whole country right now knows the desperation of this team, kn… [+2670 chars]",fox-news,Fox News
Associated Press,New Zealand beats France to clinch gold in women's rugby 7s,"After five long years, Portia Woodman has finally been able to shake the mental image of herself in tears, standing under the goalposts.",https://www.foxnews.com/sports/new-zealand-beats-france-to-clinch-gold-in-womens-rugby-7s,https://static.foxnews.com/foxnews.com/content/uploads/2021/07/AP21212336188672.jpg,2021-07-31T15:43:15Z,"After five long years, Portia Woodman has finally been able to shake the mental image of herself in tears, standing under the goalposts.
It was like grief for something lost, but it's been supplante… [+3980 chars]",fox-news,Fox News
Associated Press,"To the quarters: USA routs Czech Republic, 119-84 in Tokyo","The U.S. lost its first two exhibition games of the summer in Las Vegas, dropped its opening game at these Olympics and had a difficult time shaking free of the Czech Republic in their group-play finale.",https://www.foxnews.com/sports/to-the-quarters-usa-routs-czech-republic-119-84-in-tokyo,https://static.foxnews.com/foxnews.com/content/uploads/2021/07/AP21212505365322.jpg,2021-07-31T15:33:09Z,"The U.S. lost its first two exhibition games of the summer in Las Vegas, dropped its opening game at these Olympics and had a difficult time shaking free of the Czech Republic in their group-play fin… [+4872 chars]",fox-news,Fox News
Associated Press,"At home in Japan, Nick Martínez pitches US over South Korea","Nick Martínez stepped onto the mound, and it felt like an old familiar place.",https://www.foxnews.com/sports/at-home-in-japan-nick-martinez-pitches-us-over-south-korea,https://static.foxnews.com/foxnews.com/content/uploads/2021/07/AP21212384971270.jpg,2021-07-31T15:25:17Z,"Nick Martínez stepped onto the mound, and it felt like an old familiar place.
Because it was.
CLICK HERE FOR MORE SPORTS COVERAGE ON FOXNEWS.COM
""Felt comfortable the whole game,"" he said after st… [+5319 chars]",fox-news,Fox News
Julia Musto,Apollo 15’s 50th anniversary: Moon landing seen in stunning detail,New images released to Fox News depict the Apollo 15 moon landing in remarkable detail 50 years later.,https://www.foxnews.com/science/apollo-15s-50th-anniversary-moon-landing-stunning-detail,https://static.foxnews.com/foxnews.com/content/uploads/2021/07/Remastered-Apollo-8.jpg,2021-07-31T15:23:16Z,"New images released to Fox News depict the Apollo 15 moon landing in remarkable detail 50 years later.
The pictures, remastered by ""Apollo Remastered"" author Andy Saunders, show the Lunar Roving Veh… [+3318 chars]",fox-news,Fox News
Paulina Dedaj,"Olympic gold medalist Connor Fields suffered brain hemorrhage in BMX crash, USA Cycling says","Olympic gold medalist Connor Fields suffered a brain hemorrhage among other serious injuries following a horrific crash during the first heat of the BMX men’s racing semifinals on Friday, USA cycling said.",https://www.foxnews.com/sports/olympic-gold-connor-fields-brain-hemorrhage-bmx-crash-usa,https://static.foxnews.com/foxnews.com/content/uploads/2021/07/AP21211240294262.jpg,2021-07-31T15:21:54Z,"Olympic
 gold medalist Connor Fields suffered a brain hemorrhage among other serious injuries following a horrific crash during the first heat of the BMX mens racing semifinals on Friday, USA cyclin… [+1573 chars]",fox-news,Fox News
Emma Colton,Dad restrained as he confronts suspect in fatal shooting daughter in movie theater: 'Look at me!',The father of an 18-year-old woman who was killed in a movie theater shooting in California confronted the accused shooter during a court appearance.,https://www.foxnews.com/us/dad-confronts-suspect-fatal-movie-theater-shooting-daughter,https://static.foxnews.com/foxnews.com/content/uploads/2021/07/defendant-.jpg,2021-07-31T15:15:04Z,"The father of an 18-year-old woman who was killed in a movie theater shooting in California confronted the accused shooter during a court appearance. 
""Look at me. Look at me!"" yelled Dave Goodrich … [+1450 chars]",fox-news,Fox News
Emma Colton,Photos appear to show DC mayor celebrating birthday maskless hours before mandate went into effect,"Photos on social media appear to show Washington, D.C., Mayor Muriel Bowser celebrating her upcoming birthday and posing for photos maskless with comedian Dave Chappelle hours before the city’s mask mandate was put into effect.",https://www.foxnews.com/politics/mayor-muriel-bowser-party-mask-mandate,https://static.foxnews.com/foxnews.com/content/uploads/2021/03/BOWSER.jpg,2021-07-31T15:13:15Z,"Photos on social media appear to show Washington, D.C., Mayor Muriel Bowser celebrating her upcoming birthday and posing for photos maskless with comedian Dave Chappelle hours before the citys mask m… [+1732 chars]",fox-news,Fox News
Peter Aitken,"Chicago shooting leaves 4 injured, weekend total already at 16","Chicago suffered a violent start to another weekend with sixteen people shot by Saturday morning, with at least four people in serious or critical condition.",https://www.foxnews.com/us/chicago-shooting-4-injured-weekend-total-15,https://static.foxnews.com/foxnews.com/content/uploads/2021/06/Chicago-police.jpg,2021-07-31T15:03:35Z,"Chicago suffered a violent start to another weekend with sixteen people shot by Saturday morning, with at least four people in serious or critical condition. 
The latest shooting occurred in Jackson… [+1995 chars]",fox-news,Fox News
Adam Shaw,Biden administration resumes fast-track deportation flights for migrants denied asylum,The Biden administration has started fast-track deportation flights to Central America for migrants who have been denied asylum in the U.S. after arriving at the southern border.,https://www.foxnews.com/politics/biden-administration-fast-track-deportation-flights-migrants-asylum,https://static.foxnews.com/foxnews.com/content/uploads/2020/10/ICE-Agent-ICE.jpg,2021-07-31T14:43:49Z,"The Biden administration has started fast-track deportation flights to Central America for migrants who have been denied asylum in the U.S. after arriving at the southern border.
The Department of H… [+3970 chars]",fox-news,Fox News
Emma Colton,Iowa Republican governor rejects Biden's $100 vaccine incentives,Republican Iowa Gov. Kim Reynolds rejected President Biden’s request that state and local governments use federal funds to encourage people to get the coronavirus vaccine.,https://www.foxnews.com/politics/iowa-governor-kim-reynolds-biden-vaccine-incentive,https://static.foxnews.com/foxnews.com/content/uploads/2021/05/Kim-Reynolds-Signs-Bill-REUTERS.jpg,2021-07-31T14:22:44Z,"Republican Iowa
 Gov. Kim Reynolds rejected President Biden
s request that state and local governments use federal funds to encourage people to get the coronavirus vaccine. 
Reynolds spokesman Pat… [+2254 chars]",fox-news,Fox News
Kelly Laco,Police association slams stalled reform negotiations: 'Quit playing politics with people’s lives',"The National Fraternal Order of Police (FOP), the world's largest police organization, slammed stalled criminal justice reform negotiations in Congress, telling one powerful House Democrat to ""quit playing politics with people’s lives.""",https://www.foxnews.com/politics/police-association-slams-stalled-reform-negotiations-quit-playing-politics,https://static.foxnews.com/foxnews.com/content/uploads/2021/07/Tim-Scott-Police-Reform-Violent-Crime.jpg,2021-07-31T14:15:32Z,"The National Fraternal Order of Police (FOP), the world's largest police organization, slammed stalled criminal justice reform negotiations in Congress, telling one powerful House Democrat to ""quit p… [+3026 chars]",fox-news,Fox News
Julia Musto,How to reduce the risk of a shark attack,All it took for American theater audiences to be terrified of shark attacks was a score of two ominous notes.,https://www.foxnews.com/us/how-to-reduce-the-risk-of-a-shark-attack,https://static.foxnews.com/foxnews.com/content/uploads/2021/05/iStock-1222310545.jpg,2021-07-31T17:55:53Z,"All it took for American theater audiences to be terrified of shark attacks was a score of two ominous notes. 
And yet, while John Williams' 1975 ""Jaws"" theme marked one for the history books, shark… [+3697 chars]",fox-news,Fox News
Audrey Conklin,California WWII vet receives bronze medal 75 years after it was awarded,"A California World War II Army veteran has finally received the Bronze Star Medal 75 years after earning it, according to the California National Guard.",https://www.foxnews.com/us/california-veteran-bronze-medal-wwii,https://static.foxnews.com/foxnews.com/content/uploads/2021/07/Untitled-19.jpg,2021-07-31T17:51:48Z,"A California World War II Army veteran has finally received the Bronze Star Medal 75 years after earning it, according to the California National Guard.
Ubaldo ""Joseph"" Ciniero, 95, was first statio… [+2019 chars]",fox-news,Fox News
