author,title,description,url,urlToImage,publishedAt,content,source.id,source.name
Lauren Green,Critical race theory debate divides Christians: 'All of us have intrinsic value',"The debate over critical race theory is in schools and government, but now it's starting to infiltrate and divide the Christian church.",https://www.foxnews.com/politics/critical-race-theory-debate-divides-christians,https://static.foxnews.com/foxnews.com/content/uploads/2021/07/iStock-1220682823.jpg,2021-07-31T01:47:13Z,"The debate over critical race theory is in schools and government, but now it's starting to infiltrate and divide the Christian church.
At a heated school board meeting in Ft. Worth, Texas recently,… [+3919 chars]",fox-news,Fox News
Louis Casiano,"Chicago boy, 14, shot twice in the head while sitting in parked car, police say",A 14-year-old boy was shot twice in the head and a man was also wounded Thursday while they were sitting in a parked car in Chicago.,https://www.foxnews.com/us/chicago-boy-shot-head-police,https://static.foxnews.com/foxnews.com/content/uploads/2021/05/2021-04-24T000000Z_932580589_MT1ABCPR000K20Y3A_RTRMADP_3_ABACA-PRESS.jpg,2021-07-31T01:19:01Z,"A 14-year-old boy was shot twice in the head and a man was also wounded Thursday while they were sitting in a parked car in Chicago. 
The shooting happened just after midnight, police said. The boy … [+1167 chars]",fox-news,Fox News
Jen Golotko,Dave Rubin responds to Twitter locking his account over COVID 'misinformation',"Since the start of the COVID-19 pandemic Big Tech companies have taken extra steps to remove what they deem “misinformation” from their platform, and sometimes even outright banned individuals who they claim violated their rules. Author Dave Rubin joined “Fox…",https://www.foxnews.com/media/twitter-claims-dave-rubins-twitter-suspension-was-an-error-following-covid-tweet,https://static.foxnews.com/foxnews.com/content/uploads/2021/07/White-House-using-mainstream-media-for-COVID-fearmongering.jpg,2021-07-31T01:05:17Z,"Author Dave Rubin joined ""Fox News Primetime"" Friday to discuss being locked out of his account right after tweeting a message about the latest COVID-19 rhetoric coming from the Biden administration,… [+1502 chars]",fox-news,Fox News
Paul Best,Illinois woman who ventured too close to grizzly bear at Yellowstone is cited: report,"An Illinois woman who got dangerously close to a grizzly bear and her cubs in Yellowstone National Park earlier this year was charged with two criminal offenses this week after authorities tracked her down, the Billings Gazette reports.",https://www.foxnews.com/us/illinois-woman-too-close-grizzly-bear-yellowstone-cited-report,https://static.foxnews.com/foxnews.com/content/uploads/2021/05/Yellowstone.jpg,2021-07-31T01:03:58Z,"An Illinois woman who got dangerously close to a grizzly bear and her cubs in Yellowstone National Park earlier this year was charged with two offenses this week after authorities tracked her down, t… [+1244 chars]",fox-news,Fox News
Lauryn Overhultz,"Matt Damon reveals the one thing that has been different about Jennifer Lopez, Ben Affleck’s rekindled romance","Matt Damon pointed out that the media attention regarding Ben Affleck and Jennifer Lopez's rekindled relationship has been different than the first time the couple was together. The actor accused the press of previously being ""particularly terrible"" to Lopez …",https://www.foxnews.com/entertainment/matt-damon-ben-affleck-jennifer-lopez-media-attention-press,https://static.foxnews.com/foxnews.com/content/uploads/2021/07/Matt_Damon_Ben_Affleck_JLO_Getty_Images.jpg,2021-07-31T00:58:17Z,"Matt Damon emphasized the media attention regarding Jennifer Lopez and Ben Affleck's rekindled relationship and how different it is from the first time the two were an item.
""I have to say, the pres… [+1701 chars]",fox-news,Fox News
Caitlin McFall,"UN compound in Afghanistan attacked, at least one guard killed",At least one security guard was killed in Afghanistan Friday after the Taliban attacked the central United Nations compound in the western province of Herat.,https://www.foxnews.com/world/un-compound-afghanistan-attacked-by-taliban,https://static.foxnews.com/foxnews.com/content/uploads/2018/09/Afghanistan_Carm-1.jpg,2021-07-31T00:49:04Z,"At least one security guard was killed in Afghanistan Friday after the Taliban attacked the central United Nations compound in the western province of Herat.
U.N. Assistance Mission in Afghanistan (… [+2396 chars]",fox-news,Fox News
Associated Press,Cuba Gooding Jr. could be on the hook for millions of dollars after ignoring rape lawsuit,Cuba Gooding Jr. might have to pay out millions of dollars after a judge issued a default judgment claiming the actor was willfully ignoring a rape lawsuit.,https://www.foxnews.com/entertainment/cuba-gooding-jr-ignoring-rape-lawsuit,https://static.foxnews.com/foxnews.com/content/uploads/2019/10/cuba-gooding-jr-ap.jpg,2021-07-31T00:48:53Z,"Actor Cuba Gooding Jr. could be on the hook for millions of dollars in damages after failing to respond to a lawsuit that accused him of raping a woman in New York City in 2013.
U.S. District Judge … [+2336 chars]",fox-news,Fox News
Joseph Wulfsohn,NYT gives reporter who called Trump supporters 'enemies' a free pass after firing editor for pro-Biden tweet,It appears that The New York Times has shifted its enforcement of the paper's social media guidelines for its employees as the reporter who attacked millions of Trump voters has skated while a freelance editor was fired earlier this year after making a pro-Bi…,https://www.foxnews.com/media/new-york-times-katie-benner-lauren-wolfe,https://static.foxnews.com/foxnews.com/content/uploads/2021/07/Benner-Wolfe-1.jpg,2021-07-31T00:45:23Z,It appears that The New York Times has shifted its enforcement of the paper's social media guidelines for its employees as the reporter who attacked millions of Trump voters has skated while a freela… [+4367 chars],fox-news,Fox News
Michael Ruiz,FBI investigating latest alleged Los Angeles 'jetpack guy' sighting,The FBI is investigating a new report of Los Angeles’ elusive “jetpack guy”-- who may have been spotted soaring over California again this week.,https://www.foxnews.com/us/fbi-los-angeles-jetpack-guy-sighting,https://static.foxnews.com/foxnews.com/content/uploads/2021/07/delta-plane-1.jpg,2021-07-31T00:44:08Z,"The FBI is investigating a new report of Los Angeles elusive ""jetpack guy""-- who may have been spotted soaring over California again this week.
A commercial pilot radioed in the possible sighting We… [+2090 chars]",fox-news,Fox News
Caitlin McFall,Biden says Americans should expect more COVID restrictions,President Biden warned Friday that increased COVID-related restrictions could again become a possibility as the U.S. sees spiking coronavirus cases nationwide.,https://www.foxnews.com/politics/biden-expect-more-coronavirus-restrictions,https://static.foxnews.com/foxnews.com/content/uploads/2021/07/AP21211814269672.jpg,2021-07-31T00:41:13Z,"President Biden warned Friday that increased COVID-related restrictions could again become a possibility as the U.S. sees spiking coronavirus cases nationwide. 
In response to questions by reporters… [+2006 chars]",fox-news,Fox News
"Julius Young, Matt Finn","Jussie Smollett's attorney allowed to remain on case but can't question Abel and Ola Osundairo, judge rules","Court documents obtained by Fox News on Friday heard a judge say he would not remove one of Smollett’s lawyers from the matter despite the fact he believes the attorney did, in fact, speak with brothers Abel and Ola Osundairo.",https://www.foxnews.com/entertainment/jussie-smollett-attorney-allowed-remain-hoax-attack-case,https://static.foxnews.com/foxnews.com/content/uploads/2019/12/Jussie-Smollett.jpg,2021-07-31T00:30:14Z,"Jussie Smollett scored a sizable win in his ongoing case stemming from an alleged hate crime in 2019.
Court documents obtained by Fox News on Friday heard a judge say he would not remove one of Smol… [+3588 chars]",fox-news,Fox News
Associated Press,6 people test positive for COVID-19 after Caribbean cruise,"Six passengers who sailed on a Royal Caribbean ship tested positive for COVID-19 near the end of their cruise and were immediately quarantined, the company said Friday.",https://www.foxnews.com/health/6-test-positive-covid-19-caribbean-cruise,https://static.foxnews.com/foxnews.com/content/uploads/2021/07/AP21211572554499.jpg,2021-07-31T00:26:05Z,"Six passengers who sailed on a Royal Caribbean ship tested positive for COVID-19 near the end of their cruise and were immediately quarantined, the company said Friday.
The passengers four adults an… [+1949 chars]",fox-news,Fox News
Michael Ruiz,Tennessee parents' sons in state custody after disappearance of daughter Summer Wells,"The parents of missing Tennessee 5-year-old Summer Wells attended juvenile court this week after their three sons were placed in the custody of that state Department of Child Protective Services, according to local reports.",https://www.foxnews.com/us/missing-tennessee-girl-summer-wells-parents-attend-juvenile-court-sons-cps-custody,https://static.foxnews.com/foxnews.com/content/uploads/2021/06/Summer-Wells-1.jpg,2021-07-31T00:23:39Z,"The parents of missingTennessee 5-year-old Summer Wells attended juvenile court this week after their three sons were placed in the custody of that state's Department of Child Protective Services, ac… [+2325 chars]",fox-news,Fox News
Jen Golotko,Larry Elder blasts government for rising crime and failure to protect citizens,California gubernatorial candidate Larry Elder and Fox Nation host Joey Jones joined “Hannity” Friday to discuss the rise in crime across the United States.,https://www.foxnews.com/media/larry-elder-government-crime-failure,https://cf-images.us-east-1.prod.boltdns.net/v1/static/694940094001/0f2661e0-850e-4fb0-b215-5853006453e3/2ab2c73c-a835-4c79-8c31-88b415009078/1280x720/match/image.jpg,2021-07-31T03:53:06Z,"Republican California gubernatorial candidate Larry Elder and Fox Nation host Joey Jones joined a special edition of ""Hannity"" Friday to discuss the rise in crime across the United States and the gov… [+1855 chars]",fox-news,Fox News
Brie Stimson,"Simone Biles withdraws from vault and bars, may still compete on floor and beam","American gymnast Simone Biles has withdrawn from the vault and uneven bars event finals at the Tokyo Olympics, USA Gymnastics said Saturday.",https://www.foxnews.com/sports/simone-biles-withdraws-vault-bars-floor-beam-mykayla-skinner,https://static.foxnews.com/foxnews.com/content/uploads/2021/07/AP21209226714150.jpg,2021-07-31T03:51:40Z,"American gymnast Simone Biles has withdrawn from the vault and uneven bars event finals at the Tokyo Olympics, USA Gymnastics said Saturday. 
Earlier, the superstar withdrew from the team competitio… [+1498 chars]",fox-news,Fox News
Tucker Carlson,Tucker Carlson: Democrats and the CDC have been lying about COVID and the vaccine,Tucker Carlson reacts to new COVID guidelines and highlights the flip-flops of Democrats and the CDC as they cling to power.,https://www.foxnews.com/opinion/tucker-carlson-democrats-cdc-lying-covid-vaccine,https://cf-images.us-east-1.prod.boltdns.net/v1/static/694940094001/5be54050-e605-4b57-a180-1fcacb7032b0/f1aa427d-1496-416c-b6d7-37c0aff7dece/1280x720/match/image.jpg,2021-07-31T03:26:58Z,"So you got the vaccine because they told you to get it or they forced you to get it because as Joe Biden himself explained, it was your patriotic duty to get it to protect yourself and others. Good p… [+10598 chars]",fox-news,Fox News
Charles Creitz,Colion Noir blasts ACLU for declaring the Second Amendment 'racist': 'Disgusting' to use racism,"Attorney and gun rights activist Colion Noir ripped the American Civil Liberties Union for declaring the liberties enshrined in the Second Amendment ""racist.""",https://www.foxnews.com/media/colion-noir-aclu-second-amendment-racist,https://static.foxnews.com/foxnews.com/content/uploads/2021/07/Video-2021-07-30T215148.926.jpg,2021-07-31T03:07:08Z,"Attorney and gun rights activist Colion Noir ripped the American Civil Liberties Union for declaring the liberties enshrined in the Second Amendment ""racist"" Friday on ""Tucker Carlson Tonight."" 
""Ra… [+1540 chars]",fox-news,Fox News
Michael Ruiz,Liberals from White House to Hawaii push for mask mandates but data is underwhelming,Democratic leaders from the White House down are mulling or enacting new coronavirus mask mandates following new guidance from the Centers for Disease Control and Prevention – even as new infections vary widely in different areas.,https://www.foxnews.com/politics/liberals-at-every-level-push-for-mask-mandate-but-data-is-questionable,https://static.foxnews.com/foxnews.com/content/uploads/2021/07/AP21211814269672.jpg,2021-07-31T02:45:33Z,Democratic leaders from the White House down are mulling or enacting new coronavirus mask mandates following new guidance from the Centers for Disease Control and Prevention even as new infections va… [+5252 chars],fox-news,Fox News
Fox News Staff,Stephen Miller slams New York Times opinion essay that argues for non-citizens to vote,Former Trump adviser Stephen Miller joined “Fox News Primetime” to weigh in on a New York Times opinion piece arguing that non-U.S. citizens should have the right to vote.,https://www.foxnews.com/media/stephen-miller-new-york-times-voting,https://cf-images.us-east-1.prod.boltdns.net/v1/static/694940094001/21653876-8203-4990-b5d8-77633383c90b/fd1be91e-02f2-47d8-8d0c-a38466864ac6/1280x720/match/image.jpg,2021-07-31T02:34:02Z,"Former Trump adviser Stephen Miller joined ""Fox News Primetime"" to weigh in on a New York Times opinion piece arguing that non-U.S. citizens should have the right to vote.
STEPHEN MILLER: The New Yo… [+1631 chars]",fox-news,Fox News
Nate Day,Ree Drummond shares sweet selfies with husband Ladd from Colorado vacation,“Pioneer Woman” star Ree Drummond took to Instagram to share a handful of selfies taken with her husband Ladd during their getaway to Colorado.,https://www.foxnews.com/entertainment/ree-drummond-sweet-selfies-husband-ladd-colorado-vacation,https://static.foxnews.com/foxnews.com/content/uploads/2020/11/Ree-Drummond-husband.jpg,2021-07-31T02:26:42Z,"Ree Drummond is giving fans a look at her happy marriage.
The 52-year-old celebrity chef took to Instagram recently to share photos from her trip to the Rocky Mountains in Colorado, particularly Vai… [+2155 chars]",fox-news,Fox News
Nate Day,‘House of Gucci’ trailer sees Lady Gaga push fashion brand to the limits,"“911” singer Lady Gaga follows up her starring role in “A Star is Born” alongside Jared Leto, Adam Driver, Al Pacino and more",https://www.foxnews.com/entertainment/house-of-gucci-trailer-lady-gaga-push-fashion-brand-limits,https://static.foxnews.com/foxnews.com/content/uploads/2021/07/Lady-Gaga-1.jpg,2021-07-31T02:17:44Z,"Lady Gaga is back on the big screen.
Nearly three years after taking audiences by storm in ""A Star is Born,"" Gaga has found her second leading role in MGMs ""House of Gucci.""
The films first trailer… [+1966 chars]",fox-news,Fox News
Nate Day,"Britney Spears goes topless again, shares snapshot from her 'vacation' with Cher and more in Instagram spree","The ""Toxic"" singer shared fan art depicting her enjoying ice cream in St. Tropez with ""Strong Enough"" singer Cher.",https://www.foxnews.com/entertainment/britney-spears-topless-again-snapshot-vacation-cher-instagram-spree,https://static.foxnews.com/foxnews.com/content/uploads/2021/07/Britney_Spears_Getty_2021.jpg,2021-07-31T02:14:08Z,"Britney Spears has plenty to say.
The 39-year-old pop star took to Instagram on Friday evening to share several back-to-back posts featuring another topless video, fan art depicting her with Cher an… [+2815 chars]",fox-news,Fox News
Brie Stimson,"Kamala Harris to travel to Vietnam, Singapore next month amid China tensions, US border crisis",Vice President Kamala Harris has another big trip ahead – but it won't be a return visit to the U.S.-Mexico border.,https://www.foxnews.com/politics/kamala-harris-vietnam-singapore-china-tensions-border-migrant-crisis,https://static.foxnews.com/foxnews.com/content/uploads/2021/06/slideshow-KH6.jpg,2021-07-31T05:14:41Z,"Vice President Kamala Harris has another big trip ahead but it won't be a return visit to the U.S.-Mexico border.
Instead, Harris next month will travel across the Pacific, to Vietnam and Singapore,… [+2247 chars]",fox-news,Fox News
Nate Day,Arnold Schwarzenegger's kids celebrate 'Terminator' star's 74th birthday: 'I love you so much',The former action-movie star and Republican governor of California celebrated Friday,https://www.foxnews.com/entertainment/arnold-schwarzeneggers-kids-celebrate-terminator-star-74th-birthday,https://static.foxnews.com/foxnews.com/content/uploads/2021/07/Arnold-Schwarzenegger-Katherine-Patrick.jpg,2021-07-31T04:45:26Z,"Arnold Schwarzenegger's family is celebrating a big milestone.
The ""Terminator"" star turned 74 on Friday and several of his children took to Instagram to wish him a special day.
""HAPPY BIRTHDAY DAD… [+2344 chars]",fox-news,Fox News
Dom Calicchio,Justice Department says hackers struck 27 US attorneys’ offices around US,"In a statement issued Friday, the U.S. Justice Department updated details about cyberattacks that struck the offices of federal prosecutors around the country in December 2020.",https://www.foxnews.com/tech/justice-department-says-hackers-struck-27-us-attorneys-offices-around-us,https://static.foxnews.com/foxnews.com/content/uploads/2021/06/GettyImages-1323059849.jpg,2021-07-31T04:37:02Z,"In a statement issued Friday, the U.S. Justice Department updated details about cyberattacks that struck the offices of federal prosecutors around the country in December 2020.
According to the stat… [+1962 chars]",fox-news,Fox News
Greg Gutfeld,"Greg Gutfeld: Police 'reforms' put people’s lives in danger, by pretending not to",We're living in a time where we're told we must reform the police because we assume everything we're being told about the reforms by the press was urgent and good for us.,https://www.foxnews.com/opinion/greg-gutfeld-police-reforms-danger,https://cf-images.us-east-1.prod.boltdns.net/v1/static/694940094001/0ca3d811-ce3f-470d-93a9-033974ddd1e1/30f81591-5b8d-4c48-b82f-3f0f41eb1093/1280x720/match/image.jpg,2021-07-31T04:32:30Z,"Here's a perfect Friday story that doesn't involve Brian Kilmeade being locked in a men's room without his pants. 
A man from Washington State, wearing only a yellow dress, stole a bus and escaped f… [+5043 chars]",fox-news,Fox News
Joseph Wulfsohn,"Bill Maher backs Simone Biles, rips 'armchair quarterbacks' attacking her: 'This is not a quitter'","""Real Time"" host Bill Maher returned from his vacation on Friday night to defend U.S. Olympic Gold Medalist Simone Biles after she withdrew from various competitions at the Tokyo Olympics, arguing she was ""pushed to the brink.""",https://www.foxnews.com/entertainment/bill-maher-backs-simone-biles,https://static.foxnews.com/foxnews.com/content/uploads/2021/07/maher-biles.jpg,2021-07-31T04:06:03Z,"""Real Time"" host Bill Maher returned from his vacation Friday night to defend U.S. Olympic Gold Medalist Simone Biles after she withdrew from various competitions at the Tokyo Olympics, arguing she w… [+1776 chars]",fox-news,Fox News
Nicole Rabon,Moms Push Back Against CDC’s School Masking Guidelines,"“We’re Momming Today” with Liz Patterson and Danielle Costa, two moms from “Unmask Our Kids” in Torrington, Connecticut, making a big push to ensure their kids go back to school next month without face masks, arguing that masks can cause more harm than the vi…",https://radio.foxnews.com/2021/07/31/moms-push-back-against-cdcs-school-masking-guidelines/,https://radio.foxnews.com/wp-content/uploads/2019/05/social-momming.jpg,2021-07-31T04:01:11Z,"“We’re Momming Today” with Liz Patterson and Danielle Costa, two moms from “Unmask Our Kids” in Torrington, Connecticut, making a big push to ensure their kids go back to school next month without fa… [+63 chars]",fox-news,Fox News
Fox News Staff,"Sen. Ron Johnson: CDC, other US health agencies have lost American public's trust","U.S. Sen. Ron Johnson, R-Wis., slammed the U.S. Centers for Disease Control and Prevention on Friday night’s edition of ""The Ingraham Angle.""",https://www.foxnews.com/media/sen-ron-johnson-cdc-health-agencies-lost-american-public-trust,https://cf-images.us-east-1.prod.boltdns.net/v1/static/694940094001/4eca59cb-b92b-47c0-b4ff-7f4d19e53ebe/4dcf6d86-13a5-411b-8824-d032272136af/1280x720/match/image.jpg,2021-07-31T07:51:43Z,"U.S. Sen. Ron Johnson, R-Wis., slammed the U.S. Centers for Disease Control and Prevention and other federal health agencies during a conversation with Fox News Brian Kilmeade on Friday nights editio… [+804 chars]",fox-news,Fox News
Brie Stimson,"Cori Bush spends night protesting outside US Capitol, gets support from Squad allies Omar, Pressley",U.S. Rep. Cori Bush said late Friday she plans to spend the night on the steps of the U.S. Capitol to protest the impending end of the coronavirus eviction moratorium.,https://www.foxnews.com/politics/cori-bush-protest-end-eviction-moratorium-ilhan-omar-ayanna-pressley,https://static.foxnews.com/foxnews.com/content/uploads/2021/07/capitol-steps.jpg,2021-07-31T07:22:56Z,"U.S. Rep. Cori Bush said late Friday she planned to spend the night on the steps of the U.S. Capitol to protest the impending end of the coronavirus eviction moratorium. 
""Millions are at risk of be… [+2298 chars]",fox-news,Fox News
Dom Calicchio,"CDC boss Walensky, after Fox TV appearance, walks back vaccine mandate remarks","Dr. Rochelle Walensky, director of the U.S. Centers for Disease Control and Prevention, issued a clarification statement Friday night after claiming on Fox News’ “Special Report” that the U.S. was “looking into” a possible nationwide vaccine mandate.",https://www.foxnews.com/media/cdc-boss-walensky-after-fox-tv-appearance-walks-back-vaccine-mandate-remarks,https://cf-images.us-east-1.prod.boltdns.net/v1/static/694940094001/f2ca4240-5f77-4e7e-a14b-17c99d3c626a/c16dcd1f-08ef-44dc-b530-90bed8ec8baf/1280x720/match/image.jpg,2021-07-31T06:58:17Z,"Dr. Rochelle Walensky, director of the U.S. Centers for Disease Control and Prevention, issued a clarification statement Friday night after claiming on Fox News ""Special Report"" that the U.S. was ""lo… [+4068 chars]",fox-news,Fox News
Brie Stimson,"New Mexico state Dem leader resigns amid racketeering, money-laundering probe",New Mexico House Majority Leader Sheryl Williams Stapleton resigned on Friday amid a criminal investigation involving alleged racketeering and money laundering.,https://www.foxnews.com/politics/new-mexico-democrat-williams-stapleton-resigns-amid-racketeering-investigation,https://static.foxnews.com/foxnews.com/content/uploads/2021/07/AP21209686290744.jpg,2021-07-31T09:46:58Z,"New Mexico House Majority Leader Sheryl Williams Stapleton resigned Friday amid a criminal investigation involving alleged racketeering and money laundering. 
The Democratic state lawmaker has ""uneq… [+4880 chars]",fox-news,Fox News
Brie Stimson,Canadian doctor accused of using own sperm to inseminate patients to pay $10.7M in tentative settlement,"Hundreds of victims of a former Canadian fertility doctor, who allegedly used the wrong sperm and sometimes his own while artificially inseminating patients, will be awarded $10.7 million in a tentative agreement reached this week, according to reports.",https://www.foxnews.com/health/canadian-doctor-own-sperm-inseminate-patients-settlement,https://static.foxnews.com/foxnews.com/content/uploads/2021/07/iStock-816223244.jpg,2021-07-31T09:21:18Z,"Hundreds of victims of a former Canadian fertility doctor, who allegedly used the wrong sperm and sometimes his own while artificially inseminating patients, will be awarded $10.7 million in a tentat… [+2747 chars]",fox-news,Fox News
Kate Pearce,Throwing It Back To The Real World ft. Puck Rainey & Jon Brennan,"This week, Sean & Rachel bring two of their oldest friends from ""The Real World"" to the kitchen table, David “Puck” Rainey & Jon Brennan.",https://radio.foxnews.com/2021/07/31/throwing-it-back-to-the-real-world-ft-puck-rainey-jon-brennan/,https://radio.foxnews.com/wp-content/uploads/2021/05/FEATURED_IMAGE_FROM_THE_KITCHEN_TABLE.png,2021-07-31T09:00:35Z,"This week, Sean &amp; Rachel bring two of their oldest friends from The Real World to the kitchen table, David “Puck” Rainey &amp; Jon Brennan.
The four friends reminisce on the old days while filmi… [+307 chars]",fox-news,Fox News
William Sanchez,FOX News Rundown Extra: Are New Mask Rules And Vaccine Mandates Following The Science?,"This week, President Biden announced he will require all federal workers to get the COVID vaccine or submit to frequent testing. This comes just days after the Center for Disease Control and Prevention revised its recommendation for fully vaccinated Americans…",https://radio.foxnews.com/2021/07/31/the-fox-news-rundown-7-31-2021-2/,https://radio.foxnews.com/wp-content/uploads/2020/05/Rundown-Featured-Image-NEW.png,2021-07-31T09:00:03Z,"This week, President Biden announced he will require all federal workers to get the COVID vaccine or submit to frequent testing.
This comes just days after the Center for Disease Control and Prevent… [+1120 chars]",fox-news,Fox News
