author,title,description,url,urlToImage,publishedAt,content,source.id,source.name
Emily Trainham,'Wheel of Fortune' host Pat Sajak shares reason behind his decision to retire from game show,"Pat Sajak has been hosting ""Wheel of Fortune"" for over 40 years, and now, the legendary game show host is explaining why he decided it was time to call it quits.",https://www.foxnews.com/entertainment/wheel-fortune-host-pat-sajak-shares-reason-behind-his-decision-retire-game-show,https://static.foxnews.com/foxnews.com/content/uploads/2024/06/pat-sajak.jpg,2024-06-03T14:34:05Z,"Pat Sajak knows when it is time to say goodbye.
Sajak, 77, has been hosting ""Wheel of Fortune"" for over 40 years, and while he originally announced his retirement from the gig last summer, he is cur… [+3148 chars]",fox-news,Fox News
Michael Ruiz,"Gilgo Beach investigators link another victim to suspected serial killer Rex Heuermann, sources say","Long Island investigators have linked a fifth alleged victim to Rex Heuermann, the suspected Gilgo Beach serial killer, sources tell Fox News Digital.",https://www.foxnews.com/us/gilgo-beach-investigators-link-another-victim-suspected-serial-killer-rex-heuermann-sources-say,https://static.foxnews.com/foxnews.com/content/uploads/2024/04/Rex-Heuermann-Gilgo-Beach-Suffolk-Court_05.jpg,2024-06-03T14:21:15Z,"Join Fox News for access to this content
Plus special access to select articles and other premium content with your account - free of charge.
By entering your email and pushing continue, you are ag… [+3584 chars]",fox-news,Fox News
Anders Hagstrom,Netanyahu says Biden presented 'incomplete' version of Gaza cease-fire,"Israeli Prime Minister Benjamin Netanyahu says President Biden presented an ""incomplete"" version of the cease-fire deal Israel is prepared to accept.",https://www.foxnews.com/politics/netanyahu-says-biden-presented-incomplete-version-gaza-cease-fire-deal,https://static.foxnews.com/foxnews.com/content/uploads/2024/03/AP24078580386310.jpg,2024-06-03T14:15:20Z,"Israeli Prime Minister Benjamin Netanyahu says there are ""gaps"" between the cease-fire deal Israel proposed and the version of it that President Biden described on Friday.
Netanyahu stated Monday th… [+2342 chars]",fox-news,Fox News
Bailee Hill,Trump vows to fire generals who push wokeness: 'You can't have a woke military',"Former President Trump issued a stark warning on a 'woke' U.S. military, promising to oust far-left generals during an exclusive sit-down interview with 'Fox & Friends Weekend.'",https://www.foxnews.com/media/trump-vows-fire-generals-push-wokeness-cant-woke-military,https://static.foxnews.com/foxnews.com/content/uploads/2020/10/AP20300617686986-e1603735785310.jpg,2024-06-03T14:09:01Z,"Join Fox News for access to this content
Plus special access to select articles and other premium content with your account - free of charge.
By entering your email and pushing continue, you are ag… [+4789 chars]",fox-news,Fox News
"Kurt Knutsson, CyberGuy Report",Android banking trojan masquerades as Google Play to steal your data,"New malware poses as a Google Play update with the intention of stealing data from Android users. Kurt “CyberGuy"" Knutsson discusses how to protect yourself.",https://www.foxnews.com/tech/android-banking-trojan-masquerades-google-play-steal-your-data,https://static.foxnews.com/foxnews.com/content/uploads/2024/06/5-Android-banking-trojan-masquerades-as-Google-Play-to-steal-your-data.jpg,2024-06-03T14:00:47Z,"Criminals constantly develop new ways to scam people, and their latest tactic involves infecting Android phones with malware to access banking information and other details. Researchers at the cybers… [+7713 chars]",fox-news,Fox News
Associated Press,French authorities investigate 3 men accused of 'psychological violence' at Eiffel Tower,"French prosecutors said that three men have been placed under an investigation on suspicion they committed “psychological violence"" at the Eiffel Tower.",https://www.foxnews.com/world/french-authorities-investigate-men-accused-psychological-violence-eiffel-tower,https://static.foxnews.com/foxnews.com/content/uploads/2024/06/France-2.png,2024-06-03T17:59:56Z,"<ul><li>Three men from Bulgaria, Germany, and Ukraine are being investigated for placing five coffins, inscribed with ""French soldiers of Ukraine,"" near the Eiffel Tower.</li><li>The men face charges… [+2453 chars]",fox-news,Fox News
Brittany Kasko,"Best European vacation spots for avid runners to visit on 2024 summer trips, Hoka says","Hoka, the shoe brand, listed the best European destinations for runners to visit on their summer vacation this year. With sunny skies and warm weather waiting, a few top places made the cut.",https://www.foxnews.com/travel/best-european-vacation-spots-avid-runners-visit-summer-trip-hoka,https://static.foxnews.com/foxnews.com/content/uploads/2024/05/travel-split.png,2024-06-03T17:55:22Z,"Join Fox News for access to this content
Plus special access to select articles and other premium content with your account - free of charge.
By entering your email and pushing continue, you are ag… [+2936 chars]",fox-news,Fox News
Reuters,Spanish and French farmers form border blockade before EU election,Spanish and French farmers blocked roads along their border ahead of European Parliament elections to protest against what they say is unfair competition from outside the EU.,https://www.foxnews.com/world/spanish-french-farmers-border-blockade-eu-election,https://static.foxnews.com/foxnews.com/content/uploads/2024/06/Spanish-French-farmers.jpg,2024-06-03T17:49:59Z,<ul><li>Spanish and French farmers blocked roads along their border on Monday ahead of European Parliament elections to protest against what they say is unfair competition from outside the European U… [+2254 chars],fox-news,Fox News
Danielle Wallace,Anti-Israel demonstrators seen on video bringing Philadelphia Pride Parade to a halt,"A video showed a crowd of anti-Israel protesters led by ""Queers 4 Palestine Philly"" blocking marchers in the Philadelphia Pride Parade from continuing.",https://www.foxnews.com/us/anti-israel-demonstrators-seen-video-bringing-philadelphia-pride-parade-halt,https://static.foxnews.com/foxnews.com/content/uploads/2024/06/palestine-pride-march-1.jpg,2024-06-03T17:49:12Z,"A crowd of anti-Israel protesters brought the Philadelphia Pride Parade to a halt on Sunday. 
A video that circulated online showed parade participants being stopped in their tracks by a group of an… [+2763 chars]",fox-news,Fox News
Ashlyn Messier,"Who is Caitlin Clark? Stats, awards, broken records and endorsement deals of the Indiana Fever player",Caitlin Clark is highly regarded as one of the most popular players in the WNBA. She played for the Iowa Hawkeyes in college and now plays for the Indiana Fever in the WNBA.,https://www.foxnews.com/sports/who-is-caitlin-clark,https://static.foxnews.com/foxnews.com/content/uploads/2024/06/caitlin-clark-indiana-iowa.jpg,2024-06-03T17:46:39Z,"Caitlin Clark's popularity has skyrocketed, especially during her last couple years playing basketball for the University of Iowa leading into her WNBA debut. 
Even if you are not a fan of basketbal… [+4747 chars]",fox-news,Fox News
Stephen Sorace,Democratic Minnesota state senator’s own party calling for her resignation after burglary charge,Democratic Minnesota state Sen. Nicole Mitchell is now facing calls to resign from her own party after she was charged with first-degree burglary in April.,https://www.foxnews.com/politics/democratic-minnesota-state-senators-own-party-calling-resignation-burglary-charge,https://static.foxnews.com/foxnews.com/content/uploads/2024/04/nicole-mitchell-capitol-thumb.jpg,2024-06-03T17:43:42Z,Democratic Minnesota state Sen. Nicole Mitchells own party is calling for her resignation over a month after she was charged with burglary for allegedly breaking into her stepmother's home to get her… [+2158 chars],fox-news,Fox News
Associated Press,18 people arrested in Poland after allegedly planning 'hostile activities' on behalf of Russia,Poland's interior minister said that 18 people have been arrested on allegations of pursuing hostile activities or planning sabotage on behalf of Russia and Belarus.,https://www.foxnews.com/world/18-people-arrested-poland-allegedly-planning-hostile-activities-behalf-russia,https://static.foxnews.com/foxnews.com/content/uploads/2024/06/Zelenskyy-5.png,2024-06-03T17:41:17Z,<ul><li>Poland has arrested 18 people accused of pursuing hostile activities or planning sabotage on behalf of Russia and Belarus.</li><li>Ten of those arrested were directly involved in planning var… [+1818 chars],fox-news,Fox News
Anders Hagstrom,"Biden issues permit to expand, maintain border crossings across Texas",President Biden authorized the expansion of border crossing facilities across Texas on Monday.,https://www.foxnews.com/politics/biden-issues-permit-expand-maintain-border-crossings-texas,https://static.foxnews.com/foxnews.com/content/uploads/2024/04/biden-border-crossers-edit.jpg,2024-06-03T17:26:30Z,"President Biden issued permits to several Texas cities on Monday allowing them to ""expand and continue to maintain"" their border crossings.
Biden's order impacts the Texas cities of Laredo, Eagle Pa… [+2314 chars]",fox-news,Fox News
Christina Coulter,"Arizona man, minor arrested in shooting that killed police officer, bystander",An Arizona man and a juvenile have been arrested after Officer Joshua Briese and a bystander were killed when police responded to a house party on Saturday.,https://www.foxnews.com/us/arizona-man-minor-arrested-shooting-killed-police-officer-bystander,https://static.foxnews.com/foxnews.com/content/uploads/2024/06/AZ-COP-2.png,2024-06-03T17:24:29Z,"Join Fox News for access to this content
Plus special access to select articles and other premium content with your account - free of charge.
By entering your email and pushing continue, you are ag… [+2416 chars]",fox-news,Fox News
Ryan Gaydos,"Justin Jefferson, Vikings agree to historic contract extension","Justin Jefferson and the Minnesota Vikings agreed to a massive contract extension on Monday, the team announced. He will be with the team through the 2028 season.",https://www.foxnews.com/sports/justin-jefferson-vikings-agree-historic-contract-extension,https://static.foxnews.com/foxnews.com/content/uploads/2024/06/Justin-Jefferson.jpg,2024-06-03T17:16:52Z,"Join Fox News for access to this content
Plus special access to select articles and other premium content with your account - free of charge.
By entering your email and pushing continue, you are ag… [+3181 chars]",fox-news,Fox News
Associated Press,Chinese spacecraft lands on far side of moon to collect samples as space rivalry with US grows,China has landed a spacecraft on the moon’s far side to collect samples that could provide insights into differences between the less-explored region and the better-known near side.,https://www.foxnews.com/world/chinese-spacecraft-lands-far-side-moon-collect-samples-space-rivalry-us-grows,https://static.foxnews.com/foxnews.com/content/uploads/2024/06/China-Space-lands-on-moon.jpg,2024-06-03T17:14:32Z,<ul><li>A Chinese spacecraft has landed on the moons far side to collect soil and rock samples that could provide insights into differences between the less-explored region and the better-known near … [+3024 chars],fox-news,Fox News
Greg Norman,Cleaning crew finds 235 pounds of meth at California Airbnb: police,Police in California say a cleaning crew at an Airbnb property discovered boxes that ultimately turned out to be 235 pounds of methamphetamine.,https://www.foxnews.com/us/cleaning-crew-finds-235-pounds-meth-california-airbnb-police,https://static.foxnews.com/foxnews.com/content/uploads/2024/06/California-meth.jpg,2024-06-03T17:14:04Z,"A cleaning crew stumbled upon 235 pounds of methamphetamine while working at a California Airbnb property, police say. 
The Alhambra Police Department announced Sunday that two suspects are now in c… [+2368 chars]",fox-news,Fox News
Paul Steinhauser,Conservative firebrand spotlights Trump conviction in attack ad on vulnerable Dem senator,Republican Tim Sheehy of Montana becomes the first GOP Senate candidate to launch an ad that spotlights former President Trump's guilty verdict in his criminal trial.,https://www.foxnews.com/politics/conservative-firebrand-spotlights-trump-conviction-attack-ad-vulnerable-dem-senator,https://static.foxnews.com/foxnews.com/content/uploads/2024/02/sheehy-trump.jpg,2024-06-03T17:12:26Z,"Join Fox News for access to this content
Plus special access to select articles and other premium content with your account - free of charge.
By entering your email and pushing continue, you are ag… [+2829 chars]",fox-news,Fox News
Lindsay Kornick,Idaho bar goes viral after declaring 'Heterosexual Awesomeness Month',"The Old State Saloon in Eagle, Idaho announced some “Heterosexual Awesomeness Month"" specials ahead of June as alternatives to LGBTQ Pride Month in June.",https://www.foxnews.com/media/idaho-bar-goes-viral-after-declaring-heterosexual-awesomeness-month,https://static.foxnews.com/foxnews.com/content/uploads/2024/06/OLD-STATE-SALOON-PRIDE-FLAG.jpg,2024-06-03T17:00:52Z,"One bar in Eagle, Idaho is going viral after it announced it was celebrating ""Heterosexual Awesomeness Month"" in June.
The Old State Saloon posted on Wednesday that it would be kicking off its first… [+3685 chars]",fox-news,Fox News
Kristine Parks,Bill Maher battles journalist over Biden’s re-election chances: ‘He’s going to f---ing lose!’,"Bill Maher slammed critics accusing him of changing his views and made a prediction about who would win the November election, during his most recent podcast.",https://www.foxnews.com/media/bill-maher-battles-journalist-over-bidens-re-election-chances-hes-going-f-ing-lose,https://static.foxnews.com/foxnews.com/content/uploads/2024/03/MaherBiden3.jpg,2024-06-03T16:49:39Z,"HBO host Bill Maher predicted President Biden would lose the presidential election to Donald Trump on this week's episode of his ""Club Random"" podcast.
The talk show host was debating the November e… [+2368 chars]",fox-news,Fox News
Benjamin Weinthal,"Netanyahu and Trump face similar 'politicized prosecutions,' legal expert says",From Trump to Netanyahu to the late Silvio Berlusconi and Pakistan's Imran Khan leaders argue they have been targeted by a politicized judiciary,https://www.foxnews.com/world/netanyahu-trump-face-similar-politicized-prosecutions-legal-expert-says,https://static.foxnews.com/foxnews.com/content/uploads/2021/12/AP21344286604749.jpg,2024-06-03T16:42:09Z,"Join Fox News for access to this content
Plus special access to select articles and other premium content with your account - free of charge.
By entering your email and pushing continue, you are ag… [+5003 chars]",fox-news,Fox News
Maureen Mackey,Cat reunited with owner 12 years after disappearing from family home: 'Didn't feel real',"A young man in Wales lost his cat for 12 years — and thought he'd never see the pet again. But just weeks ago, the cat turned up and the two have been reunited.",https://www.foxnews.com/lifestyle/cat-reunited-owner-12-years-disappearing-family-home-didnt-feel-real,https://static.foxnews.com/foxnews.com/content/uploads/2024/06/cat-reunited-with-owner-12-years-later-split.jpg,2024-06-03T16:39:27Z,"Join Fox News for access to this content
Plus special access to select articles and other premium content with your account - free of charge.
By entering your email and pushing continue, you are ag… [+4997 chars]",fox-news,Fox News
Chris Eberhart,"Chicago man sent dozens of sextortion victims, family members threatening messages: court docs","A Chicago man admitted to targeting people on social media, convincing them to send explicit images and using them to demand money and sex while outing their sexual orientation",https://www.foxnews.com/us/chicago-man-sent-dozens-sextortion-victims-family-members-threatening-messages-court-docs,https://static.foxnews.com/foxnews.com/content/uploads/2023/12/GettyImages-1232416609-1.jpg,2024-06-03T16:35:52Z,"Join Fox News for access to this content
Plus special access to select articles and other premium content with your account - free of charge.
By entering your email and pushing continue, you are ag… [+4478 chars]",fox-news,Fox News
Thomas Phippen,"Pro-life group urges GOP to avoid 'ostrich strategy,' target Dems for wanting 'global abortion factory'","Susan B. Anthony (SBA) Pro-Life America is urging Republican candidates not to stick their heads in the sand ahead of the 2024 elections, but rather paint Democrats as unpopular on abortion.",https://www.foxnews.com/politics/pro-life-group-urges-gop-avoid-ostrich-strategy-target-dems-wanting-global-abortion-factory,https://static.foxnews.com/foxnews.com/content/uploads/2024/01/pro-life.jpg,2024-06-03T16:33:48Z,"Prominent pro-life organization Susan B. Anthony (SBA) Pro-Life America is urging Republican candidates not to stick their heads in the sand ahead of the 2024 elections, but rather paint Democrats as… [+4446 chars]",fox-news,Fox News
Associated Press,"Austria's first woman chancellor, Brigitte Bierlein, dies at 74","Brigitte Bierlein, Austria's former Constitutional Court head and first woman chancellor, has died at 74 after a brief illness, according to Chancellor Karl Nehammer.",https://www.foxnews.com/world/austrias-first-woman-chancellor-brigitte-bierlein-dies-74,https://static.foxnews.com/foxnews.com/content/uploads/2024/06/Brigitte-Bierlein.png,2024-06-03T16:31:25Z,"<ul><li>Brigitte Bierlein, former head of Austrias Constitutional Court and the countrys first woman chancellor, has died at the age of 74.</li><li>Her death was announced by Chancellor Karl Nehammer… [+2751 chars]",fox-news,Fox News
Brian Flood,RNC co-chair Lara Trump blasts ‘ridiculous’ GOP Senate hopeful Larry Hogan for defending Trump trial verdict,"Lara Trump said Republican nominee for Senate Larry Hogan ""doesn’t deserve the respect"" of anyone in the GOP for remarks he made about former President Trump's criminal trial.",https://www.foxnews.com/media/rnc-co-chair-lara-trump-blasts-ridiculous-gop-senate-candidate-larry-hogan-he-doesnt-deserve-respect,https://static.foxnews.com/foxnews.com/content/uploads/2024/06/LARA-TRUMP-CNN-1.jpg,2024-06-03T16:31:11Z,"Join Fox News for access to this content
Plus special access to select articles and other premium content with your account - free of charge.
By entering your email and pushing continue, you are ag… [+3099 chars]",fox-news,Fox News
Ryan Gaydos,Orioles' Jorge Mateo forced to leave game after bizarre accident near on-deck circle with teammate,Baltimore Orioles infielder Jorge Mateo was put into concussion protocol on Sunday after a bizarre accident with teammate Cedric Mullins.,https://www.foxnews.com/sports/orioles-jorge-mateo-forced-leave-game-after-bizarre-accident-near-on-deck-circle-teammate,https://static.foxnews.com/foxnews.com/content/uploads/2024/06/Jorge-Mateo.jpg,2024-06-03T16:25:04Z,"Baltimore Orioles outfielder Cedric Mullins and infielder Jorge Mateo were involved in a bizarre on-deck circle accident Sunday against the Tampa Bay Rays.
As Mullins was getting warmed up to enter … [+1486 chars]",fox-news,Fox News
Ryan Gaydos,NFL legend Larry Allen 'passed away suddenly' at 52,"Legendary Dallas Cowboys offensive lineman Larry Allen ""passed away suddenly"" while vacationing in Mexico, the team said Monday. He was 52.",https://www.foxnews.com/sports/nfl-legend-larry-allen-passed-away-suddenly,https://static.foxnews.com/foxnews.com/content/uploads/2024/06/Larry-Allen.jpg,2024-06-03T16:24:06Z,"Larry Allen, a Pro Football Hall of Fame guard who played most of his career with the Dallas Cowboys, ""passed away suddenly"" at the age of 52, the team said Monday.
Allen died while he was with his … [+1806 chars]",fox-news,Fox News
Associated Press,"Congo hasn't allowed US access to Americans arrested in coup attempt, embassy says",The U.S. Embassy in Congo said Congolese authorities have not shared details or provided access to the Americans arrested under accusations of having a role in a recent failed coup attempt.,https://www.foxnews.com/world/congo-hasnt-allowed-us-access-americans-arrested-coup-attempt-embassy-says,https://static.foxnews.com/foxnews.com/content/uploads/2024/06/Congo-Failed-Coup.jpg,2024-06-03T16:21:48Z,<ul><li>The U.S. Embassy in Congo said that Congolese authorities have not shared details or provided access to the three Americans who were accused of having a role in a recent failed coup attempt a… [+2900 chars],fox-news,Fox News
Associated Press,More than 100 former Illinois youth inmates sue state over alleged sexual abuse in detention centers,"Dozens more former youth inmates are suing over alleged sexual abuse they say that they endured at Illinois detention centers, according to law officials.",https://www.foxnews.com/us/former-illinois-youth-inmates-sue-state-alleged-sexual-abuse-detention-centers,https://static.foxnews.com/foxnews.com/content/uploads/2024/05/Youth-Center-Abuse-Illinois.jpg,2024-06-03T16:15:58Z,<ul><li>Dozens of former youth inmates have filed lawsuits seeking millions in damages for sexual abuse allegedly endured at Illinois detention centers.</li><li>Thirteen women and 95 men filed two la… [+4113 chars],fox-news,Fox News
Associated Press,"Intellectual disability disorder may be linked to a single, 'surprising' gene, research shows","Scientists have made a breakthrough in genetic research by finding the root of a disorder that causes intellectual disability, which affects about one in 20,000 young people.",https://www.foxnews.com/health/intellectual-disability-disorder-linked-single-surprising-gene-research-shows,https://static.foxnews.com/foxnews.com/content/uploads/2024/06/Genes.png,2024-06-03T16:13:32Z,"<ul><li>Scientists have identified the genetic basis of a disorder causing intellectual disability, affecting approximately one in 20,000 young people.</li><li>The disorder is characterized by sympto… [+2726 chars]",fox-news,Fox News
Reuters,What to know about the upcoming Swiss summit on Ukraine's peace plan,Switzerland will host a summit on June 15-16 that aims to build broad international support for Ukrainian President Volodymyr Zelenskiy's peace proposals.,https://www.foxnews.com/world/what-know-upcoming-swiss-summit-ukraines-peace-plan,https://static.foxnews.com/foxnews.com/content/uploads/2024/06/Zelenskiy-bilateral-meeting-Philippines.jpg,2024-06-03T16:10:40Z,<ul><li>Switzerland will host a summit on June 15-16 that aims to build broad international support for Ukrainian President Volodymyr Zelenskiy's peace proposals.</li><li>Zelenskiy heavily lobbied Ch… [+3847 chars],fox-news,Fox News
Jamie Joseph,Biden calls son Hunter's 'resilience' amid gun trial charges 'inspiring',"President Joe Biden rallied behind his son, Hunter, who is facing federal gun charges. Trial proceedings began Monday morning with jury selection.",https://www.foxnews.com/politics/biden-calls-son-hunters-resilience-amid-gun-trial-charges-inspiring,https://static.foxnews.com/foxnews.com/content/uploads/2024/06/Hunter-Biden-Delaware-Trial-Day-1_03.jpg,2024-06-03T16:01:19Z,"President Joe Biden issued a statement as his son, Hunter Biden, faces trial over federal gun charges, calling his ""resilience inspiring to us.""
""I am the President, but I am also a Dad. Jill and I … [+2230 chars]",fox-news,Fox News
Jamie Joseph,GOP lawmakers turn up pressure on Biden over Iran nuclear program: 'Enough is enough',Sen. Tim Scott and Rep. Mike Lawler will introduce a resolution Monday afternoon urging the Biden administration to censure Iran at the IAEA meeting.,https://www.foxnews.com/politics/gop-lawmakers-turn-up-pressure-biden-over-iran-nuclear-program-enough-is-enough,https://static.foxnews.com/foxnews.com/content/uploads/2024/06/Scott_Lawler.jpg,2024-06-03T19:56:03Z,FIRST ON FOX: Republican lawmakers Sen. Tim Scott and Rep. Mike Lawler are pressing the Biden administration to censure Iran at the next International Atomic Energy Agency (IAEA) meeting due to its h… [+4157 chars],fox-news,Fox News
Scott Thompson,"Pat McAfee refers to Caitlin Clark as 'White b----,' slams critics for saying race reason for her popularity","ESPN's Pat McAfee slammed critics of Caitlin Clark and her popularity on his radio show and referred to the Indiana Fever rookie as ""White b----.""",https://www.foxnews.com/sports/pat-mcafee-refers-caitlin-clark-white-b-h-slams-critics-saying-race-reason-popularity,https://static.foxnews.com/foxnews.com/content/uploads/2024/06/Caitlin-Clark-Pat-McAfee.png,2024-06-03T19:49:13Z,"Since she was selected No. 1 overall in the 2024 WNBA Draft, the Indiana Fever's Caitlin Clark was labeled a superstar before even stepping on the professional court. 
And while the Fever have gotte… [+3948 chars]",fox-news,Fox News
Ryan Gaydos,Caitlin Clark's boyfriend appears to endorse idea of Fever bringing in enforcer after foul drama,Indiana Fever rookie Caitlin Clark's boyfriend appeared to endorse the idea of the team bringing in an enforcer after the foul drama with the Chicago Sky.,https://www.foxnews.com/sports/caitlin-clarks-boyfriend-appears-endorse-idea-fever-bringing-enforcer-after-foul-drama,https://static.foxnews.com/foxnews.com/content/uploads/2024/06/Caitlin-Clark14.jpg,2024-06-03T19:36:30Z,"There has been much debate about what the Indiana Fever should do to protect Caitlin Clark, but one idea that took off was to add an enforcer to the roster.
The idea appeared to be endorsed by Clark… [+1933 chars]",fox-news,Fox News
