author,title,description,url,urlToImage,publishedAt,content,source.id,source.name
Associated Press,Tara VanDerveer becomes winningest women's basketball coach,"Tara VanDerveer made history, and then took a moment to tell her Stanford players what they mean to her.",https://www.foxnews.com/sports/tara-vanderveer-becomes-winningest-womens-basketball-coach,https://static.foxnews.com/foxnews.com/content/uploads/2020/12/Tara_VanDerveer.jpg,2020-12-16T14:25:39Z,"Tara VanDerveer made history, and then took a moment to tell her Stanford players what they mean to her.
“The most important thing I can do as a coach is love you,” VanDerveer said. “I love the game… [+5956 chars]",fox-news,Fox News
Evie Fordham,"Biden Cabinet pick Jennifer Granholm promoted 'pee tape,' Russian collusion claims","Jennifer Granholm, President-elect Joe Biden's pick to be energy secretary, heavily promoted claims that President Trump's campaign colluded with Russia to win the 2016 election, even mentioning an unsubstantiated ""pee tape.""",https://www.foxnews.com/politics/jennifer-granholm-russia-collusion-narrative-biden-energy-secretary,https://static.foxnews.com/foxnews.com/content/uploads/2020/12/gettyimages-jennifer-Granholm.jpg,2020-12-16T14:19:44Z,"Jennifer Granholm, President-elect Joe Biden's pick to be energy secretary, heavily promoted claims that President Trump's campaign colluded with Russia to win the 2016 election, even mentioning an u… [+2962 chars]",fox-news,Fox News
Caleb Parke,"Sen. Cotton calls on Swalwell to hold press conference, explain Chinese spy ties","Rep. Eric Swalwell, D-Calif., needs to stop ""hiding behind"" the cloak of classified information amid backlash over his relationship with a Chinese spy, Sen. Tom Cotton said Wednesday.",https://www.foxnews.com/politics/sen-cotton-calls-on-swalwell-to-hold-press-conference-explain-chinese-spy-ties,https://cf-images.us-east-1.prod.boltdns.net/v1/static/694940094001/16a1316b-4229-45d4-b9fa-b9426a892a17/0d3947fe-e2a4-47a2-8e25-07f054bb025d/1280x720/match/image.jpg,2020-12-16T14:15:34Z,"Rep. Eric Swalwell, D-Calif., needs to stop ""hiding behind"" the cloak of classified information amid backlash over his relationship with a Chinese spy, Sen. Tom Cotton said Wednesday.
A group of 17 … [+2217 chars]",fox-news,Fox News
Brian Flood,"CNN’s Don Lemon dismisses Kayleigh McEnany with slang term: ‘Girl, bye’","CNN’s Don Lemon, who the liberal network bills as an “anchor,” not an opinion host, dismissed White House press secretary Kayleigh McEnany with the term, “Girl, bye,” on Tuesday night.",https://www.foxnews.com/media/don-lemon-kayleigh-mcenany-girl-bye,https://static.foxnews.com/foxnews.com/content/uploads/2020/04/don-lemon-CNN.jpg,2020-12-16T14:14:59Z,"CNN’s Don Lemon, who the liberal network bills as an “anchor,” not an opinion host, dismissed White House press secretary Kayleigh McEnany with the term, “Girl, bye,” on Tuesday night.
Lemon played … [+1918 chars]",fox-news,Fox News
Associated Press,"Harden returns to Rockets, scores 12 in preseason debut",James Harden was back in a Houston uniform.,https://www.foxnews.com/sports/harden-returns-to-rockets-scores-12-in-preseason-debut,https://static.foxnews.com/foxnews.com/content/uploads/2020/12/James_Harden.jpg,2020-12-16T14:14:58Z,"James Harden was back in a Houston uniform.
It’s still unclear how many more times that’ll happen.
CLICK HERE TO GET MORE SPORTS COVERAGE ON FOXNEWS.COM
The three-time defending NBA scoring champi… [+4906 chars]",fox-news,Fox News
Megan Henney,"AOC says Pelosi, Schumer need to go, but warns of Democratic power vacuum",Rep. Alexandria Ocasio-Cortez believes the Democratic Party needs new leaders.,https://www.foxnews.com/politics/aoc-nancy-pelosi-chuck-schumer-new-democratic-leadership,https://static.foxnews.com/foxnews.com/content/uploads/2020/12/501a9196-AP19102561445126.jpg,2020-12-16T14:04:04Z,"Rep. Alexandria Ocasio-Cortez believes the Democratic Party needs new leaders.
The progressive firebrand said it's time for House Speaker Nancy Pelosi and Senate Minority Leader Chuck Schumer to go … [+2906 chars]",fox-news,Fox News
Ronn Blitzer,Senate confirmation of Barrett replacement adds to Trump's record on judges,President Trump continued to add to his tally of successful judicial appointments Tuesday with the confirmation of Thomas Kirsch II as a judge on the 7th Circuit Court of Appeals.,https://www.foxnews.com/politics/senate-confirms-barrett-replacement-trump-record-on-judges,https://static.foxnews.com/foxnews.com/content/uploads/2020/12/trump-georgia-rally.jpg,2020-12-16T14:02:19Z,"President Trump continued to add to his tally of successful judicial appointments Tuesday with the confirmation of Thomas Kirsch II as a judge on the 7th Circuit Court of Appeals.
Kirsch, who had se… [+2647 chars]",fox-news,Fox News
Associated Press,"Islamic State widow convicted in Charlie Hebdo, kosher market attacks",The fugitive widow of an Islamic State gunman and a man described as his logistician on Wednesday were convicted of terrorism charges and sentenced to 30 years in prison in the trial of 14 people linked to the January 2015 attacks in Paris against the satiric…,https://www.foxnews.com/world/islamic-state-widow-convicted-charlie-hebdo-kosher-market-attacks,https://static.foxnews.com/foxnews.com/content/uploads/2020/09/AP20269393217644.jpg,2020-12-16T17:58:15Z,PARIS — The fugitive widow of an Islamic State gunman and a man described as his logistician on Wednesday were convicted of terrorism charges and sentenced to 30 years in prison in the trial of 14 pe… [+7316 chars],fox-news,Fox News
Madeline Farber,Daily coronavirus cases in Maine see record high,"Daily new coronavirus cases in Maine reached a record high this week, with the state recording some 554 cases on Tuesday alone.",https://www.foxnews.com/health/daily-coronavirus-cases-in-maine-see-record-high,https://static.foxnews.com/foxnews.com/content/uploads/2020/12/a8cd4799-coronavirus-.jpg,2020-12-16T17:52:05Z,"Daily new coronavirus cases in Maine reached a record high this week, with the state recording some 554 cases on Tuesday alone.
The seven-day moving average also increased on Tuesday, rising to 409.… [+1425 chars]",fox-news,Fox News
Tyler Olson,"Biden says 'I'm confident' Hunter did nothing wrong, amid federal probe into 'tax affairs'","President-elect Biden on Wednesday directly addressed questions about a federal investigation into his son, Hunter Biden, for the first time, saying ""I'm confident"" that he did nothing wrong.",https://www.foxnews.com/politics/biden-says-im-confident-hunter-did-nothing-wrong-amid-federal-probe-into-tax-affairs,https://cf-images.us-east-1.prod.boltdns.net/v1/static/694940094001/d48a1508-5938-48ec-8d61-d3278e41c1b8/39a23cf2-debb-4dd9-84fa-2a19f837f39e/1280x720/match/image.jpg,2020-12-16T17:47:06Z,"President-elect Biden on Wednesday directly addressed questions about a federal investigation into his son, Hunter Biden, for the first time, saying ""I'm confident"" that he did nothing wrong. 
Hunte… [+1818 chars]",fox-news,Fox News
Jessica Napoli,Kim Kardashian and Kanye West 'spend a lot of time apart' but remain focused on kids,"They share kids North West, 7, Saint West, 5, Chicago West, 2, and Pslam West, 19 months.",https://www.foxnews.com/entertainment/kim-kardashian-kanye-west-marriage-issues,https://static.foxnews.com/foxnews.com/content/uploads/2018/12/kim_kanye.jpg,2020-12-16T17:42:17Z,"Kim Kardashian and Kanye West have been married for six years but now the famous couple is reportedly having relationship issues.
A source close to the reality TV star told E! News that the pair are… [+2295 chars]",fox-news,Fox News
Brian Flood,"Media outlets called out for touting Buttigieg as first openly gay Cabinet member, ‘whitewashing’ Ric Grenell","President-elect Joe Biden tapped former South Bend Mayor Pete Buttigieg to serve as transportation secretary in the new administration on Tuesday and the mainstream media quickly celebrated that he is the first openly gay Cabinet member, completely overlookin…",https://www.foxnews.com/media/pete-buttigieg-first-openly-gay-cabinet-member-grenell,https://static.foxnews.com/foxnews.com/content/uploads/2020/12/Pete-Buttigieg-Richard-Grenell.jpg,2020-12-16T17:39:56Z,President-elect Joe Biden tapped former South Bend Mayor Pete Buttigieg to serve as transportation secretary in the new administration on Tuesday and the mainstream media quickly celebrated that he i… [+2549 chars],fox-news,Fox News
Associated Press,Iran leader says Biden's arrival doesn't guarantee better relations with US,Iran’s supreme leader and the country’s president both warned America on Wednesday that the departure of President Donald Trump does not immediately mean better relations between the two nations.,https://www.foxnews.com/world/iran-bidens-arrival-relations-with-us,https://static.foxnews.com/foxnews.com/content/uploads/2020/12/Ayatollah-Ali-Khamenei.jpg,2020-12-16T17:38:10Z,"Iran’s supreme leader and the country’s president both warned America on Wednesday that the departure of President Donald Trump does not immediately mean better relations between the two nations. 
T… [+4518 chars]",fox-news,Fox News
Stephanie Nolasco,"Kate Middleton is a low-maintenance parent who wants to give her royal children a normal upbringing, pals say","Kate Middleton may be married to the future king of England, but the queen consort to be is simply a busy mom of three behind palace doors, pals insist.",https://www.foxnews.com/entertainment/kate-middleton-hands-on-parent-duchess-of-cambridge-friends-speak-out,https://cf-images.us-east-1.prod.boltdns.net/v1/static/694940094001/929b3c5c-6978-465f-b913-0ea458866167/377dda83-75ba-46ae-91a1-f876173b33ba/1280x720/match/image.jpg,2020-12-16T17:37:01Z,"Kate Middleton may be married to the future king of England, but the queen consort to be is simply a busy mom of three behind palace doors, pals insist.
Friends of the 38-year-old told People magazi… [+3999 chars]",fox-news,Fox News
James Rogers,Snowflake science explained,"Snow is an all-too-familiar feature of the colder months across much of the U.S., but how much do you know about the science of snowflakes?",https://www.foxnews.com/science/snowflake-science-explained,https://cf-images.us-east-1.prod.boltdns.net/v1/static/694940094001/8e94d1e4-2abf-4873-87c6-b34783731b69/9f493fca-47b6-4fb4-bc54-ff7e2e5dabe8/1280x720/match/image.jpg,2020-12-16T17:36:41Z,"Snow is an all-too-familiar feature of the colder months across much of the U.S., but how much do you know about the science of snowflakes?
There will be plenty of snowflakes falling on Wednesday wi… [+2586 chars]",fox-news,Fox News
Peter Caterina,Mark Morgan: JD Vance Is Spot On That Chinese Fentanyl Is Crossing The Southern Border & Is Crushing Rural America,Mark Morgan: JD Vance Is Spot On That Chinese Fentanyl Is Crossing The Southern Border & Is Crushing Rural America,https://radio.foxnews.com/2020/12/16/mark-morgan-jd-vance-is-spot-on-that-chinese-fentanyl-is-crossing-the-southern-border-is-crushing-rural-america/,https://radio.foxnews.com/wp-content/uploads/2020/12/JD-Vance-Fox-photo.jpg,2020-12-16T17:30:38Z,,fox-news,Fox News
Tyler McCarthy,"Christopher Walken reveals he never owned a cell phone or computer, says he 'borrows' from 'nice' people","In a world where everything is happening online, Christopher Walken revealed that he has somehow managed to avoid modern technology.",https://www.foxnews.com/entertainment/christopher-walken-never-owned-cell-phone-computer-nice-borrow,https://static.foxnews.com/foxnews.com/content/uploads/2020/12/Christopher-Walken-Getty.jpg,2020-12-16T17:20:43Z,"In a world where everything is happening online, Christopher Walken revealed that he has somehow managed to avoid modern technology.
The actor, 77, appeared virtually for an interview on ""The Late S… [+2539 chars]",fox-news,Fox News
Danielle Wallace,"DeSantis vows to keep Florida restaurants open, criticizes NYC indoor dining shutdown",Florida Gov. Ron DeSantis on Tuesday reaffirmed his commitment to keeping restaurants open and criticizing other areas of the country like New York City where indoor dining has been suspended despite evidence that most coronavirus infections can be traced to …,https://www.foxnews.com/us/florida-desantis-restaurants-nyc-in-door-dining-shutdown,https://static.foxnews.com/foxnews.com/content/uploads/2020/12/desantis-at-steakhouse.jpg,2020-12-16T17:18:16Z,Florida Gov. Ron DeSantis on Tuesday reaffirmed his commitment to keeping restaurants open and criticizing other areas of the country like New York City where indoor dining has been suspended despite… [+3798 chars],fox-news,Fox News
Greg Norman,"Indiana police officers distribute hundreds of boxes of food, toys to families in need",The South Bend Police Department is helping spread holiday cheer for hundreds of families in need in Indiana.,https://www.foxnews.com/us/indiana-police-officers-salvation-army-event,https://cf-images.us-east-1.prod.boltdns.net/v1/static/694940094001/c4a4c8a2-ac5d-4682-ba91-73a1800d67f1/aa0cc224-d8c0-4d33-964d-a8f3fa051b8d/1280x720/match/image.jpg,2020-12-16T17:16:06Z,"The South Bend Police Department is helping spread holiday cheer for hundreds of families in need in Indiana.  
Its officers volunteered to hand out boxes of food and toys to locals at the Salvation… [+932 chars]",fox-news,Fox News
Stephanie Giang-Paunon,"Owner of NYC's oldest restaurant slams Cuomo’s coronavirus indoor dining ban, says business may not survive",A New York City restaurant owner said Gov. Andrew Cuomo’s latest coronavirus restrictions could be the final nail in the coffin for his business.,https://www.foxnews.com/politics/fraunces-tavern-cuomo-covid-indoor-dining-ban,https://static.foxnews.com/foxnews.com/content/uploads/2020/11/Cuomo.jpg,2020-12-16T17:13:09Z,"A New York City restaurant owner said Gov. Andrew Cuomo’s latest coronavirus restrictions could be the final nail in the coffin for his business.
Cuomo recently warned state residents should prepare… [+1711 chars]",fox-news,Fox News
Janine Puhak,"TikTok star, a former flight attendant, reveals why passengers shouldn't accept vouchers after being bumped",Flight of fancy?,https://www.foxnews.com/travel/tiktok-star-former-flight-attendant-reveals-passengers-claims,https://static.foxnews.com/foxnews.com/content/uploads/2020/12/iStock-1256135387.jpg,2020-12-16T17:12:55Z,"Flight of fancy?
A former flight attendant has gone viral for sharing candid tips and tricks on travel, notably explaining why passengers should push to receive cash in lieu of airline vouchers if t… [+1781 chars]",fox-news,Fox News
Katherine Tague,Securing The Cloud: CEO Avi Shua of Orca Security,"This week, Liz is joined by the CEO & Co-Founder of Orca Security, Avi Shua. Avi discusses how his time in the Israeli intelligence led him to found company Orca, what listeners need to know about our modern technological environment, and how Orca has faced t…",https://radio.foxnews.com/2020/12/16/securing-the-cloud-ceo-avi-shua-of-orca-security/,https://radio.foxnews.com/wp-content/uploads/2020/03/FEATURED_IMAGE_EVERYONE_TALKS_TO_LIZ-2.jpg,2020-12-16T17:00:01Z,"Host of FOX Business' The Claman Countdown, Liz Claman is joined by the CEO &amp; Co-Founder of Orca Security, Avi Shua.
When Avi was 13 years old, he received his first computer and became interest… [+530 chars]",fox-news,Fox News
Katherine Tague,Securing The Cloud: CEO Avi Shua of Orca Security,"This week, Liz is joined by the CEO & Co-Founder of Orca Security, Avi Shua. Avi discusses how his time in the Israeli intelligence led him to found company Orca, what listeners need to know about our modern technological environment, and how Orca has faced t…",https://radio.foxnews.com/2020/12/16/securing-the-cloud-ceo-avi-shua-of-orca-security/,https://radio.foxnews.com/wp-content/uploads/2020/03/FEATURED_IMAGE_EVERYONE_TALKS_TO_LIZ-2.jpg,2020-12-16T17:00:01Z,"Host of FOX Business' The Claman Countdown, Liz Claman is joined by the CEO &amp; Co-Founder of Orca Security, Avi Shua.
When Avi was 13 years old, he received his first computer and became interest… [+530 chars]",fox-news,Fox News
Associated Press,Drop in new coronavirus cases in some Midwestern states offers signs of hope,"After a punishing fall that left hospitals struggling, some Midwestern states are seeing a decline in new coronavirus cases.",https://www.foxnews.com/health/drop-in-new-coronavirus-cases-in-some-midwestern-states,https://static.foxnews.com/foxnews.com/content/uploads/2020/12/60743396-covid-positive-.jpg,2020-12-16T16:45:30Z,"After a punishing fall that left hospitals struggling, some Midwestern states are seeing a decline in new coronavirus cases. But the signs of improvement are offset by the virus’s accelerating spread… [+4965 chars]",fox-news,Fox News
Jessica Napoli,Lily James and Sebastian Stan to play Pamela Anderson and Tommy Lee in Hulu series,The real-life couple married in 1995 and divorced in 1998.,https://www.foxnews.com/entertainment/lily-james-sebastian-stan-play-pamela-anderson-tommy-lee-hulu-series,https://static.foxnews.com/foxnews.com/content/uploads/2020/12/Stan-Knightly.jpg,2020-12-16T16:38:57Z,"One of Hollywood's most infamous couples is getting the streaming series treatment.
Lily James and Sebastian Stan are playing ""Baywatch"" star Pamela Anderson and Mötley Crüe drummer Tommy Lee in an … [+1578 chars]",fox-news,Fox News
Joshua Nelson,NYC bar owner calls for 'federal relief' as coronavirus sees restaurants struggle,New York's recent call to halt outdoor dining ahead of a major snowstorm expected to sweep the city adds more problems to the current indoor dining ban intended to prevent coronavirus spread.,https://www.foxnews.com/politics/new-york-bar-owner-federal-relief-dining-ban,https://static.foxnews.com/foxnews.com/content/uploads/2020/12/AP20344020749825.jpg,2020-12-16T16:38:38Z,"The new call to halt outdoor dining in New York City ahead of a major snowstorm adds more problems for restaurants already struggling to stay in business amid the coronavirus pandemic.
""No one is tr… [+2006 chars]",fox-news,Fox News
Tyler McCarthy,Taylor Swift gets into hilarious Twitter exchange with 'The Office' star Rainn Wilson,"Taylor Swift got into a hilarious Twitter exchange with one of the stars of her favorite show, “The Office.”",https://www.foxnews.com/entertainment/taylor-swift-hilarious-twitter-office-rainn-wilson,https://static.foxnews.com/foxnews.com/content/uploads/2020/12/Swift-Wilson-AP-Getty1.jpg,2020-12-16T16:37:25Z,"Taylor Swift got into a hilarious Twitter exchange with one of the stars of her favorite show, “The Office.” 
The artist recently surprised all of her fans by dropping “Evermore,” her second album o… [+2130 chars]",fox-news,Fox News
Chris Ciaccia,Chicken-sized dinosaur had 'mane of long fur' and other bizarre features never before seen in nature,A dinosaur the size of a chicken has been discovered that researchers say has features unlike anything seen before in the fossil record.,https://www.foxnews.com/science/chicken-sized-dinosaur-mane-fur-feathers,https://static.foxnews.com/foxnews.com/content/uploads/2020/12/martill-ubirajara-whole-image-reduced.jpg,2020-12-16T16:20:41Z,"A dinosaur the size of a chicken has been discovered that researchers say has features unlike anything seen before in the fossil record.
The ancient creature, known as Ubirajara jubatus, lived appro… [+2759 chars]",fox-news,Fox News
Adam Shaw,Nikki Haley to campaign for Kelly Loeffler in key Georgia Senate race,"EXCLUSIVE: Former U.N. Ambassador Nikki Haley will campaign for Sen. Kelly Loeffler, R-Ga., in a tour of the state on Sunday -- ahead of the state’s runoff races on Jan 5.",https://www.foxnews.com/politics/nikki-haley-kelly-loeffler-georgia-senate-race,https://static.foxnews.com/foxnews.com/content/uploads/2020/08/AP20238087865287-1.jpg,2020-12-16T16:18:17Z,"EXCLUSIVE: Former U.N. Ambassador Nikki Haley will campaign for Sen. Kelly Loeffler, R-Ga., in a tour of the state on Sunday -- ahead of the state’s runoff races on Jan 5.
Haley will join Loeffler f… [+2638 chars]",fox-news,Fox News
Michael Hollan,Teen Kansas hunter's 42-point buck confirmed as world record,It didn’t take long for this hunter to start setting world records.,https://www.foxnews.com/great-outdoors/teen-kansas-girls-record-breaking-42-buck-confirmed,https://static.foxnews.com/foxnews.com/content/uploads/2020/12/iStock-1044783528.jpg,2020-12-16T16:10:06Z,"It didn’t take long for this hunter to start setting world records.
A 14-year-old girl has set a world record after taking down a buck with 42-scorable points. Now, the teen holds the record for the… [+1648 chars]",fox-news,Fox News
Jeanette Settembre,Ikea selling tiny homes during COVID-19 pandemic as more Americans leave cities,Ikea's Tiny Home project is selling small homes built for downsizing.,https://www.foxnews.com/lifestyle/ikea-tiny-homes,https://static.foxnews.com/foxnews.com/content/uploads/2020/04/IKEAIstock.jpg,2020-12-16T16:10:03Z,"The tiny home trend keeps getting bigger. 
Swedish furniture retailer Ikea is the latest to launch customized trailers with everything a homeowner needs to live their best life. That includes eco-fr… [+1575 chars]",fox-news,Fox News
Alexandria Hein,WWII POW gets Birmingham's first COVID-19 vaccine,"A 94-year-old World War II veteran and prisoner of war rolled up his sleeves on Tuesday and became the first person in Birmingham, Ala., to receive the COVID-19 vaccine.",https://www.foxnews.com/health/wwii-pow-gets-birminghams-first-covid-19-vaccine,https://static.foxnews.com/foxnews.com/content/uploads/2020/12/iStock-1223827873.jpg,2020-12-16T16:07:37Z,"A 94-year-old World War II veteran and prisoner of war rolled up his sleeves on Tuesday and became the first person in Birmingham, Ala., to receive the COVID-19 vaccine. Lee Elm Creel told AL.com tha… [+1426 chars]",fox-news,Fox News
Joshua Nelson,Lara Logan: Big Tech showed its 'true colors' with support for Joe Biden,"The donations by Big Tech executives to President-elect Joe Biden’s campaign were “strategic,” Fox Nation host Lara Logan said Wednesday.",https://www.foxnews.com/media/lara-logan-biden-campaign-donations-big-tech-giants,https://static.foxnews.com/foxnews.com/content/uploads/2020/12/logan.jpg,2020-12-16T16:03:31Z,"The donations by Big Tech executives to President-elect Joe Biden’s campaign were “strategic,” Fox Nation host Lara Logan said Wednesday.
“This was actually a plan that was thought out by Media Matt… [+3312 chars]",fox-news,Fox News
Danielle Wallace,"Boy abandoned at Mississippi Goodwill prompts Christmas gift donations, spotlights pandemic-era child abuse",National media coverage about a 2-year-old boy left abandoned at a Goodwill in Mississippi has helped shed light on issues of child abuse and neglect during the pandemic. It has also caused a spike in inquiries from around the country from those wanting to pu…,https://www.foxnews.com/us/mississippi-goodwill-abandoned-boy-christmas-gift-donations-pandemic-child-abuse,https://static.foxnews.com/foxnews.com/content/uploads/2020/12/Southaven-Police-Dept-1.jpg,2020-12-16T19:52:42Z,National media coverage about a 2-year-old boy left abandoned at a Goodwill in Mississippi has helped shed light on issues of child abuse and neglect during the pandemic. It has also caused a spike i… [+5400 chars],fox-news,Fox News
Jessica Napoli,Director Oliver Stone reveals he's taken Russian coronavirus vaccine: 'I've heard good things',The filmmaker said he needs to get a second shot in about 45 days.,https://www.foxnews.com/entertainment/oliver-stone-taken-russian-coronavirus-vaccine,https://static.foxnews.com/foxnews.com/content/uploads/2020/07/Oliver-Stone.jpg,2020-12-16T19:52:17Z,"Director Oliver Stone has gotten vaccinated for the coronavirus. 
The Oscar-winning filmmaker told Russia’s Channel One in a video obtained by the Associated Press: ""I got a vaccine shot, yeah.
""I … [+1514 chars]",fox-news,Fox News
Julia Musto,Trump campaign poll asks if he should run for president in 2024,"In a Tuesday email, President Trump's campaign wrote to supporters asking if he should run for office again in 2024.",https://www.foxnews.com/politics/trump-campaign-fundraising-poll-asks-whether-trump-should-run-in-2024,https://static.foxnews.com/foxnews.com/content/uploads/2020/12/AP20342667244606.jpg,2020-12-16T19:51:53Z,"President Trump'scampaign is asking supporters whether he should run for office again in 2024 in an e-mail that simultaneously seeks help keeping Republicans in control of the Senate.
In concert wit… [+1966 chars]",fox-news,Fox News
Evie Fordham,Georgia secretary of state orders study of mail-in ballot signatures after Trump pressure,Georgia Secretary of State Brad Raffensperger said Wednesday that there will be a statewide signature match study after pressure from President Trump and his supporters.,https://www.foxnews.com/politics/georgia-secretary-of-state-mail-in-ballot-signatures-trump-study,https://static.foxnews.com/foxnews.com/content/uploads/2020/11/AP20316600847662.jpg,2020-12-16T19:42:36Z,"Georgia Secretary of State Brad Raffensperger said Wednesday that there will be a statewide signature match study after pressure from President Trump and his supporters.
""This team will work to rest… [+2934 chars]",fox-news,Fox News
