author,title,description,url,urlToImage,publishedAt,content,source.id,source.name
Sarah Binder,Congress can’t easily pass police reforms. Here’s why.,Public attention will shift — and the Republican Senate will ignore House action.,https://www.washingtonpost.com/politics/2020/06/05/congress-cant-easily-pass-police-reforms-heres-why/,https://www.washingtonpost.com/wp-apps/imrs.php?src=https://arc-anglerfish-washpost-prod-washpost.s3.amazonaws.com/public/SUWKLXFGWAI6VCMOWINZVA7XSI.jpg&w=1440,2020-06-05T11:45:00Z,"Still, reformers on Capitol Hill face a tough road, especially if and when media attention to the protests wanes. Differences between and within the parties coupled with the underrepresentation of bl… [+6368 chars]",the-washington-post,The Washington Post
Paige Winfield Cunningham,The Health 202: Protecting U.S. nursing homes would have significantly slashed coronavirus deaths,Updated government data show the steep toll on the nation’s elderly.,https://www.washingtonpost.com/news/powerpost/paloma/the-health-202/2020/06/05/the-health-202-protecting-u-s-nursing-homes-would-have-significantly-slashed-coronavirus-deaths/5ed8f831602ff12947e843f9/,https://www.washingtonpost.com/pbox.php?url=https://palomaimages.washingtonpost.com/pr2/9d6a161d4e9385addc1981c149538b1f-F37BEHEWBYI6VB5DELJSII2WGY-680-453-70-8.jpg&w=1484&op=resize&opt=1&filter=antialias&t=20170517,2020-06-05T11:37:44Z,,the-washington-post,The Washington Post
Carley Petesch | AP,"UN says eastern Congo fighting has killed 1,300 civilians","The United Nations says various conflicts involving armed groups and government forces in Congo have killed more than 1,300 civilians in the past eight months and violence has surged in recent weeks in eastern provinces",https://www.washingtonpost.com/world/africa/un-says-eastern-congo-fighting-has-killed-1300-civilians/2020/06/05/9ec2daa6-a720-11ea-898e-b21b9a83f792_story.html,https://www.washingtonpost.com/wp-apps/imrs.php?src=&w=1440,2020-06-05T11:35:14Z,"I am appalled by the increase in brutal attacks on innocent civilians by armed groups, and by the reaction of the military and security forces who have also committed grave violations, including kill… [+3515 chars]",the-washington-post,The Washington Post
Joseph Marks,The Cybersecurity 202: Attempted hacks of Trump and Biden campaigns reveal a race to disrupt the 2020 general election,Google’s revelations are likely just the tip of the spear.,https://www.washingtonpost.com/politics/the-cybersecurity-202-attempted-hacks-of-trump-and-biden-campaigns-reveal-a-race-to-disrupt-the-2020-general-election/2020/06/05/8eb45c61-54be-4b5a-89e4-965ea8d56759_story.html?utm_source=rss&utm_medium=referral&utm_campaign=wp_politics,,2020-06-05T11:29:31Z,,the-washington-post,The Washington Post
Thomas Adamson and Angela Charlton | AP,Floyd case restokes anger over French custody death,"U.S. protests over George Floyd's death have rekindled anger in France over police violence, entrenched racism, and the complicated case of Adama Traore",https://www.washingtonpost.com/world/the_americas/floyd-case-restokes-anger-over-french-custody-death/2020/06/05/af602f4a-a71f-11ea-898e-b21b9a83f792_story.html,https://www.washingtonpost.com/wp-apps/imrs.php?src=&w=1440,2020-06-05T11:28:32Z,"During the coronavirus, people had a pause in their lives. They filmed scenes of police violence and they realized they were living in a country where there is violence every day against people of co… [+5106 chars]",the-washington-post,The Washington Post
Samy Magdy | AP,Libya official: Tripoli units take key town with Turks' help,Forces allied with the U.N.-supported government in Libya say they have retaken another key western town from rival forces,https://www.washingtonpost.com/world/africa/libya-official-tripoli-units-take-key-town-with-turks-help/2020/06/05/168a3568-a71f-11ea-898e-b21b9a83f792_story.html,https://www.washingtonpost.com/wp-apps/imrs.php?src=&w=1440,2020-06-05T11:24:16Z,"Tarhouna served as a main stronghold for commander Khalifa Hifters east-based forces in their campaign to capture Tripoli from the west-based Government of National Accord. Hifter, who leads the self… [+1749 chars]",the-washington-post,The Washington Post
Geoffrey A. Fowler,How to spot misinformation and stop its spread,"A citizen’s guide to not helping trolls, bots and other online disinformers during turbulent times",https://www.washingtonpost.com/technology/2020/06/05/stop-spreading-misinformation/,https://www.washingtonpost.com/wp-apps/imrs.php?src=https://arc-anglerfish-washpost-prod-washpost.s3.amazonaws.com/public/FM2OMCHSLRARDLPMIYUYS2ASZA.jpg&w=1440,2020-06-05T11:20:54Z,"To avoid being taken advantage of, we need to learn their ways and learn some new techniques of our own to challenge what we see on Twitter, Facebook, Instagram, WhatsApp, YouTube, Reddit and Nextdoo… [+11250 chars]",the-washington-post,The Washington Post
Gerry Shih,"Chinese soccer superstar calls for ouster of Communist Party, stunning nation","Hao Haidong, a retired striker for the national team, records video message saying the authoritarian regime in Beijing should be ""kicked out of humanity.""",https://www.washingtonpost.com/world/asia_pacific/chinese-soccer-superstar-hao-haidong-calls-for-ouster-of-communist-party-stunning-nation/2020/06/05/9ae91df2-a6ec-11ea-898e-b21b9a83f792_story.html,https://www.washingtonpost.com/wp-apps/imrs.php?src=https://arc-anglerfish-washpost-prod-washpost.s3.amazonaws.com/public/N4VL7RFHBUI6VNQZH6ITHO5UQI.jpg&w=1440,2020-06-05T11:14:51Z,"In a highly unusual YouTube appearance as part of an apparent publicity campaign by the fugitive billionaire Guo Wengui, one of the Chinese governments most reviled opponents, Hao read an 18-point ma… [+4222 chars]",the-washington-post,The Washington Post
David Rising | AP,Germany investigating McCann suspect in another case,German prosecutors have opened an investigation into whether a 43-year-old who has emerged as a possible suspect in the disappearance of British girl Madeleine McCann in Portugal may have been involved in a similar crime in Germany,https://www.washingtonpost.com/world/europe/germany-investigating-mccann-suspect-in-another-case/2020/06/05/93935ed8-a71d-11ea-898e-b21b9a83f792_story.html,https://www.washingtonpost.com/wp-apps/imrs.php?src=&w=1440,2020-06-05T11:13:26Z,"Authorities have not released the suspects name, but he has been widely identified by the German media as Christian B. He reportedly had a property 100 kilometers (60 miles) southwest of Stendal in t… [+1647 chars]",the-washington-post,The Washington Post
Abha Bhattarai,"For many black business owners, importance of protests overshadows cost of rebuilding - The Washington Post","“Sometimes you have to tear something down to build a fresh foundation,” says Marshe Wyche, whose Virginia shop was vandalized during a demonstration tied to the death of George Floyd.",https://www.washingtonpost.com/business/2020/06/05/many-black-business-owners-importance-protests-overshadows-cost-rebuilding/,https://www.washingtonpost.com/wp-apps/imrs.php?src=https://arc-anglerfish-washpost-prod-washpost.s3.amazonaws.com/public/LMEEAXVGMEI6VCMOWINZVA7XSI.jpg&w=1440,2020-06-05T11:07:17Z,"To see my store smashed in it was really scary, said Wyche, 35, who is black. But at the same time, I am those protesters: I look like them, Im angry like them. I understand.
Businesses across the c… [+8064 chars]",the-washington-post,The Washington Post
DeNeen L. Brown,A history lesson for Trump: Lafayette Square was once a politician market - The Washington Post,"<ol><li>A history lesson for Trump: Lafayette Square was once a politician market  The Washington Post
</li><li>Protesters Came Out Again In Washington, D.C. — And Some Stayed, Despite Thunderstorm  NPR
</li><li>Protests continue outside the White House as memor…",https://www.washingtonpost.com/history/2020/06/05/lafayette-square-politician-market-dc-protests/,https://www.washingtonpost.com/wp-apps/imrs.php?src=https://arc-anglerfish-washpost-prod-washpost.s3.amazonaws.com/public/WQRLJAVFIII6VCMOWINZVA7XSI.jpg&w=1440,2020-06-05T11:05:04Z,"Enpoliticiand people helped build the White House. At least eight of the first 12 presidents brought enpoliticiand people with them to labor at 1600 Pennsylvania Ave., according to the White House Historical A… [+3457 chars]",the-washington-post,The Washington Post
Meagan Flynn,Tacoma mayor demands officers be fired after unarmed black man Manuel Ellis died in handcuffs on the ground - Washington Post,"<ol><li>Tacoma mayor demands officers be fired after unarmed black man Manuel Ellis died in handcuffs on the ground  Washington Post
</li><li>Death of black man in Tacoma police custody ruled a homicide  CBS News
</li><li>Manuel Ellis' mother speaks about t…",https://www.washingtonpost.com/nation/2020/06/05/tacoma-mayor-manuel-ellis/,https://www.washingtonpost.com/wp-apps/imrs.php?src=https://arc-anglerfish-washpost-prod-washpost.s3.amazonaws.com/public/3MBTKOFGUMI6VCMOWINZVA7XSI.jpg&w=1440,2020-06-05T11:01:00Z,"New video footage of the violent arrest emerged late Thursday night, showing Tacoma police officers beating Ellis on the side of the road. The footage, provided by the Tacoma Action Collective, also … [+4218 chars]",the-washington-post,The Washington Post
George Will,A 1946 lynching is still haunting us,The most lurid crime in the year that lit the fuse that blew up Jim Crow.,https://www.washingtonpost.com/opinions/a-1946-lynching-is-still-haunting-us/2020/06/04/f08e541c-a6a0-11ea-bb20-ebf0921f3bbd_story.html,https://www.washingtonpost.com/wp-apps/imrs.php?src=https://arc-anglerfish-washpost-prod-washpost.s3.amazonaws.com/public/NEE7NJBOLMI6TCWTTJNRCPWNHQ.jpg&w=1440,2020-06-05T11:00:00Z,"On July 25, 1946, Roger Malcom, a 24-year-old black man, was released from jail on bail after the charge against him was reduced from murder to attempted murder because the white man he had allegedly… [+4427 chars]",the-washington-post,The Washington Post
The Washington Post,"What to watch with your kids: ‘The Not-Too-Late Show With Elmo,’ ‘Spelling the Dream’ and more",Here’s what parents need to know.,https://www.washingtonpost.com/goingoutguide/movies/what-to-watch-with-your-kids-the-not-too-late-show-with-elmo-spelling-the-dream-and-more/2020/06/03/bd8461d0-a41e-11ea-b473-04905b1af82b_story.html,https://www.washingtonpost.com/wp-apps/imrs.php?src=https://arc-anglerfish-washpost-prod-washpost.s3.amazonaws.com/public/2DKHCLVBHQI6VAN3YL3Q6AIDJM.jpg&w=1440,2020-06-05T11:00:00Z,"Available via HBO Max.
Spelling the Dream (Unrated)
Streaming
Upbeat celebration of outstanding kids who spell to win.
Spelling the Dream is a documentary that spotlights four first-generation In… [+3141 chars]",the-washington-post,The Washington Post
"A. Odysseus Patrick, Max Bearak","Winter is coming south of the equator, along with predictions of the coronavirus spreading","As the rest of the world reopens, scientists from the Southern Hemisphere urge caution.",https://www.washingtonpost.com/world/winter-is-coming-south-of-the-equator-along-with-predictions-of-the-coronavirus-spreading/2020/06/04/c0dd4c92-a4c9-11ea-898e-b21b9a83f792_story.html,https://www.washingtonpost.com/wp-apps/imrs.php?src=https://arc-anglerfish-washpost-prod-washpost.s3.amazonaws.com/public/LSVWALVFXYI6VNDTASIFWGXYFM.jpg&w=1440,2020-06-05T11:00:00Z,"We need to be thinking if its wintertime, it could be covid-19 time, said Michael Ward, an epidemiologist in the University of Sydneys School of Veterinary Science, in a statement. Ward and colleague… [+5729 chars]",the-washington-post,The Washington Post
Michael Tesler,The Floyd protests will likely change public attitudes about race and policing. Here’s why.,The last wave of Black Lives Matter protests did — especially among young people.,https://www.washingtonpost.com/politics/2020/06/05/floyd-protests-will-likely-change-public-attitudes-about-race-policing-heres-why/,https://www.washingtonpost.com/wp-apps/imrs.php?src=https://arc-anglerfish-washpost-prod-washpost.s3.amazonaws.com/public/5G7TFTVGWMI6VCMOWINZVA7XSI.jpg&w=1440,2020-06-05T11:00:00Z,"But the violent urban unrest in the second half of the 1960s prompted white backlash. In fact, these violent uprisings loom large in researchers theories of modern prejudice and how its influenced U.… [+4975 chars]",the-washington-post,The Washington Post
Dana Hedgpeth,Live updates: White House and Bowser clash over control of city streets; demonstrations evolve on seventh day of D.C. protests - The Washington Post,"<ol><li>Live updates: White House and Bowser clash over control of city streets; demonstrations evolve on seventh day of D.C. protests  The Washington Post
</li><li>Trump’s Bible photo op splits white evangelical loyalists into two camps  The Guardian
</li>…",https://www.washingtonpost.com/dc-md-va/2020/06/05/live-updates-white-house-bowser-clash-over-control-city-streets-demonstrations-evolve-seventh-day-dc-protests/,https://www.washingtonpost.com/wp-apps/imrs.php?src=https://d1i4t8bqe7zgj6.cloudfront.net/06-05-2020/t_d5ce5b7f7f634e16b2126e8ae760097d_name_c9357186_a6d0_11ea_898e_b21b9a83f792.jpg&w=1440,2020-06-05T10:54:39Z,"At just before 11 p.m. Thursday, a crowd of protesters arrived at the Lincoln Memorial, where they were met by a cluster of U.S. Park Police officers, who stood on the steps behind a metal barricade.… [+3232 chars]",the-washington-post,The Washington Post
Jacqueline Alemany,Power Up: Protesters ‘defund the police’ rallying cry is achieving some progress,"Meanwhile, the White House is becoming a fortress.",https://www.washingtonpost.com/news/powerpost/paloma/powerup/2020/06/05/powerup-protesters-defund-the-police-rallying-cry-is-achieving-some-progress/5ed98153602ff12947e84cbd/,https://www.washingtonpost.com/pbox.php?url=https://palomaimages.washingtonpost.com/pr2/82564423e41fa07add3114c450527470-EIQLPLVF5AI6VCMOWINZVA7XSI-680-453-70-8.jpg&w=1484&op=resize&opt=1&filter=antialias&t=20170517,2020-06-05T10:41:06Z,,the-washington-post,The Washington Post
Wiley Miller,"Non Sequitur for Friday, June 05, 2020","Comics - Washington Post comics, Tom Toles, Cul de Sac and editorial cartoons. Web comics including Archie, Family Circus, Marmaduke, Over the Hedge, Soup to Nutz, The Buckets and more.",http://wpcomics.washingtonpost.com/client/wpc/nq/2020/06/05/,,2020-06-05T10:38:02Z,,the-washington-post,The Washington Post
Associated Press,Elephant dies in India after eating explosive-stuffed fruit,Indian police have arrested a man accused of causing the death of a pregnant elephant that died after biting a pineapple stuffed with firecrackers that exploded in its mouth,https://www.washingtonpost.com/world/asia_pacific/elephant-dies-in-india-after-eating-explosive-stuffed-fruit/2020/06/05/4331565c-a718-11ea-898e-b21b9a83f792_story.html,https://www.washingtonpost.com/wp-apps/imrs.php?src=&w=1440,2020-06-05T10:35:24Z,"Details of the suspect were not immediately available.
The state forest department announced the arrest and said it is investigating whether he was a poacher or a farmer who wanted to kill the eleph… [+768 chars]",the-washington-post,The Washington Post
Associated Press,Macron makes new call for Iran to release detained academic,French President Emmanuel Macron has made a fresh call for Iran to immediately release a French-Iranian researcher,https://www.washingtonpost.com/world/europe/macron-makes-new-call-for-iran-to-release-detained-academic/2020/06/05/ec358a22-a716-11ea-898e-b21b9a83f792_story.html,https://www.washingtonpost.com/wp-apps/imrs.php?src=&w=1440,2020-06-05T10:25:49Z,"In March, a prisoner exchange was carried out between Iran and France, swapping researcher Roland Marchal for engineer Jalal Ruhollahnejad. But there has been little indication that Adelkhah will sim… [+376 chars]",the-washington-post,The Washington Post
Associated Press,"News agency: Iranian ship sinks in Iraqi waters, 1 dead",Iran's state-run IRNA news agency reports that an Iranian cargo ship has sunk in Iraqi waters and at least one crew member is dead and two others missing,https://www.washingtonpost.com/world/middle_east/news-agency-iranian-ship-sinks-in-iraqi-waters-1-dead/2020/06/05/56956bd8-a714-11ea-898e-b21b9a83f792_story.html,https://www.washingtonpost.com/wp-apps/imrs.php?src=&w=1440,2020-06-05T10:07:19Z,"Officials said it was not immediately clear why the vessel, which had a crew of seven, went down.
Pasandeh said Iran was consulting with Iraq to dispatch teams of marine experts to the scene. He sai… [+496 chars]",the-washington-post,The Washington Post
Eli Rosenberg,May 2020 jobs report: Unemployment rate expected close to 20 percent,May 2020 jobs report: Unemployment rate expected close to 20 percentwashingtonpost.com,https://www.washingtonpost.com/business/2020/06/05/may-2020-jobs-report/,https://www.washingtonpost.com/wp-apps/imrs.php?src=https://arc-anglerfish-washpost-prod-washpost.s3.amazonaws.com/public/Y73DPEFB3QI6VPQGV5KRJ3QDQU.jpg&w=1440,2020-06-05T10:06:14Z,These figures signal the U.S. economy is beginning to bottom out. Yet the 30 million workers who are still collecting unemployment benefits is a sign of how significantly the labor market has been up… [+4997 chars],the-washington-post,The Washington Post
Associated Press,Ex-Swedish envoy on trial for alleged contacts with China,Sweden's former ambassador to China has gone on trial for alleged unauthorized contacts with a foreign power,https://www.washingtonpost.com/world/national-security/ex-swedish-envoy-on-trial-for-alleged-contacts-with-china/2020/06/05/0b19eb66-a714-11ea-898e-b21b9a83f792_story.html,https://www.washingtonpost.com/wp-apps/imrs.php?src=&w=1440,2020-06-05T10:05:12Z,"Swedens Foreign Ministry said it had no advance knowledge of the January 2019 meeting arranged by former Swedish Ambassador to China Anna Lindstedt, who was summoned home for an investigation the fol… [+1721 chars]",the-washington-post,The Washington Post
"Gabriele Magni, Andrew Reynolds",Pelosi called Trump ‘morbidly obese.’ Voters don’t like overweight candidates.,Our new study looks at how weight matters in politics.,https://www.washingtonpost.com/politics/2020/06/05/pelosi-called-trump-morbidly-obese-voters-dont-like-overweight-candidates/,https://www.washingtonpost.com/wp-apps/imrs.php?src=https://arc-anglerfish-washpost-prod-washpost.s3.amazonaws.com/public/FF4BY4E6AEI6VPQGV5KRJ3QDQU.jpg&w=1440,2020-06-05T10:00:00Z,"Pelosi no doubt was trying to get under the presidents skin and Trump fired back, saying that Pelosi has mental issues. Some commentators accused her of fat shaming.
But Pelosis comments, as well as… [+4426 chars]",the-washington-post,The Washington Post
Karel Janicek | AP,Czech PM: Russian diplomat spread fake report of poison plot,The Czech Republic's prime minister says his country's spy agency has discovered that a diplomat from the Russian Embassy in Prague spread false information about a Russian assassin arriving to allegedly poison the Czech capital's mayors,https://www.washingtonpost.com/world/national-security/czech-pm-russian-diplomat-spread-fake-report-of-poison-plot/2020/06/05/aad8e60c-a732-11ea-898e-b21b9a83f792_story.html,https://www.washingtonpost.com/wp-apps/imrs.php?src=&w=1440,2020-06-05T13:44:25Z,"One of them sent to our counter-intelligence service false information about a planned attack against Czech politicians, he said.
Babis said the action further complicated Czech-Russian relations. C… [+3004 chars]",the-washington-post,The Washington Post
Associated Press,"Dubai: Dane involved in Sweden, Spain gang crime arrested","A Danish national who allegedly is involved in gang-related crime in southern Sweden, and killings and explosions in Spain has been arrested in Dubai",https://www.washingtonpost.com/world/europe/dubai-dane-involved-in-sweden-spain-gang-crime-arrested/2020/06/05/3867d600-a732-11ea-898e-b21b9a83f792_story.html,https://www.washingtonpost.com/wp-apps/imrs.php?src=&w=1440,2020-06-05T13:41:13Z,"The statement added that preparations are underway to hand him over to the relevant authorities. It was not clear whether he was to be extradited and to which country.
The Swedish daily Expressen sa… [+1056 chars]",the-washington-post,The Washington Post
Christian Davenport,Trump campaign ad pulled after complaints it politicized space,Trump campaign ad pulled after complaints it politicized spacewashingtonpost.com,https://www.washingtonpost.com/technology/2020/06/05/trump-campaign-nasa-ad-pulled/,https://www.washingtonpost.com/wp-apps/imrs.php?src=https://arc-anglerfish-washpost-prod-washpost.s3.amazonaws.com/public/RBPGBGFDCMI6VPQGV5KRJ3QDQU.jpg&w=1440,2020-06-05T13:33:44Z,"On Twitter, Karen Nyberg, a former astronaut and wife of Doug Hurley, who was carried to the International Space Station by the SpaceX launch, blasted the advertisement, saying she found it disturbin… [+2604 chars]",the-washington-post,The Washington Post
Taylor Telford,Stocks soar after surprise drop in U.S. unemployment rate,Investors rejoiced after the Labor Department reported May unemployment fell to 13.3 percent — a far cry from the 19.5 percent analysts had forecast and a sharp improvement from the 14.7 percent set in April.,https://www.washingtonpost.com/business/2020/06/05/stocks-market-today-coronavirus-economy/,https://www.washingtonpost.com/wp-apps/imrs.php?src=https://arc-anglerfish-washpost-prod-washpost.s3.amazonaws.com/public/R6IEYMVGPEI6VCMOWINZVA7XSI.jpg&w=1440,2020-06-05T13:32:17Z,"More than 2.5 million jobs were added to non-farm payrolls, data show. About half the gains were in restaurants and bars, a sector of the economy that has been among the hardest-hit as social distanc… [+2843 chars]",the-washington-post,The Washington Post
Jennifer Rubin,The military and the media rose to defend democracy. But will the courts?,Civil liberties are not self-effectuating.,https://www.washingtonpost.com/opinions/2020/06/05/military-media-rose-defend-democracy-will-courts/,https://www.washingtonpost.com/wp-apps/imrs.php?src=https://arc-anglerfish-washpost-prod-washpost.s3.amazonaws.com/public/WSUMVBVGUUI6VCMOWINZVA7XSI.jpg&w=1440,2020-06-05T13:30:29Z,The American Civil Liberties Union of the District of Columbia on Thursday announced it was filing a lawsuit arising from events on Monday: Protesters who were attacked with tear gas and other weapon… [+5888 chars],the-washington-post,The Washington Post
"Joseph Marks, The Washington Post",The Cybersecurity 202: Attempted hacks of Trump and Biden campaigns reveal a race to disrupt the 2020 general election - Thehour.com,"It's official: The race to hack the 2020 general election is in full swing. 
 Iran tried to hack into Gmail accounts used by President Donald Trump's reelection campaign staff, the leader of Google's threat-hunting team revealed in a tweet. China, meanwhile, …",https://www.washingtonpost.com/news/powerpost/paloma/the-cybersecurity-202/2020/06/05/the-cybersecurity-202-attempted-hacks-of-trump-and-biden-campaigns-reveal-a-race-to-disrupt-the-2020-general-election/5ed98eb6602ff12947e84d7c/,https://www.thehour.com/img/pages/article/opengraph_default.jpg,2020-06-05T13:24:00Z,"It's official: The race to hack the 2020 general election is in full swing.
Iran tried to hack into Gmail accounts used by President Donald Trump's reelection campaign staff, the leader of Google's … [+5787 chars]",the-washington-post,The Washington Post
Cat Zakrzewski,The Technology 202: Here’s what app downloads reveal about technology’s role in the protests,Citizen is the breakout app.,https://www.washingtonpost.com/news/powerpost/paloma/the-technology-202/2020/06/05/the-technology-202-here-s-what-app-downloads-reveal-about-technology-s-role-in-the-protests/5ed9541488e0fa32f8232b5c/,https://www.washingtonpost.com/pbox.php?url=https://palomaimages.washingtonpost.com/pr2/61f8de7903c10bc3cedea1af04eaf5a8-RZTOLTFGKII6VCMOWINZVA7XSI-680-453-70-8.jpg&w=1484&op=resize&opt=1&filter=antialias&t=20170517,2020-06-05T13:12:42Z,,the-washington-post,The Washington Post
Osagie K. Obasogie,Police killing black people is a public health crisis,Police killing black people is a public health crisiswashingtonpost.com,https://www.washingtonpost.com/outlook/police-violence-pandemic/2020/06/05/e1a2a1b0-a669-11ea-b619-3f9133bbb482_story.html,https://www.washingtonpost.com/wp-apps/imrs.php?src=https://arc-anglerfish-washpost-prod-washpost.s3.amazonaws.com/public/XUNG3IFFKYI6VCMOWINZVA7XSI.jpg&w=1440,2020-06-05T13:06:48Z,"Those social and political contexts also help explain another pandemic one that, like the coronavirus that still rages, is also disproportionately killing black Americans. Make no mistake: Police vio… [+9680 chars]",the-washington-post,The Washington Post
"Brittany Mayes, Aaron Blake, Kevin Uhrmacher",Who do you think Joe Biden should choose for VP?,"Biden committed to choosing a woman as his running mate. The potential picks include Stacey Abrams, Tammy Baldwin, Keisha Lance Bottoms, Val Demings, Tammy Duckworth, Kamala D. Harris, Amy Klobuchar, Michelle Lujan Grisham, Susan E. Rice,  Elizabeth Warren an…",https://www.washingtonpost.com/graphics/2020/politics/quiz-biden-vice-president-pick/,https://www.washingtonpost.com/wp-apps/imrs.php?src=https://arc-anglerfish-washpost-prod-washpost.s3.amazonaws.com/public/NTOKKKT6ZJFVHJPTW6FPYIRYNA.jpg&w=1200,2020-06-05T13:05:23Z,"Perhaps the next major event in the 2020 race for the presidency comes when former vice president Joe Biden, the presumptive Democratic nominee, decides on his running mate. Bidens decision, which he… [+889 chars]",the-washington-post,The Washington Post
