author,title,description,url,urlToImage,publishedAt,content,source.id,source.name
Ashok Sharma | AP,"India, China trying to end army standoff in Himalayas","Indian and Chinese foreign ministry officials discussed  the flaring of tensions on their disputed Himalayan border, where thousands of soldiers from the two countries have been facing off just a few hundred meters (yards) from each other for a month",https://www.washingtonpost.com/world/asia_pacific/india-china-trying-to-end-army-standoff-in-himalayas/2020/06/05/0ba9566e-a74d-11ea-898e-b21b9a83f792_story.html,https://www.washingtonpost.com/wp-apps/imrs.php?src=&w=1440,2020-06-05T16:53:14Z,An External Affairs Ministry statement in New Delhi said both sides agreed that they should handle their differences through peaceful discussion ``bearing in mind the importance of respecting each ot… [+1425 chars],the-washington-post,The Washington Post
Paul Waldman,Trump spins good jobs report to create fake impression that all is well,"All our problems have been solved, and the federal government can stand down.",https://www.washingtonpost.com/opinions/2020/06/05/trump-spins-good-jobs-report-create-fake-impression-that-all-is-well/,https://www.washingtonpost.com/wp-apps/imrs.php?src=https://arc-anglerfish-washpost-prod-washpost.s3.amazonaws.com/public/RB7N75FHIUI6VCMOWINZVA7XSI.jpg&w=1440,2020-06-05T16:39:13Z,"And he said of George Floyd, the man whose killing in Minneapolis touched off the nationwide protests against police brutality, Hopefully George is looking down right now and saying this is a great t… [+5060 chars]",the-washington-post,The Washington Post
Jeff Stein,"Touting new jobs numbers, Trump says strong economy will quell protests and racial divide","Touting new jobs numbers, Trump says strong economy will quell protests and racial dividewashingtonpost.com",https://www.washingtonpost.com/business/2020/06/05/trump-economy-jobs-report-race/,https://www.washingtonpost.com/wp-apps/imrs.php?src=https://arc-anglerfish-washpost-prod-washpost.s3.amazonaws.com/public/FIEPIWVHHMI6VCMOWINZVA7XSI.jpg&w=1440,2020-06-05T16:15:39Z,"The event was meant to celebrate unemployment figures, which came in better than expected but still showed a U.S. economy that is very weak, with the jobless rate at 13.3 percent. During the ceremony… [+3853 chars]",the-washington-post,The Washington Post
Adam Taylor,"As countries reopen, hundreds of millions of students have returned to school",Well beyond a billion students were sent home from schools as the novel coronavirus spread around the world.,https://www.washingtonpost.com/world/2020/06/05/coronavirus-countries-reopening-schools/,https://www.washingtonpost.com/wp-apps/imrs.php?src=https://arc-anglerfish-washpost-prod-washpost.s3.amazonaws.com/public/NCOWXPU72UI6VPQGV5KRJ3QDQU.jpg&w=1440,2020-06-05T16:12:03Z,"At the height of such measures in April, nearly 1.6 billion students were affected, according to UNESCO, with 194 countrywide closures. As of June 5, more than 1.1 billion students remain affected mo… [+8426 chars]",the-washington-post,The Washington Post
"Matthew Cappucci, Andrew Freedman","Tropical storm watches issued as Cristobal churns toward U.S. Gulf Coast, bringing widespread flood threat","Wind and storm surge are likely, but flooding rains are the most significant threat.",https://www.washingtonpost.com/weather/2020/06/05/tropical-storm-cristobal-gulf-coast-threat/,https://www.washingtonpost.com/resizer/puZoSPNC3yFIkpSEECNW9aqlViI=/1484x0/arc-anglerfish-washpost-prod-washpost.s3.amazonaws.com/public/MJWQSD2GIJEVPM5372EUDOQM3U.png,2020-06-05T16:09:36Z,"The United States is eyeing the second landfall of a tropical cyclone so far this young hurricane season, as Tropical Depression Cristobal spins northwards from the Bay of Campeche. After a dizzying … [+6170 chars]",the-washington-post,The Washington Post
Matthew Cappucci,Homes swallowed by sea in Norway landslide,There were no injuries or fatalities.,https://www.washingtonpost.com/weather/2020/06/05/norway-landslide/,https://www.washingtonpost.com/resizer/iaeYn1bwEM9xc8mcbQ9t3Paf57U=/1484x0/d1i4t8bqe7zgj6.cloudfront.net/thumbnails/5eda2bf552faff0001e9dbea/2020-06-05T111332Z_1_OVCH3N2O1_RTRMADC_0_NORWAY-LANDSLIDE-ROUGH-CUT.jpg,2020-06-05T19:46:53Z,"At least eight homes were swept into the sea following a destructive landslide in Norway on Wednesday. There were no injuries or fatalities, according to NBC News. The report said all people were acc… [+2262 chars]",the-washington-post,The Washington Post
Associated Press,Magnitude 5.0 earthquake shakes southeast Turkey,"A moderate earthquake that hit southeast Turkey sent people out into the streets in panic Friday, but there were no immediate reports of injuries or damage",https://www.washingtonpost.com/world/europe/magnitude-50-earthquake-shakes-southeast-turkey/2020/06/05/6f391caa-a761-11ea-898e-b21b9a83f792_story.html,https://www.washingtonpost.com/wp-apps/imrs.php?src=&w=1440,2020-06-05T19:19:11Z,"State-run Anadolu Agency reported that the earthquake was felt in several neighboring provinces and some people rushed out of their homes, fearing a building collapse.
We have not received any negat… [+594 chars]",the-washington-post,The Washington Post
Ariana Eunjung Cha,‘They are all linked’: George Floyd. Freddie Gray. Dar’Yana Dyson. - The Washington Post,"Anger, grief over toll of covid-19 and police violence spill out at Baltimore teen’s memorial service.",https://www.washingtonpost.com/health/2020/06/05/coronavirus-baltimore-race-police-violence/,https://www.washingtonpost.com/wp-apps/imrs.php?src=https://arc-anglerfish-washpost-prod-washpost.s3.amazonaws.com/public/T7A72UXOQVFUVGLAFSMI532ZVU.jpg&w=1440,2020-06-05T19:09:58Z,"The gathering for the youngest victim of the coronavirus so far in Maryland, Virginia or D.C. took place this week just a few miles from where thousands were marching at that very moment to protest t… [+12359 chars]",the-washington-post,The Washington Post
Jennifer Rubin,Biden got it right: Trump’s remarks were ‘despicable’,The president is warped and out of touch.,https://www.washingtonpost.com/opinions/2020/06/05/biden-got-it-right-trumps-remarks-were-despicable/,https://www.washingtonpost.com/wp-apps/imrs.php?src=https://arc-anglerfish-washpost-prod-washpost.s3.amazonaws.com/public/KSSLXOVHKII6VCMOWINZVA7XSI.jpg&w=1440,2020-06-05T19:04:42Z,"George Floyd is dead. It is hard to fathom what sort of a twisted man would use the name of someone the entire country has been mourning to promote himself. Once more, we are reminded that with Trump… [+2911 chars]",the-washington-post,The Washington Post
"Paul Sonne, Fenit Nirappil, Josh Dawsey","Pentagon disarms guardsmen in Washington, D.C., in signal of de-escalation - The Washington Post","<ol><li>Pentagon disarms guardsmen in Washington, D.C., in signal of de-escalation  The Washington Post
</li><li>Two National Guard members injured by lightning strike in D.C. storm  Daily Mail
</li><li>View Full Coverage on Google News</li></ol>",https://www.washingtonpost.com/national-security/pentagon-disarms-guardsmen-in-washington-dc-in-signal-of-de-escalation/2020/06/05/324da91a-a733-11ea-8681-7d471bf20207_story.html,https://www.washingtonpost.com/wp-apps/imrs.php?src=https://arc-anglerfish-washpost-prod-washpost.s3.amazonaws.com/public/6YYEFZFHLII6VB2FJ7RXSHTV5U.jpg&w=1440,2020-06-05T19:04:24Z,"The Defense Department, led by Defense Secretary Mark T. Esper, appears to have made the decision without consulting the White House, where President Trump has ordered a militarized show of force on … [+7907 chars]",the-washington-post,The Washington Post
MarÍa Verza | AP,3 Mexican police officers arrested for alleged beating death,"Authorities in western Mexico arrested three police officers, including the commissioner, and took over their local police department Friday in connection with the alleged beating death of a man in police custody",https://www.washingtonpost.com/world/the_americas/3-mexican-police-officers-arrested-for-alleged-beating-death/2020/06/05/343649ea-a75f-11ea-898e-b21b9a83f792_story.html,https://www.washingtonpost.com/wp-apps/imrs.php?src=&w=1440,2020-06-05T19:03:14Z,"Jalisco Gov. Enrique Alfaro called the killing an atrocity and promised to clear up the case, but also asserted that the sudden backlash was politically motivated.
A video circulated on social media… [+3111 chars]",the-washington-post,The Washington Post
Samantha Schmidt,Teens have been gassed and hit with rubber bullets at protests. They keep coming back. - The Washington Post,"<ol><li>Teens have been gassed and hit with rubber bullets at protests. They keep coming back.  The Washington Post
</li><li>Barr defends use of force at Monday's White House protest  CNN
</li><li>At fortified White House, Trump under verbal assault from mi…",https://www.washingtonpost.com/dc-md-va/2020/06/05/teens-protests-george-floyd-tear-gas/,https://www.washingtonpost.com/wp-apps/imrs.php?src=https://arc-anglerfish-washpost-prod-washpost.s3.amazonaws.com/public/I3A77KFF7YI6VCMOWINZVA7XSI.jpg&w=1440,2020-06-05T18:58:31Z,"We are the face of this movement, she shouted to the crowd. We are the face of this generation. We will not let this stand. Enough is enough.
Hours later, Aly coughed and wheezed in a cloud of chemi… [+7091 chars]",the-washington-post,The Washington Post
Philip Bump,A reverse fact-check from Trump and his supporters about ‘tear gas’ falls apart,The reporters who were tear-gassed on Monday were right: they were tear-gassed.,https://www.washingtonpost.com/politics/2020/06/05/reverse-fact-check-trump-his-supporters-about-tear-gas-falls-apart/,https://www.washingtonpost.com/wp-apps/imrs.php?src=https://arc-anglerfish-washpost-prod-washpost.s3.amazonaws.com/public/MBEWLVZXBJCBVASY5JCSLYO2U4&w=1440,2020-06-05T18:45:07Z,"There are two ways in which the Trump administration objected to this presentation of what happened. The first was to argue that somehow Barr's instructions were unrelated to Trump's walk, an argumen… [+7131 chars]",the-washington-post,The Washington Post
Steven Mufson,"Citing an economic ‘emergency,’ Trump directs agencies across government to waive federal regulations","New executive orders affect transportation, environment, financial institutions, health agencies and more",https://www.washingtonpost.com/climate-environment/citing-an-economic-emergency-trump-directs-agencies-across-government-to-waive-federal-regulations/2020/06/05/6a23546c-a0fc-11ea-b5c9-570a91917d8d_story.html,https://www.washingtonpost.com/wp-apps/imrs.php?src=https://arc-anglerfish-washpost-prod-washpost.s3.amazonaws.com/public/PNHSZZE2EAI6VLLZ5334242GIE.jpg&w=1440,2020-06-05T18:45:00Z,"President Trump formalized this strategy two weeks ago when he signed an executive order instructing agencies across the government to rescind, modify or simply stop enforcing regulations if they bur… [+11658 chars]",the-washington-post,The Washington Post
"Chico Harlan, Loveday Morris, Michael Birnbaum, Stefano Pitrelli",Coronavirus infections haven't spiked since Europe loosened lockdowns. There are many theories about why.,"Europe's experience so far suggests that reopening schools, shops and restaurants and even permitting large protests does not lead to an inevitable resurgence.",https://www.washingtonpost.com/world/2020/06/05/coronavirus-infections-havent-spiked-since-europe-loosened-lockdowns-there-are-many-theories-about-why/,https://www.washingtonpost.com/wp-apps/imrs.php?src=https://arc-anglerfish-washpost-prod-washpost.s3.amazonaws.com/public/FDANPEE5CYI6VLLZ5334242GIE.jpg&w=1440,2020-06-05T18:42:41Z,"But that is not what has happened.
In Italy and across most of Europe, countries have restarted their economies and resumed a degree of socializing without visible signs of the dire health consequen… [+10510 chars]",the-washington-post,The Washington Post
Nicole Winfield | AP,"US cardinal at Vatican prays for Floyd, and America's future","The highest-ranking American cardinal at the Vatican is deploring the ""unjust"" killing of George Floyd",https://www.washingtonpost.com/world/the_americas/us-cardinal-at-vatican-prays-for-floyd-and-americas-future/2020/06/05/5aece408-a75b-11ea-898e-b21b9a83f792_story.html,https://www.washingtonpost.com/wp-apps/imrs.php?src=&w=1440,2020-06-05T18:35:40Z,"We would never think that that could possibly happen, Farrell said. They are trained individuals who knew that in that position, that person was not going to survive.
Now, what brings a person to th… [+1418 chars]",the-washington-post,The Washington Post
Jennifer Hassan,"In Britain, protests over the death of George Floyd revive memories of others killed by police","""Who killed Mark Duggan? The police killed Mark Duggan,"" demonstrators chanted at a protest in London over the weekend.",https://www.washingtonpost.com/world/2020/06/05/britain-protests-over-death-george-floyd-revive-memories-others-killed-by-police/,https://www.washingtonpost.com/wp-apps/imrs.php?src=https://arc-anglerfish-washpost-prod-washpost.s3.amazonaws.com/public/FF26RLFFSQI6VCMOWINZVA7XSI.jpg&w=1440,2020-06-05T18:24:50Z,"Who killed Mark Duggan? The police killed Mark Duggan, demonstrators chanted at a protest in London over the weekend.
Duggan was 29-year-old black man who was shot dead by an unidentified Metropolit… [+3624 chars]",the-washington-post,The Washington Post
Munir Ahmed | AP,Pakistani activists: Lawmaker inciting against journalist,"A Pakistani human rights group and several senior journalists are lambasting a lawmaker from the ruling party, saying he has been inciting to violence against a local TV station's news presenter",https://www.washingtonpost.com/world/asia_pacific/pakistani-activists-lawmaker-inciting-against-journalist/2020/06/05/cc8545e6-a757-11ea-898e-b21b9a83f792_story.html,https://www.washingtonpost.com/wp-apps/imrs.php?src=&w=1440,2020-06-05T18:10:13Z,"The statement accuses Chuhan of endangering the life of Mir and his family. Mir, known for his criticism of corrupt officials, has been targeted in militant attacks the past.
In the statement, Harri… [+1594 chars]",the-washington-post,The Washington Post
Associated Press,"Cristobal regains tropical storm force, on a track for U.S. Gulf Coast","Cristobal regains tropical storm force, on a track for U.S. Gulf Coast",https://www.washingtonpost.com/world/cristobal-regains-tropical-storm-force-on-a-track-for-us-gulf-coast/2020/06/05/5ddf4a92-a757-11ea-898e-b21b9a83f792_story.html,https://www.washingtonpost.com/wp-apps/imrs.php?src=&w=1440,2020-06-05T18:07:07Z,"MEXICO CITY Cristobal regains tropical storm force, on a track for U.S. Gulf Coast.
Copyright 2020 The Associated Press. All rights reserved. This material may not be published, broadcast, rewritten… [+36 chars]",the-washington-post,The Washington Post
Edith M. Lederer | AP,US shares proposal to extend Iran arms embargo with Russia,U.S. Ambassador Kelly Craft says she has shared a draft U.N. Security Council resolution with Russia that would extend the arms embargo against Iran indefinitely,https://www.washingtonpost.com/world/europe/us-shares-proposal-to-extend-iran-arms-embargo-with-russia/2020/06/05/4114ade8-a776-11ea-898e-b21b9a83f792_story.html,https://www.washingtonpost.com/wp-apps/imrs.php?src=&w=1440,2020-06-05T21:48:14Z,"Craft told a press briefing that she also shared the draft with the United Kingdom, France, Germany and Estonia and hopes to give the draft to the rest of the 15-member Security Council pretty soon.… [+2693 chars]",the-washington-post,The Washington Post
Harmen Boerboom | AP,Suriname finally issues vote results showing opposition win,Suriname's electoral authorities have finally announced preliminary results from the May 25 elections won by opposition parties,https://www.washingtonpost.com/world/the_americas/suriname-finally-issues-vote-results-showing-opposition-win/2020/06/05/8dd5bfd8-a775-11ea-898e-b21b9a83f792_story.html,https://www.washingtonpost.com/wp-apps/imrs.php?src=&w=1440,2020-06-05T21:43:13Z,"Four opposition parties have formed a coalition to elect the next president in August, though they remain one vote short of the 34 needed for a two-thirds majority in the National Assembly, which is … [+1954 chars]",the-washington-post,The Washington Post
"Adam Wren, Kim Bellware",Four Indianapolis officers taken off patrol after video shows two of them striking woman with batons during arrest - Washington Post,Four Indianapolis officers taken off patrol after video shows two of them striking woman with batons during arrest  Washington PostView Full Coverage on Google News,https://www.washingtonpost.com/nation/2020/06/05/indianapolis-police-arrest/,https://www.washingtonpost.com/wp-apps/imrs.php?src=https://d1i4t8bqe7zgj6.cloudfront.net/06-05-2020/t_18ff5191a85f4192a9e81c6be43c1df3_name_2___1920x1080___24p_00_00_22_04_Still001.jpg&w=1440,2020-06-05T21:39:00Z,"I dont think theres anyone that should be able to watch that video and not be moved to emotion, Hogsett said. Anytime that our officers deploy force against anyone, that moment is a reminder of the w… [+2184 chars]",the-washington-post,The Washington Post
Carol D. Leonnig,Park Police spokesman acknowledges chemical agents used on Lafayette Square protesters are similar to tear gas,"A spokesman told Vox that it was “a mistake” to deny that the agency employed tear gas. Hours later, the acting chief reiterated his statement that Park Police officers did not use tear gas.",https://www.washingtonpost.com/politics/park-police-spokesman-acknowledges-chemical-agents-used-on-lafayette-square-protesters-are-similar-to-tear-gas/2020/06/05/971a8d78-a75a-11ea-b473-04905b1af82b_story.html,https://www.washingtonpost.com/wp-apps/imrs.php?src=https://arc-anglerfish-washpost-prod-washpost.s3.amazonaws.com/public/6C4VLPFE34I6VNDTASIFWGXYFM.jpg&w=1440,2020-06-05T21:18:56Z,"The point is, we admitted to using what we used, Sgt. Eduardo Delgado, the spokesman, told Vox. I think the term tear gas doesnt even matter anymore. It was a mistake on our part for using tear gas b… [+5467 chars]",the-washington-post,The Washington Post
Darryl Fears,Trump lifts limits on commercial fishing at ocean sanctuary off New England,,https://www.washingtonpost.com/climate-environment/2020/06/05/trump-fishing-seamounts-marine-national-monument/,https://www.washingtonpost.com/wp-apps/imrs.php?src=https://arc-anglerfish-washpost-prod-washpost.s3.amazonaws.com/public/HL7CNFFHNEI6VCMOWINZVA7XSI.jpg&w=1440,2020-06-05T21:18:01Z,"A coalition of fishing groups sought unsuccessfully to overturn the monument designation in federal court. They lost in both federal district court and in the D.C. Circuit Court of Appeals, and said … [+5797 chars]",the-washington-post,The Washington Post
Baba Ahmed | AP,French forces kill al-Qaida's North African commander,"France’s defense minister says the French military and allied forces in Mali have killed the longtime leader of al-Qaida’s North African arm, in what would be a major victory for France after years of battling jihadists in the Sahel",https://www.washingtonpost.com/world/europe/french-forces-kill-al-qaidas-north-african-commander/2020/06/05/a8022c74-a771-11ea-898e-b21b9a83f792_story.html,https://www.washingtonpost.com/wp-apps/imrs.php?src=&w=1440,2020-06-05T21:15:19Z,French Defense Minister Florence Parly tweeted that Droukdel and several of his allies were killed Wednesday in northern Mali by French forces and their partners. It was not immediately clear how his… [+1633 chars],the-washington-post,The Washington Post
"Dan Morse, Dana Hedgpeth","Police have a ‘strong suspect’ in case of bicyclist accused of assaulting teens posting fliers on a Montgomery County trail, official says - The Washington Post","<ol><li>Police have a ‘strong suspect’ in case of bicyclist accused of assaulting teens posting fliers on a Montgomery County trail, official says  The Washington Post
</li><li>Police searching for cyclist who was filmed accosting people posting signs suppor…",https://www.washingtonpost.com/local/public-safety/police-have-a-strong-suspect-in-case-of-bicyclist-accused-of-assaulting-teens-posting-fliers-on-a-montgomery-county-trail-official-says/2020/06/05/1cc57c0c-a752-11ea-b619-3f9133bbb482_story.html,https://www.washingtonpost.com/wp-apps/imrs.php?src=https://arc-anglerfish-washpost-prod-washpost.s3.amazonaws.com/public/EIVHPOVHOAI6VB2FJ7RXSHTV5U.jpg&w=1440,2020-06-05T21:13:49Z,"The incident unfolded around 1 p.m. on Monday. The teenagers video, which has gone viral over the last two days, shows an unknown man in bike-riding garb pulling tape off the teens arm. The man appea… [+4180 chars]",the-washington-post,The Washington Post
Associated Press,French military says it killed commander of al-Qaida's North Africa branch in long-awaited victory,French military says it killed commander of al-Qaida's North Africa branch in long-awaited victory,https://www.washingtonpost.com/world/africa/french-military-says-it-killed-commander-of-al-qaidas-north-africa-branch-in-long-awaited-victory/2020/06/05/5c6eb96c-a771-11ea-898e-b21b9a83f792_story.html,https://www.washingtonpost.com/wp-apps/imrs.php?src=&w=1440,2020-06-05T21:13:12Z,"PARIS French military says it killed commander of al-Qaidas North Africa branch in long-awaited victory.
Copyright 2020 The Associated Press. All rights reserved. This material may not be published,… [+57 chars]",the-washington-post,The Washington Post
Paul Waldman,Happy Hour Roundup,Our nightly wrap-up of news and opinion.,https://www.washingtonpost.com/opinions/2020/06/05/happy-hour-roundup/,https://www.washingtonpost.com/wp-apps/imrs.php?src=https://arc-anglerfish-washpost-prod-washpost.s3.amazonaws.com/public/MFNGF3VHL4I6VCMOWINZVA7XSI.jpg&w=1440,2020-06-05T21:10:52Z,,the-washington-post,The Washington Post
Ian Livingston,PM Update: Slow-moving storms drop some heavy rain into evening,"A cold front passes Saturday, bringing a new weather regime into the area for a while.",https://www.washingtonpost.com/weather/2020/06/05/pm-update-slow-moving-storms-drop-some-heavy-rain-into-evening/,https://www.washingtonpost.com/resizer/2CjPNwqvXHPS_2RpuRTKY-p3eVo=/1484x0/www.washingtonpost.com/pb/resources/img/twp-social-share.png,2020-06-05T20:59:22Z,"Radar courtesy MyRadar | © OpenStreetMap contributors
* Flash flood watch until midnight *
It seems were falling into that summer pattern of the daily storm chances to go along with high humidity a… [+1631 chars]",the-washington-post,The Washington Post
Robert Burns and Lolita C. Baldor | AP,"More active-duty troops leaving D.C., others remain on alert",U.S. Army Secretary Ryan McCarthy and other officials say that nearly 500 more of the active-duty troops brought in to help if needed with the civil unrest in the nation's capitol have been given orders to leave Washington,https://www.washingtonpost.com/world/national-security/more-active-duty-troops-leaving-dc-others-remain-on-alert/2020/06/05/09a973c2-a76f-11ea-898e-b21b9a83f792_story.html,https://www.washingtonpost.com/wp-apps/imrs.php?src=&w=1440,2020-06-05T20:56:34Z,"The decision to send the troops home comes as D.C. Mayor Muriel Bowser has repeatedly complained about the growing contingent of National Guard troops in the city to help handle the protests,and has … [+2442 chars]",the-washington-post,The Washington Post
Nicole Winfield | AP,Vatican arrests businessman in shady London real estate deal,"Vatican police have arrested an Italian businessman involved in a controversial London real estate deal on suspicion of extortion, fraud and money laundering",https://www.washingtonpost.com/world/vatican-arrests-businessman-in-shady-london-real-estate-deal/2020/06/05/f0ba8e30-a76b-11ea-898e-b21b9a83f792_story.html,https://www.washingtonpost.com/wp-apps/imrs.php?src=&w=1440,2020-06-05T20:34:24Z,"Its the first arrest in a nearly yearlong investigation into the deal, which has convulsed the Vatican, raised questions about Pope Francis seven-year financial reform effort and exposed Machiavellia… [+2284 chars]",the-washington-post,The Washington Post
Annie Linskey,Biden denounces Trump comment at jobs event that George Floyd would be “happy” today,The former vice president said Trump’s ‘crowing’ at better unemployment numbers disturbed him.,https://www.washingtonpost.com/politics/biden-denounces-trumps-comment-at-jobs-event-that-george-floyd-would-be-happy-today/2020/06/05/e043fbe6-a747-11ea-b473-04905b1af82b_story.html,https://www.washingtonpost.com/wp-apps/imrs.php?src=https://arc-anglerfish-washpost-prod-washpost.s3.amazonaws.com/public/YOLFOUFHNII6VB2FJ7RXSHTV5U.jpg&w=1440,2020-06-05T20:16:32Z,"Biden was referring to remarks made earlier in the day when Trump suggested that new Labor Department statistics showing a slight improvement in employment marked a great day for Floyd, whose memoria… [+4075 chars]",the-washington-post,The Washington Post
Philip Bump,A third of Trump’s support in 2016 came from evangelicals — and he hasn’t lost them yet,"Trump might want to start worrying about Catholic enthusiasm, though.",https://www.washingtonpost.com/politics/2020/06/05/third-trumps-support-2016-came-evangelicals-and-he-hasnt-lost-them-yet/,https://www.washingtonpost.com/wp-apps/imrs.php?src=https://arc-anglerfish-washpost-prod-washpost.s3.amazonaws.com/public/ZPLRB2VETYI6VCMOWINZVA7XSI.jpg&w=1440,2020-06-05T20:15:21Z,"By the way, he continued, if the other side and I call them the radical left because, [former vice president Joe] Biden has gone way left but he doesnt know where he is. But hes surrounded by people … [+4100 chars]",the-washington-post,The Washington Post
