author,title,description,url,urlToImage,publishedAt,content,source.id,source.name
Helena Andrews-dyer,"Fallon, Meyers, Conan use late-night shows to talk George Floyd and Black Lives Matter",Late-night hosts such as Jimmy Fallon and Conan O'Brien ditched the celebrity chitchat for real conversations about racism and police brutality.,https://www.washingtonpost.com/arts-entertainment/2020/06/05/late-night-shows-george-floyd-protests/,https://www.washingtonpost.com/wp-apps/imrs.php?src=https://arc-anglerfish-washpost-prod-washpost.s3.amazonaws.com/public/U5OZXNVG2QI6VOZA5PYJEHZ3XU.png&w=1440,2020-06-05T12:44:10Z,"This week, big-name hosts Jimmy Fallon, Jimmy Kimmel, Conan OBrien, Seth Meyers, Stephen Colbert and James Corden ditched the celebrity schmoozing for serious conversations about white privilege and … [+4171 chars]",the-washington-post,The Washington Post
"Munir Ahmed, AP",Pakistani couple suspected of killing 8-year-old maid,"Police say they have arrested a Pakistani businessman and his wife who are suspected of beating to death their 8-year-old maid after she inadvertently opened a cage to feed the couple's parrots and the birds flew away,",https://www.washingtonpost.com/world/asia_pacific/pakistani-couple-suspected-of-killing-8-year-old-maid/2020/06/05/b1519028-a729-11ea-898e-b21b9a83f792_story.html,https://www.washingtonpost.com/resizer/2CjPNwqvXHPS_2RpuRTKY-p3eVo=/1484x0/www.washingtonpost.com/pb/resources/img/twp-social-share.png,2020-06-05T12:40:10Z,ISLAMABAD Police arrested a Pakistani businessman and his wife who are suspected of beating to death their 8-year-old maid after she inadvertently opened a cage to feed the couples parrots and the bi… [+2099 chars],the-washington-post,The Washington Post
"Gerry Shih, The Washington Post",Soccer superstar stuns China with call for ouster of Communist Party...,"Chinese sports stars usually express thanks and offer platitudes about their government - if they address politics and power at all. 
 Not Hao Haidong. 
 The retired soccer forward, the Chinese national team's all-time top goal scorer and an idol in the 1990s…",http://www.washingtonpost.com/world/asia_pacific/chinese-soccer-superstar-hao-haidong-calls-for-ouster-of-communist-party-stunning-nation/2020/06/05/9ae91df2-a6ec-11ea-898e-b21b9a83f792_story.html,https://www.thehour.com/img/pages/article/opengraph_default.jpg,2020-06-05T12:22:38Z,"Chinese sports stars usually express thanks and offer platitudes about their government - if they address politics and power at all.
Not Hao Haidong.
The retired soccer forward, the Chinese nationa… [+4281 chars]",the-washington-post,The Washington Post
Eloge Willy Kaneza | AP,Burundi appeals court upholds journalists' prison sentence,An appeals court in Burundi has upheld the two-and-a-half-year prison sentence for four journalists convicted on charges of trying to undermine state security,https://www.washingtonpost.com/world/africa/burundi-appeals-court-upholds-journalists-prison-sentence/2020/06/05/a09c982a-a726-11ea-898e-b21b9a83f792_story.html,https://www.washingtonpost.com/wp-apps/imrs.php?src=&w=1440,2020-06-05T12:18:14Z,"The four were arrested in October in Musigati district in the western province while covering the aftermath of clashes between the army and a rebel group from South Kivu in neighboring Congo.
Presid… [+1119 chars]",the-washington-post,The Washington Post
Lorne Cook and Karel Janicek | AP,EU hopes to free borders of virus restrictions by end June,EU Home Affairs Commissioner Ylva Johansson says she believes that Europe's free travel area will be back up and running by the end of the month,https://www.washingtonpost.com/world/europe/eu-hopes-to-free-borders-of-virus-restrictions-by-end-june/2020/06/05/0efb6cb6-a726-11ea-898e-b21b9a83f792_story.html,https://www.washingtonpost.com/wp-apps/imrs.php?src=&w=1440,2020-06-05T12:14:10Z,"Free movement is a jewel in Europes crown which helps business flourish, and many European officials feared that the very future of the Schengen area was at threat from the restrictions. These added … [+1492 chars]",the-washington-post,The Washington Post
Christine Spolar,"While covid lockdowns keep others at home, these Londoners are swinging through the trees",Two tree surgeons say they have the perfect job for the coronavirus era.,https://www.washingtonpost.com/world/2020/06/05/while-covid-lockdowns-keep-others-home-these-londoners-are-swinging-through-trees/,https://www.washingtonpost.com/resizer/XZyoMkEkdnv0jSQYeqgvrZp_VvE=/1484x0/arc-anglerfish-washpost-prod-washpost.s3.amazonaws.com/public/S3J7ABFEHAI6VCMOWINZVA7XSI.jpg,2020-06-05T12:01:42Z,"LONDON They call themselves tree surgeons. But swinging from branch to branch and taking turns slicing through trails of dead wood at neck-craning heights, Adam Rendell and Sam Davis look more like u… [+5803 chars]",the-washington-post,The Washington Post
Dino Grandoni,The Energy 202: How carbon levels hit a record high even as emissions fell during coronavirus pandemic,It’s evidence of how hard it is to tackle climate change.,https://www.washingtonpost.com/news/powerpost/paloma/the-energy-202/2020/06/05/the-energy-202-how-carbon-levels-hit-a-record-high-even-as-emissions-fell-during-coronavirus-pandemic/5ed91ba688e0fa32f82327d2/,https://www.washingtonpost.com/pbox.php?url=https://palomaimages.washingtonpost.com/pr2/2bcbb450a6de8a59ff6e563eef1fcba2-NCPEDBFGUUI6VCMOWINZVA7XSI-680-453-70-8.jpg&w=1484&op=resize&opt=1&filter=antialias&t=20170517,2020-06-05T12:01:38Z,,the-washington-post,The Washington Post
Aaron Blake,"The 11 most logical picks for Joe Biden’s vice president, ranked",Our latest look at the most logical picks for Joe Biden's running mate.,https://www.washingtonpost.com/politics/2020/06/05/11-logical-picks-joe-bidens-vice-president-ranked/,https://www.washingtonpost.com/wp-apps/imrs.php?src=https://arc-anglerfish-washpost-prod-washpost.s3.amazonaws.com/public/U5EDMSVC44I6VPQGV5KRJ3QDQU.jpg&w=1440,2020-06-05T12:00:07Z,"Below is my latest ranking of the 11 candidates who make the most sense for the ticket at this moment. (Heres my last list.) All 12 are women, in keeping with Bidens pledge to pick a female running m… [+6342 chars]",the-washington-post,The Washington Post
Kim Tong-Hyung | AP,North Korea threatens to shut liaison office with South,North Korea is threatening to permanently abolish a liaison office with South Korea as it continues to condemn its rival for failing to prevent activists from sending anti-North Korean leaflets across the border,https://www.washingtonpost.com/world/asia_pacific/north-korea-threatens-to-shut-liaison-office-with-south/2020/06/05/63e6ac58-a745-11ea-898e-b21b9a83f792_story.html,https://www.washingtonpost.com/wp-apps/imrs.php?src=&w=1440,2020-06-05T15:58:27Z,"Kim Yo Jong also said North Korea could permanently shut the liaison office and a joint factory park in the border town of Kaesong, which have been symbols of reconciliation between the two countries… [+3503 chars]",the-washington-post,The Washington Post
The Washington Post,Iran's coronavirus cases surge again as strategic province becomes new epicenter,"Hard hit is Khuzestan, which has at times balked at central government control.",https://www.washingtonpost.com/world/middle_east/irans-coronavirus-cases-surge-again-as-strategic-province-becomes-new-epicenter/2020/06/05/6a5e4f9e-a021-11ea-be06-af5514ee0385_story.html,https://www.washingtonpost.com/wp-apps/imrs.php?src=https://arc-anglerfish-washpost-prod-washpost.s3.amazonaws.com/public/O2PXM2VHGQI6VNDTASIFWGXYFM.jpg&w=1440,2020-06-05T15:56:16Z,"While the epidemic was initially concentrated in the capital, Tehran, and the holy city of Qom, the new flare-up has largely been centered in Khuzestan province, an oil-rich region in Irans southwest… [+6693 chars]",the-washington-post,The Washington Post
Christine Armario | AP,Peru is running out of oxygen for COVID-19 patients,"One of the world's most abundant elements is in increasingly short supply in Peru, a center of the COVID-19 pandemic in Latin America",https://www.washingtonpost.com/world/the_americas/peru-is-running-out-of-oxygen-for-covid-19-patients/2020/06/05/f5abff3c-a743-11ea-898e-b21b9a83f792_story.html,https://www.washingtonpost.com/wp-apps/imrs.php?src=&w=1440,2020-06-05T15:48:12Z,"In the South American nation wracked by COVID-19, one of the worlds most abundant elements is now in short supply. Exasperated relatives are racing to fill overpriced tanks. Long neglected hospitals … [+5639 chars]",the-washington-post,The Washington Post
Jason Samenow,"Lightning in D.C. area struck Washington Monument, injured National Guardsmen in Lafayette Park Thursday night",The guardsmen's injuries were believed to be non-life-threatening.,https://www.washingtonpost.com/weather/2020/06/05/lightning-dc-area-struck-washington-monument-injured-national-guardsmen-lafayette-park-thursday-night/,https://www.washingtonpost.com/resizer/kgVARX_-JwP6O7KhDz4ylP83yrE=/1484x0/arc-anglerfish-washpost-prod-washpost.s3.amazonaws.com/public/2D5ZLJ42ABBKLGLHBGOKBWXWRE.png,2020-06-05T15:41:39Z,"Several rounds of intense thunderstorms charged through the D.C. area Thursday night into early Friday, unleashing frequent lightning that injured two National Guardsmen and struck the Washington Mon… [+5792 chars]",the-washington-post,The Washington Post
Eugene Scott,Does Trump understand why the protests are happening?,He seemed to in his early remarks on George Floyd. But he’s opted to talk about other things since then.,https://www.washingtonpost.com/politics/2020/06/05/does-trump-understand-why-protests-are-happening/,https://www.washingtonpost.com/wp-apps/imrs.php?src=https://d1i4t8bqe7zgj6.cloudfront.net/06-04-2020/t_74027105440f4bf7a486568f314c4f61_name_afce2614_a45c_11ea_898e_b21b9a83f792_scaled.jpg&w=1440,2020-06-05T15:40:54Z,"Days after demonstrators began filling the centers of cities in every to protest racial injustice and police brutality, Trump offered his most direct address to them. Heres what he said on Saturday, … [+7023 chars]",the-washington-post,The Washington Post
Philip Bump,The murkiness of claiming a popular mandate for a military crackdown on protests,Polling is scarce. The situation is blurry and evolving.,https://www.washingtonpost.com/politics/2020/06/05/murkiness-claiming-popular-mandate-military-crackdown-protests/,https://www.washingtonpost.com/wp-apps/imrs.php?src=https://arc-anglerfish-washpost-prod-washpost.s3.amazonaws.com/public/56SML3VG44I6VCMOWINZVA7XSI.jpg&w=1440,2020-06-05T15:33:43Z,"If local law enforcement is overwhelmed and needs backup, he wrote, lets see how tough these Antifa terrorists are when theyre facing off with the 101st Airborne Division. In the face of criticism, h… [+4158 chars]",the-washington-post,The Washington Post
"Fenit Nirappil, Rachel Chason","In giant yellow letters, D.C. mayor sends message to protesters, and to Trump - The Washington Post","<ol><li>In giant yellow letters, D.C. mayor sends message to protesters, and to Trump  The Washington Post
</li><li>GOP's Mike Lee blasts claim of DC plan to evict National Guard troops from city hotels  Fox News
</li><li>Why Washington’s Streets Have Fille…",https://www.washingtonpost.com/local/dc-politics/bowser-black-lives-matter-street/2020/06/05/eb44ff4a-a733-11ea-bb20-ebf0921f3bbd_story.html,https://www.washingtonpost.com/wp-apps/imrs.php?src=https://arc-anglerfish-washpost-prod-washpost.s3.amazonaws.com/public/O5R4BRFHHEI6VOZA5PYJEHZ3XU.jpg&w=1440,2020-06-05T15:32:06Z,"Live updates: The latest on protests in Washington
The art will take up two blocks on 16th Street, between K and H streets, affirming the cause of thousands who have demonstrated in the nations capi… [+4112 chars]",the-washington-post,The Washington Post
Associated Press,A death in Nicaraguan baseball puts pandemic in public eye,"The death of 58-year-old Nicaraguan baseball coach Carlos Aranda — himself the son of a former star of Nicaragua’s national team — shook Nicaragua, a place where baseball is the national pastime and the government has tried to obscure the novel coronavirus’ t…",https://www.washingtonpost.com/world/the_americas/a-death-in-nicaraguan-baseball-puts-pandemic-in-public-eye/2020/06/05/a39ec434-a740-11ea-898e-b21b9a83f792_story.html,https://www.washingtonpost.com/wp-apps/imrs.php?src=&w=1440,2020-06-05T15:24:26Z,"Then, during a May 16 game in the capital, Managua, manager Norman Cardoze Sr. and coach Carlos Aranda felt sick. Cardozes son Norman Jr., the teams star slugger, was so weak and achy he didnt play. … [+6035 chars]",the-washington-post,The Washington Post
Dake Kang | AP,Patten says China pursuing 'Orwellian' agenda in Hong Kong,"The last British governor of Hong Kong is criticizing the Chinese government over proposed national security legislation, saying it would violate the agreement on handing the territory over to Beijing",https://www.washingtonpost.com/world/asia_pacific/patten-says-china-pursuing-orwellian-agenda-in-hong-kong/2020/06/05/370fc1f2-a73f-11ea-898e-b21b9a83f792_story.html,https://www.washingtonpost.com/wp-apps/imrs.php?src=&w=1440,2020-06-05T15:14:14Z,The law is seen as potentially imposing severe restrictions on freedom of speech and opposition political activity in the former British colony that was handed over to Chinese rule in 1997. China has… [+2425 chars],the-washington-post,The Washington Post
Andrew Freedman,Earth just had its warmest May on record amid startling Siberian heat wave,New data from the Copernicus Climate Change Service shows that staggering heat anomalies in Siberia helped May set a new global temperature record.,https://www.washingtonpost.com/weather/2020/06/05/earth-just-had-its-warmest-may-record-amid-startling-siberian-heat-wave/,https://www.washingtonpost.com/resizer/MAOELqgNcKG3P7iAoUEaWPq6X64=/1484x0/arc-anglerfish-washpost-prod-washpost.s3.amazonaws.com/public/VURDPPXV5ZFABNJSHVDLOVXHHY.png,2020-06-05T15:00:39Z,"Astonishing warmth in Siberia helped propel global average surface temperatures to a record high during May, according to the Copernicus Climate Change Service, a science division of the European Uni… [+3933 chars]",the-washington-post,The Washington Post
Sudarsan Raghavan,Libyan pro-government forces seize last western stronghold of eastern warlord,"The capture of Tarhuna shattered Khalifa Hifter's ambitions to seize the capital, Tripoli, and rule Libya. Now, his forces are on the retreat as Libya enters an uncertain future.",https://www.washingtonpost.com/world/middle_east/libyan-pro-government-forces-seize-last-western-stronghold-of-eastern-warlord/2020/06/05/6585ba54-a727-11ea-bb20-ebf0921f3bbd_story.html,https://www.washingtonpost.com/wp-apps/imrs.php?src=https://arc-anglerfish-washpost-prod-washpost.s3.amazonaws.com/public/QT7MTOVHHQI6VOZA5PYJEHZ3XU.jpg&w=1440,2020-06-05T14:56:15Z,"Mohammed Gnounou, a military spokesman for the Tripoli government, said in a statement that its fighters entered the city from four directions and gave Hifters forces a lesson they will not forget. H… [+2478 chars]",the-washington-post,The Washington Post
Carol D. Leonnig,How Mattis reached his breaking point — and decided to speak out against Trump,"The former defense secretary feared top military leaders were being used as a prop for the president, according to people familiar with his thinking.",https://www.washingtonpost.com/politics/how-mattis-reached-his-breaking-point--and-decided-to-speak-out-against-trump/2020/06/05/6aafd548-a69e-11ea-bb20-ebf0921f3bbd_story.html,https://www.washingtonpost.com/wp-apps/imrs.php?src=https://arc-anglerfish-washpost-prod-washpost.s3.amazonaws.com/public/3YDCZTSPWUI6PN2OBUTYLUYIHU.jpg&w=1440,2020-06-05T14:48:00Z,"In Mattiss eyes, the appearance of the two top military leaders appeared to condone an unprovoked use of force. The nonpartisan military that Mattis had served for nearly five decades was being featu… [+10637 chars]",the-washington-post,The Washington Post
Tameem Akhgar | AP,US airstrikes hit Taliban; 10 Afghan police killed in ambush,"U.S. forces have carried out two sets of airstrikes against the Taliban, in western and southern Afghanistan",https://www.washingtonpost.com/world/asia_pacific/us-airstrikes-hit-taliban-10-afghan-police-killed-in-ambush/2020/06/05/552e4f0a-a73a-11ea-898e-b21b9a83f792_story.html,https://www.washingtonpost.com/wp-apps/imrs.php?src=&w=1440,2020-06-05T14:39:17Z,"A U.S. military spokesman, Col. Sonny Leggett, said one set of airstrikes took place on Friday afternoon in western Farah province, targeting 25 Taliban fighters who were attacking Afghan forces. Hou… [+1294 chars]",the-washington-post,The Washington Post
Greg Sargent,Trump and Tom Cotton are losing the argument. New polls confirm it.,Majorities simply refuse to see the protests as Trump and Senator Cotton want them to.,https://www.washingtonpost.com/opinions/2020/06/05/trump-tom-cotton-are-losing-argument-new-polls-confirm-it/,https://www.washingtonpost.com/wp-apps/imrs.php?src=https://arc-anglerfish-washpost-prod-washpost.s3.amazonaws.com/public/RTOKVPUL5QI6VCWBX6ZFBB3LPI.jpg&w=1440,2020-06-05T14:36:14Z,"They dont want you to see these events as they are largely a sign of people exercising their fundamental rights in our democracy, with mostly peaceful protests registering profound and legitimate abh… [+5214 chars]",the-washington-post,The Washington Post
Farai Mutsaka | AP,Scuffles and tear gas at Zimbabwe opposition headquarters,Zimbabwe police have fired tear gas and arrested several opposition leaders who gathered at their party's headquarters after it was forcibly occupied by a rival faction with the help of state security agents,https://www.washingtonpost.com/world/africa/scuffles-and-tear-gas-at-zimbabwe-opposition-headquarters/2020/06/05/3c08f210-a739-11ea-898e-b21b9a83f792_story.html,https://www.washingtonpost.com/wp-apps/imrs.php?src=&w=1440,2020-06-05T14:31:26Z,"Police were not immediately available for comment.
The MDC, Zimbabwes main opposition party, is fractured after a court ruled in March that Nelson Chamisa, who narrowly lost to President Emmerson Mn… [+1193 chars]",the-washington-post,The Washington Post
Aniruddha Ghosal | AP,New Delhi nurses protest as cracks show in Indian healthcare,Nurses at a top hospital in India's capital which treats coronavirus patients are threatening to stage a one-day walkout next week if working conditions don't improve,https://www.washingtonpost.com/world/asia_pacific/new-delhi-nurses-protest-as-cracks-show-in-indian-healthcare/2020/06/05/37e4f8a0-a739-11ea-898e-b21b9a83f792_story.html,https://www.washingtonpost.com/wp-apps/imrs.php?src=&w=1440,2020-06-05T14:31:19Z,"More than 350 medical workers at AIIMS and 150 family members have been infected by the virus since March, said Dr. D.K. Sharma, the hospitals medical superintendent. He said about 60% have recovered… [+2083 chars]",the-washington-post,The Washington Post
James Brooks | AP,Dissident Ai Wei Wei: Hong Kong anthem law almost 'medieval',"Chinese dissident artist Ai Weiwei has described as almost ""medieval"" a new law in Hong Kong that criminalizes disrespecting China's national anthem",https://www.washingtonpost.com/world/asia_pacific/dissident-ai-wei-wei-hong-kong-anthem-law-almost-medieval/2020/06/05/04cb177c-a736-11ea-898e-b21b9a83f792_story.html,https://www.washingtonpost.com/wp-apps/imrs.php?src=&w=1440,2020-06-05T14:08:24Z,"Its almost like a medieval law, Ai said Friday in an interview with the Associated Press in Cambridge, England. You know, you have to be brainwashed and then you have no chance to express your own fe… [+1747 chars]",the-washington-post,The Washington Post
Hau Chu,"On Facebook Live, an uneasy look at the past, present and future of go-go, an art form that has always spoken to the moment.","Writer Ta-Nehisi Coates talked about the significance of go-go, D.C. official music, on Facebook Live, followed by a virtual concert.",https://www.washingtonpost.com/dc-md-va/2020/06/05/facebook-live-an-uneasy-look-past-present-future-go-go-an-art-form-that-has-always-spoken-moment/,https://www.washingtonpost.com/wp-apps/imrs.php?src=https://arc-anglerfish-washpost-prod-washpost.s3.amazonaws.com/public/WJ6GEMX6YAI6TA2BZQ644UXH3Y.jpg&w=1440,2020-06-05T14:00:39Z,"Twenty years ago, Ta-Nehisi Coates then a budding journalist, today a MacArthur genius, cultural critic and public intellectual wrote a defining perspective for the Washington City Paper on what has … [+4728 chars]",the-washington-post,The Washington Post
Heather Long,Economists Predicted 20 Percent Employment In May. How Did They Get It So Wrong?,"Give some credit to the government relief efforts, especially ""PPP,"" the Paycheck Protection Program, for bringing back jobs in restaurants and stores sooner than expected.",https://www.washingtonpost.com/business/2020/06/05/unemployment-rate-wrong/,https://www.washingtonpost.com/wp-apps/imrs.php?src=https://arc-anglerfish-washpost-prod-washpost.s3.amazonaws.com/public/A7AHOYFHIAI6VCMOWINZVA7XSI.jpg&w=1440,2020-06-05T17:53:44Z,"What the heck happened?
In short, give some credit to the government relief efforts, especially the Paycheck Protection Program, for bringing back jobs. The program gave relief to small businesses (… [+6175 chars]",the-washington-post,The Washington Post
Baba Ahmed | AP,Thousands in Mali's capital demand that president step down,Thousands of people have demonstrated in Mali's capital to demand the resignation of President Ibrahim Boubacar Keita,https://www.washingtonpost.com/world/africa/thousands-in-malis-capital-demand-that-president-step-down/2020/06/05/a61a18e0-a753-11ea-898e-b21b9a83f792_story.html,https://www.washingtonpost.com/wp-apps/imrs.php?src=&w=1440,2020-06-05T17:40:30Z,Mali has been in turmoil since a 2012 uprising prompted mutinous soldiers to overthrow the president of a decade. The power vacuum that resulted led to an Islamic insurgency and a French-led interven… [+572 chars],the-washington-post,The Washington Post
Sarah Dadouch,Desperate Middle Eastern women resort to selling their gold as pandemic grinds on,Families feel shame and despair as economic distress leaves them little other way of making ends meet.,https://www.washingtonpost.com/world/middle_east/desperate-middle-eastern-women-resort-to-selling-their-gold-as-pandemic-grinds-on/2020/06/05/a9594f10-9f71-11ea-be06-af5514ee0385_story.html,https://www.washingtonpost.com/wp-apps/imrs.php?src=https://arc-anglerfish-washpost-prod-washpost.s3.amazonaws.com/public/36PL4YFFSQI6VCMOWINZVA7XSI.jpg&w=1440,2020-06-05T17:37:22Z,"Across much of the Middle East, women pushed to desperation by the economic pressures of the pandemic have been selling off their gold.
Strict public health measures, coming on top of a severe econo… [+7112 chars]",the-washington-post,The Washington Post
Jennifer Rubin,The cowardly president hides — again,No surprise: Trump's stunt is about ego and cowardice.,https://www.washingtonpost.com/opinions/2020/06/05/cowardly-president-hides-again/,https://www.washingtonpost.com/wp-apps/imrs.php?src=https://arc-anglerfish-washpost-prod-washpost.s3.amazonaws.com/public/3R2RDUFHEQI6VCMOWINZVA7XSI.jpg&w=1440,2020-06-05T17:09:35Z,"As I pointed out at the time, this is preposterous. Conventions take years of planning. The security, hotel and other logistical details take months upon months of sorting out. Moreover, what other s… [+3799 chars]",the-washington-post,The Washington Post
James Hohmann,The Daily 202: ‘We don’t need to overreact.’ Jeff Sessions says ‘politically correct policing’ will ‘demoralize’ officers.,"In an interview, the former attorney general supports Trump’s threat to invoke the Insurrection Act and defends Barr’s order to clear Lafayette Square.",https://www.washingtonpost.com/news/powerpost/paloma/daily-202/2020/06/05/daily-202-we-don-t-need-to-overreact-jeff-sessions-says-politically-correct-policing-will-demoralize-officers/5ed9d565602ff12947e8517a/,https://www.washingtonpost.com/pbox.php?url=https://palomaimages.washingtonpost.com/pr2/08a810e568cd0f00cd53bdb7a839534f-IDCV6Y3BEVHCFC7JK666IIKP7Y-680-453-70-8.jpg&w=1484&op=resize&opt=1&filter=antialias&t=20170517,2020-06-05T17:04:09Z,,the-washington-post,The Washington Post
Christopher Federico,"The Pop Group, ‘Forces of Oppression’: The Week In One Song",Force and threats of force in the wake of the George Floyd protests.,https://www.washingtonpost.com/politics/2020/06/05/pop-group-forces-oppression-week-one-song/,https://www.washingtonpost.com/wp-apps/imrs.php?src=https://arc-anglerfish-washpost-prod-washpost.s3.amazonaws.com/public/VDKF3QVGZ4I6VCMOWINZVA7XSI.jpg&w=1440,2020-06-05T17:00:53Z,"Receive the most important pandemic developments in your inbox every day. All stories linked in the newsletter are free to access.
By signing up you agree to ourTerms of UseandPrivacy Policy",the-washington-post,The Washington Post
Craig Timberg,"Masks don't just filter the air, they keep people away","To measure how people respond to masks, an Italian researcher created  the world’s first “social distancing belt:” a $30 contraption that looked like a grey handbag but measured the proximity of oncoming objects, or, in this case, people.",https://www.washingtonpost.com/technology/2020/06/05/masks-benefits-study-italy/,https://www.washingtonpost.com/wp-apps/imrs.php?src=https://arc-anglerfish-washpost-prod-washpost.s3.amazonaws.com/public/RC3CB6VHHII6VCMOWINZVA7XSI.jpg&w=1440,2020-06-05T16:58:13Z,The result suggested that masks help fight contagion in ways other than just filtering air benefits rarely discussed in the fraught political conversation about whether mask-wearing in public spaces … [+8858 chars],the-washington-post,The Washington Post
